TRAIN_3.9/logic/gemm/arcturus_Cijk_Alik_Bljk_HBH.yaml
- {MinimumRequiredVersion: 4.22.0}
- arcturus
- gfx908
- [Device 7380, Device 7388, Device 738c, Device 7390]
    SolutionIndex: 0
    SolutionNameMin: Cijk_Alik_Bljk_HBH_MT32x32x32_MI16x16x16x1_SE_1LDSB0_AF0EM8_GRVW2_GSU1_LBSPP128_PLR2_SU0_SUS256_SRVW4_TT1_16_VAW2_WG32_8_1_WGM1
    SolutionIndex: 1
    SolutionNameMin: Cijk_Alik_Bljk_HBH_MT64x32x32_MI16x16x16x1_SE_1LDSB0_AF0EM8_GRVW4_GSU1_LBSPP128_PLR2_SU0_SUS256_SRVW4_TT2_16_VAW2_WG32_8_1_WGM1
    SolutionIndex: 2
    SolutionNameMin: Cijk_Alik_Bljk_HBH_MT32x32x64_MI16x16x16x1_SE_1LDSB0_AF0EM8_GRVW4_GSU1_LBSPP128_PLR5_SU0_SUS256_SRVW4_TT1_16_VAW2_WG32_8_1_WGM1
    SolutionIndex: 3
    SolutionNameMin: Cijk_Alik_Bljk_HBH_MT64x32x32_MI16x16x16x1_SE_1LDSB0_AF0EM8_GRVW8_GSU1_LBSPP128_PLR2_SU0_SUS256_SRVW4_TT2_16_VAW2_WG32_8_1_WGM1
    SolutionIndex: 4
    SolutionNameMin: Cijk_Alik_Bljk_HBH_MT64x128x32_MI32x32x8x1_SE_1LDSB0_AF0EM8_GRVW8_GSU1_LBSPP128_PLR5_SU0_SUS256_SRVW4_TT1_64_VAW2_WG64_4_1_WGM1
    SolutionIndex: 5
    SolutionNameMin: Cijk_Alik_Bljk_HBH_MT32x32x64_MI16x16x16x1_SE_1LDSB0_AF0EM8_GRVW8_GSU1_LBSPP128_PLR5_SU0_SUS256_SRVW4_TT1_16_VAW2_WG32_8_1_WGM1
    SolutionIndex: 6
    SolutionNameMin: Cijk_Alik_Bljk_HBH_MT32x32x64_MI16x16x16x1_SE_1LDSB0_AF0EM8_GRVW4_GSU1_LBSPP128_PLR5_SU32_SUS128_SRVW4_TT1_16_VAW2_WG32_8_1_WGM1
    SolutionIndex: 7
    SolutionNameMin: Cijk_Alik_Bljk_HBH_MT32x32x64_MI16x16x16x1_SE_1LDSB0_AF0EM8_GRVW8_GSU1_LBSPP128_PLR5_SU32_SUS128_SRVW4_TT1_16_VAW2_WG32_8_1_WGM1
    SolutionIndex: 8
    SolutionNameMin: Cijk_Alik_Bljk_HBH_MT32x64x64_MI16x16x16x1_SE_1LDSB0_AF0EM8_GRVW8_GSU1_LBSPP128_PLR5_SU32_SUS128_SRVW4_TT1_32_VAW2_WG32_8_1_WGM1
    SolutionIndex: 9
    SolutionNameMin: Cijk_Alik_Bljk_HBH_MT128x96x64_MI32x32x8x1_SE_1LDSB0_AF0EM8_GRVW8_GSU1_LBSPP128_PLR9_SU32_SUS128_SRVW4_TT1_96_VAW2_WG128_2_1_WGM1
    SolutionIndex: 10
    SolutionNameMin: Cijk_Alik_Bljk_HBH_MT128x96x64_MI32x32x8x1_SE_1LDSB0_AF0EM8_GRVW2_GSU1_LBSPP128_PLR9_SU0_SUS256_SRVW4_TT1_96_VAW2_WG128_2_1_WGM2
    SolutionIndex: 11
    SolutionNameMin: Cijk_Alik_Bljk_HBH_MT32x32x64_MI16x16x16x1_SE_1LDSB0_AF0EM8_GRVW4_GSU1_LBSPP128_PLR5_SU0_SUS256_SRVW4_TT1_16_VAW2_WG32_8_1_WGM2
    SolutionIndex: 12
    SolutionNameMin: Cijk_Alik_Bljk_HBH_MT128x96x64_MI32x32x8x1_SE_1LDSB0_AF0EM8_GRVW8_GSU1_LBSPP128_PLR9_SU0_SUS256_SRVW4_TT1_96_VAW2_WG128_2_1_WGM2
    SolutionIndex: 13
    SolutionNameMin: Cijk_Alik_Bljk_HBH_MT128x96x64_MI32x32x8x1_SE_1LDSB0_AF0EM8_GRVW2_GSU1_LBSPP128_PLR9_SU32_SUS128_SRVW4_TT1_96_VAW2_WG128_2_1_WGM2
    SolutionIndex: 14
    SolutionNameMin: Cijk_Alik_Bljk_HBH_MT32x32x64_MI16x16x16x1_SE_1LDSB0_AF0EM8_GRVW4_GSU1_LBSPP128_PLR5_SU32_SUS128_SRVW4_TT1_16_VAW2_WG32_8_1_WGM2
    SolutionIndex: 15
    SolutionNameMin: Cijk_Alik_Bljk_HBH_MT32x32x64_MI16x16x16x1_SE_1LDSB0_AF0EM8_GRVW8_GSU1_LBSPP128_PLR5_SU32_SUS128_SRVW4_TT1_16_VAW2_WG32_8_1_WGM2
    SolutionIndex: 16
    SolutionNameMin: Cijk_Alik_Bljk_HBH_MT64x128x64_MI32x32x8x1_SE_1LDSB0_AF0EM8_GRVW8_GSU1_LBSPP128_PLR9_SU32_SUS128_SRVW4_TT1_64_VAW2_WG64_4_1_WGM2
    SolutionIndex: 17
    SolutionNameMin: Cijk_Alik_Bljk_HBH_MT64x128x64_MI32x32x8x1_SE_1LDSB0_AF0EM8_GRVW4_GSU1_LBSPP128_PLR9_SU32_SUS256_SRVW4_TT1_64_VAW2_WG64_4_1_WGM2
    SolutionIndex: 18
    SolutionNameMin: Cijk_Alik_Bljk_HBH_MT64x64x64_MI32x32x8x1_SE_1LDSB0_AF0EM8_GRVW2_GSU1_LBSPP128_PLR9_SU0_SUS256_SRVW4_TT1_32_VAW2_WG64_4_1_WGM15
    SolutionIndex: 19
    SolutionNameMin: Cijk_Alik_Bljk_HBH_MT64x128x64_MI32x32x8x1_SE_1LDSB0_AF0EM8_GRVW2_GSU1_LBSPP128_PLR9_SU0_SUS256_SRVW4_TT1_64_VAW2_WG64_4_1_WGM15
    SolutionIndex: 20
    SolutionNameMin: Cijk_Alik_Bljk_HBH_MT128x96x64_MI32x32x8x1_SE_1LDSB0_AF0EM8_GRVW2_GSU1_LBSPP128_PLR9_SU0_SUS256_SRVW4_TT1_96_VAW2_WG128_2_1_WGM15
    SolutionIndex: 21
    SolutionNameMin: Cijk_Alik_Bljk_HBH_MT128x64x32_MI32x32x8x1_SE_1LDSB0_AF0EM8_GRVW4_GSU1_LBSPP128_PLR5_SU0_SUS256_SRVW4_TT2_32_VAW2_WG64_4_1_WGM15
    SolutionIndex: 22
    SolutionNameMin: Cijk_Alik_Bljk_HBH_MT128x128x32_MI32x32x8x1_SE_1LDSB0_AF0EM8_GRVW8_GSU1_LBSPP128_PLR5_SU0_SUS256_SRVW4_TT2_64_VAW2_WG64_4_1_WGM15
    SolutionIndex: 23
    SolutionNameMin: Cijk_Alik_Bljk_HBH_MT32x32x64_MI16x16x16x1_SE_1LDSB0_AF0EM8_GRVW8_GSU1_LBSPP128_PLR5_SU0_SUS256_SRVW4_TT1_16_VAW2_WG32_8_1_WGM15
    SolutionIndex: 24
    SolutionNameMin: Cijk_Alik_Bljk_HBH_MT32x64x64_MI16x16x16x1_SE_1LDSB0_AF0EM8_GRVW8_GSU1_LBSPP128_PLR5_SU0_SUS256_SRVW4_TT1_32_VAW2_WG32_8_1_WGM15
    SolutionIndex: 25
    SolutionNameMin: Cijk_Alik_Bljk_HBH_MT64x32x64_MI16x16x16x1_SE_1LDSB0_AF0EM8_GRVW8_GSU1_LBSPP128_PLR5_SU0_SUS256_SRVW4_TT2_16_VAW2_WG32_8_1_WGM15
    SolutionIndex: 26
    SolutionNameMin: Cijk_Alik_Bljk_HBH_MT64x128x64_MI32x32x8x1_SE_1LDSB0_AF0EM8_GRVW8_GSU1_LBSPP128_PLR9_SU0_SUS256_SRVW4_TT1_64_VAW2_WG64_4_1_WGM15
    SolutionIndex: 27
    SolutionNameMin: Cijk_Alik_Bljk_HBH_MT64x128x64_MI32x32x8x1_SE_1LDSB0_AF0EM8_GRVW2_GSU1_LBSPP128_PLR9_SU32_SUS128_SRVW4_TT1_64_VAW2_WG64_4_1_WGM15
    SolutionIndex: 28
    SolutionNameMin: Cijk_Alik_Bljk_HBH_MT64x32x64_MI16x16x16x1_SE_1LDSB0_AF0EM8_GRVW8_GSU1_LBSPP128_PLR5_SU32_SUS128_SRVW4_TT2_16_VAW2_WG32_8_1_WGM15
    SolutionIndex: 29
    SolutionNameMin: Cijk_Alik_Bljk_HBH_MT128x96x64_MI32x32x8x1_SE_1LDSB0_AF0EM8_GRVW2_GSU1_LBSPP128_PLR9_SU32_SUS256_SRVW4_TT1_96_VAW2_WG128_2_1_WGM15
    SolutionIndex: 30
    SolutionNameMin: Cijk_Alik_Bljk_HBH_MT64x128x64_MI32x32x8x1_SE_1LDSB0_AF0EM8_GRVW4_GSU1_LBSPP128_PLR9_SU32_SUS256_SRVW4_TT1_64_VAW2_WG64_4_1_WGM15
    SolutionIndex: 31
    SolutionNameMin: Cijk_Alik_Bljk_HBH_MT128x64x64_MI32x32x8x1_SE_1LDSB0_AF0EM8_GRVW4_GSU1_LBSPP128_PLR9_SU32_SUS256_SRVW4_TT2_32_VAW2_WG64_4_1_WGM15
    SolutionIndex: 32
    SolutionNameMin: Cijk_Alik_Bljk_HBH_MT64x64x64_MI32x32x8x1_SE_1LDSB0_AF0EM8_GRVW8_GSU1_LBSPP128_PLR9_SU32_SUS256_SRVW4_TT1_32_VAW2_WG64_4_1_WGM15
    SolutionIndex: 33
    SolutionNameMin: Cijk_Alik_Bljk_HBH_MT128x96x64_MI32x32x8x1_SE_1LDSB0_AF0EM8_GRVW8_GSU1_LBSPP128_PLR9_SU32_SUS256_SRVW4_TT1_96_VAW2_WG128_2_1_WGM15
    SolutionIndex: 34
    SolutionNameMin: Cijk_Alik_Bljk_HBH_MT256x256x32_MI32x32x8x1_SE_1LDSB1_AF0EM8_GRVW2_GSU1_LBSPP128_PLR5_SU0_SUS256_SRVW4_TT4_128_VAW2_WG64_4_1_WGM1
    SolutionIndex: 35
    SolutionNameMin: Cijk_Alik_Bljk_HBH_MT160x160x64_MI16x16x16x1_SE_1LDSB1_AF0EM8_GRVW2_GSU1_LBSPP128_PLR5_SU0_SUS256_SRVW0_TT5_80_VAW2_WG32_8_1_WGM1
    SolutionIndex: 36
    SolutionNameMin: Cijk_Alik_Bljk_HBH_MT144x128x64_MI16x16x16x1_SE_1LDSB1_AF0EM8_GRVW2_GSU1_LBSPP128_PLR5_SU0_SUS256_SRVW0_TT9_32_VAW2_WG16_16_1_WGM1
    SolutionIndex: 37
    SolutionNameMin: Cijk_Alik_Bljk_HBH_MT64x64x64_MI32x32x8x1_SE_1LDSB1_AF0EM8_GRVW2_GSU1_LBSPP128_PLR9_SU0_SUS256_SRVW4_TT1_32_VAW2_WG64_4_1_WGM1
    SolutionIndex: 38
    SolutionNameMin: Cijk_Alik_Bljk_HBH_MT256x128x64_MI32x32x8x1_SE_1LDSB1_AF0EM8_GRVW2_GSU1_LBSPP128_PLR9_SU0_SUS256_SRVW4_TT4_64_VAW2_WG64_4_1_WGM1
    SolutionIndex: 39
    SolutionNameMin: Cijk_Alik_Bljk_HBH_MT256x160x64_MI32x32x8x1_SE_1LDSB1_AF0EM8_GRVW2_GSU1_LBSPP128_PLR9_SU0_SUS256_SRVW4_TT2_160_VAW2_WG128_2_1_WGM1
    SolutionIndex: 40
    SolutionNameMin: Cijk_Alik_Bljk_HBH_MT128x128x32_MI32x32x8x1_SE_1LDSB1_AF0EM8_GRVW4_GSU1_LBSPP128_PLR5_SU0_SUS256_SRVW4_TT2_64_VAW2_WG64_4_1_WGM1
    SolutionIndex: 41
    SolutionNameMin: Cijk_Alik_Bljk_HBH_MT128x96x32_MI32x32x8x1_SE_1LDSB1_AF0EM8_GRVW4_GSU1_LBSPP128_PLR5_SU0_SUS256_SRVW4_TT1_96_VAW2_WG128_2_1_WGM1
    SolutionIndex: 42
    SolutionNameMin: Cijk_Alik_Bljk_HBH_MT64x128x64_MI32x32x8x1_SE_1LDSB1_AF0EM8_GRVW4_GSU1_LBSPP128_PLR9_SU0_SUS256_SRVW4_TT1_64_VAW2_WG64_4_1_WGM1
    SolutionIndex: 43
    SolutionNameMin: Cijk_Alik_Bljk_HBH_MT128x96x64_MI32x32x8x1_SE_1LDSB1_AF0EM8_GRVW4_GSU1_LBSPP128_PLR9_SU0_SUS256_SRVW4_TT1_96_VAW2_WG128_2_1_WGM1
    SolutionIndex: 44
    SolutionNameMin: Cijk_Alik_Bljk_HBH_MT64x32x32_MI16x16x16x1_SE_1LDSB1_AF0EM8_GRVW8_GSU1_LBSPP128_PLR2_SU0_SUS256_SRVW4_TT2_16_VAW2_WG32_8_1_WGM1
    SolutionIndex: 45
    SolutionNameMin: Cijk_Alik_Bljk_HBH_MT64x64x32_MI32x32x8x1_SE_1LDSB1_AF0EM8_GRVW8_GSU1_LBSPP128_PLR5_SU0_SUS256_SRVW4_TT1_32_VAW2_WG64_4_1_WGM1
    SolutionIndex: 46
    SolutionNameMin: Cijk_Alik_Bljk_HBH_MT128x128x32_MI32x32x8x1_SE_1LDSB1_AF0EM8_GRVW8_GSU1_LBSPP128_PLR5_SU0_SUS256_SRVW4_TT2_64_VAW2_WG64_4_1_WGM1
    SolutionIndex: 47
    SolutionNameMin: Cijk_Alik_Bljk_HBH_MT128x256x32_MI32x32x8x1_SE_1LDSB1_AF0EM8_GRVW8_GSU1_LBSPP128_PLR5_SU0_SUS256_SRVW4_TT2_128_VAW2_WG64_4_1_WGM1
    SolutionIndex: 48
    SolutionNameMin: Cijk_Alik_Bljk_HBH_MT64x64x64_MI32x32x8x1_SE_1LDSB1_AF0EM8_GRVW8_GSU1_LBSPP128_PLR9_SU0_SUS256_SRVW4_TT1_32_VAW2_WG64_4_1_WGM1
    SolutionIndex: 49
    SolutionNameMin: Cijk_Alik_Bljk_HBH_MT64x128x64_MI32x32x8x1_SE_1LDSB1_AF0EM8_GRVW8_GSU1_LBSPP128_PLR9_SU0_SUS256_SRVW4_TT1_64_VAW2_WG64_4_1_WGM1
    SolutionIndex: 50
    SolutionNameMin: Cijk_Alik_Bljk_HBH_MT32x64x32_MI16x16x16x1_SE_1LDSB1_AF0EM8_GRVW4_GSU1_LBSPP128_PLR2_SU32_SUS128_SRVW4_TT1_32_VAW2_WG32_8_1_WGM1
    SolutionIndex: 51
    SolutionNameMin: Cijk_Alik_Bljk_HBH_MT64x32x32_MI16x16x16x1_SE_1LDSB1_AF0EM8_GRVW4_GSU1_LBSPP128_PLR2_SU32_SUS128_SRVW4_TT2_16_VAW2_WG32_8_1_WGM1
    SolutionIndex: 52
    SolutionNameMin: Cijk_Alik_Bljk_HBH_MT128x128x32_MI32x32x8x1_SE_1LDSB1_AF0EM8_GRVW4_GSU1_LBSPP128_PLR5_SU32_SUS128_SRVW4_TT2_64_VAW2_WG64_4_1_WGM1
    SolutionIndex: 53
    SolutionNameMin: Cijk_Alik_Bljk_HBH_MT128x288x64_MI32x32x8x1_SE_1LDSB1_AF0EM8_GRVW4_GSU1_LBSPP128_PLR9_SU32_SUS128_SRVW4_TT1_288_VAW2_WG128_2_1_WGM1
    SolutionIndex: 54
    SolutionNameMin: Cijk_Alik_Bljk_HBH_MT128x128x32_MI32x32x8x1_SE_1LDSB1_AF0EM8_GRVW8_GSU1_LBSPP128_PLR5_SU32_SUS128_SRVW4_TT2_64_VAW2_WG64_4_1_WGM1
    SolutionIndex: 55
    SolutionNameMin: Cijk_Alik_Bljk_HBH_MT64x64x64_MI32x32x8x1_SE_1LDSB1_AF0EM8_GRVW8_GSU1_LBSPP128_PLR9_SU32_SUS128_SRVW4_TT1_32_VAW2_WG64_4_1_WGM1
    SolutionIndex: 56
    SolutionNameMin: Cijk_Alik_Bljk_HBH_MT64x128x64_MI32x32x8x1_SE_1LDSB1_AF0EM8_GRVW8_GSU1_LBSPP128_PLR9_SU32_SUS128_SRVW4_TT1_64_VAW2_WG64_4_1_WGM1
    SolutionIndex: 57
    SolutionNameMin: Cijk_Alik_Bljk_HBH_MT128x128x64_MI32x32x8x1_SE_1LDSB1_AF0EM8_GRVW8_GSU1_LBSPP128_PLR9_SU32_SUS128_SRVW4_TT2_64_VAW2_WG64_4_1_WGM1
    SolutionIndex: 58
    SolutionNameMin: Cijk_Alik_Bljk_HBH_MT256x256x32_MI32x32x8x1_SE_1LDSB1_AF0EM8_GRVW2_GSU1_LBSPP128_PLR5_SU32_SUS256_SRVW4_TT4_128_VAW2_WG64_4_1_WGM1
    SolutionIndex: 59
    SolutionNameMin: Cijk_Alik_Bljk_HBH_MT144x256x64_MI16x16x16x1_SE_1LDSB1_AF0EM8_GRVW2_GSU1_LBSPP128_PLR5_SU32_SUS256_SRVW0_TT9_64_VAW2_WG16_16_1_WGM1
    SolutionIndex: 60
    SolutionNameMin: Cijk_Alik_Bljk_HBH_MT64x128x32_MI32x32x8x1_SE_1LDSB1_AF0EM8_GRVW8_GSU1_LBSPP128_PLR5_SU32_SUS256_SRVW4_TT1_64_VAW2_WG64_4_1_WGM1
    SolutionIndex: 61
    SolutionNameMin: Cijk_Alik_Bljk_HBH_MT128x128x32_MI32x32x8x1_SE_1LDSB1_AF0EM8_GRVW8_GSU1_LBSPP128_PLR5_SU32_SUS256_SRVW4_TT2_64_VAW2_WG64_4_1_WGM1
    SolutionIndex: 62
    SolutionNameMin: Cijk_Alik_Bljk_HBH_MT64x64x64_MI32x32x8x1_SE_1LDSB1_AF0EM8_GRVW8_GSU1_LBSPP128_PLR9_SU32_SUS256_SRVW4_TT1_32_VAW2_WG64_4_1_WGM1
    SolutionIndex: 63
    SolutionNameMin: Cijk_Alik_Bljk_HBH_MT64x128x64_MI32x32x8x1_SE_1LDSB1_AF0EM8_GRVW8_GSU1_LBSPP128_PLR9_SU32_SUS256_SRVW4_TT1_64_VAW2_WG64_4_1_WGM1
    SolutionIndex: 64
    SolutionNameMin: Cijk_Alik_Bljk_HBH_MT128x64x64_MI32x32x8x1_SE_1LDSB1_AF0EM8_GRVW8_GSU1_LBSPP128_PLR9_SU32_SUS256_SRVW4_TT2_32_VAW2_WG64_4_1_WGM1
    SolutionIndex: 65
    SolutionNameMin: Cijk_Alik_Bljk_HBH_MT128x128x64_MI32x32x8x1_SE_1LDSB1_AF0EM8_GRVW8_GSU1_LBSPP128_PLR9_SU32_SUS256_SRVW4_TT2_64_VAW2_WG64_4_1_WGM1
    SolutionIndex: 66
    SolutionNameMin: Cijk_Alik_Bljk_HBH_MT128x256x32_MI32x32x8x1_SE_1LDSB1_AF0EM8_GRVW2_GSU1_LBSPP128_PLR5_SU0_SUS256_SRVW4_TT2_128_VAW2_WG64_4_1_WGM2
    SolutionIndex: 67
    SolutionNameMin: Cijk_Alik_Bljk_HBH_MT256x256x32_MI32x32x8x1_SE_1LDSB1_AF0EM8_GRVW2_GSU1_LBSPP128_PLR5_SU0_SUS256_SRVW4_TT4_128_VAW2_WG64_4_1_WGM2
    SolutionIndex: 68
    SolutionNameMin: Cijk_Alik_Bljk_HBH_MT128x160x32_MI32x32x8x1_SE_1LDSB1_AF0EM8_GRVW2_GSU1_LBSPP128_PLR5_SU0_SUS256_SRVW4_TT1_160_VAW2_WG128_2_1_WGM2
    SolutionIndex: 69
    SolutionNameMin: Cijk_Alik_Bljk_HBH_MT160x160x64_MI16x16x16x1_SE_1LDSB1_AF0EM8_GRVW2_GSU1_LBSPP128_PLR5_SU0_SUS256_SRVW0_TT5_80_VAW2_WG32_8_1_WGM2
    SolutionIndex: 70
    SolutionNameMin: Cijk_Alik_Bljk_HBH_MT128x144x64_MI16x16x16x1_SE_1LDSB1_AF0EM8_GRVW2_GSU1_LBSPP128_PLR5_SU0_SUS256_SRVW4_TT2_144_VAW2_WG64_4_1_WGM2
    SolutionIndex: 71
    SolutionNameMin: Cijk_Alik_Bljk_HBH_MT64x64x64_MI32x32x8x1_SE_1LDSB1_AF0EM8_GRVW2_GSU1_LBSPP128_PLR9_SU0_SUS256_SRVW4_TT1_32_VAW2_WG64_4_1_WGM2
    SolutionIndex: 72
    SolutionNameMin: Cijk_Alik_Bljk_HBH_MT128x256x64_MI32x32x8x1_SE_1LDSB1_AF0EM8_GRVW2_GSU1_LBSPP128_PLR9_SU0_SUS256_SRVW4_TT2_128_VAW2_WG64_4_1_WGM2
    SolutionIndex: 73
    SolutionNameMin: Cijk_Alik_Bljk_HBH_MT256x160x64_MI32x32x8x1_SE_1LDSB1_AF0EM8_GRVW2_GSU1_LBSPP128_PLR9_SU0_SUS256_SRVW4_TT2_160_VAW2_WG128_2_1_WGM2
    SolutionIndex: 74
    SolutionNameMin: Cijk_Alik_Bljk_HBH_MT128x96x32_MI32x32x8x1_SE_1LDSB1_AF0EM8_GRVW4_GSU1_LBSPP128_PLR5_SU0_SUS256_SRVW4_TT1_96_VAW2_WG128_2_1_WGM2
    SolutionIndex: 75
    SolutionNameMin: Cijk_Alik_Bljk_HBH_MT128x288x32_MI32x32x8x1_SE_1LDSB1_AF0EM8_GRVW4_GSU1_LBSPP128_PLR5_SU0_SUS256_SRVW4_TT1_288_VAW2_WG128_2_1_WGM2
    SolutionIndex: 76
    SolutionNameMin: Cijk_Alik_Bljk_HBH_MT64x256x64_MI32x32x8x1_SE_1LDSB1_AF0EM8_GRVW4_GSU1_LBSPP128_PLR9_SU0_SUS256_SRVW4_TT1_128_VAW2_WG64_4_1_WGM2
    SolutionIndex: 77
    SolutionNameMin: Cijk_Alik_Bljk_HBH_MT128x128x64_MI32x32x8x1_SE_1LDSB1_AF0EM8_GRVW4_GSU1_LBSPP128_PLR9_SU0_SUS256_SRVW4_TT2_64_VAW2_WG64_4_1_WGM2
    SolutionIndex: 78
    SolutionNameMin: Cijk_Alik_Bljk_HBH_MT128x96x64_MI32x32x8x1_SE_1LDSB1_AF0EM8_GRVW4_GSU1_LBSPP128_PLR9_SU0_SUS256_SRVW4_TT1_96_VAW2_WG128_2_1_WGM2
    SolutionIndex: 79
    SolutionNameMin: Cijk_Alik_Bljk_HBH_MT128x256x32_MI32x32x8x1_SE_1LDSB1_AF0EM8_GRVW8_GSU1_LBSPP128_PLR5_SU0_SUS256_SRVW4_TT2_128_VAW2_WG64_4_1_WGM2
    SolutionIndex: 80
    SolutionNameMin: Cijk_Alik_Bljk_HBH_MT64x64x64_MI32x32x8x1_SE_1LDSB1_AF0EM8_GRVW8_GSU1_LBSPP128_PLR9_SU0_SUS256_SRVW4_TT1_32_VAW2_WG64_4_1_WGM2
    SolutionIndex: 81
    SolutionNameMin: Cijk_Alik_Bljk_HBH_MT64x128x64_MI32x32x8x1_SE_1LDSB1_AF0EM8_GRVW8_GSU1_LBSPP128_PLR9_SU0_SUS256_SRVW4_TT1_64_VAW2_WG64_4_1_WGM2
    SolutionIndex: 82
    SolutionNameMin: Cijk_Alik_Bljk_HBH_MT128x128x64_MI32x32x8x1_SE_1LDSB1_AF0EM8_GRVW8_GSU1_LBSPP128_PLR9_SU0_SUS256_SRVW4_TT2_64_VAW2_WG64_4_1_WGM2
    SolutionIndex: 83
    SolutionNameMin: Cijk_Alik_Bljk_HBH_MT128x96x64_MI32x32x8x1_SE_1LDSB1_AF0EM8_GRVW8_GSU1_LBSPP128_PLR9_SU0_SUS256_SRVW4_TT1_96_VAW2_WG128_2_1_WGM2
    SolutionIndex: 84
    SolutionNameMin: Cijk_Alik_Bljk_HBH_MT256x256x32_MI32x32x8x1_SE_1LDSB1_AF0EM8_GRVW2_GSU1_LBSPP128_PLR5_SU32_SUS128_SRVW4_TT4_128_VAW2_WG64_4_1_WGM2
    SolutionIndex: 85
    SolutionNameMin: Cijk_Alik_Bljk_HBH_MT256x144x64_MI16x16x16x1_SE_1LDSB1_AF0EM8_GRVW2_GSU1_LBSPP128_PLR5_SU32_SUS128_SRVW4_TT4_144_VAW2_WG64_4_1_WGM2
    SolutionIndex: 86
    SolutionNameMin: Cijk_Alik_Bljk_HBH_MT128x160x64_MI32x32x8x1_SE_1LDSB1_AF0EM8_GRVW2_GSU1_LBSPP128_PLR9_SU32_SUS128_SRVW4_TT1_160_VAW2_WG128_2_1_WGM2
    SolutionIndex: 87
    SolutionNameMin: Cijk_Alik_Bljk_HBH_MT256x160x64_MI32x32x8x1_SE_1LDSB1_AF0EM8_GRVW2_GSU1_LBSPP128_PLR9_SU32_SUS128_SRVW4_TT2_160_VAW2_WG128_2_1_WGM2
    SolutionIndex: 88
    SolutionNameMin: Cijk_Alik_Bljk_HBH_MT128x256x64_MI32x32x8x1_SE_1LDSB1_AF0EM8_GRVW4_GSU1_LBSPP128_PLR9_SU32_SUS128_SRVW4_TT2_128_VAW2_WG64_4_1_WGM2
    SolutionIndex: 89
    SolutionNameMin: Cijk_Alik_Bljk_HBH_MT128x288x64_MI32x32x8x1_SE_1LDSB1_AF0EM8_GRVW4_GSU1_LBSPP128_PLR9_SU32_SUS128_SRVW4_TT1_288_VAW2_WG128_2_1_WGM2
    SolutionIndex: 90
    SolutionNameMin: Cijk_Alik_Bljk_HBH_MT128x160x64_MI32x32x8x1_SE_1LDSB1_AF0EM8_GRVW4_GSU1_LBSPP128_PLR9_SU32_SUS128_SRVW4_TT1_160_VAW2_WG128_2_1_WGM2
    SolutionIndex: 91
    SolutionNameMin: Cijk_Alik_Bljk_HBH_MT128x128x32_MI32x32x8x1_SE_1LDSB1_AF0EM8_GRVW8_GSU1_LBSPP128_PLR5_SU32_SUS128_SRVW4_TT2_64_VAW2_WG64_4_1_WGM2
    SolutionIndex: 92
    SolutionNameMin: Cijk_Alik_Bljk_HBH_MT128x256x32_MI32x32x8x1_SE_1LDSB1_AF0EM8_GRVW8_GSU1_LBSPP128_PLR5_SU32_SUS128_SRVW4_TT2_128_VAW2_WG64_4_1_WGM2
    SolutionIndex: 93
    SolutionNameMin: Cijk_Alik_Bljk_HBH_MT64x64x64_MI32x32x8x1_SE_1LDSB1_AF0EM8_GRVW8_GSU1_LBSPP128_PLR9_SU32_SUS128_SRVW4_TT1_32_VAW2_WG64_4_1_WGM2
    SolutionIndex: 94
    SolutionNameMin: Cijk_Alik_Bljk_HBH_MT64x128x64_MI32x32x8x1_SE_1LDSB1_AF0EM8_GRVW8_GSU1_LBSPP128_PLR9_SU32_SUS128_SRVW4_TT1_64_VAW2_WG64_4_1_WGM2
    SolutionIndex: 95
    SolutionNameMin: Cijk_Alik_Bljk_HBH_MT128x128x64_MI32x32x8x1_SE_1LDSB1_AF0EM8_GRVW8_GSU1_LBSPP128_PLR9_SU32_SUS128_SRVW4_TT2_64_VAW2_WG64_4_1_WGM2
    SolutionIndex: 96
    SolutionNameMin: Cijk_Alik_Bljk_HBH_MT128x160x64_MI32x32x8x1_SE_1LDSB1_AF0EM8_GRVW8_GSU1_LBSPP128_PLR9_SU32_SUS128_SRVW4_TT1_160_VAW2_WG128_2_1_WGM2
    SolutionIndex: 97
    SolutionNameMin: Cijk_Alik_Bljk_HBH_MT256x256x32_MI32x32x8x1_SE_1LDSB1_AF0EM8_GRVW2_GSU1_LBSPP128_PLR5_SU32_SUS256_SRVW4_TT4_128_VAW2_WG64_4_1_WGM2
    SolutionIndex: 98
    SolutionNameMin: Cijk_Alik_Bljk_HBH_MT128x128x32_MI32x32x8x1_SE_1LDSB1_AF0EM8_GRVW8_GSU1_LBSPP128_PLR5_SU32_SUS256_SRVW4_TT2_64_VAW2_WG64_4_1_WGM2
    SolutionIndex: 99
    SolutionNameMin: Cijk_Alik_Bljk_HBH_MT128x256x32_MI32x32x8x1_SE_1LDSB1_AF0EM8_GRVW8_GSU1_LBSPP128_PLR5_SU32_SUS256_SRVW4_TT2_128_VAW2_WG64_4_1_WGM2
    SolutionIndex: 100
    SolutionNameMin: Cijk_Alik_Bljk_HBH_MT32x64x64_MI16x16x16x1_SE_1LDSB1_AF0EM8_GRVW8_GSU1_LBSPP128_PLR5_SU32_SUS256_SRVW4_TT1_32_VAW2_WG32_8_1_WGM2
    SolutionIndex: 101
    SolutionNameMin: Cijk_Alik_Bljk_HBH_MT64x64x64_MI32x32x8x1_SE_1LDSB1_AF0EM8_GRVW8_GSU1_LBSPP128_PLR9_SU32_SUS256_SRVW4_TT1_32_VAW2_WG64_4_1_WGM2
    SolutionIndex: 102
    SolutionNameMin: Cijk_Alik_Bljk_HBH_MT96x128x64_MI32x32x8x1_SE_1LDSB1_AF0EM8_GRVW8_GSU1_LBSPP128_PLR9_SU32_SUS256_SRVW0_TT3_32_VAW2_WG32_8_1_WGM2
    SolutionIndex: 103
    SolutionNameMin: Cijk_Alik_Bljk_HBH_MT32x32x32_MI16x16x16x1_SE_1LDSB1_AF0EM8_GRVW2_GSU1_LBSPP128_PLR2_SU0_SUS256_SRVW4_TT1_16_VAW2_WG32_8_1_WGM15
    SolutionIndex: 104
    SolutionNameMin: Cijk_Alik_Bljk_HBH_MT64x64x32_MI32x32x8x1_SE_1LDSB1_AF0EM8_GRVW2_GSU1_LBSPP128_PLR5_SU0_SUS256_SRVW4_TT1_32_VAW2_WG64_4_1_WGM15
    SolutionIndex: 105
    SolutionNameMin: Cijk_Alik_Bljk_HBH_MT128x128x32_MI32x32x8x1_SE_1LDSB1_AF0EM8_GRVW2_GSU1_LBSPP128_PLR5_SU0_SUS256_SRVW4_TT2_64_VAW2_WG64_4_1_WGM15
    SolutionIndex: 106
    SolutionNameMin: Cijk_Alik_Bljk_HBH_MT256x256x32_MI32x32x8x1_SE_1LDSB1_AF0EM8_GRVW2_GSU1_LBSPP128_PLR5_SU0_SUS256_SRVW4_TT4_128_VAW2_WG64_4_1_WGM15
    SolutionIndex: 107
    SolutionNameMin: Cijk_Alik_Bljk_HBH_MT128x144x64_MI16x16x16x1_SE_1LDSB1_AF0EM8_GRVW2_GSU1_LBSPP128_PLR5_SU0_SUS256_SRVW4_TT2_144_VAW2_WG64_4_1_WGM15
    SolutionIndex: 108
    SolutionNameMin: Cijk_Alik_Bljk_HBH_MT256x144x64_MI16x16x16x1_SE_1LDSB1_AF0EM8_GRVW2_GSU1_LBSPP128_PLR5_SU0_SUS256_SRVW4_TT4_144_VAW2_WG64_4_1_WGM15
    SolutionIndex: 109
    SolutionNameMin: Cijk_Alik_Bljk_HBH_MT64x64x64_MI32x32x8x1_SE_1LDSB1_AF0EM8_GRVW2_GSU1_LBSPP128_PLR9_SU0_SUS256_SRVW4_TT1_32_VAW2_WG64_4_1_WGM15
    SolutionIndex: 110
    SolutionNameMin: Cijk_Alik_Bljk_HBH_MT64x128x64_MI32x32x8x1_SE_1LDSB1_AF0EM8_GRVW2_GSU1_LBSPP128_PLR9_SU0_SUS256_SRVW4_TT1_64_VAW2_WG64_4_1_WGM15
    SolutionIndex: 111
    SolutionNameMin: Cijk_Alik_Bljk_HBH_MT128x256x64_MI32x32x8x1_SE_1LDSB1_AF0EM8_GRVW2_GSU1_LBSPP128_PLR9_SU0_SUS256_SRVW4_TT2_128_VAW2_WG64_4_1_WGM15
    SolutionIndex: 112
    SolutionNameMin: Cijk_Alik_Bljk_HBH_MT256x128x64_MI32x32x8x1_SE_1LDSB1_AF0EM8_GRVW2_GSU1_LBSPP128_PLR9_SU0_SUS256_SRVW4_TT4_64_VAW2_WG64_4_1_WGM15
    SolutionIndex: 113
    SolutionNameMin: Cijk_Alik_Bljk_HBH_MT256x160x64_MI32x32x8x1_SE_1LDSB1_AF0EM8_GRVW2_GSU1_LBSPP128_PLR9_SU0_SUS256_SRVW4_TT2_160_VAW2_WG128_2_1_WGM15
    SolutionIndex: 114
    SolutionNameMin: Cijk_Alik_Bljk_HBH_MT64x64x32_MI32x32x8x1_SE_1LDSB1_AF0EM8_GRVW4_GSU1_LBSPP128_PLR5_SU0_SUS256_SRVW4_TT1_32_VAW2_WG64_4_1_WGM15
    SolutionIndex: 115
    SolutionNameMin: Cijk_Alik_Bljk_HBH_MT128x128x32_MI32x32x8x1_SE_1LDSB1_AF0EM8_GRVW4_GSU1_LBSPP128_PLR5_SU0_SUS256_SRVW4_TT2_64_VAW2_WG64_4_1_WGM15
    SolutionIndex: 116
    SolutionNameMin: Cijk_Alik_Bljk_HBH_MT128x96x32_MI32x32x8x1_SE_1LDSB1_AF0EM8_GRVW4_GSU1_LBSPP128_PLR5_SU0_SUS256_SRVW4_TT1_96_VAW2_WG128_2_1_WGM15
    SolutionIndex: 117
    SolutionNameMin: Cijk_Alik_Bljk_HBH_MT128x160x32_MI32x32x8x1_SE_1LDSB1_AF0EM8_GRVW4_GSU1_LBSPP128_PLR5_SU0_SUS256_SRVW4_TT1_160_VAW2_WG128_2_1_WGM15
    SolutionIndex: 118
    SolutionNameMin: Cijk_Alik_Bljk_HBH_MT128x128x64_MI32x32x8x1_SE_1LDSB1_AF0EM8_GRVW4_GSU1_LBSPP128_PLR9_SU0_SUS256_SRVW4_TT2_64_VAW2_WG64_4_1_WGM15
    SolutionIndex: 119
    SolutionNameMin: Cijk_Alik_Bljk_HBH_MT128x288x64_MI32x32x8x1_SE_1LDSB1_AF0EM8_GRVW4_GSU1_LBSPP128_PLR9_SU0_SUS256_SRVW4_TT1_288_VAW2_WG128_2_1_WGM15
    SolutionIndex: 120
    SolutionNameMin: Cijk_Alik_Bljk_HBH_MT128x160x64_MI32x32x8x1_SE_1LDSB1_AF0EM8_GRVW4_GSU1_LBSPP128_PLR9_SU0_SUS256_SRVW4_TT1_160_VAW2_WG128_2_1_WGM15
    SolutionIndex: 121
    SolutionNameMin: Cijk_Alik_Bljk_HBH_MT256x160x64_MI32x32x8x1_SE_1LDSB1_AF0EM8_GRVW4_GSU1_LBSPP128_PLR9_SU0_SUS256_SRVW4_TT2_160_VAW2_WG128_2_1_WGM15
    SolutionIndex: 122
    SolutionNameMin: Cijk_Alik_Bljk_HBH_MT64x128x32_MI32x32x8x1_SE_1LDSB1_AF0EM8_GRVW8_GSU1_LBSPP128_PLR5_SU0_SUS256_SRVW4_TT1_64_VAW2_WG64_4_1_WGM15
    SolutionIndex: 123
    SolutionNameMin: Cijk_Alik_Bljk_HBH_MT128x64x32_MI32x32x8x1_SE_1LDSB1_AF0EM8_GRVW8_GSU1_LBSPP128_PLR5_SU0_SUS256_SRVW4_TT2_32_VAW2_WG64_4_1_WGM15
    SolutionIndex: 124
    SolutionNameMin: Cijk_Alik_Bljk_HBH_MT128x128x32_MI32x32x8x1_SE_1LDSB1_AF0EM8_GRVW8_GSU1_LBSPP128_PLR5_SU0_SUS256_SRVW4_TT2_64_VAW2_WG64_4_1_WGM15
    SolutionIndex: 125
    SolutionNameMin: Cijk_Alik_Bljk_HBH_MT128x256x32_MI32x32x8x1_SE_1LDSB1_AF0EM8_GRVW8_GSU1_LBSPP128_PLR5_SU0_SUS256_SRVW4_TT2_128_VAW2_WG64_4_1_WGM15
    SolutionIndex: 126
    SolutionNameMin: Cijk_Alik_Bljk_HBH_MT256x128x32_MI32x32x8x1_SE_1LDSB1_AF0EM8_GRVW8_GSU1_LBSPP128_PLR5_SU0_SUS256_SRVW4_TT4_64_VAW2_WG64_4_1_WGM15
    SolutionIndex: 127
    SolutionNameMin: Cijk_Alik_Bljk_HBH_MT64x64x64_MI32x32x8x1_SE_1LDSB1_AF0EM8_GRVW8_GSU1_LBSPP128_PLR9_SU0_SUS256_SRVW4_TT1_32_VAW2_WG64_4_1_WGM15
    SolutionIndex: 128
    SolutionNameMin: Cijk_Alik_Bljk_HBH_MT128x64x64_MI32x32x8x1_SE_1LDSB1_AF0EM8_GRVW8_GSU1_LBSPP128_PLR9_SU0_SUS256_SRVW4_TT2_32_VAW2_WG64_4_1_WGM15
    SolutionIndex: 129
    SolutionNameMin: Cijk_Alik_Bljk_HBH_MT128x128x64_MI32x32x8x1_SE_1LDSB1_AF0EM8_GRVW8_GSU1_LBSPP128_PLR9_SU0_SUS256_SRVW4_TT2_64_VAW2_WG64_4_1_WGM15
    SolutionIndex: 130
    SolutionNameMin: Cijk_Alik_Bljk_HBH_MT128x96x64_MI32x32x8x1_SE_1LDSB1_AF0EM8_GRVW8_GSU1_LBSPP128_PLR9_SU0_SUS256_SRVW4_TT1_96_VAW2_WG128_2_1_WGM15
    SolutionIndex: 131
    SolutionNameMin: Cijk_Alik_Bljk_HBH_MT128x160x64_MI32x32x8x1_SE_1LDSB1_AF0EM8_GRVW8_GSU1_LBSPP128_PLR9_SU0_SUS256_SRVW4_TT1_160_VAW2_WG128_2_1_WGM15
    SolutionIndex: 132
    SolutionNameMin: Cijk_Alik_Bljk_HBH_MT128x256x64_MI32x32x8x1_SE_1LDSB1_AF0EM8_GRVW2_GSU1_LBSPP128_PLR9_SU32_SUS128_SRVW4_TT2_128_VAW2_WG64_4_1_WGM15
    SolutionIndex: 133
    SolutionNameMin: Cijk_Alik_Bljk_HBH_MT128x128x32_MI32x32x8x1_SE_1LDSB1_AF0EM8_GRVW4_GSU1_LBSPP128_PLR5_SU32_SUS128_SRVW4_TT2_64_VAW2_WG64_4_1_WGM15
    SolutionIndex: 134
    SolutionNameMin: Cijk_Alik_Bljk_HBH_MT128x128x64_MI32x32x8x1_SE_1LDSB1_AF0EM8_GRVW4_GSU1_LBSPP128_PLR9_SU32_SUS128_SRVW4_TT2_64_VAW2_WG64_4_1_WGM15
    SolutionIndex: 135
    SolutionNameMin: Cijk_Alik_Bljk_HBH_MT128x288x64_MI32x32x8x1_SE_1LDSB1_AF0EM8_GRVW4_GSU1_LBSPP128_PLR9_SU32_SUS128_SRVW4_TT1_288_VAW2_WG128_2_1_WGM15
    SolutionIndex: 136
    SolutionNameMin: Cijk_Alik_Bljk_HBH_MT256x160x64_MI32x32x8x1_SE_1LDSB1_AF0EM8_GRVW4_GSU1_LBSPP128_PLR9_SU32_SUS128_SRVW4_TT2_160_VAW2_WG128_2_1_WGM15
    SolutionIndex: 137
    SolutionNameMin: Cijk_Alik_Bljk_HBH_MT128x128x32_MI32x32x8x1_SE_1LDSB1_AF0EM8_GRVW8_GSU1_LBSPP128_PLR5_SU32_SUS128_SRVW4_TT2_64_VAW2_WG64_4_1_WGM15
    SolutionIndex: 138
    SolutionNameMin: Cijk_Alik_Bljk_HBH_MT128x256x32_MI32x32x8x1_SE_1LDSB1_AF0EM8_GRVW8_GSU1_LBSPP128_PLR5_SU32_SUS128_SRVW4_TT2_128_VAW2_WG64_4_1_WGM15
    SolutionIndex: 139
    SolutionNameMin: Cijk_Alik_Bljk_HBH_MT64x64x64_MI32x32x8x1_SE_1LDSB1_AF0EM8_GRVW8_GSU1_LBSPP128_PLR9_SU32_SUS128_SRVW4_TT1_32_VAW2_WG64_4_1_WGM15
    SolutionIndex: 140
    SolutionNameMin: Cijk_Alik_Bljk_HBH_MT64x128x64_MI32x32x8x1_SE_1LDSB1_AF0EM8_GRVW8_GSU1_LBSPP128_PLR9_SU32_SUS128_SRVW4_TT1_64_VAW2_WG64_4_1_WGM15
    SolutionIndex: 141
    SolutionNameMin: Cijk_Alik_Bljk_HBH_MT128x64x64_MI32x32x8x1_SE_1LDSB1_AF0EM8_GRVW8_GSU1_LBSPP128_PLR9_SU32_SUS128_SRVW4_TT2_32_VAW2_WG64_4_1_WGM15
    SolutionIndex: 142
    SolutionNameMin: Cijk_Alik_Bljk_HBH_MT128x128x64_MI32x32x8x1_SE_1LDSB1_AF0EM8_GRVW8_GSU1_LBSPP128_PLR9_SU32_SUS128_SRVW4_TT2_64_VAW2_WG64_4_1_WGM15
    SolutionIndex: 143
    SolutionNameMin: Cijk_Alik_Bljk_HBH_MT128x96x64_MI32x32x8x1_SE_1LDSB1_AF0EM8_GRVW8_GSU1_LBSPP128_PLR9_SU32_SUS128_SRVW4_TT1_96_VAW2_WG128_2_1_WGM15
    SolutionIndex: 144
    SolutionNameMin: Cijk_Alik_Bljk_HBH_MT128x160x64_MI32x32x8x1_SE_1LDSB1_AF0EM8_GRVW8_GSU1_LBSPP128_PLR9_SU32_SUS128_SRVW4_TT1_160_VAW2_WG128_2_1_WGM15
    SolutionIndex: 145
    SolutionNameMin: Cijk_Alik_Bljk_HBH_MT32x32x32_MI16x16x16x1_SE_1LDSB1_AF0EM8_GRVW4_GSU1_LBSPP128_PLR2_SU32_SUS256_SRVW4_TT1_16_VAW2_WG32_8_1_WGM15
    SolutionIndex: 146
    SolutionNameMin: Cijk_Alik_Bljk_HBH_MT128x128x32_MI32x32x8x1_SE_1LDSB1_AF0EM8_GRVW4_GSU1_LBSPP128_PLR5_SU32_SUS256_SRVW4_TT2_64_VAW2_WG64_4_1_WGM15
    SolutionIndex: 147
    SolutionNameMin: Cijk_Alik_Bljk_HBH_MT128x64x32_MI32x32x8x1_SE_1LDSB1_AF0EM8_GRVW8_GSU1_LBSPP128_PLR5_SU32_SUS256_SRVW4_TT2_32_VAW2_WG64_4_1_WGM15
    SolutionIndex: 148
    SolutionNameMin: Cijk_Alik_Bljk_HBH_MT128x256x32_MI32x32x8x1_SE_1LDSB1_AF0EM8_GRVW8_GSU1_LBSPP128_PLR5_SU32_SUS256_SRVW4_TT2_128_VAW2_WG64_4_1_WGM15
    SolutionIndex: 149
    SolutionNameMin: Cijk_Alik_Bljk_HBH_MT256x128x32_MI32x32x8x1_SE_1LDSB1_AF0EM8_GRVW8_GSU1_LBSPP128_PLR5_SU32_SUS256_SRVW4_TT4_64_VAW2_WG64_4_1_WGM15
    SolutionIndex: 150
    SolutionNameMin: Cijk_Alik_Bljk_HBH_MT64x64x64_MI32x32x8x1_SE_1LDSB1_AF0EM8_GRVW8_GSU1_LBSPP128_PLR9_SU32_SUS256_SRVW4_TT1_32_VAW2_WG64_4_1_WGM15
    SolutionIndex: 151
    SolutionNameMin: Cijk_Alik_Bljk_HBH_MT64x128x64_MI32x32x8x1_SE_1LDSB1_AF0EM8_GRVW8_GSU1_LBSPP128_PLR9_SU32_SUS256_SRVW4_TT1_64_VAW2_WG64_4_1_WGM15
    SolutionIndex: 152
    SolutionNameMin: Cijk_Alik_Bljk_HBH_MT128x64x64_MI32x32x8x1_SE_1LDSB1_AF0EM8_GRVW8_GSU1_LBSPP128_PLR9_SU32_SUS256_SRVW4_TT2_32_VAW2_WG64_4_1_WGM15
    SolutionIndex: 153
    SolutionNameMin: Cijk_Alik_Bljk_HBH_MT128x128x64_MI32x32x8x1_SE_1LDSB1_AF0EM8_GRVW8_GSU1_LBSPP128_PLR9_SU32_SUS256_SRVW4_TT2_64_VAW2_WG64_4_1_WGM15
    SolutionIndex: 154
    SolutionNameMin: Cijk_Alik_Bljk_HBH_MT128x96x64_MI32x32x8x1_SE_1LDSB1_AF0EM8_GRVW8_GSU1_LBSPP128_PLR9_SU32_SUS256_SRVW4_TT1_96_VAW2_WG128_2_1_WGM15
    SolutionIndex: 155
    SolutionNameMin: Cijk_Alik_Bljk_HBH_MT96x128x64_MI32x32x8x1_SE_1LDSB1_AF0EM8_GRVW8_GSU1_LBSPP128_PLR9_SU32_SUS256_SRVW0_TT3_32_VAW2_WG32_8_1_WGM15
    SolutionIndex: 156
    SolutionNameMin: Cijk_Alik_Bljk_HBH_MT32x32x64_MI16x16x16x1_SE_1LDSB0_AF0EM8_GRVW8_GSU15_LBSPP128_PLR5_SU0_SUS256_SRVW0_TT1_16_VAW1_WG32_8_1_WGM1
    SolutionIndex: 157
    SolutionNameMin: Cijk_Alik_Bljk_HBH_MT32x32x32_MI16x16x16x1_SE_1LDSB0_AF0EM1_GRVW2_GSU1_LBSPP128_PLR2_SU0_SUS256_SRVW4_TT1_16_VAW2_WG32_8_1_WGM1
    SolutionIndex: 158
    SolutionNameMin: Cijk_Alik_Bljk_HBH_MT32x32x32_MI16x16x16x1_SE_1LDSB1_AF0EM1_GRVW2_GSU1_LBSPP128_PLR2_SU0_SUS256_SRVW4_TT1_16_VAW2_WG32_8_1_WGM1
    SolutionIndex: 159
    SolutionNameMin: Cijk_Alik_Bljk_HBH_MT256x160x64_MI32x32x8x1_SE_1LDSB1_AF0EM1_GRVW2_GSU1_LBSPP128_PLR9_SU0_SUS256_SRVW4_TT2_160_VAW2_WG128_2_1_WGM1
    SolutionIndex: 160
    SolutionNameMin: Cijk_Alik_Bljk_HBH_MT32x32x32_MI16x16x16x1_SE_1LDSB1_AF0EM1_GRVW4_GSU1_LBSPP128_PLR2_SU0_SUS256_SRVW4_TT1_16_VAW2_WG32_8_1_WGM1
    SolutionIndex: 161
    SolutionNameMin: Cijk_Alik_Bljk_HBH_MT256x160x64_MI32x32x8x1_SE_1LDSB1_AF0EM1_GRVW4_GSU1_LBSPP128_PLR9_SU0_SUS256_SRVW4_TT2_160_VAW2_WG128_2_1_WGM1
    SolutionIndex: 162
    SolutionNameMin: Cijk_Alik_Bljk_HBH_MT64x64x32_MI32x32x8x1_SE_1LDSB1_AF0EM1_GRVW8_GSU1_LBSPP128_PLR5_SU0_SUS256_SRVW4_TT1_32_VAW2_WG64_4_1_WGM1
    SolutionIndex: 163
    SolutionNameMin: Cijk_Alik_Bljk_HBH_MT32x64x64_MI16x16x16x1_SE_1LDSB1_AF0EM1_GRVW8_GSU1_LBSPP128_PLR5_SU0_SUS256_SRVW4_TT1_32_VAW2_WG32_8_1_WGM1
    SolutionIndex: 164
    SolutionNameMin: Cijk_Alik_Bljk_HBH_MT64x32x64_MI16x16x16x1_SE_1LDSB1_AF0EM1_GRVW8_GSU1_LBSPP128_PLR5_SU0_SUS256_SRVW4_TT2_16_VAW2_WG32_8_1_WGM1
    SolutionIndex: 165
    SolutionNameMin: Cijk_Alik_Bljk_HBH_MT32x32x32_MI16x16x16x1_SE_1LDSB1_AF0EM1_GRVW8_GSU1_LBSPP128_PLR2_SU32_SUS128_SRVW4_TT1_16_VAW2_WG32_8_1_WGM1
    SolutionIndex: 166
    SolutionNameMin: Cijk_Alik_Bljk_HBH_MT128x96x64_MI32x32x8x1_SE_1LDSB1_AF0EM1_GRVW8_GSU1_LBSPP128_PLR9_SU32_SUS128_SRVW4_TT1_96_VAW2_WG128_2_1_WGM1
    SolutionIndex: 167
    SolutionNameMin: Cijk_Alik_Bljk_HBH_MT64x64x32_MI32x32x8x1_SE_1LDSB1_AF0EM1_GRVW2_GSU1_LBSPP128_PLR5_SU32_SUS256_SRVW4_TT1_32_VAW2_WG64_4_1_WGM1
    SolutionIndex: 168
    SolutionNameMin: Cijk_Alik_Bljk_HBH_MT256x160x64_MI32x32x8x1_SE_1LDSB1_AF0EM1_GRVW2_GSU1_LBSPP128_PLR9_SU0_SUS256_SRVW4_TT2_160_VAW2_WG128_2_1_WGM2
    SolutionIndex: 169
    SolutionNameMin: Cijk_Alik_Bljk_HBH_MT128x96x64_MI32x32x8x1_SE_1LDSB1_AF0EM1_GRVW4_GSU1_LBSPP128_PLR9_SU32_SUS256_SRVW4_TT1_96_VAW2_WG128_2_1_WGM2
    SolutionIndex: 170
    SolutionNameMin: Cijk_Alik_Bljk_HBH_MT32x32x32_MI16x16x16x1_SE_1LDSB1_AF0EM1_GRVW8_GSU1_LBSPP128_PLR2_SU32_SUS256_SRVW4_TT1_16_VAW2_WG32_8_1_WGM2
    SolutionIndex: 171
    SolutionNameMin: Cijk_Alik_Bljk_HBH_MT256x160x64_MI32x32x8x1_SE_1LDSB1_AF0EM1_GRVW2_GSU1_LBSPP128_PLR9_SU0_SUS256_SRVW4_TT2_160_VAW2_WG128_2_1_WGM15
    SolutionIndex: 172
    SolutionNameMin: Cijk_Alik_Bljk_HBH_MT128x128x32_MI32x32x8x1_SE_1LDSB1_AF0EM1_GRVW8_GSU1_LBSPP128_PLR5_SU0_SUS256_SRVW4_TT2_64_VAW2_WG64_4_1_WGM15
    SolutionIndex: 173
    SolutionNameMin: Cijk_Alik_Bljk_HBH_MT128x96x64_MI32x32x8x1_SE_1LDSB1_AF0EM1_GRVW8_GSU1_LBSPP128_PLR9_SU0_SUS256_SRVW4_TT1_96_VAW2_WG128_2_1_WGM15
    SolutionIndex: 174
    SolutionNameMin: Cijk_Alik_Bljk_HBH_MT64x64x32_MI32x32x8x1_SE_1LDSB1_AF0EM1_GRVW2_GSU1_LBSPP128_PLR5_SU32_SUS128_SRVW4_TT1_32_VAW2_WG64_4_1_WGM15
    SolutionIndex: 175
    SolutionNameMin: Cijk_Alik_Bljk_HBH_MT128x160x32_MI32x32x8x1_SE_1LDSB1_AF0EM1_GRVW2_GSU1_LBSPP128_PLR5_SU32_SUS128_SRVW4_TT1_160_VAW2_WG128_2_1_WGM15
    SolutionIndex: 176
    SolutionNameMin: Cijk_Alik_Bljk_HBH_MT128x128x32_MI32x32x8x1_SE_1LDSB1_AF0EM1_GRVW4_GSU1_LBSPP128_PLR5_SU32_SUS128_SRVW4_TT2_64_VAW2_WG64_4_1_WGM15
    SolutionIndex: 177
    SolutionNameMin: Cijk_Alik_Bljk_HBH_MT128x160x32_MI32x32x8x1_SE_1LDSB1_AF0EM1_GRVW4_GSU1_LBSPP128_PLR5_SU32_SUS128_SRVW4_TT1_160_VAW2_WG128_2_1_WGM15
    SolutionIndex: 178
    SolutionNameMin: Cijk_Alik_Bljk_HBH_MT128x256x32_MI32x32x8x1_SE_1LDSB1_AF0EM1_GRVW8_GSU1_LBSPP128_PLR5_SU32_SUS128_SRVW4_TT2_128_VAW2_WG64_4_1_WGM15
    SolutionIndex: 179
    SolutionNameMin: Cijk_Alik_Bljk_HBH_MT32x32x32_MI16x16x16x1_SE_1LDSB1_AF0EM1_GRVW4_GSU1_LBSPP128_PLR2_SU32_SUS256_SRVW4_TT1_16_VAW2_WG32_8_1_WGM15
    SolutionIndex: 180
    SolutionNameMin: Cijk_Alik_Bljk_HBH_MT32x32x64_MI16x16x16x1_SE_1LDSB0_AF0EM1_GRVW2_GSU5_LBSPP128_PLR5_SU0_SUS256_SRVW0_TT1_16_VAW1_WG32_8_1_WGM1
    SolutionIndex: 181
    SolutionNameMin: Cijk_Alik_Bljk_HBH_MT32x32x64_MI16x16x16x1_SE_1LDSB0_AF0EM1_GRVW4_GSU5_LBSPP128_PLR5_SU0_SUS256_SRVW0_TT1_16_VAW1_WG32_8_1_WGM1
    SolutionIndex: 182
    SolutionNameMin: Cijk_Alik_Bljk_HBH_MT32x32x64_MI16x16x16x1_SE_1LDSB0_AF0EM1_GRVW2_GSU5_LBSPP128_PLR5_SU32_SUS128_SRVW0_TT1_16_VAW1_WG32_8_1_WGM1
    SolutionIndex: 183
    SolutionNameMin: Cijk_Alik_Bljk_HBH_MT32x32x32_MI16x16x16x1_SE_1LDSB0_AF0EM1_GRVW2_GSU15_LBSPP128_PLR2_SU0_SUS256_SRVW0_TT1_16_VAW1_WG32_8_1_WGM1
    SolutionIndex: 184
    SolutionNameMin: Cijk_Alik_Bljk_HBH_MT16x16x32_MI16x16x16x1_SE_1LDSB0_AF0EM1_GRVW2_GSU1_LBSPP128_PLR2_SU0_SUS256_SRVW0_TT1_16_VAW2_WG16_4_1_WGM1
    SolutionIndex: 185
    SolutionNameMin: Cijk_Alik_Bljk_HBH_MT16x16x64_MI16x16x16x1_SE_1LDSB0_AF0EM1_GRVW4_GSU1_LBSPP128_PLR5_SU0_SUS256_SRVW0_TT1_16_VAW2_WG16_4_1_WGM1
    SolutionIndex: 186
    SolutionNameMin: Cijk_Alik_Bljk_HBH_MT16x16x32_MI16x16x16x1_SE_1LDSB0_AF0EM1_GRVW8_GSU1_LBSPP128_PLR2_SU0_SUS256_SRVW0_TT1_16_VAW2_WG16_4_1_WGM1
    SolutionIndex: 187
    SolutionNameMin: Cijk_Alik_Bljk_HBH_MT16x16x64_MI16x16x16x1_SE_1LDSB0_AF0EM1_GRVW8_GSU1_LBSPP128_PLR5_SU0_SUS256_SRVW0_TT1_16_VAW2_WG16_4_1_WGM1
    SolutionIndex: 188
    SolutionNameMin: Cijk_Alik_Bljk_HBH_MT16x16x128_MI16x16x16x1_SE_1LDSB0_AF0EM1_GRVW4_GSU1_LBSPP256_PLR9_SU0_SUS256_SRVW0_TT1_16_VAW2_WG16_4_1_WGM1
    SolutionIndex: 189
    SolutionNameMin: Cijk_Alik_Bljk_HBH_MT16x16x128_MI16x16x16x1_SE_1LDSB0_AF0EM1_GRVW8_GSU1_LBSPP256_PLR9_SU0_SUS256_SRVW0_TT1_16_VAW2_WG16_4_1_WGM1
    SolutionIndex: 190
    SolutionNameMin: Cijk_Alik_Bljk_HBH_MT16x16x128_MI16x16x16x1_SE_1LDSB0_AF0EM8_GRVW8_GSU1_LBSPP256_PLR9_SU0_SUS256_SRVW0_TT1_16_VAW2_WG16_4_1_WGM1
    SolutionIndex: 191
    SolutionNameMin: Cijk_Alik_Bljk_HBH_MT16x16x64_MI16x16x16x1_SE_1LDSB0_AF0EM1_GRVW8_GSU1_LBSPP128_PLR5_SU32_SUS128_SRVW0_TT1_16_VAW2_WG16_4_1_WGM1
    SolutionIndex: 192
    SolutionNameMin: Cijk_Alik_Bljk_HBH_MT16x16x128_MI16x16x16x1_SE_1LDSB0_AF0EM8_GRVW8_GSU1_LBSPP256_PLR9_SU32_SUS256_SRVW0_TT1_16_VAW2_WG16_4_1_WGM1
    SolutionIndex: 193
    SolutionNameMin: Cijk_Alik_Bljk_HBH_MT16x16x128_MI16x16x16x1_SE_1LDSB0_AF0EM1_GRVW8_GSU1_LBSPP256_PLR9_SU0_SUS256_SRVW0_TT1_16_VAW2_WG16_4_1_WGM2
    SolutionIndex: 194
    SolutionNameMin: Cijk_Alik_Bljk_HBH_MT16x16x128_MI16x16x16x1_SE_1LDSB0_AF0EM8_GRVW4_GSU1_LBSPP256_PLR9_SU32_SUS256_SRVW0_TT1_16_VAW2_WG16_4_1_WGM2
    SolutionIndex: 195
    SolutionNameMin: Cijk_Alik_Bljk_HBH_MT16x16x128_MI16x16x16x1_SE_1LDSB0_AF0EM8_GRVW8_GSU1_LBSPP256_PLR9_SU0_SUS256_SRVW0_TT1_16_VAW2_WG16_4_1_WGM15
    SolutionIndex: 196
    SolutionNameMin: Cijk_Alik_Bljk_HBH_MT16x16x32_MI16x16x16x1_SE_1LDSB1_AF0EM1_GRVW8_GSU1_LBSPP128_PLR2_SU0_SUS256_SRVW0_TT1_16_VAW2_WG16_4_1_WGM1
    SolutionIndex: 197
    SolutionNameMin: Cijk_Alik_Bljk_HBH_MT16x16x128_MI16x16x16x1_SE_1LDSB1_AF0EM1_GRVW8_GSU1_LBSPP256_PLR9_SU0_SUS256_SRVW0_TT1_16_VAW2_WG16_4_1_WGM1
    SolutionIndex: 198
    SolutionNameMin: Cijk_Alik_Bljk_HBH_MT16x16x32_MI16x16x16x1_SE_1LDSB1_AF0EM1_GRVW2_GSU1_LBSPP128_PLR2_SU32_SUS128_SRVW0_TT1_16_VAW2_WG16_4_1_WGM1
    SolutionIndex: 199
    SolutionNameMin: Cijk_Alik_Bljk_HBH_MT64x4x64_MI4x4x4x16_SE_1LDSB1_AF0EM8_GRVW8_GSU1_LBSPP128_PLR17_SU32_SUS256_SRVW0_TT1_4_VAW2_WG64_1_1_WGM1
    SolutionIndex: 200
    SolutionNameMin: Cijk_Alik_Bljk_HBH_MT16x16x128_MI16x16x16x1_SE_1LDSB1_AF0EM1_GRVW8_GSU1_LBSPP256_PLR9_SU32_SUS256_SRVW0_TT1_16_VAW2_WG16_4_1_WGM1
    SolutionIndex: 201
    SolutionNameMin: Cijk_Alik_Bljk_HBH_MT16x16x128_MI16x16x16x1_SE_1LDSB1_AF0EM8_GRVW8_GSU1_LBSPP256_PLR9_SU32_SUS256_SRVW0_TT1_16_VAW2_WG16_4_1_WGM1
    SolutionIndex: 202
    SolutionNameMin: Cijk_Alik_Bljk_HBH_MT16x16x32_MI16x16x16x1_SE_1LDSB1_AF0EM1_GRVW8_GSU1_LBSPP128_PLR2_SU0_SUS256_SRVW0_TT1_16_VAW2_WG16_4_1_WGM2
    SolutionIndex: 203
    SolutionNameMin: Cijk_Alik_Bljk_HBH_MT16x16x128_MI16x16x16x1_SE_1LDSB1_AF0EM1_GRVW8_GSU1_LBSPP256_PLR9_SU0_SUS256_SRVW0_TT1_16_VAW2_WG16_4_1_WGM2
- - - [7680, 8192, 1, 8192, 8384, 8384, 8384, 8384]
    - [34, 127631.0]
  - - [3840, 4096, 1, 4096, 4192, 4192, 4192, 4192]
    - [67, 125261.0]
  - - [1920, 2048, 1, 2048, 2080, 2080, 2080, 2080]
    - [47, 117873.0]
  - - [960, 1024, 1, 1024, 1056, 1056, 1056, 1056]
    - [48, 61985.0]
  - - [480, 512, 1, 512, 544, 544, 544, 544]
    - [8, 20696.0]
  - - [8192, 7680, 1, 8192, 8384, 8384, 8384, 8384]
    - [34, 127581.0]
  - - [4096, 3840, 1, 4096, 4192, 4192, 4192, 4192]
    - [67, 125242.0]
  - - [2048, 1920, 1, 2048, 2080, 2080, 2080, 2080]
    - [126, 117050.0]
  - - [1024, 960, 1, 1024, 1056, 1056, 1056, 1056]
    - [143, 62915.0]
  - - [512, 480, 1, 512, 544, 544, 544, 544]
    - [55, 20696.0]
  - - [8192, 8192, 1, 8192, 8384, 8384, 8384, 8384]
    - [121, 123505.0]
  - - [4096, 4096, 1, 4096, 4192, 4192, 4192, 4192]
    - [75, 115908.0]
  - - [2048, 2048, 1, 2048, 2080, 2080, 2080, 2080]
    - [108, 100256.0]
  - - [1024, 1024, 1, 1024, 1056, 1056, 1056, 1056]
    - [9, 62719.0]
  - - [512, 512, 1, 512, 544, 544, 544, 544]
    - [55, 22075.0]
  - - [512, 512, 16, 64, 512, 512, 64, 64]
    - [60, 27060.0]
  - - [512, 512, 128, 64, 512, 512, 64, 64]
    - [105, 42340.0]
  - - [1024, 1, 1, 1024, 1024, 1024, 1024, 1024]
    - [193, 218.0]
  - - [1024, 77, 1, 1024, 1024, 1024, 1024, 1024]
    - [15, 10093.0]
  - - [1024, 512, 1, 1024, 1024, 1024, 1024, 1024]
    - [30, 39709.0]
  - - [1024, 512, 1, 4096, 1024, 1024, 4096, 4096]
    - [55, 38735.0]
  - - [4096, 512, 1, 1024, 4096, 4096, 1024, 1024]
    - [36, 69363.0]
  - - [128, 128, 128, 64, 128, 128, 64, 64]
    - [127, 19738.0]
  - - [128, 128, 160, 64, 128, 128, 64, 64]
    - [123, 20764.0]
  - - [1024, 10, 1, 1024, 1024, 1024, 1024, 1024]
    - [201, 2016.0]
  - - [1024, 200, 1, 1024, 1024, 1024, 1024, 1024]
    - [28, 20480.0]
  - - [1024, 1280, 1, 1024, 1024, 1024, 1024, 1024]
    - [130, 61909.0]
  - - [1024, 1280, 1, 4096, 1024, 1024, 4096, 4096]
    - [13, 62602.0]
  - - [4096, 1280, 1, 1024, 4096, 4096, 1024, 1024]
    - [95, 81940.0]
  - - [128, 128, 624, 64, 128, 128, 64, 64]
    - [37, 26555.0]
  - - [1024, 39, 1, 1024, 1024, 1024, 1024, 1024]
    - [7, 5325.0]
  - - [1024, 780, 1, 1024, 1024, 1024, 1024, 1024]
    - [140, 49152.0]
  - - [1024, 4992, 1, 1024, 1024, 1024, 1024, 1024]
    - [83, 82929.0]
  - - [1024, 4992, 1, 4096, 1024, 1024, 4096, 4096]
    - [118, 88063.0]
  - - [4096, 4992, 1, 1024, 4096, 4096, 1024, 1024]
    - [115, 96257.0]
  - - [512, 512, 64, 64, 512, 512, 64, 64]
    - [52, 40427.0]
  - - [1024, 4, 1, 1024, 1024, 1024, 1024, 1024]
    - [203, 846.0]
  - - [1024, 308, 1, 1024, 1024, 1024, 1024, 1024]
    - [93, 30127.0]
  - - [1024, 2048, 1, 1024, 1024, 1024, 1024, 1024]
    - [107, 72550.0]
  - - [1024, 2048, 1, 4096, 1024, 1024, 4096, 4096]
    - [86, 82405.0]
  - - [4096, 2048, 1, 1024, 4096, 4096, 1024, 1024]
    - [117, 84149.0]
  - - [128, 128, 640, 64, 128, 128, 64, 64]
    - [55, 26546.0]
  - - [1024, 40, 1, 1024, 1024, 1024, 1024, 1024]
    - [6, 5405.0]
  - - [1024, 800, 1, 1024, 1024, 1024, 1024, 1024]
    - [152, 50171.0]
  - - [1024, 5120, 1, 1024, 1024, 1024, 1024, 1024]
    - [130, 83781.0]
  - - [1024, 5120, 1, 4096, 1024, 1024, 4096, 4096]
    - [35, 88827.0]
  - - [4096, 5120, 1, 1024, 4096, 4096, 1024, 1024]
    - [79, 99790.0]
  - - [128, 128, 656, 64, 128, 128, 64, 64]
    - [71, 26703.0]
  - - [1024, 41, 1, 1024, 1024, 1024, 1024, 1024]
    - [7, 5484.0]
  - - [1024, 820, 1, 1024, 1024, 1024, 1024, 1024]
    - [31, 50224.0]
  - - [1024, 5248, 1, 1024, 1024, 1024, 1024, 1024]
    - [130, 81501.0]
  - - [1024, 5248, 1, 4096, 1024, 1024, 4096, 4096]
    - [118, 89976.0]
  - - [4096, 5248, 1, 1024, 4096, 4096, 1024, 1024]
    - [47, 99546.0]
  - - [512, 512, 80, 64, 512, 512, 64, 64]
    - [146, 41121.0]
  - - [1024, 5, 1, 1024, 1024, 1024, 1024, 1024]
    - [192, 1040.0]
  - - [1024, 385, 1, 1024, 1024, 1024, 1024, 1024]
    - [93, 33868.0]
  - - [1024, 2560, 1, 1024, 1024, 1024, 1024, 1024]
    - [35, 74072.0]
  - - [1024, 2560, 1, 4096, 1024, 1024, 4096, 4096]
    - [69, 84361.0]
  - - [4096, 2560, 1, 1024, 4096, 4096, 1024, 1024]
    - [99, 95122.0]
  - - [512, 512, 96, 64, 512, 512, 64, 64]
    - [105, 40754.0]
  - - [1024, 6, 1, 1024, 1024, 1024, 1024, 1024]
    - [201, 1248.0]
  - - [1024, 462, 1, 1024, 1024, 1024, 1024, 1024]
    - [151, 36261.0]
  - - [1024, 3072, 1, 1024, 1024, 1024, 1024, 1024]
    - [124, 76696.0]
  - - [1024, 3072, 1, 4096, 1024, 1024, 4096, 4096]
    - [88, 87343.0]
  - - [4096, 3072, 1, 1024, 4096, 4096, 1024, 1024]
    - [115, 91253.0]
  - - [1024, 8, 1, 1024, 1024, 1024, 1024, 1024]
    - [193, 1613.0]
  - - [1024, 160, 1, 1024, 1024, 1024, 1024, 1024]
    - [25, 18079.0]
  - - [1024, 1024, 1, 1024, 1024, 1024, 1024, 1024]
    - [12, 55924.0]
  - - [1024, 1024, 1, 4096, 1024, 1024, 4096, 4096]
    - [20, 59719.0]
  - - [4096, 1024, 1, 1024, 4096, 4096, 1024, 1024]
    - [59, 79185.0]
  - - [128, 128, 144, 64, 128, 128, 64, 64]
    - [80, 20295.0]
  - - [1024, 9, 1, 1024, 1024, 1024, 1024, 1024]
    - [200, 1843.0]
  - - [1024, 180, 1, 1024, 1024, 1024, 1024, 1024]
    - [28, 19826.0]
  - - [1024, 1152, 1, 1024, 1024, 1024, 1024, 1024]
    - [33, 61380.0]
  - - [1024, 1152, 1, 4096, 1024, 1024, 4096, 4096]
    - [142, 62980.0]
  - - [4096, 1152, 1, 1024, 4096, 4096, 1024, 1024]
    - [154, 79159.0]
  - - [128, 32768, 1, 256, 128, 128, 256, 256]
    - [42, 45040.0]
  - - [256, 32768, 1, 512, 256, 256, 512, 512]
    - [130, 79185.0]
  - - [512, 32768, 1, 13, 512, 512, 13, 13]
    - [124, 7368.0]
  - - [512, 32768, 1, 1024, 512, 512, 1024, 1024]
    - [68, 94644.0]
  - - [1024, 32768, 1, 479, 1024, 1024, 479, 479]
    - [66, 70842.0]
  - - [1024, 32768, 1, 1024, 1024, 1024, 1024, 1024]
    - [47, 105217.0]
  - - [32768, 1, 1, 256, 32768, 32768, 256, 256]
    - [199, 783.0]
  - - [64, 128, 512, 128, 64, 64, 128, 128]
    - [48, 24492.0]
  - - [128, 128, 512, 64, 128, 128, 64, 64]
    - [80, 25324.0]
  - - [1024, 32, 1, 1024, 1024, 1024, 1024, 131072]
    - [5, 4609.0]
  - - [1024, 4096, 1, 1024, 1024, 1024, 1024, 1024]
    - [119, 92088.0]
  - - [1024, 4096, 1, 4096, 1024, 1024, 4096, 4096]
    - [39, 97746.0]
  - - [4096, 4096, 1, 1024, 4096, 4096, 1024, 1024]
    - [115, 95232.0]
  - - [30528, 4096, 1, 1024, 30528, 30528, 1024, 1024]
    - [138, 113161.0]
  - - [64, 512, 64, 512, 64, 64, 512, 512]
    - [93, 39360.0]
  - - [1024, 4, 1, 1024, 1024, 1024, 1024, 524288]
    - [193, 846.0]
  - - [30528, 2048, 1, 1024, 30528, 30528, 1024, 1024]
    - [92, 110139.0]
  - - [1024, 8192, 1, 1024, 1024, 1024, 1024, 1024]
    - [135, 86244.0]
  - - [1024, 8192, 1, 4096, 1024, 1024, 4096, 4096]
    - [73, 101153.0]
  - - [1024, 9600, 1, 1024, 1024, 1024, 1024, 1024]
    - [113, 103819.0]
  - - [1024, 9600, 1, 4096, 1024, 1024, 4096, 4096]
    - [113, 121106.0]
  - - [4096, 8192, 1, 1024, 4096, 4096, 1024, 1024]
    - [79, 104986.0]
  - - [4096, 9600, 1, 1024, 4096, 4096, 1024, 1024]
    - [73, 107180.0]
  - - [33712, 8192, 1, 1024, 33712, 33712, 1024, 1024]
    - [138, 116869.0]
  - - [33712, 9600, 1, 1024, 33712, 33712, 1024, 1024]
    - [138, 115384.0]
  - - [1024, 10064, 1, 1024, 1024, 1024, 1024, 1024]
    - [125, 90910.0]
  - - [1024, 10064, 1, 4096, 1024, 1024, 4096, 4096]
    - [125, 102734.0]
  - - [1024, 10080, 1, 1024, 1024, 1024, 1024, 1024]
    - [125, 90308.0]
  - - [1024, 10080, 1, 4096, 1024, 1024, 4096, 4096]
    - [79, 102697.0]
  - - [1024, 10200, 1, 1024, 1024, 1024, 1024, 1024]
    - [125, 87438.0]
  - - [1024, 10200, 1, 4096, 1024, 1024, 4096, 4096]
    - [79, 100691.0]
  - - [1024, 3840, 1, 1024, 1024, 1024, 1024, 1024]
    - [72, 95506.0]
  - - [1024, 3840, 1, 4096, 1024, 1024, 4096, 4096]
    - [72, 109061.0]
  - - [1024, 3968, 1, 1024, 1024, 1024, 1024, 1024]
    - [85, 82293.0]
  - - [1024, 3968, 1, 4096, 1024, 1024, 4096, 4096]
    - [113, 95299.0]
  - - [1024, 6528, 1, 1024, 1024, 1024, 1024, 1024]
    - [125, 82750.0]
  - - [1024, 6528, 1, 4096, 1024, 1024, 4096, 4096]
    - [34, 100368.0]
  - - [1024, 7104, 1, 1024, 1024, 1024, 1024, 1024]
    - [106, 96993.0]
  - - [1024, 7104, 1, 4096, 1024, 1024, 4096, 4096]
    - [106, 113346.0]
  - - [1024, 7200, 1, 1024, 1024, 1024, 1024, 1024]
    - [125, 93437.0]
  - - [1024, 7200, 1, 4096, 1024, 1024, 4096, 4096]
    - [58, 109480.0]
  - - [1024, 8064, 1, 1024, 1024, 1024, 1024, 1024]
    - [89, 89802.0]
  - - [1024, 8064, 1, 4096, 1024, 1024, 4096, 4096]
    - [119, 102345.0]
  - - [1024, 8160, 1, 1024, 1024, 1024, 1024, 1024]
    - [73, 89878.0]
  - - [1024, 8160, 1, 4096, 1024, 1024, 4096, 4096]
    - [73, 104219.0]
  - - [1024, 9216, 1, 1024, 1024, 1024, 1024, 1024]
    - [113, 90892.0]
  - - [1024, 9216, 1, 4096, 1024, 1024, 4096, 4096]
    - [113, 112946.0]
  - - [1024, 9520, 1, 1024, 1024, 1024, 1024, 1024]
    - [136, 94674.0]
  - - [1024, 9520, 1, 4096, 1024, 1024, 4096, 4096]
    - [113, 116399.0]
  - - [4096, 10064, 1, 1024, 4096, 4096, 1024, 1024]
    - [138, 104920.0]
  - - [4096, 10080, 1, 1024, 4096, 4096, 1024, 1024]
    - [79, 105866.0]
  - - [4096, 10200, 1, 1024, 4096, 4096, 1024, 1024]
    - [79, 106826.0]
  - - [4096, 3840, 1, 1024, 4096, 4096, 1024, 1024]
    - [67, 107145.0]
  - - [4096, 3968, 1, 1024, 4096, 4096, 1024, 1024]
    - [117, 97168.0]
  - - [4096, 6528, 1, 1024, 4096, 4096, 1024, 1024]
    - [138, 102105.0]
  - - [4096, 7104, 1, 1024, 4096, 4096, 1024, 1024]
    - [79, 101847.0]
  - - [4096, 7200, 1, 1024, 4096, 4096, 1024, 1024]
    - [39, 107302.0]
  - - [4096, 8064, 1, 1024, 4096, 4096, 1024, 1024]
    - [79, 103396.0]
  - - [4096, 8160, 1, 1024, 4096, 4096, 1024, 1024]
    - [39, 105634.0]
  - - [4096, 9216, 1, 1024, 4096, 4096, 1024, 1024]
    - [79, 106077.0]
  - - [4096, 9520, 1, 1024, 4096, 4096, 1024, 1024]
    - [73, 103789.0]
  - - [42720, 10080, 1, 1024, 42720, 42720, 1024, 1024]
    - [138, 113979.0]
  - - [42720, 3968, 1, 1024, 42720, 42720, 1024, 1024]
    - [138, 112844.0]
  - - [42720, 6528, 1, 1024, 42720, 42720, 1024, 1024]
    - [138, 115454.0]
  - - [42720, 7104, 1, 1024, 42720, 42720, 1024, 1024]
    - [138, 116917.0]
  - - [42720, 7200, 1, 1024, 42720, 42720, 1024, 1024]
    - [138, 114901.0]
  - - [42720, 9520, 1, 1024, 42720, 42720, 1024, 1024]
    - [138, 113562.0]
  - - [24, 24, 4736, 64, 24, 24, 303104, 303104]
    - [145, 7250.0]
  - - [32, 32, 4608, 64, 32, 32, 294912, 294912]
    - [51, 8658.0]
  - - [32, 35, 4608, 64, 32, 32, 294912, 294912]
    - [50, 8879.0]
  - - [64, 512, 1, 512, 64, 64, 512, 512]
    - [2, 3554.0]
  - - [512, 512, 1, 64, 512, 512, 64, 64]
    - [3, 6168.0]
  - - [128, 128, 1, 64, 128, 128, 64, 64]
    - [0, 437.0]
  - - [1024, 8, 1, 1024, 1024, 1024, 1024, 131072]
    - [189, 1664.0]
  - - [64, 128, 1, 128, 64, 64, 128, 128]
    - [103, 386.0]
  - - [2048, 512, 1, 2048, 2048, 2048, 2048, 2048]
    - [29, 57977.0]
  - - [1024, 512, 1, 1600, 1024, 1024, 1600, 1600]
    - [151, 45393.0]
  - - [2048, 512, 1, 74, 2048, 2048, 74, 74]
    - [104, 11278.0]
  - - [512, 1, 1, 2048, 512, 512, 2048, 2048]
    - [156, 141.0]
  - - [64, 512, 1, 1024, 64, 64, 1024, 1024]
    - [11, 4369.0]
  - - [1024, 1600, 1, 560, 1024, 1024, 560, 560]
    - [22, 45153.0]
  - - [1600, 1, 1, 1024, 1600, 1600, 1024, 1024]
    - [189, 341.0]
  - - [512, 1600, 1, 512, 512, 512, 512, 512]
    - [26, 41943.0]
  - - [1024, 1600, 1, 1024, 1024, 1024, 1024, 1024]
    - [142, 68759.0]
  - - [32, 1600, 1, 512, 32, 32, 512, 512]
    - [5, 5201.0]
  - - [64, 960, 1, 1024, 64, 64, 1024, 1024]
    - [24, 7085.0]
  - - [200, 1, 1, 1024, 200, 200, 1024, 1024]
    - [189, 43.0]
  - - [256, 684, 1, 1024, 256, 256, 1024, 1024]
    - [24, 18994.0]
  - - [256, 1280, 1, 1024, 256, 256, 1024, 1024]
    - [127, 31301.0]
  - - [256, 1536, 1, 1024, 256, 256, 1024, 1024]
    - [18, 34711.0]
  - - [256, 2304, 1, 1024, 256, 256, 1024, 1024]
    - [127, 38519.0]
  - - [256, 2560, 1, 1024, 256, 256, 1024, 1024]
    - [26, 41528.0]
  - - [256, 2816, 1, 1024, 256, 256, 1024, 1024]
    - [27, 45233.0]
  - - [256, 3328, 1, 1024, 256, 256, 1024, 1024]
    - [110, 49122.0]
  - - [256, 3584, 1, 1024, 256, 256, 1024, 1024]
    - [19, 52429.0]
  - - [256, 4608, 1, 1024, 256, 256, 1024, 1024]
    - [143, 58753.0]
  - - [256, 4864, 1, 1024, 256, 256, 1024, 1024]
    - [154, 58169.0]
  - - [256, 5376, 1, 1024, 256, 256, 1024, 1024]
    - [10, 64292.0]
  - - [256, 5888, 1, 1024, 256, 256, 1024, 1024]
    - [95, 63258.0]
  - - [256, 6144, 1, 1024, 256, 256, 1024, 1024]
    - [153, 65793.0]
  - - [256, 6400, 1, 1024, 256, 256, 1024, 1024]
    - [95, 67869.0]
  - - [256, 6656, 1, 1024, 256, 256, 1024, 1024]
    - [82, 71981.0]
  - - [256, 7168, 1, 1024, 256, 256, 1024, 1024]
    - [129, 76260.0]
  - - [256, 7424, 1, 1024, 256, 256, 1024, 1024]
    - [77, 78474.0]
  - - [256, 7936, 1, 1024, 256, 256, 1024, 1024]
    - [70, 69161.0]
  - - [256, 8192, 1, 1024, 256, 256, 1024, 1024]
    - [90, 67277.0]
  - - [256, 8448, 1, 1024, 256, 256, 1024, 1024]
    - [96, 68352.0]
  - - [256, 8960, 1, 1024, 256, 256, 1024, 1024]
    - [131, 80882.0]
  - - [256, 9984, 1, 1024, 256, 256, 1024, 1024]
    - [74, 68016.0]
  - - [256, 10496, 1, 1024, 256, 256, 1024, 1024]
    - [74, 69905.0]
  - - [256, 11264, 1, 1024, 256, 256, 1024, 1024]
    - [116, 71949.0]
  - - [256, 11520, 1, 1024, 256, 256, 1024, 1024]
    - [116, 72316.0]
  - - [256, 11776, 1, 1024, 256, 256, 1024, 1024]
    - [124, 72944.0]
  - - [256, 12544, 1, 1024, 256, 256, 1024, 1024]
    - [124, 76830.0]
  - - [256, 13312, 1, 1024, 256, 256, 1024, 1024]
    - [132, 79167.0]
  - - [256, 14336, 1, 1024, 256, 256, 1024, 1024]
    - [111, 86353.0]
  - - [256, 14592, 1, 1024, 256, 256, 1024, 1024]
    - [38, 87413.0]
  - - [256, 14848, 1, 1024, 256, 256, 1024, 1024]
    - [72, 88623.0]
  - - [256, 15104, 1, 1024, 256, 256, 1024, 1024]
    - [72, 89661.0]
  - - [256, 16128, 1, 1024, 256, 256, 1024, 1024]
    - [119, 88080.0]
  - - [256, 18176, 1, 1024, 256, 256, 1024, 1024]
    - [96, 80053.0]
  - - [256, 18944, 1, 1024, 256, 256, 1024, 1024]
    - [144, 83211.0]
  - - [256, 19200, 1, 1024, 256, 256, 1024, 1024]
    - [87, 99706.0]
  - - [256, 20480, 1, 1024, 256, 256, 1024, 1024]
    - [130, 80757.0]
  - - [256, 20992, 1, 1024, 256, 256, 1024, 1024]
    - [83, 82875.0]
  - - [256, 21248, 1, 1024, 256, 256, 1024, 1024]
    - [130, 81243.0]
  - - [256, 21504, 1, 1024, 256, 256, 1024, 1024]
    - [142, 81556.0]
  - - [256, 22016, 1, 1024, 256, 256, 1024, 1024]
    - [142, 82637.0]
  - - [256, 22344, 1, 1024, 256, 256, 1024, 1024]
    - [142, 81262.0]
  - - [256, 23296, 1, 1024, 256, 256, 1024, 1024]
    - [78, 77578.0]
  - - [256, 23552, 1, 1024, 256, 256, 1024, 1024]
    - [131, 78192.0]
  - - [256, 31488, 1, 1024, 256, 256, 1024, 1024]
    - [83, 85273.0]
  - - [256, 33536, 1, 1024, 256, 256, 1024, 1024]
    - [119, 86596.0]
  - - [256, 44505, 1, 1024, 256, 256, 1024, 1024]
    - [125, 89855.0]
  - - [960, 1, 1, 2048, 960, 960, 2048, 2048]
    - [189, 241.0]
  - - [1024, 200, 1, 560, 1024, 1024, 560, 560]
    - [44, 14194.0]
  - - [1024, 960, 1, 1024, 1024, 1024, 1024, 1024]
    - [143, 56680.0]
  - - [1024, 960, 1, 1600, 1024, 1024, 1600, 1600]
    - [143, 65318.0]
  - - [1024, 32768, 1, 480, 1024, 1024, 480, 480]
    - [99, 106861.0]
  - - [1280, 8976, 1, 256, 1280, 1280, 256, 256]
    - [54, 70030.0]
  - - [1792, 8976, 1, 256, 1792, 1792, 256, 256]
    - [91, 75694.0]
  - - [2048, 114, 1, 512, 2048, 2048, 512, 512]
    - [139, 18222.0]
  - - [2048, 114, 1, 768, 2048, 2048, 768, 768]
    - [62, 22413.0]
  - - [2048, 215, 1, 512, 2048, 2048, 512, 512]
    - [141, 27360.0]
  - - [2048, 215, 1, 768, 2048, 2048, 768, 768]
    - [16, 31545.0]
  - - [2048, 256, 1, 512, 2048, 2048, 512, 512]
    - [64, 33554.0]
  - - [2048, 256, 1, 768, 2048, 2048, 768, 768]
    - [56, 37561.0]
  - - [2048, 512, 1, 67, 2048, 2048, 67, 67]
    - [114, 10211.0]
  - - [2048, 512, 1, 100, 2048, 2048, 100, 100]
    - [104, 13513.0]
  - - [2048, 684, 1, 512, 2048, 2048, 512, 512]
    - [153, 52124.0]
  - - [2048, 684, 1, 768, 2048, 2048, 768, 768]
    - [65, 58982.0]
  - - [2048, 960, 1, 74, 2048, 2048, 74, 74]
    - [21, 16839.0]
  - - [2048, 960, 1, 2048, 2048, 2048, 2048, 2048]
    - [144, 78643.0]
  - - [2048, 1536, 1, 512, 2048, 2048, 512, 512]
    - [61, 67109.0]
  - - [2048, 1536, 1, 768, 2048, 2048, 768, 768]
    - [46, 77433.0]
  - - [2048, 8976, 1, 256, 2048, 2048, 256, 256]
    - [54, 74087.0]
  - - [2304, 8976, 1, 256, 2304, 2304, 256, 256]
    - [91, 76595.0]
  - - [2560, 8976, 1, 256, 2560, 2560, 256, 256]
    - [54, 78225.0]
  - - [2816, 8976, 1, 256, 2816, 2816, 256, 256]
    - [91, 80084.0]
  - - [3072, 8976, 1, 256, 3072, 3072, 256, 256]
    - [54, 79279.0]
  - - [3328, 8976, 1, 256, 3328, 3328, 256, 256]
    - [54, 80599.0]
  - - [3840, 8976, 1, 256, 3840, 3840, 256, 256]
    - [91, 79637.0]
  - - [4096, 8976, 1, 256, 4096, 4096, 256, 256]
    - [54, 75465.0]
  - - [4352, 8976, 1, 256, 4352, 4352, 256, 256]
    - [54, 78966.0]
  - - [4608, 8976, 1, 256, 4608, 4608, 256, 256]
    - [54, 79350.0]
  - - [4864, 8976, 1, 256, 4864, 4864, 256, 256]
    - [54, 79834.0]
  - - [5120, 8976, 1, 256, 5120, 5120, 256, 256]
    - [98, 78896.0]
  - - [5376, 8976, 1, 256, 5376, 5376, 256, 256]
    - [137, 79147.0]
  - - [5632, 8976, 1, 256, 5632, 5632, 256, 256]
    - [137, 79259.0]
  - - [5888, 8976, 1, 256, 5888, 5888, 256, 256]
    - [138, 80229.0]
  - - [6144, 8976, 1, 256, 6144, 6144, 256, 256]
    - [137, 79208.0]
  - - [6400, 8976, 1, 256, 6400, 6400, 256, 256]
    - [137, 80030.0]
  - - [7168, 8976, 1, 256, 7168, 7168, 256, 256]
    - [92, 81443.0]
  - - [7936, 8976, 1, 256, 7936, 7936, 256, 256]
    - [92, 81207.0]
  - - [8192, 8976, 1, 256, 8192, 8192, 256, 256]
    - [92, 78748.0]
  - - [8448, 8976, 1, 256, 8448, 8448, 256, 256]
    - [92, 82311.0]
  - - [8960, 8976, 1, 256, 8960, 8960, 256, 256]
    - [92, 81417.0]
  - - [9472, 8976, 1, 256, 9472, 9472, 256, 256]
    - [92, 81262.0]
  - - [9728, 8976, 1, 256, 9728, 9728, 256, 256]
    - [92, 83334.0]
  - - [9984, 8976, 1, 256, 9984, 9984, 256, 256]
    - [92, 82240.0]
  - - [10240, 8976, 1, 256, 10240, 10240, 256, 256]
    - [92, 82689.0]
  - - [10496, 8976, 1, 256, 10496, 10496, 256, 256]
    - [92, 82892.0]
  - - [11264, 8976, 1, 256, 11264, 11264, 256, 256]
    - [92, 83300.0]
  - - [11776, 8976, 1, 256, 11776, 11776, 256, 256]
    - [92, 83373.0]
  - - [12544, 8976, 1, 256, 12544, 12544, 256, 256]
    - [92, 83096.0]
  - - [13312, 8976, 1, 256, 13312, 13312, 256, 256]
    - [92, 83485.0]
  - - [13568, 8976, 1, 256, 13568, 13568, 256, 256]
    - [92, 82725.0]
  - - [13824, 8976, 1, 256, 13824, 13824, 256, 256]
    - [92, 84018.0]
  - - [15104, 8976, 1, 256, 15104, 15104, 256, 256]
    - [92, 84585.0]
  - - [15360, 8976, 1, 256, 15360, 15360, 256, 256]
    - [138, 82728.0]
  - - [15872, 8976, 1, 256, 15872, 15872, 256, 256]
    - [92, 83086.0]
  - - [16128, 8976, 1, 256, 16128, 16128, 256, 256]
    - [92, 84181.0]
  - - [17152, 8976, 1, 256, 17152, 17152, 256, 256]
    - [92, 84000.0]
  - - [18176, 8976, 1, 256, 18176, 18176, 256, 256]
    - [92, 84355.0]
  - - [18688, 8976, 1, 256, 18688, 18688, 256, 256]
    - [92, 84465.0]
  - - [18944, 8976, 1, 256, 18944, 18944, 256, 256]
    - [92, 84479.0]
  - - [19712, 8976, 1, 256, 19712, 19712, 256, 256]
    - [92, 83669.0]
  - - [19968, 8976, 1, 256, 19968, 19968, 256, 256]
    - [92, 84085.0]
  - - [20480, 8976, 1, 256, 20480, 20480, 256, 256]
    - [92, 83808.0]
  - - [20992, 8976, 1, 256, 20992, 20992, 256, 256]
    - [92, 84047.0]
  - - [21248, 8976, 1, 256, 21248, 21248, 256, 256]
    - [92, 83684.0]
  - - [23552, 8976, 1, 256, 23552, 23552, 256, 256]
    - [92, 84025.0]
  - - [28672, 8976, 1, 256, 28672, 28672, 256, 256]
    - [92, 85025.0]
  - - [31488, 8976, 1, 256, 31488, 31488, 256, 256]
    - [92, 84598.0]
  - - [33536, 8976, 1, 256, 33536, 33536, 256, 256]
    - [92, 85282.0]
  - - [2048, 1024, 1, 2048, 2048, 2048, 2048, 2048]
    - [120, 80732.0]
  - - [2048, 1024, 1, 8192, 2048, 2048, 8192, 8192]
    - [144, 90802.0]
  - - [2048, 2, 1, 2048, 2048, 2048, 2048, 1048576]
    - [195, 807.0]
  - - [30592, 1024, 1, 2048, 30592, 30592, 2048, 2048]
    - [106, 115239.0]
  - - [6144, 1024, 1, 2048, 6144, 6144, 2048, 2048]
    - [34, 88495.0]
  - - [8192, 1024, 1, 2048, 8192, 8192, 2048, 2048]
    - [39, 93940.0]
  - - [1024, 16, 1, 1024, 1024, 1024, 1024, 524288]
    - [193, 3438.0]
  - - [30592, 8192, 1, 1024, 30592, 30592, 1024, 1024]
    - [138, 115910.0]
  - - [3072, 8192, 1, 1024, 3072, 3072, 1024, 1024]
    - [47, 102521.0]
  - - [512, 512, 256, 64, 512, 512, 64, 64]
    - [115, 43970.0]
  - - [64, 512, 256, 512, 64, 64, 512, 512]
    - [49, 44964.0]
  - - [30592, 2048, 1, 1024, 30592, 30592, 1024, 1024]
    - [138, 110690.0]
  - - [3072, 2048, 1, 1024, 3072, 3072, 1024, 1024]
    - [99, 84591.0]
  - - [1024, 8, 1, 1024, 1024, 1024, 1024, 524288]
    - [190, 1664.0]
  - - [30592, 4096, 1, 1024, 30592, 30592, 1024, 1024]
    - [138, 112927.0]
  - - [3072, 4096, 1, 1024, 3072, 3072, 1024, 1024]
    - [133, 91721.0]
  - - [64, 512, 128, 512, 64, 64, 512, 512]
    - [55, 41489.0]
  - - [1920, 2048, 1, 2560, 1920, 1920, 2560, 2560]
    - [72, 109227.0]
  - - [2560, 2048, 1, 2560, 2560, 2560, 2560, 2560]
    - [57, 95109.0]
  - - [2560, 2048, 1, 640, 2560, 2560, 640, 640]
    - [143, 78840.0]
  - - [2560, 4, 1, 2560, 2560, 2560, 2560, 1310720]
    - [194, 2199.0]
  - - [7680, 2048, 1, 2560, 7680, 7680, 2560, 2560]
    - [97, 119837.0]
  - - [512, 512, 40, 64, 512, 512, 64, 64]
    - [115, 36792.0]
  - - [64, 512, 40, 512, 64, 64, 512, 512]
    - [63, 35395.0]
  - - [1536, 4096, 1, 1536, 1536, 1536, 1536, 1536]
    - [43, 86841.0]
  - - [1536, 4096, 1, 6144, 1536, 1536, 6144, 6144]
    - [84, 98730.0]
  - - [4608, 4096, 1, 1536, 4608, 4608, 1536, 1536]
    - [79, 107501.0]
  - - [50304, 4096, 1, 1536, 50304, 50304, 1536, 1536]
    - [99, 117265.0]
  - - [6144, 4096, 1, 1536, 6144, 6144, 1536, 1536]
    - [92, 103598.0]
  - - [1024, 1024, 64, 96, 1024, 1024, 96, 96]
    - [79, 64168.0]
  - - [96, 1024, 64, 1024, 96, 96, 1024, 1024]
    - [155, 61193.0]
  - - [1536, 8192, 1, 1536, 1536, 1536, 1536, 1536]
    - [135, 97142.0]
  - - [1536, 8192, 1, 6144, 1536, 1536, 6144, 6144]
    - [53, 109206.0]
  - - [4608, 8192, 1, 1536, 4608, 4608, 1536, 1536]
    - [97, 110636.0]
  - - [50304, 8192, 1, 1536, 50304, 50304, 1536, 1536]
    - [92, 118840.0]
  - - [6144, 8192, 1, 1536, 6144, 6144, 1536, 1536]
    - [138, 113770.0]
  - - [1024, 1024, 128, 96, 1024, 1024, 96, 96]
    - [79, 66719.0]
  - - [96, 1024, 128, 1024, 96, 96, 1024, 1024]
    - [102, 65739.0]
  - - [1024, 16384, 1, 1024, 1024, 1024, 1024, 1024]
    - [47, 93491.0]
  - - [1024, 16384, 1, 4096, 1024, 1024, 4096, 4096]
    - [135, 103406.0]
  - - [3072, 16384, 1, 1024, 3072, 3072, 1024, 1024]
    - [138, 109046.0]
  - - [4096, 16384, 1, 1024, 4096, 4096, 1024, 1024]
    - [138, 107832.0]
  - - [50304, 16384, 1, 1024, 50304, 50304, 1024, 1024]
    - [138, 116033.0]
  - - [1024, 1024, 256, 64, 1024, 1024, 64, 64]
    - [46, 48487.0]
  - - [64, 1024, 256, 1024, 64, 64, 1024, 1024]
    - [76, 50720.0]
  - - [50304, 2048, 1, 1024, 50304, 50304, 1024, 1024]
    - [92, 112487.0]
  - - [1024, 1024, 32, 64, 1024, 1024, 64, 64]
    - [40, 44151.0]
  - - [64, 1024, 32, 1024, 64, 64, 1024, 1024]
    - [127, 43577.0]
  - - [50304, 4096, 1, 1024, 50304, 50304, 1024, 1024]
    - [138, 115811.0]
  - - [1024, 1024, 64, 64, 1024, 1024, 64, 64]
    - [61, 46442.0]
  - - [64, 1024, 64, 1024, 64, 64, 1024, 1024]
    - [63, 46603.0]
  - - [50304, 8192, 1, 1024, 50304, 50304, 1024, 1024]
    - [92, 115664.0]
  - - [1024, 1024, 128, 64, 1024, 1024, 64, 64]
    - [98, 47785.0]
  - - [64, 1024, 128, 1024, 64, 64, 1024, 1024]
    - [94, 49733.0]
  - - [1024, 64, 1, 1024, 1024, 1024, 1024, 131072]
    - [23, 9020.0]
  - - [30528, 8192, 1, 1024, 30528, 30528, 1024, 1024]
    - [138, 117269.0]
  - - [128, 128, 1024, 64, 128, 128, 64, 64]
    - [37, 28436.0]
  - - [64, 128, 1024, 128, 64, 64, 128, 128]
    - [62, 25861.0]
  - - [1024, 3456, 1, 1024, 1024, 1024, 1024, 1024]
    - [111, 85469.0]
  - - [1024, 3456, 1, 480, 1024, 1024, 480, 480]
    - [149, 76106.0]
  - - [1024, 4096, 1, 480, 1024, 1024, 480, 480]
    - [75, 83056.0]
  - - [1024, 6912, 1, 1024, 1024, 1024, 1024, 1024]
    - [106, 94866.0]
  - - [1024, 6912, 1, 480, 1024, 1024, 480, 480]
    - [79, 88658.0]
  - - [1024, 864, 1, 1024, 1024, 1024, 1024, 1024]
    - [140, 53167.0]
  - - [1024, 864, 1, 480, 1024, 1024, 480, 480]
    - [147, 44987.0]
  - - [128, 3456, 1, 256, 128, 128, 256, 256]
    - [32, 23993.0]
  - - [128, 4096, 1, 256, 128, 128, 256, 256]
    - [101, 25041.0]
  - - [128, 55296, 1, 256, 128, 128, 256, 256]
    - [79, 55377.0]
  - - [128, 6912, 1, 256, 128, 128, 256, 256]
    - [17, 33308.0]
  - - [128, 864, 1, 256, 128, 128, 256, 256]
    - [6, 8043.0]
  - - [256, 3456, 1, 512, 256, 256, 512, 512]
    - [128, 43224.0]
  - - [256, 4096, 1, 512, 256, 256, 512, 512]
    - [12, 44739.0]
  - - [256, 55296, 1, 512, 256, 256, 512, 512]
    - [83, 81253.0]
  - - [256, 6912, 1, 512, 256, 256, 512, 512]
    - [134, 56062.0]
  - - [256, 864, 1, 512, 256, 256, 512, 512]
    - [100, 18874.0]
  - - [3456, 1, 1, 256, 3456, 3456, 256, 256]
    - [185, 299.0]
  - - [4096, 1, 1, 256, 4096, 4096, 256, 256]
    - [187, 354.0]
  - - [512, 3456, 1, 1024, 512, 512, 1024, 1024]
    - [129, 69690.0]
  - - [512, 3456, 1, 13, 512, 512, 13, 13]
    - [4, 4424.0]
  - - [512, 4096, 1, 1024, 512, 512, 1024, 1024]
    - [144, 68304.0]
  - - [512, 4096, 1, 13, 512, 512, 13, 13]
    - [45, 4369.0]
  - - [512, 55296, 1, 13, 512, 512, 13, 13]
    - [41, 7891.0]
  - - [512, 6912, 1, 1024, 512, 512, 1024, 1024]
    - [112, 84670.0]
  - - [512, 6912, 1, 13, 512, 512, 13, 13]
    - [122, 5809.0]
  - - [512, 864, 1, 1024, 512, 512, 1024, 1024]
    - [150, 35389.0]
  - - [512, 864, 1, 13, 512, 512, 13, 13]
    - [1, 1672.0]
  - - [6912, 1, 1, 256, 6912, 6912, 256, 256]
    - [191, 527.0]
  - - [864, 1, 1, 256, 864, 864, 256, 256]
    - [190, 75.0]
  - - [1024, 32, 1, 1024, 1024, 1024, 1024, 1024]
    - [7, 4462.0]
  - - [30528, 640, 1, 1024, 30528, 30528, 1024, 1024]
    - [113, 106058.0]
  - - [30528, 1280, 1, 1024, 30528, 30528, 1024, 1024]
    - [138, 109398.0]
  - - [1024, 64, 1, 1024, 1024, 1024, 1024, 1024]
    - [14, 8648.0]
  - - [30528, 1600, 1, 1024, 30528, 30528, 1024, 1024]
    - [113, 104254.0]
  - - [1024, 10240, 1, 1024, 1024, 1024, 1024, 1024]
    - [125, 92692.0]
  - - [1024, 80, 1, 1024, 1024, 1024, 1024, 1024]
    - [15, 10280.0]
  - - [4096, 10240, 1, 1024, 4096, 4096, 1024, 1024]
    - [79, 107783.0]
  - - [1024, 10240, 1, 4096, 1024, 1024, 4096, 4096]
    - [79, 102711.0]
  - - [64, 128, 1280, 128, 64, 64, 128, 128]
    - [80, 26297.0]
  - - [128, 128, 1280, 64, 128, 128, 64, 64]
    - [109, 29178.0]
  - - [1024, 10496, 1, 4096, 1024, 1024, 4096, 4096]
    - [125, 105319.0]
  - - [30528, 1640, 1, 1024, 30528, 30528, 1024, 1024]
    - [148, 102897.0]
  - - [1024, 82, 1, 1024, 1024, 1024, 1024, 1024]
    - [15, 10537.0]
  - - [4096, 10496, 1, 1024, 4096, 4096, 1024, 1024]
    - [138, 104380.0]
  - - [1024, 10496, 1, 1024, 1024, 1024, 1024, 1024]
    - [79, 94487.0]
  - - [64, 128, 1312, 128, 64, 64, 128, 128]
    - [139, 26416.0]
  - - [128, 128, 1312, 64, 128, 128, 64, 64]
    - [48, 29296.0]
  - - [30528, 160, 1, 1024, 30528, 30528, 1024, 1024]
    - [39, 92899.0]
  - - [1024, 12, 1, 1024, 1024, 1024, 1024, 1024]
    - [200, 2420.0]
  - - [30528, 240, 1, 1024, 30528, 30528, 1024, 1024]
    - [67, 97183.0]
  - - [1024, 6144, 1, 1024, 1024, 1024, 1024, 1024]
    - [125, 82680.0]
  - - [4096, 6144, 1, 1024, 4096, 4096, 1024, 1024]
    - [79, 102750.0]
  - - [1024, 6144, 1, 4096, 1024, 1024, 4096, 4096]
    - [34, 96213.0]
  - - [64, 512, 192, 512, 64, 64, 512, 512]
    - [81, 43624.0]
  - - [512, 512, 192, 64, 512, 512, 64, 64]
    - [46, 43250.0]
  - - [2, 8, 1, 1024, 2, 2, 1024, 1024]
    - [180, 3.0]
  - - [30522, 77, 1, 1024, 30522, 30522, 1024, 1024]
    - [166, 46281.0]
  - - [30522, 616, 1, 1024, 30522, 30522, 1024, 1024]
    - [176, 88804.0]
  - - [2, 10, 1, 1024, 2, 2, 1024, 1024]
    - [183, 4.0]
  - - [30522, 160, 1, 1024, 30522, 30522, 1024, 1024]
    - [161, 85982.0]
  - - [30522, 200, 1, 1024, 30522, 30522, 1024, 1024]
    - [178, 68063.0]
  - - [2, 39, 1, 1024, 2, 2, 1024, 1024]
    - [193, 17.0]
  - - [30522, 780, 1, 1024, 30522, 30522, 1024, 1024]
    - [175, 93619.0]
  - - [2, 4, 1, 1024, 2, 2, 1024, 1024]
    - [188, 2.0]
  - - [30522, 308, 1, 1024, 30522, 30522, 1024, 1024]
    - [159, 81635.0]
  - - [2, 40, 1, 1024, 2, 2, 1024, 1024]
    - [189, 17.0]
  - - [30522, 800, 1, 1024, 30522, 30522, 1024, 1024]
    - [171, 99823.0]
  - - [2, 41, 1, 1024, 2, 2, 1024, 1024]
    - [203, 18.0]
  - - [30522, 820, 1, 1024, 30522, 30522, 1024, 1024]
    - [172, 91348.0]
  - - [2, 5, 1, 1024, 2, 2, 1024, 1024]
    - [182, 2.0]
  - - [30522, 385, 1, 1024, 30522, 30522, 1024, 1024]
    - [177, 79499.0]
  - - [2, 6, 1, 1024, 2, 2, 1024, 1024]
    - [197, 3.0]
  - - [30522, 462, 1, 1024, 30522, 30522, 1024, 1024]
    - [168, 86860.0]
  - - [2, 9, 1, 1024, 2, 2, 1024, 1024]
    - [189, 4.0]
  - - [30522, 180, 1, 1024, 30522, 30522, 1024, 1024]
    - [169, 64575.0]
  - - [2, 32, 1, 1024, 2, 2, 1024, 1024]
    - [189, 14.0]
  - - [4, 4, 32768, 64, 4, 4, 2097152, 2097152]
    - [196, 1028.0]
  - - [4, 4, 38400, 64, 4, 4, 2457600, 2457600]
    - [202, 1037.0]
  - - [14, 14, 10880, 64, 14, 14, 696320, 696320]
    - [187, 4713.0]
  - - [15, 14, 10880, 64, 15, 15, 696320, 696320]
    - [187, 5022.0]
  - - [15, 15, 7680, 64, 15, 15, 491520, 491520]
    - [198, 4686.0]
  - - [15, 15, 10880, 64, 15, 15, 696320, 696320]
    - [187, 5265.0]
  - - [17, 15, 7680, 64, 17, 17, 491520, 491520]
    - [160, 4145.0]
  - - [17, 17, 6144, 64, 17, 17, 393216, 393216]
    - [160, 3728.0]
  - - [17, 17, 7680, 64, 17, 17, 491520, 491520]
    - [158, 4530.0]
  - - [21, 17, 6144, 64, 21, 21, 393216, 393216]
    - [160, 4198.0]
  - - [21, 21, 6144, 64, 21, 21, 393216, 393216]
    - [179, 4733.0]
  - - [30, 30, 2048, 64, 30, 30, 131072, 131072]
    - [165, 6275.0]
  - - [30, 31, 2048, 64, 30, 30, 131072, 131072]
    - [170, 6322.0]
  - - [31, 31, 2048, 64, 31, 31, 131072, 131072]
    - [160, 6375.0]
  - - [34, 24, 4736, 64, 34, 34, 303104, 303104]
    - [164, 7847.0]
  - - [34, 34, 4736, 64, 34, 34, 303104, 303104]
    - [174, 8391.0]
  - - [35, 35, 4608, 64, 35, 35, 294912, 294912]
    - [167, 7936.0]
  - - [2, 2048, 1, 1024, 2, 2, 1024, 1024]
    - [203, 874.0]
  - - [2, 1024, 1, 1024, 2, 2, 1024, 1024]
    - [203, 437.0]
  - - [5, 5, 1, 64, 5, 5, 64, 64]
    - [157, 1.0]
  - - [33, 33, 1, 32, 33, 33, 32, 32]
    - [160, 13.0]
  - - [3, 3, 512, 64, 3, 3, 64, 64]
    - [185, 132.0]
  - - [5, 5, 512, 64, 5, 5, 64, 64]
    - [185, 366.0]
  - - [5, 5, 960, 64, 5, 5, 64, 64]
    - [186, 600.0]
  - - [9, 9, 512, 64, 9, 9, 64, 64]
    - [187, 1144.0]
  - - [27, 27, 32768, 128, 27, 27, 128, 128]
    - [163, 11321.0]
  - - [33, 33, 1600, 32, 33, 33, 32, 32]
    - [162, 4468.0]
  - - [684, 8976, 1, 256, 684, 684, 256, 256]
    - [173, 53243.0]
  - - [44505, 8976, 1, 256, 44505, 44505, 256, 256]
    - [178, 82197.0]
  - - [2, 2, 1, 2048, 2, 2, 2048, 2048]
    - [157, 1.0]
  - - [2, 16, 1, 1024, 2, 2, 1024, 1024]
    - [189, 7.0]
  - - [2, 4, 1, 2560, 2, 2, 2560, 2560]
    - [181, 3.0]
  - - [2, 64, 1, 1024, 2, 2, 1024, 1024]
    - [203, 28.0]
  - - [2, 80, 1, 1024, 2, 2, 1024, 1024]
    - [189, 34.0]
  - - [2, 82, 1, 1024, 2, 2, 1024, 1024]
    - [189, 36.0]
  - - [2, 12, 1, 1024, 2, 2, 1024, 1024]
    - [189, 5.0]
  - - [2, 1, 1, 1024, 2, 2, 1024, 1024]
    - [184, 0.0]
  - - [1, 4096, 1, 256, 1, 1, 256, 256]
    - [185, 354.0]
  - - [1, 6912, 1, 256, 1, 1, 256, 256]
    - [187, 514.0]
- null
