TRAIN_3.9/logic/gemm/arcturus_Cijk_Ailk_Bljk_HBH.yaml
- {MinimumRequiredVersion: 4.22.0}
- arcturus
- gfx908
- [Device 7380, Device 7388, Device 738c, Device 7390]
    SolutionIndex: 0
    SolutionNameMin: Cijk_Ailk_Bljk_HBH_MT32x32x32_MI16x16x16x1_SE_GRVW2_GSU1_PLR2_SU0_SUS256_SRVW4_VAW2_WGM1
    SolutionIndex: 1
    SolutionNameMin: Cijk_Ailk_Bljk_HBH_MT64x64x32_MI32x32x8x1_SE_GRVW2_GSU1_PLR5_SU0_SUS256_SRVW4_VAW2_WGM1
    SolutionIndex: 2
    SolutionNameMin: Cijk_Ailk_Bljk_HBH_MT64x128x32_MI32x32x8x1_SE_GRVW2_GSU1_PLR5_SU0_SUS256_SRVW4_VAW2_WGM1
    SolutionIndex: 3
    SolutionNameMin: Cijk_Ailk_Bljk_HBH_MT128x64x32_MI32x32x8x1_SE_GRVW2_GSU1_PLR5_SU0_SUS256_SRVW4_VAW2_WGM1
    SolutionIndex: 4
    SolutionNameMin: Cijk_Ailk_Bljk_HBH_MT64x64x64_MI32x32x8x1_SE_GRVW2_GSU1_PLR9_SU0_SUS256_SRVW4_VAW2_WGM1
    SolutionIndex: 5
    SolutionNameMin: Cijk_Ailk_Bljk_HBH_MT32x32x32_MI16x16x16x1_SE_GRVW4_GSU1_PLR2_SU0_SUS256_SRVW4_VAW2_WGM1
    SolutionIndex: 6
    SolutionNameMin: Cijk_Ailk_Bljk_HBH_MT32x64x32_MI16x16x16x1_SE_GRVW4_GSU1_PLR2_SU0_SUS256_SRVW4_VAW2_WGM1
    SolutionIndex: 7
    SolutionNameMin: Cijk_Ailk_Bljk_HBH_MT64x64x32_MI32x32x8x1_SE_GRVW4_GSU1_PLR5_SU0_SUS256_SRVW4_VAW2_WGM1
    SolutionIndex: 8
    SolutionNameMin: Cijk_Ailk_Bljk_HBH_MT128x64x32_MI32x32x8x1_SE_GRVW4_GSU1_PLR5_SU0_SUS256_SRVW4_VAW2_WGM1
    SolutionIndex: 9
    SolutionNameMin: Cijk_Ailk_Bljk_HBH_MT128x96x32_MI32x32x8x1_SE_GRVW4_GSU1_PLR5_SU0_SUS256_SRVW4_VAW2_WGM1
    SolutionIndex: 10
    SolutionNameMin: Cijk_Ailk_Bljk_HBH_MT128x288x32_MI32x32x8x1_SE_GRVW4_GSU1_PLR5_SU0_SUS256_SRVW4_VAW2_WGM1
    SolutionIndex: 11
    SolutionNameMin: Cijk_Ailk_Bljk_HBH_MT128x160x32_MI32x32x8x1_SE_GRVW4_GSU1_PLR5_SU0_SUS256_SRVW4_VAW2_WGM1
    SolutionIndex: 12
    SolutionNameMin: Cijk_Ailk_Bljk_HBH_MT256x160x32_MI32x32x8x1_SE_GRVW4_GSU1_PLR5_SU0_SUS256_SRVW4_VAW2_WGM1
    SolutionIndex: 13
    SolutionNameMin: Cijk_Ailk_Bljk_HBH_MT32x32x32_MI16x16x16x1_SE_GRVW8_GSU1_PLR2_SU0_SUS256_SRVW4_VAW2_WGM1
    SolutionIndex: 14
    SolutionNameMin: Cijk_Ailk_Bljk_HBH_MT64x64x32_MI32x32x8x1_SE_GRVW8_GSU1_PLR5_SU0_SUS256_SRVW4_VAW2_WGM1
    SolutionIndex: 15
    SolutionNameMin: Cijk_Ailk_Bljk_HBH_MT64x128x32_MI32x32x8x1_SE_GRVW8_GSU1_PLR5_SU0_SUS256_SRVW4_VAW2_WGM1
    SolutionIndex: 16
    SolutionNameMin: Cijk_Ailk_Bljk_HBH_MT32x32x64_MI16x16x16x1_SE_GRVW8_GSU1_PLR5_SU0_SUS256_SRVW4_VAW2_WGM1
    SolutionIndex: 17
    SolutionNameMin: Cijk_Ailk_Bljk_HBH_MT32x64x64_MI16x16x16x1_SE_GRVW8_GSU1_PLR5_SU0_SUS256_SRVW4_VAW2_WGM1
    SolutionIndex: 18
    SolutionNameMin: Cijk_Ailk_Bljk_HBH_MT64x32x64_MI16x16x16x1_SE_GRVW8_GSU1_PLR5_SU0_SUS256_SRVW4_VAW2_WGM1
    SolutionIndex: 19
    SolutionNameMin: Cijk_Ailk_Bljk_HBH_MT64x64x64_MI32x32x8x1_SE_GRVW8_GSU1_PLR9_SU0_SUS256_SRVW4_VAW2_WGM1
    SolutionIndex: 20
    SolutionNameMin: Cijk_Ailk_Bljk_HBH_MT64x128x64_MI32x32x8x1_SE_GRVW8_GSU1_PLR9_SU0_SUS256_SRVW4_VAW2_WGM1
    SolutionIndex: 21
    SolutionNameMin: Cijk_Ailk_Bljk_HBH_MT128x64x64_MI32x32x8x1_SE_GRVW8_GSU1_PLR9_SU0_SUS256_SRVW4_VAW2_WGM1
    SolutionIndex: 22
    SolutionNameMin: Cijk_Ailk_Bljk_HBH_MT128x96x64_MI32x32x8x1_SE_GRVW8_GSU1_PLR9_SU0_SUS256_SRVW4_VAW2_WGM1
    SolutionIndex: 23
    SolutionNameMin: Cijk_Ailk_Bljk_HBH_MT32x32x64_MI16x16x16x1_SE_GRVW2_GSU1_PLR5_SU32_SUS128_SRVW4_VAW2_WGM1
    SolutionIndex: 24
    SolutionNameMin: Cijk_Ailk_Bljk_HBH_MT128x96x32_MI32x32x8x1_SE_GRVW4_GSU1_PLR5_SU32_SUS128_SRVW4_VAW2_WGM1
    SolutionIndex: 25
    SolutionNameMin: Cijk_Ailk_Bljk_HBH_MT256x160x32_MI32x32x8x1_SE_GRVW4_GSU1_PLR5_SU32_SUS128_SRVW4_VAW2_WGM1
    SolutionIndex: 26
    SolutionNameMin: Cijk_Ailk_Bljk_HBH_MT32x32x64_MI16x16x16x1_SE_GRVW4_GSU1_PLR5_SU32_SUS128_SRVW4_VAW2_WGM1
    SolutionIndex: 27
    SolutionNameMin: Cijk_Ailk_Bljk_HBH_MT32x32x64_MI16x16x16x1_SE_GRVW8_GSU1_PLR5_SU32_SUS128_SRVW4_VAW2_WGM1
    SolutionIndex: 28
    SolutionNameMin: Cijk_Ailk_Bljk_HBH_MT32x64x64_MI16x16x16x1_SE_GRVW8_GSU1_PLR5_SU32_SUS128_SRVW4_VAW2_WGM1
    SolutionIndex: 29
    SolutionNameMin: Cijk_Ailk_Bljk_HBH_MT64x64x64_MI32x32x8x1_SE_GRVW8_GSU1_PLR9_SU32_SUS128_SRVW4_VAW2_WGM1
    SolutionIndex: 30
    SolutionNameMin: Cijk_Ailk_Bljk_HBH_MT64x128x64_MI32x32x8x1_SE_GRVW8_GSU1_PLR9_SU32_SUS128_SRVW4_VAW2_WGM1
    SolutionIndex: 31
    SolutionNameMin: Cijk_Ailk_Bljk_HBH_MT128x96x64_MI32x32x8x1_SE_GRVW8_GSU1_PLR9_SU32_SUS128_SRVW4_VAW2_WGM1
    SolutionIndex: 32
    SolutionNameMin: Cijk_Ailk_Bljk_HBH_MT64x128x32_MI32x32x8x1_SE_GRVW8_GSU1_PLR5_SU32_SUS256_SRVW4_VAW2_WGM1
    SolutionIndex: 33
    SolutionNameMin: Cijk_Ailk_Bljk_HBH_MT64x64x64_MI32x32x8x1_SE_GRVW8_GSU1_PLR9_SU32_SUS256_SRVW4_VAW2_WGM1
    SolutionIndex: 34
    SolutionNameMin: Cijk_Ailk_Bljk_HBH_MT64x128x64_MI32x32x8x1_SE_GRVW8_GSU1_PLR9_SU32_SUS256_SRVW4_VAW2_WGM1
    SolutionIndex: 35
    SolutionNameMin: Cijk_Ailk_Bljk_HBH_MT96x128x64_MI32x32x8x1_SE_GRVW8_GSU1_PLR9_SU32_SUS256_SRVW0_VAW2_WGM1
    SolutionIndex: 36
    SolutionNameMin: Cijk_Ailk_Bljk_HBH_MT64x64x32_MI32x32x8x1_SE_GRVW2_GSU1_PLR5_SU0_SUS256_SRVW4_VAW2_WGM2
    SolutionIndex: 37
    SolutionNameMin: Cijk_Ailk_Bljk_HBH_MT32x32x32_MI16x16x16x1_SE_GRVW4_GSU1_PLR2_SU0_SUS256_SRVW4_VAW2_WGM2
    SolutionIndex: 38
    SolutionNameMin: Cijk_Ailk_Bljk_HBH_MT256x160x32_MI32x32x8x1_SE_GRVW4_GSU1_PLR5_SU0_SUS256_SRVW4_VAW2_WGM2
    SolutionIndex: 39
    SolutionNameMin: Cijk_Ailk_Bljk_HBH_MT64x128x32_MI32x32x8x1_SE_GRVW8_GSU1_PLR5_SU0_SUS256_SRVW4_VAW2_WGM2
    SolutionIndex: 40
    SolutionNameMin: Cijk_Ailk_Bljk_HBH_MT128x256x32_MI32x32x8x1_SE_GRVW8_GSU1_PLR5_SU0_SUS256_SRVW4_VAW2_WGM2
    SolutionIndex: 41
    SolutionNameMin: Cijk_Ailk_Bljk_HBH_MT256x128x32_MI32x32x8x1_SE_GRVW8_GSU1_PLR5_SU0_SUS256_SRVW4_VAW2_WGM2
    SolutionIndex: 42
    SolutionNameMin: Cijk_Ailk_Bljk_HBH_MT32x32x64_MI16x16x16x1_SE_GRVW8_GSU1_PLR5_SU0_SUS256_SRVW4_VAW2_WGM2
    SolutionIndex: 43
    SolutionNameMin: Cijk_Ailk_Bljk_HBH_MT64x32x64_MI16x16x16x1_SE_GRVW8_GSU1_PLR5_SU0_SUS256_SRVW4_VAW2_WGM2
    SolutionIndex: 44
    SolutionNameMin: Cijk_Ailk_Bljk_HBH_MT64x128x32_MI32x32x8x1_SE_GRVW2_GSU1_PLR5_SU32_SUS128_SRVW4_VAW2_WGM2
    SolutionIndex: 45
    SolutionNameMin: Cijk_Ailk_Bljk_HBH_MT128x288x32_MI32x32x8x1_SE_GRVW4_GSU1_PLR5_SU32_SUS128_SRVW4_VAW2_WGM2
    SolutionIndex: 46
    SolutionNameMin: Cijk_Ailk_Bljk_HBH_MT128x160x32_MI32x32x8x1_SE_GRVW4_GSU1_PLR5_SU32_SUS128_SRVW4_VAW2_WGM2
    SolutionIndex: 47
    SolutionNameMin: Cijk_Ailk_Bljk_HBH_MT256x160x32_MI32x32x8x1_SE_GRVW4_GSU1_PLR5_SU32_SUS128_SRVW4_VAW2_WGM2
    SolutionIndex: 48
    SolutionNameMin: Cijk_Ailk_Bljk_HBH_MT32x32x64_MI16x16x16x1_SE_GRVW8_GSU1_PLR5_SU32_SUS128_SRVW4_VAW2_WGM2
    SolutionIndex: 49
    SolutionNameMin: Cijk_Ailk_Bljk_HBH_MT32x64x64_MI16x16x16x1_SE_GRVW8_GSU1_PLR5_SU32_SUS128_SRVW4_VAW2_WGM2
    SolutionIndex: 50
    SolutionNameMin: Cijk_Ailk_Bljk_HBH_MT64x128x64_MI32x32x8x1_SE_GRVW8_GSU1_PLR9_SU32_SUS128_SRVW4_VAW2_WGM2
    SolutionIndex: 51
    SolutionNameMin: Cijk_Ailk_Bljk_HBH_MT128x96x64_MI32x32x8x1_SE_GRVW8_GSU1_PLR9_SU32_SUS128_SRVW4_VAW2_WGM2
    SolutionIndex: 52
    SolutionNameMin: Cijk_Ailk_Bljk_HBH_MT96x128x64_MI32x32x8x1_SE_GRVW8_GSU1_PLR9_SU32_SUS128_SRVW0_VAW2_WGM2
    SolutionIndex: 53
    SolutionNameMin: Cijk_Ailk_Bljk_HBH_MT64x64x64_MI32x32x8x1_SE_GRVW8_GSU1_PLR9_SU32_SUS256_SRVW4_VAW2_WGM2
    SolutionIndex: 54
    SolutionNameMin: Cijk_Ailk_Bljk_HBH_MT64x128x64_MI32x32x8x1_SE_GRVW8_GSU1_PLR9_SU32_SUS256_SRVW4_VAW2_WGM2
    SolutionIndex: 55
    SolutionNameMin: Cijk_Ailk_Bljk_HBH_MT128x96x64_MI32x32x8x1_SE_GRVW8_GSU1_PLR9_SU32_SUS256_SRVW4_VAW2_WGM2
    SolutionIndex: 56
    SolutionNameMin: Cijk_Ailk_Bljk_HBH_MT32x32x32_MI16x16x16x1_SE_GRVW4_GSU1_PLR2_SU0_SUS256_SRVW4_VAW2_WGM15
    SolutionIndex: 57
    SolutionNameMin: Cijk_Ailk_Bljk_HBH_MT256x128x32_MI32x32x8x1_SE_GRVW4_GSU1_PLR5_SU0_SUS256_SRVW4_VAW2_WGM15
    SolutionIndex: 58
    SolutionNameMin: Cijk_Ailk_Bljk_HBH_MT128x96x32_MI32x32x8x1_SE_GRVW4_GSU1_PLR5_SU0_SUS256_SRVW4_VAW2_WGM15
    SolutionIndex: 59
    SolutionNameMin: Cijk_Ailk_Bljk_HBH_MT128x288x32_MI32x32x8x1_SE_GRVW4_GSU1_PLR5_SU0_SUS256_SRVW4_VAW2_WGM15
    SolutionIndex: 60
    SolutionNameMin: Cijk_Ailk_Bljk_HBH_MT256x160x32_MI32x32x8x1_SE_GRVW4_GSU1_PLR5_SU0_SUS256_SRVW4_VAW2_WGM15
    SolutionIndex: 61
    SolutionNameMin: Cijk_Ailk_Bljk_HBH_MT64x64x32_MI32x32x8x1_SE_GRVW8_GSU1_PLR5_SU0_SUS256_SRVW4_VAW2_WGM15
    SolutionIndex: 62
    SolutionNameMin: Cijk_Ailk_Bljk_HBH_MT64x128x32_MI32x32x8x1_SE_GRVW8_GSU1_PLR5_SU0_SUS256_SRVW4_VAW2_WGM15
    SolutionIndex: 63
    SolutionNameMin: Cijk_Ailk_Bljk_HBH_MT256x128x32_MI32x32x8x1_SE_GRVW8_GSU1_PLR5_SU0_SUS256_SRVW4_VAW2_WGM15
    SolutionIndex: 64
    SolutionNameMin: Cijk_Ailk_Bljk_HBH_MT32x32x64_MI16x16x16x1_SE_GRVW8_GSU1_PLR5_SU0_SUS256_SRVW4_VAW2_WGM15
    SolutionIndex: 65
    SolutionNameMin: Cijk_Ailk_Bljk_HBH_MT64x64x64_MI32x32x8x1_SE_GRVW8_GSU1_PLR9_SU0_SUS256_SRVW4_VAW2_WGM15
    SolutionIndex: 66
    SolutionNameMin: Cijk_Ailk_Bljk_HBH_MT64x128x64_MI32x32x8x1_SE_GRVW8_GSU1_PLR9_SU0_SUS256_SRVW4_VAW2_WGM15
    SolutionIndex: 67
    SolutionNameMin: Cijk_Ailk_Bljk_HBH_MT128x96x64_MI32x32x8x1_SE_GRVW8_GSU1_PLR9_SU0_SUS256_SRVW4_VAW2_WGM15
    SolutionIndex: 68
    SolutionNameMin: Cijk_Ailk_Bljk_HBH_MT256x160x32_MI32x32x8x1_SE_GRVW4_GSU1_PLR5_SU32_SUS128_SRVW4_VAW2_WGM15
    SolutionIndex: 69
    SolutionNameMin: Cijk_Ailk_Bljk_HBH_MT64x128x64_MI32x32x8x1_SE_GRVW8_GSU1_PLR9_SU32_SUS128_SRVW4_VAW2_WGM15
    SolutionIndex: 70
    SolutionNameMin: Cijk_Ailk_Bljk_HBH_MT128x96x64_MI32x32x8x1_SE_GRVW8_GSU1_PLR9_SU32_SUS128_SRVW4_VAW2_WGM15
    SolutionIndex: 71
    SolutionNameMin: Cijk_Ailk_Bljk_HBH_MT128x128x32_MI32x32x8x1_SE_GRVW4_GSU1_PLR5_SU32_SUS256_SRVW4_VAW2_WGM15
    SolutionIndex: 72
    SolutionNameMin: Cijk_Ailk_Bljk_HBH_MT256x160x32_MI32x32x8x1_SE_GRVW4_GSU1_PLR5_SU32_SUS256_SRVW4_VAW2_WGM15
    SolutionIndex: 73
    SolutionNameMin: Cijk_Ailk_Bljk_HBH_MT64x64x64_MI32x32x8x1_SE_GRVW8_GSU1_PLR9_SU32_SUS256_SRVW4_VAW2_WGM15
    SolutionIndex: 74
    SolutionNameMin: Cijk_Ailk_Bljk_HBH_MT64x128x64_MI32x32x8x1_SE_GRVW8_GSU1_PLR9_SU32_SUS256_SRVW4_VAW2_WGM15
    SolutionIndex: 75
    SolutionNameMin: Cijk_Ailk_Bljk_HBH_MT128x96x64_MI32x32x8x1_SE_GRVW8_GSU1_PLR9_SU32_SUS256_SRVW4_VAW2_WGM15
    SolutionIndex: 76
    SolutionNameMin: Cijk_Ailk_Bljk_HBH_MT32x64x32_MI16x16x16x1_SE_GRVW2_GSU1_PLR2_SU0_SUS256_SRVW4_VAW2_WGM1
    SolutionIndex: 77
    SolutionNameMin: Cijk_Ailk_Bljk_HBH_MT64x32x32_MI16x16x16x1_SE_GRVW2_GSU1_PLR2_SU0_SUS256_SRVW4_VAW2_WGM1
    SolutionIndex: 78
    SolutionNameMin: Cijk_Ailk_Bljk_HBH_MT128x128x32_MI32x32x8x1_SE_GRVW2_GSU1_PLR5_SU0_SUS256_SRVW4_VAW2_WGM1
    SolutionIndex: 79
    SolutionNameMin: Cijk_Ailk_Bljk_HBH_MT128x160x64_MI32x32x8x1_SE_GRVW2_GSU1_PLR9_SU0_SUS256_SRVW4_VAW2_WGM1
    SolutionIndex: 80
    SolutionNameMin: Cijk_Ailk_Bljk_HBH_MT128x256x32_MI32x32x8x1_SE_GRVW8_GSU1_PLR5_SU0_SUS256_SRVW4_VAW2_WGM1
    SolutionIndex: 81
    SolutionNameMin: Cijk_Ailk_Bljk_HBH_MT256x128x32_MI32x32x8x1_SE_GRVW8_GSU1_PLR5_SU0_SUS256_SRVW4_VAW2_WGM1
    SolutionIndex: 82
    SolutionNameMin: Cijk_Ailk_Bljk_HBH_MT256x256x32_MI32x32x8x1_SE_GRVW8_GSU1_PLR5_SU0_SUS256_SRVW4_VAW2_WGM1
    SolutionIndex: 83
    SolutionNameMin: Cijk_Ailk_Bljk_HBH_MT64x32x32_MI16x16x16x1_SE_GRVW2_GSU1_PLR2_SU32_SUS128_SRVW4_VAW2_WGM1
    SolutionIndex: 84
    SolutionNameMin: Cijk_Ailk_Bljk_HBH_MT128x128x32_MI32x32x8x1_SE_GRVW2_GSU1_PLR5_SU32_SUS128_SRVW4_VAW2_WGM1
    SolutionIndex: 85
    SolutionNameMin: Cijk_Ailk_Bljk_HBH_MT256x256x32_MI32x32x8x1_SE_GRVW8_GSU1_PLR5_SU32_SUS128_SRVW4_VAW2_WGM1
    SolutionIndex: 86
    SolutionNameMin: Cijk_Ailk_Bljk_HBH_MT160x160x64_MI16x16x16x1_SE_GRVW8_GSU1_PLR5_SU32_SUS128_SRVW0_VAW2_WGM1
    SolutionIndex: 87
    SolutionNameMin: Cijk_Ailk_Bljk_HBH_MT64x32x32_MI16x16x16x1_SE_GRVW2_GSU1_PLR2_SU32_SUS256_SRVW4_VAW2_WGM1
    SolutionIndex: 88
    SolutionNameMin: Cijk_Ailk_Bljk_HBH_MT128x128x64_MI32x32x8x1_SE_GRVW2_GSU1_PLR9_SU32_SUS256_SRVW4_VAW2_WGM1
    SolutionIndex: 89
    SolutionNameMin: Cijk_Ailk_Bljk_HBH_MT128x256x32_MI32x32x8x1_SE_GRVW8_GSU1_PLR5_SU32_SUS256_SRVW4_VAW2_WGM1
    SolutionIndex: 90
    SolutionNameMin: Cijk_Ailk_Bljk_HBH_MT256x256x32_MI32x32x8x1_SE_GRVW8_GSU1_PLR5_SU32_SUS256_SRVW4_VAW2_WGM1
    SolutionIndex: 91
    SolutionNameMin: Cijk_Ailk_Bljk_HBH_MT64x32x32_MI16x16x16x1_SE_GRVW2_GSU1_PLR2_SU0_SUS256_SRVW4_VAW2_WGM2
    SolutionIndex: 92
    SolutionNameMin: Cijk_Ailk_Bljk_HBH_MT128x128x32_MI32x32x8x1_SE_GRVW2_GSU1_PLR5_SU0_SUS256_SRVW4_VAW2_WGM2
    SolutionIndex: 93
    SolutionNameMin: Cijk_Ailk_Bljk_HBH_MT256x256x32_MI32x32x8x1_SE_GRVW2_GSU1_PLR5_SU0_SUS256_SRVW4_VAW2_WGM2
    SolutionIndex: 94
    SolutionNameMin: Cijk_Ailk_Bljk_HBH_MT128x96x64_MI32x32x8x1_SE_GRVW2_GSU1_PLR9_SU0_SUS256_SRVW4_VAW2_WGM2
    SolutionIndex: 95
    SolutionNameMin: Cijk_Ailk_Bljk_HBH_MT128x160x64_MI32x32x8x1_SE_GRVW2_GSU1_PLR9_SU0_SUS256_SRVW4_VAW2_WGM2
    SolutionIndex: 96
    SolutionNameMin: Cijk_Ailk_Bljk_HBH_MT256x144x64_MI16x16x16x1_SE_GRVW4_GSU1_PLR5_SU0_SUS256_SRVW4_VAW2_WGM2
    SolutionIndex: 97
    SolutionNameMin: Cijk_Ailk_Bljk_HBH_MT128x256x32_MI32x32x8x1_SE_GRVW8_GSU1_PLR5_SU0_SUS256_SRVW4_VAW2_WGM2
    SolutionIndex: 98
    SolutionNameMin: Cijk_Ailk_Bljk_HBH_MT256x256x32_MI32x32x8x1_SE_GRVW8_GSU1_PLR5_SU0_SUS256_SRVW4_VAW2_WGM2
    SolutionIndex: 99
    SolutionNameMin: Cijk_Ailk_Bljk_HBH_MT160x160x64_MI16x16x16x1_SE_GRVW8_GSU1_PLR5_SU0_SUS256_SRVW0_VAW2_WGM2
    SolutionIndex: 100
    SolutionNameMin: Cijk_Ailk_Bljk_HBH_MT32x64x32_MI16x16x16x1_SE_GRVW2_GSU1_PLR2_SU32_SUS128_SRVW4_VAW2_WGM2
    SolutionIndex: 101
    SolutionNameMin: Cijk_Ailk_Bljk_HBH_MT64x32x32_MI16x16x16x1_SE_GRVW2_GSU1_PLR2_SU32_SUS128_SRVW4_VAW2_WGM2
    SolutionIndex: 102
    SolutionNameMin: Cijk_Ailk_Bljk_HBH_MT256x256x32_MI32x32x8x1_SE_GRVW2_GSU1_PLR5_SU32_SUS128_SRVW4_VAW2_WGM2
    SolutionIndex: 103
    SolutionNameMin: Cijk_Ailk_Bljk_HBH_MT64x256x64_MI32x32x8x1_SE_GRVW2_GSU1_PLR9_SU32_SUS128_SRVW4_VAW2_WGM2
    SolutionIndex: 104
    SolutionNameMin: Cijk_Ailk_Bljk_HBH_MT128x96x64_MI32x32x8x1_SE_GRVW2_GSU1_PLR9_SU32_SUS128_SRVW4_VAW2_WGM2
    SolutionIndex: 105
    SolutionNameMin: Cijk_Ailk_Bljk_HBH_MT128x160x64_MI32x32x8x1_SE_GRVW2_GSU1_PLR9_SU32_SUS128_SRVW4_VAW2_WGM2
    SolutionIndex: 106
    SolutionNameMin: Cijk_Ailk_Bljk_HBH_MT128x256x32_MI32x32x8x1_SE_GRVW8_GSU1_PLR5_SU32_SUS128_SRVW4_VAW2_WGM2
    SolutionIndex: 107
    SolutionNameMin: Cijk_Ailk_Bljk_HBH_MT64x32x32_MI16x16x16x1_SE_GRVW2_GSU1_PLR2_SU32_SUS256_SRVW4_VAW2_WGM2
    SolutionIndex: 108
    SolutionNameMin: Cijk_Ailk_Bljk_HBH_MT128x128x32_MI32x32x8x1_SE_GRVW2_GSU1_PLR5_SU32_SUS256_SRVW4_VAW2_WGM2
    SolutionIndex: 109
    SolutionNameMin: Cijk_Ailk_Bljk_HBH_MT128x96x32_MI32x32x8x1_SE_GRVW2_GSU1_PLR5_SU32_SUS256_SRVW4_VAW2_WGM2
    SolutionIndex: 110
    SolutionNameMin: Cijk_Ailk_Bljk_HBH_MT128x128x64_MI32x32x8x1_SE_GRVW2_GSU1_PLR9_SU32_SUS256_SRVW4_VAW2_WGM2
    SolutionIndex: 111
    SolutionNameMin: Cijk_Ailk_Bljk_HBH_MT128x96x64_MI32x32x8x1_SE_GRVW2_GSU1_PLR9_SU32_SUS256_SRVW4_VAW2_WGM2
    SolutionIndex: 112
    SolutionNameMin: Cijk_Ailk_Bljk_HBH_MT128x160x64_MI32x32x8x1_SE_GRVW2_GSU1_PLR9_SU32_SUS256_SRVW4_VAW2_WGM2
    SolutionIndex: 113
    SolutionNameMin: Cijk_Ailk_Bljk_HBH_MT128x256x32_MI32x32x8x1_SE_GRVW8_GSU1_PLR5_SU32_SUS256_SRVW4_VAW2_WGM2
    SolutionIndex: 114
    SolutionNameMin: Cijk_Ailk_Bljk_HBH_MT256x256x32_MI32x32x8x1_SE_GRVW8_GSU1_PLR5_SU32_SUS256_SRVW4_VAW2_WGM2
    SolutionIndex: 115
    SolutionNameMin: Cijk_Ailk_Bljk_HBH_MT64x32x32_MI16x16x16x1_SE_GRVW2_GSU1_PLR2_SU0_SUS256_SRVW4_VAW2_WGM15
    SolutionIndex: 116
    SolutionNameMin: Cijk_Ailk_Bljk_HBH_MT128x128x32_MI32x32x8x1_SE_GRVW2_GSU1_PLR5_SU0_SUS256_SRVW4_VAW2_WGM15
    SolutionIndex: 117
    SolutionNameMin: Cijk_Ailk_Bljk_HBH_MT128x256x32_MI32x32x8x1_SE_GRVW2_GSU1_PLR5_SU0_SUS256_SRVW4_VAW2_WGM15
    SolutionIndex: 118
    SolutionNameMin: Cijk_Ailk_Bljk_HBH_MT256x160x32_MI32x32x8x1_SE_GRVW2_GSU1_PLR5_SU0_SUS256_SRVW4_VAW2_WGM15
    SolutionIndex: 119
    SolutionNameMin: Cijk_Ailk_Bljk_HBH_MT128x128x64_MI32x32x8x1_SE_GRVW2_GSU1_PLR9_SU0_SUS256_SRVW4_VAW2_WGM15
    SolutionIndex: 120
    SolutionNameMin: Cijk_Ailk_Bljk_HBH_MT128x96x64_MI32x32x8x1_SE_GRVW2_GSU1_PLR9_SU0_SUS256_SRVW4_VAW2_WGM15
    SolutionIndex: 121
    SolutionNameMin: Cijk_Ailk_Bljk_HBH_MT128x160x64_MI32x32x8x1_SE_GRVW2_GSU1_PLR9_SU0_SUS256_SRVW4_VAW2_WGM15
    SolutionIndex: 122
    SolutionNameMin: Cijk_Ailk_Bljk_HBH_MT128x256x32_MI32x32x8x1_SE_GRVW8_GSU1_PLR5_SU0_SUS256_SRVW4_VAW2_WGM15
    SolutionIndex: 123
    SolutionNameMin: Cijk_Ailk_Bljk_HBH_MT256x128x32_MI32x32x8x1_SE_GRVW8_GSU1_PLR5_SU0_SUS256_SRVW4_VAW2_WGM15
    SolutionIndex: 124
    SolutionNameMin: Cijk_Ailk_Bljk_HBH_MT160x160x64_MI16x16x16x1_SE_GRVW8_GSU1_PLR5_SU0_SUS256_SRVW0_VAW2_WGM15
    SolutionIndex: 125
    SolutionNameMin: Cijk_Ailk_Bljk_HBH_MT64x32x32_MI16x16x16x1_SE_GRVW2_GSU1_PLR2_SU32_SUS128_SRVW4_VAW2_WGM15
    SolutionIndex: 126
    SolutionNameMin: Cijk_Ailk_Bljk_HBH_MT128x128x32_MI32x32x8x1_SE_GRVW2_GSU1_PLR5_SU32_SUS128_SRVW4_VAW2_WGM15
    SolutionIndex: 127
    SolutionNameMin: Cijk_Ailk_Bljk_HBH_MT256x256x32_MI32x32x8x1_SE_GRVW2_GSU1_PLR5_SU32_SUS128_SRVW4_VAW2_WGM15
    SolutionIndex: 128
    SolutionNameMin: Cijk_Ailk_Bljk_HBH_MT128x160x64_MI32x32x8x1_SE_GRVW2_GSU1_PLR9_SU32_SUS128_SRVW4_VAW2_WGM15
    SolutionIndex: 129
    SolutionNameMin: Cijk_Ailk_Bljk_HBH_MT128x256x32_MI32x32x8x1_SE_GRVW8_GSU1_PLR5_SU32_SUS128_SRVW4_VAW2_WGM15
    SolutionIndex: 130
    SolutionNameMin: Cijk_Ailk_Bljk_HBH_MT32x64x32_MI16x16x16x1_SE_GRVW2_GSU1_PLR2_SU32_SUS256_SRVW4_VAW2_WGM15
    SolutionIndex: 131
    SolutionNameMin: Cijk_Ailk_Bljk_HBH_MT64x32x32_MI16x16x16x1_SE_GRVW2_GSU1_PLR2_SU32_SUS256_SRVW4_VAW2_WGM15
    SolutionIndex: 132
    SolutionNameMin: Cijk_Ailk_Bljk_HBH_MT128x128x32_MI32x32x8x1_SE_GRVW2_GSU1_PLR5_SU32_SUS256_SRVW4_VAW2_WGM15
    SolutionIndex: 133
    SolutionNameMin: Cijk_Ailk_Bljk_HBH_MT128x96x32_MI32x32x8x1_SE_GRVW2_GSU1_PLR5_SU32_SUS256_SRVW4_VAW2_WGM15
    SolutionIndex: 134
    SolutionNameMin: Cijk_Ailk_Bljk_HBH_MT128x160x32_MI32x32x8x1_SE_GRVW2_GSU1_PLR5_SU32_SUS256_SRVW4_VAW2_WGM15
    SolutionIndex: 135
    SolutionNameMin: Cijk_Ailk_Bljk_HBH_MT128x160x64_MI32x32x8x1_SE_GRVW2_GSU1_PLR9_SU32_SUS256_SRVW4_VAW2_WGM15
    SolutionIndex: 136
    SolutionNameMin: Cijk_Ailk_Bljk_HBH_MT256x160x32_MI32x32x8x1_SE_GRVW4_GSU2_PLR5_SU0_SUS256_SRVW0_VAW1_WGM1
    SolutionIndex: 137
    SolutionNameMin: Cijk_Ailk_Bljk_HBH_MT256x160x32_MI32x32x8x1_SE_GRVW4_GSU2_PLR5_SU32_SUS128_SRVW0_VAW1_WGM1
    SolutionIndex: 138
    SolutionNameMin: Cijk_Ailk_Bljk_HBH_MT256x160x32_MI32x32x8x1_SE_GRVW4_GSU2_PLR5_SU32_SUS256_SRVW0_VAW1_WGM1
    SolutionIndex: 139
    SolutionNameMin: Cijk_Ailk_Bljk_HBH_MT256x160x32_MI32x32x8x1_SE_GRVW4_GSU2_PLR5_SU0_SUS256_SRVW0_VAW1_WGM2
    SolutionIndex: 140
    SolutionNameMin: Cijk_Ailk_Bljk_HBH_MT256x128x32_MI32x32x8x1_SE_GRVW8_GSU2_PLR5_SU0_SUS256_SRVW0_VAW1_WGM2
    SolutionIndex: 141
    SolutionNameMin: Cijk_Ailk_Bljk_HBH_MT256x160x32_MI32x32x8x1_SE_GRVW4_GSU2_PLR5_SU32_SUS256_SRVW0_VAW1_WGM2
    SolutionIndex: 142
    SolutionNameMin: Cijk_Ailk_Bljk_HBH_MT256x160x32_MI32x32x8x1_SE_GRVW4_GSU3_PLR5_SU0_SUS256_SRVW0_VAW1_WGM1
    SolutionIndex: 143
    SolutionNameMin: Cijk_Ailk_Bljk_HBH_MT256x128x32_MI32x32x8x1_SE_GRVW8_GSU3_PLR5_SU0_SUS256_SRVW0_VAW1_WGM2
    SolutionIndex: 144
    SolutionNameMin: Cijk_Ailk_Bljk_HBH_MT256x144x64_MI16x16x16x1_SE_GRVW4_GSU5_PLR5_SU0_SUS256_SRVW0_VAW1_WGM1
    SolutionIndex: 145
    SolutionNameMin: Cijk_Ailk_Bljk_HBH_MT160x160x64_MI16x16x16x1_SE_GRVW8_GSU5_PLR5_SU0_SUS256_SRVW0_VAW1_WGM1
    SolutionIndex: 146
    SolutionNameMin: Cijk_Ailk_Bljk_HBH_MT256x144x64_MI16x16x16x1_SE_GRVW4_GSU5_PLR5_SU32_SUS128_SRVW0_VAW1_WGM1
    SolutionIndex: 147
    SolutionNameMin: Cijk_Ailk_Bljk_HBH_MT128x160x64_MI32x32x8x1_SE_GRVW2_GSU5_PLR9_SU32_SUS256_SRVW0_VAW1_WGM15
    SolutionIndex: 148
    SolutionNameMin: Cijk_Ailk_Bljk_HBH_MT64x32x64_MI16x16x16x1_SE_GRVW8_GSU7_PLR5_SU0_SUS256_SRVW0_VAW1_WGM1
    SolutionIndex: 149
    SolutionNameMin: Cijk_Ailk_Bljk_HBH_MT256x160x32_MI32x32x8x1_SE_GRVW4_GSU7_PLR5_SU32_SUS128_SRVW0_VAW1_WGM1
    SolutionIndex: 150
    SolutionNameMin: Cijk_Ailk_Bljk_HBH_MT64x32x64_MI16x16x16x1_SE_GRVW4_GSU7_PLR5_SU0_SUS256_SRVW0_VAW1_WGM2
    SolutionIndex: 151
    SolutionNameMin: Cijk_Ailk_Bljk_HBH_MT128x96x64_MI32x32x8x1_SE_GRVW2_GSU7_PLR9_SU0_SUS256_SRVW0_VAW1_WGM1
    SolutionIndex: 152
    SolutionNameMin: Cijk_Ailk_Bljk_HBH_MT128x128x64_MI32x32x8x1_SE_GRVW2_GSU7_PLR9_SU0_SUS256_SRVW0_VAW1_WGM15
    SolutionIndex: 153
    SolutionNameMin: Cijk_Ailk_Bljk_HBH_MT160x160x64_MI16x16x16x1_SE_GRVW8_GSU7_PLR5_SU0_SUS256_SRVW0_VAW1_WGM15
    SolutionIndex: 154
    SolutionNameMin: Cijk_Ailk_Bljk_HBH_MT160x160x64_MI16x16x16x1_SE_GRVW8_GSU15_PLR5_SU0_SUS256_SRVW0_VAW1_WGM1
    SolutionIndex: 155
    SolutionNameMin: Cijk_Ailk_Bljk_HBH_MT256x144x64_MI16x16x16x1_SE_GRVW4_GSU15_PLR5_SU32_SUS128_SRVW0_VAW1_WGM1
    SolutionIndex: 156
    SolutionNameMin: Cijk_Ailk_Bljk_HBH_MT160x160x64_MI16x16x16x1_SE_GRVW8_GSU15_PLR5_SU0_SUS256_SRVW0_VAW1_WGM2
    SolutionIndex: 157
    SolutionNameMin: Cijk_Ailk_Bljk_HBH_MT96x96x32_MI16x16x16x1_SE_GRVW4_GSU15_PLR2_SU32_SUS128_SRVW0_VAW1_WGM2
    SolutionIndex: 158
    SolutionNameMin: Cijk_Ailk_Bljk_HBH_MT32x32x64_MI16x16x16x1_SE_GRVW2_GSU1_PLR5_SU0_SUS256_SRVW4_VAW2_WGM1
    SolutionIndex: 159
    SolutionNameMin: Cijk_Ailk_Bljk_HBH_MT32x32x64_MI16x16x16x1_SE_GRVW4_GSU1_PLR5_SU0_SUS256_SRVW4_VAW2_WGM1
    SolutionIndex: 160
    SolutionNameMin: Cijk_Ailk_Bljk_HBH_MT128x256x32_MI32x32x8x1_SE_GRVW8_GSU1_PLR5_SU0_SUS256_SRVW4_VAW2_WGM15
    SolutionIndex: 161
    SolutionNameMin: Cijk_Ailk_Bljk_HBH_MT96x96x64_MI16x16x16x1_SE_GRVW8_GSU3_PLR5_SU0_SUS256_SRVW0_VAW1_WGM1
    SolutionIndex: 162
    SolutionNameMin: Cijk_Ailk_Bljk_HBH_MT32x64x64_MI16x16x16x1_SE_GRVW8_GSU5_PLR5_SU0_SUS256_SRVW0_VAW1_WGM2
    SolutionIndex: 163
    SolutionNameMin: Cijk_Ailk_Bljk_HBH_MT64x16x64_MI16x16x16x1_SE_GRVW8_GSU5_PLR5_SU32_SUS256_SRVW0_VAW1_WGM2
- - - [7680, 8192, 1, 8192, 8384, 8384, 8384, 8384]
    - [98, 127485.0]
  - - [3840, 4096, 1, 4096, 4192, 4192, 4192, 4192]
    - [80, 125731.0]
  - - [1920, 2048, 1, 2048, 2080, 2080, 2080, 2080]
    - [97, 117873.0]
  - - [960, 1024, 1, 1024, 1056, 1056, 1056, 1056]
    - [34, 59353.0]
  - - [480, 512, 1, 512, 544, 544, 544, 544]
    - [28, 19418.0]
  - - [8192, 7680, 1, 8192, 8384, 8384, 8384, 8384]
    - [98, 127344.0]
  - - [4096, 3840, 1, 4096, 4192, 4192, 4192, 4192]
    - [80, 125106.0]
  - - [2048, 1920, 1, 2048, 2080, 2080, 2080, 2080]
    - [63, 115044.0]
  - - [1024, 960, 1, 1024, 1056, 1056, 1056, 1056]
    - [51, 61380.0]
  - - [512, 480, 1, 512, 544, 544, 544, 544]
    - [19, 18950.0]
  - - [8192, 8192, 1, 8192, 8384, 8384, 8384, 8384]
    - [12, 123709.0]
  - - [4096, 4096, 1, 4096, 4192, 4192, 4192, 4192]
    - [10, 115845.0]
  - - [2048, 2048, 1, 2048, 2080, 2080, 2080, 2080]
    - [96, 93288.0]
  - - [1024, 1024, 1, 1024, 1056, 1056, 1056, 1056]
    - [51, 63310.0]
  - - [512, 512, 1, 512, 544, 544, 544, 544]
    - [19, 20214.0]
  - - [64, 512, 16, 512, 64, 64, 64, 512]
    - [14, 22075.0]
  - - [64, 512, 128, 512, 64, 64, 64, 512]
    - [20, 36924.0]
  - - [1024, 1, 1, 2, 1024, 1024, 1024, 2]
    - [0, 1.0]
  - - [1024, 1, 1, 1024, 1024, 1024, 1024, 1024]
    - [16, 126.0]
  - - [1024, 8, 1, 1024, 1024, 1024, 1024, 1024]
    - [16, 999.0]
  - - [1024, 77, 1, 1024, 1024, 1024, 1024, 1024]
    - [26, 9011.0]
  - - [1024, 77, 1, 30522, 1024, 1024, 1024, 30522]
    - [157, 31401.0]
  - - [1024, 512, 1, 2, 1024, 1024, 1024, 2]
    - [1, 273.0]
  - - [1024, 512, 1, 1024, 1024, 1024, 1024, 1024]
    - [50, 38568.0]
  - - [1024, 512, 1, 4096, 1024, 1024, 1024, 4096]
    - [21, 38076.0]
  - - [1024, 616, 1, 1024, 1024, 1024, 1024, 1024]
    - [69, 44120.0]
  - - [1024, 4096, 1, 2, 1024, 1024, 1024, 2]
    - [78, 896.0]
  - - [1024, 4096, 1, 1024, 1024, 1024, 1024, 1024]
    - [59, 83755.0]
  - - [1024, 4096, 1, 4096, 1024, 1024, 1024, 4096]
    - [60, 99651.0]
  - - [4096, 512, 1, 1024, 4096, 4096, 4096, 1024]
    - [99, 56041.0]
  - - [4096, 4096, 1, 1024, 4096, 4096, 4096, 1024]
    - [89, 94023.0]
  - - [64, 128, 128, 128, 64, 64, 64, 128]
    - [62, 17120.0]
  - - [64, 128, 160, 128, 64, 64, 64, 128]
    - [2, 17772.0]
  - - [1024, 10, 1, 2, 1024, 1024, 1024, 2]
    - [5, 7.0]
  - - [1024, 10, 1, 1024, 1024, 1024, 1024, 1024]
    - [64, 1237.0]
  - - [1024, 160, 1, 1024, 1024, 1024, 1024, 1024]
    - [49, 16513.0]
  - - [1024, 200, 1, 1024, 1024, 1024, 1024, 1024]
    - [29, 19275.0]
  - - [1024, 200, 1, 30522, 1024, 1024, 1024, 30522]
    - [155, 45936.0]
  - - [1024, 1024, 1, 2, 1024, 1024, 1024, 2]
    - [8, 437.0]
  - - [1024, 1024, 1, 1024, 1024, 1024, 1024, 1024]
    - [67, 55924.0]
  - - [1024, 1024, 1, 4096, 1024, 1024, 1024, 4096]
    - [67, 62719.0]
  - - [1024, 1280, 1, 2, 1024, 1024, 1024, 2]
    - [2, 512.0]
  - - [1024, 1280, 1, 1024, 1024, 1024, 1024, 1024]
    - [70, 59075.0]
  - - [1024, 1280, 1, 4096, 1024, 1024, 1024, 4096]
    - [94, 66052.0]
  - - [4096, 1024, 1, 1024, 4096, 4096, 4096, 1024]
    - [60, 76260.0]
  - - [4096, 1280, 1, 1024, 4096, 4096, 4096, 1024]
    - [110, 73423.0]
  - - [64, 128, 624, 128, 64, 64, 64, 128]
    - [44, 21986.0]
  - - [1024, 39, 1, 2, 1024, 1024, 1024, 2]
    - [13, 27.0]
  - - [1024, 39, 1, 1024, 1024, 1024, 1024, 1024]
    - [27, 4690.0]
  - - [1024, 780, 1, 1024, 1024, 1024, 1024, 1024]
    - [69, 49152.0]
  - - [1024, 780, 1, 30522, 1024, 1024, 1024, 30522]
    - [146, 75728.0]
  - - [1024, 4992, 1, 2, 1024, 1024, 1024, 2]
    - [78, 983.0]
  - - [1024, 4992, 1, 1024, 1024, 1024, 1024, 1024]
    - [94, 74185.0]
  - - [1024, 4992, 1, 4096, 1024, 1024, 1024, 4096]
    - [124, 82407.0]
  - - [4096, 4992, 1, 1024, 4096, 4096, 4096, 1024]
    - [97, 99138.0]
  - - [64, 512, 64, 512, 64, 64, 64, 512]
    - [20, 31805.0]
  - - [1024, 4, 1, 2, 1024, 1024, 1024, 2]
    - [0, 3.0]
  - - [1024, 4, 1, 1024, 1024, 1024, 1024, 1024]
    - [16, 499.0]
  - - [1024, 308, 1, 1024, 1024, 1024, 1024, 1024]
    - [33, 28631.0]
  - - [1024, 308, 1, 30522, 1024, 1024, 1024, 30522]
    - [153, 55400.0]
  - - [1024, 2048, 1, 2, 1024, 1024, 1024, 2]
    - [24, 639.0]
  - - [1024, 2048, 1, 1024, 1024, 1024, 1024, 1024]
    - [95, 63913.0]
  - - [1024, 2048, 1, 4096, 1024, 1024, 1024, 4096]
    - [121, 81903.0]
  - - [4096, 2048, 1, 1024, 4096, 4096, 4096, 1024]
    - [38, 84215.0]
  - - [64, 128, 640, 128, 64, 64, 64, 128]
    - [107, 22251.0]
  - - [1024, 40, 1, 2, 1024, 1024, 1024, 2]
    - [0, 27.0]
  - - [1024, 40, 1, 1024, 1024, 1024, 1024, 1024]
    - [27, 4766.0]
  - - [1024, 800, 1, 1024, 1024, 1024, 1024, 1024]
    - [50, 49229.0]
  - - [1024, 800, 1, 30522, 1024, 1024, 1024, 30522]
    - [144, 77324.0]
  - - [1024, 5120, 1, 2, 1024, 1024, 1024, 2]
    - [78, 1001.0]
  - - [1024, 5120, 1, 1024, 1024, 1024, 1024, 1024]
    - [120, 75150.0]
  - - [1024, 5120, 1, 4096, 1024, 1024, 1024, 4096]
    - [86, 83860.0]
  - - [4096, 5120, 1, 1024, 4096, 4096, 4096, 1024]
    - [80, 103006.0]
  - - [64, 128, 656, 128, 64, 64, 64, 128]
    - [2, 22391.0]
  - - [1024, 41, 1, 2, 1024, 1024, 1024, 2]
    - [0, 28.0]
  - - [1024, 41, 1, 1024, 1024, 1024, 1024, 1024]
    - [27, 4930.0]
  - - [1024, 820, 1, 1024, 1024, 1024, 1024, 1024]
    - [69, 50698.0]
  - - [1024, 820, 1, 30522, 1024, 1024, 1024, 30522]
    - [144, 79081.0]
  - - [1024, 5248, 1, 2, 1024, 1024, 1024, 2]
    - [108, 988.0]
  - - [1024, 5248, 1, 1024, 1024, 1024, 1024, 1024]
    - [94, 75923.0]
  - - [1024, 5248, 1, 4096, 1024, 1024, 1024, 4096]
    - [99, 85449.0]
  - - [4096, 5248, 1, 1024, 4096, 4096, 4096, 1024]
    - [113, 99402.0]
  - - [64, 512, 80, 512, 64, 64, 64, 512]
    - [34, 36712.0]
  - - [1024, 5, 1, 2, 1024, 1024, 1024, 2]
    - [0, 3.0]
  - - [1024, 5, 1, 1024, 1024, 1024, 1024, 1024]
    - [16, 630.0]
  - - [1024, 385, 1, 1024, 1024, 1024, 1024, 1024]
    - [73, 33868.0]
  - - [1024, 385, 1, 30522, 1024, 1024, 1024, 30522]
    - [147, 53680.0]
  - - [1024, 2560, 1, 2, 1024, 1024, 1024, 2]
    - [58, 790.0]
  - - [1024, 2560, 1, 1024, 1024, 1024, 1024, 1024]
    - [99, 67924.0]
  - - [1024, 2560, 1, 4096, 1024, 1024, 1024, 4096]
    - [99, 82953.0]
  - - [4096, 2560, 1, 1024, 4096, 4096, 4096, 1024]
    - [97, 96145.0]
  - - [64, 512, 96, 512, 64, 64, 64, 512]
    - [2, 37915.0]
  - - [1024, 6, 1, 2, 1024, 1024, 1024, 2]
    - [0, 4.0]
  - - [1024, 6, 1, 1024, 1024, 1024, 1024, 1024]
    - [42, 742.0]
  - - [1024, 462, 1, 1024, 1024, 1024, 1024, 1024]
    - [50, 35207.0]
  - - [1024, 462, 1, 30522, 1024, 1024, 1024, 30522]
    - [145, 62412.0]
  - - [1024, 3072, 1, 2, 1024, 1024, 1024, 2]
    - [78, 846.0]
  - - [1024, 3072, 1, 1024, 1024, 1024, 1024, 1024]
    - [81, 73477.0]
  - - [1024, 3072, 1, 4096, 1024, 1024, 1024, 4096]
    - [123, 91982.0]
  - - [4096, 3072, 1, 1024, 4096, 4096, 4096, 1024]
    - [80, 92193.0]
  - - [1024, 8, 1, 2, 1024, 1024, 1024, 2]
    - [0, 5.0]
  - - [1024, 160, 1, 30522, 1024, 1024, 1024, 30522]
    - [154, 47863.0]
  - - [64, 128, 144, 128, 64, 64, 64, 128]
    - [2, 17476.0]
  - - [1024, 9, 1, 2, 1024, 1024, 1024, 2]
    - [0, 6.0]
  - - [1024, 9, 1, 1024, 1024, 1024, 1024, 1024]
    - [16, 1102.0]
  - - [1024, 180, 1, 1024, 1024, 1024, 1024, 1024]
    - [28, 18289.0]
  - - [1024, 180, 1, 30522, 1024, 1024, 1024, 30522]
    - [151, 44906.0]
  - - [1024, 1152, 1, 2, 1024, 1024, 1024, 2]
    - [8, 476.0]
  - - [1024, 1152, 1, 1024, 1024, 1024, 1024, 1024]
    - [51, 58525.0]
  - - [1024, 1152, 1, 4096, 1024, 1024, 1024, 4096]
    - [75, 62524.0]
  - - [4096, 1152, 1, 1024, 4096, 4096, 4096, 1024]
    - [9, 70067.0]
  - - [256, 32768, 1, 128, 256, 256, 256, 128]
    - [92, 45808.0]
  - - [512, 32768, 1, 256, 512, 512, 512, 256]
    - [116, 71870.0]
  - - [1024, 32768, 1, 512, 1024, 1024, 1024, 512]
    - [97, 97171.0]
  - - [1024, 32768, 1, 1024, 1024, 1024, 1024, 1024]
    - [97, 108049.0]
  - - [64, 128, 512, 128, 64, 64, 64, 128]
    - [130, 21372.0]
  - - [128, 128, 512, 64, 128, 128, 128, 64]
    - [108, 23967.0]
  - - [1024, 32, 1, 2, 1024, 1024, 1024, 2]
    - [0, 22.0]
  - - [1024, 32, 1, 1024, 1024, 1024, 1024, 1024]
    - [27, 3848.0]
  - - [1024, 4096, 1, 30528, 1024, 1024, 1024, 30528]
    - [60, 109327.0]
  - - [512, 512, 64, 64, 512, 512, 512, 64]
    - [116, 39592.0]
  - - [1024, 2048, 1, 30528, 1024, 1024, 1024, 30528]
    - [95, 90202.0]
  - - [64, 4, 32768, 4, 64, 64, 2097152, 4]
    - [77, 194.0]
  - - [64, 4, 38400, 4, 64, 64, 2457600, 4]
    - [77, 196.0]
  - - [1024, 8192, 1, 1024, 1024, 1024, 1024, 1024]
    - [59, 84347.0]
  - - [1024, 8192, 1, 4096, 1024, 1024, 1024, 4096]
    - [12, 101969.0]
  - - [1024, 8192, 1, 33712, 1024, 1024, 1024, 33712]
    - [60, 109604.0]
  - - [1024, 9600, 1, 1024, 1024, 1024, 1024, 1024]
    - [60, 105296.0]
  - - [1024, 9600, 1, 4096, 1024, 1024, 1024, 4096]
    - [118, 108520.0]
  - - [1024, 9600, 1, 33712, 1024, 1024, 1024, 33712]
    - [60, 118084.0]
  - - [4096, 8192, 1, 1024, 4096, 4096, 4096, 1024]
    - [80, 103269.0]
  - - [4096, 9600, 1, 1024, 4096, 4096, 4096, 1024]
    - [97, 105340.0]
  - - [1024, 10064, 1, 1024, 1024, 1024, 1024, 1024]
    - [80, 94492.0]
  - - [1024, 10064, 1, 4096, 1024, 1024, 1024, 4096]
    - [122, 104525.0]
  - - [1024, 10080, 1, 1024, 1024, 1024, 1024, 1024]
    - [122, 94642.0]
  - - [1024, 10080, 1, 4096, 1024, 1024, 1024, 4096]
    - [122, 104733.0]
  - - [1024, 10080, 1, 42720, 1024, 1024, 1024, 42720]
    - [57, 111681.0]
  - - [1024, 10200, 1, 1024, 1024, 1024, 1024, 1024]
    - [122, 92139.0]
  - - [1024, 10200, 1, 4096, 1024, 1024, 1024, 4096]
    - [122, 105665.0]
  - - [1024, 3840, 1, 1024, 1024, 1024, 1024, 1024]
    - [63, 90525.0]
  - - [1024, 3840, 1, 4096, 1024, 1024, 1024, 4096]
    - [63, 107546.0]
  - - [1024, 3968, 1, 1024, 1024, 1024, 1024, 1024]
    - [38, 74299.0]
  - - [1024, 3968, 1, 4096, 1024, 1024, 1024, 4096]
    - [12, 96135.0]
  - - [1024, 3968, 1, 42720, 1024, 1024, 1024, 42720]
    - [60, 106486.0]
  - - [1024, 6528, 1, 1024, 1024, 1024, 1024, 1024]
    - [63, 89129.0]
  - - [1024, 6528, 1, 4096, 1024, 1024, 1024, 4096]
    - [123, 101861.0]
  - - [1024, 6528, 1, 42720, 1024, 1024, 1024, 42720]
    - [57, 109089.0]
  - - [1024, 7104, 1, 1024, 1024, 1024, 1024, 1024]
    - [114, 94917.0]
  - - [1024, 7104, 1, 4096, 1024, 1024, 1024, 4096]
    - [85, 110915.0]
  - - [1024, 7104, 1, 42720, 1024, 1024, 1024, 42720]
    - [102, 117033.0]
  - - [1024, 7200, 1, 1024, 1024, 1024, 1024, 1024]
    - [122, 93996.0]
  - - [1024, 7200, 1, 4096, 1024, 1024, 1024, 4096]
    - [82, 109448.0]
  - - [1024, 7200, 1, 42720, 1024, 1024, 1024, 42720]
    - [127, 118740.0]
  - - [1024, 8064, 1, 1024, 1024, 1024, 1024, 1024]
    - [59, 84019.0]
  - - [1024, 8064, 1, 4096, 1024, 1024, 1024, 4096]
    - [72, 100233.0]
  - - [1024, 8160, 1, 1024, 1024, 1024, 1024, 1024]
    - [60, 92123.0]
  - - [1024, 8160, 1, 4096, 1024, 1024, 1024, 4096]
    - [60, 104550.0]
  - - [1024, 9216, 1, 1024, 1024, 1024, 1024, 1024]
    - [60, 91581.0]
  - - [1024, 9216, 1, 4096, 1024, 1024, 1024, 4096]
    - [60, 113610.0]
  - - [1024, 9520, 1, 1024, 1024, 1024, 1024, 1024]
    - [60, 94602.0]
  - - [1024, 9520, 1, 4096, 1024, 1024, 1024, 4096]
    - [60, 109384.0]
  - - [1024, 9520, 1, 42720, 1024, 1024, 1024, 42720]
    - [60, 127235.0]
  - - [4096, 10064, 1, 1024, 4096, 4096, 4096, 1024]
    - [80, 101783.0]
  - - [4096, 10080, 1, 1024, 4096, 4096, 4096, 1024]
    - [80, 101925.0]
  - - [4096, 10200, 1, 1024, 4096, 4096, 4096, 1024]
    - [80, 104325.0]
  - - [4096, 3840, 1, 1024, 4096, 4096, 4096, 1024]
    - [98, 108943.0]
  - - [4096, 3968, 1, 1024, 4096, 4096, 4096, 1024]
    - [113, 92092.0]
  - - [4096, 6528, 1, 1024, 4096, 4096, 4096, 1024]
    - [80, 98236.0]
  - - [4096, 7104, 1, 1024, 4096, 4096, 4096, 1024]
    - [97, 102689.0]
  - - [4096, 7200, 1, 1024, 4096, 4096, 4096, 1024]
    - [98, 100744.0]
  - - [4096, 8064, 1, 1024, 4096, 4096, 4096, 1024]
    - [97, 101387.0]
  - - [4096, 8160, 1, 1024, 4096, 4096, 4096, 1024]
    - [97, 102031.0]
  - - [4096, 9216, 1, 1024, 4096, 4096, 4096, 1024]
    - [98, 107398.0]
  - - [4096, 9520, 1, 1024, 4096, 4096, 4096, 1024]
    - [97, 104835.0]
  - - [64, 14, 10880, 14, 64, 64, 696320, 14]
    - [131, 2036.0]
  - - [64, 14, 10880, 15, 64, 64, 696320, 15]
    - [91, 2200.0]
  - - [64, 15, 7680, 15, 64, 64, 491520, 15]
    - [77, 2316.0]
  - - [64, 15, 10880, 15, 64, 64, 696320, 15]
    - [125, 2331.0]
  - - [64, 15, 7680, 17, 64, 64, 491520, 17]
    - [77, 2377.0]
  - - [64, 17, 6144, 17, 64, 64, 393216, 17]
    - [77, 2569.0]
  - - [64, 17, 7680, 17, 64, 64, 491520, 17]
    - [115, 2686.0]
  - - [64, 17, 6144, 21, 64, 64, 393216, 21]
    - [77, 3084.0]
  - - [64, 21, 6144, 21, 64, 64, 393216, 21]
    - [77, 3731.0]
  - - [64, 24, 4736, 24, 64, 64, 303104, 24]
    - [115, 4775.0]
  - - [64, 24, 4736, 34, 64, 64, 303104, 34]
    - [77, 5205.0]
  - - [64, 30, 2048, 30, 64, 64, 131072, 30]
    - [83, 5738.0]
  - - [64, 31, 2048, 30, 64, 64, 131072, 30]
    - [125, 5838.0]
  - - [64, 31, 2048, 31, 64, 64, 131072, 31]
    - [77, 6010.0]
  - - [64, 32, 4608, 32, 64, 64, 294912, 32]
    - [115, 9779.0]
  - - [64, 34, 4736, 34, 64, 64, 303104, 34]
    - [100, 4966.0]
  - - [64, 35, 4608, 32, 64, 64, 294912, 32]
    - [77, 8766.0]
  - - [64, 35, 4608, 35, 64, 64, 294912, 35]
    - [76, 4814.0]
  - - [64, 512, 1, 512, 64, 64, 64, 512]
    - [16, 3277.0]
  - - [512, 512, 1, 64, 512, 512, 512, 64]
    - [6, 5668.0]
  - - [128, 128, 1, 64, 128, 128, 128, 64]
    - [43, 452.0]
  - - [64, 128, 1, 128, 64, 64, 64, 128]
    - [23, 386.0]
  - - [1024, 512, 1, 64, 1024, 1024, 1024, 64]
    - [61, 10486.0]
  - - [64, 5, 1, 5, 64, 64, 64, 5]
    - [0, 1.0]
  - - [2048, 512, 1, 2048, 2048, 2048, 2048, 2048]
    - [31, 58867.0]
  - - [512, 1600, 1, 512, 512, 512, 512, 512]
    - [69, 42625.0]
  - - [32, 33, 1, 33, 32, 32, 32, 33]
    - [37, 11.0]
  - - [560, 1600, 1, 1024, 560, 560, 560, 1024]
    - [35, 47787.0]
  - - [512, 1600, 1, 32, 512, 512, 512, 32]
    - [14, 9102.0]
  - - [1024, 1600, 1, 1024, 1024, 1024, 1024, 1024]
    - [110, 60787.0]
  - - [32, 33, 1600, 33, 32, 32, 32, 33]
    - [76, 3788.0]
  - - [32, 200, 1, 1, 32, 32, 32, 1]
    - [0, 2.0]
  - - [64, 3, 512, 3, 64, 64, 64, 3]
    - [83, 56.0]
  - - [64, 5, 512, 5, 64, 64, 64, 5]
    - [77, 155.0]
  - - [64, 5, 960, 5, 64, 64, 64, 5]
    - [91, 229.0]
  - - [64, 9, 512, 9, 64, 64, 64, 9]
    - [77, 510.0]
  - - [64, 512, 1, 1, 64, 64, 64, 1]
    - [0, 11.0]
  - - [128, 27, 32768, 27, 128, 128, 128, 27]
    - [77, 6714.0]
  - - [256, 1024, 1, 1, 256, 256, 256, 1]
    - [37, 80.0]
  - - [256, 8976, 1, 1536, 256, 256, 256, 1536]
    - [128, 77401.0]
  - - [256, 8976, 1, 2048, 256, 256, 256, 2048]
    - [95, 80143.0]
  - - [256, 8976, 1, 2304, 256, 256, 256, 2304]
    - [121, 82930.0]
  - - [256, 8976, 1, 2560, 256, 256, 256, 2560]
    - [105, 83844.0]
  - - [256, 8976, 1, 2816, 256, 256, 256, 2816]
    - [128, 84785.0]
  - - [256, 8976, 1, 3072, 256, 256, 256, 3072]
    - [121, 85585.0]
  - - [256, 8976, 1, 4352, 256, 256, 256, 4352]
    - [121, 90060.0]
  - - [256, 8976, 1, 4864, 256, 256, 256, 4864]
    - [95, 81701.0]
  - - [256, 8976, 1, 5376, 256, 256, 256, 5376]
    - [128, 89258.0]
  - - [256, 8976, 1, 5632, 256, 256, 256, 5632]
    - [121, 87965.0]
  - - [256, 8976, 1, 5888, 256, 256, 256, 5888]
    - [95, 86729.0]
  - - [256, 8976, 1, 6144, 256, 256, 256, 6144]
    - [121, 85876.0]
  - - [256, 8976, 1, 6656, 256, 256, 256, 6656]
    - [105, 85159.0]
  - - [256, 8976, 1, 7168, 256, 256, 256, 7168]
    - [105, 89672.0]
  - - [256, 8976, 1, 7424, 256, 256, 256, 7424]
    - [105, 84285.0]
  - - [256, 8976, 1, 8192, 256, 256, 256, 8192]
    - [128, 87700.0]
  - - [256, 8976, 1, 8448, 256, 256, 256, 8448]
    - [105, 89639.0]
  - - [256, 8976, 1, 8960, 256, 256, 256, 8960]
    - [128, 84352.0]
  - - [256, 8976, 1, 9472, 256, 256, 256, 9472]
    - [105, 87397.0]
  - - [256, 8976, 1, 9728, 256, 256, 256, 9728]
    - [128, 84086.0]
  - - [256, 8976, 1, 9984, 256, 256, 256, 9984]
    - [128, 86066.0]
  - - [256, 8976, 1, 10240, 256, 256, 256, 10240]
    - [128, 88994.0]
  - - [256, 8976, 1, 10496, 256, 256, 256, 10496]
    - [128, 87946.0]
  - - [256, 8976, 1, 11008, 256, 256, 256, 11008]
    - [105, 84564.0]
  - - [256, 8976, 1, 11520, 256, 256, 256, 11520]
    - [105, 89697.0]
  - - [256, 8976, 1, 12288, 256, 256, 256, 12288]
    - [128, 85688.0]
  - - [256, 8976, 1, 14336, 256, 256, 256, 14336]
    - [135, 89071.0]
  - - [256, 8976, 1, 14848, 256, 256, 256, 14848]
    - [121, 90051.0]
  - - [256, 8976, 1, 15104, 256, 256, 256, 15104]
    - [105, 87856.0]
  - - [256, 8976, 1, 15872, 256, 256, 256, 15872]
    - [112, 83819.0]
  - - [256, 8976, 1, 17152, 256, 256, 256, 17152]
    - [128, 86310.0]
  - - [256, 8976, 1, 19712, 256, 256, 256, 19712]
    - [138, 87416.0]
  - - [256, 8976, 1, 19968, 256, 256, 256, 19968]
    - [136, 87698.0]
  - - [256, 8976, 1, 20480, 256, 256, 256, 20480]
    - [136, 88499.0]
  - - [256, 8976, 1, 20992, 256, 256, 256, 20992]
    - [137, 88905.0]
  - - [256, 8976, 1, 22016, 256, 256, 256, 22016]
    - [136, 90120.0]
  - - [256, 8976, 1, 26112, 256, 256, 256, 26112]
    - [137, 93952.0]
  - - [256, 8976, 1, 33536, 256, 256, 256, 33536]
    - [138, 98755.0]
  - - [256, 8976, 1, 44505, 256, 256, 256, 44505]
    - [141, 101013.0]
  - - [480, 32768, 1, 1024, 480, 480, 480, 1024]
    - [80, 90281.0]
  - - [512, 200, 1, 1, 512, 512, 512, 1]
    - [13, 40.0]
  - - [512, 200, 1, 32, 512, 512, 512, 32]
    - [5, 1365.0]
  - - [512, 215, 1, 2048, 512, 512, 512, 2048]
    - [48, 13548.0]
  - - [512, 256, 1, 2048, 512, 512, 512, 2048]
    - [17, 15322.0]
  - - [560, 200, 1, 1024, 560, 560, 560, 1024]
    - [17, 11288.0]
  - - [768, 215, 1, 2048, 768, 768, 768, 2048]
    - [53, 18379.0]
  - - [768, 256, 1, 2048, 768, 768, 768, 2048]
    - [53, 21509.0]
  - - [1024, 1, 1, 200, 1024, 1024, 1024, 200]
    - [13, 46.0]
  - - [1024, 1, 1, 1600, 1024, 1024, 1024, 1600]
    - [148, 172.0]
  - - [1024, 200, 1, 1, 1024, 1024, 1024, 1]
    - [115, 69.0]
  - - [1024, 512, 1, 1, 1024, 1024, 1024, 1]
    - [7, 137.0]
  - - [1024, 960, 1, 64, 1024, 1024, 1024, 64]
    - [36, 16733.0]
  - - [1024, 960, 1, 1024, 1024, 1024, 1024, 1024]
    - [55, 55677.0]
  - - [1024, 1600, 1, 1, 1024, 1024, 1024, 1]
    - [3, 315.0]
  - - [1024, 1792, 1, 256, 1024, 1024, 1024, 256]
    - [71, 47355.0]
  - - [1024, 2048, 1, 256, 1024, 1024, 1024, 256]
    - [46, 42745.0]
  - - [1024, 2560, 1, 256, 1024, 1024, 1024, 256]
    - [58, 47935.0]
  - - [1024, 3072, 1, 256, 1024, 1024, 1024, 256]
    - [116, 50332.0]
  - - [1024, 3328, 1, 256, 1024, 1024, 1024, 256]
    - [116, 52938.0]
  - - [1024, 3840, 1, 256, 1024, 1024, 1024, 256]
    - [123, 60495.0]
  - - [1024, 4096, 1, 256, 1024, 1024, 1024, 256]
    - [45, 58103.0]
  - - [1024, 4608, 1, 256, 1024, 1024, 1024, 256]
    - [58, 54315.0]
  - - [1024, 4864, 1, 256, 1024, 1024, 1024, 256]
    - [116, 56519.0]
  - - [1024, 5120, 1, 256, 1024, 1024, 1024, 256]
    - [116, 55554.0]
  - - [1024, 5632, 1, 256, 1024, 1024, 1024, 256]
    - [116, 58034.0]
  - - [1024, 6144, 1, 256, 1024, 1024, 1024, 256]
    - [97, 62138.0]
  - - [1024, 6400, 1, 256, 1024, 1024, 1024, 256]
    - [122, 63167.0]
  - - [1024, 7168, 1, 256, 1024, 1024, 1024, 256]
    - [122, 69491.0]
  - - [1024, 7424, 1, 256, 1024, 1024, 1024, 256]
    - [122, 71340.0]
  - - [1024, 7680, 1, 256, 1024, 1024, 1024, 256]
    - [122, 73370.0]
  - - [1024, 7936, 1, 256, 1024, 1024, 1024, 256]
    - [116, 61622.0]
  - - [1024, 8192, 1, 256, 1024, 1024, 1024, 256]
    - [116, 62719.0]
  - - [1024, 8448, 1, 256, 1024, 1024, 1024, 256]
    - [116, 64228.0]
  - - [1024, 8704, 1, 256, 1024, 1024, 1024, 256]
    - [126, 65266.0]
  - - [1024, 8960, 1, 256, 1024, 1024, 1024, 256]
    - [134, 65978.0]
  - - [1024, 9728, 1, 256, 1024, 1024, 1024, 256]
    - [97, 67250.0]
  - - [1024, 9984, 1, 256, 1024, 1024, 1024, 256]
    - [122, 68443.0]
  - - [1024, 10240, 1, 256, 1024, 1024, 1024, 256]
    - [122, 69327.0]
  - - [1024, 10496, 1, 256, 1024, 1024, 1024, 256]
    - [122, 70768.0]
  - - [1024, 11008, 1, 256, 1024, 1024, 1024, 256]
    - [122, 73614.0]
  - - [1024, 11264, 1, 256, 1024, 1024, 1024, 256]
    - [129, 73672.0]
  - - [1024, 11520, 1, 256, 1024, 1024, 1024, 256]
    - [122, 74898.0]
  - - [1024, 12288, 1, 256, 1024, 1024, 1024, 256]
    - [80, 66444.0]
  - - [1024, 13312, 1, 256, 1024, 1024, 1024, 256]
    - [122, 69020.0]
  - - [1024, 13568, 1, 256, 1024, 1024, 1024, 256]
    - [122, 70348.0]
  - - [1024, 14336, 1, 256, 1024, 1024, 1024, 256]
    - [122, 73978.0]
  - - [1024, 14592, 1, 256, 1024, 1024, 1024, 256]
    - [122, 74594.0]
  - - [1024, 14848, 1, 256, 1024, 1024, 1024, 256]
    - [122, 75785.0]
  - - [1024, 15104, 1, 256, 1024, 1024, 1024, 256]
    - [122, 76614.0]
  - - [1024, 16128, 1, 256, 1024, 1024, 1024, 256]
    - [108, 69537.0]
  - - [1024, 17152, 1, 256, 1024, 1024, 1024, 256]
    - [122, 72056.0]
  - - [1024, 18944, 1, 256, 1024, 1024, 1024, 256]
    - [122, 77209.0]
  - - [1024, 19712, 1, 256, 1024, 1024, 1024, 256]
    - [106, 71531.0]
  - - [1024, 19968, 1, 256, 1024, 1024, 1024, 256]
    - [129, 72300.0]
  - - [1024, 20480, 1, 256, 1024, 1024, 1024, 256]
    - [122, 72394.0]
  - - [1024, 20992, 1, 256, 1024, 1024, 1024, 256]
    - [129, 73726.0]
  - - [1024, 21504, 1, 256, 1024, 1024, 1024, 256]
    - [122, 74882.0]
  - - [1024, 22016, 1, 256, 1024, 1024, 1024, 256]
    - [122, 76747.0]
  - - [1024, 23552, 1, 256, 1024, 1024, 1024, 256]
    - [106, 73291.0]
  - - [1024, 28672, 1, 256, 1024, 1024, 1024, 256]
    - [97, 76759.0]
  - - [1024, 33536, 1, 256, 1024, 1024, 1024, 256]
    - [129, 78270.0]
  - - [1024, 40448, 1, 256, 1024, 1024, 1024, 256]
    - [129, 78658.0]
  - - [1600, 512, 1, 1024, 1600, 1600, 1600, 1024]
    - [54, 51910.0]
  - - [2048, 1, 1, 512, 2048, 2048, 2048, 512]
    - [16, 196.0]
  - - [2048, 512, 1, 1, 2048, 2048, 2048, 1]
    - [8, 218.0]
  - - [2048, 960, 1, 2048, 2048, 2048, 2048, 2048]
    - [121, 72734.0]
  - - [2048, 1024, 1, 1, 2048, 2048, 2048, 1]
    - [78, 332.0]
  - - [2048, 1024, 1, 256, 2048, 2048, 2048, 256]
    - [11, 45040.0]
  - - [3200, 1024, 1, 2048, 3200, 3200, 3200, 2048]
    - [81, 85424.0]
  - - [4096, 1024, 1, 1, 4096, 4096, 4096, 1]
    - [133, 460.0]
  - - [2048, 1024, 1, 2048, 2048, 2048, 2048, 2048]
    - [79, 74359.0]
  - - [2048, 1024, 1, 30592, 2048, 2048, 2048, 30592]
    - [135, 89473.0]
  - - [2048, 1024, 1, 6144, 2048, 2048, 2048, 6144]
    - [95, 85037.0]
  - - [2048, 1024, 1, 8192, 2048, 2048, 2048, 8192]
    - [112, 86452.0]
  - - [2048, 2, 1, 2, 2048, 2048, 2048, 2]
    - [0, 3.0]
  - - [2048, 2, 1, 2048, 2048, 2048, 2048, 2048]
    - [150, 672.0]
  - - [8192, 1024, 1, 2048, 8192, 8192, 8192, 2048]
    - [25, 95656.0]
  - - [1024, 16, 1, 1024, 1024, 1024, 1024, 1024]
    - [64, 1907.0]
  - - [1024, 16, 1, 2, 1024, 1024, 1024, 2]
    - [0, 11.0]
  - - [1024, 8192, 1, 30592, 1024, 1024, 1024, 30592]
    - [60, 109815.0]
  - - [1024, 8192, 1, 3072, 1024, 1024, 1024, 3072]
    - [12, 99451.0]
  - - [512, 512, 256, 64, 512, 512, 512, 64]
    - [116, 44851.0]
  - - [64, 512, 256, 512, 64, 64, 64, 512]
    - [30, 40245.0]
  - - [1024, 2048, 1, 30592, 1024, 1024, 1024, 30592]
    - [121, 90066.0]
  - - [1024, 2048, 1, 3072, 1024, 1024, 1024, 3072]
    - [95, 79419.0]
  - - [1024, 4096, 1, 30592, 1024, 1024, 1024, 30592]
    - [60, 108857.0]
  - - [1024, 4096, 1, 3072, 1024, 1024, 1024, 3072]
    - [47, 95756.0]
  - - [512, 512, 128, 64, 512, 512, 512, 64]
    - [116, 42745.0]
  - - [2560, 2048, 1, 1920, 2560, 2560, 2560, 1920]
    - [111, 82134.0]
  - - [2560, 2048, 1, 2560, 2560, 2560, 2560, 2560]
    - [120, 84776.0]
  - - [2560, 2048, 1, 7680, 2560, 2560, 2560, 7680]
    - [99, 87869.0]
  - - [2560, 4, 1, 2, 2560, 2560, 2560, 2]
    - [13, 7.0]
  - - [2560, 4, 1, 2560, 2560, 2560, 2560, 2560]
    - [163, 1734.0]
  - - [640, 2048, 1, 2560, 640, 640, 640, 2560]
    - [22, 75709.0]
  - - [512, 512, 40, 64, 512, 512, 512, 64]
    - [116, 36792.0]
  - - [64, 512, 40, 512, 64, 64, 64, 512]
    - [32, 32768.0]
  - - [1536, 4096, 1, 1536, 1536, 1536, 1536, 1536]
    - [63, 90484.0]
  - - [1536, 4096, 1, 4608, 1536, 1536, 1536, 4608]
    - [41, 97916.0]
  - - [1536, 4096, 1, 50304, 1536, 1536, 1536, 50304]
    - [93, 102942.0]
  - - [1536, 4096, 1, 6144, 1536, 1536, 1536, 6144]
    - [81, 99196.0]
  - - [6144, 4096, 1, 1536, 6144, 6144, 6144, 1536]
    - [97, 109218.0]
  - - [1024, 1024, 64, 96, 1024, 1024, 1024, 96]
    - [97, 64631.0]
  - - [96, 1024, 64, 1024, 96, 96, 96, 1024]
    - [104, 58356.0]
  - - [1536, 8192, 1, 1536, 1536, 1536, 1536, 1536]
    - [98, 95794.0]
  - - [1536, 8192, 1, 4608, 1536, 1536, 1536, 4608]
    - [68, 105207.0]
  - - [1536, 8192, 1, 50304, 1536, 1536, 1536, 50304]
    - [25, 110724.0]
  - - [1536, 8192, 1, 6144, 1536, 1536, 1536, 6144]
    - [68, 106545.0]
  - - [6144, 8192, 1, 1536, 6144, 6144, 6144, 1536]
    - [113, 116275.0]
  - - [1024, 1024, 128, 96, 1024, 1024, 1024, 96]
    - [97, 66941.0]
  - - [96, 1024, 128, 1024, 96, 96, 96, 1024]
    - [52, 61100.0]
  - - [1024, 16384, 1, 1024, 1024, 1024, 1024, 1024]
    - [122, 96386.0]
  - - [1024, 16384, 1, 3072, 1024, 1024, 1024, 3072]
    - [68, 102701.0]
  - - [1024, 16384, 1, 4096, 1024, 1024, 1024, 4096]
    - [68, 104998.0]
  - - [1024, 16384, 1, 50304, 1024, 1024, 1024, 50304]
    - [68, 110448.0]
  - - [4096, 16384, 1, 1024, 4096, 4096, 4096, 1024]
    - [82, 107778.0]
  - - [1024, 1024, 256, 64, 1024, 1024, 1024, 64]
    - [117, 48762.0]
  - - [64, 1024, 256, 1024, 64, 64, 64, 1024]
    - [103, 50529.0]
  - - [1024, 2048, 1, 50304, 1024, 1024, 1024, 50304]
    - [139, 96529.0]
  - - [1024, 1024, 32, 64, 1024, 1024, 1024, 64]
    - [116, 44889.0]
  - - [64, 1024, 32, 1024, 64, 64, 64, 1024]
    - [20, 37915.0]
  - - [1024, 4096, 1, 50304, 1024, 1024, 1024, 50304]
    - [60, 109744.0]
  - - [1024, 1024, 64, 64, 1024, 1024, 1024, 64]
    - [116, 46644.0]
  - - [64, 1024, 64, 1024, 64, 64, 64, 1024]
    - [20, 43826.0]
  - - [1024, 8192, 1, 50304, 1024, 1024, 1024, 50304]
    - [68, 110230.0]
  - - [1024, 1024, 128, 64, 1024, 1024, 1024, 64]
    - [132, 47935.0]
  - - [64, 1024, 128, 1024, 64, 64, 64, 1024]
    - [66, 47701.0]
  - - [128, 128, 1024, 64, 128, 128, 128, 64]
    - [78, 26317.0]
  - - [64, 128, 1024, 128, 64, 64, 64, 128]
    - [87, 23424.0]
  - - [1024, 64, 1, 2, 1024, 1024, 1024, 2]
    - [56, 44.0]
  - - [1024, 8192, 1, 30528, 1024, 1024, 1024, 30528]
    - [72, 110037.0]
  - - [1024, 64, 1, 1024, 1024, 1024, 1024, 1024]
    - [27, 7557.0]
  - - [1024, 3456, 1, 1024, 1024, 1024, 1024, 1024]
    - [40, 81326.0]
  - - [1024, 3456, 1, 512, 1024, 1024, 1024, 512]
    - [123, 75750.0]
  - - [1024, 4096, 1, 512, 1024, 1024, 1024, 512]
    - [59, 69905.0]
  - - [1024, 6912, 1, 1024, 1024, 1024, 1024, 1024]
    - [98, 96792.0]
  - - [1024, 6912, 1, 512, 1024, 1024, 1024, 512]
    - [122, 82813.0]
  - - [1024, 864, 1, 1024, 1024, 1024, 1024, 1024]
    - [74, 51243.0]
  - - [1024, 864, 1, 512, 1024, 1024, 1024, 512]
    - [69, 44237.0]
  - - [256, 3456, 1, 128, 256, 256, 256, 128]
    - [14, 26214.0]
  - - [256, 4096, 1, 128, 256, 256, 256, 128]
    - [15, 25420.0]
  - - [256, 55296, 1, 128, 256, 256, 256, 128]
    - [109, 52919.0]
  - - [256, 6912, 1, 128, 256, 256, 256, 128]
    - [62, 35389.0]
  - - [256, 864, 1, 128, 256, 256, 256, 128]
    - [18, 8847.0]
  - - [480, 3456, 1, 1024, 480, 480, 480, 1024]
    - [88, 60323.0]
  - - [480, 4096, 1, 1024, 480, 480, 480, 1024]
    - [79, 59075.0]
  - - [480, 6912, 1, 1024, 480, 480, 480, 1024]
    - [81, 81355.0]
  - - [480, 864, 1, 1024, 480, 480, 480, 1024]
    - [4, 32172.0]
  - - [512, 3456, 1, 256, 512, 512, 512, 256]
    - [119, 46796.0]
  - - [512, 4096, 1, 256, 512, 512, 512, 256]
    - [58, 43019.0]
  - - [512, 55296, 1, 256, 512, 512, 512, 256]
    - [116, 74565.0]
  - - [512, 6912, 1, 256, 512, 512, 512, 256]
    - [41, 56908.0]
  - - [512, 864, 1, 256, 512, 512, 512, 256]
    - [65, 22469.0]
  - - [1024, 640, 1, 30528, 1024, 1024, 1024, 30528]
    - [149, 77068.0]
  - - [1024, 1280, 1, 30528, 1024, 1024, 1024, 30528]
    - [143, 83626.0]
  - - [1024, 1600, 1, 30528, 1024, 1024, 1024, 30528]
    - [142, 95906.0]
  - - [1024, 10240, 1, 1024, 1024, 1024, 1024, 1024]
    - [97, 96352.0]
  - - [1024, 10240, 1, 4096, 1024, 1024, 1024, 4096]
    - [122, 106437.0]
  - - [4096, 10240, 1, 1024, 4096, 4096, 4096, 1024]
    - [38, 104960.0]
  - - [1024, 80, 1, 1024, 1024, 1024, 1024, 1024]
    - [27, 9533.0]
  - - [1024, 80, 1, 2, 1024, 1024, 1024, 2]
    - [13, 54.0]
  - - [128, 128, 1280, 64, 128, 128, 128, 64]
    - [108, 26758.0]
  - - [64, 128, 1280, 128, 64, 64, 64, 128]
    - [101, 23967.0]
  - - [1024, 1640, 1, 30528, 1024, 1024, 1024, 30528]
    - [140, 89328.0]
  - - [1024, 10496, 1, 1024, 1024, 1024, 1024, 1024]
    - [122, 99045.0]
  - - [1024, 10496, 1, 4096, 1024, 1024, 1024, 4096]
    - [123, 108410.0]
  - - [4096, 10496, 1, 1024, 4096, 4096, 4096, 1024]
    - [80, 107040.0]
  - - [1024, 82, 1, 1024, 1024, 1024, 1024, 1024]
    - [27, 9683.0]
  - - [1024, 82, 1, 2, 1024, 1024, 1024, 2]
    - [13, 55.0]
  - - [128, 128, 1312, 64, 128, 128, 128, 64]
    - [84, 26996.0]
  - - [64, 128, 1312, 128, 64, 64, 64, 128]
    - [107, 23818.0]
  - - [1024, 160, 1, 30528, 1024, 1024, 1024, 30528]
    - [156, 52761.0]
  - - [1024, 240, 1, 30528, 1024, 1024, 1024, 30528]
    - [152, 58908.0]
  - - [1024, 6144, 1, 4096, 1024, 1024, 1024, 4096]
    - [63, 96328.0]
  - - [1024, 12, 1, 1024, 1024, 1024, 1024, 1024]
    - [42, 1484.0]
  - - [4096, 6144, 1, 1024, 4096, 4096, 4096, 1024]
    - [80, 104416.0]
  - - [1024, 6144, 1, 1024, 1024, 1024, 1024, 1024]
    - [90, 86221.0]
  - - [1024, 12, 1, 2, 1024, 1024, 1024, 2]
    - [0, 8.0]
  - - [512, 512, 192, 64, 512, 512, 512, 64]
    - [78, 44248.0]
  - - [64, 512, 192, 512, 64, 64, 64, 512]
    - [34, 38941.0]
  - - [256, 4096, 1, 1, 256, 256, 256, 1]
    - [39, 218.0]
  - - [256, 6912, 1, 1, 256, 256, 256, 1]
    - [2, 346.0]
  - - [479, 32768, 1, 1024, 479, 479, 479, 1024]
    - [160, 84592.0]
  - - [74, 512, 1, 2048, 74, 74, 74, 2048]
    - [158, 4511.0]
  - - [67, 512, 1, 2048, 67, 67, 67, 2048]
    - [162, 4047.0]
  - - [74, 960, 1, 2048, 74, 74, 74, 2048]
    - [159, 7942.0]
  - - [100, 512, 1, 2048, 100, 100, 100, 2048]
    - [158, 6040.0]
  - - [257, 1024, 1, 4096, 257, 257, 257, 4096]
    - [161, 24499.0]
- null
