TRAIN_3.9/logic/gemm/arcturus_Cijk_Ailk_Bjlk_BBH.yaml
- {MinimumRequiredVersion: 4.22.0}
- arcturus
- gfx908
- [Device 7380, Device 7388, Device 738c, Device 7390]
    SolutionIndex: 0
    SolutionNameMin: Cijk_Ailk_Bjlk_BBH_MT64x64x16_MI32x32x4x1_SE_AF0EM8_GRVW2_GSU1_SU0_SUS256_SRVW4_WG64_4_1_WGM1
    SolutionIndex: 1
    SolutionNameMin: Cijk_Ailk_Bjlk_BBH_MT128x64x16_MI32x32x4x1_SE_AF0EM8_GRVW2_GSU1_SU0_SUS256_SRVW4_WG64_4_1_WGM1
    SolutionIndex: 2
    SolutionNameMin: Cijk_Ailk_Bjlk_BBH_MT32x32x16_MI16x16x8x1_SE_AF0EM8_GRVW2_GSU1_SU0_SUS256_SRVW4_WG32_8_1_WGM1
    SolutionIndex: 3
    SolutionNameMin: Cijk_Ailk_Bjlk_BBH_MT64x32x16_MI16x16x8x1_SE_AF0EM8_GRVW2_GSU1_SU0_SUS256_SRVW4_WG32_8_1_WGM1
    SolutionIndex: 4
    SolutionNameMin: Cijk_Ailk_Bjlk_BBH_MT128x96x16_MI32x32x4x1_SE_AF0EM8_GRVW2_GSU1_SU0_SUS256_SRVW4_WG128_2_1_WGM1
    SolutionIndex: 5
    SolutionNameMin: Cijk_Ailk_Bjlk_BBH_MT96x96x32_MI16x16x8x1_SE_AF0EM8_GRVW2_GSU1_SU0_SUS256_SRVW0_WG32_8_1_WGM1
    SolutionIndex: 6
    SolutionNameMin: Cijk_Ailk_Bjlk_BBH_MT128x144x32_MI16x16x8x1_SE_AF0EM8_GRVW2_GSU1_SU0_SUS256_SRVW4_WG64_4_1_WGM1
    SolutionIndex: 7
    SolutionNameMin: Cijk_Ailk_Bjlk_BBH_MT64x128x16_MI32x32x4x1_SE_AF0EM8_GRVW4_GSU1_SU0_SUS256_SRVW4_WG64_4_1_WGM1
    SolutionIndex: 8
    SolutionNameMin: Cijk_Ailk_Bjlk_BBH_MT32x32x16_MI16x16x8x1_SE_AF0EM8_GRVW4_GSU1_SU0_SUS256_SRVW4_WG32_8_1_WGM1
    SolutionIndex: 9
    SolutionNameMin: Cijk_Ailk_Bjlk_BBH_MT32x64x16_MI16x16x8x1_SE_AF0EM8_GRVW4_GSU1_SU0_SUS256_SRVW4_WG32_8_1_WGM1
    SolutionIndex: 10
    SolutionNameMin: Cijk_Ailk_Bjlk_BBH_MT64x32x16_MI16x16x8x1_SE_AF0EM8_GRVW4_GSU1_SU0_SUS256_SRVW4_WG32_8_1_WGM1
    SolutionIndex: 11
    SolutionNameMin: Cijk_Ailk_Bjlk_BBH_MT64x64x32_MI32x32x4x1_SE_AF0EM8_GRVW4_GSU1_SU0_SUS256_SRVW4_WG64_4_1_WGM1
    SolutionIndex: 12
    SolutionNameMin: Cijk_Ailk_Bjlk_BBH_MT128x96x32_MI32x32x4x1_SE_AF0EM8_GRVW4_GSU1_SU0_SUS256_SRVW4_WG128_2_1_WGM1
    SolutionIndex: 13
    SolutionNameMin: Cijk_Ailk_Bjlk_BBH_MT96x128x32_MI32x32x4x1_SE_AF0EM8_GRVW4_GSU1_SU0_SUS256_SRVW0_WG32_8_1_WGM1
    SolutionIndex: 14
    SolutionNameMin: Cijk_Ailk_Bjlk_BBH_MT96x96x32_MI16x16x8x1_SE_AF0EM8_GRVW4_GSU1_SU0_SUS256_SRVW0_WG32_8_1_WGM1
    SolutionIndex: 15
    SolutionNameMin: Cijk_Ailk_Bjlk_BBH_MT64x128x16_MI32x32x4x1_SE_AF0EM8_GRVW8_GSU1_SU0_SUS256_SRVW4_WG64_4_1_WGM1
    SolutionIndex: 16
    SolutionNameMin: Cijk_Ailk_Bjlk_BBH_MT128x64x16_MI32x32x4x1_SE_AF0EM8_GRVW8_GSU1_SU0_SUS256_SRVW4_WG64_4_1_WGM1
    SolutionIndex: 17
    SolutionNameMin: Cijk_Ailk_Bjlk_BBH_MT128x128x16_MI32x32x4x1_SE_AF0EM8_GRVW8_GSU1_SU0_SUS256_SRVW4_WG64_4_1_WGM1
    SolutionIndex: 18
    SolutionNameMin: Cijk_Ailk_Bjlk_BBH_MT128x256x16_MI32x32x4x1_SE_AF0EM8_GRVW8_GSU1_SU0_SUS256_SRVW4_WG64_4_1_WGM1
    SolutionIndex: 19
    SolutionNameMin: Cijk_Ailk_Bjlk_BBH_MT64x32x16_MI16x16x8x1_SE_AF0EM8_GRVW8_GSU1_SU0_SUS256_SRVW4_WG32_8_1_WGM1
    SolutionIndex: 20
    SolutionNameMin: Cijk_Ailk_Bjlk_BBH_MT64x64x32_MI32x32x4x1_SE_AF0EM8_GRVW8_GSU1_SU0_SUS256_SRVW4_WG64_4_1_WGM1
    SolutionIndex: 21
    SolutionNameMin: Cijk_Ailk_Bjlk_BBH_MT64x128x32_MI32x32x4x1_SE_AF0EM8_GRVW8_GSU1_SU0_SUS256_SRVW4_WG64_4_1_WGM1
    SolutionIndex: 22
    SolutionNameMin: Cijk_Ailk_Bjlk_BBH_MT128x64x32_MI32x32x4x1_SE_AF0EM8_GRVW8_GSU1_SU0_SUS256_SRVW4_WG64_4_1_WGM1
    SolutionIndex: 23
    SolutionNameMin: Cijk_Ailk_Bjlk_BBH_MT128x128x32_MI32x32x4x1_SE_AF0EM8_GRVW8_GSU1_SU0_SUS256_SRVW4_WG64_4_1_WGM1
    SolutionIndex: 24
    SolutionNameMin: Cijk_Ailk_Bjlk_BBH_MT32x32x32_MI16x16x8x1_SE_AF0EM8_GRVW8_GSU1_SU0_SUS256_SRVW4_WG32_8_1_WGM1
    SolutionIndex: 25
    SolutionNameMin: Cijk_Ailk_Bjlk_BBH_MT64x32x32_MI16x16x8x1_SE_AF0EM8_GRVW8_GSU1_SU0_SUS256_SRVW4_WG32_8_1_WGM1
    SolutionIndex: 26
    SolutionNameMin: Cijk_Ailk_Bjlk_BBH_MT64x64x64_MI32x32x4x1_SE_AF0EM8_GRVW8_GSU1_SU0_SUS256_SRVW4_WG64_4_1_WGM1
    SolutionIndex: 27
    SolutionNameMin: Cijk_Ailk_Bjlk_BBH_MT32x32x64_MI16x16x8x1_SE_AF0EM8_GRVW8_GSU1_SU0_SUS256_SRVW4_WG32_8_1_WGM1
    SolutionIndex: 28
    SolutionNameMin: Cijk_Ailk_Bjlk_BBH_MT64x32x16_MI16x16x8x1_SE_AF0EM8_GRVW2_GSU1_SU32_SUS128_SRVW4_WG32_8_1_WGM1
    SolutionIndex: 29
    SolutionNameMin: Cijk_Ailk_Bjlk_BBH_MT128x160x16_MI32x32x4x1_SE_AF0EM8_GRVW2_GSU1_SU32_SUS128_SRVW4_WG128_2_1_WGM1
    SolutionIndex: 30
    SolutionNameMin: Cijk_Ailk_Bjlk_BBH_MT64x32x16_MI16x16x8x1_SE_AF0EM8_GRVW4_GSU1_SU32_SUS128_SRVW4_WG32_8_1_WGM1
    SolutionIndex: 31
    SolutionNameMin: Cijk_Ailk_Bjlk_BBH_MT128x96x32_MI32x32x4x1_SE_AF0EM8_GRVW4_GSU1_SU32_SUS128_SRVW4_WG128_2_1_WGM1
    SolutionIndex: 32
    SolutionNameMin: Cijk_Ailk_Bjlk_BBH_MT64x128x16_MI32x32x4x1_SE_AF0EM8_GRVW8_GSU1_SU32_SUS128_SRVW4_WG64_4_1_WGM1
    SolutionIndex: 33
    SolutionNameMin: Cijk_Ailk_Bjlk_BBH_MT64x64x32_MI32x32x4x1_SE_AF0EM8_GRVW8_GSU1_SU32_SUS128_SRVW4_WG64_4_1_WGM1
    SolutionIndex: 34
    SolutionNameMin: Cijk_Ailk_Bjlk_BBH_MT64x128x32_MI32x32x4x1_SE_AF0EM8_GRVW8_GSU1_SU32_SUS128_SRVW4_WG64_4_1_WGM1
    SolutionIndex: 35
    SolutionNameMin: Cijk_Ailk_Bjlk_BBH_MT128x64x32_MI32x32x4x1_SE_AF0EM8_GRVW8_GSU1_SU32_SUS128_SRVW4_WG64_4_1_WGM1
    SolutionIndex: 36
    SolutionNameMin: Cijk_Ailk_Bjlk_BBH_MT64x64x64_MI32x32x4x1_SE_AF0EM8_GRVW8_GSU1_SU32_SUS128_SRVW4_WG64_4_1_WGM1
    SolutionIndex: 37
    SolutionNameMin: Cijk_Ailk_Bjlk_BBH_MT32x32x64_MI16x16x8x1_SE_AF0EM8_GRVW8_GSU1_SU32_SUS128_SRVW4_WG32_8_1_WGM1
    SolutionIndex: 38
    SolutionNameMin: Cijk_Ailk_Bjlk_BBH_MT32x64x64_MI16x16x8x1_SE_AF0EM8_GRVW8_GSU1_SU32_SUS128_SRVW4_WG32_8_1_WGM1
    SolutionIndex: 39
    SolutionNameMin: Cijk_Ailk_Bjlk_BBH_MT64x64x16_MI32x32x4x1_SE_AF0EM8_GRVW2_GSU1_SU32_SUS256_SRVW4_WG64_4_1_WGM1
    SolutionIndex: 40
    SolutionNameMin: Cijk_Ailk_Bjlk_BBH_MT64x128x16_MI32x32x4x1_SE_AF0EM8_GRVW2_GSU1_SU32_SUS256_SRVW4_WG64_4_1_WGM1
    SolutionIndex: 41
    SolutionNameMin: Cijk_Ailk_Bjlk_BBH_MT32x64x16_MI16x16x8x1_SE_AF0EM8_GRVW2_GSU1_SU32_SUS256_SRVW4_WG32_8_1_WGM1
    SolutionIndex: 42
    SolutionNameMin: Cijk_Ailk_Bjlk_BBH_MT128x160x16_MI32x32x4x1_SE_AF0EM8_GRVW2_GSU1_SU32_SUS256_SRVW4_WG128_2_1_WGM1
    SolutionIndex: 43
    SolutionNameMin: Cijk_Ailk_Bjlk_BBH_MT128x128x16_MI32x32x4x1_SE_AF0EM8_GRVW8_GSU1_SU32_SUS256_SRVW4_WG64_4_1_WGM1
    SolutionIndex: 44
    SolutionNameMin: Cijk_Ailk_Bjlk_BBH_MT64x64x32_MI32x32x4x1_SE_AF0EM8_GRVW8_GSU1_SU32_SUS256_SRVW4_WG64_4_1_WGM1
    SolutionIndex: 45
    SolutionNameMin: Cijk_Ailk_Bjlk_BBH_MT64x64x64_MI32x32x4x1_SE_AF0EM8_GRVW8_GSU1_SU32_SUS256_SRVW4_WG64_4_1_WGM1
    SolutionIndex: 46
    SolutionNameMin: Cijk_Ailk_Bjlk_BBH_MT64x128x16_MI32x32x4x1_SE_AF0EM8_GRVW2_GSU1_SU0_SUS256_SRVW4_WG64_4_1_WGM2
    SolutionIndex: 47
    SolutionNameMin: Cijk_Ailk_Bjlk_BBH_MT128x160x32_MI32x32x4x1_SE_AF0EM8_GRVW2_GSU1_SU0_SUS256_SRVW4_WG128_2_1_WGM2
    SolutionIndex: 48
    SolutionNameMin: Cijk_Ailk_Bjlk_BBH_MT160x128x32_MI32x32x4x1_SE_AF0EM8_GRVW2_GSU1_SU0_SUS256_SRVW0_WG32_8_1_WGM2
    SolutionIndex: 49
    SolutionNameMin: Cijk_Ailk_Bjlk_BBH_MT96x96x64_MI16x16x8x1_SE_AF0EM8_GRVW2_GSU1_SU0_SUS256_SRVW0_WG32_8_1_WGM2
    SolutionIndex: 50
    SolutionNameMin: Cijk_Ailk_Bjlk_BBH_MT64x64x16_MI32x32x4x1_SE_AF0EM8_GRVW4_GSU1_SU0_SUS256_SRVW4_WG64_4_1_WGM2
    SolutionIndex: 51
    SolutionNameMin: Cijk_Ailk_Bjlk_BBH_MT128x64x16_MI32x32x4x1_SE_AF0EM8_GRVW4_GSU1_SU0_SUS256_SRVW4_WG64_4_1_WGM2
    SolutionIndex: 52
    SolutionNameMin: Cijk_Ailk_Bjlk_BBH_MT32x64x16_MI16x16x8x1_SE_AF0EM8_GRVW4_GSU1_SU0_SUS256_SRVW4_WG32_8_1_WGM2
    SolutionIndex: 53
    SolutionNameMin: Cijk_Ailk_Bjlk_BBH_MT64x64x16_MI32x32x4x1_SE_AF0EM8_GRVW8_GSU1_SU0_SUS256_SRVW4_WG64_4_1_WGM2
    SolutionIndex: 54
    SolutionNameMin: Cijk_Ailk_Bjlk_BBH_MT128x64x16_MI32x32x4x1_SE_AF0EM8_GRVW8_GSU1_SU0_SUS256_SRVW4_WG64_4_1_WGM2
    SolutionIndex: 55
    SolutionNameMin: Cijk_Ailk_Bjlk_BBH_MT128x128x16_MI32x32x4x1_SE_AF0EM8_GRVW8_GSU1_SU0_SUS256_SRVW4_WG64_4_1_WGM2
    SolutionIndex: 56
    SolutionNameMin: Cijk_Ailk_Bjlk_BBH_MT64x64x32_MI32x32x4x1_SE_AF0EM8_GRVW8_GSU1_SU0_SUS256_SRVW4_WG64_4_1_WGM2
    SolutionIndex: 57
    SolutionNameMin: Cijk_Ailk_Bjlk_BBH_MT64x128x32_MI32x32x4x1_SE_AF0EM8_GRVW8_GSU1_SU0_SUS256_SRVW4_WG64_4_1_WGM2
    SolutionIndex: 58
    SolutionNameMin: Cijk_Ailk_Bjlk_BBH_MT64x64x64_MI32x32x4x1_SE_AF0EM8_GRVW8_GSU1_SU0_SUS256_SRVW4_WG64_4_1_WGM2
    SolutionIndex: 59
    SolutionNameMin: Cijk_Ailk_Bjlk_BBH_MT128x96x16_MI32x32x4x1_SE_AF0EM8_GRVW2_GSU1_SU32_SUS128_SRVW4_WG128_2_1_WGM2
    SolutionIndex: 60
    SolutionNameMin: Cijk_Ailk_Bjlk_BBH_MT64x32x16_MI16x16x8x1_SE_AF0EM8_GRVW4_GSU1_SU32_SUS128_SRVW4_WG32_8_1_WGM2
    SolutionIndex: 61
    SolutionNameMin: Cijk_Ailk_Bjlk_BBH_MT128x96x32_MI32x32x4x1_SE_AF0EM8_GRVW4_GSU1_SU32_SUS128_SRVW4_WG128_2_1_WGM2
    SolutionIndex: 62
    SolutionNameMin: Cijk_Ailk_Bjlk_BBH_MT128x128x16_MI32x32x4x1_SE_AF0EM8_GRVW8_GSU1_SU32_SUS128_SRVW4_WG64_4_1_WGM2
    SolutionIndex: 63
    SolutionNameMin: Cijk_Ailk_Bjlk_BBH_MT64x32x16_MI16x16x8x1_SE_AF0EM8_GRVW8_GSU1_SU32_SUS128_SRVW4_WG32_8_1_WGM2
    SolutionIndex: 64
    SolutionNameMin: Cijk_Ailk_Bjlk_BBH_MT128x128x32_MI32x32x4x1_SE_AF0EM8_GRVW8_GSU1_SU32_SUS128_SRVW4_WG64_4_1_WGM2
    SolutionIndex: 65
    SolutionNameMin: Cijk_Ailk_Bjlk_BBH_MT64x64x64_MI32x32x4x1_SE_AF0EM8_GRVW8_GSU1_SU32_SUS128_SRVW4_WG64_4_1_WGM2
    SolutionIndex: 66
    SolutionNameMin: Cijk_Ailk_Bjlk_BBH_MT32x32x64_MI16x16x8x1_SE_AF0EM8_GRVW8_GSU1_SU32_SUS128_SRVW4_WG32_8_1_WGM2
    SolutionIndex: 67
    SolutionNameMin: Cijk_Ailk_Bjlk_BBH_MT64x32x16_MI16x16x8x1_SE_AF0EM8_GRVW2_GSU1_SU32_SUS256_SRVW4_WG32_8_1_WGM2
    SolutionIndex: 68
    SolutionNameMin: Cijk_Ailk_Bjlk_BBH_MT128x96x32_MI32x32x4x1_SE_AF0EM8_GRVW4_GSU1_SU32_SUS256_SRVW4_WG128_2_1_WGM2
    SolutionIndex: 69
    SolutionNameMin: Cijk_Ailk_Bjlk_BBH_MT64x128x16_MI32x32x4x1_SE_AF0EM8_GRVW8_GSU1_SU32_SUS256_SRVW4_WG64_4_1_WGM2
    SolutionIndex: 70
    SolutionNameMin: Cijk_Ailk_Bjlk_BBH_MT64x64x32_MI32x32x4x1_SE_AF0EM8_GRVW8_GSU1_SU32_SUS256_SRVW4_WG64_4_1_WGM2
    SolutionIndex: 71
    SolutionNameMin: Cijk_Ailk_Bjlk_BBH_MT128x64x32_MI32x32x4x1_SE_AF0EM8_GRVW8_GSU1_SU32_SUS256_SRVW4_WG64_4_1_WGM2
    SolutionIndex: 72
    SolutionNameMin: Cijk_Ailk_Bjlk_BBH_MT128x128x32_MI32x32x4x1_SE_AF0EM8_GRVW8_GSU1_SU32_SUS256_SRVW4_WG64_4_1_WGM2
    SolutionIndex: 73
    SolutionNameMin: Cijk_Ailk_Bjlk_BBH_MT32x64x16_MI16x16x8x1_SE_AF0EM8_GRVW2_GSU1_SU0_SUS256_SRVW4_WG32_8_1_WGM15
    SolutionIndex: 74
    SolutionNameMin: Cijk_Ailk_Bjlk_BBH_MT64x128x16_MI32x32x4x1_SE_AF0EM8_GRVW4_GSU1_SU0_SUS256_SRVW4_WG64_4_1_WGM15
    SolutionIndex: 75
    SolutionNameMin: Cijk_Ailk_Bjlk_BBH_MT32x64x16_MI16x16x8x1_SE_AF0EM8_GRVW4_GSU1_SU0_SUS256_SRVW4_WG32_8_1_WGM15
    SolutionIndex: 76
    SolutionNameMin: Cijk_Ailk_Bjlk_BBH_MT64x32x16_MI16x16x8x1_SE_AF0EM8_GRVW4_GSU1_SU0_SUS256_SRVW4_WG32_8_1_WGM15
    SolutionIndex: 77
    SolutionNameMin: Cijk_Ailk_Bjlk_BBH_MT64x64x32_MI32x32x4x1_SE_AF0EM8_GRVW4_GSU1_SU0_SUS256_SRVW4_WG64_4_1_WGM15
    SolutionIndex: 78
    SolutionNameMin: Cijk_Ailk_Bjlk_BBH_MT128x160x32_MI32x32x4x1_SE_AF0EM8_GRVW4_GSU1_SU0_SUS256_SRVW4_WG128_2_1_WGM15
    SolutionIndex: 79
    SolutionNameMin: Cijk_Ailk_Bjlk_BBH_MT96x96x32_MI16x16x8x1_SE_AF0EM8_GRVW4_GSU1_SU0_SUS256_SRVW0_WG32_8_1_WGM15
    SolutionIndex: 80
    SolutionNameMin: Cijk_Ailk_Bjlk_BBH_MT128x64x64_MI32x32x4x1_SE_AF0EM8_GRVW4_GSU1_SU0_SUS256_SRVW4_WG64_4_1_WGM15
    SolutionIndex: 81
    SolutionNameMin: Cijk_Ailk_Bjlk_BBH_MT128x64x16_MI32x32x4x1_SE_AF0EM8_GRVW8_GSU1_SU0_SUS256_SRVW4_WG64_4_1_WGM15
    SolutionIndex: 82
    SolutionNameMin: Cijk_Ailk_Bjlk_BBH_MT128x128x16_MI32x32x4x1_SE_AF0EM8_GRVW8_GSU1_SU0_SUS256_SRVW4_WG64_4_1_WGM15
    SolutionIndex: 83
    SolutionNameMin: Cijk_Ailk_Bjlk_BBH_MT128x256x16_MI32x32x4x1_SE_AF0EM8_GRVW8_GSU1_SU0_SUS256_SRVW4_WG64_4_1_WGM15
    SolutionIndex: 84
    SolutionNameMin: Cijk_Ailk_Bjlk_BBH_MT32x64x16_MI16x16x8x1_SE_AF0EM8_GRVW8_GSU1_SU0_SUS256_SRVW4_WG32_8_1_WGM15
    SolutionIndex: 85
    SolutionNameMin: Cijk_Ailk_Bjlk_BBH_MT64x32x16_MI16x16x8x1_SE_AF0EM8_GRVW8_GSU1_SU0_SUS256_SRVW4_WG32_8_1_WGM15
    SolutionIndex: 86
    SolutionNameMin: Cijk_Ailk_Bjlk_BBH_MT64x64x32_MI32x32x4x1_SE_AF0EM8_GRVW8_GSU1_SU0_SUS256_SRVW4_WG64_4_1_WGM15
    SolutionIndex: 87
    SolutionNameMin: Cijk_Ailk_Bjlk_BBH_MT128x64x32_MI32x32x4x1_SE_AF0EM8_GRVW8_GSU1_SU0_SUS256_SRVW4_WG64_4_1_WGM15
    SolutionIndex: 88
    SolutionNameMin: Cijk_Ailk_Bjlk_BBH_MT32x32x32_MI16x16x8x1_SE_AF0EM8_GRVW8_GSU1_SU0_SUS256_SRVW4_WG32_8_1_WGM15
    SolutionIndex: 89
    SolutionNameMin: Cijk_Ailk_Bjlk_BBH_MT32x64x32_MI16x16x8x1_SE_AF0EM8_GRVW8_GSU1_SU0_SUS256_SRVW4_WG32_8_1_WGM15
    SolutionIndex: 90
    SolutionNameMin: Cijk_Ailk_Bjlk_BBH_MT64x64x64_MI32x32x4x1_SE_AF0EM8_GRVW8_GSU1_SU0_SUS256_SRVW4_WG64_4_1_WGM15
    SolutionIndex: 91
    SolutionNameMin: Cijk_Ailk_Bjlk_BBH_MT128x64x64_MI32x32x4x1_SE_AF0EM8_GRVW8_GSU1_SU0_SUS256_SRVW4_WG64_4_1_WGM15
    SolutionIndex: 92
    SolutionNameMin: Cijk_Ailk_Bjlk_BBH_MT32x32x64_MI16x16x8x1_SE_AF0EM8_GRVW8_GSU1_SU0_SUS256_SRVW4_WG32_8_1_WGM15
    SolutionIndex: 93
    SolutionNameMin: Cijk_Ailk_Bjlk_BBH_MT64x64x16_MI32x32x4x1_SE_AF0EM8_GRVW2_GSU1_SU32_SUS128_SRVW4_WG64_4_1_WGM15
    SolutionIndex: 94
    SolutionNameMin: Cijk_Ailk_Bjlk_BBH_MT64x32x16_MI16x16x8x1_SE_AF0EM8_GRVW2_GSU1_SU32_SUS128_SRVW4_WG32_8_1_WGM15
    SolutionIndex: 95
    SolutionNameMin: Cijk_Ailk_Bjlk_BBH_MT128x160x16_MI32x32x4x1_SE_AF0EM8_GRVW2_GSU1_SU32_SUS128_SRVW4_WG128_2_1_WGM15
    SolutionIndex: 96
    SolutionNameMin: Cijk_Ailk_Bjlk_BBH_MT128x96x32_MI32x32x4x1_SE_AF0EM8_GRVW4_GSU1_SU32_SUS128_SRVW4_WG128_2_1_WGM15
    SolutionIndex: 97
    SolutionNameMin: Cijk_Ailk_Bjlk_BBH_MT128x128x16_MI32x32x4x1_SE_AF0EM8_GRVW8_GSU1_SU32_SUS128_SRVW4_WG64_4_1_WGM15
    SolutionIndex: 98
    SolutionNameMin: Cijk_Ailk_Bjlk_BBH_MT64x32x16_MI16x16x8x1_SE_AF0EM8_GRVW8_GSU1_SU32_SUS128_SRVW4_WG32_8_1_WGM15
    SolutionIndex: 99
    SolutionNameMin: Cijk_Ailk_Bjlk_BBH_MT64x64x32_MI32x32x4x1_SE_AF0EM8_GRVW8_GSU1_SU32_SUS128_SRVW4_WG64_4_1_WGM15
    SolutionIndex: 100
    SolutionNameMin: Cijk_Ailk_Bjlk_BBH_MT128x64x32_MI32x32x4x1_SE_AF0EM8_GRVW8_GSU1_SU32_SUS128_SRVW4_WG64_4_1_WGM15
    SolutionIndex: 101
    SolutionNameMin: Cijk_Ailk_Bjlk_BBH_MT128x128x32_MI32x32x4x1_SE_AF0EM8_GRVW8_GSU1_SU32_SUS128_SRVW4_WG64_4_1_WGM15
    SolutionIndex: 102
    SolutionNameMin: Cijk_Ailk_Bjlk_BBH_MT64x64x64_MI32x32x4x1_SE_AF0EM8_GRVW8_GSU1_SU32_SUS128_SRVW4_WG64_4_1_WGM15
    SolutionIndex: 103
    SolutionNameMin: Cijk_Ailk_Bjlk_BBH_MT64x64x16_MI32x32x4x1_SE_AF0EM8_GRVW2_GSU1_SU32_SUS256_SRVW4_WG64_4_1_WGM15
    SolutionIndex: 104
    SolutionNameMin: Cijk_Ailk_Bjlk_BBH_MT32x64x16_MI16x16x8x1_SE_AF0EM8_GRVW4_GSU1_SU32_SUS256_SRVW4_WG32_8_1_WGM15
    SolutionIndex: 105
    SolutionNameMin: Cijk_Ailk_Bjlk_BBH_MT128x96x32_MI32x32x4x1_SE_AF0EM8_GRVW4_GSU1_SU32_SUS256_SRVW4_WG128_2_1_WGM15
    SolutionIndex: 106
    SolutionNameMin: Cijk_Ailk_Bjlk_BBH_MT96x128x32_MI32x32x4x1_SE_AF0EM8_GRVW4_GSU1_SU32_SUS256_SRVW0_WG32_8_1_WGM15
    SolutionIndex: 107
    SolutionNameMin: Cijk_Ailk_Bjlk_BBH_MT128x64x64_MI32x32x4x1_SE_AF0EM8_GRVW4_GSU1_SU32_SUS256_SRVW4_WG64_4_1_WGM15
    SolutionIndex: 108
    SolutionNameMin: Cijk_Ailk_Bjlk_BBH_MT128x128x16_MI32x32x4x1_SE_AF0EM8_GRVW8_GSU1_SU32_SUS256_SRVW4_WG64_4_1_WGM15
    SolutionIndex: 109
    SolutionNameMin: Cijk_Ailk_Bjlk_BBH_MT64x64x32_MI32x32x4x1_SE_AF0EM8_GRVW8_GSU1_SU32_SUS256_SRVW4_WG64_4_1_WGM15
    SolutionIndex: 110
    SolutionNameMin: Cijk_Ailk_Bjlk_BBH_MT64x128x32_MI32x32x4x1_SE_AF0EM8_GRVW8_GSU1_SU32_SUS256_SRVW4_WG64_4_1_WGM15
    SolutionIndex: 111
    SolutionNameMin: Cijk_Ailk_Bjlk_BBH_MT128x128x32_MI32x32x4x1_SE_AF0EM8_GRVW8_GSU1_SU32_SUS256_SRVW4_WG64_4_1_WGM15
    SolutionIndex: 112
    SolutionNameMin: Cijk_Ailk_Bjlk_BBH_MT64x64x64_MI32x32x4x1_SE_AF0EM8_GRVW8_GSU1_SU32_SUS256_SRVW4_WG64_4_1_WGM15
    SolutionIndex: 113
    SolutionNameMin: Cijk_Ailk_Bjlk_BBH_MT32x32x64_MI16x16x8x1_SE_AF0EM8_GRVW8_GSU1_SU32_SUS256_SRVW4_WG32_8_1_WGM15
    SolutionIndex: 114
    SolutionNameMin: Cijk_Ailk_Bjlk_BBH_MT128x128x16_MI32x32x4x1_SE_AF0EM8_GRVW8_GSU1_SU0_SUS256_SRVW4_WG64_4_1_WGM1
    SolutionIndex: 115
    SolutionNameMin: Cijk_Ailk_Bjlk_BBH_MT128x256x32_MI32x32x4x1_SE_AF0EM8_GRVW8_GSU1_SU0_SUS256_SRVW4_WG64_4_1_WGM1
    SolutionIndex: 116
    SolutionNameMin: Cijk_Ailk_Bjlk_BBH_MT128x128x16_MI32x32x4x1_SE_AF0EM8_GRVW8_GSU1_SU32_SUS128_SRVW4_WG64_4_1_WGM2
    SolutionIndex: 117
    SolutionNameMin: Cijk_Ailk_Bjlk_BBH_MT128x128x16_MI32x32x4x1_SE_AF0EM8_GRVW8_GSU1_SU32_SUS128_SRVW4_WG64_4_1_WGM15
    SolutionIndex: 118
    SolutionNameMin: Cijk_Ailk_Bjlk_BBH_MT128x256x32_MI32x32x4x1_SE_AF0EM8_GRVW8_GSU1_SU32_SUS128_SRVW4_WG64_4_1_WGM15
    SolutionIndex: 119
    SolutionNameMin: Cijk_Ailk_Bjlk_BBH_MT128x128x16_MI32x32x4x1_SE_AF0EM8_GRVW8_GSU1_SU32_SUS256_SRVW4_WG64_4_1_WGM15
    SolutionIndex: 120
    SolutionNameMin: Cijk_Ailk_Bjlk_BBH_MT128x144x32_MI16x16x8x1_SE_AF0EM8_GRVW2_GSU2_SU0_SUS256_SRVW0_WG64_4_1_WGM1
    SolutionIndex: 121
    SolutionNameMin: Cijk_Ailk_Bjlk_BBH_MT128x160x32_MI32x32x4x1_SE_AF0EM8_GRVW2_GSU2_SU32_SUS256_SRVW0_WG128_2_1_WGM1
    SolutionIndex: 122
    SolutionNameMin: Cijk_Ailk_Bjlk_BBH_MT96x128x32_MI32x32x4x1_SE_AF0EM8_GRVW4_GSU3_SU0_SUS256_SRVW0_WG32_8_1_WGM1
    SolutionIndex: 123
    SolutionNameMin: Cijk_Ailk_Bjlk_BBH_MT32x64x64_MI16x16x8x1_SE_AF0EM8_GRVW8_GSU3_SU32_SUS128_SRVW0_WG32_8_1_WGM1
    SolutionIndex: 124
    SolutionNameMin: Cijk_Ailk_Bjlk_BBH_MT64x64x64_MI32x32x4x1_SE_AF0EM8_GRVW8_GSU3_SU32_SUS256_SRVW0_WG64_4_1_WGM1
    SolutionIndex: 125
    SolutionNameMin: Cijk_Ailk_Bjlk_BBH_MT128x128x16_MI32x32x4x1_SE_AF0EM8_GRVW8_GSU3_SU0_SUS256_SRVW0_WG64_4_1_WGM2
    SolutionIndex: 126
    SolutionNameMin: Cijk_Ailk_Bjlk_BBH_MT96x128x64_MI32x32x4x1_SE_AF0EM8_GRVW8_GSU3_SU0_SUS256_SRVW0_WG32_8_1_WGM2
    SolutionIndex: 127
    SolutionNameMin: Cijk_Ailk_Bjlk_BBH_MT128x64x32_MI32x32x4x1_SE_AF0EM8_GRVW8_GSU3_SU0_SUS256_SRVW0_WG64_4_1_WGM15
    SolutionIndex: 128
    SolutionNameMin: Cijk_Ailk_Bjlk_BBH_MT32x64x64_MI16x16x8x1_SE_AF0EM8_GRVW8_GSU3_SU0_SUS256_SRVW0_WG32_8_1_WGM15
    SolutionIndex: 129
    SolutionNameMin: Cijk_Ailk_Bjlk_BBH_MT128x96x32_MI32x32x4x1_SE_AF0EM8_GRVW4_GSU5_SU0_SUS256_SRVW0_WG128_2_1_WGM1
    SolutionIndex: 130
    SolutionNameMin: Cijk_Ailk_Bjlk_BBH_MT96x128x32_MI32x32x4x1_SE_AF0EM8_GRVW4_GSU5_SU0_SUS256_SRVW0_WG32_8_1_WGM1
    SolutionIndex: 131
    SolutionNameMin: Cijk_Ailk_Bjlk_BBH_MT96x128x32_MI32x32x4x1_SE_AF0EM8_GRVW4_GSU5_SU32_SUS128_SRVW0_WG32_8_1_WGM1
    SolutionIndex: 132
    SolutionNameMin: Cijk_Ailk_Bjlk_BBH_MT96x128x32_MI32x32x4x1_SE_AF0EM8_GRVW4_GSU5_SU32_SUS128_SRVW0_WG32_8_1_WGM2
    SolutionIndex: 133
    SolutionNameMin: Cijk_Ailk_Bjlk_BBH_MT96x128x32_MI32x32x4x1_SE_AF0EM8_GRVW4_GSU5_SU0_SUS256_SRVW0_WG32_8_1_WGM15
    SolutionIndex: 134
    SolutionNameMin: Cijk_Ailk_Bjlk_BBH_MT96x96x32_MI16x16x8x1_SE_AF0EM8_GRVW4_GSU7_SU0_SUS256_SRVW0_WG32_8_1_WGM1
    SolutionIndex: 135
    SolutionNameMin: Cijk_Ailk_Bjlk_BBH_MT128x64x64_MI32x32x4x1_SE_AF0EM8_GRVW4_GSU7_SU32_SUS128_SRVW0_WG64_4_1_WGM1
    SolutionIndex: 136
    SolutionNameMin: Cijk_Ailk_Bjlk_BBH_MT256x64x32_MI32x32x4x1_SE_AF0EM8_GRVW8_GSU7_SU32_SUS128_SRVW0_WG64_4_1_WGM1
    SolutionIndex: 137
    SolutionNameMin: Cijk_Ailk_Bjlk_BBH_MT128x64x64_MI32x32x4x1_SE_AF0EM8_GRVW8_GSU7_SU0_SUS256_SRVW0_WG64_4_1_WGM2
    SolutionIndex: 138
    SolutionNameMin: Cijk_Ailk_Bjlk_BBH_MT256x64x32_MI32x32x4x1_SE_AF0EM8_GRVW8_GSU7_SU32_SUS128_SRVW0_WG64_4_1_WGM2
    SolutionIndex: 139
    SolutionNameMin: Cijk_Ailk_Bjlk_BBH_MT96x96x32_MI16x16x8x1_SE_AF0EM8_GRVW4_GSU7_SU0_SUS256_SRVW0_WG32_8_1_WGM15
    SolutionIndex: 140
    SolutionNameMin: Cijk_Ailk_Bjlk_BBH_MT128x128x16_MI32x32x4x1_SE_AF0EM8_GRVW8_GSU7_SU0_SUS256_SRVW0_WG64_4_1_WGM1
    SolutionIndex: 141
    SolutionNameMin: Cijk_Ailk_Bjlk_BBH_MT32x32x64_MI16x16x8x1_SE_AF0EM8_GRVW8_GSU15_SU0_SUS256_SRVW0_WG32_8_1_WGM1
    SolutionIndex: 142
    SolutionNameMin: Cijk_Ailk_Bjlk_BBH_MT64x64x64_MI32x32x4x1_SE_AF0EM8_GRVW8_GSU15_SU32_SUS128_SRVW0_WG64_4_1_WGM1
    SolutionIndex: 143
    SolutionNameMin: Cijk_Ailk_Bjlk_BBH_MT32x32x16_MI16x16x8x1_SE_AF0EM8_GRVW2_GSU15_SU0_SUS256_SRVW0_WG32_8_1_WGM2
    SolutionIndex: 144
    SolutionNameMin: Cijk_Ailk_Bjlk_BBH_MT64x32x64_MI16x16x8x1_SE_AF0EM8_GRVW8_GSU15_SU0_SUS256_SRVW0_WG32_8_1_WGM2
    SolutionIndex: 145
    SolutionNameMin: Cijk_Ailk_Bjlk_BBH_MT64x32x64_MI16x16x8x1_SE_AF0EM8_GRVW8_GSU15_SU32_SUS128_SRVW0_WG32_8_1_WGM2
    SolutionIndex: 146
    SolutionNameMin: Cijk_Ailk_Bjlk_BBH_MT64x32x32_MI16x16x8x1_SE_AF0EM8_GRVW8_GSU15_SU32_SUS256_SRVW0_WG32_8_1_WGM2
    SolutionIndex: 147
    SolutionNameMin: Cijk_Ailk_Bjlk_BBH_MT64x64x64_MI32x32x4x1_SE_AF0EM8_GRVW8_GSU15_SU32_SUS128_SRVW0_WG64_4_1_WGM15
    SolutionIndex: 148
    SolutionNameMin: Cijk_Ailk_Bjlk_BBH_MT64x64x16_MI32x32x4x1_SE_AF0EM1_GRVW2_GSU1_SU0_SUS256_SRVW4_WG64_4_1_WGM1
    SolutionIndex: 149
    SolutionNameMin: Cijk_Ailk_Bjlk_BBH_MT32x64x16_MI16x16x8x1_SE_AF0EM1_GRVW2_GSU1_SU0_SUS256_SRVW4_WG32_8_1_WGM1
    SolutionIndex: 150
    SolutionNameMin: Cijk_Ailk_Bjlk_BBH_MT32x32x32_MI16x16x8x1_SE_AF0EM1_GRVW2_GSU1_SU0_SUS256_SRVW4_WG32_8_1_WGM1
    SolutionIndex: 151
    SolutionNameMin: Cijk_Ailk_Bjlk_BBH_MT32x64x16_MI16x16x8x1_SE_AF0EM1_GRVW4_GSU1_SU0_SUS256_SRVW4_WG32_8_1_WGM1
    SolutionIndex: 152
    SolutionNameMin: Cijk_Ailk_Bjlk_BBH_MT32x64x16_MI16x16x8x1_SE_AF0EM1_GRVW8_GSU1_SU0_SUS256_SRVW4_WG32_8_1_WGM1
    SolutionIndex: 153
    SolutionNameMin: Cijk_Ailk_Bjlk_BBH_MT32x32x32_MI16x16x8x1_SE_AF0EM1_GRVW8_GSU1_SU0_SUS256_SRVW4_WG32_8_1_WGM1
    SolutionIndex: 154
    SolutionNameMin: Cijk_Ailk_Bjlk_BBH_MT64x64x16_MI32x32x4x1_SE_AF0EM1_GRVW2_GSU1_SU32_SUS256_SRVW4_WG64_4_1_WGM1
    SolutionIndex: 155
    SolutionNameMin: Cijk_Ailk_Bjlk_BBH_MT32x32x64_MI16x16x8x1_SE_AF0EM1_GRVW4_GSU1_SU32_SUS256_SRVW4_WG32_8_1_WGM1
    SolutionIndex: 156
    SolutionNameMin: Cijk_Ailk_Bjlk_BBH_MT32x64x16_MI16x16x8x1_SE_AF0EM1_GRVW2_GSU1_SU0_SUS256_SRVW4_WG32_8_1_WGM2
    SolutionIndex: 157
    SolutionNameMin: Cijk_Ailk_Bjlk_BBH_MT32x32x64_MI16x16x8x1_SE_AF0EM1_GRVW8_GSU1_SU0_SUS256_SRVW4_WG32_8_1_WGM2
    SolutionIndex: 158
    SolutionNameMin: Cijk_Ailk_Bjlk_BBH_MT32x64x16_MI16x16x8x1_SE_AF0EM1_GRVW2_GSU1_SU32_SUS128_SRVW4_WG32_8_1_WGM2
    SolutionIndex: 159
    SolutionNameMin: Cijk_Ailk_Bjlk_BBH_MT32x64x16_MI16x16x8x1_SE_AF0EM1_GRVW4_GSU1_SU32_SUS128_SRVW4_WG32_8_1_WGM2
    SolutionIndex: 160
    SolutionNameMin: Cijk_Ailk_Bjlk_BBH_MT64x64x32_MI32x32x4x1_SE_AF0EM1_GRVW8_GSU1_SU32_SUS128_SRVW4_WG64_4_1_WGM2
    SolutionIndex: 161
    SolutionNameMin: Cijk_Ailk_Bjlk_BBH_MT32x32x64_MI16x16x8x1_SE_AF0EM1_GRVW8_GSU1_SU32_SUS256_SRVW4_WG32_8_1_WGM2
    SolutionIndex: 162
    SolutionNameMin: Cijk_Ailk_Bjlk_BBH_MT64x32x16_MI16x16x8x1_SE_AF0EM1_GRVW2_GSU1_SU0_SUS256_SRVW4_WG32_8_1_WGM15
    SolutionIndex: 163
    SolutionNameMin: Cijk_Ailk_Bjlk_BBH_MT32x64x16_MI16x16x8x1_SE_AF0EM1_GRVW2_GSU1_SU32_SUS128_SRVW4_WG32_8_1_WGM15
    SolutionIndex: 164
    SolutionNameMin: Cijk_Ailk_Bjlk_BBH_MT32x64x16_MI16x16x8x1_SE_AF0EM1_GRVW8_GSU1_SU32_SUS128_SRVW4_WG32_8_1_WGM15
    SolutionIndex: 165
    SolutionNameMin: Cijk_Ailk_Bjlk_BBH_MT32x32x64_MI16x16x8x1_SE_AF0EM1_GRVW8_GSU1_SU32_SUS128_SRVW4_WG32_8_1_WGM15
    SolutionIndex: 166
    SolutionNameMin: Cijk_Ailk_Bjlk_BBH_MT96x128x64_MI32x32x4x1_SE_AF0EM1_GRVW8_GSU3_SU32_SUS128_SRVW0_WG32_8_1_WGM2
    SolutionIndex: 167
    SolutionNameMin: Cijk_Ailk_Bjlk_BBH_MT32x32x64_MI16x16x8x1_SE_AF0EM1_GRVW4_GSU15_SU0_SUS256_SRVW0_WG32_8_1_WGM1
    SolutionIndex: 168
    SolutionNameMin: Cijk_Ailk_Bjlk_BBH_MT32x32x64_MI16x16x8x1_SE_AF0EM1_GRVW8_GSU15_SU0_SUS256_SRVW0_WG32_8_1_WGM1
    SolutionIndex: 169
    SolutionNameMin: Cijk_Ailk_Bjlk_BBH_MT32x32x64_MI16x16x8x1_SE_AF0EM1_GRVW8_GSU15_SU0_SUS256_SRVW0_WG32_8_1_WGM15
    SolutionIndex: 170
    SolutionNameMin: Cijk_Ailk_Bjlk_BBH_MT16x16x16_MI16x16x8x1_SE_AF0EM1_GRVW2_GSU1_SU0_SUS256_SRVW0_WG16_4_1_WGM1
    SolutionIndex: 171
    SolutionNameMin: Cijk_Ailk_Bjlk_BBH_MT64x16x32_MI16x16x8x1_SE_AF0EM8_GRVW2_GSU1_SU0_SUS256_SRVW0_WG64_4_1_WGM1
    SolutionIndex: 172
    SolutionNameMin: Cijk_Ailk_Bjlk_BBH_MT16x64x32_MI16x16x8x1_SE_AF0EM8_GRVW2_GSU1_SU0_SUS256_SRVW0_WG16_16_1_WGM1
    SolutionIndex: 173
    SolutionNameMin: Cijk_Ailk_Bjlk_BBH_MT16x16x16_MI16x16x8x1_SE_AF0EM8_GRVW4_GSU1_SU0_SUS256_SRVW0_WG16_4_1_WGM1
    SolutionIndex: 174
    SolutionNameMin: Cijk_Ailk_Bjlk_BBH_MT64x16x32_MI16x16x8x1_SE_AF0EM8_GRVW4_GSU1_SU0_SUS256_SRVW0_WG64_4_1_WGM1
    SolutionIndex: 175
    SolutionNameMin: Cijk_Ailk_Bjlk_BBH_MT16x16x16_MI16x16x8x1_SE_AF0EM1_GRVW8_GSU1_SU0_SUS256_SRVW0_WG16_4_1_WGM1
    SolutionIndex: 176
    SolutionNameMin: Cijk_Ailk_Bjlk_BBH_MT64x16x32_MI16x16x8x1_SE_AF0EM8_GRVW8_GSU1_SU0_SUS256_SRVW0_WG64_4_1_WGM1
    SolutionIndex: 177
    SolutionNameMin: Cijk_Ailk_Bjlk_BBH_MT16x16x64_MI16x16x8x1_SE_AF0EM1_GRVW8_GSU1_SU0_SUS256_SRVW0_WG16_4_1_WGM1
    SolutionIndex: 178
    SolutionNameMin: Cijk_Ailk_Bjlk_BBH_MT16x16x16_MI16x16x8x1_SE_AF0EM1_GRVW2_GSU1_SU32_SUS128_SRVW0_WG16_4_1_WGM1
    SolutionIndex: 179
    SolutionNameMin: Cijk_Ailk_Bjlk_BBH_MT64x16x32_MI16x16x8x1_SE_AF0EM8_GRVW2_GSU1_SU32_SUS128_SRVW0_WG64_4_1_WGM1
    SolutionIndex: 180
    SolutionNameMin: Cijk_Ailk_Bjlk_BBH_MT16x64x64_MI16x16x8x1_SE_AF0EM8_GRVW2_GSU1_SU32_SUS256_SRVW0_WG16_16_1_WGM1
    SolutionIndex: 181
    SolutionNameMin: Cijk_Ailk_Bjlk_BBH_MT16x16x16_MI16x16x8x1_SE_AF0EM1_GRVW2_GSU1_SU0_SUS256_SRVW0_WG16_4_1_WGM2
    SolutionIndex: 182
    SolutionNameMin: Cijk_Ailk_Bjlk_BBH_MT16x16x16_MI16x16x8x1_SE_AF0EM8_GRVW2_GSU1_SU0_SUS256_SRVW0_WG16_4_1_WGM2
    SolutionIndex: 183
    SolutionNameMin: Cijk_Ailk_Bjlk_BBH_MT16x64x32_MI16x16x8x1_SE_AF0EM8_GRVW2_GSU1_SU0_SUS256_SRVW0_WG16_16_1_WGM2
    SolutionIndex: 184
    SolutionNameMin: Cijk_Ailk_Bjlk_BBH_MT16x16x16_MI16x16x8x1_SE_AF0EM1_GRVW2_GSU1_SU32_SUS256_SRVW0_WG16_4_1_WGM2
    SolutionIndex: 185
    SolutionNameMin: Cijk_Ailk_Bjlk_BBH_MT16x16x16_MI16x16x8x1_SE_AF0EM1_GRVW2_GSU1_SU0_SUS256_SRVW0_WG16_4_1_WGM15
    SolutionIndex: 186
    SolutionNameMin: Cijk_Ailk_Bjlk_BBH_MT16x16x16_MI16x16x8x1_SE_AF0EM8_GRVW2_GSU1_SU0_SUS256_SRVW0_WG16_4_1_WGM15
    SolutionIndex: 187
    SolutionNameMin: Cijk_Ailk_Bjlk_BBH_MT64x16x32_MI16x16x8x1_SE_AF0EM8_GRVW8_GSU1_SU0_SUS256_SRVW0_WG64_4_1_WGM15
    SolutionIndex: 188
    SolutionNameMin: Cijk_Ailk_Bjlk_BBH_MT16x16x16_MI16x16x8x1_SE_AF0EM1_GRVW2_GSU1_SU32_SUS128_SRVW0_WG16_4_1_WGM15
    SolutionIndex: 189
    SolutionNameMin: Cijk_Ailk_Bjlk_BBH_MT64x16x64_MI16x16x8x1_SE_AF0EM8_GRVW2_GSU15_SU0_SUS256_SRVW0_WG64_4_1_WGM1
    SolutionIndex: 190
    SolutionNameMin: Cijk_Ailk_Bjlk_BBH_MT64x16x32_MI16x16x8x1_SE_AF0EM1_GRVW8_GSU15_SU0_SUS256_SRVW0_WG64_4_1_WGM1
    SolutionIndex: 191
    SolutionNameMin: Cijk_Ailk_Bjlk_BBH_MT64x16x32_MI16x16x8x1_SE_AF0EM8_GRVW8_GSU15_SU0_SUS256_SRVW0_WG64_4_1_WGM1
    SolutionIndex: 192
    SolutionNameMin: Cijk_Ailk_Bjlk_BBH_MT16x64x64_MI16x16x8x1_SE_AF0EM1_GRVW8_GSU15_SU0_SUS256_SRVW0_WG16_16_1_WGM1
    SolutionIndex: 193
    SolutionNameMin: Cijk_Ailk_Bjlk_BBH_MT64x16x32_MI16x16x8x1_SE_AF0EM8_GRVW2_GSU15_SU0_SUS256_SRVW0_WG64_4_1_WGM2
    SolutionIndex: 194
    SolutionNameMin: Cijk_Ailk_Bjlk_BBH_MT64x16x32_MI16x16x8x1_SE_AF0EM8_GRVW4_GSU15_SU0_SUS256_SRVW0_WG64_4_1_WGM2
    SolutionIndex: 195
    SolutionNameMin: Cijk_Ailk_Bjlk_BBH_MT16x64x64_MI16x16x8x1_SE_AF0EM1_GRVW8_GSU15_SU0_SUS256_SRVW0_WG16_16_1_WGM2
- - - [7680, 8192, 1, 8192, 8384, 8384, 8384, 8384]
    - [118, 65669.0]
  - - [3840, 4096, 1, 4096, 4192, 4192, 4192, 4192]
    - [18, 64902.0]
  - - [1920, 2048, 1, 2048, 2080, 2080, 2080, 2080]
    - [64, 61008.0]
  - - [960, 1024, 1, 1024, 1056, 1056, 1056, 1056]
    - [44, 41804.0]
  - - [480, 512, 1, 512, 544, 544, 544, 544]
    - [27, 11565.0]
  - - [8192, 7680, 1, 8192, 8384, 8384, 8384, 8384]
    - [18, 65698.0]
  - - [4096, 3840, 1, 4096, 4192, 4192, 4192, 4192]
    - [83, 64902.0]
  - - [2048, 1920, 1, 2048, 2080, 2080, 2080, 2080]
    - [23, 60824.0]
  - - [1024, 960, 1, 1024, 1056, 1056, 1056, 1056]
    - [90, 40201.0]
  - - [512, 480, 1, 512, 544, 544, 544, 544]
    - [92, 11565.0]
  - - [8192, 8192, 1, 8192, 8384, 8384, 8384, 8384]
    - [105, 63959.0]
  - - [4096, 4096, 1, 4096, 4192, 4192, 4192, 4192]
    - [29, 61731.0]
  - - [2048, 2048, 1, 2048, 2080, 2080, 2080, 2080]
    - [12, 55808.0]
  - - [1024, 1024, 1, 1024, 1056, 1056, 1056, 1056]
    - [56, 34065.0]
  - - [512, 512, 1, 512, 544, 544, 544, 544]
    - [92, 11336.0]
  - - [64, 512, 16, 512, 64, 64, 64, 512]
    - [20, 17660.0]
  - - [1024, 2, 1, 1, 1024, 1024, 1024, 2]
    - [0, 0.0]
  - - [1024, 2, 1, 512, 1024, 1024, 1024, 2]
    - [180, 97.0]
  - - [1024, 1024, 1, 1, 1024, 1024, 1024, 1024]
    - [10, 151.0]
  - - [1024, 1024, 1, 77, 1024, 1024, 1024, 1024]
    - [76, 8776.0]
  - - [1024, 1024, 1, 512, 1024, 1024, 1024, 1024]
    - [86, 28316.0]
  - - [1024, 4096, 1, 512, 1024, 1024, 1024, 4096]
    - [32, 43577.0]
  - - [1024, 30522, 1, 77, 1024, 1024, 1024, 30522]
    - [4, 29667.0]
  - - [4096, 1024, 1, 512, 4096, 4096, 4096, 1024]
    - [105, 45040.0]
  - - [64, 128, 160, 128, 64, 64, 64, 128]
    - [86, 16009.0]
  - - [1024, 2, 1, 10, 1024, 1024, 1024, 2]
    - [172, 4.0]
  - - [1024, 2, 1, 1280, 1024, 1024, 1024, 2]
    - [143, 204.0]
  - - [1024, 1024, 1, 10, 1024, 1024, 1024, 1024]
    - [3, 1394.0]
  - - [1024, 1024, 1, 200, 1024, 1024, 1024, 1024]
    - [86, 15792.0]
  - - [1024, 1024, 1, 1280, 1024, 1024, 1024, 1024]
    - [70, 33757.0]
  - - [1024, 4096, 1, 1280, 1024, 1024, 1024, 4096]
    - [68, 52265.0]
  - - [1024, 30522, 1, 200, 1024, 1024, 1024, 30522]
    - [97, 49673.0]
  - - [4096, 1024, 1, 1280, 4096, 4096, 4096, 1024]
    - [96, 53644.0]
  - - [64, 128, 624, 128, 64, 64, 64, 128]
    - [15, 22782.0]
  - - [1024, 2, 1, 39, 1024, 1024, 1024, 2]
    - [172, 13.0]
  - - [1024, 2, 1, 4992, 1024, 1024, 1024, 2]
    - [189, 592.0]
  - - [1024, 1024, 1, 39, 1024, 1024, 1024, 1024]
    - [76, 5163.0]
  - - [1024, 1024, 1, 780, 1024, 1024, 1024, 1024]
    - [99, 29127.0]
  - - [1024, 1024, 1, 4992, 1024, 1024, 1024, 1024]
    - [13, 41491.0]
  - - [1024, 4096, 1, 4992, 1024, 1024, 1024, 4096]
    - [96, 58748.0]
  - - [1024, 30522, 1, 780, 1024, 1024, 1024, 30522]
    - [119, 60776.0]
  - - [4096, 1024, 1, 4992, 4096, 4096, 4096, 1024]
    - [96, 58854.0]
  - - [64, 512, 64, 512, 64, 64, 64, 512]
    - [32, 31213.0]
  - - [1024, 2, 1, 4, 1024, 1024, 1024, 2]
    - [0, 1.0]
  - - [1024, 2, 1, 2048, 1024, 1024, 1024, 2]
    - [191, 314.0]
  - - [1024, 1024, 1, 4, 1024, 1024, 1024, 1024]
    - [19, 603.0]
  - - [1024, 1024, 1, 308, 1024, 1024, 1024, 1024]
    - [77, 20185.0]
  - - [1024, 1024, 1, 2048, 1024, 1024, 1024, 1024]
    - [13, 35696.0]
  - - [1024, 4096, 1, 2048, 1024, 1024, 1024, 4096]
    - [105, 55462.0]
  - - [1024, 30522, 1, 308, 1024, 1024, 1024, 30522]
    - [117, 55349.0]
  - - [4096, 1024, 1, 2048, 4096, 4096, 4096, 1024]
    - [105, 55605.0]
  - - [64, 128, 640, 128, 64, 64, 64, 128]
    - [7, 22192.0]
  - - [1024, 2, 1, 40, 1024, 1024, 1024, 2]
    - [176, 13.0]
  - - [1024, 2, 1, 5120, 1024, 1024, 1024, 2]
    - [190, 604.0]
  - - [1024, 1024, 1, 40, 1024, 1024, 1024, 1024]
    - [85, 5350.0]
  - - [1024, 1024, 1, 800, 1024, 1024, 1024, 1024]
    - [99, 30840.0]
  - - [1024, 1024, 1, 5120, 1024, 1024, 1024, 1024]
    - [13, 41657.0]
  - - [1024, 4096, 1, 5120, 1024, 1024, 1024, 4096]
    - [105, 58432.0]
  - - [1024, 30522, 1, 800, 1024, 1024, 1024, 30522]
    - [119, 61464.0]
  - - [4096, 1024, 1, 5120, 4096, 4096, 4096, 1024]
    - [68, 58893.0]
  - - [64, 128, 656, 128, 64, 64, 64, 128]
    - [93, 22450.0]
  - - [1024, 2, 1, 41, 1024, 1024, 1024, 2]
    - [187, 14.0]
  - - [1024, 2, 1, 5248, 1024, 1024, 1024, 2]
    - [191, 625.0]
  - - [1024, 1024, 1, 41, 1024, 1024, 1024, 1024]
    - [85, 5269.0]
  - - [1024, 1024, 1, 820, 1024, 1024, 1024, 1024]
    - [44, 28892.0]
  - - [1024, 1024, 1, 5248, 1024, 1024, 1024, 1024]
    - [13, 41765.0]
  - - [1024, 4096, 1, 5248, 1024, 1024, 1024, 4096]
    - [96, 58666.0]
  - - [1024, 30522, 1, 820, 1024, 1024, 1024, 30522]
    - [117, 61125.0]
  - - [4096, 1024, 1, 5248, 4096, 4096, 4096, 1024]
    - [96, 58754.0]
  - - [64, 512, 80, 512, 64, 64, 64, 512]
    - [69, 36003.0]
  - - [1024, 2, 1, 5, 1024, 1024, 1024, 2]
    - [2, 2.0]
  - - [1024, 2, 1, 2560, 1024, 1024, 1024, 2]
    - [191, 379.0]
  - - [1024, 1024, 1, 5, 1024, 1024, 1024, 1024]
    - [19, 753.0]
  - - [1024, 1024, 1, 385, 1024, 1024, 1024, 1024]
    - [86, 23362.0]
  - - [1024, 1024, 1, 2560, 1024, 1024, 1024, 1024]
    - [13, 37283.0]
  - - [1024, 4096, 1, 2560, 1024, 1024, 1024, 4096]
    - [96, 56584.0]
  - - [1024, 30522, 1, 385, 1024, 1024, 1024, 30522]
    - [117, 56931.0]
  - - [4096, 1024, 1, 2560, 4096, 4096, 4096, 1024]
    - [96, 56608.0]
  - - [64, 512, 96, 512, 64, 64, 64, 512]
    - [32, 35320.0]
  - - [1024, 2, 1, 6, 1024, 1024, 1024, 2]
    - [0, 2.0]
  - - [1024, 2, 1, 3072, 1024, 1024, 1024, 2]
    - [191, 423.0]
  - - [1024, 1024, 1, 6, 1024, 1024, 1024, 1024]
    - [9, 874.0]
  - - [1024, 1024, 1, 462, 1024, 1024, 1024, 1024]
    - [86, 24126.0]
  - - [1024, 1024, 1, 3072, 1024, 1024, 1024, 1024]
    - [13, 38791.0]
  - - [1024, 4096, 1, 3072, 1024, 1024, 1024, 4096]
    - [105, 57195.0]
  - - [1024, 30522, 1, 462, 1024, 1024, 1024, 30522]
    - [97, 57888.0]
  - - [4096, 1024, 1, 3072, 4096, 4096, 4096, 1024]
    - [68, 57256.0]
  - - [64, 128, 128, 128, 64, 64, 64, 128]
    - [11, 13107.0]
  - - [1024, 2, 1, 8, 1024, 1024, 1024, 2]
    - [2, 3.0]
  - - [1024, 2, 1, 1024, 1024, 1024, 1024, 2]
    - [193, 171.0]
  - - [1024, 1024, 1, 8, 1024, 1024, 1024, 1024]
    - [3, 1192.0]
  - - [1024, 1024, 1, 160, 1024, 1024, 1024, 1024]
    - [86, 16384.0]
  - - [1024, 1024, 1, 1024, 1024, 1024, 1024, 1024]
    - [86, 32187.0]
  - - [1024, 4096, 1, 1024, 1024, 1024, 1024, 4096]
    - [105, 50696.0]
  - - [1024, 30522, 1, 160, 1024, 1024, 1024, 30522]
    - [97, 49065.0]
  - - [4096, 1024, 1, 1024, 4096, 4096, 4096, 1024]
    - [96, 50985.0]
  - - [64, 128, 144, 128, 64, 64, 64, 128]
    - [56, 14519.0]
  - - [1024, 2, 1, 9, 1024, 1024, 1024, 2]
    - [2, 3.0]
  - - [1024, 2, 1, 1152, 1024, 1024, 1024, 2]
    - [194, 194.0]
  - - [1024, 1024, 1, 9, 1024, 1024, 1024, 1024]
    - [3, 1282.0]
  - - [1024, 1024, 1, 180, 1024, 1024, 1024, 1024]
    - [77, 14474.0]
  - - [1024, 1024, 1, 1152, 1024, 1024, 1024, 1024]
    - [86, 32683.0]
  - - [1024, 4096, 1, 1152, 1024, 1024, 1024, 4096]
    - [96, 51315.0]
  - - [1024, 30522, 1, 180, 1024, 1024, 1024, 30522]
    - [97, 48801.0]
  - - [4096, 1024, 1, 1152, 4096, 4096, 4096, 1024]
    - [96, 52795.0]
  - - [256, 128, 1, 32768, 256, 256, 256, 128]
    - [147, 25372.0]
  - - [256, 32768, 1, 1, 256, 256, 256, 32768]
    - [0, 479.0]
  - - [512, 256, 1, 32768, 512, 512, 512, 256]
    - [137, 41553.0]
  - - [1024, 512, 1, 32768, 1024, 1024, 1024, 512]
    - [140, 47553.0]
  - - [1024, 1024, 1, 32768, 1024, 1024, 1024, 1024]
    - [121, 49578.0]
  - - [64, 128, 512, 128, 64, 64, 64, 128]
    - [74, 21304.0]
  - - [128, 64, 512, 128, 128, 128, 128, 64]
    - [53, 21441.0]
  - - [1024, 2, 1, 32, 1024, 1024, 1024, 2]
    - [179, 13.0]
  - - [1024, 1024, 1, 32, 1024, 1024, 131072, 1024]
    - [52, 4877.0]
  - - [1024, 1024, 1, 4096, 1024, 1024, 1024, 1024]
    - [106, 40488.0]
  - - [1024, 4096, 1, 4096, 1024, 1024, 1024, 4096]
    - [105, 58009.0]
  - - [1024, 30528, 1, 4096, 1024, 1024, 1024, 30528]
    - [115, 64645.0]
  - - [4096, 1024, 1, 4096, 4096, 4096, 4096, 1024]
    - [96, 58435.0]
  - - [512, 64, 64, 512, 512, 512, 512, 64]
    - [16, 30997.0]
  - - [1024, 1024, 1, 4, 1024, 1024, 524288, 1024]
    - [73, 617.0]
  - - [1024, 30528, 1, 2048, 1024, 1024, 1024, 30528]
    - [117, 63635.0]
  - - [64, 4, 32768, 4, 64, 64, 2097152, 4]
    - [173, 265.0]
  - - [64, 4, 38400, 4, 64, 64, 2457600, 4]
    - [173, 267.0]
  - - [1024, 1024, 1, 8192, 1024, 1024, 1024, 1024]
    - [13, 43366.0]
  - - [1024, 1024, 1, 9600, 1024, 1024, 1024, 1024]
    - [13, 44058.0]
  - - [1024, 4096, 1, 8192, 1024, 1024, 1024, 4096]
    - [105, 59388.0]
  - - [1024, 4096, 1, 9600, 1024, 1024, 1024, 4096]
    - [105, 59727.0]
  - - [1024, 33712, 1, 8192, 1024, 1024, 1024, 33712]
    - [18, 64006.0]
  - - [1024, 33712, 1, 9600, 1024, 1024, 1024, 33712]
    - [115, 64068.0]
  - - [4096, 1024, 1, 8192, 4096, 4096, 4096, 1024]
    - [96, 59636.0]
  - - [4096, 1024, 1, 9600, 4096, 4096, 4096, 1024]
    - [68, 59663.0]
  - - [1024, 1024, 1, 10064, 1024, 1024, 1024, 1024]
    - [61, 43449.0]
  - - [1024, 1024, 1, 10080, 1024, 1024, 1024, 1024]
    - [13, 44128.0]
  - - [1024, 1024, 1, 10200, 1024, 1024, 1024, 1024]
    - [13, 43534.0]
  - - [1024, 1024, 1, 3840, 1024, 1024, 1024, 1024]
    - [13, 40265.0]
  - - [1024, 1024, 1, 3968, 1024, 1024, 1024, 1024]
    - [13, 40411.0]
  - - [1024, 1024, 1, 6528, 1024, 1024, 1024, 1024]
    - [13, 42590.0]
  - - [1024, 1024, 1, 7104, 1024, 1024, 1024, 1024]
    - [13, 42909.0]
  - - [1024, 1024, 1, 7200, 1024, 1024, 1024, 1024]
    - [13, 42994.0]
  - - [1024, 1024, 1, 8064, 1024, 1024, 1024, 1024]
    - [68, 43478.0]
  - - [1024, 1024, 1, 8160, 1024, 1024, 1024, 1024]
    - [68, 43424.0]
  - - [1024, 1024, 1, 9216, 1024, 1024, 1024, 1024]
    - [13, 43798.0]
  - - [1024, 1024, 1, 9520, 1024, 1024, 1024, 1024]
    - [13, 43342.0]
  - - [1024, 4096, 1, 10064, 1024, 1024, 1024, 4096]
    - [105, 59372.0]
  - - [1024, 4096, 1, 10080, 1024, 1024, 1024, 4096]
    - [96, 59574.0]
  - - [1024, 4096, 1, 10200, 1024, 1024, 1024, 4096]
    - [105, 59545.0]
  - - [1024, 4096, 1, 3840, 1024, 1024, 1024, 4096]
    - [96, 57786.0]
  - - [1024, 4096, 1, 3968, 1024, 1024, 1024, 4096]
    - [96, 58372.0]
  - - [1024, 4096, 1, 6528, 1024, 1024, 1024, 4096]
    - [96, 59142.0]
  - - [1024, 4096, 1, 7104, 1024, 1024, 1024, 4096]
    - [105, 59280.0]
  - - [1024, 4096, 1, 7200, 1024, 1024, 1024, 4096]
    - [68, 58945.0]
  - - [1024, 4096, 1, 8064, 1024, 1024, 1024, 4096]
    - [96, 59330.0]
  - - [1024, 4096, 1, 8160, 1024, 1024, 1024, 4096]
    - [105, 59411.0]
  - - [1024, 4096, 1, 9216, 1024, 1024, 1024, 4096]
    - [96, 59711.0]
  - - [1024, 4096, 1, 9520, 1024, 1024, 1024, 4096]
    - [96, 59349.0]
  - - [1024, 42720, 1, 10080, 1024, 1024, 1024, 42720]
    - [61, 63903.0]
  - - [1024, 42720, 1, 3968, 1024, 1024, 1024, 42720]
    - [61, 63451.0]
  - - [1024, 42720, 1, 6528, 1024, 1024, 1024, 42720]
    - [96, 63753.0]
  - - [1024, 42720, 1, 7104, 1024, 1024, 1024, 42720]
    - [61, 63825.0]
  - - [1024, 42720, 1, 7200, 1024, 1024, 1024, 42720]
    - [61, 63779.0]
  - - [1024, 42720, 1, 9520, 1024, 1024, 1024, 42720]
    - [29, 63819.0]
  - - [4096, 1024, 1, 10064, 4096, 4096, 4096, 1024]
    - [96, 59392.0]
  - - [4096, 1024, 1, 10080, 4096, 4096, 4096, 1024]
    - [96, 59574.0]
  - - [4096, 1024, 1, 10200, 4096, 4096, 4096, 1024]
    - [96, 59169.0]
  - - [4096, 1024, 1, 3840, 4096, 4096, 4096, 1024]
    - [68, 58053.0]
  - - [4096, 1024, 1, 3968, 4096, 4096, 4096, 1024]
    - [96, 58470.0]
  - - [4096, 1024, 1, 6528, 4096, 4096, 4096, 1024]
    - [96, 59203.0]
  - - [4096, 1024, 1, 7104, 4096, 4096, 4096, 1024]
    - [68, 59317.0]
  - - [4096, 1024, 1, 7200, 4096, 4096, 4096, 1024]
    - [68, 59437.0]
  - - [4096, 1024, 1, 8064, 4096, 4096, 4096, 1024]
    - [96, 59405.0]
  - - [4096, 1024, 1, 8160, 4096, 4096, 4096, 1024]
    - [68, 59246.0]
  - - [4096, 1024, 1, 9216, 4096, 4096, 4096, 1024]
    - [68, 59505.0]
  - - [4096, 1024, 1, 9520, 4096, 4096, 4096, 1024]
    - [68, 59285.0]
  - - [24, 64, 4736, 24, 24, 24, 24, 303104]
    - [41, 5099.0]
  - - [32, 64, 4608, 32, 32, 32, 32, 294912]
    - [104, 9230.0]
  - - [32, 64, 4608, 35, 32, 32, 32, 294912]
    - [41, 7269.0]
  - - [64, 14, 10880, 14, 64, 64, 696320, 14]
    - [182, 2747.0]
  - - [64, 15, 10880, 14, 64, 64, 696320, 15]
    - [186, 2852.0]
  - - [64, 15, 7680, 15, 64, 64, 491520, 15]
    - [186, 2839.0]
  - - [64, 15, 10880, 15, 64, 64, 696320, 15]
    - [182, 2990.0]
  - - [64, 17, 7680, 15, 64, 64, 491520, 17]
    - [28, 2833.0]
  - - [64, 17, 6144, 17, 64, 64, 393216, 17]
    - [63, 2726.0]
  - - [64, 17, 7680, 17, 64, 64, 491520, 17]
    - [98, 3099.0]
  - - [64, 21, 6144, 17, 64, 64, 393216, 21]
    - [60, 3274.0]
  - - [64, 21, 6144, 21, 64, 64, 393216, 21]
    - [67, 3892.0]
  - - [64, 24, 4736, 24, 64, 64, 303104, 24]
    - [67, 5233.0]
  - - [64, 30, 2048, 30, 64, 64, 131072, 30]
    - [94, 5607.0]
  - - [64, 30, 2048, 31, 64, 64, 131072, 30]
    - [3, 5772.0]
  - - [64, 31, 2048, 31, 64, 64, 131072, 31]
    - [3, 5964.0]
  - - [64, 32, 4608, 32, 64, 64, 294912, 32]
    - [67, 9275.0]
  - - [64, 32, 4608, 35, 64, 64, 294912, 32]
    - [3, 7269.0]
  - - [64, 34, 4736, 24, 64, 64, 303104, 34]
    - [39, 5258.0]
  - - [64, 34, 4736, 34, 64, 64, 303104, 34]
    - [0, 6266.0]
  - - [64, 35, 4608, 35, 64, 64, 294912, 35]
    - [39, 6272.0]
  - - [512, 64, 1, 512, 512, 512, 512, 64]
    - [113, 1678.0]
  - - [64, 512, 1, 512, 64, 64, 64, 512]
    - [92, 1626.0]
  - - [64, 128, 1, 128, 64, 64, 64, 128]
    - [27, 158.0]
  - - [128, 64, 1, 128, 128, 128, 128, 64]
    - [27, 152.0]
  - - [2048, 2048, 1, 512, 2048, 2048, 2048, 2048]
    - [34, 43436.0]
  - - [1024, 64, 1, 512, 1024, 1024, 1024, 64]
    - [37, 3277.0]
  - - [2048, 512, 1, 1, 2048, 2048, 2048, 512]
    - [30, 158.0]
  - - [1600, 1024, 1, 512, 1600, 1600, 1600, 1024]
    - [71, 35187.0]
  - - [512, 32, 1, 1600, 512, 512, 512, 32]
    - [141, 1894.0]
  - - [560, 1024, 1, 1600, 560, 560, 560, 1024]
    - [44, 26796.0]
  - - [1024, 1600, 1, 1, 1024, 1024, 1024, 1600]
    - [19, 225.0]
  - - [1024, 1024, 1, 1600, 1024, 1024, 1024, 1024]
    - [26, 34267.0]
  - - [512, 512, 1, 1600, 512, 512, 512, 512]
    - [112, 16913.0]
  - - [256, 1280, 1, 8976, 256, 256, 256, 1280]
    - [127, 34652.0]
  - - [256, 2560, 1, 8976, 256, 256, 256, 2560]
    - [125, 39704.0]
  - - [256, 2816, 1, 8976, 256, 256, 256, 2816]
    - [26, 41931.0]
  - - [256, 3328, 1, 8976, 256, 256, 256, 3328]
    - [80, 48820.0]
  - - [256, 3584, 1, 8976, 256, 256, 256, 3584]
    - [107, 52469.0]
  - - [256, 3840, 1, 8976, 256, 256, 256, 3840]
    - [91, 55790.0]
  - - [256, 4096, 1, 8976, 256, 256, 256, 4096]
    - [120, 43254.0]
  - - [256, 4352, 1, 8976, 256, 256, 256, 4352]
    - [12, 45655.0]
  - - [256, 4864, 1, 8976, 256, 256, 256, 4864]
    - [12, 50748.0]
  - - [256, 5120, 1, 8976, 256, 256, 256, 5120]
    - [12, 53303.0]
  - - [256, 5632, 1, 8976, 256, 256, 256, 5632]
    - [12, 58379.0]
  - - [256, 5888, 1, 8976, 256, 256, 256, 5888]
    - [108, 47680.0]
  - - [256, 6144, 1, 8976, 256, 256, 256, 6144]
    - [43, 49433.0]
  - - [256, 7168, 1, 8976, 256, 256, 256, 7168]
    - [82, 57591.0]
  - - [256, 8192, 1, 8976, 256, 256, 256, 8192]
    - [6, 55028.0]
  - - [256, 8960, 1, 8976, 256, 256, 256, 8960]
    - [78, 57204.0]
  - - [256, 9728, 1, 8976, 256, 256, 256, 9728]
    - [68, 53324.0]
  - - [256, 9984, 1, 8976, 256, 256, 256, 9984]
    - [96, 55021.0]
  - - [256, 10240, 1, 8976, 256, 256, 256, 10240]
    - [96, 55970.0]
  - - [256, 10496, 1, 8976, 256, 256, 256, 10496]
    - [68, 57392.0]
  - - [256, 11008, 1, 8976, 256, 256, 256, 11008]
    - [68, 59872.0]
  - - [256, 11264, 1, 8976, 256, 256, 256, 11264]
    - [61, 61288.0]
  - - [256, 11520, 1, 8976, 256, 256, 256, 11520]
    - [96, 62788.0]
  - - [256, 11776, 1, 8976, 256, 256, 256, 11776]
    - [26, 52271.0]
  - - [256, 12544, 1, 8976, 256, 256, 256, 12544]
    - [26, 54426.0]
  - - [256, 12800, 1, 8976, 256, 256, 256, 12800]
    - [55, 53516.0]
  - - [256, 13312, 1, 8976, 256, 256, 256, 13312]
    - [64, 55600.0]
  - - [256, 13568, 1, 8976, 256, 256, 256, 13568]
    - [17, 56620.0]
  - - [256, 14336, 1, 8976, 256, 256, 256, 14336]
    - [101, 59738.0]
  - - [256, 14848, 1, 8976, 256, 256, 256, 14848]
    - [64, 61719.0]
  - - [256, 15104, 1, 8976, 256, 256, 256, 15104]
    - [64, 62729.0]
  - - [256, 15872, 1, 8976, 256, 256, 256, 15872]
    - [96, 58373.0]
  - - [256, 16128, 1, 8976, 256, 256, 256, 16128]
    - [61, 59413.0]
  - - [256, 17152, 1, 8976, 256, 256, 256, 17152]
    - [61, 62631.0]
  - - [256, 17408, 1, 8976, 256, 256, 256, 17408]
    - [57, 56794.0]
  - - [256, 18688, 1, 8976, 256, 256, 256, 18688]
    - [21, 60578.0]
  - - [256, 19968, 1, 8976, 256, 256, 256, 19968]
    - [17, 55988.0]
  - - [256, 20480, 1, 8976, 256, 256, 256, 20480]
    - [72, 57345.0]
  - - [256, 20992, 1, 8976, 256, 256, 256, 20992]
    - [114, 58745.0]
  - - [256, 21248, 1, 8976, 256, 256, 256, 21248]
    - [17, 59426.0]
  - - [256, 22016, 1, 8976, 256, 256, 256, 22016]
    - [111, 61473.0]
  - - [256, 26112, 1, 8976, 256, 256, 256, 26112]
    - [100, 60627.0]
  - - [256, 32512, 1, 8976, 256, 256, 256, 32512]
    - [68, 60186.0]
  - - [256, 33536, 1, 8976, 256, 256, 256, 33536]
    - [68, 62038.0]
  - - [256, 44505, 1, 8976, 256, 256, 256, 44505]
    - [18, 62611.0]
  - - [480, 1024, 1, 32768, 480, 480, 480, 1024]
    - [126, 55754.0]
  - - [512, 32, 1, 200, 512, 512, 512, 32]
    - [24, 369.0]
  - - [512, 512, 1, 200, 512, 512, 512, 512]
    - [88, 5554.0]
  - - [512, 2048, 1, 256, 512, 512, 512, 2048]
    - [44, 22075.0]
  - - [560, 1024, 1, 200, 560, 560, 560, 1024]
    - [25, 10025.0]
  - - [768, 2048, 1, 256, 768, 768, 768, 2048]
    - [20, 27206.0]
  - - [1024, 64, 1, 960, 1024, 1024, 1024, 64]
    - [66, 4572.0]
  - - [1024, 256, 1, 1024, 1024, 1024, 1024, 256]
    - [92, 13923.0]
  - - [1024, 256, 1, 1280, 1024, 1024, 1024, 256]
    - [36, 15087.0]
  - - [1024, 256, 1, 2304, 1024, 1024, 1024, 256]
    - [102, 18874.0]
  - - [1024, 256, 1, 2816, 1024, 1024, 1024, 256]
    - [102, 20460.0]
  - - [1024, 256, 1, 3072, 1024, 1024, 1024, 256]
    - [102, 20254.0]
  - - [1024, 256, 1, 3328, 1024, 1024, 1024, 256]
    - [36, 20693.0]
  - - [1024, 256, 1, 3584, 1024, 1024, 1024, 256]
    - [65, 21275.0]
  - - [1024, 256, 1, 4096, 1024, 1024, 1024, 256]
    - [45, 21103.0]
  - - [1024, 256, 1, 4352, 1024, 1024, 1024, 256]
    - [36, 22247.0]
  - - [1024, 256, 1, 4608, 1024, 1024, 1024, 256]
    - [36, 22304.0]
  - - [1024, 256, 1, 5120, 1024, 1024, 1024, 256]
    - [139, 23334.0]
  - - [1024, 256, 1, 5376, 1024, 1024, 1024, 256]
    - [139, 23870.0]
  - - [1024, 256, 1, 5632, 1024, 1024, 1024, 256]
    - [139, 24639.0]
  - - [1024, 256, 1, 6144, 1024, 1024, 1024, 256]
    - [134, 25484.0]
  - - [1024, 256, 1, 6400, 1024, 1024, 1024, 256]
    - [134, 26052.0]
  - - [1024, 256, 1, 7680, 1024, 1024, 1024, 256]
    - [134, 28213.0]
  - - [1024, 256, 1, 7936, 1024, 1024, 1024, 256]
    - [139, 28671.0]
  - - [1024, 256, 1, 8192, 1024, 1024, 1024, 256]
    - [139, 29114.0]
  - - [1024, 256, 1, 8448, 1024, 1024, 1024, 256]
    - [134, 29449.0]
  - - [1024, 256, 1, 9728, 1024, 1024, 1024, 256]
    - [134, 31130.0]
  - - [1024, 256, 1, 9984, 1024, 1024, 1024, 256]
    - [134, 31457.0]
  - - [1024, 256, 1, 10496, 1024, 1024, 1024, 256]
    - [139, 32024.0]
  - - [1024, 256, 1, 11520, 1024, 1024, 1024, 256]
    - [134, 33084.0]
  - - [1024, 256, 1, 12032, 1024, 1024, 1024, 256]
    - [134, 33356.0]
  - - [1024, 256, 1, 13568, 1024, 1024, 1024, 256]
    - [133, 35146.0]
  - - [1024, 256, 1, 14336, 1024, 1024, 1024, 256]
    - [129, 35887.0]
  - - [1024, 256, 1, 14848, 1024, 1024, 1024, 256]
    - [130, 36363.0]
  - - [1024, 256, 1, 15104, 1024, 1024, 1024, 256]
    - [133, 36661.0]
  - - [1024, 256, 1, 15872, 1024, 1024, 1024, 256]
    - [129, 37176.0]
  - - [1024, 256, 1, 16128, 1024, 1024, 1024, 256]
    - [130, 37588.0]
  - - [1024, 256, 1, 17152, 1024, 1024, 1024, 256]
    - [131, 38104.0]
  - - [1024, 256, 1, 17408, 1024, 1024, 1024, 256]
    - [132, 38361.0]
  - - [1024, 256, 1, 18944, 1024, 1024, 1024, 256]
    - [133, 39438.0]
  - - [1024, 256, 1, 19712, 1024, 1024, 1024, 256]
    - [129, 39774.0]
  - - [1024, 256, 1, 19968, 1024, 1024, 1024, 256]
    - [130, 40019.0]
  - - [1024, 256, 1, 21248, 1024, 1024, 1024, 256]
    - [129, 40740.0]
  - - [1024, 256, 1, 21504, 1024, 1024, 1024, 256]
    - [129, 40849.0]
  - - [1024, 256, 1, 22016, 1024, 1024, 1024, 256]
    - [129, 41177.0]
  - - [1024, 256, 1, 28672, 1024, 1024, 1024, 256]
    - [138, 44047.0]
  - - [1024, 256, 1, 33536, 1024, 1024, 1024, 256]
    - [136, 46172.0]
  - - [1024, 1024, 1, 960, 1024, 1024, 1024, 1024]
    - [99, 32598.0]
  - - [1600, 1024, 1, 960, 1600, 1600, 1600, 1024]
    - [35, 41921.0]
  - - [2048, 256, 1, 1024, 2048, 2048, 2048, 256]
    - [65, 23302.0]
  - - [2048, 960, 1, 1, 2048, 2048, 2048, 960]
    - [19, 253.0]
  - - [2048, 2048, 1, 960, 2048, 2048, 2048, 2048]
    - [105, 50585.0]
  - - [2048, 2048, 1, 1024, 2048, 2048, 2048, 2048]
    - [105, 50840.0]
  - - [3200, 2048, 1, 1024, 3200, 3200, 3200, 2048]
    - [35, 55152.0]
  - - [4096, 4096, 1, 1024, 4096, 4096, 4096, 4096]
    - [62, 59176.0]
  - - [2048, 2, 1, 2, 2048, 2048, 2048, 2]
    - [171, 2.0]
  - - [2048, 2048, 1, 2, 2048, 2048, 1048576, 2048]
    - [50, 685.0]
  - - [2048, 30592, 1, 1024, 2048, 2048, 2048, 30592]
    - [97, 63310.0]
  - - [2048, 6144, 1, 1024, 2048, 2048, 2048, 6144]
    - [12, 57873.0]
  - - [2048, 8192, 1, 1024, 2048, 2048, 2048, 8192]
    - [17, 59454.0]
  - - [8192, 2048, 1, 1024, 8192, 8192, 8192, 2048]
    - [116, 59224.0]
  - - [1024, 1024, 1, 16, 1024, 1024, 524288, 1024]
    - [75, 2724.0]
  - - [1024, 2, 1, 16, 1024, 1024, 1024, 2]
    - [2, 6.0]
  - - [1024, 30592, 1, 8192, 1024, 1024, 1024, 30592]
    - [115, 65288.0]
  - - [1024, 3072, 1, 8192, 1024, 1024, 1024, 3072]
    - [49, 55405.0]
  - - [512, 64, 256, 512, 512, 512, 512, 64]
    - [54, 41298.0]
  - - [64, 512, 256, 512, 64, 64, 64, 512]
    - [46, 41650.0]
  - - [1024, 30592, 1, 2048, 1024, 1024, 1024, 30592]
    - [117, 63916.0]
  - - [1024, 3072, 1, 2048, 1024, 1024, 1024, 3072]
    - [14, 51196.0]
  - - [1024, 1024, 1, 8, 1024, 1024, 524288, 1024]
    - [9, 1165.0]
  - - [1024, 30592, 1, 4096, 1024, 1024, 1024, 30592]
    - [115, 64634.0]
  - - [1024, 3072, 1, 4096, 1024, 1024, 1024, 3072]
    - [5, 53651.0]
  - - [512, 64, 128, 512, 512, 512, 512, 64]
    - [54, 36873.0]
  - - [64, 512, 128, 512, 64, 64, 64, 512]
    - [57, 35983.0]
  - - [2560, 1920, 1, 2048, 2560, 2560, 2560, 1920]
    - [42, 59663.0]
  - - [2560, 2, 1, 4, 2560, 2560, 2560, 2]
    - [171, 4.0]
  - - [2560, 2560, 1, 2048, 2560, 2560, 2560, 2560]
    - [22, 58315.0]
  - - [2560, 2560, 1, 4, 2560, 2560, 1310720, 2560]
    - [103, 1647.0]
  - - [2560, 7680, 1, 2048, 2560, 2560, 2560, 7680]
    - [115, 64594.0]
  - - [640, 2560, 1, 2048, 640, 640, 640, 2560]
    - [21, 47771.0]
  - - [512, 64, 40, 512, 512, 512, 512, 64]
    - [56, 30504.0]
  - - [64, 512, 40, 512, 64, 64, 64, 512]
    - [33, 31301.0]
  - - [1536, 1536, 1, 4096, 1536, 1536, 1536, 1536]
    - [48, 55436.0]
  - - [1536, 4608, 1, 4096, 1536, 1536, 1536, 4608]
    - [61, 60967.0]
  - - [1536, 50304, 1, 4096, 1536, 1536, 1536, 50304]
    - [115, 64372.0]
  - - [1536, 6144, 1, 4096, 1536, 1536, 1536, 6144]
    - [64, 61915.0]
  - - [6144, 1536, 1, 4096, 6144, 6144, 6144, 1536]
    - [101, 61796.0]
  - - [1024, 96, 64, 1024, 1024, 1024, 1024, 96]
    - [12, 48483.0]
  - - [96, 1024, 64, 1024, 96, 96, 96, 1024]
    - [79, 49496.0]
  - - [1536, 1536, 1, 8192, 1536, 1536, 1536, 1536]
    - [48, 58910.0]
  - - [1536, 4608, 1, 8192, 1536, 1536, 1536, 4608]
    - [61, 61662.0]
  - - [1536, 50304, 1, 8192, 1536, 1536, 1536, 50304]
    - [115, 64619.0]
  - - [1536, 6144, 1, 8192, 1536, 1536, 1536, 6144]
    - [64, 62419.0]
  - - [6144, 1536, 1, 8192, 6144, 6144, 6144, 1536]
    - [101, 62346.0]
  - - [1024, 96, 128, 1024, 1024, 1024, 1024, 96]
    - [12, 54970.0]
  - - [96, 1024, 128, 1024, 96, 96, 96, 1024]
    - [13, 53208.0]
  - - [1024, 1024, 1, 16384, 1024, 1024, 1024, 1024]
    - [13, 45106.0]
  - - [1024, 3072, 1, 16384, 1024, 1024, 1024, 3072]
    - [49, 56862.0]
  - - [1024, 4096, 1, 16384, 1024, 1024, 1024, 4096]
    - [68, 60120.0]
  - - [1024, 50304, 1, 16384, 1024, 1024, 1024, 50304]
    - [47, 64569.0]
  - - [4096, 1024, 1, 16384, 4096, 4096, 4096, 1024]
    - [96, 60221.0]
  - - [1024, 64, 256, 1024, 1024, 1024, 1024, 64]
    - [87, 52060.0]
  - - [64, 1024, 256, 1024, 64, 64, 64, 1024]
    - [110, 51859.0]
  - - [1024, 50304, 1, 2048, 1024, 1024, 1024, 50304]
    - [42, 62836.0]
  - - [1024, 64, 32, 1024, 1024, 1024, 1024, 64]
    - [56, 37179.0]
  - - [64, 1024, 32, 1024, 64, 64, 64, 1024]
    - [45, 37808.0]
  - - [1024, 50304, 1, 4096, 1024, 1024, 1024, 50304]
    - [105, 63752.0]
  - - [1024, 64, 64, 1024, 1024, 1024, 1024, 64]
    - [22, 44665.0]
  - - [64, 1024, 64, 1024, 64, 64, 64, 1024]
    - [21, 44554.0]
  - - [1024, 50304, 1, 8192, 1024, 1024, 1024, 50304]
    - [95, 64085.0]
  - - [1024, 64, 128, 1024, 1024, 1024, 1024, 64]
    - [87, 49641.0]
  - - [64, 1024, 128, 1024, 64, 64, 64, 1024]
    - [57, 49756.0]
  - - [1024, 2, 1, 64, 1024, 1024, 1024, 2]
    - [174, 22.0]
  - - [1024, 30528, 1, 8192, 1024, 1024, 1024, 30528]
    - [115, 65109.0]
  - - [1024, 1024, 1, 64, 1024, 1024, 131072, 1024]
    - [10, 8648.0]
  - - [64, 128, 1024, 128, 64, 64, 64, 128]
    - [40, 24448.0]
  - - [128, 64, 1024, 128, 128, 128, 128, 64]
    - [1, 24053.0]
  - - [1024, 1024, 1, 3456, 1024, 1024, 1024, 1024]
    - [13, 39356.0]
  - - [1024, 1024, 1, 6912, 1024, 1024, 1024, 1024]
    - [13, 42815.0]
  - - [1024, 1024, 1, 864, 1024, 1024, 1024, 1024]
    - [109, 31722.0]
  - - [1024, 512, 1, 3456, 1024, 1024, 1024, 512]
    - [58, 29415.0]
  - - [1024, 512, 1, 4096, 1024, 1024, 1024, 512]
    - [65, 29727.0]
  - - [1024, 512, 1, 6912, 1024, 1024, 1024, 512]
    - [58, 30963.0]
  - - [1024, 512, 1, 864, 1024, 1024, 1024, 512]
    - [109, 22118.0]
  - - [256, 128, 1, 3456, 256, 256, 256, 128]
    - [144, 6741.0]
  - - [256, 128, 1, 4096, 256, 256, 256, 128]
    - [146, 7523.0]
  - - [256, 128, 1, 55296, 256, 256, 256, 128]
    - [142, 32036.0]
  - - [256, 128, 1, 6912, 256, 256, 256, 128]
    - [145, 11235.0]
  - - [256, 128, 1, 864, 256, 256, 256, 128]
    - [66, 1913.0]
  - - [256, 3456, 1, 1, 256, 256, 256, 3456]
    - [3, 138.0]
  - - [256, 4096, 1, 1, 256, 256, 256, 4096]
    - [9, 160.0]
  - - [256, 6912, 1, 1, 256, 256, 256, 6912]
    - [3, 228.0]
  - - [256, 864, 1, 1, 256, 256, 256, 864]
    - [24, 41.0]
  - - [480, 1024, 1, 3456, 480, 480, 480, 1024]
    - [38, 27793.0]
  - - [480, 1024, 1, 4096, 480, 480, 480, 1024]
    - [122, 28960.0]
  - - [480, 1024, 1, 6912, 480, 480, 480, 1024]
    - [122, 37252.0]
  - - [480, 1024, 1, 864, 480, 480, 480, 1024]
    - [89, 21405.0]
  - - [512, 256, 1, 3456, 512, 512, 512, 256]
    - [123, 15099.0]
  - - [512, 256, 1, 4096, 512, 512, 512, 256]
    - [128, 16408.0]
  - - [512, 256, 1, 55296, 512, 512, 512, 256]
    - [135, 47235.0]
  - - [512, 256, 1, 6912, 512, 512, 512, 256]
    - [124, 21168.0]
  - - [512, 256, 1, 864, 512, 512, 512, 256]
    - [37, 7297.0]
  - - [30528, 1024, 1, 640, 30528, 30528, 30528, 1024]
    - [97, 60117.0]
  - - [1024, 1024, 1, 32, 1024, 1024, 1024, 1024]
    - [76, 4934.0]
  - - [30528, 1024, 1, 1280, 30528, 30528, 30528, 1024]
    - [119, 62686.0]
  - - [1024, 1024, 1, 64, 1024, 1024, 1024, 1024]
    - [76, 8648.0]
  - - [4096, 1024, 1, 10240, 4096, 4096, 4096, 1024]
    - [31, 59579.0]
  - - [1024, 4096, 1, 10240, 1024, 1024, 1024, 4096]
    - [105, 59872.0]
  - - [30528, 1024, 1, 1600, 30528, 30528, 30528, 1024]
    - [119, 63070.0]
  - - [1024, 2, 1, 80, 1024, 1024, 1024, 2]
    - [8, 24.0]
  - - [1024, 1024, 1, 10240, 1024, 1024, 1024, 1024]
    - [13, 44078.0]
  - - [1024, 1024, 1, 80, 1024, 1024, 1024, 1024]
    - [84, 9800.0]
  - - [64, 128, 1280, 128, 64, 64, 64, 128]
    - [46, 25420.0]
  - - [128, 64, 1280, 128, 128, 128, 128, 64]
    - [1, 24245.0]
  - - [1024, 4096, 1, 10496, 1024, 1024, 1024, 4096]
    - [68, 59769.0]
  - - [30528, 1024, 1, 1640, 30528, 30528, 30528, 1024]
    - [119, 62840.0]
  - - [4096, 1024, 1, 10496, 4096, 4096, 4096, 1024]
    - [96, 59555.0]
  - - [1024, 1024, 1, 10496, 1024, 1024, 1024, 1024]
    - [13, 44165.0]
  - - [1024, 1024, 1, 82, 1024, 1024, 1024, 1024]
    - [10, 9265.0]
  - - [1024, 2, 1, 82, 1024, 1024, 1024, 2]
    - [183, 23.0]
  - - [128, 64, 1312, 128, 128, 128, 128, 64]
    - [51, 24779.0]
  - - [64, 128, 1312, 128, 64, 64, 64, 128]
    - [46, 25552.0]
  - - [30528, 1024, 1, 160, 30528, 30528, 30528, 1024]
    - [59, 47150.0]
  - - [1024, 4096, 1, 6144, 1024, 1024, 1024, 4096]
    - [96, 59235.0]
  - - [30528, 1024, 1, 240, 30528, 30528, 30528, 1024]
    - [97, 52510.0]
  - - [4096, 1024, 1, 6144, 4096, 4096, 4096, 1024]
    - [96, 59203.0]
  - - [1024, 1024, 1, 12, 1024, 1024, 1024, 1024]
    - [3, 1710.0]
  - - [1024, 2, 1, 12, 1024, 1024, 1024, 2]
    - [3, 4.0]
  - - [1024, 1024, 1, 6144, 1024, 1024, 1024, 1024]
    - [68, 42318.0]
  - - [64, 512, 192, 512, 64, 64, 64, 512]
    - [46, 39788.0]
  - - [512, 64, 192, 512, 512, 512, 512, 64]
    - [81, 38904.0]
  - - [13, 512, 1, 32768, 13, 13, 13, 512]
    - [195, 6355.0]
  - - [479, 1024, 1, 32768, 479, 479, 479, 1024]
    - [166, 53819.0]
  - - [4, 64, 32768, 4, 4, 4, 4, 2097152]
    - [175, 264.0]
  - - [4, 64, 38400, 4, 4, 4, 4, 2457600]
    - [170, 265.0]
  - - [14, 64, 10880, 14, 14, 14, 14, 696320]
    - [178, 2393.0]
  - - [15, 64, 10880, 14, 15, 15, 15, 696320]
    - [170, 2460.0]
  - - [15, 64, 7680, 15, 15, 15, 15, 491520]
    - [184, 2473.0]
  - - [15, 64, 10880, 15, 15, 15, 15, 696320]
    - [188, 2594.0]
  - - [17, 64, 7680, 15, 17, 17, 17, 491520]
    - [149, 2297.0]
  - - [17, 64, 6144, 17, 17, 17, 17, 393216]
    - [159, 2329.0]
  - - [17, 64, 7680, 17, 17, 17, 17, 491520]
    - [164, 2526.0]
  - - [21, 64, 6144, 17, 21, 21, 21, 393216]
    - [163, 2808.0]
  - - [21, 64, 6144, 21, 21, 21, 21, 393216]
    - [158, 3366.0]
  - - [30, 64, 2048, 30, 30, 30, 30, 131072]
    - [149, 4696.0]
  - - [30, 64, 2048, 31, 30, 30, 30, 131072]
    - [156, 4792.0]
  - - [31, 64, 2048, 31, 31, 31, 31, 131072]
    - [149, 4757.0]
  - - [34, 64, 4736, 24, 34, 34, 34, 303104]
    - [154, 4253.0]
  - - [34, 64, 4736, 34, 34, 34, 34, 303104]
    - [151, 5277.0]
  - - [35, 64, 4608, 35, 35, 35, 35, 294912]
    - [152, 5402.0]
  - - [74, 2048, 1, 512, 74, 74, 74, 2048]
    - [165, 6381.0]
  - - [5, 64, 1, 5, 5, 5, 5, 64]
    - [148, 0.0]
  - - [33, 32, 1, 33, 33, 33, 33, 32]
    - [153, 5.0]
  - - [3, 64, 512, 3, 3, 3, 3, 64]
    - [185, 41.0]
  - - [5, 64, 512, 5, 5, 5, 5, 64]
    - [181, 113.0]
  - - [5, 64, 960, 5, 5, 5, 5, 64]
    - [170, 185.0]
  - - [9, 64, 512, 9, 9, 9, 9, 64]
    - [185, 339.0]
  - - [27, 128, 32768, 27, 27, 27, 27, 128]
    - [158, 6595.0]
  - - [33, 32, 200, 33, 33, 33, 33, 32]
    - [150, 937.0]
  - - [33, 32, 1600, 33, 33, 33, 33, 32]
    - [162, 3057.0]
  - - [67, 2048, 1, 512, 67, 67, 67, 2048]
    - [161, 5894.0]
  - - [74, 2048, 1, 960, 74, 74, 74, 2048]
    - [155, 8786.0]
  - - [100, 2048, 1, 512, 100, 100, 100, 2048]
    - [157, 7756.0]
  - - [257, 4096, 1, 1024, 257, 257, 257, 4096]
    - [160, 27725.0]
  - - [13, 512, 1, 3456, 13, 13, 13, 512]
    - [168, 1589.0]
  - - [13, 512, 1, 4096, 13, 13, 13, 512]
    - [167, 1822.0]
  - - [13, 512, 1, 55296, 13, 13, 13, 512]
    - [192, 7579.0]
  - - [13, 512, 1, 6912, 13, 13, 13, 512]
    - [169, 2713.0]
  - - [13, 512, 1, 864, 13, 13, 13, 512]
    - [177, 341.0]
- null
