TRAIN_3.9/logic/gemm/arcturus_Cijk_Ailk_Bjlk_HBH.yaml
- {MinimumRequiredVersion: 4.22.0}
- arcturus
- gfx908
- [Device 7380, Device 7388, Device 738c, Device 7390]
    SolutionIndex: 0
    SolutionNameMin: Cijk_Ailk_Bjlk_HBH_MT64x64x16_MI32x32x8x1_SE_AF0EM8_GRVW2_GSU1_SU0_SUS256_SRVW4_VAW2_WG64_4_1_WGM1
    SolutionIndex: 1
    SolutionNameMin: Cijk_Ailk_Bjlk_HBH_MT64x128x16_MI32x32x8x1_SE_AF0EM8_GRVW2_GSU1_SU0_SUS256_SRVW4_VAW2_WG64_4_1_WGM1
    SolutionIndex: 2
    SolutionNameMin: Cijk_Ailk_Bjlk_HBH_MT128x64x16_MI32x32x8x1_SE_AF0EM8_GRVW2_GSU1_SU0_SUS256_SRVW4_VAW2_WG64_4_1_WGM1
    SolutionIndex: 3
    SolutionNameMin: Cijk_Ailk_Bjlk_HBH_MT32x32x16_MI16x16x16x1_SE_AF0EM8_GRVW2_GSU1_SU0_SUS256_SRVW4_VAW2_WG32_8_1_WGM1
    SolutionIndex: 4
    SolutionNameMin: Cijk_Ailk_Bjlk_HBH_MT64x32x16_MI16x16x16x1_SE_AF0EM8_GRVW2_GSU1_SU0_SUS256_SRVW4_VAW2_WG32_8_1_WGM1
    SolutionIndex: 5
    SolutionNameMin: Cijk_Ailk_Bjlk_HBH_MT64x32x32_MI16x16x16x1_SE_AF0EM8_GRVW2_GSU1_SU0_SUS256_SRVW4_VAW2_WG32_8_1_WGM1
    SolutionIndex: 6
    SolutionNameMin: Cijk_Ailk_Bjlk_HBH_MT144x256x32_MI16x16x16x1_SE_AF0EM8_GRVW2_GSU1_SU0_SUS256_SRVW0_VAW2_WG16_16_1_WGM1
    SolutionIndex: 7
    SolutionNameMin: Cijk_Ailk_Bjlk_HBH_MT64x128x64_MI32x32x8x1_SE_AF0EM8_GRVW2_GSU1_SU0_SUS256_SRVW4_VAW2_WG64_4_1_WGM1
    SolutionIndex: 8
    SolutionNameMin: Cijk_Ailk_Bjlk_HBH_MT64x64x16_MI32x32x8x1_SE_AF0EM8_GRVW4_GSU1_SU0_SUS256_SRVW4_VAW2_WG64_4_1_WGM1
    SolutionIndex: 9
    SolutionNameMin: Cijk_Ailk_Bjlk_HBH_MT32x32x16_MI16x16x16x1_SE_AF0EM8_GRVW4_GSU1_SU0_SUS256_SRVW4_VAW2_WG32_8_1_WGM1
    SolutionIndex: 10
    SolutionNameMin: Cijk_Ailk_Bjlk_HBH_MT128x256x32_MI32x32x8x1_SE_AF0EM8_GRVW4_GSU1_SU0_SUS256_SRVW4_VAW2_WG64_4_1_WGM1
    SolutionIndex: 11
    SolutionNameMin: Cijk_Ailk_Bjlk_HBH_MT128x160x32_MI32x32x8x1_SE_AF0EM8_GRVW4_GSU1_SU0_SUS256_SRVW4_VAW2_WG128_2_1_WGM1
    SolutionIndex: 12
    SolutionNameMin: Cijk_Ailk_Bjlk_HBH_MT160x256x32_MI32x32x8x1_SE_AF0EM8_GRVW4_GSU1_SU0_SUS256_SRVW0_VAW2_WG32_8_1_WGM1
    SolutionIndex: 13
    SolutionNameMin: Cijk_Ailk_Bjlk_HBH_MT32x32x64_MI16x16x16x1_SE_AF0EM8_GRVW4_GSU1_SU0_SUS256_SRVW4_VAW2_WG32_8_1_WGM1
    SolutionIndex: 14
    SolutionNameMin: Cijk_Ailk_Bjlk_HBH_MT64x64x16_MI32x32x8x1_SE_AF0EM8_GRVW8_GSU1_SU0_SUS256_SRVW4_VAW2_WG64_4_1_WGM1
    SolutionIndex: 15
    SolutionNameMin: Cijk_Ailk_Bjlk_HBH_MT64x128x16_MI32x32x8x1_SE_AF0EM8_GRVW8_GSU1_SU0_SUS256_SRVW4_VAW2_WG64_4_1_WGM1
    SolutionIndex: 16
    SolutionNameMin: Cijk_Ailk_Bjlk_HBH_MT128x64x16_MI32x32x8x1_SE_AF0EM8_GRVW8_GSU1_SU0_SUS256_SRVW4_VAW2_WG64_4_1_WGM1
    SolutionIndex: 17
    SolutionNameMin: Cijk_Ailk_Bjlk_HBH_MT256x256x16_MI32x32x8x1_SE_AF0EM8_GRVW8_GSU1_SU0_SUS256_SRVW4_VAW2_WG64_4_1_WGM1
    SolutionIndex: 18
    SolutionNameMin: Cijk_Ailk_Bjlk_HBH_MT32x32x16_MI16x16x16x1_SE_AF0EM8_GRVW8_GSU1_SU0_SUS256_SRVW4_VAW2_WG32_8_1_WGM1
    SolutionIndex: 19
    SolutionNameMin: Cijk_Ailk_Bjlk_HBH_MT64x128x32_MI32x32x8x1_SE_AF0EM8_GRVW8_GSU1_SU0_SUS256_SRVW4_VAW2_WG64_4_1_WGM1
    SolutionIndex: 20
    SolutionNameMin: Cijk_Ailk_Bjlk_HBH_MT128x64x32_MI32x32x8x1_SE_AF0EM8_GRVW8_GSU1_SU0_SUS256_SRVW4_VAW2_WG64_4_1_WGM1
    SolutionIndex: 21
    SolutionNameMin: Cijk_Ailk_Bjlk_HBH_MT128x128x32_MI32x32x8x1_SE_AF0EM8_GRVW8_GSU1_SU0_SUS256_SRVW4_VAW2_WG64_4_1_WGM1
    SolutionIndex: 22
    SolutionNameMin: Cijk_Ailk_Bjlk_HBH_MT128x256x32_MI32x32x8x1_SE_AF0EM8_GRVW8_GSU1_SU0_SUS256_SRVW4_VAW2_WG64_4_1_WGM1
    SolutionIndex: 23
    SolutionNameMin: Cijk_Ailk_Bjlk_HBH_MT256x256x32_MI32x32x8x1_SE_AF0EM8_GRVW8_GSU1_SU0_SUS256_SRVW4_VAW2_WG64_4_1_WGM1
    SolutionIndex: 24
    SolutionNameMin: Cijk_Ailk_Bjlk_HBH_MT64x64x64_MI32x32x8x1_SE_AF0EM8_GRVW8_GSU1_SU0_SUS256_SRVW4_VAW2_WG64_4_1_WGM1
    SolutionIndex: 25
    SolutionNameMin: Cijk_Ailk_Bjlk_HBH_MT32x32x64_MI16x16x16x1_SE_AF0EM8_GRVW8_GSU1_SU0_SUS256_SRVW4_VAW2_WG32_8_1_WGM1
    SolutionIndex: 26
    SolutionNameMin: Cijk_Ailk_Bjlk_HBH_MT64x32x64_MI16x16x16x1_SE_AF0EM8_GRVW8_GSU1_SU0_SUS256_SRVW4_VAW2_WG32_8_1_WGM1
    SolutionIndex: 27
    SolutionNameMin: Cijk_Ailk_Bjlk_HBH_MT128x96x64_MI32x32x8x1_SE_AF0EM8_GRVW8_GSU1_SU0_SUS256_SRVW4_VAW2_WG128_2_1_WGM1
    SolutionIndex: 28
    SolutionNameMin: Cijk_Ailk_Bjlk_HBH_MT64x128x16_MI32x32x8x1_SE_AF0EM8_GRVW2_GSU1_SU32_SUS128_SRVW4_VAW2_WG64_4_1_WGM1
    SolutionIndex: 29
    SolutionNameMin: Cijk_Ailk_Bjlk_HBH_MT128x64x16_MI32x32x8x1_SE_AF0EM8_GRVW2_GSU1_SU32_SUS128_SRVW4_VAW2_WG64_4_1_WGM1
    SolutionIndex: 30
    SolutionNameMin: Cijk_Ailk_Bjlk_HBH_MT256x256x16_MI32x32x8x1_SE_AF0EM8_GRVW4_GSU1_SU32_SUS128_SRVW4_VAW2_WG64_4_1_WGM1
    SolutionIndex: 31
    SolutionNameMin: Cijk_Ailk_Bjlk_HBH_MT160x256x32_MI32x32x8x1_SE_AF0EM8_GRVW4_GSU1_SU32_SUS128_SRVW0_VAW2_WG32_8_1_WGM1
    SolutionIndex: 32
    SolutionNameMin: Cijk_Ailk_Bjlk_HBH_MT64x64x32_MI32x32x8x1_SE_AF0EM8_GRVW8_GSU1_SU32_SUS128_SRVW4_VAW2_WG64_4_1_WGM1
    SolutionIndex: 33
    SolutionNameMin: Cijk_Ailk_Bjlk_HBH_MT128x64x32_MI32x32x8x1_SE_AF0EM8_GRVW8_GSU1_SU32_SUS128_SRVW4_VAW2_WG64_4_1_WGM1
    SolutionIndex: 34
    SolutionNameMin: Cijk_Ailk_Bjlk_HBH_MT128x128x32_MI32x32x8x1_SE_AF0EM8_GRVW8_GSU1_SU32_SUS128_SRVW4_VAW2_WG64_4_1_WGM1
    SolutionIndex: 35
    SolutionNameMin: Cijk_Ailk_Bjlk_HBH_MT128x256x32_MI32x32x8x1_SE_AF0EM8_GRVW8_GSU1_SU32_SUS128_SRVW4_VAW2_WG64_4_1_WGM1
    SolutionIndex: 36
    SolutionNameMin: Cijk_Ailk_Bjlk_HBH_MT64x64x64_MI32x32x8x1_SE_AF0EM8_GRVW8_GSU1_SU32_SUS128_SRVW4_VAW2_WG64_4_1_WGM1
    SolutionIndex: 37
    SolutionNameMin: Cijk_Ailk_Bjlk_HBH_MT64x32x16_MI16x16x16x1_SE_AF0EM8_GRVW2_GSU1_SU32_SUS256_SRVW4_VAW2_WG32_8_1_WGM1
    SolutionIndex: 38
    SolutionNameMin: Cijk_Ailk_Bjlk_HBH_MT64x256x16_MI32x32x8x1_SE_AF0EM8_GRVW4_GSU1_SU32_SUS256_SRVW4_VAW2_WG64_4_1_WGM1
    SolutionIndex: 39
    SolutionNameMin: Cijk_Ailk_Bjlk_HBH_MT128x256x32_MI32x32x8x1_SE_AF0EM8_GRVW8_GSU1_SU32_SUS256_SRVW4_VAW2_WG64_4_1_WGM1
    SolutionIndex: 40
    SolutionNameMin: Cijk_Ailk_Bjlk_HBH_MT256x256x32_MI32x32x8x1_SE_AF0EM8_GRVW8_GSU1_SU32_SUS256_SRVW4_VAW2_WG64_4_1_WGM1
    SolutionIndex: 41
    SolutionNameMin: Cijk_Ailk_Bjlk_HBH_MT64x128x64_MI32x32x8x1_SE_AF0EM8_GRVW8_GSU1_SU32_SUS256_SRVW4_VAW2_WG64_4_1_WGM1
    SolutionIndex: 42
    SolutionNameMin: Cijk_Ailk_Bjlk_HBH_MT128x128x64_MI32x32x8x1_SE_AF0EM8_GRVW8_GSU1_SU32_SUS256_SRVW4_VAW2_WG64_4_1_WGM1
    SolutionIndex: 43
    SolutionNameMin: Cijk_Ailk_Bjlk_HBH_MT64x64x16_MI32x32x8x1_SE_AF0EM8_GRVW2_GSU1_SU0_SUS256_SRVW4_VAW2_WG64_4_1_WGM2
    SolutionIndex: 44
    SolutionNameMin: Cijk_Ailk_Bjlk_HBH_MT32x32x16_MI16x16x16x1_SE_AF0EM8_GRVW2_GSU1_SU0_SUS256_SRVW4_VAW2_WG32_8_1_WGM2
    SolutionIndex: 45
    SolutionNameMin: Cijk_Ailk_Bjlk_HBH_MT64x64x16_MI32x32x8x1_SE_AF0EM8_GRVW4_GSU1_SU0_SUS256_SRVW4_VAW2_WG64_4_1_WGM2
    SolutionIndex: 46
    SolutionNameMin: Cijk_Ailk_Bjlk_HBH_MT128x96x32_MI32x32x8x1_SE_AF0EM8_GRVW4_GSU1_SU0_SUS256_SRVW4_VAW2_WG128_2_1_WGM2
    SolutionIndex: 47
    SolutionNameMin: Cijk_Ailk_Bjlk_HBH_MT128x288x32_MI32x32x8x1_SE_AF0EM8_GRVW4_GSU1_SU0_SUS256_SRVW4_VAW2_WG128_2_1_WGM2
    SolutionIndex: 48
    SolutionNameMin: Cijk_Ailk_Bjlk_HBH_MT128x160x32_MI32x32x8x1_SE_AF0EM8_GRVW4_GSU1_SU0_SUS256_SRVW4_VAW2_WG128_2_1_WGM2
    SolutionIndex: 49
    SolutionNameMin: Cijk_Ailk_Bjlk_HBH_MT256x160x32_MI32x32x8x1_SE_AF0EM8_GRVW4_GSU1_SU0_SUS256_SRVW4_VAW2_WG128_2_1_WGM2
    SolutionIndex: 50
    SolutionNameMin: Cijk_Ailk_Bjlk_HBH_MT64x64x16_MI32x32x8x1_SE_AF0EM8_GRVW8_GSU1_SU0_SUS256_SRVW4_VAW2_WG64_4_1_WGM2
    SolutionIndex: 51
    SolutionNameMin: Cijk_Ailk_Bjlk_HBH_MT128x128x32_MI32x32x8x1_SE_AF0EM8_GRVW8_GSU1_SU0_SUS256_SRVW4_VAW2_WG64_4_1_WGM2
    SolutionIndex: 52
    SolutionNameMin: Cijk_Ailk_Bjlk_HBH_MT256x128x32_MI32x32x8x1_SE_AF0EM8_GRVW8_GSU1_SU0_SUS256_SRVW4_VAW2_WG64_4_1_WGM2
    SolutionIndex: 53
    SolutionNameMin: Cijk_Ailk_Bjlk_HBH_MT256x256x32_MI32x32x8x1_SE_AF0EM8_GRVW8_GSU1_SU0_SUS256_SRVW4_VAW2_WG64_4_1_WGM2
    SolutionIndex: 54
    SolutionNameMin: Cijk_Ailk_Bjlk_HBH_MT64x64x64_MI32x32x8x1_SE_AF0EM8_GRVW8_GSU1_SU0_SUS256_SRVW4_VAW2_WG64_4_1_WGM2
    SolutionIndex: 55
    SolutionNameMin: Cijk_Ailk_Bjlk_HBH_MT128x128x64_MI32x32x8x1_SE_AF0EM8_GRVW8_GSU1_SU0_SUS256_SRVW4_VAW2_WG64_4_1_WGM2
    SolutionIndex: 56
    SolutionNameMin: Cijk_Ailk_Bjlk_HBH_MT128x96x64_MI32x32x8x1_SE_AF0EM8_GRVW8_GSU1_SU0_SUS256_SRVW4_VAW2_WG128_2_1_WGM2
    SolutionIndex: 57
    SolutionNameMin: Cijk_Ailk_Bjlk_HBH_MT64x64x16_MI32x32x8x1_SE_AF0EM8_GRVW2_GSU1_SU32_SUS128_SRVW4_VAW2_WG64_4_1_WGM2
    SolutionIndex: 58
    SolutionNameMin: Cijk_Ailk_Bjlk_HBH_MT64x128x16_MI32x32x8x1_SE_AF0EM8_GRVW2_GSU1_SU32_SUS128_SRVW4_VAW2_WG64_4_1_WGM2
    SolutionIndex: 59
    SolutionNameMin: Cijk_Ailk_Bjlk_HBH_MT64x32x16_MI16x16x16x1_SE_AF0EM8_GRVW2_GSU1_SU32_SUS128_SRVW4_VAW2_WG32_8_1_WGM2
    SolutionIndex: 60
    SolutionNameMin: Cijk_Ailk_Bjlk_HBH_MT256x256x16_MI32x32x8x1_SE_AF0EM8_GRVW4_GSU1_SU32_SUS128_SRVW4_VAW2_WG64_4_1_WGM2
    SolutionIndex: 61
    SolutionNameMin: Cijk_Ailk_Bjlk_HBH_MT32x64x16_MI16x16x16x1_SE_AF0EM8_GRVW4_GSU1_SU32_SUS128_SRVW4_VAW2_WG32_8_1_WGM2
    SolutionIndex: 62
    SolutionNameMin: Cijk_Ailk_Bjlk_HBH_MT256x128x32_MI32x32x8x1_SE_AF0EM8_GRVW4_GSU1_SU32_SUS128_SRVW4_VAW2_WG64_4_1_WGM2
    SolutionIndex: 63
    SolutionNameMin: Cijk_Ailk_Bjlk_HBH_MT128x96x64_MI32x32x8x1_SE_AF0EM8_GRVW4_GSU1_SU32_SUS128_SRVW4_VAW2_WG128_2_1_WGM2
    SolutionIndex: 64
    SolutionNameMin: Cijk_Ailk_Bjlk_HBH_MT128x256x16_MI32x32x8x1_SE_AF0EM8_GRVW8_GSU1_SU32_SUS128_SRVW4_VAW2_WG64_4_1_WGM2
    SolutionIndex: 65
    SolutionNameMin: Cijk_Ailk_Bjlk_HBH_MT64x64x64_MI32x32x8x1_SE_AF0EM8_GRVW8_GSU1_SU32_SUS128_SRVW4_VAW2_WG64_4_1_WGM2
    SolutionIndex: 66
    SolutionNameMin: Cijk_Ailk_Bjlk_HBH_MT128x64x64_MI32x32x8x1_SE_AF0EM8_GRVW8_GSU1_SU32_SUS128_SRVW4_VAW2_WG64_4_1_WGM2
    SolutionIndex: 67
    SolutionNameMin: Cijk_Ailk_Bjlk_HBH_MT128x96x64_MI32x32x8x1_SE_AF0EM8_GRVW8_GSU1_SU32_SUS128_SRVW4_VAW2_WG128_2_1_WGM2
    SolutionIndex: 68
    SolutionNameMin: Cijk_Ailk_Bjlk_HBH_MT64x64x16_MI32x32x8x1_SE_AF0EM8_GRVW2_GSU1_SU32_SUS256_SRVW4_VAW2_WG64_4_1_WGM2
    SolutionIndex: 69
    SolutionNameMin: Cijk_Ailk_Bjlk_HBH_MT64x128x16_MI32x32x8x1_SE_AF0EM8_GRVW2_GSU1_SU32_SUS256_SRVW4_VAW2_WG64_4_1_WGM2
    SolutionIndex: 70
    SolutionNameMin: Cijk_Ailk_Bjlk_HBH_MT32x64x16_MI16x16x16x1_SE_AF0EM8_GRVW2_GSU1_SU32_SUS256_SRVW4_VAW2_WG32_8_1_WGM2
    SolutionIndex: 71
    SolutionNameMin: Cijk_Ailk_Bjlk_HBH_MT64x32x16_MI16x16x16x1_SE_AF0EM8_GRVW2_GSU1_SU32_SUS256_SRVW4_VAW2_WG32_8_1_WGM2
    SolutionIndex: 72
    SolutionNameMin: Cijk_Ailk_Bjlk_HBH_MT160x256x32_MI32x32x8x1_SE_AF0EM8_GRVW4_GSU1_SU32_SUS256_SRVW0_VAW2_WG32_8_1_WGM2
    SolutionIndex: 73
    SolutionNameMin: Cijk_Ailk_Bjlk_HBH_MT128x128x32_MI32x32x8x1_SE_AF0EM8_GRVW8_GSU1_SU32_SUS256_SRVW4_VAW2_WG64_4_1_WGM2
    SolutionIndex: 74
    SolutionNameMin: Cijk_Ailk_Bjlk_HBH_MT128x256x32_MI32x32x8x1_SE_AF0EM8_GRVW8_GSU1_SU32_SUS256_SRVW4_VAW2_WG64_4_1_WGM2
    SolutionIndex: 75
    SolutionNameMin: Cijk_Ailk_Bjlk_HBH_MT256x128x32_MI32x32x8x1_SE_AF0EM8_GRVW8_GSU1_SU32_SUS256_SRVW4_VAW2_WG64_4_1_WGM2
    SolutionIndex: 76
    SolutionNameMin: Cijk_Ailk_Bjlk_HBH_MT256x256x32_MI32x32x8x1_SE_AF0EM8_GRVW8_GSU1_SU32_SUS256_SRVW4_VAW2_WG64_4_1_WGM2
    SolutionIndex: 77
    SolutionNameMin: Cijk_Ailk_Bjlk_HBH_MT64x128x64_MI32x32x8x1_SE_AF0EM8_GRVW8_GSU1_SU32_SUS256_SRVW4_VAW2_WG64_4_1_WGM2
    SolutionIndex: 78
    SolutionNameMin: Cijk_Ailk_Bjlk_HBH_MT128x96x64_MI32x32x8x1_SE_AF0EM8_GRVW8_GSU1_SU32_SUS256_SRVW4_VAW2_WG128_2_1_WGM2
    SolutionIndex: 79
    SolutionNameMin: Cijk_Ailk_Bjlk_HBH_MT64x64x16_MI32x32x8x1_SE_AF0EM8_GRVW2_GSU1_SU0_SUS256_SRVW4_VAW2_WG64_4_1_WGM15
    SolutionIndex: 80
    SolutionNameMin: Cijk_Ailk_Bjlk_HBH_MT128x288x32_MI32x32x8x1_SE_AF0EM8_GRVW2_GSU1_SU0_SUS256_SRVW4_VAW2_WG128_2_1_WGM15
    SolutionIndex: 81
    SolutionNameMin: Cijk_Ailk_Bjlk_HBH_MT256x144x32_MI16x16x16x1_SE_AF0EM8_GRVW2_GSU1_SU0_SUS256_SRVW4_VAW2_WG64_4_1_WGM15
    SolutionIndex: 82
    SolutionNameMin: Cijk_Ailk_Bjlk_HBH_MT64x64x16_MI32x32x8x1_SE_AF0EM8_GRVW4_GSU1_SU0_SUS256_SRVW4_VAW2_WG64_4_1_WGM15
    SolutionIndex: 83
    SolutionNameMin: Cijk_Ailk_Bjlk_HBH_MT128x64x16_MI32x32x8x1_SE_AF0EM8_GRVW4_GSU1_SU0_SUS256_SRVW4_VAW2_WG64_4_1_WGM15
    SolutionIndex: 84
    SolutionNameMin: Cijk_Ailk_Bjlk_HBH_MT256x256x16_MI32x32x8x1_SE_AF0EM8_GRVW4_GSU1_SU0_SUS256_SRVW4_VAW2_WG64_4_1_WGM15
    SolutionIndex: 85
    SolutionNameMin: Cijk_Ailk_Bjlk_HBH_MT64x64x32_MI32x32x8x1_SE_AF0EM8_GRVW4_GSU1_SU0_SUS256_SRVW4_VAW2_WG64_4_1_WGM15
    SolutionIndex: 86
    SolutionNameMin: Cijk_Ailk_Bjlk_HBH_MT128x288x32_MI32x32x8x1_SE_AF0EM8_GRVW4_GSU1_SU0_SUS256_SRVW4_VAW2_WG128_2_1_WGM15
    SolutionIndex: 87
    SolutionNameMin: Cijk_Ailk_Bjlk_HBH_MT256x160x32_MI32x32x8x1_SE_AF0EM8_GRVW4_GSU1_SU0_SUS256_SRVW4_VAW2_WG128_2_1_WGM15
    SolutionIndex: 88
    SolutionNameMin: Cijk_Ailk_Bjlk_HBH_MT32x32x64_MI16x16x16x1_SE_AF0EM8_GRVW4_GSU1_SU0_SUS256_SRVW4_VAW2_WG32_8_1_WGM15
    SolutionIndex: 89
    SolutionNameMin: Cijk_Ailk_Bjlk_HBH_MT128x96x64_MI32x32x8x1_SE_AF0EM8_GRVW4_GSU1_SU0_SUS256_SRVW4_VAW2_WG128_2_1_WGM15
    SolutionIndex: 90
    SolutionNameMin: Cijk_Ailk_Bjlk_HBH_MT64x64x16_MI32x32x8x1_SE_AF0EM8_GRVW8_GSU1_SU0_SUS256_SRVW4_VAW2_WG64_4_1_WGM15
    SolutionIndex: 91
    SolutionNameMin: Cijk_Ailk_Bjlk_HBH_MT64x128x16_MI32x32x8x1_SE_AF0EM8_GRVW8_GSU1_SU0_SUS256_SRVW4_VAW2_WG64_4_1_WGM15
    SolutionIndex: 92
    SolutionNameMin: Cijk_Ailk_Bjlk_HBH_MT128x256x16_MI32x32x8x1_SE_AF0EM8_GRVW8_GSU1_SU0_SUS256_SRVW4_VAW2_WG64_4_1_WGM15
    SolutionIndex: 93
    SolutionNameMin: Cijk_Ailk_Bjlk_HBH_MT256x256x16_MI32x32x8x1_SE_AF0EM8_GRVW8_GSU1_SU0_SUS256_SRVW4_VAW2_WG64_4_1_WGM15
    SolutionIndex: 94
    SolutionNameMin: Cijk_Ailk_Bjlk_HBH_MT64x64x32_MI32x32x8x1_SE_AF0EM8_GRVW8_GSU1_SU0_SUS256_SRVW4_VAW2_WG64_4_1_WGM15
    SolutionIndex: 95
    SolutionNameMin: Cijk_Ailk_Bjlk_HBH_MT128x64x32_MI32x32x8x1_SE_AF0EM8_GRVW8_GSU1_SU0_SUS256_SRVW4_VAW2_WG64_4_1_WGM15
    SolutionIndex: 96
    SolutionNameMin: Cijk_Ailk_Bjlk_HBH_MT128x128x32_MI32x32x8x1_SE_AF0EM8_GRVW8_GSU1_SU0_SUS256_SRVW4_VAW2_WG64_4_1_WGM15
    SolutionIndex: 97
    SolutionNameMin: Cijk_Ailk_Bjlk_HBH_MT128x256x32_MI32x32x8x1_SE_AF0EM8_GRVW8_GSU1_SU0_SUS256_SRVW4_VAW2_WG64_4_1_WGM15
    SolutionIndex: 98
    SolutionNameMin: Cijk_Ailk_Bjlk_HBH_MT256x64x32_MI32x32x8x1_SE_AF0EM8_GRVW8_GSU1_SU0_SUS256_SRVW4_VAW2_WG64_4_1_WGM15
    SolutionIndex: 99
    SolutionNameMin: Cijk_Ailk_Bjlk_HBH_MT256x128x32_MI32x32x8x1_SE_AF0EM8_GRVW8_GSU1_SU0_SUS256_SRVW4_VAW2_WG64_4_1_WGM15
    SolutionIndex: 100
    SolutionNameMin: Cijk_Ailk_Bjlk_HBH_MT256x256x32_MI32x32x8x1_SE_AF0EM8_GRVW8_GSU1_SU0_SUS256_SRVW4_VAW2_WG64_4_1_WGM15
    SolutionIndex: 101
    SolutionNameMin: Cijk_Ailk_Bjlk_HBH_MT128x64x64_MI32x32x8x1_SE_AF0EM8_GRVW8_GSU1_SU0_SUS256_SRVW4_VAW2_WG64_4_1_WGM15
    SolutionIndex: 102
    SolutionNameMin: Cijk_Ailk_Bjlk_HBH_MT128x128x64_MI32x32x8x1_SE_AF0EM8_GRVW8_GSU1_SU0_SUS256_SRVW4_VAW2_WG64_4_1_WGM15
    SolutionIndex: 103
    SolutionNameMin: Cijk_Ailk_Bjlk_HBH_MT32x32x64_MI16x16x16x1_SE_AF0EM8_GRVW8_GSU1_SU0_SUS256_SRVW4_VAW2_WG32_8_1_WGM15
    SolutionIndex: 104
    SolutionNameMin: Cijk_Ailk_Bjlk_HBH_MT32x64x64_MI16x16x16x1_SE_AF0EM8_GRVW8_GSU1_SU0_SUS256_SRVW4_VAW2_WG32_8_1_WGM15
    SolutionIndex: 105
    SolutionNameMin: Cijk_Ailk_Bjlk_HBH_MT128x96x64_MI32x32x8x1_SE_AF0EM8_GRVW8_GSU1_SU0_SUS256_SRVW4_VAW2_WG128_2_1_WGM15
    SolutionIndex: 106
    SolutionNameMin: Cijk_Ailk_Bjlk_HBH_MT32x64x16_MI16x16x16x1_SE_AF0EM8_GRVW2_GSU1_SU32_SUS128_SRVW4_VAW2_WG32_8_1_WGM15
    SolutionIndex: 107
    SolutionNameMin: Cijk_Ailk_Bjlk_HBH_MT64x32x16_MI16x16x16x1_SE_AF0EM8_GRVW2_GSU1_SU32_SUS128_SRVW4_VAW2_WG32_8_1_WGM15
    SolutionIndex: 108
    SolutionNameMin: Cijk_Ailk_Bjlk_HBH_MT128x288x32_MI32x32x8x1_SE_AF0EM8_GRVW4_GSU1_SU32_SUS128_SRVW4_VAW2_WG128_2_1_WGM15
    SolutionIndex: 109
    SolutionNameMin: Cijk_Ailk_Bjlk_HBH_MT128x160x32_MI32x32x8x1_SE_AF0EM8_GRVW4_GSU1_SU32_SUS128_SRVW4_VAW2_WG128_2_1_WGM15
    SolutionIndex: 110
    SolutionNameMin: Cijk_Ailk_Bjlk_HBH_MT128x128x64_MI32x32x8x1_SE_AF0EM8_GRVW4_GSU1_SU32_SUS128_SRVW4_VAW2_WG64_4_1_WGM15
    SolutionIndex: 111
    SolutionNameMin: Cijk_Ailk_Bjlk_HBH_MT128x256x16_MI32x32x8x1_SE_AF0EM8_GRVW8_GSU1_SU32_SUS128_SRVW4_VAW2_WG64_4_1_WGM15
    SolutionIndex: 112
    SolutionNameMin: Cijk_Ailk_Bjlk_HBH_MT64x128x32_MI32x32x8x1_SE_AF0EM8_GRVW8_GSU1_SU32_SUS128_SRVW4_VAW2_WG64_4_1_WGM15
    SolutionIndex: 113
    SolutionNameMin: Cijk_Ailk_Bjlk_HBH_MT256x128x32_MI32x32x8x1_SE_AF0EM8_GRVW8_GSU1_SU32_SUS128_SRVW4_VAW2_WG64_4_1_WGM15
    SolutionIndex: 114
    SolutionNameMin: Cijk_Ailk_Bjlk_HBH_MT256x256x32_MI32x32x8x1_SE_AF0EM8_GRVW8_GSU1_SU32_SUS128_SRVW4_VAW2_WG64_4_1_WGM15
    SolutionIndex: 115
    SolutionNameMin: Cijk_Ailk_Bjlk_HBH_MT64x64x64_MI32x32x8x1_SE_AF0EM8_GRVW8_GSU1_SU32_SUS128_SRVW4_VAW2_WG64_4_1_WGM15
    SolutionIndex: 116
    SolutionNameMin: Cijk_Ailk_Bjlk_HBH_MT64x128x64_MI32x32x8x1_SE_AF0EM8_GRVW8_GSU1_SU32_SUS128_SRVW4_VAW2_WG64_4_1_WGM15
    SolutionIndex: 117
    SolutionNameMin: Cijk_Ailk_Bjlk_HBH_MT128x64x64_MI32x32x8x1_SE_AF0EM8_GRVW8_GSU1_SU32_SUS128_SRVW4_VAW2_WG64_4_1_WGM15
    SolutionIndex: 118
    SolutionNameMin: Cijk_Ailk_Bjlk_HBH_MT128x96x64_MI32x32x8x1_SE_AF0EM8_GRVW8_GSU1_SU32_SUS128_SRVW4_VAW2_WG128_2_1_WGM15
    SolutionIndex: 119
    SolutionNameMin: Cijk_Ailk_Bjlk_HBH_MT64x128x16_MI32x32x8x1_SE_AF0EM8_GRVW2_GSU1_SU32_SUS256_SRVW4_VAW2_WG64_4_1_WGM15
    SolutionIndex: 120
    SolutionNameMin: Cijk_Ailk_Bjlk_HBH_MT128x64x16_MI32x32x8x1_SE_AF0EM8_GRVW2_GSU1_SU32_SUS256_SRVW4_VAW2_WG64_4_1_WGM15
    SolutionIndex: 121
    SolutionNameMin: Cijk_Ailk_Bjlk_HBH_MT64x64x16_MI32x32x8x1_SE_AF0EM8_GRVW4_GSU1_SU32_SUS256_SRVW4_VAW2_WG64_4_1_WGM15
    SolutionIndex: 122
    SolutionNameMin: Cijk_Ailk_Bjlk_HBH_MT256x160x32_MI32x32x8x1_SE_AF0EM8_GRVW4_GSU1_SU32_SUS256_SRVW4_VAW2_WG128_2_1_WGM15
    SolutionIndex: 123
    SolutionNameMin: Cijk_Ailk_Bjlk_HBH_MT128x96x64_MI32x32x8x1_SE_AF0EM8_GRVW4_GSU1_SU32_SUS256_SRVW4_VAW2_WG128_2_1_WGM15
    SolutionIndex: 124
    SolutionNameMin: Cijk_Ailk_Bjlk_HBH_MT64x64x32_MI32x32x8x1_SE_AF0EM8_GRVW8_GSU1_SU32_SUS256_SRVW4_VAW2_WG64_4_1_WGM15
    SolutionIndex: 125
    SolutionNameMin: Cijk_Ailk_Bjlk_HBH_MT64x128x32_MI32x32x8x1_SE_AF0EM8_GRVW8_GSU1_SU32_SUS256_SRVW4_VAW2_WG64_4_1_WGM15
    SolutionIndex: 126
    SolutionNameMin: Cijk_Ailk_Bjlk_HBH_MT128x128x32_MI32x32x8x1_SE_AF0EM8_GRVW8_GSU1_SU32_SUS256_SRVW4_VAW2_WG64_4_1_WGM15
    SolutionIndex: 127
    SolutionNameMin: Cijk_Ailk_Bjlk_HBH_MT128x256x32_MI32x32x8x1_SE_AF0EM8_GRVW8_GSU1_SU32_SUS256_SRVW4_VAW2_WG64_4_1_WGM15
    SolutionIndex: 128
    SolutionNameMin: Cijk_Ailk_Bjlk_HBH_MT256x128x32_MI32x32x8x1_SE_AF0EM8_GRVW8_GSU1_SU32_SUS256_SRVW4_VAW2_WG64_4_1_WGM15
    SolutionIndex: 129
    SolutionNameMin: Cijk_Ailk_Bjlk_HBH_MT64x128x64_MI32x32x8x1_SE_AF0EM8_GRVW8_GSU1_SU32_SUS256_SRVW4_VAW2_WG64_4_1_WGM15
    SolutionIndex: 130
    SolutionNameMin: Cijk_Ailk_Bjlk_HBH_MT128x64x64_MI32x32x8x1_SE_AF0EM8_GRVW8_GSU1_SU32_SUS256_SRVW4_VAW2_WG64_4_1_WGM15
    SolutionIndex: 131
    SolutionNameMin: Cijk_Ailk_Bjlk_HBH_MT128x96x64_MI32x32x8x1_SE_AF0EM8_GRVW8_GSU1_SU32_SUS256_SRVW4_VAW2_WG128_2_1_WGM15
    SolutionIndex: 132
    SolutionNameMin: Cijk_Ailk_Bjlk_HBH_MT64x32x16_MI16x16x16x1_SE_AF0EM8_GRVW2_GSU1_SU0_SUS256_SRVW4_VAW2_WG32_8_1_WGM1
    SolutionIndex: 133
    SolutionNameMin: Cijk_Ailk_Bjlk_HBH_MT128x256x16_MI32x32x8x1_SE_AF0EM8_GRVW8_GSU1_SU0_SUS256_SRVW4_VAW2_WG64_4_1_WGM1
    SolutionIndex: 134
    SolutionNameMin: Cijk_Ailk_Bjlk_HBH_MT256x256x16_MI32x32x8x1_SE_AF0EM8_GRVW8_GSU1_SU0_SUS256_SRVW4_VAW2_WG64_4_1_WGM1
    SolutionIndex: 135
    SolutionNameMin: Cijk_Ailk_Bjlk_HBH_MT64x32x16_MI16x16x16x1_SE_AF0EM8_GRVW2_GSU1_SU32_SUS128_SRVW4_VAW2_WG32_8_1_WGM1
    SolutionIndex: 136
    SolutionNameMin: Cijk_Ailk_Bjlk_HBH_MT128x256x16_MI32x32x8x1_SE_AF0EM8_GRVW4_GSU1_SU0_SUS256_SRVW4_VAW2_WG64_4_1_WGM2
    SolutionIndex: 137
    SolutionNameMin: Cijk_Ailk_Bjlk_HBH_MT256x256x16_MI32x32x8x1_SE_AF0EM8_GRVW4_GSU1_SU0_SUS256_SRVW4_VAW2_WG64_4_1_WGM2
    SolutionIndex: 138
    SolutionNameMin: Cijk_Ailk_Bjlk_HBH_MT128x256x16_MI32x32x8x1_SE_AF0EM8_GRVW8_GSU1_SU0_SUS256_SRVW4_VAW2_WG64_4_1_WGM2
    SolutionIndex: 139
    SolutionNameMin: Cijk_Ailk_Bjlk_HBH_MT256x256x16_MI32x32x8x1_SE_AF0EM8_GRVW8_GSU1_SU32_SUS128_SRVW4_VAW2_WG64_4_1_WGM2
    SolutionIndex: 140
    SolutionNameMin: Cijk_Ailk_Bjlk_HBH_MT128x256x16_MI32x32x8x1_SE_AF0EM8_GRVW4_GSU1_SU32_SUS256_SRVW4_VAW2_WG64_4_1_WGM2
    SolutionIndex: 141
    SolutionNameMin: Cijk_Ailk_Bjlk_HBH_MT128x256x16_MI32x32x8x1_SE_AF0EM8_GRVW8_GSU1_SU32_SUS256_SRVW4_VAW2_WG64_4_1_WGM2
    SolutionIndex: 142
    SolutionNameMin: Cijk_Ailk_Bjlk_HBH_MT256x256x16_MI32x32x8x1_SE_AF0EM8_GRVW8_GSU1_SU32_SUS256_SRVW4_VAW2_WG64_4_1_WGM2
    SolutionIndex: 143
    SolutionNameMin: Cijk_Ailk_Bjlk_HBH_MT128x288x32_MI32x32x8x1_SE_AF0EM8_GRVW2_GSU1_SU0_SUS256_SRVW4_VAW2_WG128_2_1_WGM15
    SolutionIndex: 144
    SolutionNameMin: Cijk_Ailk_Bjlk_HBH_MT256x256x16_MI32x32x8x1_SE_AF0EM8_GRVW8_GSU1_SU0_SUS256_SRVW4_VAW2_WG64_4_1_WGM15
    SolutionIndex: 145
    SolutionNameMin: Cijk_Ailk_Bjlk_HBH_MT64x32x16_MI16x16x16x1_SE_AF0EM8_GRVW2_GSU1_SU32_SUS128_SRVW4_VAW2_WG32_8_1_WGM15
    SolutionIndex: 146
    SolutionNameMin: Cijk_Ailk_Bjlk_HBH_MT128x256x16_MI32x32x8x1_SE_AF0EM8_GRVW8_GSU1_SU32_SUS128_SRVW4_VAW2_WG64_4_1_WGM15
    SolutionIndex: 147
    SolutionNameMin: Cijk_Ailk_Bjlk_HBH_MT64x32x16_MI16x16x16x1_SE_AF0EM8_GRVW2_GSU1_SU32_SUS256_SRVW4_VAW2_WG32_8_1_WGM15
    SolutionIndex: 148
    SolutionNameMin: Cijk_Ailk_Bjlk_HBH_MT128x256x16_MI32x32x8x1_SE_AF0EM8_GRVW8_GSU1_SU32_SUS256_SRVW4_VAW2_WG64_4_1_WGM15
    SolutionIndex: 149
    SolutionNameMin: Cijk_Ailk_Bjlk_HBH_MT96x96x64_MI16x16x16x1_SE_AF0EM8_GRVW8_GSU3_SU0_SUS256_SRVW0_VAW1_WG32_8_1_WGM1
    SolutionIndex: 150
    SolutionNameMin: Cijk_Ailk_Bjlk_HBH_MT96x96x64_MI16x16x16x1_SE_AF0EM8_GRVW8_GSU3_SU32_SUS128_SRVW0_VAW1_WG32_8_1_WGM1
    SolutionIndex: 151
    SolutionNameMin: Cijk_Ailk_Bjlk_HBH_MT96x96x64_MI16x16x16x1_SE_AF0EM8_GRVW8_GSU3_SU32_SUS256_SRVW0_VAW1_WG32_8_1_WGM1
    SolutionIndex: 152
    SolutionNameMin: Cijk_Ailk_Bjlk_HBH_MT128x128x64_MI32x32x8x1_SE_AF0EM8_GRVW8_GSU3_SU0_SUS256_SRVW0_VAW1_WG64_4_1_WGM2
    SolutionIndex: 153
    SolutionNameMin: Cijk_Ailk_Bjlk_HBH_MT96x96x64_MI16x16x16x1_SE_AF0EM8_GRVW8_GSU3_SU0_SUS256_SRVW0_VAW1_WG32_8_1_WGM2
    SolutionIndex: 154
    SolutionNameMin: Cijk_Ailk_Bjlk_HBH_MT96x128x64_MI32x32x8x1_SE_AF0EM8_GRVW2_GSU3_SU32_SUS128_SRVW0_VAW1_WG32_8_1_WGM2
    SolutionIndex: 155
    SolutionNameMin: Cijk_Ailk_Bjlk_HBH_MT96x96x64_MI16x16x16x1_SE_AF0EM8_GRVW8_GSU3_SU32_SUS128_SRVW0_VAW1_WG32_8_1_WGM2
    SolutionIndex: 156
    SolutionNameMin: Cijk_Ailk_Bjlk_HBH_MT128x256x32_MI32x32x8x1_SE_AF0EM8_GRVW8_GSU3_SU0_SUS256_SRVW0_VAW1_WG64_4_1_WGM15
    SolutionIndex: 157
    SolutionNameMin: Cijk_Ailk_Bjlk_HBH_MT96x96x64_MI16x16x16x1_SE_AF0EM8_GRVW8_GSU3_SU32_SUS128_SRVW0_VAW1_WG32_8_1_WGM15
    SolutionIndex: 158
    SolutionNameMin: Cijk_Ailk_Bjlk_HBH_MT96x96x64_MI16x16x16x1_SE_AF0EM8_GRVW8_GSU5_SU32_SUS128_SRVW0_VAW1_WG32_8_1_WGM2
    SolutionIndex: 159
    SolutionNameMin: Cijk_Ailk_Bjlk_HBH_MT96x96x64_MI16x16x16x1_SE_AF0EM8_GRVW8_GSU5_SU32_SUS256_SRVW0_VAW1_WG32_8_1_WGM2
    SolutionIndex: 160
    SolutionNameMin: Cijk_Ailk_Bjlk_HBH_MT128x128x64_MI32x32x8x1_SE_AF0EM8_GRVW2_GSU7_SU0_SUS256_SRVW0_VAW1_WG64_4_1_WGM1
    SolutionIndex: 161
    SolutionNameMin: Cijk_Ailk_Bjlk_HBH_MT128x128x64_MI32x32x8x1_SE_AF0EM8_GRVW4_GSU7_SU0_SUS256_SRVW0_VAW1_WG64_4_1_WGM1
    SolutionIndex: 162
    SolutionNameMin: Cijk_Ailk_Bjlk_HBH_MT128x128x64_MI32x32x8x1_SE_AF0EM8_GRVW8_GSU7_SU0_SUS256_SRVW0_VAW1_WG64_4_1_WGM1
    SolutionIndex: 163
    SolutionNameMin: Cijk_Ailk_Bjlk_HBH_MT128x128x64_MI32x32x8x1_SE_AF0EM8_GRVW2_GSU7_SU32_SUS128_SRVW0_VAW1_WG64_4_1_WGM1
    SolutionIndex: 164
    SolutionNameMin: Cijk_Ailk_Bjlk_HBH_MT128x128x64_MI32x32x8x1_SE_AF0EM8_GRVW4_GSU7_SU32_SUS128_SRVW0_VAW1_WG64_4_1_WGM1
    SolutionIndex: 165
    SolutionNameMin: Cijk_Ailk_Bjlk_HBH_MT128x128x64_MI32x32x8x1_SE_AF0EM8_GRVW8_GSU7_SU32_SUS128_SRVW0_VAW1_WG64_4_1_WGM1
    SolutionIndex: 166
    SolutionNameMin: Cijk_Ailk_Bjlk_HBH_MT64x32x64_MI16x16x16x1_SE_AF0EM8_GRVW8_GSU7_SU32_SUS256_SRVW0_VAW1_WG32_8_1_WGM1
    SolutionIndex: 167
    SolutionNameMin: Cijk_Ailk_Bjlk_HBH_MT128x256x32_MI32x32x8x1_SE_AF0EM8_GRVW8_GSU7_SU0_SUS256_SRVW0_VAW1_WG64_4_1_WGM2
    SolutionIndex: 168
    SolutionNameMin: Cijk_Ailk_Bjlk_HBH_MT128x64x64_MI32x32x8x1_SE_AF0EM8_GRVW8_GSU7_SU0_SUS256_SRVW0_VAW1_WG64_4_1_WGM2
    SolutionIndex: 169
    SolutionNameMin: Cijk_Ailk_Bjlk_HBH_MT128x128x64_MI32x32x8x1_SE_AF0EM8_GRVW2_GSU7_SU32_SUS128_SRVW0_VAW1_WG64_4_1_WGM2
    SolutionIndex: 170
    SolutionNameMin: Cijk_Ailk_Bjlk_HBH_MT160x160x32_MI16x16x16x1_SE_AF0EM8_GRVW2_GSU7_SU32_SUS256_SRVW0_VAW1_WG32_8_1_WGM2
    SolutionIndex: 171
    SolutionNameMin: Cijk_Ailk_Bjlk_HBH_MT64x32x64_MI16x16x16x1_SE_AF0EM8_GRVW8_GSU7_SU32_SUS256_SRVW0_VAW1_WG32_8_1_WGM2
    SolutionIndex: 172
    SolutionNameMin: Cijk_Ailk_Bjlk_HBH_MT128x128x64_MI32x32x8x1_SE_AF0EM8_GRVW8_GSU7_SU0_SUS256_SRVW0_VAW1_WG64_4_1_WGM15
    SolutionIndex: 173
    SolutionNameMin: Cijk_Ailk_Bjlk_HBH_MT256x128x32_MI32x32x8x1_SE_AF0EM8_GRVW8_GSU7_SU32_SUS128_SRVW0_VAW1_WG64_4_1_WGM15
    SolutionIndex: 174
    SolutionNameMin: Cijk_Ailk_Bjlk_HBH_MT64x64x64_MI32x32x8x1_SE_AF0EM8_GRVW8_GSU15_SU32_SUS128_SRVW0_VAW1_WG64_4_1_WGM1
    SolutionIndex: 175
    SolutionNameMin: Cijk_Ailk_Bjlk_HBH_MT128x128x32_MI32x32x8x1_SE_AF0EM8_GRVW8_GSU15_SU0_SUS256_SRVW0_VAW1_WG64_4_1_WGM2
    SolutionIndex: 176
    SolutionNameMin: Cijk_Ailk_Bjlk_HBH_MT256x144x32_MI16x16x16x1_SE_AF0EM8_GRVW2_GSU15_SU32_SUS128_SRVW0_VAW1_WG64_4_1_WGM2
    SolutionIndex: 177
    SolutionNameMin: Cijk_Ailk_Bjlk_HBH_MT128x128x64_MI32x32x8x1_SE_AF0EM8_GRVW8_GSU15_SU32_SUS256_SRVW0_VAW1_WG64_4_1_WGM2
    SolutionIndex: 178
    SolutionNameMin: Cijk_Ailk_Bjlk_HBH_MT64x32x64_MI16x16x16x1_SE_AF0EM8_GRVW8_GSU15_SU32_SUS256_SRVW0_VAW1_WG32_8_1_WGM2
    SolutionIndex: 179
    SolutionNameMin: Cijk_Ailk_Bjlk_HBH_MT64x64x64_MI32x32x8x1_SE_AF0EM8_GRVW8_GSU15_SU32_SUS128_SRVW0_VAW1_WG64_4_1_WGM15
    SolutionIndex: 180
    SolutionNameMin: Cijk_Ailk_Bjlk_HBH_MT32x32x16_MI16x16x16x1_SE_AF0EM1_GRVW2_GSU1_SU0_SUS256_SRVW4_VAW2_WG32_8_1_WGM1
    SolutionIndex: 181
    SolutionNameMin: Cijk_Ailk_Bjlk_HBH_MT32x64x16_MI16x16x16x1_SE_AF0EM1_GRVW2_GSU1_SU0_SUS256_SRVW4_VAW2_WG32_8_1_WGM1
    SolutionIndex: 182
    SolutionNameMin: Cijk_Ailk_Bjlk_HBH_MT64x32x16_MI16x16x16x1_SE_AF0EM1_GRVW2_GSU1_SU0_SUS256_SRVW4_VAW2_WG32_8_1_WGM1
    SolutionIndex: 183
    SolutionNameMin: Cijk_Ailk_Bjlk_HBH_MT32x32x64_MI16x16x16x1_SE_AF0EM1_GRVW4_GSU1_SU0_SUS256_SRVW4_VAW2_WG32_8_1_WGM1
    SolutionIndex: 184
    SolutionNameMin: Cijk_Ailk_Bjlk_HBH_MT32x32x16_MI16x16x16x1_SE_AF0EM1_GRVW2_GSU1_SU32_SUS128_SRVW4_VAW2_WG32_8_1_WGM1
    SolutionIndex: 185
    SolutionNameMin: Cijk_Ailk_Bjlk_HBH_MT32x32x64_MI16x16x16x1_SE_AF0EM1_GRVW2_GSU1_SU32_SUS128_SRVW4_VAW2_WG32_8_1_WGM1
    SolutionIndex: 186
    SolutionNameMin: Cijk_Ailk_Bjlk_HBH_MT64x32x16_MI16x16x16x1_SE_AF0EM1_GRVW4_GSU1_SU32_SUS128_SRVW4_VAW2_WG32_8_1_WGM1
    SolutionIndex: 187
    SolutionNameMin: Cijk_Ailk_Bjlk_HBH_MT32x32x64_MI16x16x16x1_SE_AF0EM1_GRVW2_GSU1_SU0_SUS256_SRVW4_VAW2_WG32_8_1_WGM2
    SolutionIndex: 188
    SolutionNameMin: Cijk_Ailk_Bjlk_HBH_MT64x64x16_MI32x32x8x1_SE_AF0EM1_GRVW2_GSU1_SU32_SUS128_SRVW4_VAW2_WG64_4_1_WGM2
    SolutionIndex: 189
    SolutionNameMin: Cijk_Ailk_Bjlk_HBH_MT64x64x64_MI32x32x8x1_SE_AF0EM1_GRVW4_GSU1_SU32_SUS128_SRVW4_VAW2_WG64_4_1_WGM2
    SolutionIndex: 190
    SolutionNameMin: Cijk_Ailk_Bjlk_HBH_MT32x64x16_MI16x16x16x1_SE_AF0EM1_GRVW2_GSU1_SU32_SUS256_SRVW4_VAW2_WG32_8_1_WGM2
    SolutionIndex: 191
    SolutionNameMin: Cijk_Ailk_Bjlk_HBH_MT32x64x16_MI16x16x16x1_SE_AF0EM1_GRVW2_GSU1_SU32_SUS256_SRVW4_VAW2_WG32_8_1_WGM15
    SolutionIndex: 192
    SolutionNameMin: Cijk_Ailk_Bjlk_HBH_MT96x128x64_MI32x32x8x1_SE_AF0EM1_GRVW4_GSU1_SU32_SUS256_SRVW0_VAW2_WG32_8_1_WGM15
    SolutionIndex: 193
    SolutionNameMin: Cijk_Ailk_Bjlk_HBH_MT32x64x16_MI16x16x16x1_SE_AF0EM1_GRVW2_GSU1_SU0_SUS256_SRVW4_VAW2_WG32_8_1_WGM1
    SolutionIndex: 194
    SolutionNameMin: Cijk_Ailk_Bjlk_HBH_MT32x64x16_MI16x16x16x1_SE_AF0EM1_GRVW4_GSU1_SU0_SUS256_SRVW4_VAW2_WG32_8_1_WGM1
    SolutionIndex: 195
    SolutionNameMin: Cijk_Ailk_Bjlk_HBH_MT32x64x16_MI16x16x16x1_SE_AF0EM1_GRVW2_GSU1_SU32_SUS128_SRVW4_VAW2_WG32_8_1_WGM2
    SolutionIndex: 196
    SolutionNameMin: Cijk_Ailk_Bjlk_HBH_MT32x64x16_MI16x16x16x1_SE_AF0EM1_GRVW4_GSU1_SU32_SUS256_SRVW4_VAW2_WG32_8_1_WGM2
    SolutionIndex: 197
    SolutionNameMin: Cijk_Ailk_Bjlk_HBH_MT32x64x16_MI16x16x16x1_SE_AF0EM1_GRVW8_GSU1_SU32_SUS256_SRVW4_VAW2_WG32_8_1_WGM2
    SolutionIndex: 198
    SolutionNameMin: Cijk_Ailk_Bjlk_HBH_MT128x256x32_MI32x32x8x1_SE_AF0EM1_GRVW8_GSU7_SU32_SUS128_SRVW0_VAW1_WG64_4_1_WGM1
    SolutionIndex: 199
    SolutionNameMin: Cijk_Ailk_Bjlk_HBH_MT16x16x16_MI16x16x16x1_SE_AF0EM1_GRVW2_GSU1_SU0_SUS256_SRVW0_VAW2_WG16_4_1_WGM1
    SolutionIndex: 200
    SolutionNameMin: Cijk_Ailk_Bjlk_HBH_MT16x16x16_MI16x16x16x1_SE_AF0EM8_GRVW2_GSU1_SU0_SUS256_SRVW0_VAW2_WG16_4_1_WGM1
    SolutionIndex: 201
    SolutionNameMin: Cijk_Ailk_Bjlk_HBH_MT64x16x32_MI16x16x16x1_SE_AF0EM8_GRVW2_GSU1_SU0_SUS256_SRVW0_VAW2_WG64_4_1_WGM1
    SolutionIndex: 202
    SolutionNameMin: Cijk_Ailk_Bjlk_HBH_MT16x64x32_MI16x16x16x1_SE_AF0EM8_GRVW2_GSU1_SU0_SUS256_SRVW0_VAW2_WG16_16_1_WGM1
    SolutionIndex: 203
    SolutionNameMin: Cijk_Ailk_Bjlk_HBH_MT16x16x16_MI16x16x16x1_SE_AF0EM1_GRVW4_GSU1_SU0_SUS256_SRVW0_VAW2_WG16_4_1_WGM1
    SolutionIndex: 204
    SolutionNameMin: Cijk_Ailk_Bjlk_HBH_MT64x16x32_MI16x16x16x1_SE_AF0EM8_GRVW4_GSU1_SU0_SUS256_SRVW0_VAW2_WG64_4_1_WGM1
    SolutionIndex: 205
    SolutionNameMin: Cijk_Ailk_Bjlk_HBH_MT16x16x16_MI16x16x16x1_SE_AF0EM1_GRVW2_GSU1_SU0_SUS256_SRVW4_VAW2_WG16_4_1_WGM1
    SolutionIndex: 206
    SolutionNameMin: Cijk_Ailk_Bjlk_HBH_MT16x16x16_MI16x16x16x1_SE_AF0EM1_GRVW4_GSU1_SU32_SUS128_SRVW0_VAW2_WG16_4_1_WGM1
    SolutionIndex: 207
    SolutionNameMin: Cijk_Ailk_Bjlk_HBH_MT16x16x16_MI16x16x16x1_SE_AF0EM1_GRVW2_GSU1_SU32_SUS128_SRVW4_VAW2_WG16_4_1_WGM1
    SolutionIndex: 208
    SolutionNameMin: Cijk_Ailk_Bjlk_HBH_MT16x16x16_MI16x16x16x1_SE_AF0EM8_GRVW2_GSU1_SU32_SUS128_SRVW4_VAW2_WG16_4_1_WGM1
    SolutionIndex: 209
    SolutionNameMin: Cijk_Ailk_Bjlk_HBH_MT16x16x16_MI16x16x16x1_SE_AF0EM8_GRVW2_GSU1_SU32_SUS256_SRVW0_VAW2_WG16_4_1_WGM1
    SolutionIndex: 210
    SolutionNameMin: Cijk_Ailk_Bjlk_HBH_MT16x16x16_MI16x16x16x1_SE_AF0EM8_GRVW2_GSU1_SU0_SUS256_SRVW0_VAW2_WG16_4_1_WGM2
    SolutionIndex: 211
    SolutionNameMin: Cijk_Ailk_Bjlk_HBH_MT16x16x32_MI16x16x16x1_SE_AF0EM1_GRVW2_GSU1_SU0_SUS256_SRVW0_VAW2_WG16_4_1_WGM2
    SolutionIndex: 212
    SolutionNameMin: Cijk_Ailk_Bjlk_HBH_MT16x16x64_MI16x16x16x1_SE_AF0EM8_GRVW2_GSU1_SU0_SUS256_SRVW0_VAW2_WG16_4_1_WGM2
    SolutionIndex: 213
    SolutionNameMin: Cijk_Ailk_Bjlk_HBH_MT16x16x16_MI16x16x16x1_SE_AF0EM8_GRVW2_GSU1_SU32_SUS256_SRVW4_VAW2_WG16_4_1_WGM2
    SolutionIndex: 214
    SolutionNameMin: Cijk_Ailk_Bjlk_HBH_MT16x16x16_MI16x16x16x1_SE_AF0EM8_GRVW2_GSU1_SU0_SUS256_SRVW0_VAW2_WG16_4_1_WGM15
    SolutionIndex: 215
    SolutionNameMin: Cijk_Ailk_Bjlk_HBH_MT64x16x32_MI16x16x16x1_SE_AF0EM8_GRVW2_GSU15_SU0_SUS256_SRVW0_VAW1_WG64_4_1_WGM1
    SolutionIndex: 216
    SolutionNameMin: Cijk_Ailk_Bjlk_HBH_MT64x16x64_MI16x16x16x1_SE_AF0EM1_GRVW2_GSU15_SU0_SUS256_SRVW0_VAW1_WG64_4_1_WGM1
    SolutionIndex: 217
    SolutionNameMin: Cijk_Ailk_Bjlk_HBH_MT64x16x64_MI16x16x16x1_SE_AF0EM8_GRVW2_GSU15_SU0_SUS256_SRVW0_VAW1_WG64_4_1_WGM1
    SolutionIndex: 218
    SolutionNameMin: Cijk_Ailk_Bjlk_HBH_MT64x16x32_MI16x16x16x1_SE_AF0EM1_GRVW8_GSU15_SU0_SUS256_SRVW0_VAW1_WG64_4_1_WGM1
    SolutionIndex: 219
    SolutionNameMin: Cijk_Ailk_Bjlk_HBH_MT16x64x64_MI16x16x16x1_SE_AF0EM1_GRVW8_GSU15_SU0_SUS256_SRVW0_VAW1_WG16_16_1_WGM1
    SolutionIndex: 220
    SolutionNameMin: Cijk_Ailk_Bjlk_HBH_MT64x16x32_MI16x16x16x1_SE_AF0EM8_GRVW8_GSU15_SU32_SUS128_SRVW0_VAW1_WG64_4_1_WGM1
    SolutionIndex: 221
    SolutionNameMin: Cijk_Ailk_Bjlk_HBH_MT64x16x64_MI16x16x16x1_SE_AF0EM1_GRVW2_GSU15_SU0_SUS256_SRVW0_VAW1_WG64_4_1_WGM2
    SolutionIndex: 222
    SolutionNameMin: Cijk_Ailk_Bjlk_HBH_MT64x16x32_MI16x16x16x1_SE_AF0EM1_GRVW8_GSU15_SU0_SUS256_SRVW0_VAW1_WG64_4_1_WGM2
    SolutionIndex: 223
    SolutionNameMin: Cijk_Ailk_Bjlk_HBH_MT16x64x64_MI16x16x16x1_SE_AF0EM1_GRVW8_GSU15_SU0_SUS256_SRVW0_VAW1_WG16_16_1_WGM2
    SolutionIndex: 224
    SolutionNameMin: Cijk_Ailk_Bjlk_HBH_MT16x64x64_MI16x16x16x1_SE_AF0EM1_GRVW8_GSU15_SU0_SUS256_SRVW0_VAW1_WG16_16_1_WGM15
    SolutionIndex: 225
    SolutionNameMin: Cijk_Ailk_Bjlk_HBH_MT64x16x32_MI16x16x16x1_SE_AF0EM8_GRVW8_GSU15_SU32_SUS128_SRVW0_VAW1_WG64_4_1_WGM15
    SolutionIndex: 226
    SolutionNameMin: Cijk_Ailk_Bjlk_HBH_MT16x64x64_MI16x16x16x1_SE_AF0EM1_GRVW2_GSU15_SU32_SUS256_SRVW0_VAW1_WG16_16_1_WGM15
- - - [7680, 8192, 1, 8192, 8384, 8384, 8384, 8384]
    - [23, 127682.0]
  - - [3840, 4096, 1, 4096, 4192, 4192, 4192, 4192]
    - [23, 124911.0]
  - - [1920, 2048, 1, 2048, 2080, 2080, 2080, 2080]
    - [35, 109298.0]
  - - [960, 1024, 1, 1024, 1056, 1056, 1056, 1056]
    - [77, 56680.0]
  - - [480, 512, 1, 512, 544, 544, 544, 544]
    - [104, 17873.0]
  - - [8192, 7680, 1, 8192, 8384, 8384, 8384, 8384]
    - [100, 127389.0]
  - - [4096, 3840, 1, 4096, 4192, 4192, 4192, 4192]
    - [23, 124641.0]
  - - [2048, 1920, 1, 2048, 2080, 2080, 2080, 2080]
    - [99, 110135.0]
  - - [1024, 960, 1, 1024, 1056, 1056, 1056, 1056]
    - [101, 57195.0]
  - - [512, 480, 1, 512, 544, 544, 544, 544]
    - [26, 18289.0]
  - - [8192, 8192, 1, 8192, 8384, 8384, 8384, 8384]
    - [87, 123363.0]
  - - [4096, 4096, 1, 4096, 4192, 4192, 4192, 4192]
    - [108, 109874.0]
  - - [2048, 2048, 1, 2048, 2080, 2080, 2080, 2080]
    - [6, 97791.0]
  - - [1024, 1024, 1, 1024, 1056, 1056, 1056, 1056]
    - [56, 56158.0]
  - - [512, 512, 1, 512, 544, 544, 544, 544]
    - [36, 18236.0]
  - - [64, 512, 16, 512, 64, 64, 64, 512]
    - [24, 25420.0]
  - - [1024, 2, 1, 1, 1024, 1024, 1024, 2]
    - [0, 1.0]
  - - [1024, 2, 1, 512, 1024, 1024, 1024, 2]
    - [212, 168.0]
  - - [1024, 1024, 1, 1, 1024, 1024, 1024, 1024]
    - [14, 291.0]
  - - [1024, 1024, 1, 77, 1024, 1024, 1024, 1024]
    - [82, 13825.0]
  - - [1024, 1024, 1, 512, 1024, 1024, 1024, 1024]
    - [56, 42745.0]
  - - [1024, 4096, 1, 512, 1024, 1024, 1024, 4096]
    - [86, 76916.0]
  - - [1024, 30522, 1, 77, 1024, 1024, 1024, 30522]
    - [136, 37697.0]
  - - [4096, 1024, 1, 512, 4096, 4096, 4096, 1024]
    - [73, 62865.0]
  - - [64, 128, 160, 128, 64, 64, 64, 128]
    - [124, 19600.0]
  - - [1024, 2, 1, 10, 1024, 1024, 1024, 2]
    - [3, 7.0]
  - - [1024, 2, 1, 1280, 1024, 1024, 1024, 2]
    - [225, 285.0]
  - - [1024, 1024, 1, 10, 1024, 1024, 1024, 1024]
    - [4, 2570.0]
  - - [1024, 1024, 1, 200, 1024, 1024, 1024, 1024]
    - [82, 22405.0]
  - - [1024, 1024, 1, 1280, 1024, 1024, 1024, 1024]
    - [56, 54828.0]
  - - [1024, 4096, 1, 1280, 1024, 1024, 1024, 4096]
    - [80, 88417.0]
  - - [1024, 30522, 1, 200, 1024, 1024, 1024, 30522]
    - [138, 66273.0]
  - - [4096, 1024, 1, 1280, 4096, 4096, 4096, 1024]
    - [6, 81246.0]
  - - [64, 128, 624, 128, 64, 64, 64, 128]
    - [69, 24415.0]
  - - [1024, 2, 1, 39, 1024, 1024, 1024, 2]
    - [200, 24.0]
  - - [1024, 2, 1, 4992, 1024, 1024, 1024, 2]
    - [216, 770.0]
  - - [1024, 1024, 1, 39, 1024, 1024, 1024, 1024]
    - [90, 8968.0]
  - - [1024, 1024, 1, 780, 1024, 1024, 1024, 1024]
    - [67, 39473.0]
  - - [1024, 1024, 1, 4992, 1024, 1024, 1024, 1024]
    - [131, 64085.0]
  - - [1024, 4096, 1, 4992, 1024, 1024, 1024, 4096]
    - [87, 100124.0]
  - - [1024, 30522, 1, 780, 1024, 1024, 1024, 30522]
    - [84, 94608.0]
  - - [4096, 1024, 1, 4992, 4096, 4096, 4096, 1024]
    - [87, 100431.0]
  - - [64, 512, 64, 512, 64, 64, 64, 512]
    - [91, 37596.0]
  - - [1024, 2, 1, 4, 1024, 1024, 1024, 2]
    - [3, 3.0]
  - - [1024, 2, 1, 2048, 1024, 1024, 1024, 2]
    - [220, 426.0]
  - - [1024, 1024, 1, 4, 1024, 1024, 1024, 1024]
    - [8, 1092.0]
  - - [1024, 1024, 1, 308, 1024, 1024, 1024, 1024]
    - [90, 26214.0]
  - - [1024, 1024, 1, 2048, 1024, 1024, 1024, 1024]
    - [131, 57852.0]
  - - [1024, 4096, 1, 2048, 1024, 1024, 1024, 4096]
    - [80, 93695.0]
  - - [1024, 30522, 1, 308, 1024, 1024, 1024, 30522]
    - [92, 76692.0]
  - - [4096, 1024, 1, 2048, 4096, 4096, 4096, 1024]
    - [87, 87724.0]
  - - [64, 128, 640, 128, 64, 64, 64, 128]
    - [58, 24385.0]
  - - [1024, 2, 1, 40, 1024, 1024, 1024, 2]
    - [202, 25.0]
  - - [1024, 2, 1, 5120, 1024, 1024, 1024, 2]
    - [217, 799.0]
  - - [1024, 1024, 1, 40, 1024, 1024, 1024, 1024]
    - [79, 9362.0]
  - - [1024, 1024, 1, 800, 1024, 1024, 1024, 1024]
    - [126, 42625.0]
  - - [1024, 1024, 1, 5120, 1024, 1024, 1024, 1024]
    - [78, 64714.0]
  - - [1024, 4096, 1, 5120, 1024, 1024, 1024, 4096]
    - [87, 100537.0]
  - - [1024, 30522, 1, 800, 1024, 1024, 1024, 30522]
    - [53, 102406.0]
  - - [4096, 1024, 1, 5120, 4096, 4096, 4096, 1024]
    - [12, 96110.0]
  - - [64, 128, 656, 128, 64, 64, 64, 128]
    - [58, 24289.0]
  - - [1024, 2, 1, 41, 1024, 1024, 1024, 2]
    - [18, 25.0]
  - - [1024, 2, 1, 5248, 1024, 1024, 1024, 2]
    - [221, 795.0]
  - - [1024, 1024, 1, 41, 1024, 1024, 1024, 1024]
    - [79, 8810.0]
  - - [1024, 1024, 1, 820, 1024, 1024, 1024, 1024]
    - [46, 37062.0]
  - - [1024, 1024, 1, 5248, 1024, 1024, 1024, 1024]
    - [56, 64588.0]
  - - [1024, 4096, 1, 5248, 1024, 1024, 1024, 4096]
    - [122, 100272.0]
  - - [1024, 30522, 1, 820, 1024, 1024, 1024, 30522]
    - [84, 96727.0]
  - - [4096, 1024, 1, 5248, 4096, 4096, 4096, 1024]
    - [87, 99009.0]
  - - [64, 512, 80, 512, 64, 64, 64, 512]
    - [91, 40330.0]
  - - [1024, 2, 1, 5, 1024, 1024, 1024, 2]
    - [18, 4.0]
  - - [1024, 2, 1, 2560, 1024, 1024, 1024, 2]
    - [218, 485.0]
  - - [1024, 1024, 1, 5, 1024, 1024, 1024, 1024]
    - [0, 1394.0]
  - - [1024, 1024, 1, 385, 1024, 1024, 1024, 1024]
    - [46, 30399.0]
  - - [1024, 1024, 1, 2560, 1024, 1024, 1024, 1024]
    - [131, 60133.0]
  - - [1024, 4096, 1, 2560, 1024, 1024, 1024, 4096]
    - [80, 95461.0]
  - - [1024, 30522, 1, 385, 1024, 1024, 1024, 30522]
    - [111, 82826.0]
  - - [4096, 1024, 1, 2560, 4096, 4096, 4096, 1024]
    - [87, 92500.0]
  - - [64, 512, 96, 512, 64, 64, 64, 512]
    - [38, 41003.0]
  - - [1024, 2, 1, 6, 1024, 1024, 1024, 2]
    - [3, 4.0]
  - - [1024, 2, 1, 3072, 1024, 1024, 1024, 2]
    - [221, 570.0]
  - - [1024, 1024, 1, 6, 1024, 1024, 1024, 1024]
    - [0, 1638.0]
  - - [1024, 1024, 1, 462, 1024, 1024, 1024, 1024]
    - [46, 30896.0]
  - - [1024, 1024, 1, 3072, 1024, 1024, 1024, 1024]
    - [131, 60549.0]
  - - [1024, 4096, 1, 3072, 1024, 1024, 1024, 4096]
    - [80, 96908.0]
  - - [1024, 30522, 1, 462, 1024, 1024, 1024, 30522]
    - [111, 84029.0]
  - - [4096, 1024, 1, 3072, 4096, 4096, 4096, 1024]
    - [87, 94353.0]
  - - [64, 128, 128, 128, 64, 64, 64, 128]
    - [112, 19284.0]
  - - [1024, 2, 1, 8, 1024, 1024, 1024, 2]
    - [44, 6.0]
  - - [1024, 2, 1, 1024, 1024, 1024, 1024, 2]
    - [215, 238.0]
  - - [1024, 1024, 1, 8, 1024, 1024, 1024, 1024]
    - [0, 2231.0]
  - - [1024, 1024, 1, 160, 1024, 1024, 1024, 1024]
    - [95, 24385.0]
  - - [1024, 1024, 1, 1024, 1024, 1024, 1024, 1024]
    - [63, 51033.0]
  - - [1024, 4096, 1, 1024, 1024, 1024, 1024, 4096]
    - [143, 86175.0]
  - - [1024, 30522, 1, 160, 1024, 1024, 1024, 30522]
    - [140, 65938.0]
  - - [4096, 1024, 1, 1024, 4096, 4096, 4096, 1024]
    - [6, 75829.0]
  - - [64, 128, 144, 128, 64, 64, 64, 128]
    - [32, 19458.0]
  - - [1024, 2, 1, 9, 1024, 1024, 1024, 2]
    - [3, 6.0]
  - - [1024, 2, 1, 1152, 1024, 1024, 1024, 2]
    - [222, 263.0]
  - - [1024, 1024, 1, 9, 1024, 1024, 1024, 1024]
    - [79, 2313.0]
  - - [1024, 1024, 1, 180, 1024, 1024, 1024, 1024]
    - [90, 21645.0]
  - - [1024, 1024, 1, 1152, 1024, 1024, 1024, 1024]
    - [105, 53167.0]
  - - [1024, 4096, 1, 1152, 1024, 1024, 1024, 4096]
    - [80, 87533.0]
  - - [1024, 30522, 1, 180, 1024, 1024, 1024, 30522]
    - [146, 61795.0]
  - - [4096, 1024, 1, 1152, 4096, 4096, 4096, 1024]
    - [6, 79055.0]
  - - [256, 128, 1, 32768, 256, 256, 256, 128]
    - [174, 24994.0]
  - - [256, 32768, 1, 1, 256, 256, 256, 32768]
    - [8, 620.0]
  - - [512, 256, 1, 32768, 512, 512, 512, 256]
    - [177, 49254.0]
  - - [1024, 512, 1, 32768, 1024, 1024, 1024, 512]
    - [173, 75669.0]
  - - [1024, 1024, 1, 32768, 1024, 1024, 1024, 1024]
    - [156, 79936.0]
  - - [64, 128, 512, 128, 64, 64, 64, 128]
    - [57, 24140.0]
  - - [128, 64, 512, 128, 128, 128, 128, 64]
    - [43, 23630.0]
  - - [1024, 2, 1, 32, 1024, 1024, 1024, 2]
    - [201, 26.0]
  - - [1024, 1024, 1, 32, 1024, 1024, 131072, 1024]
    - [94, 10230.0]
  - - [1024, 1024, 1, 4096, 1024, 1024, 1024, 1024]
    - [56, 61923.0]
  - - [1024, 4096, 1, 4096, 1024, 1024, 1024, 4096]
    - [87, 98058.0]
  - - [1024, 30528, 1, 4096, 1024, 1024, 1024, 30528]
    - [40, 122207.0]
  - - [4096, 1024, 1, 4096, 4096, 4096, 4096, 1024]
    - [87, 97657.0]
  - - [512, 64, 64, 512, 512, 512, 512, 64]
    - [2, 36873.0]
  - - [1024, 1024, 1, 4, 1024, 1024, 524288, 1024]
    - [0, 1116.0]
  - - [1024, 30528, 1, 2048, 1024, 1024, 1024, 30528]
    - [40, 116658.0]
  - - [64, 4, 32768, 4, 64, 64, 2097152, 4]
    - [200, 271.0]
  - - [64, 4, 38400, 4, 64, 64, 2457600, 4]
    - [200, 271.0]
  - - [1024, 1024, 1, 8192, 1024, 1024, 1024, 1024]
    - [105, 65793.0]
  - - [1024, 1024, 1, 9600, 1024, 1024, 1024, 1024]
    - [56, 67360.0]
  - - [1024, 4096, 1, 8192, 1024, 1024, 1024, 4096]
    - [87, 104196.0]
  - - [1024, 4096, 1, 9600, 1024, 1024, 1024, 4096]
    - [87, 104661.0]
  - - [1024, 33712, 1, 8192, 1024, 1024, 1024, 33712]
    - [148, 116362.0]
  - - [1024, 33712, 1, 9600, 1024, 1024, 1024, 33712]
    - [64, 116157.0]
  - - [4096, 1024, 1, 8192, 4096, 4096, 4096, 1024]
    - [31, 100584.0]
  - - [4096, 1024, 1, 9600, 4096, 4096, 4096, 1024]
    - [31, 100462.0]
  - - [1024, 1024, 1, 10064, 1024, 1024, 1024, 1024]
    - [105, 66220.0]
  - - [1024, 1024, 1, 10080, 1024, 1024, 1024, 1024]
    - [105, 65180.0]
  - - [1024, 1024, 1, 10200, 1024, 1024, 1024, 1024]
    - [131, 65568.0]
  - - [1024, 1024, 1, 3840, 1024, 1024, 1024, 1024]
    - [78, 62215.0]
  - - [1024, 1024, 1, 3968, 1024, 1024, 1024, 1024]
    - [118, 63659.0]
  - - [1024, 1024, 1, 6528, 1024, 1024, 1024, 1024]
    - [123, 65416.0]
  - - [1024, 1024, 1, 7104, 1024, 1024, 1024, 1024]
    - [56, 65712.0]
  - - [1024, 1024, 1, 7200, 1024, 1024, 1024, 1024]
    - [105, 63550.0]
  - - [1024, 1024, 1, 8064, 1024, 1024, 1024, 1024]
    - [105, 66559.0]
  - - [1024, 1024, 1, 8160, 1024, 1024, 1024, 1024]
    - [105, 64430.0]
  - - [1024, 1024, 1, 9216, 1024, 1024, 1024, 1024]
    - [105, 67109.0]
  - - [1024, 1024, 1, 9520, 1024, 1024, 1024, 1024]
    - [123, 64187.0]
  - - [1024, 4096, 1, 10064, 1024, 1024, 1024, 4096]
    - [87, 104236.0]
  - - [1024, 4096, 1, 10080, 1024, 1024, 1024, 4096]
    - [87, 103848.0]
  - - [1024, 4096, 1, 10200, 1024, 1024, 1024, 4096]
    - [87, 104427.0]
  - - [1024, 4096, 1, 3840, 1024, 1024, 1024, 4096]
    - [87, 96978.0]
  - - [1024, 4096, 1, 3968, 1024, 1024, 1024, 4096]
    - [87, 98131.0]
  - - [1024, 4096, 1, 6528, 1024, 1024, 1024, 4096]
    - [87, 102410.0]
  - - [1024, 4096, 1, 7104, 1024, 1024, 1024, 4096]
    - [87, 103144.0]
  - - [1024, 4096, 1, 7200, 1024, 1024, 1024, 4096]
    - [87, 103138.0]
  - - [1024, 4096, 1, 8064, 1024, 1024, 1024, 4096]
    - [87, 103802.0]
  - - [1024, 4096, 1, 8160, 1024, 1024, 1024, 4096]
    - [87, 103915.0]
  - - [1024, 4096, 1, 9216, 1024, 1024, 1024, 4096]
    - [87, 104948.0]
  - - [1024, 4096, 1, 9520, 1024, 1024, 1024, 4096]
    - [87, 103167.0]
  - - [1024, 42720, 1, 10080, 1024, 1024, 1024, 42720]
    - [87, 123693.0]
  - - [1024, 42720, 1, 3968, 1024, 1024, 1024, 42720]
    - [87, 122350.0]
  - - [1024, 42720, 1, 6528, 1024, 1024, 1024, 42720]
    - [87, 123464.0]
  - - [1024, 42720, 1, 7104, 1024, 1024, 1024, 42720]
    - [87, 123957.0]
  - - [1024, 42720, 1, 7200, 1024, 1024, 1024, 42720]
    - [87, 124425.0]
  - - [1024, 42720, 1, 9520, 1024, 1024, 1024, 42720]
    - [87, 123477.0]
  - - [4096, 1024, 1, 10064, 4096, 4096, 4096, 1024]
    - [72, 99032.0]
  - - [4096, 1024, 1, 10080, 4096, 4096, 4096, 1024]
    - [12, 102439.0]
  - - [4096, 1024, 1, 10200, 4096, 4096, 4096, 1024]
    - [12, 100900.0]
  - - [4096, 1024, 1, 3840, 4096, 4096, 4096, 1024]
    - [87, 97636.0]
  - - [4096, 1024, 1, 3968, 4096, 4096, 4096, 1024]
    - [87, 98038.0]
  - - [4096, 1024, 1, 6528, 4096, 4096, 4096, 1024]
    - [87, 98889.0]
  - - [4096, 1024, 1, 7104, 4096, 4096, 4096, 1024]
    - [12, 98768.0]
  - - [4096, 1024, 1, 7200, 4096, 4096, 4096, 1024]
    - [87, 99970.0]
  - - [4096, 1024, 1, 8064, 4096, 4096, 4096, 1024]
    - [31, 99152.0]
  - - [4096, 1024, 1, 8160, 4096, 4096, 4096, 1024]
    - [12, 100121.0]
  - - [4096, 1024, 1, 9216, 4096, 4096, 4096, 1024]
    - [12, 101402.0]
  - - [4096, 1024, 1, 9520, 4096, 4096, 4096, 1024]
    - [12, 100265.0]
  - - [24, 64, 4736, 24, 24, 24, 24, 303104]
    - [70, 5713.0]
  - - [32, 64, 4608, 32, 32, 32, 32, 294912]
    - [61, 10040.0]
  - - [32, 64, 4608, 35, 32, 32, 32, 294912]
    - [106, 7521.0]
  - - [64, 14, 10880, 14, 64, 64, 696320, 14]
    - [209, 2921.0]
  - - [64, 15, 10880, 14, 64, 64, 696320, 15]
    - [208, 3036.0]
  - - [64, 15, 7680, 15, 64, 64, 491520, 15]
    - [213, 3065.0]
  - - [64, 15, 10880, 15, 64, 64, 696320, 15]
    - [208, 3210.0]
  - - [64, 17, 7680, 15, 64, 64, 491520, 17]
    - [37, 3399.0]
  - - [64, 17, 6144, 17, 64, 64, 393216, 17]
    - [145, 2881.0]
  - - [64, 17, 7680, 17, 64, 64, 491520, 17]
    - [107, 3344.0]
  - - [64, 21, 6144, 17, 64, 64, 393216, 21]
    - [147, 3468.0]
  - - [64, 21, 6144, 21, 64, 64, 393216, 21]
    - [59, 4121.0]
  - - [64, 24, 4736, 24, 64, 64, 303104, 24]
    - [145, 5867.0]
  - - [64, 30, 2048, 30, 64, 64, 131072, 30]
    - [147, 6302.0]
  - - [64, 30, 2048, 31, 64, 64, 131072, 30]
    - [71, 6456.0]
  - - [64, 31, 2048, 31, 64, 64, 131072, 31]
    - [135, 6588.0]
  - - [64, 32, 4608, 32, 64, 64, 294912, 32]
    - [147, 10175.0]
  - - [64, 32, 4608, 35, 64, 64, 294912, 32]
    - [107, 7548.0]
  - - [64, 34, 4736, 24, 64, 64, 303104, 34]
    - [68, 6322.0]
  - - [64, 34, 4736, 34, 64, 64, 303104, 34]
    - [57, 7042.0]
  - - [64, 35, 4608, 35, 64, 64, 294912, 35]
    - [57, 7112.0]
  - - [512, 64, 1, 512, 512, 512, 512, 64]
    - [13, 2873.0]
  - - [64, 512, 1, 512, 64, 64, 64, 512]
    - [25, 2873.0]
  - - [64, 128, 1, 128, 64, 64, 64, 128]
    - [103, 336.0]
  - - [128, 64, 1, 128, 128, 128, 128, 64]
    - [25, 354.0]
  - - [2048, 2048, 1, 512, 2048, 2048, 2048, 2048]
    - [81, 73343.0]
  - - [1024, 64, 1, 512, 1024, 1024, 1024, 64]
    - [25, 5746.0]
  - - [2048, 512, 1, 1, 2048, 2048, 2048, 512]
    - [0, 285.0]
  - - [1600, 1024, 1, 512, 1600, 1600, 1600, 1024]
    - [110, 55480.0]
  - - [512, 32, 1, 1600, 512, 512, 512, 32]
    - [103, 1916.0]
  - - [560, 1024, 1, 1600, 560, 560, 560, 1024]
    - [129, 39684.0]
  - - [1024, 1600, 1, 1, 1024, 1024, 1024, 1600]
    - [8, 402.0]
  - - [1024, 1024, 1, 1600, 1024, 1024, 1024, 1024]
    - [78, 55775.0]
  - - [512, 512, 1, 1600, 512, 512, 512, 512]
    - [115, 26084.0]
  - - [256, 1280, 1, 8976, 256, 256, 256, 1280]
    - [170, 40269.0]
  - - [256, 2560, 1, 8976, 256, 256, 256, 2560]
    - [152, 52410.0]
  - - [256, 2816, 1, 8976, 256, 256, 256, 2816]
    - [129, 54652.0]
  - - [256, 3328, 1, 8976, 256, 256, 256, 3328]
    - [7, 57585.0]
  - - [256, 3584, 1, 8976, 256, 256, 256, 3584]
    - [56, 60662.0]
  - - [256, 3840, 1, 8976, 256, 256, 256, 3840]
    - [118, 62991.0]
  - - [256, 4096, 1, 8976, 256, 256, 256, 4096]
    - [105, 61500.0]
  - - [256, 4352, 1, 8976, 256, 256, 256, 4352]
    - [78, 65930.0]
  - - [256, 4864, 1, 8976, 256, 256, 256, 4864]
    - [89, 67952.0]
  - - [256, 5120, 1, 8976, 256, 256, 256, 5120]
    - [102, 70839.0]
  - - [256, 5632, 1, 8976, 256, 256, 256, 5632]
    - [55, 77550.0]
  - - [256, 5888, 1, 8976, 256, 256, 256, 5888]
    - [102, 81191.0]
  - - [256, 6144, 1, 8976, 256, 256, 256, 6144]
    - [55, 83519.0]
  - - [256, 7168, 1, 8976, 256, 256, 256, 7168]
    - [55, 90859.0]
  - - [256, 8192, 1, 8976, 256, 256, 256, 8192]
    - [109, 79682.0]
  - - [256, 8960, 1, 8976, 256, 256, 256, 8960]
    - [48, 89454.0]
  - - [256, 9728, 1, 8976, 256, 256, 256, 9728]
    - [99, 76954.0]
  - - [256, 9984, 1, 8976, 256, 256, 256, 9984]
    - [113, 78697.0]
  - - [256, 10240, 1, 8976, 256, 256, 256, 10240]
    - [99, 80516.0]
  - - [256, 10496, 1, 8976, 256, 256, 256, 10496]
    - [99, 82665.0]
  - - [256, 11008, 1, 8976, 256, 256, 256, 11008]
    - [10, 86460.0]
  - - [256, 11264, 1, 8976, 256, 256, 256, 11264]
    - [52, 88422.0]
  - - [256, 11520, 1, 8976, 256, 256, 256, 11520]
    - [97, 90308.0]
  - - [256, 11776, 1, 8976, 256, 256, 256, 11776]
    - [97, 92215.0]
  - - [256, 12544, 1, 8976, 256, 256, 256, 12544]
    - [99, 97722.0]
  - - [256, 12800, 1, 8976, 256, 256, 256, 12800]
    - [74, 101088.0]
  - - [256, 13312, 1, 8976, 256, 256, 256, 13312]
    - [39, 104872.0]
  - - [256, 13568, 1, 8976, 256, 256, 256, 13568]
    - [128, 108738.0]
  - - [256, 14336, 1, 8976, 256, 256, 256, 14336]
    - [52, 114957.0]
  - - [256, 14848, 1, 8976, 256, 256, 256, 14848]
    - [75, 119096.0]
  - - [256, 15104, 1, 8976, 256, 256, 256, 15104]
    - [75, 120845.0]
  - - [256, 15872, 1, 8976, 256, 256, 256, 15872]
    - [47, 108831.0]
  - - [256, 16128, 1, 8976, 256, 256, 256, 16128]
    - [86, 112193.0]
  - - [256, 17152, 1, 8976, 256, 256, 256, 17152]
    - [86, 119144.0]
  - - [256, 17408, 1, 8976, 256, 256, 256, 17408]
    - [87, 109508.0]
  - - [256, 18688, 1, 8976, 256, 256, 256, 18688]
    - [49, 117200.0]
  - - [256, 19968, 1, 8976, 256, 256, 256, 19968]
    - [96, 94426.0]
  - - [256, 20480, 1, 8976, 256, 256, 256, 20480]
    - [96, 94452.0]
  - - [256, 20992, 1, 8976, 256, 256, 256, 20992]
    - [96, 97660.0]
  - - [256, 21248, 1, 8976, 256, 256, 256, 21248]
    - [51, 96203.0]
  - - [256, 22016, 1, 8976, 256, 256, 256, 22016]
    - [51, 97603.0]
  - - [256, 26112, 1, 8976, 256, 256, 256, 26112]
    - [137, 106734.0]
  - - [256, 32512, 1, 8976, 256, 256, 256, 32512]
    - [47, 112039.0]
  - - [256, 33536, 1, 8976, 256, 256, 256, 33536]
    - [86, 115930.0]
  - - [256, 44505, 1, 8976, 256, 256, 256, 44505]
    - [52, 116827.0]
  - - [480, 1024, 1, 32768, 480, 480, 480, 1024]
    - [167, 80854.0]
  - - [512, 32, 1, 200, 512, 512, 512, 32]
    - [13, 671.0]
  - - [512, 512, 1, 200, 512, 512, 512, 512]
    - [5, 7992.0]
  - - [512, 2048, 1, 256, 512, 512, 512, 2048]
    - [105, 30504.0]
  - - [560, 1024, 1, 200, 560, 560, 560, 1024]
    - [85, 15251.0]
  - - [768, 2048, 1, 256, 768, 768, 768, 2048]
    - [34, 43019.0]
  - - [1024, 64, 1, 960, 1024, 1024, 1024, 64]
    - [103, 6899.0]
  - - [1024, 256, 1, 1024, 1024, 1024, 1024, 256]
    - [24, 23141.0]
  - - [1024, 256, 1, 1280, 1024, 1024, 1024, 256]
    - [54, 24245.0]
  - - [1024, 256, 1, 2304, 1024, 1024, 1024, 256]
    - [65, 23159.0]
  - - [1024, 256, 1, 2816, 1024, 1024, 1024, 256]
    - [65, 21918.0]
  - - [1024, 256, 1, 3072, 1024, 1024, 1024, 256]
    - [150, 22075.0]
  - - [1024, 256, 1, 3328, 1024, 1024, 1024, 256]
    - [150, 22958.0]
  - - [1024, 256, 1, 3584, 1024, 1024, 1024, 256]
    - [155, 24215.0]
  - - [1024, 256, 1, 4096, 1024, 1024, 1024, 256]
    - [151, 25663.0]
  - - [1024, 256, 1, 4352, 1024, 1024, 1024, 256]
    - [149, 26655.0]
  - - [1024, 256, 1, 4608, 1024, 1024, 1024, 256]
    - [155, 26915.0]
  - - [1024, 256, 1, 5120, 1024, 1024, 1024, 256]
    - [149, 28728.0]
  - - [1024, 256, 1, 5376, 1024, 1024, 1024, 256]
    - [155, 29069.0]
  - - [1024, 256, 1, 5632, 1024, 1024, 1024, 256]
    - [149, 29911.0]
  - - [1024, 256, 1, 6144, 1024, 1024, 1024, 256]
    - [151, 30784.0]
  - - [1024, 256, 1, 6400, 1024, 1024, 1024, 256]
    - [149, 31584.0]
  - - [1024, 256, 1, 7680, 1024, 1024, 1024, 256]
    - [157, 34380.0]
  - - [1024, 256, 1, 7936, 1024, 1024, 1024, 256]
    - [155, 34812.0]
  - - [1024, 256, 1, 8192, 1024, 1024, 1024, 256]
    - [149, 35136.0]
  - - [1024, 256, 1, 8448, 1024, 1024, 1024, 256]
    - [153, 34997.0]
  - - [1024, 256, 1, 9728, 1024, 1024, 1024, 256]
    - [155, 37414.0]
  - - [1024, 256, 1, 9984, 1024, 1024, 1024, 256]
    - [165, 37389.0]
  - - [1024, 256, 1, 10496, 1024, 1024, 1024, 256]
    - [157, 38215.0]
  - - [1024, 256, 1, 11520, 1024, 1024, 1024, 256]
    - [164, 40116.0]
  - - [1024, 256, 1, 12032, 1024, 1024, 1024, 256]
    - [162, 42032.0]
  - - [1024, 256, 1, 13568, 1024, 1024, 1024, 256]
    - [162, 43291.0]
  - - [1024, 256, 1, 14336, 1024, 1024, 1024, 256]
    - [162, 45741.0]
  - - [1024, 256, 1, 14848, 1024, 1024, 1024, 256]
    - [163, 45092.0]
  - - [1024, 256, 1, 15104, 1024, 1024, 1024, 256]
    - [162, 46212.0]
  - - [1024, 256, 1, 15872, 1024, 1024, 1024, 256]
    - [165, 46149.0]
  - - [1024, 256, 1, 16128, 1024, 1024, 1024, 256]
    - [161, 46645.0]
  - - [1024, 256, 1, 17152, 1024, 1024, 1024, 256]
    - [160, 48285.0]
  - - [1024, 256, 1, 17408, 1024, 1024, 1024, 256]
    - [160, 48016.0]
  - - [1024, 256, 1, 18944, 1024, 1024, 1024, 256]
    - [172, 51302.0]
  - - [1024, 256, 1, 19712, 1024, 1024, 1024, 256]
    - [165, 52514.0]
  - - [1024, 256, 1, 19968, 1024, 1024, 1024, 256]
    - [172, 52640.0]
  - - [1024, 256, 1, 21248, 1024, 1024, 1024, 256]
    - [169, 54099.0]
  - - [1024, 256, 1, 21504, 1024, 1024, 1024, 256]
    - [169, 52703.0]
  - - [1024, 256, 1, 22016, 1024, 1024, 1024, 256]
    - [163, 53241.0]
  - - [1024, 256, 1, 28672, 1024, 1024, 1024, 256]
    - [176, 58831.0]
  - - [1024, 256, 1, 33536, 1024, 1024, 1024, 256]
    - [176, 62155.0]
  - - [1024, 1024, 1, 960, 1024, 1024, 1024, 1024]
    - [67, 51996.0]
  - - [1600, 1024, 1, 960, 1600, 1600, 1600, 1024]
    - [42, 65976.0]
  - - [2048, 256, 1, 1024, 2048, 2048, 2048, 256]
    - [41, 33554.0]
  - - [2048, 960, 1, 1, 2048, 2048, 2048, 960]
    - [50, 464.0]
  - - [2048, 2048, 1, 960, 2048, 2048, 2048, 2048]
    - [81, 81575.0]
  - - [2048, 2048, 1, 1024, 2048, 2048, 2048, 2048]
    - [81, 81344.0]
  - - [3200, 2048, 1, 1024, 3200, 3200, 3200, 2048]
    - [127, 90297.0]
  - - [4096, 4096, 1, 1024, 4096, 4096, 4096, 4096]
    - [62, 94686.0]
  - - [2048, 2, 1, 2, 2048, 2048, 2048, 2]
    - [209, 4.0]
  - - [2048, 2048, 1, 2, 2048, 2048, 1048576, 2048]
    - [0, 1092.0]
  - - [2048, 30592, 1, 1024, 2048, 2048, 2048, 30592]
    - [53, 111366.0]
  - - [2048, 6144, 1, 1024, 2048, 2048, 2048, 6144]
    - [93, 92510.0]
  - - [2048, 8192, 1, 1024, 2048, 2048, 2048, 8192]
    - [10, 94644.0]
  - - [8192, 2048, 1, 1024, 8192, 8192, 8192, 2048]
    - [141, 95316.0]
  - - [1024, 1024, 1, 16, 1024, 1024, 524288, 1024]
    - [8, 5377.0]
  - - [1024, 2, 1, 16, 1024, 1024, 1024, 2]
    - [200, 14.0]
  - - [1024, 30592, 1, 8192, 1024, 1024, 1024, 30592]
    - [53, 125979.0]
  - - [1024, 3072, 1, 8192, 1024, 1024, 1024, 3072]
    - [97, 98268.0]
  - - [512, 64, 256, 512, 512, 512, 512, 64]
    - [2, 45344.0]
  - - [64, 512, 256, 512, 64, 64, 64, 512]
    - [125, 44665.0]
  - - [1024, 30592, 1, 2048, 1024, 1024, 1024, 30592]
    - [17, 118160.0]
  - - [1024, 3072, 1, 2048, 1024, 1024, 1024, 3072]
    - [22, 83799.0]
  - - [1024, 1024, 1, 8, 1024, 1024, 524288, 1024]
    - [0, 2231.0]
  - - [1024, 30592, 1, 4096, 1024, 1024, 1024, 30592]
    - [100, 122454.0]
  - - [1024, 3072, 1, 4096, 1024, 1024, 1024, 3072]
    - [99, 92938.0]
  - - [512, 64, 128, 512, 512, 512, 512, 64]
    - [2, 39188.0]
  - - [64, 512, 128, 512, 64, 64, 64, 512]
    - [19, 40185.0]
  - - [2560, 1920, 1, 2048, 2560, 2560, 2560, 1920]
    - [49, 117050.0]
  - - [2560, 2, 1, 4, 2560, 2560, 2560, 2]
    - [200, 9.0]
  - - [2560, 2560, 1, 2048, 2560, 2560, 2560, 2560]
    - [30, 100222.0]
  - - [2560, 2560, 1, 4, 2560, 2560, 1310720, 2560]
    - [121, 2501.0]
  - - [2560, 7680, 1, 2048, 2560, 2560, 2560, 7680]
    - [49, 119100.0]
  - - [640, 2560, 1, 2048, 640, 640, 640, 2560]
    - [55, 71453.0]
  - - [512, 64, 40, 512, 512, 512, 512, 64]
    - [95, 34521.0]
  - - [64, 512, 40, 512, 64, 64, 64, 512]
    - [19, 35099.0]
  - - [1536, 1536, 1, 4096, 1536, 1536, 1536, 1536]
    - [11, 88237.0]
  - - [1536, 4608, 1, 4096, 1536, 1536, 1536, 4608]
    - [134, 112333.0]
  - - [1536, 50304, 1, 4096, 1536, 1536, 1536, 50304]
    - [100, 122551.0]
  - - [1536, 6144, 1, 4096, 1536, 1536, 1536, 6144]
    - [87, 114770.0]
  - - [6144, 1536, 1, 4096, 6144, 6144, 6144, 1536]
    - [49, 114580.0]
  - - [1024, 96, 64, 1024, 1024, 1024, 1024, 96]
    - [27, 65260.0]
  - - [96, 1024, 64, 1024, 96, 96, 96, 1024]
    - [96, 62767.0]
  - - [1536, 1536, 1, 8192, 1536, 1536, 1536, 1536]
    - [11, 89844.0]
  - - [1536, 4608, 1, 8192, 1536, 1536, 1536, 4608]
    - [23, 115153.0]
  - - [1536, 50304, 1, 8192, 1536, 1536, 1536, 50304]
    - [114, 125033.0]
  - - [1536, 6144, 1, 8192, 1536, 1536, 1536, 6144]
    - [87, 119098.0]
  - - [6144, 1536, 1, 8192, 6144, 6144, 6144, 1536]
    - [87, 118529.0]
  - - [1024, 96, 128, 1024, 1024, 1024, 1024, 96]
    - [46, 70363.0]
  - - [96, 1024, 128, 1024, 96, 96, 96, 1024]
    - [21, 69066.0]
  - - [1024, 1024, 1, 16384, 1024, 1024, 1024, 1024]
    - [105, 68785.0]
  - - [1024, 3072, 1, 16384, 1024, 1024, 1024, 3072]
    - [99, 100193.0]
  - - [1024, 4096, 1, 16384, 1024, 1024, 1024, 4096]
    - [87, 104653.0]
  - - [1024, 50304, 1, 16384, 1024, 1024, 1024, 50304]
    - [87, 121848.0]
  - - [4096, 1024, 1, 16384, 4096, 4096, 4096, 1024]
    - [12, 104158.0]
  - - [1024, 64, 256, 1024, 1024, 1024, 1024, 64]
    - [98, 54025.0]
  - - [64, 1024, 256, 1024, 64, 64, 64, 1024]
    - [125, 54120.0]
  - - [1024, 50304, 1, 2048, 1024, 1024, 1024, 50304]
    - [133, 113357.0]
  - - [1024, 64, 32, 1024, 1024, 1024, 1024, 64]
    - [16, 43577.0]
  - - [64, 1024, 32, 1024, 64, 64, 64, 1024]
    - [15, 43719.0]
  - - [1024, 50304, 1, 4096, 1024, 1024, 1024, 50304]
    - [49, 117919.0]
  - - [1024, 64, 64, 1024, 1024, 1024, 1024, 64]
    - [20, 47637.0]
  - - [64, 1024, 64, 1024, 64, 64, 64, 1024]
    - [19, 48193.0]
  - - [1024, 50304, 1, 8192, 1024, 1024, 1024, 50304]
    - [87, 120684.0]
  - - [1024, 64, 128, 1024, 1024, 1024, 1024, 64]
    - [83, 53077.0]
  - - [64, 1024, 128, 1024, 64, 64, 64, 1024]
    - [112, 53050.0]
  - - [1024, 2, 1, 64, 1024, 1024, 1024, 2]
    - [204, 46.0]
  - - [1024, 30528, 1, 8192, 1024, 1024, 1024, 30528]
    - [76, 125513.0]
  - - [1024, 1024, 1, 64, 1024, 1024, 131072, 1024]
    - [85, 15828.0]
  - - [64, 128, 1024, 128, 64, 64, 64, 128]
    - [1, 25762.0]
  - - [128, 64, 1024, 128, 128, 128, 128, 64]
    - [120, 25861.0]
  - - [1024, 1024, 1, 3456, 1024, 1024, 1024, 1024]
    - [131, 61547.0]
  - - [1024, 1024, 1, 6912, 1024, 1024, 1024, 1024]
    - [56, 66371.0]
  - - [1024, 1024, 1, 864, 1024, 1024, 1024, 1024]
    - [126, 42896.0]
  - - [1024, 512, 1, 3456, 1024, 1024, 1024, 512]
    - [130, 38519.0]
  - - [1024, 512, 1, 4096, 1024, 1024, 1024, 512]
    - [117, 38960.0]
  - - [1024, 512, 1, 6912, 1024, 1024, 1024, 512]
    - [66, 41031.0]
  - - [1024, 512, 1, 864, 1024, 1024, 1024, 512]
    - [19, 28454.0]
  - - [256, 128, 1, 3456, 256, 256, 256, 128]
    - [166, 6464.0]
  - - [256, 128, 1, 4096, 256, 256, 256, 128]
    - [171, 7170.0]
  - - [256, 128, 1, 55296, 256, 256, 256, 128]
    - [179, 31633.0]
  - - [256, 128, 1, 6912, 256, 256, 256, 128]
    - [178, 10447.0]
  - - [256, 128, 1, 864, 256, 256, 256, 128]
    - [13, 2831.0]
  - - [256, 3456, 1, 1, 256, 256, 256, 3456]
    - [0, 270.0]
  - - [256, 4096, 1, 1, 256, 256, 256, 4096]
    - [0, 285.0]
  - - [256, 6912, 1, 1, 256, 256, 256, 6912]
    - [8, 425.0]
  - - [256, 864, 1, 1, 256, 256, 256, 864]
    - [132, 84.0]
  - - [480, 1024, 1, 3456, 480, 480, 480, 1024]
    - [116, 36421.0]
  - - [480, 1024, 1, 4096, 480, 480, 480, 1024]
    - [116, 37228.0]
  - - [480, 1024, 1, 6912, 480, 480, 480, 1024]
    - [154, 45713.0]
  - - [480, 1024, 1, 864, 480, 480, 480, 1024]
    - [33, 26279.0]
  - - [512, 256, 1, 3456, 512, 512, 512, 256]
    - [158, 15387.0]
  - - [512, 256, 1, 4096, 512, 512, 512, 256]
    - [159, 16694.0]
  - - [512, 256, 1, 55296, 512, 512, 512, 256]
    - [175, 59603.0]
  - - [512, 256, 1, 6912, 512, 512, 512, 256]
    - [168, 22293.0]
  - - [512, 256, 1, 864, 512, 512, 512, 256]
    - [88, 9375.0]
  - - [30528, 1024, 1, 640, 30528, 30528, 30528, 1024]
    - [139, 100963.0]
  - - [1024, 1024, 1, 32, 1024, 1024, 1024, 1024]
    - [85, 9754.0]
  - - [30528, 1024, 1, 1280, 30528, 30528, 30528, 1024]
    - [144, 112931.0]
  - - [1024, 1024, 1, 64, 1024, 1024, 1024, 1024]
    - [94, 15534.0]
  - - [4096, 1024, 1, 10240, 4096, 4096, 4096, 1024]
    - [72, 101182.0]
  - - [1024, 4096, 1, 10240, 1024, 1024, 1024, 4096]
    - [87, 104348.0]
  - - [30528, 1024, 1, 1600, 30528, 30528, 30528, 1024]
    - [142, 114760.0]
  - - [1024, 2, 1, 80, 1024, 1024, 1024, 2]
    - [214, 53.0]
  - - [1024, 1024, 1, 10240, 1024, 1024, 1024, 1024]
    - [56, 67109.0]
  - - [1024, 1024, 1, 80, 1024, 1024, 1024, 1024]
    - [82, 16644.0]
  - - [64, 128, 1280, 128, 64, 64, 64, 128]
    - [1, 26338.0]
  - - [128, 64, 1280, 128, 128, 128, 128, 64]
    - [2, 26052.0]
  - - [1024, 4096, 1, 10496, 1024, 1024, 1024, 4096]
    - [87, 105440.0]
  - - [30528, 1024, 1, 1640, 30528, 30528, 30528, 1024]
    - [144, 109359.0]
  - - [4096, 1024, 1, 10496, 4096, 4096, 4096, 1024]
    - [12, 101511.0]
  - - [1024, 1024, 1, 10496, 1024, 1024, 1024, 1024]
    - [89, 66686.0]
  - - [1024, 1024, 1, 82, 1024, 1024, 1024, 1024]
    - [45, 13779.0]
  - - [1024, 2, 1, 82, 1024, 1024, 1024, 2]
    - [210, 46.0]
  - - [128, 64, 1312, 128, 128, 128, 128, 64]
    - [29, 26254.0]
  - - [64, 128, 1312, 128, 64, 64, 64, 128]
    - [119, 26620.0]
  - - [30528, 1024, 1, 160, 30528, 30528, 30528, 1024]
    - [84, 62899.0]
  - - [1024, 4096, 1, 6144, 1024, 1024, 1024, 4096]
    - [87, 101680.0]
  - - [30528, 1024, 1, 240, 30528, 30528, 30528, 1024]
    - [60, 74195.0]
  - - [4096, 1024, 1, 6144, 4096, 4096, 4096, 1024]
    - [87, 99852.0]
  - - [1024, 1024, 1, 12, 1024, 1024, 1024, 1024]
    - [0, 3084.0]
  - - [1024, 2, 1, 12, 1024, 1024, 1024, 2]
    - [9, 9.0]
  - - [1024, 1024, 1, 6144, 1024, 1024, 1024, 1024]
    - [67, 64892.0]
  - - [64, 512, 192, 512, 64, 64, 64, 512]
    - [28, 44006.0]
  - - [512, 64, 192, 512, 512, 512, 512, 64]
    - [95, 42790.0]
  - - [13, 512, 1, 32768, 13, 13, 13, 512]
    - [219, 6601.0]
  - - [479, 1024, 1, 32768, 479, 479, 479, 1024]
    - [198, 73297.0]
  - - [4, 64, 32768, 4, 4, 4, 4, 2097152]
    - [199, 269.0]
  - - [4, 64, 38400, 4, 4, 4, 4, 2457600]
    - [199, 270.0]
  - - [14, 64, 10880, 14, 14, 14, 14, 696320]
    - [205, 2546.0]
  - - [15, 64, 10880, 14, 15, 15, 15, 696320]
    - [207, 2645.0]
  - - [15, 64, 7680, 15, 15, 15, 15, 491520]
    - [207, 2727.0]
  - - [15, 64, 10880, 15, 15, 15, 15, 696320]
    - [205, 2810.0]
  - - [17, 64, 7680, 15, 17, 17, 17, 491520]
    - [193, 2674.0]
  - - [17, 64, 6144, 17, 17, 17, 17, 393216]
    - [191, 2492.0]
  - - [17, 64, 7680, 17, 17, 17, 17, 491520]
    - [197, 2715.0]
  - - [21, 64, 6144, 17, 21, 21, 21, 393216]
    - [196, 3010.0]
  - - [21, 64, 6144, 21, 21, 21, 21, 393216]
    - [195, 3631.0]
  - - [30, 64, 2048, 30, 30, 30, 30, 131072]
    - [184, 5401.0]
  - - [30, 64, 2048, 31, 30, 30, 30, 131072]
    - [184, 5623.0]
  - - [31, 64, 2048, 31, 31, 31, 31, 131072]
    - [184, 5623.0]
  - - [34, 64, 4736, 24, 34, 34, 34, 303104]
    - [188, 4846.0]
  - - [34, 64, 4736, 34, 34, 34, 34, 303104]
    - [194, 5725.0]
  - - [35, 64, 4608, 35, 35, 35, 35, 294912]
    - [181, 5812.0]
  - - [74, 2048, 1, 512, 74, 74, 74, 2048]
    - [185, 9509.0]
  - - [5, 64, 1, 5, 5, 5, 5, 64]
    - [203, 1.0]
  - - [33, 32, 1, 33, 33, 33, 33, 32]
    - [180, 9.0]
  - - [3, 64, 512, 3, 3, 3, 3, 64]
    - [199, 66.0]
  - - [5, 64, 512, 5, 5, 5, 5, 64]
    - [206, 183.0]
  - - [5, 64, 960, 5, 5, 5, 5, 64]
    - [203, 253.0]
  - - [9, 64, 512, 9, 9, 9, 9, 64]
    - [203, 592.0]
  - - [27, 128, 32768, 27, 27, 27, 27, 128]
    - [190, 7165.0]
  - - [33, 32, 200, 33, 33, 33, 33, 32]
    - [182, 1675.0]
  - - [33, 32, 1600, 33, 33, 33, 33, 32]
    - [186, 3983.0]
  - - [67, 2048, 1, 512, 67, 67, 67, 2048]
    - [187, 8526.0]
  - - [74, 2048, 1, 960, 74, 74, 74, 2048]
    - [183, 11366.0]
  - - [100, 2048, 1, 512, 100, 100, 100, 2048]
    - [189, 11498.0]
  - - [257, 4096, 1, 1024, 257, 257, 257, 4096]
    - [192, 36124.0]
  - - [13, 512, 1, 3456, 13, 13, 13, 512]
    - [224, 2300.0]
  - - [13, 512, 1, 4096, 13, 13, 13, 512]
    - [219, 2562.0]
  - - [13, 512, 1, 55296, 13, 13, 13, 512]
    - [226, 7517.0]
  - - [13, 512, 1, 6912, 13, 13, 13, 512]
    - [223, 3423.0]
  - - [13, 512, 1, 864, 13, 13, 13, 512]
    - [211, 557.0]
- null
