TRAIN_3.9/logic/gemm/arcturus_Cijk_Ailk_Bljk_BBH.yaml
- {MinimumRequiredVersion: 4.22.0}
- arcturus
- gfx908
- [Device 7380, Device 7388, Device 738c, Device 7390]
    SolutionIndex: 0
    SolutionNameMin: Cijk_Ailk_Bljk_BBH_MT32x32x32_MI16x16x8x1_SE_GRVW2_GSU1_LPB4_PLR5_SU0_SUS256_SRVW4_WGM1
    SolutionIndex: 1
    SolutionNameMin: Cijk_Ailk_Bljk_BBH_MT32x64x32_MI16x16x8x1_SE_GRVW2_GSU1_LPB4_PLR5_SU0_SUS256_SRVW4_WGM1
    SolutionIndex: 2
    SolutionNameMin: Cijk_Ailk_Bljk_BBH_MT64x32x32_MI16x16x8x1_SE_GRVW2_GSU1_LPB4_PLR5_SU0_SUS256_SRVW4_WGM1
    SolutionIndex: 3
    SolutionNameMin: Cijk_Ailk_Bljk_BBH_MT144x128x32_MI16x16x8x1_SE_GRVW2_GSU1_LPB4_PLR5_SU0_SUS256_SRVW0_WGM1
    SolutionIndex: 4
    SolutionNameMin: Cijk_Ailk_Bljk_BBH_MT64x128x32_MI32x32x4x1_SE_GRVW2_GSU1_LPB4_PLR9_SU0_SUS256_SRVW4_WGM1
    SolutionIndex: 5
    SolutionNameMin: Cijk_Ailk_Bljk_BBH_MT128x160x32_MI32x32x4x1_SE_GRVW2_GSU1_LPB4_PLR9_SU0_SUS256_SRVW4_WGM1
    SolutionIndex: 6
    SolutionNameMin: Cijk_Ailk_Bljk_BBH_MT32x32x64_MI16x16x8x1_SE_GRVW2_GSU1_LPB4_PLR9_SU0_SUS256_SRVW4_WGM1
    SolutionIndex: 7
    SolutionNameMin: Cijk_Ailk_Bljk_BBH_MT32x32x32_MI16x16x8x1_SE_GRVW4_GSU1_LPB4_PLR5_SU0_SUS256_SRVW4_WGM1
    SolutionIndex: 8
    SolutionNameMin: Cijk_Ailk_Bljk_BBH_MT64x32x32_MI16x16x8x1_SE_GRVW4_GSU1_LPB4_PLR5_SU0_SUS256_SRVW4_WGM1
    SolutionIndex: 9
    SolutionNameMin: Cijk_Ailk_Bljk_BBH_MT96x96x32_MI16x16x8x1_SE_GRVW4_GSU1_LPB4_PLR5_SU0_SUS256_SRVW0_WGM1
    SolutionIndex: 10
    SolutionNameMin: Cijk_Ailk_Bljk_BBH_MT128x96x32_MI32x32x4x1_SE_GRVW4_GSU1_LPB4_PLR9_SU0_SUS256_SRVW4_WGM1
    SolutionIndex: 11
    SolutionNameMin: Cijk_Ailk_Bljk_BBH_MT128x160x32_MI32x32x4x1_SE_GRVW4_GSU1_LPB4_PLR9_SU0_SUS256_SRVW4_WGM1
    SolutionIndex: 12
    SolutionNameMin: Cijk_Ailk_Bljk_BBH_MT64x32x64_MI16x16x8x1_SE_GRVW4_GSU1_LPB4_PLR9_SU0_SUS256_SRVW4_WGM1
    SolutionIndex: 13
    SolutionNameMin: Cijk_Ailk_Bljk_BBH_MT32x32x32_MI16x16x8x1_SE_GRVW8_GSU1_LPB8_PLR5_SU0_SUS256_SRVW4_WGM1
    SolutionIndex: 14
    SolutionNameMin: Cijk_Ailk_Bljk_BBH_MT32x64x32_MI16x16x8x1_SE_GRVW8_GSU1_LPB8_PLR5_SU0_SUS256_SRVW4_WGM1
    SolutionIndex: 15
    SolutionNameMin: Cijk_Ailk_Bljk_BBH_MT64x32x32_MI16x16x8x1_SE_GRVW8_GSU1_LPB8_PLR5_SU0_SUS256_SRVW4_WGM1
    SolutionIndex: 16
    SolutionNameMin: Cijk_Ailk_Bljk_BBH_MT64x128x32_MI32x32x4x1_SE_GRVW8_GSU1_LPB8_PLR9_SU0_SUS256_SRVW4_WGM1
    SolutionIndex: 17
    SolutionNameMin: Cijk_Ailk_Bljk_BBH_MT128x64x32_MI32x32x4x1_SE_GRVW8_GSU1_LPB8_PLR9_SU0_SUS256_SRVW4_WGM1
    SolutionIndex: 18
    SolutionNameMin: Cijk_Ailk_Bljk_BBH_MT128x128x32_MI32x32x4x1_SE_GRVW8_GSU1_LPB8_PLR9_SU0_SUS256_SRVW4_WGM1
    SolutionIndex: 19
    SolutionNameMin: Cijk_Ailk_Bljk_BBH_MT32x32x64_MI16x16x8x1_SE_GRVW8_GSU1_LPB8_PLR9_SU0_SUS256_SRVW4_WGM1
    SolutionIndex: 20
    SolutionNameMin: Cijk_Ailk_Bljk_BBH_MT32x64x64_MI16x16x8x1_SE_GRVW8_GSU1_LPB8_PLR9_SU0_SUS256_SRVW4_WGM1
    SolutionIndex: 21
    SolutionNameMin: Cijk_Ailk_Bljk_BBH_MT64x128x64_MI32x32x4x1_SE_GRVW8_GSU1_LPB8_PLR17_SU0_SUS256_SRVW4_WGM1
    SolutionIndex: 22
    SolutionNameMin: Cijk_Ailk_Bljk_BBH_MT128x64x64_MI32x32x4x1_SE_GRVW8_GSU1_LPB8_PLR17_SU0_SUS256_SRVW4_WGM1
    SolutionIndex: 23
    SolutionNameMin: Cijk_Ailk_Bljk_BBH_MT128x160x32_MI32x32x4x1_SE_GRVW2_GSU1_LPB4_PLR9_SU32_SUS128_SRVW4_WGM1
    SolutionIndex: 24
    SolutionNameMin: Cijk_Ailk_Bljk_BBH_MT64x128x32_MI32x32x4x1_SE_GRVW4_GSU1_LPB4_PLR9_SU32_SUS128_SRVW4_WGM1
    SolutionIndex: 25
    SolutionNameMin: Cijk_Ailk_Bljk_BBH_MT64x32x32_MI16x16x8x1_SE_GRVW8_GSU1_LPB8_PLR5_SU32_SUS128_SRVW4_WGM1
    SolutionIndex: 26
    SolutionNameMin: Cijk_Ailk_Bljk_BBH_MT64x128x32_MI32x32x4x1_SE_GRVW8_GSU1_LPB8_PLR9_SU32_SUS128_SRVW4_WGM1
    SolutionIndex: 27
    SolutionNameMin: Cijk_Ailk_Bljk_BBH_MT32x32x64_MI16x16x8x1_SE_GRVW8_GSU1_LPB8_PLR9_SU32_SUS128_SRVW4_WGM1
    SolutionIndex: 28
    SolutionNameMin: Cijk_Ailk_Bljk_BBH_MT64x128x32_MI32x32x4x1_SE_GRVW2_GSU1_LPB4_PLR9_SU32_SUS256_SRVW4_WGM1
    SolutionIndex: 29
    SolutionNameMin: Cijk_Ailk_Bljk_BBH_MT128x96x32_MI32x32x4x1_SE_GRVW4_GSU1_LPB4_PLR9_SU32_SUS256_SRVW4_WGM1
    SolutionIndex: 30
    SolutionNameMin: Cijk_Ailk_Bljk_BBH_MT64x32x32_MI16x16x8x1_SE_GRVW8_GSU1_LPB8_PLR5_SU32_SUS256_SRVW4_WGM1
    SolutionIndex: 31
    SolutionNameMin: Cijk_Ailk_Bljk_BBH_MT64x128x32_MI32x32x4x1_SE_GRVW8_GSU1_LPB8_PLR9_SU32_SUS256_SRVW4_WGM1
    SolutionIndex: 32
    SolutionNameMin: Cijk_Ailk_Bljk_BBH_MT32x32x64_MI16x16x8x1_SE_GRVW8_GSU1_LPB8_PLR9_SU32_SUS256_SRVW4_WGM1
    SolutionIndex: 33
    SolutionNameMin: Cijk_Ailk_Bljk_BBH_MT64x128x64_MI32x32x4x1_SE_GRVW8_GSU1_LPB8_PLR17_SU32_SUS256_SRVW4_WGM1
    SolutionIndex: 34
    SolutionNameMin: Cijk_Ailk_Bljk_BBH_MT64x32x32_MI16x16x8x1_SE_GRVW2_GSU1_LPB4_PLR5_SU0_SUS256_SRVW4_WGM2
    SolutionIndex: 35
    SolutionNameMin: Cijk_Ailk_Bljk_BBH_MT128x144x32_MI16x16x8x1_SE_GRVW2_GSU1_LPB4_PLR5_SU0_SUS256_SRVW4_WGM2
    SolutionIndex: 36
    SolutionNameMin: Cijk_Ailk_Bljk_BBH_MT144x128x32_MI16x16x8x1_SE_GRVW2_GSU1_LPB4_PLR5_SU0_SUS256_SRVW0_WGM2
    SolutionIndex: 37
    SolutionNameMin: Cijk_Ailk_Bljk_BBH_MT64x64x32_MI32x32x4x1_SE_GRVW2_GSU1_LPB4_PLR9_SU0_SUS256_SRVW4_WGM2
    SolutionIndex: 38
    SolutionNameMin: Cijk_Ailk_Bljk_BBH_MT128x96x64_MI32x32x4x1_SE_GRVW2_GSU1_LPB4_PLR17_SU0_SUS256_SRVW4_WGM2
    SolutionIndex: 39
    SolutionNameMin: Cijk_Ailk_Bljk_BBH_MT128x96x32_MI32x32x4x1_SE_GRVW4_GSU1_LPB4_PLR9_SU0_SUS256_SRVW4_WGM2
    SolutionIndex: 40
    SolutionNameMin: Cijk_Ailk_Bljk_BBH_MT128x160x32_MI32x32x4x1_SE_GRVW4_GSU1_LPB4_PLR9_SU0_SUS256_SRVW4_WGM2
    SolutionIndex: 41
    SolutionNameMin: Cijk_Ailk_Bljk_BBH_MT32x64x32_MI16x16x8x1_SE_GRVW8_GSU1_LPB8_PLR5_SU0_SUS256_SRVW4_WGM2
    SolutionIndex: 42
    SolutionNameMin: Cijk_Ailk_Bljk_BBH_MT64x32x32_MI16x16x8x1_SE_GRVW8_GSU1_LPB8_PLR5_SU0_SUS256_SRVW4_WGM2
    SolutionIndex: 43
    SolutionNameMin: Cijk_Ailk_Bljk_BBH_MT64x128x32_MI32x32x4x1_SE_GRVW8_GSU1_LPB8_PLR9_SU0_SUS256_SRVW4_WGM2
    SolutionIndex: 44
    SolutionNameMin: Cijk_Ailk_Bljk_BBH_MT128x64x32_MI32x32x4x1_SE_GRVW8_GSU1_LPB8_PLR9_SU0_SUS256_SRVW4_WGM2
    SolutionIndex: 45
    SolutionNameMin: Cijk_Ailk_Bljk_BBH_MT32x32x64_MI16x16x8x1_SE_GRVW8_GSU1_LPB8_PLR9_SU0_SUS256_SRVW4_WGM2
    SolutionIndex: 46
    SolutionNameMin: Cijk_Ailk_Bljk_BBH_MT64x128x64_MI32x32x4x1_SE_GRVW8_GSU1_LPB8_PLR17_SU0_SUS256_SRVW4_WGM2
    SolutionIndex: 47
    SolutionNameMin: Cijk_Ailk_Bljk_BBH_MT64x128x32_MI32x32x4x1_SE_GRVW2_GSU1_LPB4_PLR9_SU32_SUS128_SRVW4_WGM2
    SolutionIndex: 48
    SolutionNameMin: Cijk_Ailk_Bljk_BBH_MT128x160x32_MI32x32x4x1_SE_GRVW2_GSU1_LPB4_PLR9_SU32_SUS128_SRVW4_WGM2
    SolutionIndex: 49
    SolutionNameMin: Cijk_Ailk_Bljk_BBH_MT128x96x32_MI32x32x4x1_SE_GRVW4_GSU1_LPB4_PLR9_SU32_SUS128_SRVW4_WGM2
    SolutionIndex: 50
    SolutionNameMin: Cijk_Ailk_Bljk_BBH_MT64x64x32_MI32x32x4x1_SE_GRVW8_GSU1_LPB8_PLR9_SU32_SUS128_SRVW4_WGM2
    SolutionIndex: 51
    SolutionNameMin: Cijk_Ailk_Bljk_BBH_MT64x128x32_MI32x32x4x1_SE_GRVW8_GSU1_LPB8_PLR9_SU32_SUS128_SRVW4_WGM2
    SolutionIndex: 52
    SolutionNameMin: Cijk_Ailk_Bljk_BBH_MT32x32x64_MI16x16x8x1_SE_GRVW8_GSU1_LPB8_PLR9_SU32_SUS128_SRVW4_WGM2
    SolutionIndex: 53
    SolutionNameMin: Cijk_Ailk_Bljk_BBH_MT128x64x64_MI32x32x4x1_SE_GRVW8_GSU1_LPB8_PLR17_SU32_SUS128_SRVW4_WGM2
    SolutionIndex: 54
    SolutionNameMin: Cijk_Ailk_Bljk_BBH_MT128x96x32_MI32x32x4x1_SE_GRVW2_GSU1_LPB4_PLR9_SU32_SUS256_SRVW4_WGM2
    SolutionIndex: 55
    SolutionNameMin: Cijk_Ailk_Bljk_BBH_MT128x160x32_MI32x32x4x1_SE_GRVW2_GSU1_LPB4_PLR9_SU32_SUS256_SRVW4_WGM2
    SolutionIndex: 56
    SolutionNameMin: Cijk_Ailk_Bljk_BBH_MT128x96x32_MI32x32x4x1_SE_GRVW4_GSU1_LPB4_PLR9_SU32_SUS256_SRVW4_WGM2
    SolutionIndex: 57
    SolutionNameMin: Cijk_Ailk_Bljk_BBH_MT64x32x32_MI16x16x8x1_SE_GRVW8_GSU1_LPB8_PLR5_SU32_SUS256_SRVW4_WGM2
    SolutionIndex: 58
    SolutionNameMin: Cijk_Ailk_Bljk_BBH_MT64x64x32_MI32x32x4x1_SE_GRVW8_GSU1_LPB8_PLR9_SU32_SUS256_SRVW4_WGM2
    SolutionIndex: 59
    SolutionNameMin: Cijk_Ailk_Bljk_BBH_MT64x128x32_MI32x32x4x1_SE_GRVW8_GSU1_LPB8_PLR9_SU32_SUS256_SRVW4_WGM2
    SolutionIndex: 60
    SolutionNameMin: Cijk_Ailk_Bljk_BBH_MT128x64x32_MI32x32x4x1_SE_GRVW8_GSU1_LPB8_PLR9_SU32_SUS256_SRVW4_WGM2
    SolutionIndex: 61
    SolutionNameMin: Cijk_Ailk_Bljk_BBH_MT32x32x64_MI16x16x8x1_SE_GRVW8_GSU1_LPB8_PLR9_SU32_SUS256_SRVW4_WGM2
    SolutionIndex: 62
    SolutionNameMin: Cijk_Ailk_Bljk_BBH_MT144x128x32_MI16x16x8x1_SE_GRVW2_GSU1_LPB4_PLR5_SU0_SUS256_SRVW0_WGM15
    SolutionIndex: 63
    SolutionNameMin: Cijk_Ailk_Bljk_BBH_MT128x96x32_MI32x32x4x1_SE_GRVW2_GSU1_LPB4_PLR9_SU0_SUS256_SRVW4_WGM15
    SolutionIndex: 64
    SolutionNameMin: Cijk_Ailk_Bljk_BBH_MT128x160x32_MI32x32x4x1_SE_GRVW2_GSU1_LPB4_PLR9_SU0_SUS256_SRVW4_WGM15
    SolutionIndex: 65
    SolutionNameMin: Cijk_Ailk_Bljk_BBH_MT32x32x32_MI16x16x8x1_SE_GRVW4_GSU1_LPB4_PLR5_SU0_SUS256_SRVW4_WGM15
    SolutionIndex: 66
    SolutionNameMin: Cijk_Ailk_Bljk_BBH_MT32x64x32_MI16x16x8x1_SE_GRVW4_GSU1_LPB4_PLR5_SU0_SUS256_SRVW4_WGM15
    SolutionIndex: 67
    SolutionNameMin: Cijk_Ailk_Bljk_BBH_MT64x32x32_MI16x16x8x1_SE_GRVW4_GSU1_LPB4_PLR5_SU0_SUS256_SRVW4_WGM15
    SolutionIndex: 68
    SolutionNameMin: Cijk_Ailk_Bljk_BBH_MT96x96x32_MI16x16x8x1_SE_GRVW4_GSU1_LPB4_PLR5_SU0_SUS256_SRVW0_WGM15
    SolutionIndex: 69
    SolutionNameMin: Cijk_Ailk_Bljk_BBH_MT64x64x32_MI32x32x4x1_SE_GRVW4_GSU1_LPB4_PLR9_SU0_SUS256_SRVW4_WGM15
    SolutionIndex: 70
    SolutionNameMin: Cijk_Ailk_Bljk_BBH_MT128x64x32_MI32x32x4x1_SE_GRVW4_GSU1_LPB4_PLR9_SU0_SUS256_SRVW4_WGM15
    SolutionIndex: 71
    SolutionNameMin: Cijk_Ailk_Bljk_BBH_MT128x96x32_MI32x32x4x1_SE_GRVW4_GSU1_LPB4_PLR9_SU0_SUS256_SRVW4_WGM15
    SolutionIndex: 72
    SolutionNameMin: Cijk_Ailk_Bljk_BBH_MT96x128x32_MI32x32x4x1_SE_GRVW4_GSU1_LPB4_PLR9_SU0_SUS256_SRVW0_WGM15
    SolutionIndex: 73
    SolutionNameMin: Cijk_Ailk_Bljk_BBH_MT128x160x32_MI32x32x4x1_SE_GRVW4_GSU1_LPB4_PLR9_SU0_SUS256_SRVW4_WGM15
    SolutionIndex: 74
    SolutionNameMin: Cijk_Ailk_Bljk_BBH_MT32x64x32_MI16x16x8x1_SE_GRVW8_GSU1_LPB8_PLR5_SU0_SUS256_SRVW4_WGM15
    SolutionIndex: 75
    SolutionNameMin: Cijk_Ailk_Bljk_BBH_MT64x32x32_MI16x16x8x1_SE_GRVW8_GSU1_LPB8_PLR5_SU0_SUS256_SRVW4_WGM15
    SolutionIndex: 76
    SolutionNameMin: Cijk_Ailk_Bljk_BBH_MT64x64x32_MI32x32x4x1_SE_GRVW8_GSU1_LPB8_PLR9_SU0_SUS256_SRVW4_WGM15
    SolutionIndex: 77
    SolutionNameMin: Cijk_Ailk_Bljk_BBH_MT64x128x32_MI32x32x4x1_SE_GRVW8_GSU1_LPB8_PLR9_SU0_SUS256_SRVW4_WGM15
    SolutionIndex: 78
    SolutionNameMin: Cijk_Ailk_Bljk_BBH_MT128x64x32_MI32x32x4x1_SE_GRVW8_GSU1_LPB8_PLR9_SU0_SUS256_SRVW4_WGM15
    SolutionIndex: 79
    SolutionNameMin: Cijk_Ailk_Bljk_BBH_MT128x128x32_MI32x32x4x1_SE_GRVW8_GSU1_LPB8_PLR9_SU0_SUS256_SRVW4_WGM15
    SolutionIndex: 80
    SolutionNameMin: Cijk_Ailk_Bljk_BBH_MT256x64x32_MI32x32x4x1_SE_GRVW8_GSU1_LPB8_PLR9_SU0_SUS256_SRVW4_WGM15
    SolutionIndex: 81
    SolutionNameMin: Cijk_Ailk_Bljk_BBH_MT32x32x64_MI16x16x8x1_SE_GRVW8_GSU1_LPB8_PLR9_SU0_SUS256_SRVW4_WGM15
    SolutionIndex: 82
    SolutionNameMin: Cijk_Ailk_Bljk_BBH_MT64x64x64_MI32x32x4x1_SE_GRVW8_GSU1_LPB8_PLR17_SU0_SUS256_SRVW4_WGM15
    SolutionIndex: 83
    SolutionNameMin: Cijk_Ailk_Bljk_BBH_MT64x128x64_MI32x32x4x1_SE_GRVW8_GSU1_LPB8_PLR17_SU0_SUS256_SRVW4_WGM15
    SolutionIndex: 84
    SolutionNameMin: Cijk_Ailk_Bljk_BBH_MT128x160x32_MI32x32x4x1_SE_GRVW2_GSU1_LPB4_PLR9_SU32_SUS128_SRVW4_WGM15
    SolutionIndex: 85
    SolutionNameMin: Cijk_Ailk_Bljk_BBH_MT128x96x64_MI32x32x4x1_SE_GRVW2_GSU1_LPB4_PLR17_SU32_SUS128_SRVW4_WGM15
    SolutionIndex: 86
    SolutionNameMin: Cijk_Ailk_Bljk_BBH_MT64x128x32_MI32x32x4x1_SE_GRVW4_GSU1_LPB4_PLR9_SU32_SUS128_SRVW4_WGM15
    SolutionIndex: 87
    SolutionNameMin: Cijk_Ailk_Bljk_BBH_MT128x96x32_MI32x32x4x1_SE_GRVW4_GSU1_LPB4_PLR9_SU32_SUS128_SRVW4_WGM15
    SolutionIndex: 88
    SolutionNameMin: Cijk_Ailk_Bljk_BBH_MT32x64x32_MI16x16x8x1_SE_GRVW8_GSU1_LPB8_PLR5_SU32_SUS128_SRVW4_WGM15
    SolutionIndex: 89
    SolutionNameMin: Cijk_Ailk_Bljk_BBH_MT64x64x32_MI32x32x4x1_SE_GRVW8_GSU1_LPB8_PLR9_SU32_SUS128_SRVW4_WGM15
    SolutionIndex: 90
    SolutionNameMin: Cijk_Ailk_Bljk_BBH_MT64x128x32_MI32x32x4x1_SE_GRVW8_GSU1_LPB8_PLR9_SU32_SUS128_SRVW4_WGM15
    SolutionIndex: 91
    SolutionNameMin: Cijk_Ailk_Bljk_BBH_MT32x32x64_MI16x16x8x1_SE_GRVW8_GSU1_LPB8_PLR9_SU32_SUS128_SRVW4_WGM15
    SolutionIndex: 92
    SolutionNameMin: Cijk_Ailk_Bljk_BBH_MT128x64x64_MI32x32x4x1_SE_GRVW8_GSU1_LPB8_PLR17_SU32_SUS128_SRVW4_WGM15
    SolutionIndex: 93
    SolutionNameMin: Cijk_Ailk_Bljk_BBH_MT128x160x32_MI32x32x4x1_SE_GRVW2_GSU1_LPB4_PLR9_SU32_SUS256_SRVW4_WGM15
    SolutionIndex: 94
    SolutionNameMin: Cijk_Ailk_Bljk_BBH_MT128x96x64_MI32x32x4x1_SE_GRVW2_GSU1_LPB4_PLR17_SU32_SUS256_SRVW4_WGM15
    SolutionIndex: 95
    SolutionNameMin: Cijk_Ailk_Bljk_BBH_MT128x96x32_MI32x32x4x1_SE_GRVW4_GSU1_LPB4_PLR9_SU32_SUS256_SRVW4_WGM15
    SolutionIndex: 96
    SolutionNameMin: Cijk_Ailk_Bljk_BBH_MT32x64x64_MI16x16x8x1_SE_GRVW4_GSU1_LPB4_PLR9_SU32_SUS256_SRVW4_WGM15
    SolutionIndex: 97
    SolutionNameMin: Cijk_Ailk_Bljk_BBH_MT64x64x32_MI32x32x4x1_SE_GRVW8_GSU1_LPB8_PLR9_SU32_SUS256_SRVW4_WGM15
    SolutionIndex: 98
    SolutionNameMin: Cijk_Ailk_Bljk_BBH_MT64x128x32_MI32x32x4x1_SE_GRVW8_GSU1_LPB8_PLR9_SU32_SUS256_SRVW4_WGM15
    SolutionIndex: 99
    SolutionNameMin: Cijk_Ailk_Bljk_BBH_MT32x32x64_MI16x16x8x1_SE_GRVW8_GSU1_LPB8_PLR9_SU32_SUS256_SRVW4_WGM15
    SolutionIndex: 100
    SolutionNameMin: Cijk_Ailk_Bljk_BBH_MT32x64x64_MI16x16x8x1_SE_GRVW8_GSU1_LPB8_PLR9_SU32_SUS256_SRVW4_WGM15
    SolutionIndex: 101
    SolutionNameMin: Cijk_Ailk_Bljk_BBH_MT128x144x32_MI16x16x8x1_SE_GRVW2_GSU1_LPB4_PLR5_SU0_SUS256_SRVW4_WGM1
    SolutionIndex: 102
    SolutionNameMin: Cijk_Ailk_Bljk_BBH_MT96x96x32_MI16x16x8x1_SE_GRVW4_GSU1_LPB4_PLR5_SU0_SUS256_SRVW0_WGM1
    SolutionIndex: 103
    SolutionNameMin: Cijk_Ailk_Bljk_BBH_MT128x256x32_MI32x32x4x1_SE_GRVW8_GSU1_LPB8_PLR9_SU0_SUS256_SRVW4_WGM1
    SolutionIndex: 104
    SolutionNameMin: Cijk_Ailk_Bljk_BBH_MT96x96x64_MI16x16x8x1_SE_GRVW8_GSU1_LPB8_PLR9_SU0_SUS256_SRVW0_WGM1
    SolutionIndex: 105
    SolutionNameMin: Cijk_Ailk_Bljk_BBH_MT128x144x32_MI16x16x8x1_SE_GRVW2_GSU1_LPB4_PLR5_SU32_SUS128_SRVW4_WGM1
    SolutionIndex: 106
    SolutionNameMin: Cijk_Ailk_Bljk_BBH_MT128x256x32_MI32x32x4x1_SE_GRVW8_GSU1_LPB8_PLR9_SU32_SUS256_SRVW4_WGM1
    SolutionIndex: 107
    SolutionNameMin: Cijk_Ailk_Bljk_BBH_MT96x96x32_MI16x16x8x1_SE_GRVW4_GSU1_LPB4_PLR5_SU0_SUS256_SRVW0_WGM2
    SolutionIndex: 108
    SolutionNameMin: Cijk_Ailk_Bljk_BBH_MT128x256x32_MI32x32x4x1_SE_GRVW8_GSU1_LPB8_PLR9_SU0_SUS256_SRVW4_WGM2
    SolutionIndex: 109
    SolutionNameMin: Cijk_Ailk_Bljk_BBH_MT128x256x32_MI32x32x4x1_SE_GRVW8_GSU1_LPB8_PLR9_SU32_SUS256_SRVW4_WGM2
    SolutionIndex: 110
    SolutionNameMin: Cijk_Ailk_Bljk_BBH_MT128x144x32_MI16x16x8x1_SE_GRVW2_GSU1_LPB4_PLR5_SU0_SUS256_SRVW4_WGM15
    SolutionIndex: 111
    SolutionNameMin: Cijk_Ailk_Bljk_BBH_MT96x96x32_MI16x16x8x1_SE_GRVW4_GSU1_LPB4_PLR5_SU0_SUS256_SRVW0_WGM15
    SolutionIndex: 112
    SolutionNameMin: Cijk_Ailk_Bljk_BBH_MT128x256x32_MI32x32x4x1_SE_GRVW8_GSU1_LPB8_PLR9_SU0_SUS256_SRVW4_WGM15
    SolutionIndex: 113
    SolutionNameMin: Cijk_Ailk_Bljk_BBH_MT96x96x64_MI16x16x8x1_SE_GRVW8_GSU1_LPB8_PLR9_SU0_SUS256_SRVW0_WGM15
    SolutionIndex: 114
    SolutionNameMin: Cijk_Ailk_Bljk_BBH_MT128x144x32_MI16x16x8x1_SE_GRVW2_GSU1_LPB4_PLR5_SU32_SUS128_SRVW4_WGM15
    SolutionIndex: 115
    SolutionNameMin: Cijk_Ailk_Bljk_BBH_MT96x96x32_MI16x16x8x1_SE_GRVW4_GSU1_LPB4_PLR5_SU32_SUS128_SRVW0_WGM15
    SolutionIndex: 116
    SolutionNameMin: Cijk_Ailk_Bljk_BBH_MT128x256x32_MI32x32x4x1_SE_GRVW8_GSU1_LPB8_PLR9_SU32_SUS128_SRVW4_WGM15
    SolutionIndex: 117
    SolutionNameMin: Cijk_Ailk_Bljk_BBH_MT128x144x32_MI16x16x8x1_SE_GRVW2_GSU1_LPB4_PLR5_SU32_SUS256_SRVW4_WGM15
    SolutionIndex: 118
    SolutionNameMin: Cijk_Ailk_Bljk_BBH_MT128x256x32_MI32x32x4x1_SE_GRVW8_GSU1_LPB8_PLR9_SU32_SUS256_SRVW4_WGM15
    SolutionIndex: 119
    SolutionNameMin: Cijk_Ailk_Bljk_BBH_MT96x96x64_MI16x16x8x1_SE_GRVW8_GSU1_LPB8_PLR9_SU32_SUS256_SRVW0_WGM15
    SolutionIndex: 120
    SolutionNameMin: Cijk_Ailk_Bljk_BBH_MT128x160x32_MI32x32x4x1_SE_GRVW2_GSU3_LPB4_PLR9_SU0_SUS256_SRVW0_WGM2
    SolutionIndex: 121
    SolutionNameMin: Cijk_Ailk_Bljk_BBH_MT128x96x64_MI32x32x4x1_SE_GRVW8_GSU3_LPB8_PLR17_SU0_SUS256_SRVW0_WGM2
    SolutionIndex: 122
    SolutionNameMin: Cijk_Ailk_Bljk_BBH_MT128x160x32_MI32x32x4x1_SE_GRVW2_GSU3_LPB4_PLR9_SU0_SUS256_SRVW0_WGM15
    SolutionIndex: 123
    SolutionNameMin: Cijk_Ailk_Bljk_BBH_MT256x64x32_MI32x32x4x1_SE_GRVW8_GSU3_LPB8_PLR9_SU0_SUS256_SRVW0_WGM15
    SolutionIndex: 124
    SolutionNameMin: Cijk_Ailk_Bljk_BBH_MT128x64x64_MI32x32x4x1_SE_GRVW2_GSU3_LPB4_PLR17_SU32_SUS128_SRVW0_WGM15
    SolutionIndex: 125
    SolutionNameMin: Cijk_Ailk_Bljk_BBH_MT128x64x64_MI32x32x4x1_SE_GRVW8_GSU5_LPB8_PLR17_SU32_SUS128_SRVW0_WGM1
    SolutionIndex: 126
    SolutionNameMin: Cijk_Ailk_Bljk_BBH_MT96x96x64_MI16x16x8x1_SE_GRVW2_GSU5_LPB4_PLR9_SU0_SUS256_SRVW0_WGM2
    SolutionIndex: 127
    SolutionNameMin: Cijk_Ailk_Bljk_BBH_MT128x144x32_MI16x16x8x1_SE_GRVW2_GSU5_LPB4_PLR5_SU0_SUS256_SRVW0_WGM15
    SolutionIndex: 128
    SolutionNameMin: Cijk_Ailk_Bljk_BBH_MT128x64x64_MI32x32x4x1_SE_GRVW8_GSU5_LPB8_PLR17_SU0_SUS256_SRVW0_WGM15
    SolutionIndex: 129
    SolutionNameMin: Cijk_Ailk_Bljk_BBH_MT128x144x32_MI16x16x8x1_SE_GRVW2_GSU5_LPB4_PLR5_SU0_SUS256_SRVW0_WGM1
    SolutionIndex: 130
    SolutionNameMin: Cijk_Ailk_Bljk_BBH_MT32x32x64_MI16x16x8x1_SE_GRVW2_GSU7_LPB4_PLR9_SU0_SUS256_SRVW0_WGM1
    SolutionIndex: 131
    SolutionNameMin: Cijk_Ailk_Bljk_BBH_MT32x32x64_MI16x16x8x1_SE_GRVW8_GSU7_LPB8_PLR9_SU0_SUS256_SRVW0_WGM1
    SolutionIndex: 132
    SolutionNameMin: Cijk_Ailk_Bljk_BBH_MT32x32x64_MI16x16x8x1_SE_GRVW2_GSU7_LPB4_PLR9_SU32_SUS128_SRVW0_WGM1
    SolutionIndex: 133
    SolutionNameMin: Cijk_Ailk_Bljk_BBH_MT32x32x64_MI16x16x8x1_SE_GRVW2_GSU7_LPB4_PLR9_SU32_SUS256_SRVW0_WGM1
    SolutionIndex: 134
    SolutionNameMin: Cijk_Ailk_Bljk_BBH_MT128x128x32_MI32x32x4x1_SE_GRVW4_GSU7_LPB4_PLR9_SU32_SUS256_SRVW0_WGM1
    SolutionIndex: 135
    SolutionNameMin: Cijk_Ailk_Bljk_BBH_MT64x256x32_MI32x32x4x1_SE_GRVW4_GSU7_LPB4_PLR9_SU0_SUS256_SRVW0_WGM15
    SolutionIndex: 136
    SolutionNameMin: Cijk_Ailk_Bljk_BBH_MT128x96x32_MI32x32x4x1_SE_GRVW4_GSU15_LPB4_PLR9_SU32_SUS128_SRVW0_WGM2
    SolutionIndex: 137
    SolutionNameMin: Cijk_Ailk_Bljk_BBH_MT64x32x32_MI16x16x8x1_SE_GRVW8_GSU15_LPB8_PLR5_SU0_SUS256_SRVW0_WGM15
    SolutionIndex: 138
    SolutionNameMin: Cijk_Ailk_Bljk_BBH_MT128x96x32_MI32x32x4x1_SE_GRVW4_GSU1_LPB4_PLR9_SU0_SUS256_SRVW4_WGM15
    SolutionIndex: 139
    SolutionNameMin: Cijk_Ailk_Bljk_BBH_MT32x32x64_MI16x16x8x1_SE_GRVW8_GSU3_LPB8_PLR9_SU0_SUS256_SRVW0_WGM1
    SolutionIndex: 140
    SolutionNameMin: Cijk_Ailk_Bljk_BBH_MT64x128x64_MI32x32x4x1_SE_GRVW8_GSU3_LPB8_PLR17_SU32_SUS128_SRVW0_WGM1
    SolutionIndex: 141
    SolutionNameMin: Cijk_Ailk_Bljk_BBH_MT32x32x64_MI16x16x8x1_SE_GRVW4_GSU5_LPB4_PLR9_SU0_SUS256_SRVW0_WGM1
    SolutionIndex: 142
    SolutionNameMin: Cijk_Ailk_Bljk_BBH_MT32x64x64_MI16x16x8x1_SE_GRVW4_GSU5_LPB4_PLR9_SU0_SUS256_SRVW0_WGM1
    SolutionIndex: 143
    SolutionNameMin: Cijk_Ailk_Bljk_BBH_MT32x32x64_MI16x16x8x1_SE_GRVW8_GSU5_LPB8_PLR9_SU0_SUS256_SRVW0_WGM1
    SolutionIndex: 144
    SolutionNameMin: Cijk_Ailk_Bljk_BBH_MT64x16x32_MI16x16x8x1_SE_GRVW2_GSU7_LPB4_PLR5_SU32_SUS128_SRVW0_WGM1
- - - [7680, 8192, 1, 8192, 8384, 8384, 8384, 8384]
    - [112, 65752.0]
  - - [3840, 4096, 1, 4096, 4192, 4192, 4192, 4192]
    - [108, 65149.0]
  - - [1920, 2048, 1, 2048, 2080, 2080, 2080, 2080]
    - [59, 60061.0]
  - - [960, 1024, 1, 1024, 1056, 1056, 1056, 1056]
    - [58, 43389.0]
  - - [480, 512, 1, 512, 544, 544, 544, 544]
    - [81, 13217.0]
  - - [8192, 7680, 1, 8192, 8384, 8384, 8384, 8384]
    - [116, 65601.0]
  - - [4096, 3840, 1, 4096, 4192, 4192, 4192, 4192]
    - [112, 65086.0]
  - - [2048, 1920, 1, 2048, 2080, 2080, 2080, 2080]
    - [59, 59776.0]
  - - [1024, 960, 1, 1024, 1056, 1056, 1056, 1056]
    - [76, 42367.0]
  - - [512, 480, 1, 512, 544, 544, 544, 544]
    - [81, 13329.0]
  - - [8192, 8192, 1, 8192, 8384, 8384, 8384, 8384]
    - [87, 64522.0]
  - - [4096, 4096, 1, 4096, 4192, 4192, 4192, 4192]
    - [84, 61177.0]
  - - [2048, 2048, 1, 2048, 2080, 2080, 2080, 2080]
    - [110, 57450.0]
  - - [1024, 1024, 1, 1024, 1056, 1056, 1056, 1056]
    - [72, 30504.0]
  - - [512, 512, 1, 512, 544, 544, 544, 544]
    - [100, 12246.0]
  - - [64, 512, 16, 512, 64, 64, 64, 512]
    - [41, 18138.0]
  - - [64, 512, 128, 512, 64, 64, 64, 512]
    - [28, 33639.0]
  - - [1024, 1, 1, 2, 1024, 1024, 1024, 2]
    - [0, 0.0]
  - - [1024, 1, 1, 1024, 1024, 1024, 1024, 1024]
    - [130, 85.0]
  - - [1024, 8, 1, 1024, 1024, 1024, 1024, 1024]
    - [131, 668.0]
  - - [1024, 77, 1, 1024, 1024, 1024, 1024, 1024]
    - [91, 6192.0]
  - - [1024, 77, 1, 30522, 1024, 1024, 1024, 30522]
    - [136, 25734.0]
  - - [1024, 512, 1, 2, 1024, 1024, 1024, 2]
    - [13, 156.0]
  - - [1024, 512, 1, 1024, 1024, 1024, 1024, 1024]
    - [89, 23141.0]
  - - [1024, 512, 1, 4096, 1024, 1024, 1024, 4096]
    - [92, 29793.0]
  - - [1024, 616, 1, 1024, 1024, 1024, 1024, 1024]
    - [76, 26300.0]
  - - [1024, 4096, 1, 2, 1024, 1024, 1024, 2]
    - [68, 468.0]
  - - [1024, 4096, 1, 1024, 1024, 1024, 1024, 1024]
    - [71, 52531.0]
  - - [1024, 4096, 1, 4096, 1024, 1024, 1024, 4096]
    - [71, 59470.0]
  - - [4096, 512, 1, 1024, 4096, 4096, 4096, 1024]
    - [3, 40306.0]
  - - [4096, 4096, 1, 1024, 4096, 4096, 4096, 1024]
    - [87, 58738.0]
  - - [64, 128, 128, 128, 64, 64, 64, 128]
    - [42, 11732.0]
  - - [64, 128, 160, 128, 64, 64, 64, 128]
    - [77, 13707.0]
  - - [1024, 10, 1, 2, 1024, 1024, 1024, 2]
    - [0, 3.0]
  - - [1024, 10, 1, 1024, 1024, 1024, 1024, 1024]
    - [133, 830.0]
  - - [1024, 160, 1, 1024, 1024, 1024, 1024, 1024]
    - [27, 12264.0]
  - - [1024, 200, 1, 1024, 1024, 1024, 1024, 1024]
    - [91, 13797.0]
  - - [1024, 200, 1, 30522, 1024, 1024, 1024, 30522]
    - [134, 35133.0]
  - - [1024, 1024, 1, 2, 1024, 1024, 1024, 2]
    - [66, 228.0]
  - - [1024, 1024, 1, 1024, 1024, 1024, 1024, 1024]
    - [71, 29959.0]
  - - [1024, 1024, 1, 4096, 1024, 1024, 1024, 4096]
    - [87, 41298.0]
  - - [1024, 1280, 1, 2, 1024, 1024, 1024, 2]
    - [15, 262.0]
  - - [1024, 1280, 1, 1024, 1024, 1024, 1024, 1024]
    - [29, 37200.0]
  - - [1024, 1280, 1, 4096, 1024, 1024, 1024, 4096]
    - [71, 50763.0]
  - - [4096, 1024, 1, 1024, 4096, 4096, 4096, 1024]
    - [87, 52842.0]
  - - [4096, 1280, 1, 1024, 4096, 4096, 4096, 1024]
    - [87, 52552.0]
  - - [64, 128, 624, 128, 64, 64, 64, 128]
    - [15, 19756.0]
  - - [1024, 39, 1, 2, 1024, 1024, 1024, 2]
    - [13, 13.0]
  - - [1024, 39, 1, 1024, 1024, 1024, 1024, 1024]
    - [27, 3175.0]
  - - [1024, 780, 1, 1024, 1024, 1024, 1024, 1024]
    - [90, 31075.0]
  - - [1024, 780, 1, 30522, 1024, 1024, 1024, 30522]
    - [120, 53443.0]
  - - [1024, 4992, 1, 2, 1024, 1024, 1024, 2]
    - [70, 528.0]
  - - [1024, 4992, 1, 1024, 1024, 1024, 1024, 1024]
    - [39, 52220.0]
  - - [1024, 4992, 1, 4096, 1024, 1024, 1024, 4096]
    - [104, 56699.0]
  - - [4096, 4992, 1, 1024, 4096, 4096, 4096, 1024]
    - [49, 60739.0]
  - - [64, 512, 64, 512, 64, 64, 64, 512]
    - [47, 27006.0]
  - - [1024, 4, 1, 2, 1024, 1024, 1024, 2]
    - [0, 1.0]
  - - [1024, 4, 1, 1024, 1024, 1024, 1024, 1024]
    - [131, 338.0]
  - - [1024, 308, 1, 1024, 1024, 1024, 1024, 1024]
    - [96, 19043.0]
  - - [1024, 308, 1, 30522, 1024, 1024, 1024, 30522]
    - [124, 43550.0]
  - - [1024, 2048, 1, 2, 1024, 1024, 1024, 2]
    - [102, 338.0]
  - - [1024, 2048, 1, 1024, 1024, 1024, 1024, 1024]
    - [105, 39886.0]
  - - [1024, 2048, 1, 4096, 1024, 1024, 1024, 4096]
    - [35, 53821.0]
  - - [4096, 2048, 1, 1024, 4096, 4096, 4096, 1024]
    - [87, 56158.0]
  - - [64, 128, 640, 128, 64, 64, 64, 128]
    - [25, 19831.0]
  - - [1024, 40, 1, 2, 1024, 1024, 1024, 2]
    - [13, 14.0]
  - - [1024, 40, 1, 1024, 1024, 1024, 1024, 1024]
    - [61, 3318.0]
  - - [1024, 800, 1, 1024, 1024, 1024, 1024, 1024]
    - [50, 32165.0]
  - - [1024, 800, 1, 30522, 1024, 1024, 1024, 30522]
    - [122, 54101.0]
  - - [1024, 5120, 1, 2, 1024, 1024, 1024, 2]
    - [16, 537.0]
  - - [1024, 5120, 1, 1024, 1024, 1024, 1024, 1024]
    - [102, 51782.0]
  - - [1024, 5120, 1, 4096, 1024, 1024, 1024, 4096]
    - [104, 57382.0]
  - - [4096, 5120, 1, 1024, 4096, 4096, 4096, 1024]
    - [95, 58971.0]
  - - [64, 128, 656, 128, 64, 64, 64, 128]
    - [75, 20184.0]
  - - [1024, 41, 1, 2, 1024, 1024, 1024, 2]
    - [7, 14.0]
  - - [1024, 41, 1, 1024, 1024, 1024, 1024, 1024]
    - [52, 3297.0]
  - - [1024, 820, 1, 1024, 1024, 1024, 1024, 1024]
    - [97, 31988.0]
  - - [1024, 820, 1, 30522, 1024, 1024, 1024, 30522]
    - [129, 52406.0]
  - - [1024, 5248, 1, 2, 1024, 1024, 1024, 2]
    - [70, 560.0]
  - - [1024, 5248, 1, 1024, 1024, 1024, 1024, 1024]
    - [78, 53158.0]
  - - [1024, 5248, 1, 4096, 1024, 1024, 1024, 4096]
    - [87, 57743.0]
  - - [4096, 5248, 1, 1024, 4096, 4096, 4096, 1024]
    - [87, 60154.0]
  - - [64, 512, 80, 512, 64, 64, 64, 512]
    - [76, 31301.0]
  - - [1024, 5, 1, 2, 1024, 1024, 1024, 2]
    - [0, 2.0]
  - - [1024, 5, 1, 1024, 1024, 1024, 1024, 1024]
    - [132, 420.0]
  - - [1024, 385, 1, 1024, 1024, 1024, 1024, 1024]
    - [82, 22230.0]
  - - [1024, 385, 1, 30522, 1024, 1024, 1024, 30522]
    - [127, 47240.0]
  - - [1024, 2560, 1, 2, 1024, 1024, 1024, 2]
    - [111, 402.0]
  - - [1024, 2560, 1, 1024, 1024, 1024, 1024, 1024]
    - [59, 48072.0]
  - - [1024, 2560, 1, 4096, 1024, 1024, 1024, 4096]
    - [71, 54538.0]
  - - [4096, 2560, 1, 1024, 4096, 4096, 4096, 1024]
    - [90, 56299.0]
  - - [64, 512, 96, 512, 64, 64, 64, 512]
    - [24, 33332.0]
  - - [1024, 6, 1, 2, 1024, 1024, 1024, 2]
    - [0, 2.0]
  - - [1024, 6, 1, 1024, 1024, 1024, 1024, 1024]
    - [131, 521.0]
  - - [1024, 462, 1, 1024, 1024, 1024, 1024, 1024]
    - [88, 22263.0]
  - - [1024, 462, 1, 30522, 1024, 1024, 1024, 30522]
    - [121, 51175.0]
  - - [1024, 3072, 1, 2, 1024, 1024, 1024, 2]
    - [111, 455.0]
  - - [1024, 3072, 1, 1024, 1024, 1024, 1024, 1024]
    - [9, 48630.0]
  - - [1024, 3072, 1, 4096, 1024, 1024, 1024, 4096]
    - [104, 56712.0]
  - - [4096, 3072, 1, 1024, 4096, 4096, 4096, 1024]
    - [10, 58760.0]
  - - [1024, 8, 1, 2, 1024, 1024, 1024, 2]
    - [6, 3.0]
  - - [1024, 160, 1, 30522, 1024, 1024, 1024, 30522]
    - [125, 38657.0]
  - - [64, 128, 144, 128, 64, 64, 64, 128]
    - [77, 12753.0]
  - - [1024, 9, 1, 2, 1024, 1024, 1024, 2]
    - [0, 3.0]
  - - [1024, 9, 1, 1024, 1024, 1024, 1024, 1024]
    - [99, 747.0]
  - - [1024, 180, 1, 1024, 1024, 1024, 1024, 1024]
    - [27, 13107.0]
  - - [1024, 180, 1, 30522, 1024, 1024, 1024, 30522]
    - [126, 41028.0]
  - - [1024, 1152, 1, 2, 1024, 1024, 1024, 2]
    - [66, 236.0]
  - - [1024, 1152, 1, 1024, 1024, 1024, 1024, 1024]
    - [29, 35528.0]
  - - [1024, 1152, 1, 4096, 1024, 1024, 1024, 4096]
    - [71, 46639.0]
  - - [4096, 1152, 1, 1024, 4096, 4096, 4096, 1024]
    - [51, 53167.0]
  - - [256, 32768, 1, 128, 256, 256, 256, 128]
    - [78, 31069.0]
  - - [512, 32768, 1, 256, 512, 512, 512, 256]
    - [90, 48021.0]
  - - [1024, 32768, 1, 512, 1024, 1024, 1024, 512]
    - [39, 58229.0]
  - - [1024, 32768, 1, 1024, 1024, 1024, 1024, 1024]
    - [71, 61674.0]
  - - [64, 128, 512, 128, 64, 64, 64, 128]
    - [57, 18798.0]
  - - [128, 128, 512, 64, 128, 128, 128, 64]
    - [43, 17614.0]
  - - [1024, 32, 1, 2, 1024, 1024, 1024, 2]
    - [45, 12.0]
  - - [1024, 32, 1, 1024, 1024, 1024, 1024, 1024]
    - [52, 2706.0]
  - - [1024, 4096, 1, 30528, 1024, 1024, 1024, 30528]
    - [39, 61926.0]
  - - [512, 512, 64, 64, 512, 512, 512, 64]
    - [17, 24582.0]
  - - [1024, 2048, 1, 30528, 1024, 1024, 1024, 30528]
    - [35, 59914.0]
  - - [64, 4, 32768, 4, 64, 64, 2097152, 4]
    - [2, 135.0]
  - - [64, 4, 38400, 4, 64, 64, 2457600, 4]
    - [2, 136.0]
  - - [1024, 8192, 1, 1024, 1024, 1024, 1024, 1024]
    - [87, 56423.0]
  - - [1024, 8192, 1, 4096, 1024, 1024, 1024, 4096]
    - [71, 60612.0]
  - - [1024, 8192, 1, 33712, 1024, 1024, 1024, 33712]
    - [71, 61831.0]
  - - [1024, 9600, 1, 1024, 1024, 1024, 1024, 1024]
    - [71, 58471.0]
  - - [1024, 9600, 1, 4096, 1024, 1024, 1024, 4096]
    - [64, 62633.0]
  - - [1024, 9600, 1, 33712, 1024, 1024, 1024, 33712]
    - [93, 64859.0]
  - - [4096, 8192, 1, 1024, 4096, 4096, 4096, 1024]
    - [54, 60586.0]
  - - [4096, 9600, 1, 1024, 4096, 4096, 4096, 1024]
    - [117, 61840.0]
  - - [1024, 10064, 1, 1024, 1024, 1024, 1024, 1024]
    - [71, 58419.0]
  - - [1024, 10064, 1, 4096, 1024, 1024, 1024, 4096]
    - [63, 61988.0]
  - - [1024, 10080, 1, 1024, 1024, 1024, 1024, 1024]
    - [71, 59433.0]
  - - [1024, 10080, 1, 4096, 1024, 1024, 1024, 4096]
    - [38, 61890.0]
  - - [1024, 10080, 1, 42720, 1024, 1024, 1024, 42720]
    - [95, 64944.0]
  - - [1024, 10200, 1, 1024, 1024, 1024, 1024, 1024]
    - [16, 56794.0]
  - - [1024, 10200, 1, 4096, 1024, 1024, 1024, 4096]
    - [110, 60447.0]
  - - [1024, 3840, 1, 1024, 1024, 1024, 1024, 1024]
    - [71, 51996.0]
  - - [1024, 3840, 1, 4096, 1024, 1024, 1024, 4096]
    - [79, 61119.0]
  - - [1024, 3968, 1, 1024, 1024, 1024, 1024, 1024]
    - [10, 50990.0]
  - - [1024, 3968, 1, 4096, 1024, 1024, 1024, 4096]
    - [71, 57580.0]
  - - [1024, 3968, 1, 42720, 1024, 1024, 1024, 42720]
    - [71, 60069.0]
  - - [1024, 6528, 1, 1024, 1024, 1024, 1024, 1024]
    - [16, 55381.0]
  - - [1024, 6528, 1, 4096, 1024, 1024, 1024, 4096]
    - [39, 58216.0]
  - - [1024, 6528, 1, 42720, 1024, 1024, 1024, 42720]
    - [46, 62386.0]
  - - [1024, 7104, 1, 1024, 1024, 1024, 1024, 1024]
    - [71, 57870.0]
  - - [1024, 7104, 1, 4096, 1024, 1024, 1024, 4096]
    - [71, 62566.0]
  - - [1024, 7104, 1, 42720, 1024, 1024, 1024, 42720]
    - [84, 64496.0]
  - - [1024, 7200, 1, 1024, 1024, 1024, 1024, 1024]
    - [71, 58218.0]
  - - [1024, 7200, 1, 4096, 1024, 1024, 1024, 4096]
    - [64, 62179.0]
  - - [1024, 7200, 1, 42720, 1024, 1024, 1024, 42720]
    - [84, 65300.0]
  - - [1024, 8064, 1, 1024, 1024, 1024, 1024, 1024]
    - [71, 56979.0]
  - - [1024, 8064, 1, 4096, 1024, 1024, 1024, 4096]
    - [71, 60072.0]
  - - [1024, 8160, 1, 1024, 1024, 1024, 1024, 1024]
    - [71, 57379.0]
  - - [1024, 8160, 1, 4096, 1024, 1024, 1024, 4096]
    - [71, 60649.0]
  - - [1024, 9216, 1, 1024, 1024, 1024, 1024, 1024]
    - [16, 56579.0]
  - - [1024, 9216, 1, 4096, 1024, 1024, 1024, 4096]
    - [79, 60150.0]
  - - [1024, 9520, 1, 1024, 1024, 1024, 1024, 1024]
    - [87, 56590.0]
  - - [1024, 9520, 1, 4096, 1024, 1024, 1024, 4096]
    - [79, 61445.0]
  - - [1024, 9520, 1, 42720, 1024, 1024, 1024, 42720]
    - [93, 64819.0]
  - - [4096, 10064, 1, 1024, 4096, 4096, 4096, 1024]
    - [114, 61511.0]
  - - [4096, 10080, 1, 1024, 4096, 4096, 4096, 1024]
    - [101, 62116.0]
  - - [4096, 10200, 1, 1024, 4096, 4096, 4096, 1024]
    - [101, 62139.0]
  - - [4096, 3840, 1, 1024, 4096, 4096, 4096, 1024]
    - [109, 61851.0]
  - - [4096, 3968, 1, 1024, 4096, 4096, 4096, 1024]
    - [87, 57405.0]
  - - [4096, 6528, 1, 1024, 4096, 4096, 4096, 1024]
    - [87, 60182.0]
  - - [4096, 7104, 1, 1024, 4096, 4096, 4096, 1024]
    - [56, 61188.0]
  - - [4096, 7200, 1, 1024, 4096, 4096, 4096, 1024]
    - [87, 60215.0]
  - - [4096, 8064, 1, 1024, 4096, 4096, 4096, 1024]
    - [101, 62431.0]
  - - [4096, 8160, 1, 1024, 4096, 4096, 4096, 1024]
    - [56, 61442.0]
  - - [4096, 9216, 1, 1024, 4096, 4096, 4096, 1024]
    - [10, 61536.0]
  - - [4096, 9520, 1, 1024, 4096, 4096, 4096, 1024]
    - [114, 61287.0]
  - - [64, 14, 10880, 14, 64, 64, 696320, 14]
    - [2, 1417.0]
  - - [64, 14, 10880, 15, 64, 64, 696320, 15]
    - [2, 1511.0]
  - - [64, 15, 7680, 15, 64, 64, 491520, 15]
    - [2, 1576.0]
  - - [64, 15, 10880, 15, 64, 64, 696320, 15]
    - [2, 1616.0]
  - - [64, 15, 7680, 17, 64, 64, 491520, 17]
    - [2, 1683.0]
  - - [64, 17, 6144, 17, 64, 64, 393216, 17]
    - [2, 1840.0]
  - - [64, 17, 7680, 17, 64, 64, 491520, 17]
    - [2, 1903.0]
  - - [64, 17, 6144, 21, 64, 64, 393216, 21]
    - [2, 2227.0]
  - - [64, 21, 6144, 21, 64, 64, 393216, 21]
    - [2, 2720.0]
  - - [64, 24, 4736, 24, 64, 64, 303104, 24]
    - [2, 3475.0]
  - - [64, 24, 4736, 34, 64, 64, 303104, 34]
    - [2, 4410.0]
  - - [64, 30, 2048, 30, 64, 64, 131072, 30]
    - [34, 4073.0]
  - - [64, 31, 2048, 30, 64, 64, 131072, 30]
    - [2, 4209.0]
  - - [64, 31, 2048, 31, 64, 64, 131072, 31]
    - [2, 4386.0]
  - - [64, 32, 4608, 32, 64, 64, 294912, 32]
    - [15, 8464.0]
  - - [64, 34, 4736, 34, 64, 64, 303104, 34]
    - [37, 4124.0]
  - - [64, 35, 4608, 32, 64, 64, 294912, 32]
    - [15, 6441.0]
  - - [64, 35, 4608, 35, 64, 64, 294912, 35]
    - [69, 4079.0]
  - - [64, 512, 1, 512, 64, 64, 64, 512]
    - [61, 1792.0]
  - - [512, 512, 1, 64, 512, 512, 512, 64]
    - [13, 2873.0]
  - - [128, 128, 1, 64, 128, 128, 128, 64]
    - [52, 193.0]
  - - [64, 128, 1, 128, 64, 64, 64, 128]
    - [19, 166.0]
  - - [1024, 512, 1, 64, 1024, 1024, 1024, 64]
    - [65, 5178.0]
  - - [64, 5, 1, 5, 64, 64, 64, 5]
    - [0, 0.0]
  - - [2048, 512, 1, 2048, 2048, 2048, 2048, 2048]
    - [87, 36621.0]
  - - [512, 1600, 1, 512, 512, 512, 512, 512]
    - [76, 26614.0]
  - - [32, 33, 1, 33, 32, 32, 32, 33]
    - [0, 5.0]
  - - [560, 1600, 1, 1024, 560, 560, 560, 1024]
    - [83, 34032.0]
  - - [512, 1600, 1, 32, 512, 512, 512, 32]
    - [8, 4312.0]
  - - [1024, 1600, 1, 1024, 1024, 1024, 1024, 1024]
    - [77, 42625.0]
  - - [32, 33, 1600, 33, 32, 32, 32, 33]
    - [1, 2553.0]
  - - [32, 200, 1, 1, 32, 32, 32, 1]
    - [0, 1.0]
  - - [64, 3, 512, 3, 64, 64, 64, 3]
    - [0, 28.0]
  - - [64, 5, 512, 5, 64, 64, 64, 5]
    - [67, 79.0]
  - - [64, 5, 960, 5, 64, 64, 64, 5]
    - [34, 124.0]
  - - [64, 9, 512, 9, 64, 64, 64, 9]
    - [0, 240.0]
  - - [64, 512, 1, 1, 64, 64, 64, 1]
    - [7, 6.0]
  - - [128, 27, 32768, 27, 128, 128, 128, 27]
    - [2, 4772.0]
  - - [256, 1024, 1, 1, 256, 256, 256, 1]
    - [7, 41.0]
  - - [256, 8976, 1, 1536, 256, 256, 256, 1536]
    - [40, 46687.0]
  - - [256, 8976, 1, 2048, 256, 256, 256, 2048]
    - [11, 49641.0]
  - - [256, 8976, 1, 2304, 256, 256, 256, 2304]
    - [11, 50867.0]
  - - [256, 8976, 1, 2560, 256, 256, 256, 2560]
    - [73, 51819.0]
  - - [256, 8976, 1, 2816, 256, 256, 256, 2816]
    - [5, 52625.0]
  - - [256, 8976, 1, 3072, 256, 256, 256, 3072]
    - [11, 53123.0]
  - - [256, 8976, 1, 4352, 256, 256, 256, 4352]
    - [5, 55336.0]
  - - [256, 8976, 1, 4864, 256, 256, 256, 4864]
    - [5, 55928.0]
  - - [256, 8976, 1, 5376, 256, 256, 256, 5376]
    - [93, 56377.0]
  - - [256, 8976, 1, 5632, 256, 256, 256, 5632]
    - [84, 56602.0]
  - - [256, 8976, 1, 5888, 256, 256, 256, 5888]
    - [55, 57116.0]
  - - [256, 8976, 1, 6144, 256, 256, 256, 6144]
    - [84, 56983.0]
  - - [256, 8976, 1, 6656, 256, 256, 256, 6656]
    - [93, 57377.0]
  - - [256, 8976, 1, 7168, 256, 256, 256, 7168]
    - [5, 57672.0]
  - - [256, 8976, 1, 7424, 256, 256, 256, 7424]
    - [5, 57757.0]
  - - [256, 8976, 1, 8192, 256, 256, 256, 8192]
    - [5, 58300.0]
  - - [256, 8976, 1, 8448, 256, 256, 256, 8448]
    - [5, 58232.0]
  - - [256, 8976, 1, 8960, 256, 256, 256, 8960]
    - [93, 58531.0]
  - - [256, 8976, 1, 9472, 256, 256, 256, 9472]
    - [23, 58572.0]
  - - [256, 8976, 1, 9728, 256, 256, 256, 9728]
    - [5, 58751.0]
  - - [256, 8976, 1, 9984, 256, 256, 256, 9984]
    - [5, 58681.0]
  - - [256, 8976, 1, 10240, 256, 256, 256, 10240]
    - [84, 58743.0]
  - - [256, 8976, 1, 10496, 256, 256, 256, 10496]
    - [84, 58733.0]
  - - [256, 8976, 1, 11008, 256, 256, 256, 11008]
    - [5, 58990.0]
  - - [256, 8976, 1, 11520, 256, 256, 256, 11520]
    - [93, 59130.0]
  - - [256, 8976, 1, 12288, 256, 256, 256, 12288]
    - [5, 59180.0]
  - - [256, 8976, 1, 14336, 256, 256, 256, 14336]
    - [84, 59643.0]
  - - [256, 8976, 1, 14848, 256, 256, 256, 14848]
    - [5, 59656.0]
  - - [256, 8976, 1, 15104, 256, 256, 256, 15104]
    - [55, 59617.0]
  - - [256, 8976, 1, 15872, 256, 256, 256, 15872]
    - [84, 59789.0]
  - - [256, 8976, 1, 17152, 256, 256, 256, 17152]
    - [93, 59927.0]
  - - [256, 8976, 1, 19712, 256, 256, 256, 19712]
    - [93, 60195.0]
  - - [256, 8976, 1, 19968, 256, 256, 256, 19968]
    - [55, 60164.0]
  - - [256, 8976, 1, 20480, 256, 256, 256, 20480]
    - [93, 60216.0]
  - - [256, 8976, 1, 20992, 256, 256, 256, 20992]
    - [84, 60253.0]
  - - [256, 8976, 1, 22016, 256, 256, 256, 22016]
    - [55, 60277.0]
  - - [256, 8976, 1, 26112, 256, 256, 256, 26112]
    - [93, 60437.0]
  - - [256, 8976, 1, 33536, 256, 256, 256, 33536]
    - [84, 60777.0]
  - - [256, 8976, 1, 44505, 256, 256, 256, 44505]
    - [55, 60555.0]
  - - [480, 32768, 1, 1024, 480, 480, 480, 1024]
    - [107, 57227.0]
  - - [512, 200, 1, 1, 512, 512, 512, 1]
    - [7, 17.0]
  - - [512, 200, 1, 32, 512, 512, 512, 32]
    - [0, 569.0]
  - - [512, 215, 1, 2048, 512, 512, 512, 2048]
    - [61, 11272.0]
  - - [512, 256, 1, 2048, 512, 512, 512, 2048]
    - [32, 12807.0]
  - - [560, 200, 1, 1024, 560, 560, 560, 1024]
    - [32, 8099.0]
  - - [768, 215, 1, 2048, 768, 768, 768, 2048]
    - [32, 15598.0]
  - - [768, 256, 1, 2048, 768, 768, 768, 2048]
    - [32, 17912.0]
  - - [1024, 1, 1, 200, 1024, 1024, 1024, 200]
    - [7, 23.0]
  - - [1024, 1, 1, 1600, 1024, 1024, 1024, 1600]
    - [131, 126.0]
  - - [1024, 200, 1, 1, 1024, 1024, 1024, 1]
    - [7, 34.0]
  - - [1024, 512, 1, 1, 1024, 1024, 1024, 1]
    - [7, 79.0]
  - - [1024, 960, 1, 64, 1024, 1024, 1024, 64]
    - [74, 8937.0]
  - - [1024, 960, 1, 1024, 1024, 1024, 1024, 1024]
    - [53, 36685.0]
  - - [1024, 1600, 1, 1, 1024, 1024, 1024, 1]
    - [70, 161.0]
  - - [1024, 1792, 1, 256, 1024, 1024, 1024, 256]
    - [98, 31234.0]
  - - [1024, 2048, 1, 256, 1024, 1024, 1024, 256]
    - [51, 26631.0]
  - - [1024, 2560, 1, 256, 1024, 1024, 1024, 256]
    - [86, 31184.0]
  - - [1024, 3072, 1, 256, 1024, 1024, 1024, 256]
    - [102, 33443.0]
  - - [1024, 3328, 1, 256, 1024, 1024, 1024, 256]
    - [51, 34841.0]
  - - [1024, 3840, 1, 256, 1024, 1024, 1024, 256]
    - [71, 38015.0]
  - - [1024, 4096, 1, 256, 1024, 1024, 1024, 256]
    - [78, 36080.0]
  - - [1024, 4608, 1, 256, 1024, 1024, 1024, 256]
    - [59, 39736.0]
  - - [1024, 4864, 1, 256, 1024, 1024, 1024, 256]
    - [51, 37326.0]
  - - [1024, 5120, 1, 256, 1024, 1024, 1024, 256]
    - [51, 38746.0]
  - - [1024, 5632, 1, 256, 1024, 1024, 1024, 256]
    - [95, 41379.0]
  - - [1024, 6144, 1, 256, 1024, 1024, 1024, 256]
    - [51, 41171.0]
  - - [1024, 6400, 1, 256, 1024, 1024, 1024, 256]
    - [90, 42027.0]
  - - [1024, 7168, 1, 256, 1024, 1024, 1024, 256]
    - [112, 45608.0]
  - - [1024, 7424, 1, 256, 1024, 1024, 1024, 256]
    - [112, 47054.0]
  - - [1024, 7680, 1, 256, 1024, 1024, 1024, 256]
    - [118, 47844.0]
  - - [1024, 7936, 1, 256, 1024, 1024, 1024, 256]
    - [51, 43341.0]
  - - [1024, 8192, 1, 256, 1024, 1024, 1024, 256]
    - [51, 43862.0]
  - - [1024, 8448, 1, 256, 1024, 1024, 1024, 256]
    - [71, 46137.0]
  - - [1024, 8704, 1, 256, 1024, 1024, 1024, 256]
    - [51, 43811.0]
  - - [1024, 8960, 1, 256, 1024, 1024, 1024, 256]
    - [26, 43887.0]
  - - [1024, 9728, 1, 256, 1024, 1024, 1024, 256]
    - [51, 45151.0]
  - - [1024, 9984, 1, 256, 1024, 1024, 1024, 256]
    - [71, 47073.0]
  - - [1024, 10240, 1, 256, 1024, 1024, 1024, 256]
    - [26, 45222.0]
  - - [1024, 10496, 1, 256, 1024, 1024, 1024, 256]
    - [108, 46165.0]
  - - [1024, 11008, 1, 256, 1024, 1024, 1024, 256]
    - [108, 48483.0]
  - - [1024, 11264, 1, 256, 1024, 1024, 1024, 256]
    - [112, 49213.0]
  - - [1024, 11520, 1, 256, 1024, 1024, 1024, 256]
    - [112, 50399.0]
  - - [1024, 12288, 1, 256, 1024, 1024, 1024, 256]
    - [49, 48338.0]
  - - [1024, 13312, 1, 256, 1024, 1024, 1024, 256]
    - [51, 47107.0]
  - - [1024, 13568, 1, 256, 1024, 1024, 1024, 256]
    - [51, 47398.0]
  - - [1024, 14336, 1, 256, 1024, 1024, 1024, 256]
    - [112, 48832.0]
  - - [1024, 14592, 1, 256, 1024, 1024, 1024, 256]
    - [112, 49911.0]
  - - [1024, 14848, 1, 256, 1024, 1024, 1024, 256]
    - [108, 51000.0]
  - - [1024, 15104, 1, 256, 1024, 1024, 1024, 256]
    - [108, 51182.0]
  - - [1024, 16128, 1, 256, 1024, 1024, 1024, 256]
    - [49, 49437.0]
  - - [1024, 17152, 1, 256, 1024, 1024, 1024, 256]
    - [87, 49129.0]
  - - [1024, 18944, 1, 256, 1024, 1024, 1024, 256]
    - [112, 52966.0]
  - - [1024, 19712, 1, 256, 1024, 1024, 1024, 256]
    - [87, 49345.0]
  - - [1024, 19968, 1, 256, 1024, 1024, 1024, 256]
    - [39, 51238.0]
  - - [1024, 20480, 1, 256, 1024, 1024, 1024, 256]
    - [26, 49272.0]
  - - [1024, 20992, 1, 256, 1024, 1024, 1024, 256]
    - [49, 50246.0]
  - - [1024, 21504, 1, 256, 1024, 1024, 1024, 256]
    - [39, 51359.0]
  - - [1024, 22016, 1, 256, 1024, 1024, 1024, 256]
    - [112, 52051.0]
  - - [1024, 23552, 1, 256, 1024, 1024, 1024, 256]
    - [49, 50277.0]
  - - [1024, 28672, 1, 256, 1024, 1024, 1024, 256]
    - [112, 51850.0]
  - - [1024, 33536, 1, 256, 1024, 1024, 1024, 256]
    - [112, 54133.0]
  - - [1024, 40448, 1, 256, 1024, 1024, 1024, 256]
    - [112, 53944.0]
  - - [1600, 512, 1, 1024, 1600, 1600, 1600, 1024]
    - [97, 33934.0]
  - - [2048, 1, 1, 512, 2048, 2048, 2048, 512]
    - [81, 108.0]
  - - [2048, 512, 1, 1, 2048, 2048, 2048, 1]
    - [15, 111.0]
  - - [2048, 960, 1, 2048, 2048, 2048, 2048, 2048]
    - [80, 53431.0]
  - - [2048, 1024, 1, 1, 2048, 2048, 2048, 1]
    - [15, 167.0]
  - - [2048, 1024, 1, 256, 2048, 2048, 2048, 256]
    - [71, 26525.0]
  - - [3200, 1024, 1, 2048, 3200, 3200, 3200, 2048]
    - [60, 49932.0]
  - - [4096, 1024, 1, 1, 4096, 4096, 4096, 1]
    - [43, 234.0]
  - - [2048, 1024, 1, 2048, 2048, 2048, 2048, 2048]
    - [36, 48236.0]
  - - [2048, 1024, 1, 30592, 2048, 2048, 2048, 30592]
    - [62, 59167.0]
  - - [2048, 1024, 1, 6144, 2048, 2048, 2048, 6144]
    - [3, 55866.0]
  - - [2048, 1024, 1, 8192, 2048, 2048, 2048, 8192]
    - [36, 56977.0]
  - - [2048, 2, 1, 2, 2048, 2048, 2048, 2]
    - [7, 2.0]
  - - [2048, 2, 1, 2048, 2048, 2048, 2048, 2048]
    - [137, 532.0]
  - - [8192, 1024, 1, 2048, 8192, 8192, 8192, 2048]
    - [87, 58916.0]
  - - [1024, 16, 1, 1024, 1024, 1024, 1024, 1024]
    - [32, 1303.0]
  - - [1024, 16, 1, 2, 1024, 1024, 1024, 2]
    - [45, 6.0]
  - - [1024, 8192, 1, 30592, 1024, 1024, 1024, 30592]
    - [110, 61976.0]
  - - [1024, 8192, 1, 3072, 1024, 1024, 1024, 3072]
    - [71, 60109.0]
  - - [512, 512, 256, 64, 512, 512, 512, 64]
    - [112, 33596.0]
  - - [64, 512, 256, 512, 64, 64, 64, 512]
    - [47, 38430.0]
  - - [1024, 2048, 1, 30592, 1024, 1024, 1024, 30592]
    - [35, 60071.0]
  - - [1024, 2048, 1, 3072, 1024, 1024, 1024, 3072]
    - [101, 51755.0]
  - - [1024, 4096, 1, 30592, 1024, 1024, 1024, 30592]
    - [85, 61499.0]
  - - [1024, 4096, 1, 3072, 1024, 1024, 1024, 3072]
    - [71, 58377.0]
  - - [512, 512, 128, 64, 512, 512, 512, 64]
    - [105, 28989.0]
  - - [2560, 2048, 1, 1920, 2560, 2560, 2560, 1920]
    - [115, 55627.0]
  - - [2560, 2048, 1, 2560, 2560, 2560, 2560, 2560]
    - [104, 56584.0]
  - - [2560, 2048, 1, 7680, 2560, 2560, 2560, 7680]
    - [113, 59102.0]
  - - [2560, 4, 1, 2, 2560, 2560, 2560, 2]
    - [7, 4.0]
  - - [2560, 4, 1, 2560, 2560, 2560, 2560, 2560]
    - [144, 1450.0]
  - - [640, 2048, 1, 2560, 640, 640, 640, 2560]
    - [87, 47935.0]
  - - [512, 512, 40, 64, 512, 512, 512, 64]
    - [17, 21676.0]
  - - [64, 512, 40, 512, 64, 64, 64, 512]
    - [16, 29959.0]
  - - [1536, 4096, 1, 1536, 1536, 1536, 1536, 1536]
    - [113, 55924.0]
  - - [1536, 4096, 1, 4608, 1536, 1536, 1536, 4608]
    - [110, 59829.0]
  - - [1536, 4096, 1, 50304, 1536, 1536, 1536, 50304]
    - [110, 61567.0]
  - - [1536, 4096, 1, 6144, 1536, 1536, 1536, 6144]
    - [101, 60398.0]
  - - [6144, 4096, 1, 1536, 6144, 6144, 6144, 1536]
    - [59, 61147.0]
  - - [1024, 1024, 64, 96, 1024, 1024, 1024, 96]
    - [103, 43530.0]
  - - [96, 1024, 64, 1024, 96, 96, 96, 1024]
    - [104, 51228.0]
  - - [1536, 8192, 1, 1536, 1536, 1536, 1536, 1536]
    - [90, 60413.0]
  - - [1536, 8192, 1, 4608, 1536, 1536, 1536, 4608]
    - [78, 62357.0]
  - - [1536, 8192, 1, 50304, 1536, 1536, 1536, 50304]
    - [22, 63886.0]
  - - [1536, 8192, 1, 6144, 1536, 1536, 1536, 6144]
    - [78, 62556.0]
  - - [6144, 8192, 1, 1536, 6144, 6144, 6144, 1536]
    - [110, 63556.0]
  - - [1024, 1024, 128, 96, 1024, 1024, 1024, 96]
    - [103, 47053.0]
  - - [96, 1024, 128, 1024, 96, 96, 96, 1024]
    - [119, 54065.0]
  - - [1024, 16384, 1, 1024, 1024, 1024, 1024, 1024]
    - [39, 58308.0]
  - - [1024, 16384, 1, 3072, 1024, 1024, 1024, 3072]
    - [10, 60824.0]
  - - [1024, 16384, 1, 4096, 1024, 1024, 1024, 4096]
    - [64, 61326.0]
  - - [1024, 16384, 1, 50304, 1024, 1024, 1024, 50304]
    - [48, 63989.0]
  - - [4096, 16384, 1, 1024, 4096, 4096, 4096, 1024]
    - [114, 62142.0]
  - - [1024, 1024, 256, 64, 1024, 1024, 1024, 64]
    - [106, 38252.0]
  - - [64, 1024, 256, 1024, 64, 64, 64, 1024]
    - [21, 45565.0]
  - - [1024, 2048, 1, 50304, 1024, 1024, 1024, 50304]
    - [110, 60532.0]
  - - [1024, 1024, 32, 64, 1024, 1024, 1024, 64]
    - [101, 29661.0]
  - - [64, 1024, 32, 1024, 64, 64, 64, 1024]
    - [104, 32264.0]
  - - [1024, 4096, 1, 50304, 1024, 1024, 1024, 50304]
    - [94, 61806.0]
  - - [1024, 1024, 64, 64, 1024, 1024, 1024, 64]
    - [106, 33681.0]
  - - [64, 1024, 64, 1024, 64, 64, 64, 1024]
    - [33, 38430.0]
  - - [1024, 8192, 1, 50304, 1024, 1024, 1024, 50304]
    - [38, 61924.0]
  - - [1024, 1024, 128, 64, 1024, 1024, 1024, 64]
    - [108, 36785.0]
  - - [64, 1024, 128, 1024, 64, 64, 64, 1024]
    - [33, 43862.0]
  - - [128, 128, 1024, 64, 128, 128, 128, 64]
    - [44, 21475.0]
  - - [64, 128, 1024, 128, 64, 64, 64, 128]
    - [30, 21648.0]
  - - [1024, 64, 1, 2, 1024, 1024, 1024, 2]
    - [45, 23.0]
  - - [1024, 8192, 1, 30528, 1024, 1024, 1024, 30528]
    - [71, 62011.0]
  - - [1024, 64, 1, 1024, 1024, 1024, 1024, 1024]
    - [52, 5377.0]
  - - [1024, 3456, 1, 1024, 1024, 1024, 1024, 1024]
    - [78, 50054.0]
  - - [1024, 3456, 1, 512, 1024, 1024, 1024, 512]
    - [31, 45572.0]
  - - [1024, 4096, 1, 512, 1024, 1024, 1024, 512]
    - [51, 45115.0]
  - - [1024, 6912, 1, 1024, 1024, 1024, 1024, 1024]
    - [71, 57816.0]
  - - [1024, 6912, 1, 512, 1024, 1024, 1024, 512]
    - [71, 52611.0]
  - - [1024, 864, 1, 1024, 1024, 1024, 1024, 1024]
    - [21, 33505.0]
  - - [1024, 864, 1, 512, 1024, 1024, 1024, 512]
    - [97, 27092.0]
  - - [256, 3456, 1, 128, 256, 256, 256, 128]
    - [8, 13743.0]
  - - [256, 4096, 1, 128, 256, 256, 256, 128]
    - [14, 12520.0]
  - - [256, 55296, 1, 128, 256, 256, 256, 128]
    - [10, 37069.0]
  - - [256, 6912, 1, 128, 256, 256, 256, 128]
    - [43, 19938.0]
  - - [256, 864, 1, 128, 256, 256, 256, 128]
    - [32, 4369.0]
  - - [480, 3456, 1, 1024, 480, 480, 480, 1024]
    - [44, 44145.0]
  - - [480, 4096, 1, 1024, 480, 480, 480, 1024]
    - [9, 44384.0]
  - - [480, 6912, 1, 1024, 480, 480, 480, 1024]
    - [102, 52886.0]
  - - [480, 864, 1, 1024, 480, 480, 480, 1024]
    - [12, 22980.0]
  - - [512, 3456, 1, 256, 512, 512, 512, 256]
    - [78, 31811.0]
  - - [512, 4096, 1, 256, 512, 512, 512, 256]
    - [44, 26214.0]
  - - [512, 55296, 1, 256, 512, 512, 512, 256]
    - [101, 53198.0]
  - - [512, 6912, 1, 256, 512, 512, 512, 256]
    - [16, 36768.0]
  - - [512, 864, 1, 256, 512, 512, 512, 256]
    - [20, 12203.0]
  - - [1024, 640, 1, 30528, 1024, 1024, 1024, 30528]
    - [123, 54759.0]
  - - [1024, 1280, 1, 30528, 1024, 1024, 1024, 30528]
    - [71, 57352.0]
  - - [1024, 1600, 1, 30528, 1024, 1024, 1024, 30528]
    - [120, 55862.0]
  - - [1024, 10240, 1, 1024, 1024, 1024, 1024, 1024]
    - [16, 57089.0]
  - - [1024, 10240, 1, 4096, 1024, 1024, 1024, 4096]
    - [110, 60547.0]
  - - [4096, 10240, 1, 1024, 4096, 4096, 4096, 1024]
    - [108, 61901.0]
  - - [1024, 80, 1, 1024, 1024, 1024, 1024, 1024]
    - [91, 6433.0]
  - - [1024, 80, 1, 2, 1024, 1024, 1024, 2]
    - [13, 28.0]
  - - [128, 128, 1280, 64, 128, 128, 128, 64]
    - [44, 22075.0]
  - - [64, 128, 1280, 128, 64, 64, 64, 128]
    - [42, 22134.0]
  - - [1024, 1640, 1, 30528, 1024, 1024, 1024, 30528]
    - [18, 55393.0]
  - - [1024, 10496, 1, 1024, 1024, 1024, 1024, 1024]
    - [110, 57179.0]
  - - [1024, 10496, 1, 4096, 1024, 1024, 1024, 4096]
    - [110, 61998.0]
  - - [4096, 10496, 1, 1024, 4096, 4096, 4096, 1024]
    - [108, 63121.0]
  - - [1024, 82, 1, 1024, 1024, 1024, 1024, 1024]
    - [32, 6514.0]
  - - [1024, 82, 1, 2, 1024, 1024, 1024, 2]
    - [7, 27.0]
  - - [128, 128, 1312, 64, 128, 128, 128, 64]
    - [17, 22362.0]
  - - [64, 128, 1312, 128, 64, 64, 64, 128]
    - [30, 22304.0]
  - - [1024, 160, 1, 30528, 1024, 1024, 1024, 30528]
    - [128, 40336.0]
  - - [1024, 240, 1, 30528, 1024, 1024, 1024, 30528]
    - [135, 44153.0]
  - - [1024, 6144, 1, 4096, 1024, 1024, 1024, 4096]
    - [110, 59597.0]
  - - [1024, 12, 1, 1024, 1024, 1024, 1024, 1024]
    - [131, 1008.0]
  - - [4096, 6144, 1, 1024, 4096, 4096, 4096, 1024]
    - [87, 59785.0]
  - - [1024, 6144, 1, 1024, 1024, 1024, 1024, 1024]
    - [90, 53544.0]
  - - [1024, 12, 1, 2, 1024, 1024, 1024, 2]
    - [0, 4.0]
  - - [512, 512, 192, 64, 512, 512, 512, 64]
    - [108, 31906.0]
  - - [64, 512, 192, 512, 64, 64, 64, 512]
    - [4, 36839.0]
  - - [256, 4096, 1, 1, 256, 256, 256, 1]
    - [41, 114.0]
  - - [256, 6912, 1, 1, 256, 256, 256, 1]
    - [16, 174.0]
  - - [479, 32768, 1, 1024, 479, 479, 479, 1024]
    - [138, 54182.0]
  - - [74, 512, 1, 2048, 74, 74, 74, 2048]
    - [141, 4619.0]
  - - [67, 512, 1, 2048, 67, 67, 67, 2048]
    - [143, 4305.0]
  - - [74, 960, 1, 2048, 74, 74, 74, 2048]
    - [142, 7423.0]
  - - [100, 512, 1, 2048, 100, 100, 100, 2048]
    - [139, 5699.0]
  - - [257, 1024, 1, 4096, 257, 257, 257, 4096]
    - [140, 20761.0]
- null
