TRAIN_3.9/logic/gemm/arcturus_Cijk_Alik_Bljk_BBH.yaml
- {MinimumRequiredVersion: 4.22.0}
- arcturus
- gfx908
- [Device 7380, Device 7388, Device 738c, Device 7390]
    SolutionIndex: 0
    SolutionNameMin: Cijk_Alik_Bljk_BBH_MT144x128x32_MI16x16x8x1_SE_1LDSB0_AF0EM8_GRVW2_GSU1_LBSPP128_LPA4_LPB4_PLR5_SU0_SUS256_SRVW0_TT9_32_WG16_16_1_WGM1
    SolutionIndex: 1
    SolutionNameMin: Cijk_Alik_Bljk_BBH_MT32x32x32_MI16x16x8x1_SE_1LDSB0_AF0EM8_GRVW4_GSU1_LBSPP128_LPA4_LPB4_PLR5_SU0_SUS256_SRVW4_TT1_16_WG32_8_1_WGM1
    SolutionIndex: 2
    SolutionNameMin: Cijk_Alik_Bljk_BBH_MT32x32x64_MI16x16x8x1_SE_1LDSB0_AF0EM8_GRVW8_GSU1_LBSPP128_LPA8_LPB8_PLR9_SU0_SUS256_SRVW4_TT1_16_WG32_8_1_WGM1
    SolutionIndex: 3
    SolutionNameMin: Cijk_Alik_Bljk_BBH_MT32x32x64_MI16x16x8x1_SE_1LDSB0_AF0EM8_GRVW8_GSU1_LBSPP128_LPA8_LPB8_PLR9_SU32_SUS128_SRVW4_TT1_16_WG32_8_1_WGM1
    SolutionIndex: 4
    SolutionNameMin: Cijk_Alik_Bljk_BBH_MT32x32x64_MI16x16x8x1_SE_1LDSB0_AF0EM8_GRVW8_GSU1_LBSPP128_LPA8_LPB8_PLR9_SU0_SUS256_SRVW4_TT1_16_WG32_8_1_WGM2
    SolutionIndex: 5
    SolutionNameMin: Cijk_Alik_Bljk_BBH_MT32x32x64_MI16x16x8x1_SE_1LDSB0_AF0EM8_GRVW8_GSU1_LBSPP128_LPA8_LPB8_PLR9_SU32_SUS128_SRVW4_TT1_16_WG32_8_1_WGM2
    SolutionIndex: 6
    SolutionNameMin: Cijk_Alik_Bljk_BBH_MT64x32x64_MI16x16x8x1_SE_1LDSB0_AF0EM8_GRVW8_GSU1_LBSPP128_LPA8_LPB8_PLR9_SU32_SUS128_SRVW4_TT2_16_WG32_8_1_WGM2
    SolutionIndex: 7
    SolutionNameMin: Cijk_Alik_Bljk_BBH_MT64x32x64_MI16x16x8x1_SE_1LDSB0_AF0EM8_GRVW2_GSU1_LBSPP128_LPA4_LPB4_PLR9_SU0_SUS256_SRVW4_TT2_16_WG32_8_1_WGM15
    SolutionIndex: 8
    SolutionNameMin: Cijk_Alik_Bljk_BBH_MT64x32x32_MI16x16x8x1_SE_1LDSB0_AF0EM8_GRVW4_GSU1_LBSPP128_LPA4_LPB4_PLR5_SU0_SUS256_SRVW4_TT2_16_WG32_8_1_WGM15
    SolutionIndex: 9
    SolutionNameMin: Cijk_Alik_Bljk_BBH_MT64x64x32_MI32x32x4x1_SE_1LDSB0_AF0EM8_GRVW8_GSU1_LBSPP128_LPA8_LPB8_PLR9_SU0_SUS256_SRVW4_TT1_32_WG64_4_1_WGM15
    SolutionIndex: 10
    SolutionNameMin: Cijk_Alik_Bljk_BBH_MT128x64x32_MI32x32x4x1_SE_1LDSB0_AF0EM8_GRVW8_GSU1_LBSPP128_LPA8_LPB8_PLR9_SU0_SUS256_SRVW4_TT2_32_WG64_4_1_WGM15
    SolutionIndex: 11
    SolutionNameMin: Cijk_Alik_Bljk_BBH_MT32x32x64_MI16x16x8x1_SE_1LDSB0_AF0EM8_GRVW8_GSU1_LBSPP128_LPA8_LPB8_PLR9_SU0_SUS256_SRVW4_TT1_16_WG32_8_1_WGM15
    SolutionIndex: 12
    SolutionNameMin: Cijk_Alik_Bljk_BBH_MT64x128x64_MI32x32x4x1_SE_1LDSB0_AF0EM8_GRVW8_GSU1_LBSPP128_LPA8_LPB8_PLR17_SU0_SUS256_SRVW4_TT1_64_WG64_4_1_WGM15
    SolutionIndex: 13
    SolutionNameMin: Cijk_Alik_Bljk_BBH_MT64x128x32_MI32x32x4x1_SE_1LDSB0_AF0EM8_GRVW8_GSU1_LBSPP128_LPA8_LPB8_PLR9_SU32_SUS128_SRVW4_TT1_64_WG64_4_1_WGM15
    SolutionIndex: 14
    SolutionNameMin: Cijk_Alik_Bljk_BBH_MT32x32x64_MI16x16x8x1_SE_1LDSB0_AF0EM8_GRVW8_GSU1_LBSPP128_LPA8_LPB8_PLR9_SU32_SUS128_SRVW4_TT1_16_WG32_8_1_WGM15
    SolutionIndex: 15
    SolutionNameMin: Cijk_Alik_Bljk_BBH_MT64x32x64_MI16x16x8x1_SE_1LDSB0_AF0EM8_GRVW8_GSU1_LBSPP128_LPA8_LPB8_PLR9_SU32_SUS128_SRVW4_TT2_16_WG32_8_1_WGM15
    SolutionIndex: 16
    SolutionNameMin: Cijk_Alik_Bljk_BBH_MT64x64x32_MI32x32x4x1_SE_1LDSB0_AF0EM8_GRVW8_GSU1_LBSPP128_LPA8_LPB8_PLR9_SU32_SUS256_SRVW4_TT1_32_WG64_4_1_WGM15
    SolutionIndex: 17
    SolutionNameMin: Cijk_Alik_Bljk_BBH_MT96x96x32_MI16x16x8x1_SE_1LDSB1_AF0EM8_GRVW2_GSU1_LBSPP128_LPA4_LPB4_PLR5_SU0_SUS256_SRVW0_TT3_48_WG32_8_1_WGM1
    SolutionIndex: 18
    SolutionNameMin: Cijk_Alik_Bljk_BBH_MT144x128x32_MI16x16x8x1_SE_1LDSB1_AF0EM8_GRVW2_GSU1_LBSPP128_LPA4_LPB4_PLR5_SU0_SUS256_SRVW0_TT9_32_WG16_16_1_WGM1
    SolutionIndex: 19
    SolutionNameMin: Cijk_Alik_Bljk_BBH_MT64x64x32_MI32x32x4x1_SE_1LDSB1_AF0EM8_GRVW2_GSU1_LBSPP128_LPA4_LPB4_PLR9_SU0_SUS256_SRVW4_TT1_32_WG64_4_1_WGM1
    SolutionIndex: 20
    SolutionNameMin: Cijk_Alik_Bljk_BBH_MT128x128x32_MI32x32x4x1_SE_1LDSB1_AF0EM8_GRVW2_GSU1_LBSPP128_LPA4_LPB4_PLR9_SU0_SUS256_SRVW4_TT2_64_WG64_4_1_WGM1
    SolutionIndex: 21
    SolutionNameMin: Cijk_Alik_Bljk_BBH_MT128x256x32_MI32x32x4x1_SE_1LDSB1_AF0EM8_GRVW2_GSU1_LBSPP128_LPA4_LPB4_PLR9_SU0_SUS256_SRVW4_TT2_128_WG64_4_1_WGM1
    SolutionIndex: 22
    SolutionNameMin: Cijk_Alik_Bljk_BBH_MT128x96x32_MI32x32x4x1_SE_1LDSB1_AF0EM8_GRVW2_GSU1_LBSPP128_LPA4_LPB4_PLR9_SU0_SUS256_SRVW4_TT1_96_WG128_2_1_WGM1
    SolutionIndex: 23
    SolutionNameMin: Cijk_Alik_Bljk_BBH_MT96x96x64_MI16x16x8x1_SE_1LDSB1_AF0EM8_GRVW2_GSU1_LBSPP128_LPA4_LPB4_PLR9_SU0_SUS256_SRVW0_TT3_48_WG32_8_1_WGM1
    SolutionIndex: 24
    SolutionNameMin: Cijk_Alik_Bljk_BBH_MT128x96x64_MI32x32x4x1_SE_1LDSB1_AF0EM8_GRVW2_GSU1_LBSPP128_LPA4_LPB4_PLR17_SU0_SUS256_SRVW4_TT1_96_WG128_2_1_WGM1
    SolutionIndex: 25
    SolutionNameMin: Cijk_Alik_Bljk_BBH_MT96x128x64_MI32x32x4x1_SE_1LDSB1_AF0EM8_GRVW2_GSU1_LBSPP128_LPA4_LPB4_PLR17_SU0_SUS256_SRVW0_TT3_32_WG32_8_1_WGM1
    SolutionIndex: 26
    SolutionNameMin: Cijk_Alik_Bljk_BBH_MT64x64x32_MI32x32x4x1_SE_1LDSB1_AF0EM8_GRVW4_GSU1_LBSPP128_LPA4_LPB4_PLR9_SU0_SUS256_SRVW4_TT1_32_WG64_4_1_WGM1
    SolutionIndex: 27
    SolutionNameMin: Cijk_Alik_Bljk_BBH_MT64x128x32_MI32x32x4x1_SE_1LDSB1_AF0EM8_GRVW4_GSU1_LBSPP128_LPA4_LPB4_PLR9_SU0_SUS256_SRVW4_TT1_64_WG64_4_1_WGM1
    SolutionIndex: 28
    SolutionNameMin: Cijk_Alik_Bljk_BBH_MT32x32x64_MI16x16x8x1_SE_1LDSB1_AF0EM8_GRVW4_GSU1_LBSPP128_LPA4_LPB4_PLR9_SU0_SUS256_SRVW4_TT1_16_WG32_8_1_WGM1
    SolutionIndex: 29
    SolutionNameMin: Cijk_Alik_Bljk_BBH_MT64x64x64_MI32x32x4x1_SE_1LDSB1_AF0EM8_GRVW4_GSU1_LBSPP128_LPA4_LPB4_PLR17_SU0_SUS256_SRVW4_TT1_32_WG64_4_1_WGM1
    SolutionIndex: 30
    SolutionNameMin: Cijk_Alik_Bljk_BBH_MT64x64x32_MI32x32x4x1_SE_1LDSB1_AF0EM8_GRVW8_GSU1_LBSPP128_LPA8_LPB8_PLR9_SU0_SUS256_SRVW4_TT1_32_WG64_4_1_WGM1
    SolutionIndex: 31
    SolutionNameMin: Cijk_Alik_Bljk_BBH_MT64x128x32_MI32x32x4x1_SE_1LDSB1_AF0EM8_GRVW8_GSU1_LBSPP128_LPA8_LPB8_PLR9_SU0_SUS256_SRVW4_TT1_64_WG64_4_1_WGM1
    SolutionIndex: 32
    SolutionNameMin: Cijk_Alik_Bljk_BBH_MT128x64x32_MI32x32x4x1_SE_1LDSB1_AF0EM8_GRVW8_GSU1_LBSPP128_LPA8_LPB8_PLR9_SU0_SUS256_SRVW4_TT2_32_WG64_4_1_WGM1
    SolutionIndex: 33
    SolutionNameMin: Cijk_Alik_Bljk_BBH_MT128x128x32_MI32x32x4x1_SE_1LDSB1_AF0EM8_GRVW8_GSU1_LBSPP128_LPA8_LPB8_PLR9_SU0_SUS256_SRVW4_TT2_64_WG64_4_1_WGM1
    SolutionIndex: 34
    SolutionNameMin: Cijk_Alik_Bljk_BBH_MT64x64x64_MI32x32x4x1_SE_1LDSB1_AF0EM8_GRVW8_GSU1_LBSPP128_LPA8_LPB8_PLR17_SU0_SUS256_SRVW4_TT1_32_WG64_4_1_WGM1
    SolutionIndex: 35
    SolutionNameMin: Cijk_Alik_Bljk_BBH_MT64x128x64_MI32x32x4x1_SE_1LDSB1_AF0EM8_GRVW8_GSU1_LBSPP128_LPA8_LPB8_PLR17_SU0_SUS256_SRVW4_TT1_64_WG64_4_1_WGM1
    SolutionIndex: 36
    SolutionNameMin: Cijk_Alik_Bljk_BBH_MT128x64x64_MI32x32x4x1_SE_1LDSB1_AF0EM8_GRVW8_GSU1_LBSPP128_LPA8_LPB8_PLR17_SU0_SUS256_SRVW4_TT2_32_WG64_4_1_WGM1
    SolutionIndex: 37
    SolutionNameMin: Cijk_Alik_Bljk_BBH_MT96x128x64_MI32x32x4x1_SE_1LDSB1_AF0EM8_GRVW8_GSU1_LBSPP128_LPA8_LPB8_PLR17_SU0_SUS256_SRVW0_TT3_32_WG32_8_1_WGM1
    SolutionIndex: 38
    SolutionNameMin: Cijk_Alik_Bljk_BBH_MT64x128x32_MI32x32x4x1_SE_1LDSB1_AF0EM8_GRVW2_GSU1_LBSPP128_LPA4_LPB4_PLR9_SU32_SUS128_SRVW4_TT1_64_WG64_4_1_WGM1
    SolutionIndex: 39
    SolutionNameMin: Cijk_Alik_Bljk_BBH_MT128x96x32_MI32x32x4x1_SE_1LDSB1_AF0EM8_GRVW4_GSU1_LBSPP128_LPA4_LPB4_PLR9_SU32_SUS128_SRVW4_TT1_96_WG128_2_1_WGM1
    SolutionIndex: 40
    SolutionNameMin: Cijk_Alik_Bljk_BBH_MT32x64x32_MI16x16x8x1_SE_1LDSB1_AF0EM8_GRVW8_GSU1_LBSPP128_LPA8_LPB8_PLR5_SU32_SUS128_SRVW4_TT1_32_WG32_8_1_WGM1
    SolutionIndex: 41
    SolutionNameMin: Cijk_Alik_Bljk_BBH_MT64x64x32_MI32x32x4x1_SE_1LDSB1_AF0EM8_GRVW8_GSU1_LBSPP128_LPA8_LPB8_PLR9_SU32_SUS128_SRVW4_TT1_32_WG64_4_1_WGM1
    SolutionIndex: 42
    SolutionNameMin: Cijk_Alik_Bljk_BBH_MT64x128x32_MI32x32x4x1_SE_1LDSB1_AF0EM8_GRVW8_GSU1_LBSPP128_LPA8_LPB8_PLR9_SU32_SUS128_SRVW4_TT1_64_WG64_4_1_WGM1
    SolutionIndex: 43
    SolutionNameMin: Cijk_Alik_Bljk_BBH_MT128x128x32_MI32x32x4x1_SE_1LDSB1_AF0EM8_GRVW8_GSU1_LBSPP128_LPA8_LPB8_PLR9_SU32_SUS128_SRVW4_TT2_64_WG64_4_1_WGM1
    SolutionIndex: 44
    SolutionNameMin: Cijk_Alik_Bljk_BBH_MT64x128x64_MI32x32x4x1_SE_1LDSB1_AF0EM8_GRVW8_GSU1_LBSPP128_LPA8_LPB8_PLR17_SU32_SUS128_SRVW4_TT1_64_WG64_4_1_WGM1
    SolutionIndex: 45
    SolutionNameMin: Cijk_Alik_Bljk_BBH_MT128x96x64_MI32x32x4x1_SE_1LDSB1_AF0EM8_GRVW8_GSU1_LBSPP128_LPA8_LPB8_PLR17_SU32_SUS128_SRVW4_TT1_96_WG128_2_1_WGM1
    SolutionIndex: 46
    SolutionNameMin: Cijk_Alik_Bljk_BBH_MT96x96x64_MI16x16x8x1_SE_1LDSB1_AF0EM8_GRVW2_GSU1_LBSPP128_LPA4_LPB4_PLR9_SU32_SUS256_SRVW0_TT3_48_WG32_8_1_WGM1
    SolutionIndex: 47
    SolutionNameMin: Cijk_Alik_Bljk_BBH_MT64x128x32_MI32x32x4x1_SE_1LDSB1_AF0EM8_GRVW8_GSU1_LBSPP128_LPA8_LPB8_PLR9_SU32_SUS256_SRVW4_TT1_64_WG64_4_1_WGM1
    SolutionIndex: 48
    SolutionNameMin: Cijk_Alik_Bljk_BBH_MT128x128x32_MI32x32x4x1_SE_1LDSB1_AF0EM8_GRVW8_GSU1_LBSPP128_LPA8_LPB8_PLR9_SU32_SUS256_SRVW4_TT2_64_WG64_4_1_WGM1
    SolutionIndex: 49
    SolutionNameMin: Cijk_Alik_Bljk_BBH_MT32x32x64_MI16x16x8x1_SE_1LDSB1_AF0EM8_GRVW8_GSU1_LBSPP128_LPA8_LPB8_PLR9_SU32_SUS256_SRVW4_TT1_16_WG32_8_1_WGM1
    SolutionIndex: 50
    SolutionNameMin: Cijk_Alik_Bljk_BBH_MT64x128x64_MI32x32x4x1_SE_1LDSB1_AF0EM8_GRVW8_GSU1_LBSPP128_LPA8_LPB8_PLR17_SU32_SUS256_SRVW4_TT1_64_WG64_4_1_WGM1
    SolutionIndex: 51
    SolutionNameMin: Cijk_Alik_Bljk_BBH_MT128x96x64_MI32x32x4x1_SE_1LDSB1_AF0EM8_GRVW8_GSU1_LBSPP128_LPA8_LPB8_PLR17_SU32_SUS256_SRVW4_TT1_96_WG128_2_1_WGM1
    SolutionIndex: 52
    SolutionNameMin: Cijk_Alik_Bljk_BBH_MT96x96x32_MI16x16x8x1_SE_1LDSB1_AF0EM8_GRVW2_GSU1_LBSPP128_LPA4_LPB4_PLR5_SU0_SUS256_SRVW0_TT3_48_WG32_8_1_WGM2
    SolutionIndex: 53
    SolutionNameMin: Cijk_Alik_Bljk_BBH_MT128x144x32_MI16x16x8x1_SE_1LDSB1_AF0EM8_GRVW2_GSU1_LBSPP128_LPA4_LPB4_PLR5_SU0_SUS256_SRVW4_TT2_144_WG64_4_1_WGM2
    SolutionIndex: 54
    SolutionNameMin: Cijk_Alik_Bljk_BBH_MT128x96x64_MI32x32x4x1_SE_1LDSB1_AF0EM8_GRVW2_GSU1_LBSPP128_LPA4_LPB4_PLR17_SU0_SUS256_SRVW4_TT1_96_WG128_2_1_WGM2
    SolutionIndex: 55
    SolutionNameMin: Cijk_Alik_Bljk_BBH_MT32x64x32_MI16x16x8x1_SE_1LDSB1_AF0EM8_GRVW4_GSU1_LBSPP128_LPA4_LPB4_PLR5_SU0_SUS256_SRVW4_TT1_32_WG32_8_1_WGM2
    SolutionIndex: 56
    SolutionNameMin: Cijk_Alik_Bljk_BBH_MT64x128x32_MI32x32x4x1_SE_1LDSB1_AF0EM8_GRVW4_GSU1_LBSPP128_LPA4_LPB4_PLR9_SU0_SUS256_SRVW4_TT1_64_WG64_4_1_WGM2
    SolutionIndex: 57
    SolutionNameMin: Cijk_Alik_Bljk_BBH_MT128x96x32_MI32x32x4x1_SE_1LDSB1_AF0EM8_GRVW4_GSU1_LBSPP128_LPA4_LPB4_PLR9_SU0_SUS256_SRVW4_TT1_96_WG128_2_1_WGM2
    SolutionIndex: 58
    SolutionNameMin: Cijk_Alik_Bljk_BBH_MT32x32x64_MI16x16x8x1_SE_1LDSB1_AF0EM8_GRVW4_GSU1_LBSPP128_LPA4_LPB4_PLR9_SU0_SUS256_SRVW4_TT1_16_WG32_8_1_WGM2
    SolutionIndex: 59
    SolutionNameMin: Cijk_Alik_Bljk_BBH_MT128x96x64_MI32x32x4x1_SE_1LDSB1_AF0EM8_GRVW4_GSU1_LBSPP128_LPA4_LPB4_PLR17_SU0_SUS256_SRVW4_TT1_96_WG128_2_1_WGM2
    SolutionIndex: 60
    SolutionNameMin: Cijk_Alik_Bljk_BBH_MT64x64x32_MI32x32x4x1_SE_1LDSB1_AF0EM8_GRVW8_GSU1_LBSPP128_LPA8_LPB8_PLR9_SU0_SUS256_SRVW4_TT1_32_WG64_4_1_WGM2
    SolutionIndex: 61
    SolutionNameMin: Cijk_Alik_Bljk_BBH_MT64x128x32_MI32x32x4x1_SE_1LDSB1_AF0EM8_GRVW8_GSU1_LBSPP128_LPA8_LPB8_PLR9_SU0_SUS256_SRVW4_TT1_64_WG64_4_1_WGM2
    SolutionIndex: 62
    SolutionNameMin: Cijk_Alik_Bljk_BBH_MT128x128x32_MI32x32x4x1_SE_1LDSB1_AF0EM8_GRVW8_GSU1_LBSPP128_LPA8_LPB8_PLR9_SU0_SUS256_SRVW4_TT2_64_WG64_4_1_WGM2
    SolutionIndex: 63
    SolutionNameMin: Cijk_Alik_Bljk_BBH_MT32x32x64_MI16x16x8x1_SE_1LDSB1_AF0EM8_GRVW8_GSU1_LBSPP128_LPA8_LPB8_PLR9_SU0_SUS256_SRVW4_TT1_16_WG32_8_1_WGM2
    SolutionIndex: 64
    SolutionNameMin: Cijk_Alik_Bljk_BBH_MT64x64x64_MI32x32x4x1_SE_1LDSB1_AF0EM8_GRVW8_GSU1_LBSPP128_LPA8_LPB8_PLR17_SU0_SUS256_SRVW4_TT1_32_WG64_4_1_WGM2
    SolutionIndex: 65
    SolutionNameMin: Cijk_Alik_Bljk_BBH_MT128x64x64_MI32x32x4x1_SE_1LDSB1_AF0EM8_GRVW8_GSU1_LBSPP128_LPA8_LPB8_PLR17_SU0_SUS256_SRVW4_TT2_32_WG64_4_1_WGM2
    SolutionIndex: 66
    SolutionNameMin: Cijk_Alik_Bljk_BBH_MT128x160x32_MI32x32x4x1_SE_1LDSB1_AF0EM8_GRVW2_GSU1_LBSPP128_LPA4_LPB4_PLR9_SU32_SUS128_SRVW4_TT1_160_WG128_2_1_WGM2
    SolutionIndex: 67
    SolutionNameMin: Cijk_Alik_Bljk_BBH_MT128x96x32_MI32x32x4x1_SE_1LDSB1_AF0EM8_GRVW4_GSU1_LBSPP128_LPA4_LPB4_PLR9_SU32_SUS128_SRVW4_TT1_96_WG128_2_1_WGM2
    SolutionIndex: 68
    SolutionNameMin: Cijk_Alik_Bljk_BBH_MT32x32x64_MI16x16x8x1_SE_1LDSB1_AF0EM8_GRVW8_GSU1_LBSPP128_LPA8_LPB8_PLR9_SU32_SUS128_SRVW4_TT1_16_WG32_8_1_WGM2
    SolutionIndex: 69
    SolutionNameMin: Cijk_Alik_Bljk_BBH_MT64x64x64_MI32x32x4x1_SE_1LDSB1_AF0EM8_GRVW8_GSU1_LBSPP128_LPA8_LPB8_PLR17_SU32_SUS128_SRVW4_TT1_32_WG64_4_1_WGM2
    SolutionIndex: 70
    SolutionNameMin: Cijk_Alik_Bljk_BBH_MT128x96x32_MI32x32x4x1_SE_1LDSB1_AF0EM8_GRVW2_GSU1_LBSPP128_LPA4_LPB4_PLR9_SU32_SUS256_SRVW4_TT1_96_WG128_2_1_WGM2
    SolutionIndex: 71
    SolutionNameMin: Cijk_Alik_Bljk_BBH_MT128x96x64_MI32x32x4x1_SE_1LDSB1_AF0EM8_GRVW2_GSU1_LBSPP128_LPA4_LPB4_PLR17_SU32_SUS256_SRVW4_TT1_96_WG128_2_1_WGM2
    SolutionIndex: 72
    SolutionNameMin: Cijk_Alik_Bljk_BBH_MT64x64x64_MI32x32x4x1_SE_1LDSB1_AF0EM8_GRVW4_GSU1_LBSPP128_LPA4_LPB4_PLR17_SU32_SUS256_SRVW4_TT1_32_WG64_4_1_WGM2
    SolutionIndex: 73
    SolutionNameMin: Cijk_Alik_Bljk_BBH_MT64x128x32_MI32x32x4x1_SE_1LDSB1_AF0EM8_GRVW8_GSU1_LBSPP128_LPA8_LPB8_PLR9_SU32_SUS256_SRVW4_TT1_64_WG64_4_1_WGM2
    SolutionIndex: 74
    SolutionNameMin: Cijk_Alik_Bljk_BBH_MT64x64x64_MI32x32x4x1_SE_1LDSB1_AF0EM8_GRVW8_GSU1_LBSPP128_LPA8_LPB8_PLR17_SU32_SUS256_SRVW4_TT1_32_WG64_4_1_WGM2
    SolutionIndex: 75
    SolutionNameMin: Cijk_Alik_Bljk_BBH_MT128x64x64_MI32x32x4x1_SE_1LDSB1_AF0EM8_GRVW8_GSU1_LBSPP128_LPA8_LPB8_PLR17_SU32_SUS256_SRVW4_TT2_32_WG64_4_1_WGM2
    SolutionIndex: 76
    SolutionNameMin: Cijk_Alik_Bljk_BBH_MT32x64x32_MI16x16x8x1_SE_1LDSB1_AF0EM8_GRVW2_GSU1_LBSPP128_LPA4_LPB4_PLR5_SU0_SUS256_SRVW4_TT1_32_WG32_8_1_WGM15
    SolutionIndex: 77
    SolutionNameMin: Cijk_Alik_Bljk_BBH_MT96x96x32_MI16x16x8x1_SE_1LDSB1_AF0EM8_GRVW2_GSU1_LBSPP128_LPA4_LPB4_PLR5_SU0_SUS256_SRVW0_TT3_48_WG32_8_1_WGM15
    SolutionIndex: 78
    SolutionNameMin: Cijk_Alik_Bljk_BBH_MT128x144x32_MI16x16x8x1_SE_1LDSB1_AF0EM8_GRVW2_GSU1_LBSPP128_LPA4_LPB4_PLR5_SU0_SUS256_SRVW4_TT2_144_WG64_4_1_WGM15
    SolutionIndex: 79
    SolutionNameMin: Cijk_Alik_Bljk_BBH_MT64x64x32_MI32x32x4x1_SE_1LDSB1_AF0EM8_GRVW2_GSU1_LBSPP128_LPA4_LPB4_PLR9_SU0_SUS256_SRVW4_TT1_32_WG64_4_1_WGM15
    SolutionIndex: 80
    SolutionNameMin: Cijk_Alik_Bljk_BBH_MT64x128x32_MI32x32x4x1_SE_1LDSB1_AF0EM8_GRVW2_GSU1_LBSPP128_LPA4_LPB4_PLR9_SU0_SUS256_SRVW4_TT1_64_WG64_4_1_WGM15
    SolutionIndex: 81
    SolutionNameMin: Cijk_Alik_Bljk_BBH_MT128x128x32_MI32x32x4x1_SE_1LDSB1_AF0EM8_GRVW2_GSU1_LBSPP128_LPA4_LPB4_PLR9_SU0_SUS256_SRVW4_TT2_64_WG64_4_1_WGM15
    SolutionIndex: 82
    SolutionNameMin: Cijk_Alik_Bljk_BBH_MT128x256x32_MI32x32x4x1_SE_1LDSB1_AF0EM8_GRVW2_GSU1_LBSPP128_LPA4_LPB4_PLR9_SU0_SUS256_SRVW4_TT2_128_WG64_4_1_WGM15
    SolutionIndex: 83
    SolutionNameMin: Cijk_Alik_Bljk_BBH_MT128x96x32_MI32x32x4x1_SE_1LDSB1_AF0EM8_GRVW2_GSU1_LBSPP128_LPA4_LPB4_PLR9_SU0_SUS256_SRVW4_TT1_96_WG128_2_1_WGM15
    SolutionIndex: 84
    SolutionNameMin: Cijk_Alik_Bljk_BBH_MT128x160x32_MI32x32x4x1_SE_1LDSB1_AF0EM8_GRVW2_GSU1_LBSPP128_LPA4_LPB4_PLR9_SU0_SUS256_SRVW4_TT1_160_WG128_2_1_WGM15
    SolutionIndex: 85
    SolutionNameMin: Cijk_Alik_Bljk_BBH_MT96x96x64_MI16x16x8x1_SE_1LDSB1_AF0EM8_GRVW2_GSU1_LBSPP128_LPA4_LPB4_PLR9_SU0_SUS256_SRVW0_TT3_48_WG32_8_1_WGM15
    SolutionIndex: 86
    SolutionNameMin: Cijk_Alik_Bljk_BBH_MT128x96x64_MI32x32x4x1_SE_1LDSB1_AF0EM8_GRVW2_GSU1_LBSPP128_LPA4_LPB4_PLR17_SU0_SUS256_SRVW4_TT1_96_WG128_2_1_WGM15
    SolutionIndex: 87
    SolutionNameMin: Cijk_Alik_Bljk_BBH_MT128x64x32_MI32x32x4x1_SE_1LDSB1_AF0EM8_GRVW4_GSU1_LBSPP128_LPA4_LPB4_PLR9_SU0_SUS256_SRVW4_TT2_32_WG64_4_1_WGM15
    SolutionIndex: 88
    SolutionNameMin: Cijk_Alik_Bljk_BBH_MT128x128x32_MI32x32x4x1_SE_1LDSB1_AF0EM8_GRVW4_GSU1_LBSPP128_LPA4_LPB4_PLR9_SU0_SUS256_SRVW4_TT2_64_WG64_4_1_WGM15
    SolutionIndex: 89
    SolutionNameMin: Cijk_Alik_Bljk_BBH_MT32x32x64_MI16x16x8x1_SE_1LDSB1_AF0EM8_GRVW4_GSU1_LBSPP128_LPA4_LPB4_PLR9_SU0_SUS256_SRVW4_TT1_16_WG32_8_1_WGM15
    SolutionIndex: 90
    SolutionNameMin: Cijk_Alik_Bljk_BBH_MT32x64x64_MI16x16x8x1_SE_1LDSB1_AF0EM8_GRVW4_GSU1_LBSPP128_LPA4_LPB4_PLR9_SU0_SUS256_SRVW4_TT1_32_WG32_8_1_WGM15
    SolutionIndex: 91
    SolutionNameMin: Cijk_Alik_Bljk_BBH_MT64x64x64_MI32x32x4x1_SE_1LDSB1_AF0EM8_GRVW4_GSU1_LBSPP128_LPA4_LPB4_PLR17_SU0_SUS256_SRVW4_TT1_32_WG64_4_1_WGM15
    SolutionIndex: 92
    SolutionNameMin: Cijk_Alik_Bljk_BBH_MT64x64x32_MI32x32x4x1_SE_1LDSB1_AF0EM8_GRVW8_GSU1_LBSPP128_LPA8_LPB8_PLR9_SU0_SUS256_SRVW4_TT1_32_WG64_4_1_WGM15
    SolutionIndex: 93
    SolutionNameMin: Cijk_Alik_Bljk_BBH_MT64x128x32_MI32x32x4x1_SE_1LDSB1_AF0EM8_GRVW8_GSU1_LBSPP128_LPA8_LPB8_PLR9_SU0_SUS256_SRVW4_TT1_64_WG64_4_1_WGM15
    SolutionIndex: 94
    SolutionNameMin: Cijk_Alik_Bljk_BBH_MT128x64x32_MI32x32x4x1_SE_1LDSB1_AF0EM8_GRVW8_GSU1_LBSPP128_LPA8_LPB8_PLR9_SU0_SUS256_SRVW4_TT2_32_WG64_4_1_WGM15
    SolutionIndex: 95
    SolutionNameMin: Cijk_Alik_Bljk_BBH_MT128x128x32_MI32x32x4x1_SE_1LDSB1_AF0EM8_GRVW8_GSU1_LBSPP128_LPA8_LPB8_PLR9_SU0_SUS256_SRVW4_TT2_64_WG64_4_1_WGM15
    SolutionIndex: 96
    SolutionNameMin: Cijk_Alik_Bljk_BBH_MT32x32x64_MI16x16x8x1_SE_1LDSB1_AF0EM8_GRVW8_GSU1_LBSPP128_LPA8_LPB8_PLR9_SU0_SUS256_SRVW4_TT1_16_WG32_8_1_WGM15
    SolutionIndex: 97
    SolutionNameMin: Cijk_Alik_Bljk_BBH_MT96x96x64_MI16x16x8x1_SE_1LDSB1_AF0EM8_GRVW8_GSU1_LBSPP128_LPA8_LPB8_PLR9_SU0_SUS256_SRVW0_TT3_48_WG32_8_1_WGM15
    SolutionIndex: 98
    SolutionNameMin: Cijk_Alik_Bljk_BBH_MT64x64x64_MI32x32x4x1_SE_1LDSB1_AF0EM8_GRVW8_GSU1_LBSPP128_LPA8_LPB8_PLR17_SU0_SUS256_SRVW4_TT1_32_WG64_4_1_WGM15
    SolutionIndex: 99
    SolutionNameMin: Cijk_Alik_Bljk_BBH_MT64x128x64_MI32x32x4x1_SE_1LDSB1_AF0EM8_GRVW8_GSU1_LBSPP128_LPA8_LPB8_PLR17_SU0_SUS256_SRVW4_TT1_64_WG64_4_1_WGM15
    SolutionIndex: 100
    SolutionNameMin: Cijk_Alik_Bljk_BBH_MT128x64x64_MI32x32x4x1_SE_1LDSB1_AF0EM8_GRVW8_GSU1_LBSPP128_LPA8_LPB8_PLR17_SU0_SUS256_SRVW4_TT2_32_WG64_4_1_WGM15
    SolutionIndex: 101
    SolutionNameMin: Cijk_Alik_Bljk_BBH_MT128x96x64_MI32x32x4x1_SE_1LDSB1_AF0EM8_GRVW8_GSU1_LBSPP128_LPA8_LPB8_PLR17_SU0_SUS256_SRVW4_TT1_96_WG128_2_1_WGM15
    SolutionIndex: 102
    SolutionNameMin: Cijk_Alik_Bljk_BBH_MT128x96x32_MI32x32x4x1_SE_1LDSB1_AF0EM8_GRVW2_GSU1_LBSPP128_LPA4_LPB4_PLR9_SU32_SUS128_SRVW4_TT1_96_WG128_2_1_WGM15
    SolutionIndex: 103
    SolutionNameMin: Cijk_Alik_Bljk_BBH_MT128x160x32_MI32x32x4x1_SE_1LDSB1_AF0EM8_GRVW2_GSU1_LBSPP128_LPA4_LPB4_PLR9_SU32_SUS128_SRVW4_TT1_160_WG128_2_1_WGM15
    SolutionIndex: 104
    SolutionNameMin: Cijk_Alik_Bljk_BBH_MT96x96x64_MI16x16x8x1_SE_1LDSB1_AF0EM8_GRVW2_GSU1_LBSPP128_LPA4_LPB4_PLR9_SU32_SUS128_SRVW0_TT3_48_WG32_8_1_WGM15
    SolutionIndex: 105
    SolutionNameMin: Cijk_Alik_Bljk_BBH_MT128x96x32_MI32x32x4x1_SE_1LDSB1_AF0EM8_GRVW4_GSU1_LBSPP128_LPA4_LPB4_PLR9_SU32_SUS128_SRVW4_TT1_96_WG128_2_1_WGM15
    SolutionIndex: 106
    SolutionNameMin: Cijk_Alik_Bljk_BBH_MT128x160x32_MI32x32x4x1_SE_1LDSB1_AF0EM8_GRVW4_GSU1_LBSPP128_LPA4_LPB4_PLR9_SU32_SUS128_SRVW4_TT1_160_WG128_2_1_WGM15
    SolutionIndex: 107
    SolutionNameMin: Cijk_Alik_Bljk_BBH_MT32x32x64_MI16x16x8x1_SE_1LDSB1_AF0EM8_GRVW4_GSU1_LBSPP128_LPA4_LPB4_PLR9_SU32_SUS128_SRVW4_TT1_16_WG32_8_1_WGM15
    SolutionIndex: 108
    SolutionNameMin: Cijk_Alik_Bljk_BBH_MT64x64x64_MI32x32x4x1_SE_1LDSB1_AF0EM8_GRVW4_GSU1_LBSPP128_LPA4_LPB4_PLR17_SU32_SUS128_SRVW4_TT1_32_WG64_4_1_WGM15
    SolutionIndex: 109
    SolutionNameMin: Cijk_Alik_Bljk_BBH_MT64x64x32_MI32x32x4x1_SE_1LDSB1_AF0EM8_GRVW8_GSU1_LBSPP128_LPA8_LPB8_PLR9_SU32_SUS128_SRVW4_TT1_32_WG64_4_1_WGM15
    SolutionIndex: 110
    SolutionNameMin: Cijk_Alik_Bljk_BBH_MT64x128x32_MI32x32x4x1_SE_1LDSB1_AF0EM8_GRVW8_GSU1_LBSPP128_LPA8_LPB8_PLR9_SU32_SUS128_SRVW4_TT1_64_WG64_4_1_WGM15
    SolutionIndex: 111
    SolutionNameMin: Cijk_Alik_Bljk_BBH_MT128x64x32_MI32x32x4x1_SE_1LDSB1_AF0EM8_GRVW8_GSU1_LBSPP128_LPA8_LPB8_PLR9_SU32_SUS128_SRVW4_TT2_32_WG64_4_1_WGM15
    SolutionIndex: 112
    SolutionNameMin: Cijk_Alik_Bljk_BBH_MT32x32x64_MI16x16x8x1_SE_1LDSB1_AF0EM8_GRVW8_GSU1_LBSPP128_LPA8_LPB8_PLR9_SU32_SUS128_SRVW4_TT1_16_WG32_8_1_WGM15
    SolutionIndex: 113
    SolutionNameMin: Cijk_Alik_Bljk_BBH_MT64x64x64_MI32x32x4x1_SE_1LDSB1_AF0EM8_GRVW8_GSU1_LBSPP128_LPA8_LPB8_PLR17_SU32_SUS128_SRVW4_TT1_32_WG64_4_1_WGM15
    SolutionIndex: 114
    SolutionNameMin: Cijk_Alik_Bljk_BBH_MT128x96x32_MI32x32x4x1_SE_1LDSB1_AF0EM8_GRVW2_GSU1_LBSPP128_LPA4_LPB4_PLR9_SU32_SUS256_SRVW4_TT1_96_WG128_2_1_WGM15
    SolutionIndex: 115
    SolutionNameMin: Cijk_Alik_Bljk_BBH_MT128x96x64_MI32x32x4x1_SE_1LDSB1_AF0EM8_GRVW2_GSU1_LBSPP128_LPA4_LPB4_PLR17_SU32_SUS256_SRVW4_TT1_96_WG128_2_1_WGM15
    SolutionIndex: 116
    SolutionNameMin: Cijk_Alik_Bljk_BBH_MT64x64x32_MI32x32x4x1_SE_1LDSB1_AF0EM8_GRVW4_GSU1_LBSPP128_LPA4_LPB4_PLR9_SU32_SUS256_SRVW4_TT1_32_WG64_4_1_WGM15
    SolutionIndex: 117
    SolutionNameMin: Cijk_Alik_Bljk_BBH_MT96x128x32_MI32x32x4x1_SE_1LDSB1_AF0EM8_GRVW4_GSU1_LBSPP128_LPA4_LPB4_PLR9_SU32_SUS256_SRVW0_TT3_32_WG32_8_1_WGM15
    SolutionIndex: 118
    SolutionNameMin: Cijk_Alik_Bljk_BBH_MT64x64x64_MI32x32x4x1_SE_1LDSB1_AF0EM8_GRVW4_GSU1_LBSPP128_LPA4_LPB4_PLR17_SU32_SUS256_SRVW4_TT1_32_WG64_4_1_WGM15
    SolutionIndex: 119
    SolutionNameMin: Cijk_Alik_Bljk_BBH_MT64x64x32_MI32x32x4x1_SE_1LDSB1_AF0EM8_GRVW8_GSU1_LBSPP128_LPA8_LPB8_PLR9_SU32_SUS256_SRVW4_TT1_32_WG64_4_1_WGM15
    SolutionIndex: 120
    SolutionNameMin: Cijk_Alik_Bljk_BBH_MT64x128x32_MI32x32x4x1_SE_1LDSB1_AF0EM8_GRVW8_GSU1_LBSPP128_LPA8_LPB8_PLR9_SU32_SUS256_SRVW4_TT1_64_WG64_4_1_WGM15
    SolutionIndex: 121
    SolutionNameMin: Cijk_Alik_Bljk_BBH_MT128x128x32_MI32x32x4x1_SE_1LDSB1_AF0EM8_GRVW8_GSU1_LBSPP128_LPA8_LPB8_PLR9_SU32_SUS256_SRVW4_TT2_64_WG64_4_1_WGM15
    SolutionIndex: 122
    SolutionNameMin: Cijk_Alik_Bljk_BBH_MT96x96x64_MI16x16x8x1_SE_1LDSB1_AF0EM8_GRVW8_GSU1_LBSPP128_LPA8_LPB8_PLR9_SU32_SUS256_SRVW0_TT3_48_WG32_8_1_WGM15
    SolutionIndex: 123
    SolutionNameMin: Cijk_Alik_Bljk_BBH_MT128x64x64_MI32x32x4x1_SE_1LDSB1_AF0EM8_GRVW8_GSU1_LBSPP128_LPA8_LPB8_PLR17_SU32_SUS256_SRVW4_TT2_32_WG64_4_1_WGM15
    SolutionIndex: 124
    SolutionNameMin: Cijk_Alik_Bljk_BBH_MT128x96x64_MI32x32x4x1_SE_1LDSB1_AF0EM8_GRVW8_GSU1_LBSPP128_LPA8_LPB8_PLR17_SU32_SUS256_SRVW4_TT1_96_WG128_2_1_WGM15
    SolutionIndex: 125
    SolutionNameMin: Cijk_Alik_Bljk_BBH_MT32x32x64_MI16x16x8x1_SE_1LDSB0_AF0EM8_GRVW2_GSU15_LBSPP128_LPA4_LPB4_PLR9_SU0_SUS256_SRVW0_TT1_16_WG32_8_1_WGM1
    SolutionIndex: 126
    SolutionNameMin: Cijk_Alik_Bljk_BBH_MT32x32x32_MI16x16x8x1_SE_1LDSB0_AF0EM8_GRVW8_GSU15_LBSPP128_LPA8_LPB8_PLR5_SU0_SUS256_SRVW0_TT1_16_WG32_8_1_WGM1
    SolutionIndex: 127
    SolutionNameMin: Cijk_Alik_Bljk_BBH_MT32x32x32_MI16x16x8x1_SE_1LDSB0_AF0EM1_GRVW2_GSU1_LBSPP128_LPA4_LPB4_PLR5_SU0_SUS256_SRVW4_TT1_16_WG32_8_1_WGM1
    SolutionIndex: 128
    SolutionNameMin: Cijk_Alik_Bljk_BBH_MT32x32x64_MI16x16x8x1_SE_1LDSB0_AF0EM1_GRVW2_GSU1_LBSPP128_LPA4_LPB4_PLR9_SU0_SUS256_SRVW4_TT1_16_WG32_8_1_WGM1
    SolutionIndex: 129
    SolutionNameMin: Cijk_Alik_Bljk_BBH_MT64x64x32_MI32x32x4x1_SE_1LDSB1_AF0EM1_GRVW2_GSU1_LBSPP128_LPA4_LPB4_PLR9_SU0_SUS256_SRVW4_TT1_32_WG64_4_1_WGM1
    SolutionIndex: 130
    SolutionNameMin: Cijk_Alik_Bljk_BBH_MT32x32x64_MI16x16x8x1_SE_1LDSB1_AF0EM1_GRVW2_GSU1_LBSPP128_LPA4_LPB4_PLR9_SU0_SUS256_SRVW4_TT1_16_WG32_8_1_WGM1
    SolutionIndex: 131
    SolutionNameMin: Cijk_Alik_Bljk_BBH_MT64x64x32_MI32x32x4x1_SE_1LDSB1_AF0EM1_GRVW4_GSU1_LBSPP128_LPA4_LPB4_PLR9_SU0_SUS256_SRVW4_TT1_32_WG64_4_1_WGM1
    SolutionIndex: 132
    SolutionNameMin: Cijk_Alik_Bljk_BBH_MT32x32x64_MI16x16x8x1_SE_1LDSB1_AF0EM1_GRVW4_GSU1_LBSPP128_LPA4_LPB4_PLR9_SU0_SUS256_SRVW4_TT1_16_WG32_8_1_WGM1
    SolutionIndex: 133
    SolutionNameMin: Cijk_Alik_Bljk_BBH_MT32x32x64_MI16x16x8x1_SE_1LDSB1_AF0EM1_GRVW8_GSU1_LBSPP128_LPA8_LPB8_PLR9_SU0_SUS256_SRVW4_TT1_16_WG32_8_1_WGM1
    SolutionIndex: 134
    SolutionNameMin: Cijk_Alik_Bljk_BBH_MT64x128x32_MI32x32x4x1_SE_1LDSB1_AF0EM1_GRVW8_GSU1_LBSPP128_LPA8_LPB8_PLR9_SU32_SUS128_SRVW4_TT1_64_WG64_4_1_WGM1
    SolutionIndex: 135
    SolutionNameMin: Cijk_Alik_Bljk_BBH_MT128x128x32_MI32x32x4x1_SE_1LDSB1_AF0EM1_GRVW8_GSU1_LBSPP128_LPA8_LPB8_PLR9_SU32_SUS128_SRVW4_TT2_64_WG64_4_1_WGM1
    SolutionIndex: 136
    SolutionNameMin: Cijk_Alik_Bljk_BBH_MT32x32x64_MI16x16x8x1_SE_1LDSB1_AF0EM1_GRVW8_GSU1_LBSPP128_LPA8_LPB8_PLR9_SU32_SUS128_SRVW4_TT1_16_WG32_8_1_WGM1
    SolutionIndex: 137
    SolutionNameMin: Cijk_Alik_Bljk_BBH_MT64x32x32_MI16x16x8x1_SE_1LDSB1_AF0EM1_GRVW4_GSU1_LBSPP128_LPA4_LPB4_PLR5_SU32_SUS256_SRVW4_TT2_16_WG32_8_1_WGM1
    SolutionIndex: 138
    SolutionNameMin: Cijk_Alik_Bljk_BBH_MT128x96x32_MI32x32x4x1_SE_1LDSB1_AF0EM1_GRVW4_GSU1_LBSPP128_LPA4_LPB4_PLR9_SU32_SUS256_SRVW4_TT1_96_WG128_2_1_WGM1
    SolutionIndex: 139
    SolutionNameMin: Cijk_Alik_Bljk_BBH_MT128x160x32_MI32x32x4x1_SE_1LDSB1_AF0EM1_GRVW2_GSU1_LBSPP128_LPA4_LPB4_PLR9_SU0_SUS256_SRVW4_TT1_160_WG128_2_1_WGM2
    SolutionIndex: 140
    SolutionNameMin: Cijk_Alik_Bljk_BBH_MT32x32x64_MI16x16x8x1_SE_1LDSB1_AF0EM1_GRVW4_GSU1_LBSPP128_LPA4_LPB4_PLR9_SU0_SUS256_SRVW4_TT1_16_WG32_8_1_WGM2
    SolutionIndex: 141
    SolutionNameMin: Cijk_Alik_Bljk_BBH_MT128x160x32_MI32x32x4x1_SE_1LDSB1_AF0EM1_GRVW4_GSU1_LBSPP128_LPA4_LPB4_PLR9_SU32_SUS128_SRVW4_TT1_160_WG128_2_1_WGM2
    SolutionIndex: 142
    SolutionNameMin: Cijk_Alik_Bljk_BBH_MT32x32x64_MI16x16x8x1_SE_1LDSB1_AF0EM1_GRVW2_GSU1_LBSPP128_LPA4_LPB4_PLR9_SU32_SUS256_SRVW4_TT1_16_WG32_8_1_WGM2
    SolutionIndex: 143
    SolutionNameMin: Cijk_Alik_Bljk_BBH_MT128x144x32_MI16x16x8x1_SE_1LDSB1_AF0EM1_GRVW2_GSU1_LBSPP128_LPA4_LPB4_PLR5_SU0_SUS256_SRVW4_TT2_144_WG64_4_1_WGM15
    SolutionIndex: 144
    SolutionNameMin: Cijk_Alik_Bljk_BBH_MT128x160x32_MI32x32x4x1_SE_1LDSB1_AF0EM1_GRVW2_GSU1_LBSPP128_LPA4_LPB4_PLR9_SU0_SUS256_SRVW4_TT1_160_WG128_2_1_WGM15
    SolutionIndex: 145
    SolutionNameMin: Cijk_Alik_Bljk_BBH_MT32x32x64_MI16x16x8x1_SE_1LDSB1_AF0EM1_GRVW4_GSU1_LBSPP128_LPA4_LPB4_PLR9_SU0_SUS256_SRVW4_TT1_16_WG32_8_1_WGM15
    SolutionIndex: 146
    SolutionNameMin: Cijk_Alik_Bljk_BBH_MT128x96x32_MI32x32x4x1_SE_1LDSB1_AF0EM1_GRVW2_GSU1_LBSPP128_LPA4_LPB4_PLR9_SU32_SUS128_SRVW4_TT1_96_WG128_2_1_WGM15
    SolutionIndex: 147
    SolutionNameMin: Cijk_Alik_Bljk_BBH_MT128x128x32_MI32x32x4x1_SE_1LDSB1_AF0EM1_GRVW8_GSU1_LBSPP128_LPA8_LPB8_PLR9_SU32_SUS128_SRVW4_TT2_64_WG64_4_1_WGM15
    SolutionIndex: 148
    SolutionNameMin: Cijk_Alik_Bljk_BBH_MT128x64x64_MI32x32x4x1_SE_1LDSB1_AF0EM1_GRVW8_GSU1_LBSPP128_LPA8_LPB8_PLR17_SU32_SUS128_SRVW4_TT2_32_WG64_4_1_WGM15
    SolutionIndex: 149
    SolutionNameMin: Cijk_Alik_Bljk_BBH_MT128x96x64_MI32x32x4x1_SE_1LDSB1_AF0EM1_GRVW8_GSU1_LBSPP128_LPA8_LPB8_PLR17_SU32_SUS128_SRVW4_TT1_96_WG128_2_1_WGM15
    SolutionIndex: 150
    SolutionNameMin: Cijk_Alik_Bljk_BBH_MT32x32x64_MI16x16x8x1_SE_1LDSB0_AF0EM1_GRVW2_GSU2_LBSPP128_LPA4_LPB4_PLR9_SU0_SUS256_SRVW0_TT1_16_WG32_8_1_WGM1
    SolutionIndex: 151
    SolutionNameMin: Cijk_Alik_Bljk_BBH_MT32x32x64_MI16x16x8x1_SE_1LDSB0_AF0EM1_GRVW4_GSU2_LBSPP128_LPA4_LPB4_PLR9_SU0_SUS256_SRVW0_TT1_16_WG32_8_1_WGM1
    SolutionIndex: 152
    SolutionNameMin: Cijk_Alik_Bljk_BBH_MT32x32x64_MI16x16x8x1_SE_1LDSB0_AF0EM1_GRVW8_GSU3_LBSPP128_LPA8_LPB8_PLR9_SU0_SUS256_SRVW0_TT1_16_WG32_8_1_WGM1
    SolutionIndex: 153
    SolutionNameMin: Cijk_Alik_Bljk_BBH_MT32x32x64_MI16x16x8x1_SE_1LDSB0_AF0EM1_GRVW8_GSU3_LBSPP128_LPA8_LPB8_PLR9_SU32_SUS128_SRVW0_TT1_16_WG32_8_1_WGM1
    SolutionIndex: 154
    SolutionNameMin: Cijk_Alik_Bljk_BBH_MT32x32x64_MI16x16x8x1_SE_1LDSB1_AF0EM1_GRVW8_GSU3_LBSPP128_LPA8_LPB8_PLR9_SU0_SUS256_SRVW0_TT1_16_WG32_8_1_WGM1
    SolutionIndex: 155
    SolutionNameMin: Cijk_Alik_Bljk_BBH_MT32x32x64_MI16x16x8x1_SE_1LDSB0_AF0EM1_GRVW8_GSU5_LBSPP128_LPA8_LPB8_PLR9_SU0_SUS256_SRVW0_TT1_16_WG32_8_1_WGM1
    SolutionIndex: 156
    SolutionNameMin: Cijk_Alik_Bljk_BBH_MT32x32x64_MI16x16x8x1_SE_1LDSB0_AF0EM1_GRVW8_GSU7_LBSPP128_LPA8_LPB8_PLR9_SU0_SUS256_SRVW0_TT1_16_WG32_8_1_WGM1
    SolutionIndex: 157
    SolutionNameMin: Cijk_Alik_Bljk_BBH_MT32x32x64_MI16x16x8x1_SE_1LDSB0_AF0EM1_GRVW2_GSU15_LBSPP128_LPA4_LPB4_PLR9_SU0_SUS256_SRVW0_TT1_16_WG32_8_1_WGM1
    SolutionIndex: 158
    SolutionNameMin: Cijk_Alik_Bljk_BBH_MT32x32x64_MI16x16x8x1_SE_1LDSB0_AF0EM1_GRVW8_GSU15_LBSPP128_LPA8_LPB8_PLR9_SU0_SUS256_SRVW0_TT1_16_WG32_8_1_WGM1
    SolutionIndex: 159
    SolutionNameMin: Cijk_Alik_Bljk_BBH_MT32x32x64_MI16x16x8x1_SE_1LDSB1_AF0EM1_GRVW2_GSU15_LBSPP128_LPA4_LPB4_PLR9_SU0_SUS256_SRVW0_TT1_16_WG32_8_1_WGM1
    SolutionIndex: 160
    SolutionNameMin: Cijk_Alik_Bljk_BBH_MT16x16x32_MI16x16x8x1_SE_1LDSB0_AF0EM1_GRVW2_GSU1_LBSPP128_LPA4_LPB4_PLR5_SU0_SUS256_SRVW0_TT1_16_WG16_4_1_WGM1
    SolutionIndex: 161
    SolutionNameMin: Cijk_Alik_Bljk_BBH_MT16x16x128_MI16x16x8x1_SE_1LDSB0_AF0EM8_GRVW8_GSU1_LBSPP256_LPA8_LPB8_PLR17_SU0_SUS256_SRVW0_TT1_16_WG16_4_1_WGM1
    SolutionIndex: 162
    SolutionNameMin: Cijk_Alik_Bljk_BBH_MT16x16x128_MI16x16x8x1_SE_1LDSB0_AF0EM8_GRVW8_GSU1_LBSPP256_LPA8_LPB8_PLR17_SU0_SUS256_SRVW4_TT1_16_WG16_4_1_WGM1
    SolutionIndex: 163
    SolutionNameMin: Cijk_Alik_Bljk_BBH_MT16x16x64_MI16x16x8x1_SE_1LDSB0_AF0EM8_GRVW8_GSU1_LBSPP128_LPA8_LPB8_PLR9_SU32_SUS128_SRVW4_TT1_16_WG16_4_1_WGM1
    SolutionIndex: 164
    SolutionNameMin: Cijk_Alik_Bljk_BBH_MT16x16x128_MI16x16x8x1_SE_1LDSB0_AF0EM8_GRVW8_GSU1_LBSPP256_LPA8_LPB8_PLR17_SU32_SUS256_SRVW0_TT1_16_WG16_4_1_WGM1
    SolutionIndex: 165
    SolutionNameMin: Cijk_Alik_Bljk_BBH_MT16x16x64_MI16x16x8x1_SE_1LDSB0_AF0EM1_GRVW8_GSU1_LBSPP128_LPA8_LPB8_PLR9_SU0_SUS256_SRVW0_TT1_16_WG16_4_1_WGM2
    SolutionIndex: 166
    SolutionNameMin: Cijk_Alik_Bljk_BBH_MT16x16x128_MI16x16x8x1_SE_1LDSB0_AF0EM8_GRVW8_GSU1_LBSPP256_LPA8_LPB8_PLR17_SU0_SUS256_SRVW0_TT1_16_WG16_4_1_WGM2
    SolutionIndex: 167
    SolutionNameMin: Cijk_Alik_Bljk_BBH_MT16x16x128_MI16x16x8x1_SE_1LDSB0_AF0EM8_GRVW8_GSU1_LBSPP256_LPA8_LPB8_PLR17_SU0_SUS256_SRVW0_TT1_16_WG16_4_1_WGM15
    SolutionIndex: 168
    SolutionNameMin: Cijk_Alik_Bljk_BBH_MT16x16x64_MI16x16x8x1_SE_1LDSB1_AF0EM1_GRVW4_GSU1_LBSPP128_LPA4_LPB4_PLR9_SU0_SUS256_SRVW0_TT1_16_WG16_4_1_WGM1
    SolutionIndex: 169
    SolutionNameMin: Cijk_Alik_Bljk_BBH_MT16x16x64_MI16x16x8x1_SE_1LDSB1_AF0EM8_GRVW4_GSU1_LBSPP128_LPA4_LPB4_PLR9_SU0_SUS256_SRVW0_TT1_16_WG16_4_1_WGM1
    SolutionIndex: 170
    SolutionNameMin: Cijk_Alik_Bljk_BBH_MT16x16x64_MI16x16x8x1_SE_1LDSB1_AF0EM1_GRVW8_GSU1_LBSPP128_LPA8_LPB8_PLR9_SU0_SUS256_SRVW0_TT1_16_WG16_4_1_WGM1
    SolutionIndex: 171
    SolutionNameMin: Cijk_Alik_Bljk_BBH_MT16x16x128_MI16x16x8x1_SE_1LDSB1_AF0EM1_GRVW8_GSU1_LBSPP256_LPA8_LPB8_PLR17_SU0_SUS256_SRVW0_TT1_16_WG16_4_1_WGM1
    SolutionIndex: 172
    SolutionNameMin: Cijk_Alik_Bljk_BBH_MT16x16x128_MI16x16x8x1_SE_1LDSB1_AF0EM8_GRVW8_GSU1_LBSPP256_LPA8_LPB8_PLR17_SU0_SUS256_SRVW0_TT1_16_WG16_4_1_WGM1
    SolutionIndex: 173
    SolutionNameMin: Cijk_Alik_Bljk_BBH_MT16x16x64_MI16x16x8x1_SE_1LDSB1_AF0EM1_GRVW4_GSU1_LBSPP128_LPA4_LPB4_PLR9_SU32_SUS256_SRVW0_TT1_16_WG16_4_1_WGM1
    SolutionIndex: 174
    SolutionNameMin: Cijk_Alik_Bljk_BBH_MT16x16x128_MI16x16x8x1_SE_1LDSB1_AF0EM8_GRVW8_GSU1_LBSPP256_LPA8_LPB8_PLR17_SU32_SUS256_SRVW0_TT1_16_WG16_4_1_WGM1
    SolutionIndex: 175
    SolutionNameMin: Cijk_Alik_Bljk_BBH_MT16x16x128_MI16x16x8x1_SE_1LDSB1_AF0EM1_GRVW8_GSU1_LBSPP256_LPA8_LPB8_PLR17_SU0_SUS256_SRVW0_TT1_16_WG16_4_1_WGM2
    SolutionIndex: 176
    SolutionNameMin: Cijk_Alik_Bljk_BBH_MT16x16x64_MI16x16x8x1_SE_1LDSB1_AF0EM1_GRVW4_GSU1_LBSPP128_LPA4_LPB4_PLR9_SU0_SUS256_SRVW0_TT1_16_WG16_4_1_WGM15
    SolutionIndex: 177
    SolutionNameMin: Cijk_Alik_Bljk_BBH_MT16x16x64_MI16x16x8x1_SE_1LDSB1_AF0EM1_GRVW8_GSU1_LBSPP128_LPA8_LPB8_PLR9_SU0_SUS256_SRVW0_TT1_16_WG16_4_1_WGM15
    SolutionIndex: 178
    SolutionNameMin: Cijk_Alik_Bljk_BBH_MT16x16x128_MI16x16x8x1_SE_1LDSB1_AF0EM1_GRVW8_GSU1_LBSPP256_LPA8_LPB8_PLR17_SU0_SUS256_SRVW0_TT1_16_WG16_4_1_WGM15
    SolutionIndex: 179
    SolutionNameMin: Cijk_Alik_Bljk_BBH_MT16x16x128_MI16x16x8x1_SE_1LDSB1_AF0EM8_GRVW8_GSU1_LBSPP256_LPA8_LPB8_PLR17_SU0_SUS256_SRVW0_TT1_16_WG16_4_1_WGM15
    SolutionIndex: 180
    SolutionNameMin: Cijk_Alik_Bljk_BBH_MT16x16x128_MI16x16x8x1_SE_1LDSB1_AF0EM8_GRVW8_GSU1_LBSPP256_LPA8_LPB8_PLR17_SU32_SUS256_SRVW0_TT1_16_WG16_4_1_WGM15
    SolutionIndex: 181
    SolutionNameMin: Cijk_Alik_Bljk_BBH_MT16x16x64_MI16x16x8x1_SE_1LDSB0_AF0EM1_GRVW8_GSU7_LBSPP128_LPA8_LPB8_PLR9_SU0_SUS256_SRVW0_TT1_16_WG16_4_1_WGM1
- - - [7680, 8192, 1, 8192, 8384, 8384, 8384, 8384]
    - [21, 65737.0]
  - - [3840, 4096, 1, 4096, 4192, 4192, 4192, 4192]
    - [82, 64939.0]
  - - [1920, 2048, 1, 2048, 2080, 2080, 2080, 2080]
    - [20, 61947.0]
  - - [960, 1024, 1, 1024, 1056, 1056, 1056, 1056]
    - [34, 44306.0]
  - - [480, 512, 1, 512, 544, 544, 544, 544]
    - [68, 13919.0]
  - - [8192, 7680, 1, 8192, 8384, 8384, 8384, 8384]
    - [82, 65767.0]
  - - [4096, 3840, 1, 4096, 4192, 4192, 4192, 4192]
    - [21, 64918.0]
  - - [2048, 1920, 1, 2048, 2080, 2080, 2080, 2080]
    - [88, 61643.0]
  - - [1024, 960, 1, 1024, 1056, 1056, 1056, 1056]
    - [98, 43389.0]
  - - [512, 480, 1, 512, 544, 544, 544, 544]
    - [96, 13677.0]
  - - [8192, 8192, 1, 8192, 8384, 8384, 8384, 8384]
    - [124, 64788.0]
  - - [4096, 4096, 1, 4096, 4192, 4192, 4192, 4192]
    - [106, 63147.0]
  - - [2048, 2048, 1, 2048, 2080, 2080, 2080, 2080]
    - [78, 58261.0]
  - - [1024, 1024, 1, 1024, 1056, 1056, 1056, 1056]
    - [98, 35887.0]
  - - [512, 512, 1, 512, 544, 544, 544, 544]
    - [107, 13640.0]
  - - [512, 512, 16, 64, 512, 512, 64, 64]
    - [30, 20214.0]
  - - [512, 512, 128, 64, 512, 512, 64, 64]
    - [93, 34196.0]
  - - [1024, 1, 1, 1024, 1024, 1024, 1024, 1024]
    - [167, 108.0]
  - - [1024, 77, 1, 1024, 1024, 1024, 1024, 1024]
    - [14, 6596.0]
  - - [1024, 512, 1, 1024, 1024, 1024, 1024, 1024]
    - [69, 25041.0]
  - - [1024, 512, 1, 4096, 1024, 1024, 4096, 4096]
    - [74, 30263.0]
  - - [4096, 512, 1, 1024, 4096, 4096, 1024, 1024]
    - [118, 45040.0]
  - - [128, 128, 128, 64, 128, 128, 64, 64]
    - [30, 14717.0]
  - - [128, 128, 160, 64, 128, 128, 64, 64]
    - [26, 15888.0]
  - - [1024, 10, 1, 1024, 1024, 1024, 1024, 1024]
    - [166, 1074.0]
  - - [1024, 200, 1, 1024, 1024, 1024, 1024, 1024]
    - [6, 14895.0]
  - - [1024, 1280, 1, 1024, 1024, 1024, 1024, 1024]
    - [117, 37958.0]
  - - [1024, 1280, 1, 4096, 1024, 1024, 4096, 4096]
    - [37, 50995.0]
  - - [4096, 1280, 1, 1024, 4096, 4096, 1024, 1024]
    - [43, 53261.0]
  - - [128, 128, 624, 64, 128, 128, 64, 64]
    - [116, 23435.0]
  - - [1024, 39, 1, 1024, 1024, 1024, 1024, 1024]
    - [5, 3408.0]
  - - [1024, 780, 1, 1024, 1024, 1024, 1024, 1024]
    - [98, 34539.0]
  - - [1024, 4992, 1, 1024, 1024, 1024, 1024, 1024]
    - [52, 52178.0]
  - - [1024, 4992, 1, 4096, 1024, 1024, 4096, 4096]
    - [23, 57610.0]
  - - [4096, 4992, 1, 1024, 4096, 4096, 1024, 1024]
    - [114, 61611.0]
  - - [512, 512, 64, 64, 512, 512, 64, 64]
    - [56, 30574.0]
  - - [1024, 4, 1, 1024, 1024, 1024, 1024, 1024]
    - [178, 441.0]
  - - [1024, 308, 1, 1024, 1024, 1024, 1024, 1024]
    - [89, 20185.0]
  - - [1024, 2048, 1, 1024, 1024, 1024, 1024, 1024]
    - [91, 45344.0]
  - - [1024, 2048, 1, 4096, 1024, 1024, 4096, 4096]
    - [78, 53876.0]
  - - [4096, 2048, 1, 1024, 4096, 4096, 1024, 1024]
    - [73, 57327.0]
  - - [128, 128, 640, 64, 128, 128, 64, 64]
    - [26, 23630.0]
  - - [1024, 40, 1, 1024, 1024, 1024, 1024, 1024]
    - [112, 3404.0]
  - - [1024, 800, 1, 1024, 1024, 1024, 1024, 1024]
    - [69, 34606.0]
  - - [1024, 5120, 1, 1024, 1024, 1024, 1024, 1024]
    - [31, 53009.0]
  - - [1024, 5120, 1, 4096, 1024, 1024, 4096, 4096]
    - [104, 58002.0]
  - - [4096, 5120, 1, 1024, 4096, 4096, 1024, 1024]
    - [95, 61301.0]
  - - [128, 128, 656, 64, 128, 128, 64, 64]
    - [19, 23557.0]
  - - [1024, 41, 1, 1024, 1024, 1024, 1024, 1024]
    - [5, 3512.0]
  - - [1024, 820, 1, 1024, 1024, 1024, 1024, 1024]
    - [69, 34896.0]
  - - [1024, 5248, 1, 1024, 1024, 1024, 1024, 1024]
    - [95, 54420.0]
  - - [1024, 5248, 1, 4096, 1024, 1024, 4096, 4096]
    - [81, 58604.0]
  - - [4096, 5248, 1, 1024, 4096, 4096, 1024, 1024]
    - [95, 62547.0]
  - - [512, 512, 80, 64, 512, 512, 64, 64]
    - [27, 32202.0]
  - - [1024, 5, 1, 1024, 1024, 1024, 1024, 1024]
    - [174, 533.0]
  - - [1024, 385, 1, 1024, 1024, 1024, 1024, 1024]
    - [113, 23803.0]
  - - [1024, 2560, 1, 1024, 1024, 1024, 1024, 1024]
    - [99, 48771.0]
  - - [1024, 2560, 1, 4096, 1024, 1024, 4096, 4096]
    - [99, 55462.0]
  - - [4096, 2560, 1, 1024, 4096, 4096, 1024, 1024]
    - [120, 59049.0]
  - - [512, 512, 96, 64, 512, 512, 64, 64]
    - [31, 32843.0]
  - - [1024, 6, 1, 1024, 1024, 1024, 1024, 1024]
    - [164, 639.0]
  - - [1024, 462, 1, 1024, 1024, 1024, 1024, 1024]
    - [8, 23841.0]
  - - [1024, 3072, 1, 1024, 1024, 1024, 1024, 1024]
    - [77, 50019.0]
  - - [1024, 3072, 1, 4096, 1024, 1024, 4096, 4096]
    - [85, 57276.0]
  - - [4096, 3072, 1, 1024, 4096, 4096, 1024, 1024]
    - [93, 59941.0]
  - - [1024, 8, 1, 1024, 1024, 1024, 1024, 1024]
    - [161, 859.0]
  - - [1024, 160, 1, 1024, 1024, 1024, 1024, 1024]
    - [68, 13190.0]
  - - [1024, 1024, 1, 1024, 1024, 1024, 1024, 1024]
    - [92, 34503.0]
  - - [1024, 1024, 1, 4096, 1024, 1024, 4096, 4096]
    - [25, 41108.0]
  - - [4096, 1024, 1, 1024, 4096, 4096, 1024, 1024]
    - [114, 53473.0]
  - - [128, 128, 144, 64, 128, 128, 64, 64]
    - [119, 15471.0]
  - - [1024, 9, 1, 1024, 1024, 1024, 1024, 1024]
    - [174, 967.0]
  - - [1024, 180, 1, 1024, 1024, 1024, 1024, 1024]
    - [11, 14043.0]
  - - [1024, 1152, 1, 1024, 1024, 1024, 1024, 1024]
    - [118, 36123.0]
  - - [1024, 1152, 1, 4096, 1024, 1024, 4096, 4096]
    - [101, 46532.0]
  - - [4096, 1152, 1, 1024, 4096, 4096, 1024, 1024]
    - [110, 55360.0]
  - - [128, 32768, 1, 256, 128, 128, 256, 256]
    - [29, 36975.0]
  - - [256, 32768, 1, 512, 256, 256, 512, 512]
    - [94, 53633.0]
  - - [512, 32768, 1, 13, 512, 512, 13, 13]
    - [62, 5273.0]
  - - [512, 32768, 1, 1024, 512, 512, 1024, 1024]
    - [62, 59785.0]
  - - [1024, 32768, 1, 479, 1024, 1024, 479, 479]
    - [103, 55838.0]
  - - [1024, 32768, 1, 1024, 1024, 1024, 1024, 1024]
    - [102, 62255.0]
  - - [32768, 1, 1, 256, 32768, 32768, 256, 256]
    - [169, 592.0]
  - - [64, 128, 512, 128, 64, 64, 128, 128]
    - [19, 21509.0]
  - - [128, 128, 512, 64, 128, 128, 64, 64]
    - [30, 22444.0]
  - - [1024, 32, 1, 1024, 1024, 1024, 1024, 131072]
    - [112, 2815.0]
  - - [1024, 4096, 1, 1024, 1024, 1024, 1024, 1024]
    - [54, 52174.0]
  - - [1024, 4096, 1, 4096, 1024, 1024, 4096, 4096]
    - [54, 59520.0]
  - - [4096, 4096, 1, 1024, 4096, 4096, 1024, 1024]
    - [95, 59818.0]
  - - [30528, 4096, 1, 1024, 30528, 30528, 1024, 1024]
    - [95, 63830.0]
  - - [64, 512, 64, 512, 64, 64, 512, 512]
    - [34, 34592.0]
  - - [1024, 4, 1, 1024, 1024, 1024, 1024, 524288]
    - [161, 433.0]
  - - [30528, 2048, 1, 1024, 30528, 30528, 1024, 1024]
    - [62, 63473.0]
  - - [1024, 8192, 1, 1024, 1024, 1024, 1024, 1024]
    - [99, 57389.0]
  - - [1024, 8192, 1, 4096, 1024, 1024, 4096, 4096]
    - [115, 60646.0]
  - - [1024, 9600, 1, 1024, 1024, 1024, 1024, 1024]
    - [95, 61350.0]
  - - [1024, 9600, 1, 4096, 1024, 1024, 4096, 4096]
    - [84, 64735.0]
  - - [4096, 8192, 1, 1024, 4096, 4096, 1024, 1024]
    - [83, 62156.0]
  - - [4096, 9600, 1, 1024, 4096, 4096, 1024, 1024]
    - [95, 63735.0]
  - - [33712, 8192, 1, 1024, 33712, 33712, 1024, 1024]
    - [95, 64113.0]
  - - [33712, 9600, 1, 1024, 33712, 33712, 1024, 1024]
    - [95, 64256.0]
  - - [1024, 10064, 1, 1024, 1024, 1024, 1024, 1024]
    - [105, 59661.0]
  - - [1024, 10064, 1, 4096, 1024, 1024, 4096, 4096]
    - [86, 63694.0]
  - - [1024, 10080, 1, 1024, 1024, 1024, 1024, 1024]
    - [57, 60329.0]
  - - [1024, 10080, 1, 4096, 1024, 1024, 4096, 4096]
    - [54, 63958.0]
  - - [1024, 10200, 1, 1024, 1024, 1024, 1024, 1024]
    - [111, 58612.0]
  - - [1024, 10200, 1, 4096, 1024, 1024, 4096, 4096]
    - [123, 60887.0]
  - - [1024, 3840, 1, 1024, 1024, 1024, 1024, 1024]
    - [95, 57852.0]
  - - [1024, 3840, 1, 4096, 1024, 1024, 4096, 4096]
    - [81, 63510.0]
  - - [1024, 3968, 1, 1024, 1024, 1024, 1024, 1024]
    - [17, 50397.0]
  - - [1024, 3968, 1, 4096, 1024, 1024, 4096, 4096]
    - [71, 57564.0]
  - - [1024, 6528, 1, 1024, 1024, 1024, 1024, 1024]
    - [87, 57005.0]
  - - [1024, 6528, 1, 4096, 1024, 1024, 4096, 4096]
    - [100, 59835.0]
  - - [1024, 7104, 1, 1024, 1024, 1024, 1024, 1024]
    - [83, 58710.0]
  - - [1024, 7104, 1, 4096, 1024, 1024, 4096, 4096]
    - [54, 62872.0]
  - - [1024, 7200, 1, 1024, 1024, 1024, 1024, 1024]
    - [84, 60301.0]
  - - [1024, 7200, 1, 4096, 1024, 1024, 4096, 4096]
    - [84, 64495.0]
  - - [1024, 8064, 1, 1024, 1024, 1024, 1024, 1024]
    - [54, 56918.0]
  - - [1024, 8064, 1, 4096, 1024, 1024, 4096, 4096]
    - [86, 60063.0]
  - - [1024, 8160, 1, 1024, 1024, 1024, 1024, 1024]
    - [54, 57658.0]
  - - [1024, 8160, 1, 4096, 1024, 1024, 4096, 4096]
    - [54, 60821.0]
  - - [1024, 9216, 1, 1024, 1024, 1024, 1024, 1024]
    - [95, 59185.0]
  - - [1024, 9216, 1, 4096, 1024, 1024, 4096, 4096]
    - [95, 62210.0]
  - - [1024, 9520, 1, 1024, 1024, 1024, 1024, 1024]
    - [95, 59250.0]
  - - [1024, 9520, 1, 4096, 1024, 1024, 4096, 4096]
    - [95, 63639.0]
  - - [4096, 10064, 1, 1024, 4096, 4096, 1024, 1024]
    - [86, 62650.0]
  - - [4096, 10080, 1, 1024, 4096, 4096, 1024, 1024]
    - [84, 62787.0]
  - - [4096, 10200, 1, 1024, 4096, 4096, 1024, 1024]
    - [78, 62118.0]
  - - [4096, 3840, 1, 1024, 4096, 4096, 1024, 1024]
    - [95, 62119.0]
  - - [4096, 3968, 1, 1024, 4096, 4096, 1024, 1024]
    - [31, 59815.0]
  - - [4096, 6528, 1, 1024, 4096, 4096, 1024, 1024]
    - [95, 61723.0]
  - - [4096, 7104, 1, 1024, 4096, 4096, 1024, 1024]
    - [95, 62304.0]
  - - [4096, 7200, 1, 1024, 4096, 4096, 1024, 1024]
    - [84, 62977.0]
  - - [4096, 8064, 1, 1024, 4096, 4096, 1024, 1024]
    - [95, 62849.0]
  - - [4096, 8160, 1, 1024, 4096, 4096, 1024, 1024]
    - [102, 62328.0]
  - - [4096, 9216, 1, 1024, 4096, 4096, 1024, 1024]
    - [102, 62330.0]
  - - [4096, 9520, 1, 1024, 4096, 4096, 1024, 1024]
    - [95, 63012.0]
  - - [42720, 10080, 1, 1024, 42720, 42720, 1024, 1024]
    - [95, 64158.0]
  - - [42720, 3968, 1, 1024, 42720, 42720, 1024, 1024]
    - [95, 63655.0]
  - - [42720, 6528, 1, 1024, 42720, 42720, 1024, 1024]
    - [95, 64257.0]
  - - [42720, 7104, 1, 1024, 42720, 42720, 1024, 1024]
    - [102, 63979.0]
  - - [42720, 7200, 1, 1024, 42720, 42720, 1024, 1024]
    - [102, 63965.0]
  - - [42720, 9520, 1, 1024, 42720, 42720, 1024, 1024]
    - [95, 63710.0]
  - - [24, 24, 4736, 64, 24, 24, 303104, 303104]
    - [28, 6736.0]
  - - [32, 32, 4608, 64, 32, 32, 294912, 294912]
    - [55, 8118.0]
  - - [32, 35, 4608, 64, 32, 32, 294912, 294912]
    - [40, 8443.0]
  - - [64, 512, 1, 512, 64, 64, 512, 512]
    - [2, 2076.0]
  - - [512, 512, 1, 64, 512, 512, 64, 64]
    - [58, 3084.0]
  - - [128, 128, 1, 64, 128, 128, 64, 64]
    - [2, 205.0]
  - - [1024, 8, 1, 1024, 1024, 1024, 1024, 131072]
    - [174, 859.0]
  - - [64, 128, 1, 128, 64, 64, 128, 128]
    - [49, 185.0]
  - - [2048, 512, 1, 2048, 2048, 2048, 2048, 2048]
    - [72, 37861.0]
  - - [1024, 512, 1, 1600, 1024, 1024, 1600, 1600]
    - [90, 30482.0]
  - - [2048, 512, 1, 74, 2048, 2048, 74, 74]
    - [76, 7759.0]
  - - [512, 1, 1, 2048, 512, 512, 2048, 2048]
    - [125, 97.0]
  - - [64, 512, 1, 1024, 64, 64, 1024, 1024]
    - [4, 2893.0]
  - - [1024, 1600, 1, 560, 1024, 1024, 560, 560]
    - [99, 31336.0]
  - - [1600, 1, 1, 1024, 1600, 1600, 1024, 1024]
    - [180, 169.0]
  - - [512, 1600, 1, 512, 512, 512, 512, 512]
    - [9, 26479.0]
  - - [1024, 1600, 1, 1024, 1024, 1024, 1024, 1024]
    - [94, 43691.0]
  - - [32, 1600, 1, 512, 32, 32, 512, 512]
    - [11, 3062.0]
  - - [64, 960, 1, 1024, 64, 64, 1024, 1024]
    - [11, 5208.0]
  - - [200, 1, 1, 1024, 200, 200, 1024, 1024]
    - [126, 23.0]
  - - [256, 684, 1, 1024, 256, 256, 1024, 1024]
    - [96, 13502.0]
  - - [256, 1280, 1, 1024, 256, 256, 1024, 1024]
    - [113, 20560.0]
  - - [256, 1536, 1, 1024, 256, 256, 1024, 1024]
    - [108, 24433.0]
  - - [256, 2304, 1, 1024, 256, 256, 1024, 1024]
    - [98, 27859.0]
  - - [256, 2560, 1, 1024, 256, 256, 1024, 1024]
    - [98, 30728.0]
  - - [256, 2816, 1, 1024, 256, 256, 1024, 1024]
    - [98, 33433.0]
  - - [256, 3328, 1, 1024, 256, 256, 1024, 1024]
    - [98, 36718.0]
  - - [256, 3584, 1, 1024, 256, 256, 1024, 1024]
    - [12, 37884.0]
  - - [256, 4608, 1, 1024, 256, 256, 1024, 1024]
    - [45, 35696.0]
  - - [256, 4864, 1, 1024, 256, 256, 1024, 1024]
    - [92, 37502.0]
  - - [256, 5376, 1, 1024, 256, 256, 1024, 1024]
    - [51, 41450.0]
  - - [256, 5888, 1, 1024, 256, 256, 1024, 1024]
    - [94, 40704.0]
  - - [256, 6144, 1, 1024, 256, 256, 1024, 1024]
    - [94, 42207.0]
  - - [256, 6400, 1, 1024, 256, 256, 1024, 1024]
    - [94, 43965.0]
  - - [256, 6656, 1, 1024, 256, 256, 1024, 1024]
    - [99, 45344.0]
  - - [256, 7168, 1, 1024, 256, 256, 1024, 1024]
    - [10, 48329.0]
  - - [256, 7424, 1, 1024, 256, 256, 1024, 1024]
    - [99, 49748.0]
  - - [256, 7936, 1, 1024, 256, 256, 1024, 1024]
    - [98, 43779.0]
  - - [256, 8192, 1, 1024, 256, 256, 1024, 1024]
    - [91, 44889.0]
  - - [256, 8448, 1, 1024, 256, 256, 1024, 1024]
    - [91, 45530.0]
  - - [256, 8960, 1, 1024, 256, 256, 1024, 1024]
    - [91, 47818.0]
  - - [256, 9984, 1, 1024, 256, 256, 1024, 1024]
    - [54, 48040.0]
  - - [256, 10496, 1, 1024, 256, 256, 1024, 1024]
    - [99, 49416.0]
  - - [256, 11264, 1, 1024, 256, 256, 1024, 1024]
    - [93, 51695.0]
  - - [256, 11520, 1, 1024, 256, 256, 1024, 1024]
    - [59, 54788.0]
  - - [256, 11776, 1, 1024, 256, 256, 1024, 1024]
    - [91, 46716.0]
  - - [256, 12544, 1, 1024, 256, 256, 1024, 1024]
    - [91, 48529.0]
  - - [256, 13312, 1, 1024, 256, 256, 1024, 1024]
    - [99, 49795.0]
  - - [256, 14336, 1, 1024, 256, 256, 1024, 1024]
    - [62, 53749.0]
  - - [256, 14592, 1, 1024, 256, 256, 1024, 1024]
    - [62, 54397.0]
  - - [256, 14848, 1, 1024, 256, 256, 1024, 1024]
    - [95, 55604.0]
  - - [256, 15104, 1, 1024, 256, 256, 1024, 1024]
    - [62, 56499.0]
  - - [256, 16128, 1, 1024, 256, 256, 1024, 1024]
    - [53, 53382.0]
  - - [256, 18176, 1, 1024, 256, 256, 1024, 1024]
    - [99, 54995.0]
  - - [256, 18944, 1, 1024, 256, 256, 1024, 1024]
    - [99, 55723.0]
  - - [256, 19200, 1, 1024, 256, 256, 1024, 1024]
    - [84, 58147.0]
  - - [256, 20480, 1, 1024, 256, 256, 1024, 1024]
    - [62, 53346.0]
  - - [256, 20992, 1, 1024, 256, 256, 1024, 1024]
    - [62, 54766.0]
  - - [256, 21248, 1, 1024, 256, 256, 1024, 1024]
    - [95, 55171.0]
  - - [256, 21504, 1, 1024, 256, 256, 1024, 1024]
    - [95, 55968.0]
  - - [256, 22016, 1, 1024, 256, 256, 1024, 1024]
    - [95, 57029.0]
  - - [256, 22344, 1, 1024, 256, 256, 1024, 1024]
    - [99, 55891.0]
  - - [256, 23296, 1, 1024, 256, 256, 1024, 1024]
    - [98, 52249.0]
  - - [256, 23552, 1, 1024, 256, 256, 1024, 1024]
    - [99, 52679.0]
  - - [256, 31488, 1, 1024, 256, 256, 1024, 1024]
    - [24, 55503.0]
  - - [256, 33536, 1, 1024, 256, 256, 1024, 1024]
    - [99, 57807.0]
  - - [256, 44505, 1, 1024, 256, 256, 1024, 1024]
    - [111, 58310.0]
  - - [960, 1, 1, 2048, 960, 960, 2048, 2048]
    - [181, 155.0]
  - - [1024, 200, 1, 560, 1024, 1024, 560, 560]
    - [11, 9190.0]
  - - [1024, 960, 1, 1024, 1024, 1024, 1024, 1024]
    - [100, 40201.0]
  - - [1024, 960, 1, 1600, 1024, 1024, 1600, 1600]
    - [100, 47375.0]
  - - [1024, 32768, 1, 480, 1024, 1024, 480, 480]
    - [42, 60622.0]
  - - [1280, 8976, 1, 256, 1280, 1280, 256, 256]
    - [93, 49751.0]
  - - [1792, 8976, 1, 256, 1792, 1792, 256, 256]
    - [47, 52576.0]
  - - [2048, 114, 1, 512, 2048, 2048, 512, 512]
    - [89, 12050.0]
  - - [2048, 114, 1, 768, 2048, 2048, 768, 768]
    - [89, 15352.0]
  - - [2048, 215, 1, 512, 2048, 2048, 512, 512]
    - [7, 17724.0]
  - - [2048, 215, 1, 768, 2048, 2048, 768, 768]
    - [15, 20421.0]
  - - [2048, 256, 1, 512, 2048, 2048, 512, 512]
    - [41, 19396.0]
  - - [2048, 256, 1, 768, 2048, 2048, 768, 768]
    - [64, 23630.0]
  - - [2048, 512, 1, 67, 2048, 2048, 67, 67]
    - [76, 7380.0]
  - - [2048, 512, 1, 100, 2048, 2048, 100, 100]
    - [76, 10082.0]
  - - [2048, 684, 1, 512, 2048, 2048, 512, 512]
    - [13, 32019.0]
  - - [2048, 684, 1, 768, 2048, 2048, 768, 768]
    - [91, 38096.0]
  - - [2048, 960, 1, 74, 2048, 2048, 74, 74]
    - [79, 12206.0]
  - - [2048, 960, 1, 2048, 2048, 2048, 2048, 2048]
    - [75, 55431.0]
  - - [2048, 1536, 1, 512, 2048, 2048, 512, 512]
    - [91, 43203.0]
  - - [2048, 1536, 1, 768, 2048, 2048, 768, 768]
    - [69, 47708.0]
  - - [2048, 8976, 1, 256, 2048, 2048, 256, 256]
    - [42, 52711.0]
  - - [2304, 8976, 1, 256, 2304, 2304, 256, 256]
    - [42, 53456.0]
  - - [2560, 8976, 1, 256, 2560, 2560, 256, 256]
    - [42, 54508.0]
  - - [2816, 8976, 1, 256, 2816, 2816, 256, 256]
    - [42, 54578.0]
  - - [3072, 8976, 1, 256, 3072, 3072, 256, 256]
    - [42, 55495.0]
  - - [3328, 8976, 1, 256, 3328, 3328, 256, 256]
    - [42, 55738.0]
  - - [3840, 8976, 1, 256, 3840, 3840, 256, 256]
    - [42, 56389.0]
  - - [4096, 8976, 1, 256, 4096, 4096, 256, 256]
    - [42, 55495.0]
  - - [4352, 8976, 1, 256, 4352, 4352, 256, 256]
    - [42, 56588.0]
  - - [4608, 8976, 1, 256, 4608, 4608, 256, 256]
    - [42, 56952.0]
  - - [4864, 8976, 1, 256, 4864, 4864, 256, 256]
    - [42, 57047.0]
  - - [5120, 8976, 1, 256, 5120, 5120, 256, 256]
    - [42, 56671.0]
  - - [5376, 8976, 1, 256, 5376, 5376, 256, 256]
    - [42, 56562.0]
  - - [5632, 8976, 1, 256, 5632, 5632, 256, 256]
    - [42, 56821.0]
  - - [5888, 8976, 1, 256, 5888, 5888, 256, 256]
    - [42, 56905.0]
  - - [6144, 8976, 1, 256, 6144, 6144, 256, 256]
    - [42, 56617.0]
  - - [6400, 8976, 1, 256, 6400, 6400, 256, 256]
    - [93, 57019.0]
  - - [7168, 8976, 1, 256, 7168, 7168, 256, 256]
    - [93, 57159.0]
  - - [7936, 8976, 1, 256, 7936, 7936, 256, 256]
    - [93, 57087.0]
  - - [8192, 8976, 1, 256, 8192, 8192, 256, 256]
    - [70, 56184.0]
  - - [8448, 8976, 1, 256, 8448, 8448, 256, 256]
    - [93, 57135.0]
  - - [8960, 8976, 1, 256, 8960, 8960, 256, 256]
    - [93, 57562.0]
  - - [9472, 8976, 1, 256, 9472, 9472, 256, 256]
    - [93, 57434.0]
  - - [9728, 8976, 1, 256, 9728, 9728, 256, 256]
    - [93, 57624.0]
  - - [9984, 8976, 1, 256, 9984, 9984, 256, 256]
    - [93, 57149.0]
  - - [10240, 8976, 1, 256, 10240, 10240, 256, 256]
    - [93, 57491.0]
  - - [10496, 8976, 1, 256, 10496, 10496, 256, 256]
    - [93, 57611.0]
  - - [11264, 8976, 1, 256, 11264, 11264, 256, 256]
    - [93, 57467.0]
  - - [11776, 8976, 1, 256, 11776, 11776, 256, 256]
    - [93, 57583.0]
  - - [12544, 8976, 1, 256, 12544, 12544, 256, 256]
    - [93, 57446.0]
  - - [13312, 8976, 1, 256, 13312, 13312, 256, 256]
    - [93, 57864.0]
  - - [13568, 8976, 1, 256, 13568, 13568, 256, 256]
    - [93, 57719.0]
  - - [13824, 8976, 1, 256, 13824, 13824, 256, 256]
    - [93, 58051.0]
  - - [15104, 8976, 1, 256, 15104, 15104, 256, 256]
    - [93, 58092.0]
  - - [15360, 8976, 1, 256, 15360, 15360, 256, 256]
    - [93, 57724.0]
  - - [15872, 8976, 1, 256, 15872, 15872, 256, 256]
    - [93, 57686.0]
  - - [16128, 8976, 1, 256, 16128, 16128, 256, 256]
    - [93, 57776.0]
  - - [17152, 8976, 1, 256, 17152, 17152, 256, 256]
    - [93, 58001.0]
  - - [18176, 8976, 1, 256, 18176, 18176, 256, 256]
    - [93, 57982.0]
  - - [18688, 8976, 1, 256, 18688, 18688, 256, 256]
    - [93, 58187.0]
  - - [18944, 8976, 1, 256, 18944, 18944, 256, 256]
    - [93, 57598.0]
  - - [19712, 8976, 1, 256, 19712, 19712, 256, 256]
    - [93, 57964.0]
  - - [19968, 8976, 1, 256, 19968, 19968, 256, 256]
    - [93, 58051.0]
  - - [20480, 8976, 1, 256, 20480, 20480, 256, 256]
    - [93, 58105.0]
  - - [20992, 8976, 1, 256, 20992, 20992, 256, 256]
    - [93, 58279.0]
  - - [21248, 8976, 1, 256, 21248, 21248, 256, 256]
    - [93, 57702.0]
  - - [23552, 8976, 1, 256, 23552, 23552, 256, 256]
    - [93, 58217.0]
  - - [28672, 8976, 1, 256, 28672, 28672, 256, 256]
    - [93, 58062.0]
  - - [31488, 8976, 1, 256, 31488, 31488, 256, 256]
    - [93, 58055.0]
  - - [33536, 8976, 1, 256, 33536, 33536, 256, 256]
    - [93, 58056.0]
  - - [2048, 1024, 1, 2048, 2048, 2048, 2048, 2048]
    - [0, 50937.0]
  - - [2048, 1024, 1, 8192, 2048, 2048, 8192, 8192]
    - [0, 57573.0]
  - - [2048, 2, 1, 2048, 2048, 2048, 2048, 1048576]
    - [171, 617.0]
  - - [30592, 1024, 1, 2048, 30592, 30592, 2048, 2048]
    - [121, 64295.0]
  - - [6144, 1024, 1, 2048, 6144, 6144, 2048, 2048]
    - [18, 57134.0]
  - - [8192, 1024, 1, 2048, 8192, 8192, 2048, 2048]
    - [86, 58900.0]
  - - [1024, 16, 1, 1024, 1024, 1024, 1024, 524288]
    - [175, 1748.0]
  - - [30592, 8192, 1, 1024, 30592, 30592, 1024, 1024]
    - [95, 64193.0]
  - - [3072, 8192, 1, 1024, 3072, 3072, 1024, 1024]
    - [95, 62427.0]
  - - [512, 512, 256, 64, 512, 512, 64, 64]
    - [62, 37596.0]
  - - [64, 512, 256, 512, 64, 64, 512, 512]
    - [44, 41618.0]
  - - [30592, 2048, 1, 1024, 30592, 30592, 1024, 1024]
    - [95, 63642.0]
  - - [3072, 2048, 1, 1024, 3072, 3072, 1024, 1024]
    - [78, 55769.0]
  - - [1024, 8, 1, 1024, 1024, 1024, 1024, 524288]
    - [180, 853.0]
  - - [30592, 4096, 1, 1024, 30592, 30592, 1024, 1024]
    - [95, 64030.0]
  - - [3072, 4096, 1, 1024, 3072, 3072, 1024, 1024]
    - [38, 59941.0]
  - - [64, 512, 128, 512, 64, 64, 512, 512]
    - [34, 38904.0]
  - - [1920, 2048, 1, 2560, 1920, 1920, 2560, 2560]
    - [20, 62046.0]
  - - [2560, 2048, 1, 2560, 2560, 2560, 2560, 2560]
    - [46, 57260.0]
  - - [2560, 2048, 1, 640, 2560, 2560, 640, 640]
    - [61, 50840.0]
  - - [2560, 4, 1, 2560, 2560, 2560, 2560, 1310720]
    - [162, 1707.0]
  - - [7680, 2048, 1, 2560, 7680, 7680, 2560, 2560]
    - [33, 64330.0]
  - - [512, 512, 40, 64, 512, 512, 64, 64]
    - [30, 27504.0]
  - - [64, 512, 40, 512, 64, 64, 512, 512]
    - [64, 30728.0]
  - - [1536, 4096, 1, 1536, 1536, 1536, 1536, 1536]
    - [36, 56792.0]
  - - [1536, 4096, 1, 6144, 1536, 1536, 6144, 6144]
    - [85, 60534.0]
  - - [4608, 4096, 1, 1536, 4608, 4608, 1536, 1536]
    - [102, 62191.0]
  - - [50304, 4096, 1, 1536, 50304, 50304, 1536, 1536]
    - [95, 64814.0]
  - - [6144, 4096, 1, 1536, 6144, 6144, 1536, 1536]
    - [33, 62964.0]
  - - [1024, 1024, 64, 96, 1024, 1024, 96, 96]
    - [43, 48866.0]
  - - [96, 1024, 64, 1024, 96, 96, 1024, 1024]
    - [122, 51131.0]
  - - [1536, 8192, 1, 1536, 1536, 1536, 1536, 1536]
    - [32, 61505.0]
  - - [1536, 8192, 1, 6144, 1536, 1536, 6144, 6144]
    - [65, 63581.0]
  - - [4608, 8192, 1, 1536, 4608, 4608, 1536, 1536]
    - [102, 62936.0]
  - - [50304, 8192, 1, 1536, 50304, 50304, 1536, 1536]
    - [95, 64805.0]
  - - [6144, 8192, 1, 1536, 6144, 6144, 1536, 1536]
    - [95, 63501.0]
  - - [1024, 1024, 128, 96, 1024, 1024, 96, 96]
    - [43, 50824.0]
  - - [96, 1024, 128, 1024, 96, 96, 1024, 1024]
    - [97, 53633.0]
  - - [1024, 16384, 1, 1024, 1024, 1024, 1024, 1024]
    - [62, 59768.0]
  - - [1024, 16384, 1, 4096, 1024, 1024, 4096, 4096]
    - [84, 63156.0]
  - - [3072, 16384, 1, 1024, 3072, 3072, 1024, 1024]
    - [62, 63068.0]
  - - [4096, 16384, 1, 1024, 4096, 4096, 1024, 1024]
    - [102, 63203.0]
  - - [50304, 16384, 1, 1024, 50304, 50304, 1024, 1024]
    - [95, 64388.0]
  - - [1024, 1024, 256, 64, 1024, 1024, 64, 64]
    - [43, 42000.0]
  - - [64, 1024, 256, 1024, 64, 64, 1024, 1024]
    - [44, 48840.0]
  - - [50304, 2048, 1, 1024, 50304, 50304, 1024, 1024]
    - [95, 63389.0]
  - - [1024, 1024, 32, 64, 1024, 1024, 64, 64]
    - [39, 34998.0]
  - - [64, 1024, 32, 1024, 64, 64, 1024, 1024]
    - [34, 40306.0]
  - - [50304, 4096, 1, 1024, 50304, 50304, 1024, 1024]
    - [95, 64128.0]
  - - [1024, 1024, 64, 64, 1024, 1024, 64, 64]
    - [43, 38568.0]
  - - [64, 1024, 64, 1024, 64, 64, 1024, 1024]
    - [113, 43577.0]
  - - [50304, 8192, 1, 1024, 50304, 50304, 1024, 1024]
    - [95, 64358.0]
  - - [1024, 1024, 128, 64, 1024, 1024, 64, 64]
    - [48, 40703.0]
  - - [64, 1024, 128, 1024, 64, 64, 1024, 1024]
    - [50, 47871.0]
  - - [1024, 64, 1, 1024, 1024, 1024, 1024, 131072]
    - [68, 5630.0]
  - - [30528, 8192, 1, 1024, 30528, 30528, 1024, 1024]
    - [95, 64059.0]
  - - [128, 128, 1024, 64, 128, 128, 64, 64]
    - [60, 25762.0]
  - - [64, 128, 1024, 128, 64, 64, 128, 128]
    - [61, 24053.0]
  - - [1024, 3456, 1, 1024, 1024, 1024, 1024, 1024]
    - [35, 51476.0]
  - - [1024, 3456, 1, 480, 1024, 1024, 480, 480]
    - [32, 46873.0]
  - - [1024, 4096, 1, 480, 1024, 1024, 480, 480]
    - [109, 49056.0]
  - - [1024, 6912, 1, 1024, 1024, 1024, 1024, 1024]
    - [54, 57852.0]
  - - [1024, 6912, 1, 480, 1024, 1024, 480, 480]
    - [22, 53893.0]
  - - [1024, 864, 1, 1024, 1024, 1024, 1024, 1024]
    - [69, 35951.0]
  - - [1024, 864, 1, 480, 1024, 1024, 480, 480]
    - [16, 28087.0]
  - - [128, 3456, 1, 256, 128, 128, 256, 256]
    - [89, 13355.0]
  - - [128, 4096, 1, 256, 128, 128, 256, 256]
    - [63, 14463.0]
  - - [128, 55296, 1, 256, 128, 128, 256, 256]
    - [67, 43389.0]
  - - [128, 6912, 1, 256, 128, 128, 256, 256]
    - [9, 20972.0]
  - - [128, 864, 1, 256, 128, 128, 256, 256]
    - [11, 4369.0]
  - - [256, 3456, 1, 512, 256, 256, 512, 512]
    - [9, 30607.0]
  - - [256, 4096, 1, 512, 256, 256, 512, 512]
    - [92, 28079.0]
  - - [256, 55296, 1, 512, 256, 256, 512, 512]
    - [57, 56552.0]
  - - [256, 6912, 1, 512, 256, 256, 512, 512]
    - [94, 40301.0]
  - - [256, 864, 1, 512, 256, 256, 512, 512]
    - [11, 12417.0]
  - - [3456, 1, 1, 256, 3456, 3456, 256, 256]
    - [172, 130.0]
  - - [4096, 1, 1, 256, 4096, 4096, 256, 256]
    - [179, 152.0]
  - - [512, 3456, 1, 1024, 512, 512, 1024, 1024]
    - [10, 47284.0]
  - - [512, 3456, 1, 13, 512, 512, 13, 13]
    - [30, 2338.0]
  - - [512, 4096, 1, 1024, 512, 512, 1024, 1024]
    - [91, 45886.0]
  - - [512, 4096, 1, 13, 512, 512, 13, 13]
    - [26, 2642.0]
  - - [512, 55296, 1, 13, 512, 512, 13, 13]
    - [57, 6462.0]
  - - [512, 6912, 1, 1024, 512, 512, 1024, 1024]
    - [81, 51948.0]
  - - [512, 6912, 1, 13, 512, 512, 13, 13]
    - [110, 3464.0]
  - - [512, 864, 1, 1024, 512, 512, 1024, 1024]
    - [113, 25974.0]
  - - [512, 864, 1, 13, 512, 512, 13, 13]
    - [1, 856.0]
  - - [6912, 1, 1, 256, 6912, 6912, 256, 256]
    - [163, 249.0]
  - - [864, 1, 1, 256, 864, 864, 256, 256]
    - [161, 33.0]
  - - [1024, 32, 1, 1024, 1024, 1024, 1024, 1024]
    - [3, 2853.0]
  - - [30528, 640, 1, 1024, 30528, 30528, 1024, 1024]
    - [95, 61643.0]
  - - [30528, 1280, 1, 1024, 30528, 30528, 1024, 1024]
    - [95, 62788.0]
  - - [1024, 64, 1, 1024, 1024, 1024, 1024, 1024]
    - [5, 5630.0]
  - - [30528, 1600, 1, 1024, 30528, 30528, 1024, 1024]
    - [66, 62722.0]
  - - [1024, 10240, 1, 1024, 1024, 1024, 1024, 1024]
    - [111, 58945.0]
  - - [1024, 80, 1, 1024, 1024, 1024, 1024, 1024]
    - [5, 6809.0]
  - - [4096, 10240, 1, 1024, 4096, 4096, 1024, 1024]
    - [80, 62080.0]
  - - [1024, 10240, 1, 4096, 1024, 1024, 4096, 4096]
    - [100, 61098.0]
  - - [64, 128, 1280, 128, 64, 64, 128, 128]
    - [31, 24245.0]
  - - [128, 128, 1280, 64, 128, 128, 64, 64]
    - [30, 26887.0]
  - - [1024, 10496, 1, 4096, 1024, 1024, 4096, 4096]
    - [53, 62026.0]
  - - [30528, 1640, 1, 1024, 30528, 30528, 1024, 1024]
    - [95, 62699.0]
  - - [1024, 82, 1, 1024, 1024, 1024, 1024, 1024]
    - [5, 6979.0]
  - - [4096, 10496, 1, 1024, 4096, 4096, 1024, 1024]
    - [95, 63412.0]
  - - [1024, 10496, 1, 1024, 1024, 1024, 1024, 1024]
    - [93, 60023.0]
  - - [64, 128, 1312, 128, 64, 64, 128, 128]
    - [91, 24221.0]
  - - [128, 128, 1312, 64, 128, 128, 64, 64]
    - [30, 26744.0]
  - - [30528, 160, 1, 1024, 30528, 30528, 1024, 1024]
    - [66, 53074.0]
  - - [1024, 12, 1, 1024, 1024, 1024, 1024, 1024]
    - [174, 1289.0]
  - - [30528, 240, 1, 1024, 30528, 30528, 1024, 1024]
    - [21, 54972.0]
  - - [1024, 6144, 1, 1024, 1024, 1024, 1024, 1024]
    - [99, 54895.0]
  - - [4096, 6144, 1, 1024, 4096, 4096, 1024, 1024]
    - [95, 62234.0]
  - - [1024, 6144, 1, 4096, 1024, 1024, 4096, 4096]
    - [53, 59476.0]
  - - [64, 512, 192, 512, 64, 64, 512, 512]
    - [99, 40468.0]
  - - [512, 512, 192, 64, 512, 512, 64, 64]
    - [95, 36210.0]
  - - [2, 8, 1, 1024, 2, 2, 1024, 1024]
    - [152, 2.0]
  - - [30522, 77, 1, 1024, 30522, 30522, 1024, 1024]
    - [138, 38469.0]
  - - [30522, 616, 1, 1024, 30522, 30522, 1024, 1024]
    - [147, 58187.0]
  - - [2, 10, 1, 1024, 2, 2, 1024, 1024]
    - [158, 3.0]
  - - [30522, 160, 1, 1024, 30522, 30522, 1024, 1024]
    - [141, 50007.0]
  - - [30522, 200, 1, 1024, 30522, 30522, 1024, 1024]
    - [135, 44675.0]
  - - [2, 39, 1, 1024, 2, 2, 1024, 1024]
    - [157, 10.0]
  - - [30522, 780, 1, 1024, 30522, 30522, 1024, 1024]
    - [144, 59367.0]
  - - [2, 4, 1, 1024, 2, 2, 1024, 1024]
    - [128, 1.0]
  - - [30522, 308, 1, 1024, 30522, 30522, 1024, 1024]
    - [148, 54423.0]
  - - [2, 40, 1, 1024, 2, 2, 1024, 1024]
    - [156, 10.0]
  - - [30522, 800, 1, 1024, 30522, 30522, 1024, 1024]
    - [139, 61020.0]
  - - [2, 41, 1, 1024, 2, 2, 1024, 1024]
    - [156, 10.0]
  - - [30522, 820, 1, 1024, 30522, 30522, 1024, 1024]
    - [148, 59337.0]
  - - [2, 5, 1, 1024, 2, 2, 1024, 1024]
    - [127, 1.0]
  - - [30522, 385, 1, 1024, 30522, 30522, 1024, 1024]
    - [143, 52702.0]
  - - [2, 6, 1, 1024, 2, 2, 1024, 1024]
    - [127, 1.0]
  - - [30522, 462, 1, 1024, 30522, 30522, 1024, 1024]
    - [146, 57814.0]
  - - [2, 9, 1, 1024, 2, 2, 1024, 1024]
    - [151, 2.0]
  - - [30522, 180, 1, 1024, 30522, 30522, 1024, 1024]
    - [149, 49768.0]
  - - [2, 32, 1, 1024, 2, 2, 1024, 1024]
    - [156, 8.0]
  - - [4, 4, 32768, 64, 4, 4, 2097152, 2097152]
    - [170, 853.0]
  - - [4, 4, 38400, 64, 4, 4, 2457600, 2457600]
    - [170, 886.0]
  - - [14, 14, 10880, 64, 14, 14, 696320, 696320]
    - [168, 4623.0]
  - - [15, 14, 10880, 64, 15, 15, 696320, 696320]
    - [170, 4785.0]
  - - [15, 15, 7680, 64, 15, 15, 491520, 491520]
    - [176, 4488.0]
  - - [15, 15, 10880, 64, 15, 15, 696320, 696320]
    - [177, 4983.0]
  - - [17, 15, 7680, 64, 17, 17, 491520, 491520]
    - [133, 3377.0]
  - - [17, 17, 6144, 64, 17, 17, 393216, 393216]
    - [140, 2991.0]
  - - [17, 17, 7680, 64, 17, 17, 491520, 491520]
    - [132, 3754.0]
  - - [21, 17, 6144, 64, 21, 21, 393216, 393216]
    - [133, 3421.0]
  - - [21, 21, 6144, 64, 21, 21, 393216, 393216]
    - [145, 3843.0]
  - - [30, 30, 2048, 64, 30, 30, 131072, 131072]
    - [132, 5585.0]
  - - [30, 31, 2048, 64, 30, 30, 131072, 131072]
    - [130, 5707.0]
  - - [31, 31, 2048, 64, 31, 31, 131072, 131072]
    - [136, 5789.0]
  - - [34, 24, 4736, 64, 34, 34, 303104, 303104]
    - [137, 6810.0]
  - - [34, 34, 4736, 64, 34, 34, 303104, 303104]
    - [129, 6769.0]
  - - [35, 35, 4608, 64, 35, 35, 294912, 294912]
    - [131, 6612.0]
  - - [2, 2048, 1, 1024, 2, 2, 1024, 1024]
    - [171, 441.0]
  - - [2, 1024, 1, 1024, 2, 2, 1024, 1024]
    - [175, 220.0]
  - - [5, 5, 1, 64, 5, 5, 64, 64]
    - [127, 0.0]
  - - [33, 33, 1, 32, 33, 33, 32, 32]
    - [127, 6.0]
  - - [3, 3, 512, 64, 3, 3, 64, 64]
    - [173, 59.0]
  - - [5, 5, 512, 64, 5, 5, 64, 64]
    - [173, 151.0]
  - - [5, 5, 960, 64, 5, 5, 64, 64]
    - [173, 270.0]
  - - [9, 9, 512, 64, 9, 9, 64, 64]
    - [173, 488.0]
  - - [27, 27, 32768, 128, 27, 27, 128, 128]
    - [142, 11426.0]
  - - [33, 33, 1600, 32, 33, 33, 32, 32]
    - [129, 2953.0]
  - - [684, 8976, 1, 256, 684, 684, 256, 256]
    - [134, 39851.0]
  - - [44505, 8976, 1, 256, 44505, 44505, 256, 256]
    - [147, 57471.0]
  - - [2, 2, 1, 2048, 2, 2, 2048, 2048]
    - [150, 1.0]
  - - [2, 16, 1, 1024, 2, 2, 1024, 1024]
    - [155, 4.0]
  - - [2, 4, 1, 2560, 2, 2, 2560, 2560]
    - [153, 2.0]
  - - [2, 64, 1, 1024, 2, 2, 1024, 1024]
    - [156, 15.0]
  - - [2, 80, 1, 1024, 2, 2, 1024, 1024]
    - [159, 20.0]
  - - [2, 82, 1, 1024, 2, 2, 1024, 1024]
    - [158, 20.0]
  - - [2, 12, 1, 1024, 2, 2, 1024, 1024]
    - [154, 3.0]
  - - [2, 1, 1, 1024, 2, 2, 1024, 1024]
    - [160, 0.0]
  - - [1, 4096, 1, 256, 1, 1, 256, 256]
    - [171, 152.0]
  - - [1, 6912, 1, 256, 1, 1, 256, 256]
    - [165, 240.0]
- null
