TRAIN_3.10/logic/arcturus_Cijk_Ailk_Bjlk_HBH.yaml
- {MinimumRequiredVersion: 4.23.0}
- arcturus
- gfx908
- [Device 7380, Device 7388, Device 738c, Device 7390]
    SolutionIndex: 0
    SolutionNameMin: Cijk_Ailk_Bjlk_HBH_MT64x64x16_MI32x32x8x1_SE_AF0EM8_GRVW2_GSU1_SU0_SUS256_SRVW4_VAW2_WG64_4_1_WGM1
    SolutionIndex: 1
    SolutionNameMin: Cijk_Ailk_Bjlk_HBH_MT64x128x16_MI32x32x8x1_SE_AF0EM8_GRVW2_GSU1_SU0_SUS256_SRVW4_VAW2_WG64_4_1_WGM1
    SolutionIndex: 2
    SolutionNameMin: Cijk_Ailk_Bjlk_HBH_MT128x64x16_MI32x32x8x1_SE_AF0EM8_GRVW2_GSU1_SU0_SUS256_SRVW4_VAW2_WG64_4_1_WGM1
    SolutionIndex: 3
    SolutionNameMin: Cijk_Ailk_Bjlk_HBH_MT32x32x16_MI16x16x16x1_SE_AF0EM8_GRVW2_GSU1_SU0_SUS256_SRVW4_VAW2_WG32_8_1_WGM1
    SolutionIndex: 4
    SolutionNameMin: Cijk_Ailk_Bjlk_HBH_MT64x32x16_MI16x16x16x1_SE_AF0EM8_GRVW2_GSU1_SU0_SUS256_SRVW4_VAW2_WG32_8_1_WGM1
    SolutionIndex: 5
    SolutionNameMin: Cijk_Ailk_Bjlk_HBH_MT128x128x32_MI32x32x8x1_SE_AF0EM8_GRVW2_GSU1_SU0_SUS256_SRVW4_VAW2_WG64_4_1_WGM1
    SolutionIndex: 6
    SolutionNameMin: Cijk_Ailk_Bjlk_HBH_MT256x256x32_MI32x32x8x1_SE_AF0EM8_GRVW2_GSU1_SU0_SUS256_SRVW4_VAW2_WG64_4_1_WGM1
    SolutionIndex: 7
    SolutionNameMin: Cijk_Ailk_Bjlk_HBH_MT32x32x32_MI16x16x16x1_SE_AF0EM8_GRVW2_GSU1_SU0_SUS256_SRVW4_VAW2_WG32_8_1_WGM1
    SolutionIndex: 8
    SolutionNameMin: Cijk_Ailk_Bjlk_HBH_MT144x256x32_MI16x16x16x1_SE_AF0EM8_GRVW2_GSU1_SU0_SUS256_SRVW0_VAW2_WG16_16_1_WGM1
    SolutionIndex: 9
    SolutionNameMin: Cijk_Ailk_Bjlk_HBH_MT256x256x16_MI32x32x8x1_SE_AF0EM8_GRVW4_GSU1_SU0_SUS256_SRVW4_VAW2_WG64_4_1_WGM1
    SolutionIndex: 10
    SolutionNameMin: Cijk_Ailk_Bjlk_HBH_MT32x32x16_MI16x16x16x1_SE_AF0EM8_GRVW4_GSU1_SU0_SUS256_SRVW4_VAW2_WG32_8_1_WGM1
    SolutionIndex: 11
    SolutionNameMin: Cijk_Ailk_Bjlk_HBH_MT64x32x16_MI16x16x16x1_SE_AF0EM8_GRVW4_GSU1_SU0_SUS256_SRVW4_VAW2_WG32_8_1_WGM1
    SolutionIndex: 12
    SolutionNameMin: Cijk_Ailk_Bjlk_HBH_MT64x128x32_MI32x32x8x1_SE_AF0EM8_GRVW4_GSU1_SU0_SUS256_SRVW4_VAW2_WG64_4_1_WGM1
    SolutionIndex: 13
    SolutionNameMin: Cijk_Ailk_Bjlk_HBH_MT32x32x32_MI16x16x16x1_SE_AF0EM8_GRVW4_GSU1_SU0_SUS256_SRVW4_VAW2_WG32_8_1_WGM1
    SolutionIndex: 14
    SolutionNameMin: Cijk_Ailk_Bjlk_HBH_MT128x160x32_MI32x32x8x1_SE_AF0EM8_GRVW4_GSU1_SU0_SUS256_SRVW4_VAW2_WG128_2_1_WGM1
    SolutionIndex: 15
    SolutionNameMin: Cijk_Ailk_Bjlk_HBH_MT160x256x32_MI32x32x8x1_SE_AF0EM8_GRVW4_GSU1_SU0_SUS256_SRVW0_VAW2_WG32_8_1_WGM1
    SolutionIndex: 16
    SolutionNameMin: Cijk_Ailk_Bjlk_HBH_MT64x64x16_MI32x32x8x1_SE_AF0EM8_GRVW8_GSU1_SU0_SUS256_SRVW4_VAW2_WG64_4_1_WGM1
    SolutionIndex: 17
    SolutionNameMin: Cijk_Ailk_Bjlk_HBH_MT64x128x16_MI32x32x8x1_SE_AF0EM8_GRVW8_GSU1_SU0_SUS256_SRVW4_VAW2_WG64_4_1_WGM1
    SolutionIndex: 18
    SolutionNameMin: Cijk_Ailk_Bjlk_HBH_MT64x256x16_MI32x32x8x1_SE_AF0EM8_GRVW8_GSU1_SU0_SUS256_SRVW4_VAW2_WG64_4_1_WGM1
    SolutionIndex: 19
    SolutionNameMin: Cijk_Ailk_Bjlk_HBH_MT128x64x16_MI32x32x8x1_SE_AF0EM8_GRVW8_GSU1_SU0_SUS256_SRVW4_VAW2_WG64_4_1_WGM1
    SolutionIndex: 20
    SolutionNameMin: Cijk_Ailk_Bjlk_HBH_MT128x128x16_MI32x32x8x1_SE_AF0EM8_GRVW8_GSU1_SU0_SUS256_SRVW4_VAW2_WG64_4_1_WGM1
    SolutionIndex: 21
    SolutionNameMin: Cijk_Ailk_Bjlk_HBH_MT128x256x16_MI32x32x8x1_SE_AF0EM8_GRVW8_GSU1_SU0_SUS256_SRVW4_VAW2_WG64_4_1_WGM1
    SolutionIndex: 22
    SolutionNameMin: Cijk_Ailk_Bjlk_HBH_MT32x32x16_MI16x16x16x1_SE_AF0EM8_GRVW8_GSU1_SU0_SUS256_SRVW4_VAW2_WG32_8_1_WGM1
    SolutionIndex: 23
    SolutionNameMin: Cijk_Ailk_Bjlk_HBH_MT64x64x32_MI32x32x8x1_SE_AF0EM8_GRVW8_GSU1_SU0_SUS256_SRVW4_VAW2_WG64_4_1_WGM1
    SolutionIndex: 24
    SolutionNameMin: Cijk_Ailk_Bjlk_HBH_MT64x128x32_MI32x32x8x1_SE_AF0EM8_GRVW8_GSU1_SU0_SUS256_SRVW4_VAW2_WG64_4_1_WGM1
    SolutionIndex: 25
    SolutionNameMin: Cijk_Ailk_Bjlk_HBH_MT128x64x32_MI32x32x8x1_SE_AF0EM8_GRVW8_GSU1_SU0_SUS256_SRVW4_VAW2_WG64_4_1_WGM1
    SolutionIndex: 26
    SolutionNameMin: Cijk_Ailk_Bjlk_HBH_MT128x128x32_MI32x32x8x1_SE_AF0EM8_GRVW8_GSU1_SU0_SUS256_SRVW4_VAW2_WG64_4_1_WGM1
    SolutionIndex: 27
    SolutionNameMin: Cijk_Ailk_Bjlk_HBH_MT128x256x32_MI32x32x8x1_SE_AF0EM8_GRVW8_GSU1_SU0_SUS256_SRVW4_VAW2_WG64_4_1_WGM1
    SolutionIndex: 28
    SolutionNameMin: Cijk_Ailk_Bjlk_HBH_MT256x64x32_MI32x32x8x1_SE_AF0EM8_GRVW8_GSU1_SU0_SUS256_SRVW4_VAW2_WG64_4_1_WGM1
    SolutionIndex: 29
    SolutionNameMin: Cijk_Ailk_Bjlk_HBH_MT256x128x32_MI32x32x8x1_SE_AF0EM8_GRVW8_GSU1_SU0_SUS256_SRVW4_VAW2_WG64_4_1_WGM1
    SolutionIndex: 30
    SolutionNameMin: Cijk_Ailk_Bjlk_HBH_MT256x256x32_MI32x32x8x1_SE_AF0EM8_GRVW8_GSU1_SU0_SUS256_SRVW4_VAW2_WG64_4_1_WGM1
    SolutionIndex: 31
    SolutionNameMin: Cijk_Ailk_Bjlk_HBH_MT32x32x32_MI16x16x16x1_SE_AF0EM8_GRVW8_GSU1_SU0_SUS256_SRVW4_VAW2_WG32_8_1_WGM1
    SolutionIndex: 32
    SolutionNameMin: Cijk_Ailk_Bjlk_HBH_MT64x64x64_MI32x32x8x1_SE_AF0EM8_GRVW8_GSU1_SU0_SUS256_SRVW4_VAW2_WG64_4_1_WGM1
    SolutionIndex: 33
    SolutionNameMin: Cijk_Ailk_Bjlk_HBH_MT64x32x64_MI16x16x16x1_SE_AF0EM8_GRVW8_GSU1_SU0_SUS256_SRVW4_VAW2_WG32_8_1_WGM1
    SolutionIndex: 34
    SolutionNameMin: Cijk_Ailk_Bjlk_HBH_MT128x96x64_MI32x32x8x1_SE_AF0EM8_GRVW8_GSU1_SU0_SUS256_SRVW4_VAW2_WG128_2_1_WGM1
    SolutionIndex: 35
    SolutionNameMin: Cijk_Ailk_Bjlk_HBH_MT64x64x16_MI32x32x8x1_SE_AF0EM8_GRVW2_GSU1_SU32_SUS128_SRVW4_VAW2_WG64_4_1_WGM1
    SolutionIndex: 36
    SolutionNameMin: Cijk_Ailk_Bjlk_HBH_MT64x128x16_MI32x32x8x1_SE_AF0EM8_GRVW2_GSU1_SU32_SUS128_SRVW4_VAW2_WG64_4_1_WGM1
    SolutionIndex: 37
    SolutionNameMin: Cijk_Ailk_Bjlk_HBH_MT64x32x16_MI16x16x16x1_SE_AF0EM8_GRVW2_GSU1_SU32_SUS128_SRVW4_VAW2_WG32_8_1_WGM1
    SolutionIndex: 38
    SolutionNameMin: Cijk_Ailk_Bjlk_HBH_MT64x128x16_MI32x32x8x1_SE_AF0EM8_GRVW4_GSU1_SU32_SUS128_SRVW4_VAW2_WG64_4_1_WGM1
    SolutionIndex: 39
    SolutionNameMin: Cijk_Ailk_Bjlk_HBH_MT128x256x32_MI32x32x8x1_SE_AF0EM8_GRVW4_GSU1_SU32_SUS128_SRVW4_VAW2_WG64_4_1_WGM1
    SolutionIndex: 40
    SolutionNameMin: Cijk_Ailk_Bjlk_HBH_MT128x288x32_MI32x32x8x1_SE_AF0EM8_GRVW4_GSU1_SU32_SUS128_SRVW4_VAW2_WG128_2_1_WGM1
    SolutionIndex: 41
    SolutionNameMin: Cijk_Ailk_Bjlk_HBH_MT160x256x32_MI32x32x8x1_SE_AF0EM8_GRVW4_GSU1_SU32_SUS128_SRVW0_VAW2_WG32_8_1_WGM1
    SolutionIndex: 42
    SolutionNameMin: Cijk_Ailk_Bjlk_HBH_MT32x32x64_MI16x16x16x1_SE_AF0EM8_GRVW4_GSU1_SU32_SUS128_SRVW4_VAW2_WG32_8_1_WGM1
    SolutionIndex: 43
    SolutionNameMin: Cijk_Ailk_Bjlk_HBH_MT128x64x16_MI32x32x8x1_SE_AF0EM8_GRVW8_GSU1_SU32_SUS128_SRVW4_VAW2_WG64_4_1_WGM1
    SolutionIndex: 44
    SolutionNameMin: Cijk_Ailk_Bjlk_HBH_MT128x256x16_MI32x32x8x1_SE_AF0EM8_GRVW8_GSU1_SU32_SUS128_SRVW4_VAW2_WG64_4_1_WGM1
    SolutionIndex: 45
    SolutionNameMin: Cijk_Ailk_Bjlk_HBH_MT64x64x32_MI32x32x8x1_SE_AF0EM8_GRVW8_GSU1_SU32_SUS128_SRVW4_VAW2_WG64_4_1_WGM1
    SolutionIndex: 46
    SolutionNameMin: Cijk_Ailk_Bjlk_HBH_MT64x128x32_MI32x32x8x1_SE_AF0EM8_GRVW8_GSU1_SU32_SUS128_SRVW4_VAW2_WG64_4_1_WGM1
    SolutionIndex: 47
    SolutionNameMin: Cijk_Ailk_Bjlk_HBH_MT128x128x32_MI32x32x8x1_SE_AF0EM8_GRVW8_GSU1_SU32_SUS128_SRVW4_VAW2_WG64_4_1_WGM1
    SolutionIndex: 48
    SolutionNameMin: Cijk_Ailk_Bjlk_HBH_MT256x256x32_MI32x32x8x1_SE_AF0EM8_GRVW8_GSU1_SU32_SUS128_SRVW4_VAW2_WG64_4_1_WGM1
    SolutionIndex: 49
    SolutionNameMin: Cijk_Ailk_Bjlk_HBH_MT32x32x64_MI16x16x16x1_SE_AF0EM8_GRVW8_GSU1_SU32_SUS128_SRVW4_VAW2_WG32_8_1_WGM1
    SolutionIndex: 50
    SolutionNameMin: Cijk_Ailk_Bjlk_HBH_MT32x64x64_MI16x16x16x1_SE_AF0EM8_GRVW8_GSU1_SU32_SUS128_SRVW4_VAW2_WG32_8_1_WGM1
    SolutionIndex: 51
    SolutionNameMin: Cijk_Ailk_Bjlk_HBH_MT64x64x16_MI32x32x8x1_SE_AF0EM8_GRVW2_GSU1_SU32_SUS256_SRVW4_VAW2_WG64_4_1_WGM1
    SolutionIndex: 52
    SolutionNameMin: Cijk_Ailk_Bjlk_HBH_MT64x128x16_MI32x32x8x1_SE_AF0EM8_GRVW2_GSU1_SU32_SUS256_SRVW4_VAW2_WG64_4_1_WGM1
    SolutionIndex: 53
    SolutionNameMin: Cijk_Ailk_Bjlk_HBH_MT128x64x16_MI32x32x8x1_SE_AF0EM8_GRVW2_GSU1_SU32_SUS256_SRVW4_VAW2_WG64_4_1_WGM1
    SolutionIndex: 54
    SolutionNameMin: Cijk_Ailk_Bjlk_HBH_MT128x128x16_MI32x32x8x1_SE_AF0EM8_GRVW2_GSU1_SU32_SUS256_SRVW4_VAW2_WG64_4_1_WGM1
    SolutionIndex: 55
    SolutionNameMin: Cijk_Ailk_Bjlk_HBH_MT64x32x16_MI16x16x16x1_SE_AF0EM8_GRVW2_GSU1_SU32_SUS256_SRVW4_VAW2_WG32_8_1_WGM1
    SolutionIndex: 56
    SolutionNameMin: Cijk_Ailk_Bjlk_HBH_MT64x64x32_MI32x32x8x1_SE_AF0EM8_GRVW2_GSU1_SU32_SUS256_SRVW4_VAW2_WG64_4_1_WGM1
    SolutionIndex: 57
    SolutionNameMin: Cijk_Ailk_Bjlk_HBH_MT64x256x16_MI32x32x8x1_SE_AF0EM8_GRVW4_GSU1_SU32_SUS256_SRVW4_VAW2_WG64_4_1_WGM1
    SolutionIndex: 58
    SolutionNameMin: Cijk_Ailk_Bjlk_HBH_MT64x64x32_MI32x32x8x1_SE_AF0EM8_GRVW4_GSU1_SU32_SUS256_SRVW4_VAW2_WG64_4_1_WGM1
    SolutionIndex: 59
    SolutionNameMin: Cijk_Ailk_Bjlk_HBH_MT128x128x64_MI32x32x8x1_SE_AF0EM8_GRVW4_GSU1_SU32_SUS256_SRVW4_VAW2_WG64_4_1_WGM1
    SolutionIndex: 60
    SolutionNameMin: Cijk_Ailk_Bjlk_HBH_MT128x128x16_MI32x32x8x1_SE_AF0EM8_GRVW8_GSU1_SU32_SUS256_SRVW4_VAW2_WG64_4_1_WGM1
    SolutionIndex: 61
    SolutionNameMin: Cijk_Ailk_Bjlk_HBH_MT64x64x32_MI32x32x8x1_SE_AF0EM8_GRVW8_GSU1_SU32_SUS256_SRVW4_VAW2_WG64_4_1_WGM1
    SolutionIndex: 62
    SolutionNameMin: Cijk_Ailk_Bjlk_HBH_MT128x128x32_MI32x32x8x1_SE_AF0EM8_GRVW8_GSU1_SU32_SUS256_SRVW4_VAW2_WG64_4_1_WGM1
    SolutionIndex: 63
    SolutionNameMin: Cijk_Ailk_Bjlk_HBH_MT128x256x32_MI32x32x8x1_SE_AF0EM8_GRVW8_GSU1_SU32_SUS256_SRVW4_VAW2_WG64_4_1_WGM1
    SolutionIndex: 64
    SolutionNameMin: Cijk_Ailk_Bjlk_HBH_MT256x256x32_MI32x32x8x1_SE_AF0EM8_GRVW8_GSU1_SU32_SUS256_SRVW4_VAW2_WG64_4_1_WGM1
    SolutionIndex: 65
    SolutionNameMin: Cijk_Ailk_Bjlk_HBH_MT64x64x64_MI32x32x8x1_SE_AF0EM8_GRVW8_GSU1_SU32_SUS256_SRVW4_VAW2_WG64_4_1_WGM1
    SolutionIndex: 66
    SolutionNameMin: Cijk_Ailk_Bjlk_HBH_MT128x96x64_MI32x32x8x1_SE_AF0EM8_GRVW8_GSU1_SU32_SUS256_SRVW4_VAW2_WG128_2_1_WGM1
    SolutionIndex: 67
    SolutionNameMin: Cijk_Ailk_Bjlk_HBH_MT64x64x16_MI32x32x8x1_SE_AF0EM8_GRVW2_GSU1_SU0_SUS256_SRVW4_VAW2_WG64_4_1_WGM2
    SolutionIndex: 68
    SolutionNameMin: Cijk_Ailk_Bjlk_HBH_MT64x128x16_MI32x32x8x1_SE_AF0EM8_GRVW2_GSU1_SU0_SUS256_SRVW4_VAW2_WG64_4_1_WGM2
    SolutionIndex: 69
    SolutionNameMin: Cijk_Ailk_Bjlk_HBH_MT128x96x16_MI32x32x8x1_SE_AF0EM8_GRVW2_GSU1_SU0_SUS256_SRVW4_VAW2_WG128_2_1_WGM2
    SolutionIndex: 70
    SolutionNameMin: Cijk_Ailk_Bjlk_HBH_MT128x64x32_MI32x32x8x1_SE_AF0EM8_GRVW2_GSU1_SU0_SUS256_SRVW4_VAW2_WG64_4_1_WGM2
    SolutionIndex: 71
    SolutionNameMin: Cijk_Ailk_Bjlk_HBH_MT64x64x16_MI32x32x8x1_SE_AF0EM8_GRVW4_GSU1_SU0_SUS256_SRVW4_VAW2_WG64_4_1_WGM2
    SolutionIndex: 72
    SolutionNameMin: Cijk_Ailk_Bjlk_HBH_MT64x128x16_MI32x32x8x1_SE_AF0EM8_GRVW4_GSU1_SU0_SUS256_SRVW4_VAW2_WG64_4_1_WGM2
    SolutionIndex: 73
    SolutionNameMin: Cijk_Ailk_Bjlk_HBH_MT128x64x16_MI32x32x8x1_SE_AF0EM8_GRVW4_GSU1_SU0_SUS256_SRVW4_VAW2_WG64_4_1_WGM2
    SolutionIndex: 74
    SolutionNameMin: Cijk_Ailk_Bjlk_HBH_MT128x256x16_MI32x32x8x1_SE_AF0EM8_GRVW4_GSU1_SU0_SUS256_SRVW4_VAW2_WG64_4_1_WGM2
    SolutionIndex: 75
    SolutionNameMin: Cijk_Ailk_Bjlk_HBH_MT64x64x32_MI32x32x8x1_SE_AF0EM8_GRVW4_GSU1_SU0_SUS256_SRVW4_VAW2_WG64_4_1_WGM2
    SolutionIndex: 76
    SolutionNameMin: Cijk_Ailk_Bjlk_HBH_MT128x64x32_MI32x32x8x1_SE_AF0EM8_GRVW4_GSU1_SU0_SUS256_SRVW4_VAW2_WG64_4_1_WGM2
    SolutionIndex: 77
    SolutionNameMin: Cijk_Ailk_Bjlk_HBH_MT128x288x32_MI32x32x8x1_SE_AF0EM8_GRVW4_GSU1_SU0_SUS256_SRVW4_VAW2_WG128_2_1_WGM2
    SolutionIndex: 78
    SolutionNameMin: Cijk_Ailk_Bjlk_HBH_MT256x160x32_MI32x32x8x1_SE_AF0EM8_GRVW4_GSU1_SU0_SUS256_SRVW4_VAW2_WG128_2_1_WGM2
    SolutionIndex: 79
    SolutionNameMin: Cijk_Ailk_Bjlk_HBH_MT64x128x16_MI32x32x8x1_SE_AF0EM8_GRVW8_GSU1_SU0_SUS256_SRVW4_VAW2_WG64_4_1_WGM2
    SolutionIndex: 80
    SolutionNameMin: Cijk_Ailk_Bjlk_HBH_MT64x256x16_MI32x32x8x1_SE_AF0EM8_GRVW8_GSU1_SU0_SUS256_SRVW4_VAW2_WG64_4_1_WGM2
    SolutionIndex: 81
    SolutionNameMin: Cijk_Ailk_Bjlk_HBH_MT128x256x16_MI32x32x8x1_SE_AF0EM8_GRVW8_GSU1_SU0_SUS256_SRVW4_VAW2_WG64_4_1_WGM2
    SolutionIndex: 82
    SolutionNameMin: Cijk_Ailk_Bjlk_HBH_MT256x256x16_MI32x32x8x1_SE_AF0EM8_GRVW8_GSU1_SU0_SUS256_SRVW4_VAW2_WG64_4_1_WGM2
    SolutionIndex: 83
    SolutionNameMin: Cijk_Ailk_Bjlk_HBH_MT128x64x32_MI32x32x8x1_SE_AF0EM8_GRVW8_GSU1_SU0_SUS256_SRVW4_VAW2_WG64_4_1_WGM2
    SolutionIndex: 84
    SolutionNameMin: Cijk_Ailk_Bjlk_HBH_MT128x128x32_MI32x32x8x1_SE_AF0EM8_GRVW8_GSU1_SU0_SUS256_SRVW4_VAW2_WG64_4_1_WGM2
    SolutionIndex: 85
    SolutionNameMin: Cijk_Ailk_Bjlk_HBH_MT256x128x32_MI32x32x8x1_SE_AF0EM8_GRVW8_GSU1_SU0_SUS256_SRVW4_VAW2_WG64_4_1_WGM2
    SolutionIndex: 86
    SolutionNameMin: Cijk_Ailk_Bjlk_HBH_MT256x256x32_MI32x32x8x1_SE_AF0EM8_GRVW8_GSU1_SU0_SUS256_SRVW4_VAW2_WG64_4_1_WGM2
    SolutionIndex: 87
    SolutionNameMin: Cijk_Ailk_Bjlk_HBH_MT64x64x64_MI32x32x8x1_SE_AF0EM8_GRVW8_GSU1_SU0_SUS256_SRVW4_VAW2_WG64_4_1_WGM2
    SolutionIndex: 88
    SolutionNameMin: Cijk_Ailk_Bjlk_HBH_MT128x128x64_MI32x32x8x1_SE_AF0EM8_GRVW8_GSU1_SU0_SUS256_SRVW4_VAW2_WG64_4_1_WGM2
    SolutionIndex: 89
    SolutionNameMin: Cijk_Ailk_Bjlk_HBH_MT128x96x64_MI32x32x8x1_SE_AF0EM8_GRVW8_GSU1_SU0_SUS256_SRVW4_VAW2_WG128_2_1_WGM2
    SolutionIndex: 90
    SolutionNameMin: Cijk_Ailk_Bjlk_HBH_MT128x64x16_MI32x32x8x1_SE_AF0EM8_GRVW2_GSU1_SU32_SUS128_SRVW4_VAW2_WG64_4_1_WGM2
    SolutionIndex: 91
    SolutionNameMin: Cijk_Ailk_Bjlk_HBH_MT64x32x16_MI16x16x16x1_SE_AF0EM8_GRVW2_GSU1_SU32_SUS128_SRVW4_VAW2_WG32_8_1_WGM2
    SolutionIndex: 92
    SolutionNameMin: Cijk_Ailk_Bjlk_HBH_MT128x96x16_MI32x32x8x1_SE_AF0EM8_GRVW2_GSU1_SU32_SUS128_SRVW4_VAW2_WG128_2_1_WGM2
    SolutionIndex: 93
    SolutionNameMin: Cijk_Ailk_Bjlk_HBH_MT128x256x16_MI32x32x8x1_SE_AF0EM8_GRVW4_GSU1_SU32_SUS128_SRVW4_VAW2_WG64_4_1_WGM2
    SolutionIndex: 94
    SolutionNameMin: Cijk_Ailk_Bjlk_HBH_MT256x256x16_MI32x32x8x1_SE_AF0EM8_GRVW4_GSU1_SU32_SUS128_SRVW4_VAW2_WG64_4_1_WGM2
    SolutionIndex: 95
    SolutionNameMin: Cijk_Ailk_Bjlk_HBH_MT64x32x16_MI16x16x16x1_SE_AF0EM8_GRVW4_GSU1_SU32_SUS128_SRVW4_VAW2_WG32_8_1_WGM2
    SolutionIndex: 96
    SolutionNameMin: Cijk_Ailk_Bjlk_HBH_MT256x160x32_MI32x32x8x1_SE_AF0EM8_GRVW4_GSU1_SU32_SUS128_SRVW4_VAW2_WG128_2_1_WGM2
    SolutionIndex: 97
    SolutionNameMin: Cijk_Ailk_Bjlk_HBH_MT64x64x64_MI32x32x8x1_SE_AF0EM8_GRVW4_GSU1_SU32_SUS128_SRVW4_VAW2_WG64_4_1_WGM2
    SolutionIndex: 98
    SolutionNameMin: Cijk_Ailk_Bjlk_HBH_MT64x64x16_MI32x32x8x1_SE_AF0EM8_GRVW8_GSU1_SU32_SUS128_SRVW4_VAW2_WG64_4_1_WGM2
    SolutionIndex: 99
    SolutionNameMin: Cijk_Ailk_Bjlk_HBH_MT128x256x16_MI32x32x8x1_SE_AF0EM8_GRVW8_GSU1_SU32_SUS128_SRVW4_VAW2_WG64_4_1_WGM2
    SolutionIndex: 100
    SolutionNameMin: Cijk_Ailk_Bjlk_HBH_MT64x128x32_MI32x32x8x1_SE_AF0EM8_GRVW8_GSU1_SU32_SUS128_SRVW4_VAW2_WG64_4_1_WGM2
    SolutionIndex: 101
    SolutionNameMin: Cijk_Ailk_Bjlk_HBH_MT128x256x32_MI32x32x8x1_SE_AF0EM8_GRVW8_GSU1_SU32_SUS128_SRVW4_VAW2_WG64_4_1_WGM2
    SolutionIndex: 102
    SolutionNameMin: Cijk_Ailk_Bjlk_HBH_MT256x128x32_MI32x32x8x1_SE_AF0EM8_GRVW8_GSU1_SU32_SUS128_SRVW4_VAW2_WG64_4_1_WGM2
    SolutionIndex: 103
    SolutionNameMin: Cijk_Ailk_Bjlk_HBH_MT64x32x64_MI16x16x16x1_SE_AF0EM8_GRVW8_GSU1_SU32_SUS128_SRVW4_VAW2_WG32_8_1_WGM2
    SolutionIndex: 104
    SolutionNameMin: Cijk_Ailk_Bjlk_HBH_MT128x96x64_MI32x32x8x1_SE_AF0EM8_GRVW8_GSU1_SU32_SUS128_SRVW4_VAW2_WG128_2_1_WGM2
    SolutionIndex: 105
    SolutionNameMin: Cijk_Ailk_Bjlk_HBH_MT64x64x16_MI32x32x8x1_SE_AF0EM8_GRVW2_GSU1_SU32_SUS256_SRVW4_VAW2_WG64_4_1_WGM2
    SolutionIndex: 106
    SolutionNameMin: Cijk_Ailk_Bjlk_HBH_MT32x64x16_MI16x16x16x1_SE_AF0EM8_GRVW2_GSU1_SU32_SUS256_SRVW4_VAW2_WG32_8_1_WGM2
    SolutionIndex: 107
    SolutionNameMin: Cijk_Ailk_Bjlk_HBH_MT64x32x16_MI16x16x16x1_SE_AF0EM8_GRVW2_GSU1_SU32_SUS256_SRVW4_VAW2_WG32_8_1_WGM2
    SolutionIndex: 108
    SolutionNameMin: Cijk_Ailk_Bjlk_HBH_MT64x64x32_MI32x32x8x1_SE_AF0EM8_GRVW2_GSU1_SU32_SUS256_SRVW4_VAW2_WG64_4_1_WGM2
    SolutionIndex: 109
    SolutionNameMin: Cijk_Ailk_Bjlk_HBH_MT128x64x16_MI32x32x8x1_SE_AF0EM8_GRVW4_GSU1_SU32_SUS256_SRVW4_VAW2_WG64_4_1_WGM2
    SolutionIndex: 110
    SolutionNameMin: Cijk_Ailk_Bjlk_HBH_MT64x64x32_MI32x32x8x1_SE_AF0EM8_GRVW4_GSU1_SU32_SUS256_SRVW4_VAW2_WG64_4_1_WGM2
    SolutionIndex: 111
    SolutionNameMin: Cijk_Ailk_Bjlk_HBH_MT256x160x32_MI32x32x8x1_SE_AF0EM8_GRVW4_GSU1_SU32_SUS256_SRVW4_VAW2_WG128_2_1_WGM2
    SolutionIndex: 112
    SolutionNameMin: Cijk_Ailk_Bjlk_HBH_MT128x256x16_MI32x32x8x1_SE_AF0EM8_GRVW8_GSU1_SU32_SUS256_SRVW4_VAW2_WG64_4_1_WGM2
    SolutionIndex: 113
    SolutionNameMin: Cijk_Ailk_Bjlk_HBH_MT64x128x32_MI32x32x8x1_SE_AF0EM8_GRVW8_GSU1_SU32_SUS256_SRVW4_VAW2_WG64_4_1_WGM2
    SolutionIndex: 114
    SolutionNameMin: Cijk_Ailk_Bjlk_HBH_MT128x128x32_MI32x32x8x1_SE_AF0EM8_GRVW8_GSU1_SU32_SUS256_SRVW4_VAW2_WG64_4_1_WGM2
    SolutionIndex: 115
    SolutionNameMin: Cijk_Ailk_Bjlk_HBH_MT128x96x64_MI32x32x8x1_SE_AF0EM8_GRVW8_GSU1_SU32_SUS256_SRVW4_VAW2_WG128_2_1_WGM2
    SolutionIndex: 116
    SolutionNameMin: Cijk_Ailk_Bjlk_HBH_MT64x64x16_MI32x32x8x1_SE_AF0EM8_GRVW2_GSU1_SU0_SUS256_SRVW4_VAW2_WG64_4_1_WGM15
    SolutionIndex: 117
    SolutionNameMin: Cijk_Ailk_Bjlk_HBH_MT64x128x16_MI32x32x8x1_SE_AF0EM8_GRVW2_GSU1_SU0_SUS256_SRVW4_VAW2_WG64_4_1_WGM15
    SolutionIndex: 118
    SolutionNameMin: Cijk_Ailk_Bjlk_HBH_MT128x64x16_MI32x32x8x1_SE_AF0EM8_GRVW2_GSU1_SU0_SUS256_SRVW4_VAW2_WG64_4_1_WGM15
    SolutionIndex: 119
    SolutionNameMin: Cijk_Ailk_Bjlk_HBH_MT64x64x32_MI32x32x8x1_SE_AF0EM8_GRVW2_GSU1_SU0_SUS256_SRVW4_VAW2_WG64_4_1_WGM15
    SolutionIndex: 120
    SolutionNameMin: Cijk_Ailk_Bjlk_HBH_MT128x288x32_MI32x32x8x1_SE_AF0EM8_GRVW2_GSU1_SU0_SUS256_SRVW4_VAW2_WG128_2_1_WGM15
    SolutionIndex: 121
    SolutionNameMin: Cijk_Ailk_Bjlk_HBH_MT256x144x32_MI16x16x16x1_SE_AF0EM8_GRVW2_GSU1_SU0_SUS256_SRVW4_VAW2_WG64_4_1_WGM15
    SolutionIndex: 122
    SolutionNameMin: Cijk_Ailk_Bjlk_HBH_MT64x64x16_MI32x32x8x1_SE_AF0EM8_GRVW4_GSU1_SU0_SUS256_SRVW4_VAW2_WG64_4_1_WGM15
    SolutionIndex: 123
    SolutionNameMin: Cijk_Ailk_Bjlk_HBH_MT64x128x16_MI32x32x8x1_SE_AF0EM8_GRVW4_GSU1_SU0_SUS256_SRVW4_VAW2_WG64_4_1_WGM15
    SolutionIndex: 124
    SolutionNameMin: Cijk_Ailk_Bjlk_HBH_MT128x64x16_MI32x32x8x1_SE_AF0EM8_GRVW4_GSU1_SU0_SUS256_SRVW4_VAW2_WG64_4_1_WGM15
    SolutionIndex: 125
    SolutionNameMin: Cijk_Ailk_Bjlk_HBH_MT64x64x32_MI32x32x8x1_SE_AF0EM8_GRVW4_GSU1_SU0_SUS256_SRVW4_VAW2_WG64_4_1_WGM15
    SolutionIndex: 126
    SolutionNameMin: Cijk_Ailk_Bjlk_HBH_MT256x128x32_MI32x32x8x1_SE_AF0EM8_GRVW4_GSU1_SU0_SUS256_SRVW4_VAW2_WG64_4_1_WGM15
    SolutionIndex: 127
    SolutionNameMin: Cijk_Ailk_Bjlk_HBH_MT128x288x32_MI32x32x8x1_SE_AF0EM8_GRVW4_GSU1_SU0_SUS256_SRVW4_VAW2_WG128_2_1_WGM15
    SolutionIndex: 128
    SolutionNameMin: Cijk_Ailk_Bjlk_HBH_MT128x160x32_MI32x32x8x1_SE_AF0EM8_GRVW4_GSU1_SU0_SUS256_SRVW4_VAW2_WG128_2_1_WGM15
    SolutionIndex: 129
    SolutionNameMin: Cijk_Ailk_Bjlk_HBH_MT256x160x32_MI32x32x8x1_SE_AF0EM8_GRVW4_GSU1_SU0_SUS256_SRVW4_VAW2_WG128_2_1_WGM15
    SolutionIndex: 130
    SolutionNameMin: Cijk_Ailk_Bjlk_HBH_MT128x64x16_MI32x32x8x1_SE_AF0EM8_GRVW8_GSU1_SU0_SUS256_SRVW4_VAW2_WG64_4_1_WGM15
    SolutionIndex: 131
    SolutionNameMin: Cijk_Ailk_Bjlk_HBH_MT128x256x16_MI32x32x8x1_SE_AF0EM8_GRVW8_GSU1_SU0_SUS256_SRVW4_VAW2_WG64_4_1_WGM15
    SolutionIndex: 132
    SolutionNameMin: Cijk_Ailk_Bjlk_HBH_MT256x256x16_MI32x32x8x1_SE_AF0EM8_GRVW8_GSU1_SU0_SUS256_SRVW4_VAW2_WG64_4_1_WGM15
    SolutionIndex: 133
    SolutionNameMin: Cijk_Ailk_Bjlk_HBH_MT64x32x16_MI16x16x16x1_SE_AF0EM8_GRVW8_GSU1_SU0_SUS256_SRVW4_VAW2_WG32_8_1_WGM15
    SolutionIndex: 134
    SolutionNameMin: Cijk_Ailk_Bjlk_HBH_MT64x64x32_MI32x32x8x1_SE_AF0EM8_GRVW8_GSU1_SU0_SUS256_SRVW4_VAW2_WG64_4_1_WGM15
    SolutionIndex: 135
    SolutionNameMin: Cijk_Ailk_Bjlk_HBH_MT64x128x32_MI32x32x8x1_SE_AF0EM8_GRVW8_GSU1_SU0_SUS256_SRVW4_VAW2_WG64_4_1_WGM15
    SolutionIndex: 136
    SolutionNameMin: Cijk_Ailk_Bjlk_HBH_MT64x256x32_MI32x32x8x1_SE_AF0EM8_GRVW8_GSU1_SU0_SUS256_SRVW4_VAW2_WG64_4_1_WGM15
    SolutionIndex: 137
    SolutionNameMin: Cijk_Ailk_Bjlk_HBH_MT128x64x32_MI32x32x8x1_SE_AF0EM8_GRVW8_GSU1_SU0_SUS256_SRVW4_VAW2_WG64_4_1_WGM15
    SolutionIndex: 138
    SolutionNameMin: Cijk_Ailk_Bjlk_HBH_MT128x128x32_MI32x32x8x1_SE_AF0EM8_GRVW8_GSU1_SU0_SUS256_SRVW4_VAW2_WG64_4_1_WGM15
    SolutionIndex: 139
    SolutionNameMin: Cijk_Ailk_Bjlk_HBH_MT128x256x32_MI32x32x8x1_SE_AF0EM8_GRVW8_GSU1_SU0_SUS256_SRVW4_VAW2_WG64_4_1_WGM15
    SolutionIndex: 140
    SolutionNameMin: Cijk_Ailk_Bjlk_HBH_MT256x128x32_MI32x32x8x1_SE_AF0EM8_GRVW8_GSU1_SU0_SUS256_SRVW4_VAW2_WG64_4_1_WGM15
    SolutionIndex: 141
    SolutionNameMin: Cijk_Ailk_Bjlk_HBH_MT256x256x32_MI32x32x8x1_SE_AF0EM8_GRVW8_GSU1_SU0_SUS256_SRVW4_VAW2_WG64_4_1_WGM15
    SolutionIndex: 142
    SolutionNameMin: Cijk_Ailk_Bjlk_HBH_MT64x64x64_MI32x32x8x1_SE_AF0EM8_GRVW8_GSU1_SU0_SUS256_SRVW4_VAW2_WG64_4_1_WGM15
    SolutionIndex: 143
    SolutionNameMin: Cijk_Ailk_Bjlk_HBH_MT64x128x64_MI32x32x8x1_SE_AF0EM8_GRVW8_GSU1_SU0_SUS256_SRVW4_VAW2_WG64_4_1_WGM15
    SolutionIndex: 144
    SolutionNameMin: Cijk_Ailk_Bjlk_HBH_MT128x64x64_MI32x32x8x1_SE_AF0EM8_GRVW8_GSU1_SU0_SUS256_SRVW4_VAW2_WG64_4_1_WGM15
    SolutionIndex: 145
    SolutionNameMin: Cijk_Ailk_Bjlk_HBH_MT32x32x64_MI16x16x16x1_SE_AF0EM8_GRVW8_GSU1_SU0_SUS256_SRVW4_VAW2_WG32_8_1_WGM15
    SolutionIndex: 146
    SolutionNameMin: Cijk_Ailk_Bjlk_HBH_MT128x96x64_MI32x32x8x1_SE_AF0EM8_GRVW8_GSU1_SU0_SUS256_SRVW4_VAW2_WG128_2_1_WGM15
    SolutionIndex: 147
    SolutionNameMin: Cijk_Ailk_Bjlk_HBH_MT64x64x16_MI32x32x8x1_SE_AF0EM8_GRVW2_GSU1_SU32_SUS128_SRVW4_VAW2_WG64_4_1_WGM15
    SolutionIndex: 148
    SolutionNameMin: Cijk_Ailk_Bjlk_HBH_MT64x32x16_MI16x16x16x1_SE_AF0EM8_GRVW2_GSU1_SU32_SUS128_SRVW4_VAW2_WG32_8_1_WGM15
    SolutionIndex: 149
    SolutionNameMin: Cijk_Ailk_Bjlk_HBH_MT256x144x32_MI16x16x16x1_SE_AF0EM8_GRVW2_GSU1_SU32_SUS128_SRVW4_VAW2_WG64_4_1_WGM15
    SolutionIndex: 150
    SolutionNameMin: Cijk_Ailk_Bjlk_HBH_MT144x256x32_MI16x16x16x1_SE_AF0EM8_GRVW2_GSU1_SU32_SUS128_SRVW0_VAW2_WG16_16_1_WGM15
    SolutionIndex: 151
    SolutionNameMin: Cijk_Ailk_Bjlk_HBH_MT256x256x16_MI32x32x8x1_SE_AF0EM8_GRVW4_GSU1_SU32_SUS128_SRVW4_VAW2_WG64_4_1_WGM15
    SolutionIndex: 152
    SolutionNameMin: Cijk_Ailk_Bjlk_HBH_MT256x160x32_MI32x32x8x1_SE_AF0EM8_GRVW4_GSU1_SU32_SUS128_SRVW4_VAW2_WG128_2_1_WGM15
    SolutionIndex: 153
    SolutionNameMin: Cijk_Ailk_Bjlk_HBH_MT160x256x32_MI32x32x8x1_SE_AF0EM8_GRVW4_GSU1_SU32_SUS128_SRVW0_VAW2_WG32_8_1_WGM15
    SolutionIndex: 154
    SolutionNameMin: Cijk_Ailk_Bjlk_HBH_MT128x256x16_MI32x32x8x1_SE_AF0EM8_GRVW8_GSU1_SU32_SUS128_SRVW4_VAW2_WG64_4_1_WGM15
    SolutionIndex: 155
    SolutionNameMin: Cijk_Ailk_Bjlk_HBH_MT64x32x16_MI16x16x16x1_SE_AF0EM8_GRVW8_GSU1_SU32_SUS128_SRVW4_VAW2_WG32_8_1_WGM15
    SolutionIndex: 156
    SolutionNameMin: Cijk_Ailk_Bjlk_HBH_MT64x128x32_MI32x32x8x1_SE_AF0EM8_GRVW8_GSU1_SU32_SUS128_SRVW4_VAW2_WG64_4_1_WGM15
    SolutionIndex: 157
    SolutionNameMin: Cijk_Ailk_Bjlk_HBH_MT128x128x32_MI32x32x8x1_SE_AF0EM8_GRVW8_GSU1_SU32_SUS128_SRVW4_VAW2_WG64_4_1_WGM15
    SolutionIndex: 158
    SolutionNameMin: Cijk_Ailk_Bjlk_HBH_MT128x256x32_MI32x32x8x1_SE_AF0EM8_GRVW8_GSU1_SU32_SUS128_SRVW4_VAW2_WG64_4_1_WGM15
    SolutionIndex: 159
    SolutionNameMin: Cijk_Ailk_Bjlk_HBH_MT256x128x32_MI32x32x8x1_SE_AF0EM8_GRVW8_GSU1_SU32_SUS128_SRVW4_VAW2_WG64_4_1_WGM15
    SolutionIndex: 160
    SolutionNameMin: Cijk_Ailk_Bjlk_HBH_MT64x128x64_MI32x32x8x1_SE_AF0EM8_GRVW8_GSU1_SU32_SUS128_SRVW4_VAW2_WG64_4_1_WGM15
    SolutionIndex: 161
    SolutionNameMin: Cijk_Ailk_Bjlk_HBH_MT96x128x64_MI32x32x8x1_SE_AF0EM8_GRVW8_GSU1_SU32_SUS128_SRVW0_VAW2_WG32_8_1_WGM15
    SolutionIndex: 162
    SolutionNameMin: Cijk_Ailk_Bjlk_HBH_MT64x64x16_MI32x32x8x1_SE_AF0EM8_GRVW2_GSU1_SU32_SUS256_SRVW4_VAW2_WG64_4_1_WGM15
    SolutionIndex: 163
    SolutionNameMin: Cijk_Ailk_Bjlk_HBH_MT64x32x16_MI16x16x16x1_SE_AF0EM8_GRVW2_GSU1_SU32_SUS256_SRVW4_VAW2_WG32_8_1_WGM15
    SolutionIndex: 164
    SolutionNameMin: Cijk_Ailk_Bjlk_HBH_MT256x144x32_MI16x16x16x1_SE_AF0EM8_GRVW2_GSU1_SU32_SUS256_SRVW4_VAW2_WG64_4_1_WGM15
    SolutionIndex: 165
    SolutionNameMin: Cijk_Ailk_Bjlk_HBH_MT64x64x32_MI32x32x8x1_SE_AF0EM8_GRVW4_GSU1_SU32_SUS256_SRVW4_VAW2_WG64_4_1_WGM15
    SolutionIndex: 166
    SolutionNameMin: Cijk_Ailk_Bjlk_HBH_MT256x160x32_MI32x32x8x1_SE_AF0EM8_GRVW4_GSU1_SU32_SUS256_SRVW4_VAW2_WG128_2_1_WGM15
    SolutionIndex: 167
    SolutionNameMin: Cijk_Ailk_Bjlk_HBH_MT64x64x16_MI32x32x8x1_SE_AF0EM8_GRVW8_GSU1_SU32_SUS256_SRVW4_VAW2_WG64_4_1_WGM15
    SolutionIndex: 168
    SolutionNameMin: Cijk_Ailk_Bjlk_HBH_MT128x256x16_MI32x32x8x1_SE_AF0EM8_GRVW8_GSU1_SU32_SUS256_SRVW4_VAW2_WG64_4_1_WGM15
    SolutionIndex: 169
    SolutionNameMin: Cijk_Ailk_Bjlk_HBH_MT32x64x16_MI16x16x16x1_SE_AF0EM8_GRVW8_GSU1_SU32_SUS256_SRVW4_VAW2_WG32_8_1_WGM15
    SolutionIndex: 170
    SolutionNameMin: Cijk_Ailk_Bjlk_HBH_MT64x64x32_MI32x32x8x1_SE_AF0EM8_GRVW8_GSU1_SU32_SUS256_SRVW4_VAW2_WG64_4_1_WGM15
    SolutionIndex: 171
    SolutionNameMin: Cijk_Ailk_Bjlk_HBH_MT64x128x32_MI32x32x8x1_SE_AF0EM8_GRVW8_GSU1_SU32_SUS256_SRVW4_VAW2_WG64_4_1_WGM15
    SolutionIndex: 172
    SolutionNameMin: Cijk_Ailk_Bjlk_HBH_MT256x128x32_MI32x32x8x1_SE_AF0EM8_GRVW8_GSU1_SU32_SUS256_SRVW4_VAW2_WG64_4_1_WGM15
    SolutionIndex: 173
    SolutionNameMin: Cijk_Ailk_Bjlk_HBH_MT64x64x64_MI32x32x8x1_SE_AF0EM8_GRVW8_GSU1_SU32_SUS256_SRVW4_VAW2_WG64_4_1_WGM15
    SolutionIndex: 174
    SolutionNameMin: Cijk_Ailk_Bjlk_HBH_MT64x128x64_MI32x32x8x1_SE_AF0EM8_GRVW8_GSU1_SU32_SUS256_SRVW4_VAW2_WG64_4_1_WGM15
    SolutionIndex: 175
    SolutionNameMin: Cijk_Ailk_Bjlk_HBH_MT128x96x64_MI32x32x8x1_SE_AF0EM8_GRVW8_GSU1_SU32_SUS256_SRVW4_VAW2_WG128_2_1_WGM15
    SolutionIndex: 176
    SolutionNameMin: Cijk_Ailk_Bjlk_HBH_MT32x64x16_MI16x16x16x1_SE_AF0EM8_GRVW2_GSU1_SU0_SUS256_SRVW4_VAW2_WG32_8_1_WGM1
    SolutionIndex: 177
    SolutionNameMin: Cijk_Ailk_Bjlk_HBH_MT128x256x32_MI32x32x8x1_SE_AF0EM8_GRVW2_GSU1_SU0_SUS256_SRVW4_VAW2_WG64_4_1_WGM1
    SolutionIndex: 178
    SolutionNameMin: Cijk_Ailk_Bjlk_HBH_MT128x256x16_MI32x32x8x1_SE_AF0EM8_GRVW8_GSU1_SU0_SUS256_SRVW4_VAW2_WG64_4_1_WGM1
    SolutionIndex: 179
    SolutionNameMin: Cijk_Ailk_Bjlk_HBH_MT256x256x16_MI32x32x8x1_SE_AF0EM8_GRVW8_GSU1_SU0_SUS256_SRVW4_VAW2_WG64_4_1_WGM1
    SolutionIndex: 180
    SolutionNameMin: Cijk_Ailk_Bjlk_HBH_MT128x256x16_MI32x32x8x1_SE_AF0EM8_GRVW8_GSU1_SU32_SUS128_SRVW4_VAW2_WG64_4_1_WGM1
    SolutionIndex: 181
    SolutionNameMin: Cijk_Ailk_Bjlk_HBH_MT256x256x16_MI32x32x8x1_SE_AF0EM8_GRVW8_GSU1_SU32_SUS128_SRVW4_VAW2_WG64_4_1_WGM1
    SolutionIndex: 182
    SolutionNameMin: Cijk_Ailk_Bjlk_HBH_MT128x256x32_MI32x32x8x1_SE_AF0EM8_GRVW2_GSU1_SU32_SUS256_SRVW4_VAW2_WG64_4_1_WGM1
    SolutionIndex: 183
    SolutionNameMin: Cijk_Ailk_Bjlk_HBH_MT128x256x16_MI32x32x8x1_SE_AF0EM8_GRVW8_GSU1_SU32_SUS256_SRVW4_VAW2_WG64_4_1_WGM1
    SolutionIndex: 184
    SolutionNameMin: Cijk_Ailk_Bjlk_HBH_MT128x256x16_MI32x32x8x1_SE_AF0EM8_GRVW8_GSU1_SU0_SUS256_SRVW4_VAW2_WG64_4_1_WGM2
    SolutionIndex: 185
    SolutionNameMin: Cijk_Ailk_Bjlk_HBH_MT128x256x16_MI32x32x8x1_SE_AF0EM8_GRVW2_GSU1_SU32_SUS128_SRVW4_VAW2_WG64_4_1_WGM2
    SolutionIndex: 186
    SolutionNameMin: Cijk_Ailk_Bjlk_HBH_MT64x32x16_MI16x16x16x1_SE_AF0EM8_GRVW2_GSU1_SU32_SUS128_SRVW4_VAW2_WG32_8_1_WGM2
    SolutionIndex: 187
    SolutionNameMin: Cijk_Ailk_Bjlk_HBH_MT64x32x16_MI16x16x16x1_SE_AF0EM8_GRVW2_GSU1_SU32_SUS256_SRVW4_VAW2_WG32_8_1_WGM2
    SolutionIndex: 188
    SolutionNameMin: Cijk_Ailk_Bjlk_HBH_MT128x256x32_MI32x32x8x1_SE_AF0EM8_GRVW2_GSU1_SU0_SUS256_SRVW4_VAW2_WG64_4_1_WGM15
    SolutionIndex: 189
    SolutionNameMin: Cijk_Ailk_Bjlk_HBH_MT128x288x32_MI32x32x8x1_SE_AF0EM8_GRVW2_GSU1_SU0_SUS256_SRVW4_VAW2_WG128_2_1_WGM15
    SolutionIndex: 190
    SolutionNameMin: Cijk_Ailk_Bjlk_HBH_MT256x256x16_MI32x32x8x1_SE_AF0EM8_GRVW8_GSU1_SU0_SUS256_SRVW4_VAW2_WG64_4_1_WGM15
    SolutionIndex: 191
    SolutionNameMin: Cijk_Ailk_Bjlk_HBH_MT64x32x16_MI16x16x16x1_SE_AF0EM8_GRVW8_GSU1_SU0_SUS256_SRVW4_VAW2_WG32_8_1_WGM15
    SolutionIndex: 192
    SolutionNameMin: Cijk_Ailk_Bjlk_HBH_MT256x256x16_MI32x32x8x1_SE_AF0EM8_GRVW4_GSU1_SU32_SUS128_SRVW4_VAW2_WG64_4_1_WGM15
    SolutionIndex: 193
    SolutionNameMin: Cijk_Ailk_Bjlk_HBH_MT128x256x16_MI32x32x8x1_SE_AF0EM8_GRVW8_GSU1_SU32_SUS128_SRVW4_VAW2_WG64_4_1_WGM15
    SolutionIndex: 194
    SolutionNameMin: Cijk_Ailk_Bjlk_HBH_MT128x288x32_MI32x32x8x1_SE_AF0EM8_GRVW2_GSU1_SU32_SUS256_SRVW4_VAW2_WG128_2_1_WGM15
    SolutionIndex: 195
    SolutionNameMin: Cijk_Ailk_Bjlk_HBH_MT256x160x32_MI32x32x8x1_SE_AF0EM8_GRVW4_GSU2_SU0_SUS256_SRVW0_VAW1_WG128_2_1_WGM1
    SolutionIndex: 196
    SolutionNameMin: Cijk_Ailk_Bjlk_HBH_MT128x288x32_MI32x32x8x1_SE_AF0EM8_GRVW4_GSU2_SU0_SUS256_SRVW0_VAW1_WG128_2_1_WGM2
    SolutionIndex: 197
    SolutionNameMin: Cijk_Ailk_Bjlk_HBH_MT256x160x32_MI32x32x8x1_SE_AF0EM8_GRVW4_GSU2_SU0_SUS256_SRVW0_VAW1_WG128_2_1_WGM2
    SolutionIndex: 198
    SolutionNameMin: Cijk_Ailk_Bjlk_HBH_MT128x128x64_MI32x32x8x1_SE_AF0EM8_GRVW8_GSU2_SU0_SUS256_SRVW0_VAW1_WG64_4_1_WGM2
    SolutionIndex: 199
    SolutionNameMin: Cijk_Ailk_Bjlk_HBH_MT256x160x32_MI32x32x8x1_SE_AF0EM8_GRVW4_GSU2_SU32_SUS256_SRVW0_VAW1_WG128_2_1_WGM2
    SolutionIndex: 200
    SolutionNameMin: Cijk_Ailk_Bjlk_HBH_MT256x160x32_MI32x32x8x1_SE_AF0EM8_GRVW4_GSU2_SU0_SUS256_SRVW0_VAW1_WG128_2_1_WGM15
    SolutionIndex: 201
    SolutionNameMin: Cijk_Ailk_Bjlk_HBH_MT128x256x32_MI32x32x8x1_SE_AF0EM8_GRVW8_GSU2_SU0_SUS256_SRVW0_VAW1_WG64_4_1_WGM15
    SolutionIndex: 202
    SolutionNameMin: Cijk_Ailk_Bjlk_HBH_MT128x288x32_MI32x32x8x1_SE_AF0EM8_GRVW4_GSU3_SU0_SUS256_SRVW0_VAW1_WG128_2_1_WGM1
    SolutionIndex: 203
    SolutionNameMin: Cijk_Ailk_Bjlk_HBH_MT128x256x32_MI32x32x8x1_SE_AF0EM8_GRVW8_GSU3_SU0_SUS256_SRVW0_VAW1_WG64_4_1_WGM1
    SolutionIndex: 204
    SolutionNameMin: Cijk_Ailk_Bjlk_HBH_MT128x128x64_MI32x32x8x1_SE_AF0EM8_GRVW8_GSU3_SU0_SUS256_SRVW0_VAW1_WG64_4_1_WGM1
    SolutionIndex: 205
    SolutionNameMin: Cijk_Ailk_Bjlk_HBH_MT96x96x64_MI16x16x16x1_SE_AF0EM8_GRVW8_GSU3_SU0_SUS256_SRVW0_VAW1_WG32_8_1_WGM1
    SolutionIndex: 206
    SolutionNameMin: Cijk_Ailk_Bjlk_HBH_MT128x256x32_MI32x32x8x1_SE_AF0EM8_GRVW8_GSU3_SU32_SUS128_SRVW0_VAW1_WG64_4_1_WGM1
    SolutionIndex: 207
    SolutionNameMin: Cijk_Ailk_Bjlk_HBH_MT256x128x32_MI32x32x8x1_SE_AF0EM8_GRVW8_GSU3_SU32_SUS128_SRVW0_VAW1_WG64_4_1_WGM1
    SolutionIndex: 208
    SolutionNameMin: Cijk_Ailk_Bjlk_HBH_MT256x256x16_MI32x32x8x1_SE_AF0EM8_GRVW4_GSU3_SU32_SUS256_SRVW0_VAW1_WG64_4_1_WGM1
    SolutionIndex: 209
    SolutionNameMin: Cijk_Ailk_Bjlk_HBH_MT64x32x32_MI16x16x16x1_SE_AF0EM8_GRVW4_GSU3_SU32_SUS256_SRVW0_VAW1_WG32_8_1_WGM1
    SolutionIndex: 210
    SolutionNameMin: Cijk_Ailk_Bjlk_HBH_MT256x128x32_MI32x32x8x1_SE_AF0EM8_GRVW8_GSU3_SU32_SUS256_SRVW0_VAW1_WG64_4_1_WGM1
    SolutionIndex: 211
    SolutionNameMin: Cijk_Ailk_Bjlk_HBH_MT128x128x64_MI32x32x8x1_SE_AF0EM8_GRVW8_GSU3_SU32_SUS256_SRVW0_VAW1_WG64_4_1_WGM1
    SolutionIndex: 212
    SolutionNameMin: Cijk_Ailk_Bjlk_HBH_MT96x128x64_MI32x32x8x1_SE_AF0EM8_GRVW2_GSU3_SU0_SUS256_SRVW0_VAW1_WG32_8_1_WGM2
    SolutionIndex: 213
    SolutionNameMin: Cijk_Ailk_Bjlk_HBH_MT128x288x32_MI32x32x8x1_SE_AF0EM8_GRVW4_GSU3_SU0_SUS256_SRVW0_VAW1_WG128_2_1_WGM2
    SolutionIndex: 214
    SolutionNameMin: Cijk_Ailk_Bjlk_HBH_MT128x256x32_MI32x32x8x1_SE_AF0EM8_GRVW8_GSU3_SU0_SUS256_SRVW0_VAW1_WG64_4_1_WGM2
    SolutionIndex: 215
    SolutionNameMin: Cijk_Ailk_Bjlk_HBH_MT256x128x32_MI32x32x8x1_SE_AF0EM8_GRVW8_GSU3_SU0_SUS256_SRVW0_VAW1_WG64_4_1_WGM2
    SolutionIndex: 216
    SolutionNameMin: Cijk_Ailk_Bjlk_HBH_MT32x32x64_MI16x16x16x1_SE_AF0EM8_GRVW8_GSU3_SU0_SUS256_SRVW0_VAW1_WG32_8_1_WGM2
    SolutionIndex: 217
    SolutionNameMin: Cijk_Ailk_Bjlk_HBH_MT256x256x16_MI32x32x8x1_SE_AF0EM8_GRVW4_GSU3_SU32_SUS128_SRVW0_VAW1_WG64_4_1_WGM2
    SolutionIndex: 218
    SolutionNameMin: Cijk_Ailk_Bjlk_HBH_MT256x128x32_MI32x32x8x1_SE_AF0EM8_GRVW8_GSU3_SU32_SUS128_SRVW0_VAW1_WG64_4_1_WGM2
    SolutionIndex: 219
    SolutionNameMin: Cijk_Ailk_Bjlk_HBH_MT256x160x32_MI32x32x8x1_SE_AF0EM8_GRVW4_GSU3_SU32_SUS256_SRVW0_VAW1_WG128_2_1_WGM2
    SolutionIndex: 220
    SolutionNameMin: Cijk_Ailk_Bjlk_HBH_MT32x32x64_MI16x16x16x1_SE_AF0EM8_GRVW2_GSU3_SU0_SUS256_SRVW0_VAW1_WG32_8_1_WGM15
    SolutionIndex: 221
    SolutionNameMin: Cijk_Ailk_Bjlk_HBH_MT32x32x32_MI16x16x16x1_SE_AF0EM8_GRVW4_GSU3_SU0_SUS256_SRVW0_VAW1_WG32_8_1_WGM15
    SolutionIndex: 222
    SolutionNameMin: Cijk_Ailk_Bjlk_HBH_MT256x160x32_MI32x32x8x1_SE_AF0EM8_GRVW4_GSU3_SU0_SUS256_SRVW0_VAW1_WG128_2_1_WGM15
    SolutionIndex: 223
    SolutionNameMin: Cijk_Ailk_Bjlk_HBH_MT256x256x16_MI32x32x8x1_SE_AF0EM8_GRVW8_GSU3_SU0_SUS256_SRVW0_VAW1_WG64_4_1_WGM15
    SolutionIndex: 224
    SolutionNameMin: Cijk_Ailk_Bjlk_HBH_MT128x256x32_MI32x32x8x1_SE_AF0EM8_GRVW8_GSU3_SU0_SUS256_SRVW0_VAW1_WG64_4_1_WGM15
    SolutionIndex: 225
    SolutionNameMin: Cijk_Ailk_Bjlk_HBH_MT256x128x32_MI32x32x8x1_SE_AF0EM8_GRVW8_GSU3_SU0_SUS256_SRVW0_VAW1_WG64_4_1_WGM15
    SolutionIndex: 226
    SolutionNameMin: Cijk_Ailk_Bjlk_HBH_MT128x128x64_MI32x32x8x1_SE_AF0EM8_GRVW8_GSU3_SU0_SUS256_SRVW0_VAW1_WG64_4_1_WGM15
    SolutionIndex: 227
    SolutionNameMin: Cijk_Ailk_Bjlk_HBH_MT128x256x32_MI32x32x8x1_SE_AF0EM8_GRVW4_GSU3_SU32_SUS128_SRVW0_VAW1_WG64_4_1_WGM15
    SolutionIndex: 228
    SolutionNameMin: Cijk_Ailk_Bjlk_HBH_MT128x128x32_MI32x32x8x1_SE_AF0EM8_GRVW8_GSU3_SU32_SUS128_SRVW0_VAW1_WG64_4_1_WGM15
    SolutionIndex: 229
    SolutionNameMin: Cijk_Ailk_Bjlk_HBH_MT32x32x64_MI16x16x16x1_SE_AF0EM8_GRVW8_GSU5_SU0_SUS256_SRVW0_VAW1_WG32_8_1_WGM1
    SolutionIndex: 230
    SolutionNameMin: Cijk_Ailk_Bjlk_HBH_MT96x128x64_MI32x32x8x1_SE_AF0EM8_GRVW8_GSU5_SU0_SUS256_SRVW0_VAW1_WG32_8_1_WGM1
    SolutionIndex: 231
    SolutionNameMin: Cijk_Ailk_Bjlk_HBH_MT128x256x32_MI32x32x8x1_SE_AF0EM8_GRVW8_GSU5_SU32_SUS128_SRVW0_VAW1_WG64_4_1_WGM1
    SolutionIndex: 232
    SolutionNameMin: Cijk_Ailk_Bjlk_HBH_MT256x160x32_MI32x32x8x1_SE_AF0EM8_GRVW4_GSU5_SU0_SUS256_SRVW0_VAW1_WG128_2_1_WGM2
    SolutionIndex: 233
    SolutionNameMin: Cijk_Ailk_Bjlk_HBH_MT96x128x64_MI32x32x8x1_SE_AF0EM8_GRVW4_GSU5_SU0_SUS256_SRVW0_VAW1_WG32_8_1_WGM2
    SolutionIndex: 234
    SolutionNameMin: Cijk_Ailk_Bjlk_HBH_MT32x32x64_MI16x16x16x1_SE_AF0EM8_GRVW2_GSU5_SU0_SUS256_SRVW0_VAW1_WG32_8_1_WGM15
    SolutionIndex: 235
    SolutionNameMin: Cijk_Ailk_Bjlk_HBH_MT96x128x64_MI32x32x8x1_SE_AF0EM8_GRVW8_GSU5_SU32_SUS128_SRVW0_VAW1_WG32_8_1_WGM15
    SolutionIndex: 236
    SolutionNameMin: Cijk_Ailk_Bjlk_HBH_MT96x128x64_MI32x32x8x1_SE_AF0EM8_GRVW8_GSU5_SU32_SUS256_SRVW0_VAW1_WG32_8_1_WGM15
    SolutionIndex: 237
    SolutionNameMin: Cijk_Ailk_Bjlk_HBH_MT64x64x64_MI32x32x8x1_SE_AF0EM8_GRVW2_GSU7_SU0_SUS256_SRVW0_VAW1_WG64_4_1_WGM1
    SolutionIndex: 238
    SolutionNameMin: Cijk_Ailk_Bjlk_HBH_MT128x128x64_MI32x32x8x1_SE_AF0EM8_GRVW2_GSU7_SU0_SUS256_SRVW0_VAW1_WG64_4_1_WGM1
    SolutionIndex: 239
    SolutionNameMin: Cijk_Ailk_Bjlk_HBH_MT32x32x64_MI16x16x16x1_SE_AF0EM8_GRVW2_GSU7_SU0_SUS256_SRVW0_VAW1_WG32_8_1_WGM1
    SolutionIndex: 240
    SolutionNameMin: Cijk_Ailk_Bjlk_HBH_MT128x256x32_MI32x32x8x1_SE_AF0EM8_GRVW4_GSU7_SU0_SUS256_SRVW0_VAW1_WG64_4_1_WGM1
    SolutionIndex: 241
    SolutionNameMin: Cijk_Ailk_Bjlk_HBH_MT128x160x32_MI32x32x8x1_SE_AF0EM8_GRVW4_GSU7_SU0_SUS256_SRVW0_VAW1_WG128_2_1_WGM1
    SolutionIndex: 242
    SolutionNameMin: Cijk_Ailk_Bjlk_HBH_MT128x128x64_MI32x32x8x1_SE_AF0EM8_GRVW4_GSU7_SU0_SUS256_SRVW0_VAW1_WG64_4_1_WGM1
    SolutionIndex: 243
    SolutionNameMin: Cijk_Ailk_Bjlk_HBH_MT128x128x64_MI32x32x8x1_SE_AF0EM8_GRVW8_GSU7_SU0_SUS256_SRVW0_VAW1_WG64_4_1_WGM1
    SolutionIndex: 244
    SolutionNameMin: Cijk_Ailk_Bjlk_HBH_MT256x256x16_MI32x32x8x1_SE_AF0EM8_GRVW4_GSU7_SU32_SUS128_SRVW0_VAW1_WG64_4_1_WGM1
    SolutionIndex: 245
    SolutionNameMin: Cijk_Ailk_Bjlk_HBH_MT128x64x64_MI32x32x8x1_SE_AF0EM8_GRVW8_GSU7_SU32_SUS128_SRVW0_VAW1_WG64_4_1_WGM1
    SolutionIndex: 246
    SolutionNameMin: Cijk_Ailk_Bjlk_HBH_MT128x128x64_MI32x32x8x1_SE_AF0EM8_GRVW8_GSU7_SU32_SUS128_SRVW0_VAW1_WG64_4_1_WGM1
    SolutionIndex: 247
    SolutionNameMin: Cijk_Ailk_Bjlk_HBH_MT128x128x64_MI32x32x8x1_SE_AF0EM8_GRVW8_GSU7_SU32_SUS256_SRVW0_VAW1_WG64_4_1_WGM1
    SolutionIndex: 248
    SolutionNameMin: Cijk_Ailk_Bjlk_HBH_MT128x128x64_MI32x32x8x1_SE_AF0EM8_GRVW4_GSU7_SU0_SUS256_SRVW0_VAW1_WG64_4_1_WGM2
    SolutionIndex: 249
    SolutionNameMin: Cijk_Ailk_Bjlk_HBH_MT128x128x64_MI32x32x8x1_SE_AF0EM8_GRVW8_GSU7_SU0_SUS256_SRVW0_VAW1_WG64_4_1_WGM2
    SolutionIndex: 250
    SolutionNameMin: Cijk_Ailk_Bjlk_HBH_MT256x256x16_MI32x32x8x1_SE_AF0EM8_GRVW4_GSU7_SU32_SUS128_SRVW0_VAW1_WG64_4_1_WGM2
    SolutionIndex: 251
    SolutionNameMin: Cijk_Ailk_Bjlk_HBH_MT64x128x64_MI32x32x8x1_SE_AF0EM8_GRVW8_GSU7_SU32_SUS128_SRVW0_VAW1_WG64_4_1_WGM2
    SolutionIndex: 252
    SolutionNameMin: Cijk_Ailk_Bjlk_HBH_MT128x128x64_MI32x32x8x1_SE_AF0EM8_GRVW8_GSU7_SU32_SUS128_SRVW0_VAW1_WG64_4_1_WGM2
    SolutionIndex: 253
    SolutionNameMin: Cijk_Ailk_Bjlk_HBH_MT128x64x64_MI32x32x8x1_SE_AF0EM8_GRVW8_GSU7_SU32_SUS256_SRVW0_VAW1_WG64_4_1_WGM2
    SolutionIndex: 254
    SolutionNameMin: Cijk_Ailk_Bjlk_HBH_MT128x128x64_MI32x32x8x1_SE_AF0EM8_GRVW8_GSU7_SU32_SUS256_SRVW0_VAW1_WG64_4_1_WGM2
    SolutionIndex: 255
    SolutionNameMin: Cijk_Ailk_Bjlk_HBH_MT256x256x16_MI32x32x8x1_SE_AF0EM8_GRVW8_GSU7_SU0_SUS256_SRVW0_VAW1_WG64_4_1_WGM15
    SolutionIndex: 256
    SolutionNameMin: Cijk_Ailk_Bjlk_HBH_MT256x128x32_MI32x32x8x1_SE_AF0EM8_GRVW8_GSU7_SU0_SUS256_SRVW0_VAW1_WG64_4_1_WGM15
    SolutionIndex: 257
    SolutionNameMin: Cijk_Ailk_Bjlk_HBH_MT256x256x32_MI32x32x8x1_SE_AF0EM8_GRVW8_GSU7_SU0_SUS256_SRVW0_VAW1_WG64_4_1_WGM15
    SolutionIndex: 258
    SolutionNameMin: Cijk_Ailk_Bjlk_HBH_MT32x32x64_MI16x16x16x1_SE_AF0EM8_GRVW2_GSU7_SU32_SUS128_SRVW0_VAW1_WG32_8_1_WGM15
    SolutionIndex: 259
    SolutionNameMin: Cijk_Ailk_Bjlk_HBH_MT256x128x32_MI32x32x8x1_SE_AF0EM8_GRVW8_GSU7_SU32_SUS128_SRVW0_VAW1_WG64_4_1_WGM15
    SolutionIndex: 260
    SolutionNameMin: Cijk_Ailk_Bjlk_HBH_MT256x256x32_MI32x32x8x1_SE_AF0EM8_GRVW8_GSU7_SU32_SUS128_SRVW0_VAW1_WG64_4_1_WGM15
    SolutionIndex: 261
    SolutionNameMin: Cijk_Ailk_Bjlk_HBH_MT128x128x64_MI32x32x8x1_SE_AF0EM8_GRVW8_GSU7_SU32_SUS128_SRVW0_VAW1_WG64_4_1_WGM15
    SolutionIndex: 262
    SolutionNameMin: Cijk_Ailk_Bjlk_HBH_MT32x32x64_MI16x16x16x1_SE_AF0EM8_GRVW2_GSU7_SU32_SUS256_SRVW0_VAW1_WG32_8_1_WGM15
    SolutionIndex: 263
    SolutionNameMin: Cijk_Ailk_Bjlk_HBH_MT256x256x16_MI32x32x8x1_SE_AF0EM8_GRVW4_GSU7_SU32_SUS256_SRVW0_VAW1_WG64_4_1_WGM15
    SolutionIndex: 264
    SolutionNameMin: Cijk_Ailk_Bjlk_HBH_MT256x256x32_MI32x32x8x1_SE_AF0EM8_GRVW8_GSU7_SU32_SUS256_SRVW0_VAW1_WG64_4_1_WGM15
    SolutionIndex: 265
    SolutionNameMin: Cijk_Ailk_Bjlk_HBH_MT256x256x16_MI32x32x8x1_SE_AF0EM8_GRVW8_GSU7_SU0_SUS256_SRVW0_VAW1_WG64_4_1_WGM15
    SolutionIndex: 266
    SolutionNameMin: Cijk_Ailk_Bjlk_HBH_MT256x128x32_MI32x32x8x1_SE_AF0EM8_GRVW8_GSU15_SU0_SUS256_SRVW0_VAW1_WG64_4_1_WGM1
    SolutionIndex: 267
    SolutionNameMin: Cijk_Ailk_Bjlk_HBH_MT64x64x64_MI32x32x8x1_SE_AF0EM8_GRVW8_GSU15_SU0_SUS256_SRVW0_VAW1_WG64_4_1_WGM1
    SolutionIndex: 268
    SolutionNameMin: Cijk_Ailk_Bjlk_HBH_MT64x64x64_MI32x32x8x1_SE_AF0EM8_GRVW8_GSU15_SU32_SUS128_SRVW0_VAW1_WG64_4_1_WGM1
    SolutionIndex: 269
    SolutionNameMin: Cijk_Ailk_Bjlk_HBH_MT64x64x64_MI32x32x8x1_SE_AF0EM8_GRVW8_GSU15_SU32_SUS256_SRVW0_VAW1_WG64_4_1_WGM1
    SolutionIndex: 270
    SolutionNameMin: Cijk_Ailk_Bjlk_HBH_MT128x256x32_MI32x32x8x1_SE_AF0EM8_GRVW8_GSU15_SU0_SUS256_SRVW0_VAW1_WG64_4_1_WGM2
    SolutionIndex: 271
    SolutionNameMin: Cijk_Ailk_Bjlk_HBH_MT256x128x32_MI32x32x8x1_SE_AF0EM8_GRVW8_GSU15_SU0_SUS256_SRVW0_VAW1_WG64_4_1_WGM2
    SolutionIndex: 272
    SolutionNameMin: Cijk_Ailk_Bjlk_HBH_MT64x64x64_MI32x32x8x1_SE_AF0EM8_GRVW8_GSU15_SU0_SUS256_SRVW0_VAW1_WG64_4_1_WGM2
    SolutionIndex: 273
    SolutionNameMin: Cijk_Ailk_Bjlk_HBH_MT256x256x16_MI32x32x8x1_SE_AF0EM8_GRVW4_GSU15_SU0_SUS256_SRVW0_VAW1_WG64_4_1_WGM15
    SolutionIndex: 274
    SolutionNameMin: Cijk_Ailk_Bjlk_HBH_MT128x128x32_MI32x32x8x1_SE_AF0EM8_GRVW8_GSU15_SU0_SUS256_SRVW0_VAW1_WG64_4_1_WGM15
    SolutionIndex: 275
    SolutionNameMin: Cijk_Ailk_Bjlk_HBH_MT256x128x32_MI32x32x8x1_SE_AF0EM8_GRVW8_GSU15_SU0_SUS256_SRVW0_VAW1_WG64_4_1_WGM15
    SolutionIndex: 276
    SolutionNameMin: Cijk_Ailk_Bjlk_HBH_MT128x128x64_MI32x32x8x1_SE_AF0EM8_GRVW8_GSU15_SU0_SUS256_SRVW0_VAW1_WG64_4_1_WGM15
    SolutionIndex: 277
    SolutionNameMin: Cijk_Ailk_Bjlk_HBH_MT64x64x16_MI32x32x8x1_SE_AF0EM1_GRVW2_GSU1_SU0_SUS256_SRVW4_VAW2_WG64_4_1_WGM1
    SolutionIndex: 278
    SolutionNameMin: Cijk_Ailk_Bjlk_HBH_MT32x64x16_MI16x16x16x1_SE_AF0EM1_GRVW2_GSU1_SU0_SUS256_SRVW4_VAW2_WG32_8_1_WGM1
    SolutionIndex: 279
    SolutionNameMin: Cijk_Ailk_Bjlk_HBH_MT64x32x16_MI16x16x16x1_SE_AF0EM1_GRVW2_GSU1_SU0_SUS256_SRVW4_VAW2_WG32_8_1_WGM1
    SolutionIndex: 280
    SolutionNameMin: Cijk_Ailk_Bjlk_HBH_MT128x96x16_MI32x32x8x1_SE_AF0EM1_GRVW2_GSU1_SU0_SUS256_SRVW4_VAW2_WG128_2_1_WGM1
    SolutionIndex: 281
    SolutionNameMin: Cijk_Ailk_Bjlk_HBH_MT128x96x32_MI32x32x8x1_SE_AF0EM1_GRVW2_GSU1_SU0_SUS256_SRVW4_VAW2_WG128_2_1_WGM1
    SolutionIndex: 282
    SolutionNameMin: Cijk_Ailk_Bjlk_HBH_MT64x64x32_MI32x32x8x1_SE_AF0EM1_GRVW4_GSU1_SU0_SUS256_SRVW4_VAW2_WG64_4_1_WGM1
    SolutionIndex: 283
    SolutionNameMin: Cijk_Ailk_Bjlk_HBH_MT32x32x64_MI16x16x16x1_SE_AF0EM1_GRVW4_GSU1_SU0_SUS256_SRVW4_VAW2_WG32_8_1_WGM1
    SolutionIndex: 284
    SolutionNameMin: Cijk_Ailk_Bjlk_HBH_MT64x128x16_MI32x32x8x1_SE_AF0EM1_GRVW8_GSU1_SU0_SUS256_SRVW4_VAW2_WG64_4_1_WGM1
    SolutionIndex: 285
    SolutionNameMin: Cijk_Ailk_Bjlk_HBH_MT64x128x32_MI32x32x8x1_SE_AF0EM1_GRVW8_GSU1_SU0_SUS256_SRVW4_VAW2_WG64_4_1_WGM1
    SolutionIndex: 286
    SolutionNameMin: Cijk_Ailk_Bjlk_HBH_MT128x128x32_MI32x32x8x1_SE_AF0EM1_GRVW8_GSU1_SU0_SUS256_SRVW4_VAW2_WG64_4_1_WGM1
    SolutionIndex: 287
    SolutionNameMin: Cijk_Ailk_Bjlk_HBH_MT64x64x64_MI32x32x8x1_SE_AF0EM1_GRVW8_GSU1_SU0_SUS256_SRVW4_VAW2_WG64_4_1_WGM1
    SolutionIndex: 288
    SolutionNameMin: Cijk_Ailk_Bjlk_HBH_MT64x128x64_MI32x32x8x1_SE_AF0EM1_GRVW8_GSU1_SU0_SUS256_SRVW4_VAW2_WG64_4_1_WGM1
    SolutionIndex: 289
    SolutionNameMin: Cijk_Ailk_Bjlk_HBH_MT32x32x64_MI16x16x16x1_SE_AF0EM1_GRVW8_GSU1_SU0_SUS256_SRVW4_VAW2_WG32_8_1_WGM1
    SolutionIndex: 290
    SolutionNameMin: Cijk_Ailk_Bjlk_HBH_MT128x64x16_MI32x32x8x1_SE_AF0EM1_GRVW2_GSU1_SU32_SUS128_SRVW4_VAW2_WG64_4_1_WGM1
    SolutionIndex: 291
    SolutionNameMin: Cijk_Ailk_Bjlk_HBH_MT32x32x64_MI16x16x16x1_SE_AF0EM1_GRVW2_GSU1_SU32_SUS128_SRVW4_VAW2_WG32_8_1_WGM1
    SolutionIndex: 292
    SolutionNameMin: Cijk_Ailk_Bjlk_HBH_MT32x32x16_MI16x16x16x1_SE_AF0EM1_GRVW4_GSU1_SU32_SUS128_SRVW4_VAW2_WG32_8_1_WGM1
    SolutionIndex: 293
    SolutionNameMin: Cijk_Ailk_Bjlk_HBH_MT64x128x32_MI32x32x8x1_SE_AF0EM1_GRVW8_GSU1_SU32_SUS128_SRVW4_VAW2_WG64_4_1_WGM1
    SolutionIndex: 294
    SolutionNameMin: Cijk_Ailk_Bjlk_HBH_MT64x64x16_MI32x32x8x1_SE_AF0EM1_GRVW2_GSU1_SU32_SUS256_SRVW4_VAW2_WG64_4_1_WGM1
    SolutionIndex: 295
    SolutionNameMin: Cijk_Ailk_Bjlk_HBH_MT64x32x16_MI16x16x16x1_SE_AF0EM1_GRVW2_GSU1_SU32_SUS256_SRVW4_VAW2_WG32_8_1_WGM1
    SolutionIndex: 296
    SolutionNameMin: Cijk_Ailk_Bjlk_HBH_MT128x96x16_MI32x32x8x1_SE_AF0EM1_GRVW2_GSU1_SU32_SUS256_SRVW4_VAW2_WG128_2_1_WGM1
    SolutionIndex: 297
    SolutionNameMin: Cijk_Ailk_Bjlk_HBH_MT32x32x16_MI16x16x16x1_SE_AF0EM1_GRVW4_GSU1_SU32_SUS256_SRVW4_VAW2_WG32_8_1_WGM1
    SolutionIndex: 298
    SolutionNameMin: Cijk_Ailk_Bjlk_HBH_MT64x128x16_MI32x32x8x1_SE_AF0EM1_GRVW8_GSU1_SU32_SUS256_SRVW4_VAW2_WG64_4_1_WGM1
    SolutionIndex: 299
    SolutionNameMin: Cijk_Ailk_Bjlk_HBH_MT128x256x16_MI32x32x8x1_SE_AF0EM1_GRVW8_GSU1_SU32_SUS256_SRVW4_VAW2_WG64_4_1_WGM1
    SolutionIndex: 300
    SolutionNameMin: Cijk_Ailk_Bjlk_HBH_MT64x128x32_MI32x32x8x1_SE_AF0EM1_GRVW8_GSU1_SU32_SUS256_SRVW4_VAW2_WG64_4_1_WGM1
    SolutionIndex: 301
    SolutionNameMin: Cijk_Ailk_Bjlk_HBH_MT64x64x16_MI32x32x8x1_SE_AF0EM1_GRVW2_GSU1_SU0_SUS256_SRVW4_VAW2_WG64_4_1_WGM2
    SolutionIndex: 302
    SolutionNameMin: Cijk_Ailk_Bjlk_HBH_MT128x64x16_MI32x32x8x1_SE_AF0EM1_GRVW2_GSU1_SU0_SUS256_SRVW4_VAW2_WG64_4_1_WGM2
    SolutionIndex: 303
    SolutionNameMin: Cijk_Ailk_Bjlk_HBH_MT128x96x32_MI32x32x8x1_SE_AF0EM1_GRVW4_GSU1_SU0_SUS256_SRVW4_VAW2_WG128_2_1_WGM2
    SolutionIndex: 304
    SolutionNameMin: Cijk_Ailk_Bjlk_HBH_MT64x128x16_MI32x32x8x1_SE_AF0EM1_GRVW8_GSU1_SU0_SUS256_SRVW4_VAW2_WG64_4_1_WGM2
    SolutionIndex: 305
    SolutionNameMin: Cijk_Ailk_Bjlk_HBH_MT128x128x16_MI32x32x8x1_SE_AF0EM1_GRVW8_GSU1_SU0_SUS256_SRVW4_VAW2_WG64_4_1_WGM2
    SolutionIndex: 306
    SolutionNameMin: Cijk_Ailk_Bjlk_HBH_MT128x256x16_MI32x32x8x1_SE_AF0EM1_GRVW8_GSU1_SU0_SUS256_SRVW4_VAW2_WG64_4_1_WGM2
    SolutionIndex: 307
    SolutionNameMin: Cijk_Ailk_Bjlk_HBH_MT128x128x32_MI32x32x8x1_SE_AF0EM1_GRVW8_GSU1_SU0_SUS256_SRVW4_VAW2_WG64_4_1_WGM2
    SolutionIndex: 308
    SolutionNameMin: Cijk_Ailk_Bjlk_HBH_MT32x32x64_MI16x16x16x1_SE_AF0EM1_GRVW8_GSU1_SU0_SUS256_SRVW4_VAW2_WG32_8_1_WGM2
    SolutionIndex: 309
    SolutionNameMin: Cijk_Ailk_Bjlk_HBH_MT32x64x16_MI16x16x16x1_SE_AF0EM1_GRVW2_GSU1_SU32_SUS128_SRVW4_VAW2_WG32_8_1_WGM2
    SolutionIndex: 310
    SolutionNameMin: Cijk_Ailk_Bjlk_HBH_MT64x128x16_MI32x32x8x1_SE_AF0EM1_GRVW8_GSU1_SU32_SUS128_SRVW4_VAW2_WG64_4_1_WGM2
    SolutionIndex: 311
    SolutionNameMin: Cijk_Ailk_Bjlk_HBH_MT64x128x32_MI32x32x8x1_SE_AF0EM1_GRVW8_GSU1_SU32_SUS128_SRVW4_VAW2_WG64_4_1_WGM2
    SolutionIndex: 312
    SolutionNameMin: Cijk_Ailk_Bjlk_HBH_MT64x64x16_MI32x32x8x1_SE_AF0EM1_GRVW2_GSU1_SU32_SUS256_SRVW4_VAW2_WG64_4_1_WGM2
    SolutionIndex: 313
    SolutionNameMin: Cijk_Ailk_Bjlk_HBH_MT64x64x16_MI32x32x8x1_SE_AF0EM1_GRVW2_GSU1_SU0_SUS256_SRVW4_VAW2_WG64_4_1_WGM15
    SolutionIndex: 314
    SolutionNameMin: Cijk_Ailk_Bjlk_HBH_MT128x128x16_MI32x32x8x1_SE_AF0EM1_GRVW2_GSU1_SU0_SUS256_SRVW4_VAW2_WG64_4_1_WGM15
    SolutionIndex: 315
    SolutionNameMin: Cijk_Ailk_Bjlk_HBH_MT64x128x16_MI32x32x8x1_SE_AF0EM1_GRVW4_GSU1_SU0_SUS256_SRVW4_VAW2_WG64_4_1_WGM15
    SolutionIndex: 316
    SolutionNameMin: Cijk_Ailk_Bjlk_HBH_MT64x128x16_MI32x32x8x1_SE_AF0EM1_GRVW8_GSU1_SU0_SUS256_SRVW4_VAW2_WG64_4_1_WGM15
    SolutionIndex: 317
    SolutionNameMin: Cijk_Ailk_Bjlk_HBH_MT128x128x16_MI32x32x8x1_SE_AF0EM1_GRVW8_GSU1_SU0_SUS256_SRVW4_VAW2_WG64_4_1_WGM15
    SolutionIndex: 318
    SolutionNameMin: Cijk_Ailk_Bjlk_HBH_MT128x256x16_MI32x32x8x1_SE_AF0EM1_GRVW8_GSU1_SU0_SUS256_SRVW4_VAW2_WG64_4_1_WGM15
    SolutionIndex: 319
    SolutionNameMin: Cijk_Ailk_Bjlk_HBH_MT64x128x32_MI32x32x8x1_SE_AF0EM1_GRVW8_GSU1_SU0_SUS256_SRVW4_VAW2_WG64_4_1_WGM15
    SolutionIndex: 320
    SolutionNameMin: Cijk_Ailk_Bjlk_HBH_MT128x128x32_MI32x32x8x1_SE_AF0EM1_GRVW8_GSU1_SU0_SUS256_SRVW4_VAW2_WG64_4_1_WGM15
    SolutionIndex: 321
    SolutionNameMin: Cijk_Ailk_Bjlk_HBH_MT64x64x16_MI32x32x8x1_SE_AF0EM1_GRVW2_GSU1_SU32_SUS128_SRVW4_VAW2_WG64_4_1_WGM15
    SolutionIndex: 322
    SolutionNameMin: Cijk_Ailk_Bjlk_HBH_MT128x96x16_MI32x32x8x1_SE_AF0EM1_GRVW2_GSU1_SU32_SUS128_SRVW4_VAW2_WG128_2_1_WGM15
    SolutionIndex: 323
    SolutionNameMin: Cijk_Ailk_Bjlk_HBH_MT256x160x32_MI32x32x8x1_SE_AF0EM1_GRVW4_GSU1_SU32_SUS128_SRVW4_VAW2_WG128_2_1_WGM15
    SolutionIndex: 324
    SolutionNameMin: Cijk_Ailk_Bjlk_HBH_MT128x128x32_MI32x32x8x1_SE_AF0EM1_GRVW8_GSU1_SU32_SUS128_SRVW4_VAW2_WG64_4_1_WGM15
    SolutionIndex: 325
    SolutionNameMin: Cijk_Ailk_Bjlk_HBH_MT64x64x16_MI32x32x8x1_SE_AF0EM1_GRVW2_GSU1_SU32_SUS256_SRVW4_VAW2_WG64_4_1_WGM15
    SolutionIndex: 326
    SolutionNameMin: Cijk_Ailk_Bjlk_HBH_MT128x96x16_MI32x32x8x1_SE_AF0EM1_GRVW2_GSU1_SU32_SUS256_SRVW4_VAW2_WG128_2_1_WGM15
    SolutionIndex: 327
    SolutionNameMin: Cijk_Ailk_Bjlk_HBH_MT128x128x16_MI32x32x8x1_SE_AF0EM1_GRVW4_GSU1_SU32_SUS256_SRVW4_VAW2_WG64_4_1_WGM15
    SolutionIndex: 328
    SolutionNameMin: Cijk_Ailk_Bjlk_HBH_MT96x128x64_MI32x32x8x1_SE_AF0EM1_GRVW4_GSU1_SU32_SUS256_SRVW0_VAW2_WG32_8_1_WGM15
    SolutionIndex: 329
    SolutionNameMin: Cijk_Ailk_Bjlk_HBH_MT128x128x16_MI32x32x8x1_SE_AF0EM1_GRVW8_GSU1_SU32_SUS256_SRVW4_VAW2_WG64_4_1_WGM15
    SolutionIndex: 330
    SolutionNameMin: Cijk_Ailk_Bjlk_HBH_MT32x64x16_MI16x16x16x1_SE_AF0EM1_GRVW8_GSU1_SU32_SUS256_SRVW4_VAW2_WG32_8_1_WGM15
    SolutionIndex: 331
    SolutionNameMin: Cijk_Ailk_Bjlk_HBH_MT128x256x16_MI32x32x8x1_SE_AF0EM1_GRVW8_GSU1_SU0_SUS256_SRVW4_VAW2_WG64_4_1_WGM1
    SolutionIndex: 332
    SolutionNameMin: Cijk_Ailk_Bjlk_HBH_MT32x64x16_MI16x16x16x1_SE_AF0EM1_GRVW2_GSU1_SU32_SUS256_SRVW4_VAW2_WG32_8_1_WGM1
    SolutionIndex: 333
    SolutionNameMin: Cijk_Ailk_Bjlk_HBH_MT32x64x16_MI16x16x16x1_SE_AF0EM1_GRVW2_GSU1_SU0_SUS256_SRVW4_VAW2_WG32_8_1_WGM2
    SolutionIndex: 334
    SolutionNameMin: Cijk_Ailk_Bjlk_HBH_MT32x64x16_MI16x16x16x1_SE_AF0EM1_GRVW2_GSU1_SU32_SUS128_SRVW4_VAW2_WG32_8_1_WGM2
    SolutionIndex: 335
    SolutionNameMin: Cijk_Ailk_Bjlk_HBH_MT32x64x16_MI16x16x16x1_SE_AF0EM1_GRVW2_GSU1_SU32_SUS256_SRVW4_VAW2_WG32_8_1_WGM2
    SolutionIndex: 336
    SolutionNameMin: Cijk_Ailk_Bjlk_HBH_MT32x32x64_MI16x16x16x1_SE_AF0EM1_GRVW8_GSU7_SU0_SUS256_SRVW0_VAW1_WG32_8_1_WGM1
    SolutionIndex: 337
    SolutionNameMin: Cijk_Ailk_Bjlk_HBH_MT128x256x32_MI32x32x8x1_SE_AF0EM1_GRVW8_GSU7_SU32_SUS128_SRVW0_VAW1_WG64_4_1_WGM2
    SolutionIndex: 338
    SolutionNameMin: Cijk_Ailk_Bjlk_HBH_MT32x32x64_MI16x16x16x1_SE_AF0EM1_GRVW8_GSU15_SU0_SUS256_SRVW0_VAW1_WG32_8_1_WGM1
    SolutionIndex: 339
    SolutionNameMin: Cijk_Ailk_Bjlk_HBH_MT32x32x64_MI16x16x16x1_SE_AF0EM1_GRVW8_GSU15_SU32_SUS128_SRVW0_VAW1_WG32_8_1_WGM1
    SolutionIndex: 340
    SolutionNameMin: Cijk_Ailk_Bjlk_HBH_MT16x16x16_MI16x16x16x1_SE_AF0EM1_GRVW2_GSU1_SU0_SUS256_SRVW0_VAW2_WG16_4_1_WGM1
    SolutionIndex: 341
    SolutionNameMin: Cijk_Ailk_Bjlk_HBH_MT16x16x16_MI16x16x16x1_SE_AF0EM8_GRVW2_GSU1_SU0_SUS256_SRVW0_VAW2_WG16_4_1_WGM1
    SolutionIndex: 342
    SolutionNameMin: Cijk_Ailk_Bjlk_HBH_MT16x64x32_MI16x16x16x1_SE_AF0EM8_GRVW2_GSU1_SU0_SUS256_SRVW0_VAW2_WG16_16_1_WGM1
    SolutionIndex: 343
    SolutionNameMin: Cijk_Ailk_Bjlk_HBH_MT64x16x64_MI16x16x16x1_SE_AF0EM8_GRVW2_GSU1_SU0_SUS256_SRVW0_VAW2_WG64_4_1_WGM1
    SolutionIndex: 344
    SolutionNameMin: Cijk_Ailk_Bjlk_HBH_MT16x16x16_MI16x16x16x1_SE_AF0EM1_GRVW4_GSU1_SU0_SUS256_SRVW0_VAW2_WG16_4_1_WGM1
    SolutionIndex: 345
    SolutionNameMin: Cijk_Ailk_Bjlk_HBH_MT64x16x32_MI16x16x16x1_SE_AF0EM8_GRVW4_GSU1_SU0_SUS256_SRVW0_VAW2_WG64_4_1_WGM1
    SolutionIndex: 346
    SolutionNameMin: Cijk_Ailk_Bjlk_HBH_MT16x16x16_MI16x16x16x1_SE_AF0EM1_GRVW8_GSU1_SU0_SUS256_SRVW0_VAW2_WG16_4_1_WGM1
    SolutionIndex: 347
    SolutionNameMin: Cijk_Ailk_Bjlk_HBH_MT64x16x32_MI16x16x16x1_SE_AF0EM8_GRVW8_GSU1_SU0_SUS256_SRVW0_VAW2_WG64_4_1_WGM1
    SolutionIndex: 348
    SolutionNameMin: Cijk_Ailk_Bjlk_HBH_MT16x16x16_MI16x16x16x1_SE_AF0EM1_GRVW2_GSU1_SU32_SUS128_SRVW0_VAW2_WG16_4_1_WGM1
    SolutionIndex: 349
    SolutionNameMin: Cijk_Ailk_Bjlk_HBH_MT16x16x16_MI16x16x16x1_SE_AF0EM8_GRVW2_GSU1_SU32_SUS128_SRVW4_VAW2_WG16_4_1_WGM1
    SolutionIndex: 350
    SolutionNameMin: Cijk_Ailk_Bjlk_HBH_MT16x16x16_MI16x16x16x1_SE_AF0EM1_GRVW2_GSU1_SU32_SUS256_SRVW4_VAW2_WG16_4_1_WGM1
    SolutionIndex: 351
    SolutionNameMin: Cijk_Ailk_Bjlk_HBH_MT16x16x16_MI16x16x16x1_SE_AF0EM8_GRVW2_GSU1_SU0_SUS256_SRVW0_VAW2_WG16_4_1_WGM2
    SolutionIndex: 352
    SolutionNameMin: Cijk_Ailk_Bjlk_HBH_MT16x64x32_MI16x16x16x1_SE_AF0EM8_GRVW2_GSU1_SU0_SUS256_SRVW0_VAW2_WG16_16_1_WGM2
    SolutionIndex: 353
    SolutionNameMin: Cijk_Ailk_Bjlk_HBH_MT64x16x32_MI16x16x16x1_SE_AF0EM8_GRVW4_GSU1_SU0_SUS256_SRVW0_VAW2_WG64_4_1_WGM2
    SolutionIndex: 354
    SolutionNameMin: Cijk_Ailk_Bjlk_HBH_MT16x16x16_MI16x16x16x1_SE_AF0EM1_GRVW2_GSU1_SU0_SUS256_SRVW0_VAW2_WG16_4_1_WGM15
    SolutionIndex: 355
    SolutionNameMin: Cijk_Ailk_Bjlk_HBH_MT16x16x16_MI16x16x16x1_SE_AF0EM8_GRVW2_GSU1_SU0_SUS256_SRVW0_VAW2_WG16_4_1_WGM15
    SolutionIndex: 356
    SolutionNameMin: Cijk_Ailk_Bjlk_HBH_MT16x16x16_MI16x16x16x1_SE_AF0EM1_GRVW8_GSU1_SU0_SUS256_SRVW0_VAW2_WG16_4_1_WGM15
    SolutionIndex: 357
    SolutionNameMin: Cijk_Ailk_Bjlk_HBH_MT16x16x64_MI16x16x16x1_SE_AF0EM1_GRVW2_GSU2_SU32_SUS256_SRVW0_VAW1_WG16_4_1_WGM2
    SolutionIndex: 358
    SolutionNameMin: Cijk_Ailk_Bjlk_HBH_MT16x16x32_MI16x16x16x1_SE_AF0EM1_GRVW8_GSU3_SU0_SUS256_SRVW0_VAW1_WG16_4_1_WGM1
    SolutionIndex: 359
    SolutionNameMin: Cijk_Ailk_Bjlk_HBH_MT16x16x64_MI16x16x16x1_SE_AF0EM8_GRVW2_GSU3_SU0_SUS256_SRVW0_VAW1_WG16_4_1_WGM15
    SolutionIndex: 360
    SolutionNameMin: Cijk_Ailk_Bjlk_HBH_MT64x16x64_MI16x16x16x1_SE_AF0EM8_GRVW2_GSU7_SU32_SUS128_SRVW0_VAW1_WG64_4_1_WGM15
    SolutionIndex: 361
    SolutionNameMin: Cijk_Ailk_Bjlk_HBH_MT64x16x64_MI16x16x16x1_SE_AF0EM1_GRVW2_GSU15_SU32_SUS128_SRVW0_VAW1_WG64_4_1_WGM1
    SolutionIndex: 362
    SolutionNameMin: Cijk_Ailk_Bjlk_HBH_MT64x16x64_MI16x16x16x1_SE_AF0EM8_GRVW2_GSU15_SU32_SUS128_SRVW0_VAW1_WG64_4_1_WGM1
    SolutionIndex: 363
    SolutionNameMin: Cijk_Ailk_Bjlk_HBH_MT16x64x64_MI16x16x16x1_SE_AF0EM1_GRVW2_GSU15_SU0_SUS256_SRVW4_VAW1_WG16_16_1_WGM2
    SolutionIndex: 364
    SolutionNameMin: Cijk_Ailk_Bjlk_HBH_MT64x16x64_MI16x16x16x1_SE_AF0EM1_GRVW2_GSU15_SU0_SUS256_SRVW0_VAW1_WG64_4_1_WGM15
    SolutionIndex: 365
    SolutionNameMin: Cijk_Ailk_Bjlk_HBH_MT64x16x64_MI16x16x16x1_SE_AF0EM8_GRVW2_GSU15_SU0_SUS256_SRVW0_VAW1_WG64_4_1_WGM15
    SolutionIndex: 366
    SolutionNameMin: Cijk_Ailk_Bjlk_HBH_MT16x64x64_MI16x16x16x1_SE_AF0EM1_GRVW8_GSU15_SU0_SUS256_SRVW0_VAW1_WG16_16_1_WGM15
- - - [7680, 8192, 1, 8192, 8384, 8384, 8384, 8384]
    - [30, 95.545]
  - - [3840, 4096, 1, 4096, 4192, 4192, 4192, 4192]
    - [30, 93.244]
  - - [1920, 2048, 1, 2048, 2080, 2080, 2080, 2080]
    - [39, 80.432]
  - - [960, 1024, 1, 1024, 1056, 1056, 1056, 1056]
    - [160, 38.609]
  - - [480, 512, 1, 512, 544, 544, 544, 544]
    - [50, 10.151]
  - - [8192, 7680, 1, 8192, 8384, 8384, 8384, 8384]
    - [86, 95.372]
  - - [4096, 3840, 1, 4096, 4192, 4192, 4192, 4192]
    - [30, 93.114]
  - - [2048, 1920, 1, 2048, 2080, 2080, 2080, 2080]
    - [140, 84.871]
  - - [1024, 960, 1, 1024, 1056, 1056, 1056, 1056]
    - [144, 39.582]
  - - [512, 480, 1, 512, 544, 544, 544, 544]
    - [103, 9.979]
  - - [8192, 8192, 1, 8192, 8384, 8384, 8384, 8384]
    - [78, 92.399]
  - - [4096, 4096, 1, 4096, 4192, 4192, 4192, 4192]
    - [40, 82.408]
  - - [2048, 2048, 1, 2048, 2080, 2080, 2080, 2080]
    - [149, 71.969]
  - - [1024, 1024, 1, 1024, 1056, 1056, 1056, 1056]
    - [161, 35.013]
  - - [512, 512, 1, 512, 544, 544, 544, 544]
    - [33, 9.037]
  - - [64, 512, 16, 512, 64, 64, 64, 512]
    - [142, 17.816]
  - - [1024, 2, 1, 1, 1024, 1024, 1024, 2]
    - [0, 0.0]
  - - [1024, 2, 1, 512, 1024, 1024, 1024, 2]
    - [357, 0.094]
  - - [1024, 1024, 1, 1, 1024, 1024, 1024, 1024]
    - [0, 0.192]
  - - [1024, 1024, 1, 77, 1024, 1024, 1024, 1024]
    - [162, 8.213]
  - - [1024, 1024, 1, 512, 1024, 1024, 1024, 1024]
    - [134, 24.272]
  - - [1024, 4096, 1, 512, 1024, 1024, 1024, 4096]
    - [194, 54.317]
  - - [1024, 30522, 1, 77, 1024, 1024, 1024, 30522]
    - [93, 27.805]
  - - [4096, 1024, 1, 512, 4096, 4096, 4096, 1024]
    - [157, 45.676]
  - - [64, 128, 160, 128, 64, 64, 64, 128]
    - [58, 14.674]
  - - [1024, 2, 1, 10, 1024, 1024, 1024, 2]
    - [3, 0.003]
  - - [1024, 2, 1, 1280, 1024, 1024, 1024, 2]
    - [234, 0.219]
  - - [1024, 1024, 1, 10, 1024, 1024, 1024, 1024]
    - [0, 1.558]
  - - [1024, 1024, 1, 200, 1024, 1024, 1024, 1024]
    - [125, 14.868]
  - - [1024, 1024, 1, 1280, 1024, 1024, 1024, 1024]
    - [104, 36.62]
  - - [1024, 4096, 1, 1280, 1024, 1024, 1024, 4096]
    - [189, 66.459]
  - - [1024, 30522, 1, 200, 1024, 1024, 1024, 30522]
    - [154, 48.587]
  - - [4096, 1024, 1, 1280, 4096, 4096, 4096, 1024]
    - [111, 62.105]
  - - [64, 128, 624, 128, 64, 64, 64, 128]
    - [16, 18.334]
  - - [1024, 2, 1, 39, 1024, 1024, 1024, 2]
    - [345, 0.012]
  - - [1024, 2, 1, 4992, 1024, 1024, 1024, 2]
    - [362, 0.566]
  - - [1024, 1024, 1, 39, 1024, 1024, 1024, 1024]
    - [0, 5.103]
  - - [1024, 1024, 1, 780, 1024, 1024, 1024, 1024]
    - [110, 25.096]
  - - [1024, 1024, 1, 4992, 1024, 1024, 1024, 1024]
    - [115, 47.792]
  - - [1024, 4096, 1, 4992, 1024, 1024, 1024, 4096]
    - [129, 74.79]
  - - [1024, 30522, 1, 780, 1024, 1024, 1024, 30522]
    - [179, 70.612]
  - - [4096, 1024, 1, 4992, 4096, 4096, 4096, 1024]
    - [153, 72.735]
  - - [64, 512, 64, 512, 64, 64, 64, 512]
    - [79, 28.629]
  - - [1024, 2, 1, 4, 1024, 1024, 1024, 2]
    - [2, 0.001]
  - - [1024, 2, 1, 2048, 1024, 1024, 1024, 2]
    - [262, 0.319]
  - - [1024, 1024, 1, 4, 1024, 1024, 1024, 1024]
    - [0, 0.666]
  - - [1024, 1024, 1, 308, 1024, 1024, 1024, 1024]
    - [165, 17.991]
  - - [1024, 1024, 1, 2048, 1024, 1024, 1024, 1024]
    - [115, 42.579]
  - - [1024, 4096, 1, 2048, 1024, 1024, 1024, 4096]
    - [189, 69.964]
  - - [1024, 30522, 1, 308, 1024, 1024, 1024, 30522]
    - [168, 56.767]
  - - [4096, 1024, 1, 2048, 4096, 4096, 4096, 1024]
    - [129, 66.383]
  - - [64, 128, 640, 128, 64, 64, 64, 128]
    - [116, 18.636]
  - - [1024, 2, 1, 40, 1024, 1024, 1024, 2]
    - [342, 0.011]
  - - [1024, 2, 1, 5120, 1024, 1024, 1024, 2]
    - [361, 0.564]
  - - [1024, 1024, 1, 40, 1024, 1024, 1024, 1024]
    - [67, 5.234]
  - - [1024, 1024, 1, 800, 1024, 1024, 1024, 1024]
    - [100, 26.703]
  - - [1024, 1024, 1, 5120, 1024, 1024, 1024, 1024]
    - [104, 48.404]
  - - [1024, 4096, 1, 5120, 1024, 1024, 1024, 4096]
    - [129, 74.934]
  - - [1024, 30522, 1, 800, 1024, 1024, 1024, 30522]
    - [6, 75.556]
  - - [4096, 1024, 1, 5120, 4096, 4096, 4096, 1024]
    - [15, 72.475]
  - - [64, 128, 656, 128, 64, 64, 64, 128]
    - [162, 18.713]
  - - [1024, 2, 1, 41, 1024, 1024, 1024, 2]
    - [347, 0.012]
  - - [1024, 2, 1, 5248, 1024, 1024, 1024, 2]
    - [364, 0.582]
  - - [1024, 1024, 1, 41, 1024, 1024, 1024, 1024]
    - [67, 5.158]
  - - [1024, 1024, 1, 820, 1024, 1024, 1024, 1024]
    - [108, 24.164]
  - - [1024, 1024, 1, 5248, 1024, 1024, 1024, 1024]
    - [146, 47.597]
  - - [1024, 4096, 1, 5248, 1024, 1024, 1024, 4096]
    - [129, 75.072]
  - - [1024, 30522, 1, 820, 1024, 1024, 1024, 30522]
    - [132, 72.069]
  - - [4096, 1024, 1, 5248, 4096, 4096, 4096, 1024]
    - [41, 72.764]
  - - [64, 512, 80, 512, 64, 64, 64, 512]
    - [68, 30.862]
  - - [1024, 2, 1, 5, 1024, 1024, 1024, 2]
    - [0, 0.001]
  - - [1024, 2, 1, 2560, 1024, 1024, 1024, 2]
    - [360, 0.363]
  - - [1024, 1024, 1, 5, 1024, 1024, 1024, 1024]
    - [116, 0.846]
  - - [1024, 1024, 1, 385, 1024, 1024, 1024, 1024]
    - [170, 19.884]
  - - [1024, 1024, 1, 2560, 1024, 1024, 1024, 1024]
    - [115, 43.766]
  - - [1024, 4096, 1, 2560, 1024, 1024, 1024, 4096]
    - [189, 70.815]
  - - [1024, 30522, 1, 385, 1024, 1024, 1024, 30522]
    - [154, 61.874]
  - - [4096, 1024, 1, 2560, 4096, 4096, 4096, 1024]
    - [96, 69.301]
  - - [64, 512, 96, 512, 64, 64, 64, 512]
    - [57, 31.666]
  - - [1024, 2, 1, 6, 1024, 1024, 1024, 2]
    - [352, 0.002]
  - - [1024, 2, 1, 3072, 1024, 1024, 1024, 2]
    - [237, 0.415]
  - - [1024, 1024, 1, 6, 1024, 1024, 1024, 1024]
    - [105, 0.982]
  - - [1024, 1024, 1, 462, 1024, 1024, 1024, 1024]
    - [134, 20.702]
  - - [1024, 1024, 1, 3072, 1024, 1024, 1024, 1024]
    - [175, 45.401]
  - - [1024, 4096, 1, 3072, 1024, 1024, 1024, 4096]
    - [189, 71.478]
  - - [1024, 30522, 1, 462, 1024, 1024, 1024, 30522]
    - [154, 62.707]
  - - [4096, 1024, 1, 3072, 4096, 4096, 4096, 1024]
    - [129, 70.724]
  - - [64, 128, 128, 128, 64, 64, 64, 128]
    - [61, 12.561]
  - - [1024, 2, 1, 8, 1024, 1024, 1024, 2]
    - [3, 0.002]
  - - [1024, 2, 1, 1024, 1024, 1024, 1024, 2]
    - [220, 0.171]
  - - [1024, 1024, 1, 8, 1024, 1024, 1024, 1024]
    - [67, 1.33]
  - - [1024, 1024, 1, 160, 1024, 1024, 1024, 1024]
    - [119, 16.355]
  - - [1024, 1024, 1, 1024, 1024, 1024, 1024, 1024]
    - [104, 33.055]
  - - [1024, 4096, 1, 1024, 1024, 1024, 1024, 4096]
    - [120, 63.599]
  - - [1024, 30522, 1, 160, 1024, 1024, 1024, 30522]
    - [185, 48.648]
  - - [4096, 1024, 1, 1024, 4096, 4096, 4096, 1024]
    - [8, 55.137]
  - - [64, 128, 144, 128, 64, 64, 64, 128]
    - [125, 13.72]
  - - [1024, 2, 1, 9, 1024, 1024, 1024, 2]
    - [3, 0.003]
  - - [1024, 2, 1, 1152, 1024, 1024, 1024, 2]
    - [359, 0.186]
  - - [1024, 1024, 1, 9, 1024, 1024, 1024, 1024]
    - [0, 1.402]
  - - [1024, 1024, 1, 180, 1024, 1024, 1024, 1024]
    - [119, 14.019]
  - - [1024, 1024, 1, 1152, 1024, 1024, 1024, 1024]
    - [104, 35.217]
  - - [1024, 4096, 1, 1152, 1024, 1024, 1024, 4096]
    - [189, 65.063]
  - - [1024, 30522, 1, 180, 1024, 1024, 1024, 30522]
    - [81, 46.103]
  - - [4096, 1024, 1, 1152, 4096, 4096, 4096, 1024]
    - [150, 59.892]
  - - [256, 128, 1, 32768, 256, 256, 256, 128]
    - [267, 22.89]
  - - [256, 32768, 1, 1, 256, 256, 256, 32768]
    - [51, 0.47]
  - - [512, 256, 1, 32768, 512, 512, 512, 256]
    - [274, 47.232]
  - - [1024, 512, 1, 32768, 1024, 1024, 1024, 512]
    - [273, 69.271]
  - - [1024, 1024, 1, 32768, 1024, 1024, 1024, 1024]
    - [257, 76.725]
  - - [64, 128, 512, 128, 64, 64, 64, 128]
    - [75, 17.629]
  - - [128, 64, 512, 128, 128, 128, 128, 64]
    - [75, 17.691]
  - - [1024, 2, 1, 32, 1024, 1024, 1024, 2]
    - [353, 0.011]
  - - [1024, 1024, 1, 32, 1024, 1024, 131072, 1024]
    - [134, 5.414]
  - - [1024, 1024, 1, 4096, 1024, 1024, 1024, 1024]
    - [89, 46.095]
  - - [1024, 4096, 1, 4096, 1024, 1024, 1024, 4096]
    - [129, 73.247]
  - - [1024, 30528, 1, 4096, 1024, 1024, 1024, 30528]
    - [141, 91.257]
  - - [4096, 1024, 1, 4096, 4096, 4096, 4096, 1024]
    - [129, 73.381]
  - - [512, 64, 64, 512, 512, 512, 512, 64]
    - [43, 28.386]
  - - [1024, 1024, 1, 4, 1024, 1024, 524288, 1024]
    - [98, 0.677]
  - - [1024, 30528, 1, 2048, 1024, 1024, 1024, 30528]
    - [64, 86.758]
  - - [64, 4, 32768, 4, 64, 64, 2097152, 4]
    - [341, 0.202]
  - - [64, 4, 38400, 4, 64, 64, 2457600, 4]
    - [341, 0.203]
  - - [1024, 1024, 1, 8192, 1024, 1024, 1024, 1024]
    - [206, 54.612]
  - - [1024, 1024, 1, 9600, 1024, 1024, 1024, 1024]
    - [225, 57.129]
  - - [1024, 4096, 1, 8192, 1024, 1024, 1024, 4096]
    - [129, 77.764]
  - - [1024, 4096, 1, 9600, 1024, 1024, 1024, 4096]
    - [129, 78.456]
  - - [1024, 33712, 1, 8192, 1024, 1024, 1024, 33712]
    - [193, 86.949]
  - - [1024, 33712, 1, 9600, 1024, 1024, 1024, 33712]
    - [99, 87.497]
  - - [4096, 1024, 1, 8192, 4096, 4096, 4096, 1024]
    - [15, 75.465]
  - - [4096, 1024, 1, 9600, 4096, 4096, 4096, 1024]
    - [41, 75.82]
  - - [1024, 1024, 1, 10064, 1024, 1024, 1024, 1024]
    - [215, 56.725]
  - - [1024, 1024, 1, 10080, 1024, 1024, 1024, 1024]
    - [225, 57.111]
  - - [1024, 1024, 1, 10200, 1024, 1024, 1024, 1024]
    - [250, 56.138]
  - - [1024, 1024, 1, 3840, 1024, 1024, 1024, 1024]
    - [104, 46.522]
  - - [1024, 1024, 1, 3968, 1024, 1024, 1024, 1024]
    - [175, 46.914]
  - - [1024, 1024, 1, 6528, 1024, 1024, 1024, 1024]
    - [203, 49.93]
  - - [1024, 1024, 1, 7104, 1024, 1024, 1024, 1024]
    - [207, 51.831]
  - - [1024, 1024, 1, 7200, 1024, 1024, 1024, 1024]
    - [225, 53.124]
  - - [1024, 1024, 1, 8064, 1024, 1024, 1024, 1024]
    - [225, 53.795]
  - - [1024, 1024, 1, 8160, 1024, 1024, 1024, 1024]
    - [225, 54.068]
  - - [1024, 1024, 1, 9216, 1024, 1024, 1024, 1024]
    - [214, 56.418]
  - - [1024, 1024, 1, 9520, 1024, 1024, 1024, 1024]
    - [265, 55.907]
  - - [1024, 4096, 1, 10064, 1024, 1024, 1024, 4096]
    - [129, 78.024]
  - - [1024, 4096, 1, 10080, 1024, 1024, 1024, 4096]
    - [129, 78.225]
  - - [1024, 4096, 1, 10200, 1024, 1024, 1024, 4096]
    - [129, 77.864]
  - - [1024, 4096, 1, 3840, 1024, 1024, 1024, 4096]
    - [166, 72.327]
  - - [1024, 4096, 1, 3968, 1024, 1024, 1024, 4096]
    - [129, 72.952]
  - - [1024, 4096, 1, 6528, 1024, 1024, 1024, 4096]
    - [129, 76.558]
  - - [1024, 4096, 1, 7104, 1024, 1024, 1024, 4096]
    - [129, 77.009]
  - - [1024, 4096, 1, 7200, 1024, 1024, 1024, 4096]
    - [129, 76.798]
  - - [1024, 4096, 1, 8064, 1024, 1024, 1024, 4096]
    - [166, 77.486]
  - - [1024, 4096, 1, 8160, 1024, 1024, 1024, 4096]
    - [166, 77.125]
  - - [1024, 4096, 1, 9216, 1024, 1024, 1024, 4096]
    - [166, 77.763]
  - - [1024, 4096, 1, 9520, 1024, 1024, 1024, 4096]
    - [129, 77.303]
  - - [1024, 42720, 1, 10080, 1024, 1024, 1024, 42720]
    - [129, 93.174]
  - - [1024, 42720, 1, 3968, 1024, 1024, 1024, 42720]
    - [129, 91.591]
  - - [1024, 42720, 1, 6528, 1024, 1024, 1024, 42720]
    - [129, 93.226]
  - - [1024, 42720, 1, 7104, 1024, 1024, 1024, 42720]
    - [152, 92.908]
  - - [1024, 42720, 1, 7200, 1024, 1024, 1024, 42720]
    - [129, 93.149]
  - - [1024, 42720, 1, 9520, 1024, 1024, 1024, 42720]
    - [129, 92.663]
  - - [4096, 1024, 1, 10064, 4096, 4096, 4096, 1024]
    - [15, 75.446]
  - - [4096, 1024, 1, 10080, 4096, 4096, 4096, 1024]
    - [15, 76.339]
  - - [4096, 1024, 1, 10200, 4096, 4096, 4096, 1024]
    - [153, 76.378]
  - - [4096, 1024, 1, 3840, 4096, 4096, 4096, 1024]
    - [129, 72.535]
  - - [4096, 1024, 1, 3968, 4096, 4096, 4096, 1024]
    - [129, 72.242]
  - - [4096, 1024, 1, 6528, 4096, 4096, 4096, 1024]
    - [15, 74.015]
  - - [4096, 1024, 1, 7104, 4096, 4096, 4096, 1024]
    - [15, 74.499]
  - - [4096, 1024, 1, 7200, 4096, 4096, 4096, 1024]
    - [129, 75.085]
  - - [4096, 1024, 1, 8064, 4096, 4096, 4096, 1024]
    - [153, 75.871]
  - - [4096, 1024, 1, 8160, 4096, 4096, 4096, 1024]
    - [15, 75.082]
  - - [4096, 1024, 1, 9216, 4096, 4096, 4096, 1024]
    - [153, 76.854]
  - - [4096, 1024, 1, 9520, 4096, 4096, 4096, 1024]
    - [15, 75.249]
  - - [24, 64, 4736, 24, 24, 24, 24, 303104]
    - [106, 4.065]
  - - [32, 64, 4608, 32, 32, 32, 32, 294912]
    - [169, 7.497]
  - - [32, 64, 4608, 35, 32, 32, 32, 294912]
    - [176, 5.682]
  - - [64, 14, 10880, 14, 64, 64, 696320, 14]
    - [341, 2.136]
  - - [64, 15, 10880, 14, 64, 64, 696320, 15]
    - [351, 2.221]
  - - [64, 15, 7680, 15, 64, 64, 491520, 15]
    - [355, 2.236]
  - - [64, 15, 10880, 15, 64, 64, 696320, 15]
    - [349, 2.331]
  - - [64, 17, 7680, 15, 64, 64, 491520, 17]
    - [37, 2.454]
  - - [64, 17, 6144, 17, 64, 64, 393216, 17]
    - [107, 2.152]
  - - [64, 17, 7680, 17, 64, 64, 491520, 17]
    - [95, 2.439]
  - - [64, 21, 6144, 17, 64, 64, 393216, 21]
    - [155, 2.591]
  - - [64, 21, 6144, 21, 64, 64, 393216, 21]
    - [91, 3.091]
  - - [64, 24, 4736, 24, 64, 64, 303104, 24]
    - [148, 4.233]
  - - [64, 30, 2048, 30, 64, 64, 131072, 30]
    - [55, 4.821]
  - - [64, 30, 2048, 31, 64, 64, 131072, 30]
    - [148, 5.003]
  - - [64, 31, 2048, 31, 64, 64, 131072, 31]
    - [163, 5.148]
  - - [64, 32, 4608, 32, 64, 64, 294912, 32]
    - [133, 7.517]
  - - [64, 32, 4608, 35, 64, 64, 294912, 32]
    - [186, 5.703]
  - - [64, 34, 4736, 24, 64, 64, 303104, 34]
    - [147, 4.611]
  - - [64, 34, 4736, 34, 64, 64, 303104, 34]
    - [147, 5.263]
  - - [64, 35, 4608, 35, 64, 64, 294912, 35]
    - [67, 5.333]
  - - [512, 64, 1, 512, 512, 512, 512, 64]
    - [49, 1.44]
  - - [64, 512, 1, 512, 64, 64, 64, 512]
    - [49, 1.428]
  - - [64, 128, 1, 128, 64, 64, 64, 128]
    - [31, 0.142]
  - - [128, 64, 1, 128, 128, 128, 128, 64]
    - [145, 0.144]
  - - [2048, 2048, 1, 512, 2048, 2048, 2048, 2048]
    - [121, 54.761]
  - - [1024, 64, 1, 512, 1024, 1024, 1024, 64]
    - [42, 2.881]
  - - [2048, 512, 1, 1, 2048, 2048, 2048, 512]
    - [67, 0.192]
  - - [1600, 1024, 1, 512, 1600, 1600, 1600, 1024]
    - [137, 32.306]
  - - [512, 32, 1, 1600, 512, 512, 512, 32]
    - [229, 1.902]
  - - [560, 1024, 1, 1600, 560, 560, 560, 1024]
    - [174, 25.479]
  - - [1024, 1600, 1, 1, 1024, 1024, 1024, 1600]
    - [0, 0.274]
  - - [1024, 1024, 1, 1600, 1024, 1024, 1024, 1024]
    - [66, 38.295]
  - - [512, 512, 1, 1600, 512, 512, 512, 512]
    - [205, 16.493]
  - - [256, 1280, 1, 8976, 256, 256, 256, 1280]
    - [241, 40.302]
  - - [256, 2560, 1, 8976, 256, 256, 256, 2560]
    - [226, 52.681]
  - - [256, 2816, 1, 8976, 256, 256, 256, 2816]
    - [231, 53.12]
  - - [256, 3328, 1, 8976, 256, 256, 256, 3328]
    - [198, 54.883]
  - - [256, 3584, 1, 8976, 256, 256, 256, 3584]
    - [198, 56.755]
  - - [256, 3840, 1, 8976, 256, 256, 256, 3840]
    - [232, 59.068]
  - - [256, 4096, 1, 8976, 256, 256, 256, 4096]
    - [207, 55.855]
  - - [256, 4352, 1, 8976, 256, 256, 256, 4352]
    - [214, 58.093]
  - - [256, 4864, 1, 8976, 256, 256, 256, 4864]
    - [227, 65.415]
  - - [256, 5120, 1, 8976, 256, 256, 256, 5120]
    - [224, 68.345]
  - - [256, 5632, 1, 8976, 256, 256, 256, 5632]
    - [202, 66.509]
  - - [256, 5888, 1, 8976, 256, 256, 256, 5888]
    - [219, 65.033]
  - - [256, 6144, 1, 8976, 256, 256, 256, 6144]
    - [222, 67.721]
  - - [256, 7168, 1, 8976, 256, 256, 256, 7168]
    - [201, 69.843]
  - - [256, 8192, 1, 8976, 256, 256, 256, 8192]
    - [196, 66.228]
  - - [256, 8960, 1, 8976, 256, 256, 256, 8960]
    - [195, 70.604]
  - - [256, 9728, 1, 8976, 256, 256, 256, 9728]
    - [223, 70.129]
  - - [256, 9984, 1, 8976, 256, 256, 256, 9984]
    - [208, 71.614]
  - - [256, 10240, 1, 8976, 256, 256, 256, 10240]
    - [217, 73.037]
  - - [256, 10496, 1, 8976, 256, 256, 256, 10496]
    - [213, 63.652]
  - - [256, 11008, 1, 8976, 256, 256, 256, 11008]
    - [27, 65.177]
  - - [256, 11264, 1, 8976, 256, 256, 256, 11264]
    - [27, 66.693]
  - - [256, 11520, 1, 8976, 256, 256, 256, 11520]
    - [63, 68.133]
  - - [256, 11776, 1, 8976, 256, 256, 256, 11776]
    - [27, 69.551]
  - - [256, 12544, 1, 8976, 256, 256, 256, 12544]
    - [85, 73.905]
  - - [256, 12800, 1, 8976, 256, 256, 256, 12800]
    - [85, 75.31]
  - - [256, 13312, 1, 8976, 256, 256, 256, 13312]
    - [158, 79.985]
  - - [256, 13568, 1, 8976, 256, 256, 256, 13568]
    - [159, 81.844]
  - - [256, 14336, 1, 8976, 256, 256, 256, 14336]
    - [159, 86.259]
  - - [256, 14848, 1, 8976, 256, 256, 256, 14848]
    - [29, 89.065]
  - - [256, 15104, 1, 8976, 256, 256, 256, 15104]
    - [172, 90.424]
  - - [256, 15872, 1, 8976, 256, 256, 256, 15872]
    - [127, 83.248]
  - - [256, 16128, 1, 8976, 256, 256, 256, 16128]
    - [127, 84.509]
  - - [256, 17152, 1, 8976, 256, 256, 256, 17152]
    - [127, 88.219]
  - - [256, 17408, 1, 8976, 256, 256, 256, 17408]
    - [152, 82.023]
  - - [256, 18688, 1, 8976, 256, 256, 256, 18688]
    - [129, 87.784]
  - - [256, 19968, 1, 8976, 256, 256, 256, 19968]
    - [26, 70.348]
  - - [256, 20480, 1, 8976, 256, 256, 256, 20480]
    - [84, 70.646]
  - - [256, 20992, 1, 8976, 256, 256, 256, 20992]
    - [138, 73.306]
  - - [256, 21248, 1, 8976, 256, 256, 256, 21248]
    - [138, 71.439]
  - - [256, 22016, 1, 8976, 256, 256, 256, 22016]
    - [84, 73.436]
  - - [256, 26112, 1, 8976, 256, 256, 256, 26112]
    - [151, 80.609]
  - - [256, 32512, 1, 8976, 256, 256, 256, 32512]
    - [77, 84.429]
  - - [256, 33536, 1, 8976, 256, 256, 256, 33536]
    - [77, 87.235]
  - - [256, 44505, 1, 8976, 256, 256, 256, 44505]
    - [159, 87.667]
  - - [480, 1024, 1, 32768, 480, 480, 480, 1024]
    - [259, 69.976]
  - - [512, 32, 1, 200, 512, 512, 512, 32]
    - [13, 0.313]
  - - [512, 512, 1, 200, 512, 512, 512, 512]
    - [7, 5.006]
  - - [512, 2048, 1, 256, 512, 512, 512, 2048]
    - [135, 19.177]
  - - [560, 1024, 1, 200, 560, 560, 560, 1024]
    - [45, 8.945]
  - - [768, 2048, 1, 256, 768, 768, 768, 2048]
    - [83, 26.537]
  - - [1024, 64, 1, 960, 1024, 1024, 1024, 64]
    - [216, 3.75]
  - - [1024, 256, 1, 1024, 1024, 1024, 1024, 256]
    - [65, 12.195]
  - - [1024, 256, 1, 1280, 1024, 1024, 1024, 256]
    - [173, 12.976]
  - - [1024, 256, 1, 2304, 1024, 1024, 1024, 256]
    - [233, 18.175]
  - - [1024, 256, 1, 2816, 1024, 1024, 1024, 256]
    - [230, 20.998]
  - - [1024, 256, 1, 3072, 1024, 1024, 1024, 256]
    - [230, 21.845]
  - - [1024, 256, 1, 3328, 1024, 1024, 1024, 256]
    - [235, 22.934]
  - - [1024, 256, 1, 3584, 1024, 1024, 1024, 256]
    - [236, 23.572]
  - - [1024, 256, 1, 4096, 1024, 1024, 1024, 256]
    - [243, 25.7]
  - - [1024, 256, 1, 4352, 1024, 1024, 1024, 256]
    - [243, 27.447]
  - - [1024, 256, 1, 4608, 1024, 1024, 1024, 256]
    - [247, 27.913]
  - - [1024, 256, 1, 5120, 1024, 1024, 1024, 256]
    - [249, 29.143]
  - - [1024, 256, 1, 5376, 1024, 1024, 1024, 256]
    - [243, 30.601]
  - - [1024, 256, 1, 5632, 1024, 1024, 1024, 256]
    - [242, 30.98]
  - - [1024, 256, 1, 6144, 1024, 1024, 1024, 256]
    - [247, 32.276]
  - - [1024, 256, 1, 6400, 1024, 1024, 1024, 256]
    - [254, 33.194]
  - - [1024, 256, 1, 7680, 1024, 1024, 1024, 256]
    - [246, 35.684]
  - - [1024, 256, 1, 7936, 1024, 1024, 1024, 256]
    - [242, 36.873]
  - - [1024, 256, 1, 8192, 1024, 1024, 1024, 256]
    - [242, 36.944]
  - - [1024, 256, 1, 8448, 1024, 1024, 1024, 256]
    - [252, 38.028]
  - - [1024, 256, 1, 9728, 1024, 1024, 1024, 256]
    - [248, 39.188]
  - - [1024, 256, 1, 9984, 1024, 1024, 1024, 256]
    - [261, 39.569]
  - - [1024, 256, 1, 10496, 1024, 1024, 1024, 256]
    - [243, 40.108]
  - - [1024, 256, 1, 11520, 1024, 1024, 1024, 256]
    - [238, 42.245]
  - - [1024, 256, 1, 12032, 1024, 1024, 1024, 256]
    - [271, 43.537]
  - - [1024, 256, 1, 13568, 1024, 1024, 1024, 256]
    - [266, 46.102]
  - - [1024, 256, 1, 14336, 1024, 1024, 1024, 256]
    - [266, 47.399]
  - - [1024, 256, 1, 14848, 1024, 1024, 1024, 256]
    - [266, 48.183]
  - - [1024, 256, 1, 15104, 1024, 1024, 1024, 256]
    - [275, 48.756]
  - - [1024, 256, 1, 15872, 1024, 1024, 1024, 256]
    - [275, 49.921]
  - - [1024, 256, 1, 16128, 1024, 1024, 1024, 256]
    - [266, 49.582]
  - - [1024, 256, 1, 17152, 1024, 1024, 1024, 256]
    - [271, 50.758]
  - - [1024, 256, 1, 17408, 1024, 1024, 1024, 256]
    - [275, 51.145]
  - - [1024, 256, 1, 18944, 1024, 1024, 1024, 256]
    - [271, 53.604]
  - - [1024, 256, 1, 19712, 1024, 1024, 1024, 256]
    - [271, 53.852]
  - - [1024, 256, 1, 19968, 1024, 1024, 1024, 256]
    - [266, 54.673]
  - - [1024, 256, 1, 21248, 1024, 1024, 1024, 256]
    - [275, 55.396]
  - - [1024, 256, 1, 21504, 1024, 1024, 1024, 256]
    - [270, 54.331]
  - - [1024, 256, 1, 22016, 1024, 1024, 1024, 256]
    - [271, 57.035]
  - - [1024, 256, 1, 28672, 1024, 1024, 1024, 256]
    - [266, 62.804]
  - - [1024, 256, 1, 33536, 1024, 1024, 1024, 256]
    - [266, 63.877]
  - - [1024, 1024, 1, 960, 1024, 1024, 1024, 1024]
    - [115, 32.262]
  - - [1600, 1024, 1, 960, 1600, 1600, 1600, 1024]
    - [59, 42.789]
  - - [2048, 256, 1, 1024, 2048, 2048, 2048, 256]
    - [87, 22.43]
  - - [2048, 960, 1, 1, 2048, 2048, 2048, 960]
    - [2, 0.307]
  - - [2048, 2048, 1, 960, 2048, 2048, 2048, 2048]
    - [121, 60.876]
  - - [2048, 2048, 1, 1024, 2048, 2048, 2048, 2048]
    - [164, 59.11]
  - - [3200, 2048, 1, 1024, 3200, 3200, 3200, 2048]
    - [158, 66.179]
  - - [4096, 4096, 1, 1024, 4096, 4096, 4096, 4096]
    - [101, 70.858]
  - - [2048, 2, 1, 2, 2048, 2048, 2048, 2]
    - [3, 0.001]
  - - [2048, 2048, 1, 2, 2048, 2048, 1048576, 2048]
    - [92, 0.836]
  - - [2048, 30592, 1, 1024, 2048, 2048, 2048, 30592]
    - [86, 82.473]
  - - [2048, 6144, 1, 1024, 2048, 2048, 2048, 6144]
    - [141, 68.826]
  - - [2048, 8192, 1, 1024, 2048, 2048, 2048, 8192]
    - [27, 70.828]
  - - [8192, 2048, 1, 1024, 8192, 8192, 8192, 2048]
    - [112, 70.983]
  - - [1024, 1024, 1, 16, 1024, 1024, 524288, 1024]
    - [191, 3.14]
  - - [1024, 2, 1, 16, 1024, 1024, 1024, 2]
    - [10, 0.005]
  - - [1024, 30592, 1, 8192, 1024, 1024, 1024, 30592]
    - [9, 94.552]
  - - [1024, 3072, 1, 8192, 1024, 1024, 1024, 3072]
    - [172, 73.325]
  - - [512, 64, 256, 512, 512, 512, 512, 64]
    - [2, 33.92]
  - - [64, 512, 256, 512, 64, 64, 64, 512]
    - [46, 33.692]
  - - [1024, 30592, 1, 2048, 1024, 1024, 1024, 30592]
    - [82, 87.701]
  - - [1024, 3072, 1, 2048, 1024, 1024, 1024, 3072]
    - [27, 63.133]
  - - [1024, 1024, 1, 8, 1024, 1024, 524288, 1024]
    - [0, 1.354]
  - - [1024, 30592, 1, 4096, 1024, 1024, 1024, 30592]
    - [86, 92.03]
  - - [1024, 3072, 1, 4096, 1024, 1024, 1024, 3072]
    - [172, 69.5]
  - - [512, 64, 128, 512, 512, 512, 512, 64]
    - [70, 29.774]
  - - [64, 512, 128, 512, 64, 64, 64, 512]
    - [135, 29.996]
  - - [2560, 1920, 1, 2048, 2560, 2560, 2560, 1920]
    - [78, 87.067]
  - - [2560, 2, 1, 4, 2560, 2560, 2560, 2]
    - [355, 0.004]
  - - [2560, 2560, 1, 2048, 2560, 2560, 2560, 2560]
    - [27, 74.149]
  - - [2560, 2560, 1, 4, 2560, 2560, 1310720, 2560]
    - [74, 1.777]
  - - [2560, 7680, 1, 2048, 2560, 2560, 2560, 7680]
    - [129, 89.189]
  - - [640, 2560, 1, 2048, 640, 640, 640, 2560]
    - [88, 54.423]
  - - [512, 64, 40, 512, 512, 512, 512, 64]
    - [137, 26.84]
  - - [64, 512, 40, 512, 64, 64, 64, 512]
    - [24, 26.955]
  - - [1536, 1536, 1, 4096, 1536, 1536, 1536, 1536]
    - [14, 64.46]
  - - [1536, 4608, 1, 4096, 1536, 1536, 1536, 4608]
    - [86, 83.946]
  - - [1536, 50304, 1, 4096, 1536, 1536, 1536, 50304]
    - [102, 91.57]
  - - [1536, 6144, 1, 4096, 1536, 1536, 1536, 6144]
    - [129, 85.865]
  - - [6144, 1536, 1, 4096, 6144, 6144, 6144, 1536]
    - [129, 85.682]
  - - [1024, 96, 64, 1024, 1024, 1024, 1024, 96]
    - [34, 48.272]
  - - [96, 1024, 64, 1024, 96, 96, 96, 1024]
    - [47, 46.629]
  - - [1536, 1536, 1, 8192, 1536, 1536, 1536, 1536]
    - [200, 71.748]
  - - [1536, 4608, 1, 8192, 1536, 1536, 1536, 4608]
    - [48, 85.831]
  - - [1536, 50304, 1, 8192, 1536, 1536, 1536, 50304]
    - [141, 93.471]
  - - [1536, 6144, 1, 8192, 1536, 1536, 1536, 6144]
    - [129, 89.266]
  - - [6144, 1536, 1, 8192, 6144, 6144, 6144, 1536]
    - [129, 89.036]
  - - [1024, 96, 128, 1024, 1024, 1024, 1024, 96]
    - [89, 52.542]
  - - [96, 1024, 128, 1024, 96, 96, 96, 1024]
    - [62, 51.686]
  - - [1024, 1024, 1, 16384, 1024, 1024, 1024, 1024]
    - [244, 66.3]
  - - [1024, 3072, 1, 16384, 1024, 1024, 1024, 3072]
    - [140, 75.612]
  - - [1024, 4096, 1, 16384, 1024, 1024, 1024, 4096]
    - [129, 78.63]
  - - [1024, 50304, 1, 16384, 1024, 1024, 1024, 50304]
    - [129, 91.291]
  - - [4096, 1024, 1, 16384, 4096, 4096, 4096, 1024]
    - [15, 78.067]
  - - [1024, 64, 256, 1024, 1024, 1024, 1024, 64]
    - [28, 40.468]
  - - [64, 1024, 256, 1024, 64, 64, 64, 1024]
    - [136, 40.519]
  - - [1024, 50304, 1, 2048, 1024, 1024, 1024, 50304]
    - [152, 84.956]
  - - [1024, 64, 32, 1024, 1024, 1024, 1024, 64]
    - [130, 33.721]
  - - [64, 1024, 32, 1024, 64, 64, 64, 1024]
    - [38, 33.274]
  - - [1024, 50304, 1, 4096, 1024, 1024, 1024, 50304]
    - [152, 88.501]
  - - [1024, 64, 64, 1024, 1024, 1024, 1024, 64]
    - [25, 35.508]
  - - [64, 1024, 64, 1024, 64, 64, 64, 1024]
    - [113, 35.665]
  - - [1024, 50304, 1, 8192, 1024, 1024, 1024, 50304]
    - [78, 90.323]
  - - [1024, 64, 128, 1024, 1024, 1024, 1024, 64]
    - [124, 39.777]
  - - [64, 1024, 128, 1024, 64, 64, 64, 1024]
    - [46, 39.465]
  - - [1024, 2, 1, 64, 1024, 1024, 1024, 2]
    - [343, 0.019]
  - - [1024, 30528, 1, 8192, 1024, 1024, 1024, 30528]
    - [141, 93.808]
  - - [1024, 1024, 1, 64, 1024, 1024, 131072, 1024]
    - [134, 9.102]
  - - [64, 128, 1024, 128, 64, 64, 64, 128]
    - [68, 19.437]
  - - [128, 64, 1024, 128, 128, 128, 128, 64]
    - [118, 19.781]
  - - [1024, 1024, 1, 3456, 1024, 1024, 1024, 1024]
    - [104, 45.83]
  - - [1024, 1024, 1, 6912, 1024, 1024, 1024, 1024]
    - [218, 51.896]
  - - [1024, 1024, 1, 864, 1024, 1024, 1024, 1024]
    - [125, 26.495]
  - - [1024, 512, 1, 3456, 1024, 1024, 1024, 512]
    - [228, 32.485]
  - - [1024, 512, 1, 4096, 1024, 1024, 1024, 512]
    - [204, 35.383]
  - - [1024, 512, 1, 6912, 1024, 1024, 1024, 512]
    - [256, 44.742]
  - - [1024, 512, 1, 864, 1024, 1024, 1024, 512]
    - [97, 17.518]
  - - [256, 128, 1, 3456, 256, 256, 256, 128]
    - [239, 6.463]
  - - [256, 128, 1, 4096, 256, 256, 256, 128]
    - [268, 7.432]
  - - [256, 128, 1, 55296, 256, 256, 256, 128]
    - [272, 27.936]
  - - [256, 128, 1, 6912, 256, 256, 256, 128]
    - [269, 10.87]
  - - [256, 128, 1, 864, 256, 256, 256, 128]
    - [221, 1.934]
  - - [256, 3456, 1, 1, 256, 256, 256, 3456]
    - [4, 0.162]
  - - [256, 4096, 1, 1, 256, 256, 256, 4096]
    - [11, 0.178]
  - - [256, 6912, 1, 1, 256, 256, 256, 6912]
    - [35, 0.267]
  - - [256, 864, 1, 1, 256, 256, 256, 864]
    - [22, 0.056]
  - - [480, 1024, 1, 3456, 480, 480, 480, 1024]
    - [212, 34.71]
  - - [480, 1024, 1, 4096, 480, 480, 480, 1024]
    - [212, 36.514]
  - - [480, 1024, 1, 6912, 480, 480, 480, 1024]
    - [240, 45.616]
  - - [480, 1024, 1, 864, 480, 480, 480, 1024]
    - [23, 16.629]
  - - [512, 256, 1, 3456, 512, 512, 512, 256]
    - [251, 17.518]
  - - [512, 256, 1, 4096, 512, 512, 512, 256]
    - [253, 19.703]
  - - [512, 256, 1, 55296, 512, 512, 512, 256]
    - [276, 55.506]
  - - [512, 256, 1, 6912, 512, 512, 512, 256]
    - [245, 25.77]
  - - [512, 256, 1, 864, 512, 512, 512, 256]
    - [209, 6.463]
  - - [30528, 1024, 1, 640, 30528, 30528, 30528, 1024]
    - [94, 74.774]
  - - [1024, 1024, 1, 32, 1024, 1024, 1024, 1024]
    - [125, 5.509]
  - - [30528, 1024, 1, 1280, 30528, 30528, 30528, 1024]
    - [181, 83.307]
  - - [1024, 1024, 1, 64, 1024, 1024, 1024, 1024]
    - [170, 9.236]
  - - [4096, 1024, 1, 10240, 4096, 4096, 4096, 1024]
    - [15, 77.491]
  - - [1024, 4096, 1, 10240, 1024, 1024, 1024, 4096]
    - [129, 78.72]
  - - [30528, 1024, 1, 1600, 30528, 30528, 30528, 1024]
    - [190, 86.299]
  - - [1024, 2, 1, 80, 1024, 1024, 1024, 2]
    - [341, 0.023]
  - - [1024, 1024, 1, 10240, 1024, 1024, 1024, 1024]
    - [203, 57.684]
  - - [1024, 1024, 1, 80, 1024, 1024, 1024, 1024]
    - [122, 10.065]
  - - [64, 128, 1280, 128, 64, 64, 64, 128]
    - [117, 20.194]
  - - [128, 64, 1280, 128, 128, 128, 128, 64]
    - [53, 19.781]
  - - [1024, 4096, 1, 10496, 1024, 1024, 1024, 4096]
    - [129, 77.544]
  - - [30528, 1024, 1, 1640, 30528, 30528, 30528, 1024]
    - [190, 83.805]
  - - [4096, 1024, 1, 10496, 4096, 4096, 4096, 1024]
    - [15, 76.908]
  - - [1024, 1024, 1, 10496, 1024, 1024, 1024, 1024]
    - [264, 58.027]
  - - [1024, 1024, 1, 82, 1024, 1024, 1024, 1024]
    - [71, 8.747]
  - - [1024, 2, 1, 82, 1024, 1024, 1024, 2]
    - [355, 0.022]
  - - [128, 64, 1312, 128, 128, 128, 128, 64]
    - [90, 19.869]
  - - [64, 128, 1312, 128, 64, 64, 64, 128]
    - [52, 20.244]
  - - [30528, 1024, 1, 160, 30528, 30528, 30528, 1024]
    - [151, 47.329]
  - - [1024, 4096, 1, 6144, 1024, 1024, 1024, 4096]
    - [129, 76.415]
  - - [30528, 1024, 1, 240, 30528, 30528, 30528, 1024]
    - [192, 54.345]
  - - [4096, 1024, 1, 6144, 4096, 4096, 4096, 1024]
    - [15, 73.751]
  - - [1024, 1024, 1, 12, 1024, 1024, 1024, 1024]
    - [0, 1.84]
  - - [1024, 2, 1, 12, 1024, 1024, 1024, 2]
    - [3, 0.004]
  - - [1024, 1024, 1, 6144, 1024, 1024, 1024, 1024]
    - [210, 49.298]
  - - [64, 512, 192, 512, 64, 64, 64, 512]
    - [68, 33.2]
  - - [512, 64, 192, 512, 512, 512, 512, 64]
    - [137, 32.415]
  - - [3136, 64, 64, 128, 3136, 3136, 3136, 64]
    - [35, 24.54]
  - - [3136, 64, 64, 256, 3136, 3136, 3136, 64]
    - [19, 31.211]
  - - [3136, 128, 64, 256, 3136, 3136, 3136, 128]
    - [26, 49.999]
  - - [784, 256, 64, 512, 784, 784, 784, 256]
    - [131, 58.174]
  - - [3136, 256, 64, 128, 3136, 3136, 3136, 256]
    - [188, 49.917]
  - - [3136, 256, 64, 256, 3136, 3136, 3136, 256]
    - [131, 64.212]
  - - [784, 512, 64, 256, 784, 784, 784, 512]
    - [21, 54.323]
  - - [784, 512, 64, 512, 784, 784, 784, 512]
    - [81, 63.386]
  - - [3136, 64, 32, 128, 3136, 3136, 3136, 64]
    - [56, 22.171]
  - - [3136, 64, 32, 256, 3136, 3136, 3136, 64]
    - [69, 29.087]
  - - [3136, 128, 32, 256, 3136, 3136, 3136, 128]
    - [84, 47.127]
  - - [784, 256, 32, 512, 784, 784, 784, 256]
    - [26, 51.808]
  - - [3136, 256, 32, 128, 3136, 3136, 3136, 256]
    - [60, 44.6]
  - - [3136, 256, 32, 256, 3136, 3136, 3136, 256]
    - [26, 58.729]
  - - [784, 512, 32, 256, 784, 784, 784, 512]
    - [112, 49.081]
  - - [784, 512, 32, 512, 784, 784, 784, 512]
    - [81, 58.229]
  - - [3136, 256, 32, 64, 3136, 3136, 3136, 256]
    - [60, 29.477]
  - - [3136, 64, 32, 64, 3136, 3136, 3136, 64]
    - [23, 17.406]
  - - [784, 512, 32, 128, 784, 784, 784, 512]
    - [20, 38.087]
  - - [784, 128, 32, 512, 784, 784, 784, 128]
    - [84, 46.346]
  - - [3136, 64, 64, 64, 3136, 3136, 3136, 64]
    - [45, 19.931]
  - - [3136, 256, 64, 64, 3136, 3136, 3136, 256]
    - [54, 31.956]
  - - [784, 128, 64, 512, 784, 784, 784, 128]
    - [84, 50.532]
  - - [784, 512, 64, 128, 784, 784, 784, 512]
    - [188, 42.742]
  - - [64, 1280, 64, 192, 64, 64, 64, 1280]
    - [1, 27.227]
  - - [64, 1280, 64, 320, 64, 64, 64, 1280]
    - [36, 31.848]
  - - [64, 1280, 64, 384, 64, 64, 64, 1280]
    - [135, 33.171]
  - - [64, 1280, 64, 448, 64, 64, 64, 1280]
    - [24, 34.671]
  - - [64, 2048, 64, 192, 64, 64, 64, 2048]
    - [123, 28.71]
  - - [64, 2048, 64, 320, 64, 64, 64, 2048]
    - [68, 32.625]
  - - [64, 2048, 64, 384, 64, 64, 64, 2048]
    - [171, 33.608]
  - - [64, 2048, 64, 448, 64, 64, 64, 2048]
    - [24, 35.17]
  - - [64, 1280, 32, 192, 64, 64, 64, 1280]
    - [18, 25.461]
  - - [64, 1280, 32, 320, 64, 64, 64, 1280]
    - [18, 30.666]
  - - [64, 1280, 32, 384, 64, 64, 64, 1280]
    - [18, 31.826]
  - - [64, 1280, 32, 448, 64, 64, 64, 1280]
    - [80, 33.611]
  - - [64, 2048, 32, 192, 64, 64, 64, 2048]
    - [72, 25.29]
  - - [64, 2048, 32, 320, 64, 64, 64, 2048]
    - [24, 29.211]
  - - [64, 2048, 32, 384, 64, 64, 64, 2048]
    - [156, 30.698]
  - - [64, 2048, 32, 448, 64, 64, 64, 2048]
    - [156, 31.628]
  - - [1024, 1024, 1, 10224, 1024, 1024, 1024, 1024]
    - [263, 57.07]
  - - [1024, 1024, 1, 10192, 1024, 1024, 1024, 1024]
    - [255, 57.086]
  - - [1024, 1024, 1, 10208, 1024, 1024, 1024, 1024]
    - [206, 57.702]
  - - [1024, 4096, 1, 10224, 1024, 1024, 1024, 4096]
    - [129, 78.016]
  - - [4096, 1024, 1, 10224, 4096, 4096, 4096, 1024]
    - [15, 76.007]
  - - [1024, 3072, 1, 10224, 1024, 1024, 1024, 3072]
    - [140, 72.985]
  - - [1024, 3072, 1, 10240, 1024, 1024, 1024, 3072]
    - [140, 74.343]
  - - [4096, 1024, 1, 10192, 4096, 4096, 4096, 1024]
    - [41, 75.554]
  - - [1024, 3072, 1, 10192, 1024, 1024, 1024, 3072]
    - [126, 72.738]
  - - [1024, 4096, 1, 10192, 1024, 1024, 1024, 4096]
    - [129, 78.03]
  - - [1024, 3072, 1, 10200, 1024, 1024, 1024, 3072]
    - [140, 72.743]
  - - [1024, 1024, 1, 10184, 1024, 1024, 1024, 1024]
    - [225, 57.074]
  - - [4096, 1024, 1, 10208, 4096, 4096, 4096, 1024]
    - [15, 75.788]
  - - [1024, 3072, 1, 10208, 1024, 1024, 1024, 3072]
    - [140, 74.147]
  - - [1024, 4096, 1, 10208, 1024, 1024, 1024, 4096]
    - [166, 77.533]
  - - [1024, 2048, 1, 10224, 1024, 1024, 1024, 2048]
    - [199, 65.489]
  - - [1024, 2048, 1, 10240, 1024, 1024, 1024, 2048]
    - [200, 68.08]
  - - [1024, 1024, 1, 10120, 1024, 1024, 1024, 1024]
    - [214, 57.503]
  - - [1024, 2048, 1, 10192, 1024, 1024, 1024, 2048]
    - [197, 65.778]
  - - [64, 24, 6816, 24, 1308672, 1308672, 436224, 24]
    - [148, 4.154]
  - - [64, 24, 6816, 24, 1308672, 1308672, 1308672, 24]
    - [107, 4.033]
  - - [1024, 1024, 1, 10152, 1024, 1024, 1024, 1024]
    - [224, 57.786]
  - - [1024, 3072, 1, 10080, 1024, 1024, 1024, 3072]
    - [140, 74.168]
  - - [64, 26, 6272, 26, 1204224, 1204224, 401408, 26]
    - [107, 4.494]
  - - [64, 26, 6272, 26, 1204224, 1204224, 1204224, 26]
    - [187, 4.416]
  - - [100352, 256, 1, 512, 100352, 100352, 100352, 256]
    - [44, 70.785]
  - - [12544, 1024, 1, 2048, 12544, 12544, 12544, 1024]
    - [9, 74.423]
  - - [12544, 147, 1, 64, 12544, 12544, 12544, 147]
    - [98, 11.876]
  - - [200704, 256, 1, 512, 200704, 200704, 200704, 256]
    - [180, 74.333]
  - - [25088, 512, 1, 1024, 25088, 25088, 25088, 512]
    - [114, 70.3]
  - - [3136, 576, 1, 64, 3136, 3136, 3136, 576]
    - [167, 13.035]
  - - [50176, 512, 1, 1024, 50176, 50176, 50176, 512]
    - [99, 79.467]
  - - [6272, 1024, 1, 2048, 6272, 6272, 6272, 1024]
    - [139, 72.282]
  - - [784, 1152, 1, 128, 784, 784, 784, 1152]
    - [143, 12.88]
  - - [3136, 256, 128, 128, 3136, 3136, 3136, 256]
    - [177, 52.515]
  - - [3136, 256, 256, 128, 3136, 3136, 3136, 256]
    - [182, 53.954]
  - - [3136, 256, 128, 64, 3136, 3136, 3136, 256]
    - [26, 33.578]
  - - [3136, 256, 256, 64, 3136, 3136, 3136, 256]
    - [62, 34.374]
  - - [3136, 64, 128, 256, 3136, 3136, 3136, 64]
    - [19, 32.258]
  - - [3136, 64, 256, 256, 3136, 3136, 3136, 64]
    - [19, 32.747]
  - - [3136, 64, 128, 64, 3136, 3136, 3136, 64]
    - [134, 21.581]
  - - [3136, 64, 256, 64, 3136, 3136, 3136, 64]
    - [23, 22.611]
  - - [784, 128, 128, 512, 784, 784, 784, 128]
    - [26, 53.707]
  - - [784, 128, 256, 512, 784, 784, 784, 128]
    - [138, 54.637]
  - - [784, 512, 128, 128, 784, 784, 784, 512]
    - [81, 46.277]
  - - [784, 512, 256, 128, 784, 784, 784, 512]
    - [183, 48.732]
  - - [784, 512, 128, 256, 784, 784, 784, 512]
    - [178, 58.757]
  - - [784, 512, 256, 256, 784, 784, 784, 512]
    - [178, 61.089]
  - - [64, 128, 2048, 128, 64, 64, 64, 128]
    - [36, 20.57]
  - - [128, 64, 2048, 128, 128, 128, 128, 64]
    - [2, 20.634]
  - - [30528, 1024, 1, 2560, 30528, 30528, 30528, 1024]
    - [151, 89.479]
  - - [1024, 1024, 1, 128, 1024, 1024, 1024, 1024]
    - [165, 13.803]
  - - [1024, 2, 1, 128, 1024, 1024, 1024, 2]
    - [345, 0.034]
  - - [128, 64, 1536, 128, 128, 128, 128, 64]
    - [118, 20.124]
  - - [64, 128, 1536, 128, 64, 64, 64, 128]
    - [1, 20.259]
  - - [1024, 4096, 1, 12288, 1024, 1024, 1024, 4096]
    - [129, 79.422]
  - - [30528, 1024, 1, 1920, 30528, 30528, 30528, 1024]
    - [94, 87.411]
  - - [1024, 1024, 1, 96, 1024, 1024, 1024, 1024]
    - [170, 12.395]
  - - [1024, 1024, 1, 12288, 1024, 1024, 1024, 1024]
    - [260, 61.148]
  - - [4096, 1024, 1, 12288, 4096, 4096, 4096, 1024]
    - [41, 76.234]
  - - [1024, 2, 1, 96, 1024, 1024, 1024, 2]
    - [355, 0.027]
  - - [25600, 128, 25, 128, 25600, 25600, 25600, 128]
    - [5, 44.025]
  - - [12544, 128, 36, 128, 12544, 12544, 12544, 128]
    - [5, 43.357]
  - - [9216, 128, 49, 128, 9216, 9216, 9216, 128]
    - [5, 43.466]
  - - [6400, 128, 64, 128, 6400, 6400, 6400, 128]
    - [5, 43.164]
  - - [6400, 256, 25, 256, 6400, 6400, 6400, 256]
    - [184, 64.73]
  - - [4096, 256, 36, 256, 4096, 4096, 4096, 256]
    - [81, 62.5]
  - - [2304, 256, 49, 256, 2304, 2304, 2304, 256]
    - [26, 60.526]
  - - [2304, 256, 64, 256, 2304, 2304, 2304, 256]
    - [81, 62.891]
  - - [2304, 512, 25, 512, 2304, 2304, 2304, 512]
    - [81, 73.752]
  - - [1024, 512, 36, 512, 1024, 1024, 1024, 512]
    - [131, 70.932]
  - - [1024, 512, 49, 512, 1024, 1024, 1024, 512]
    - [81, 72.494]
  - - [1024, 512, 64, 512, 1024, 1024, 1024, 512]
    - [131, 74.607]
  - - [92416, 64, 25, 64, 92416, 92416, 92416, 64]
    - [2, 23.063]
  - - [50176, 64, 36, 64, 50176, 50176, 50176, 64]
    - [25, 23.057]
  - - [36864, 64, 49, 64, 36864, 36864, 36864, 64]
    - [118, 23.212]
  - - [25600, 64, 64, 64, 25600, 25600, 25600, 64]
    - [2, 23.261]
  - - [64, 128, 192, 128, 64, 64, 64, 128]
    - [12, 15.701]
  - - [128, 64, 192, 128, 128, 128, 128, 64]
    - [16, 15.195]
  - - [768, 2, 1, 2048, 768, 768, 768, 2]
    - [258, 0.237]
  - - [3072, 768, 1, 2048, 3072, 3072, 3072, 768]
    - [128, 62.543]
  - - [768, 3072, 1, 2048, 768, 768, 768, 3072]
    - [128, 61.69]
  - - [768, 768, 1, 2048, 768, 768, 768, 768]
    - [32, 29.287]
  - - [64, 384, 144, 384, 64, 64, 64, 384]
    - [52, 32.61]
  - - [384, 64, 144, 384, 384, 384, 384, 64]
    - [76, 30.066]
  - - [768, 2, 1, 4608, 768, 768, 768, 2]
    - [365, 0.436]
  - - [3072, 768, 1, 4608, 3072, 3072, 3072, 768]
    - [128, 67.738]
  - - [768, 3072, 1, 4608, 768, 768, 768, 3072]
    - [128, 65.853]
  - - [768, 768, 1, 4608, 768, 768, 768, 768]
    - [211, 42.322]
  - - [64, 512, 48, 512, 64, 64, 64, 512]
    - [24, 29.098]
  - - [512, 64, 48, 512, 512, 512, 512, 64]
    - [137, 28.656]
  - - [64, 128, 256, 128, 64, 64, 64, 128]
    - [17, 17.206]
  - - [128, 64, 256, 128, 128, 128, 128, 64]
    - [109, 17.206]
  - - [64, 384, 192, 384, 64, 64, 64, 384]
    - [135, 29.491]
  - - [384, 64, 192, 384, 384, 384, 384, 64]
    - [73, 31.577]
  - - [1024, 2, 1, 4608, 1024, 1024, 1024, 2]
    - [362, 0.535]
  - - [4096, 1024, 1, 4608, 4096, 4096, 4096, 1024]
    - [41, 71.211]
  - - [1024, 4096, 1, 4608, 1024, 1024, 1024, 4096]
    - [129, 74.221]
  - - [1024, 1024, 1, 4608, 1024, 1024, 1024, 1024]
    - [115, 47.054]
  - - [13, 512, 1, 32768, 13, 13, 13, 512]
    - [363, 4.918]
  - - [479, 1024, 1, 32768, 479, 479, 479, 1024]
    - [337, 61.575]
  - - [4, 64, 32768, 4, 4, 4, 4, 2097152]
    - [344, 0.201]
  - - [4, 64, 38400, 4, 4, 4, 4, 2457600]
    - [346, 0.202]
  - - [14, 64, 10880, 14, 14, 14, 14, 696320]
    - [348, 1.867]
  - - [15, 64, 10880, 14, 15, 15, 15, 696320]
    - [350, 1.935]
  - - [15, 64, 7680, 15, 15, 15, 15, 491520]
    - [350, 1.979]
  - - [15, 64, 10880, 15, 15, 15, 15, 696320]
    - [350, 2.054]
  - - [17, 64, 7680, 15, 17, 17, 17, 491520]
    - [278, 1.942]
  - - [17, 64, 6144, 17, 17, 17, 17, 393216]
    - [330, 1.84]
  - - [17, 64, 7680, 17, 17, 17, 17, 491520]
    - [334, 1.97]
  - - [21, 64, 6144, 17, 21, 21, 21, 393216]
    - [335, 2.219]
  - - [21, 64, 6144, 21, 21, 21, 21, 393216]
    - [309, 2.647]
  - - [30, 64, 2048, 30, 30, 30, 30, 131072]
    - [332, 3.874]
  - - [30, 64, 2048, 31, 30, 30, 30, 131072]
    - [333, 4.017]
  - - [31, 64, 2048, 31, 31, 31, 31, 131072]
    - [292, 3.982]
  - - [34, 64, 4736, 24, 34, 34, 34, 303104]
    - [325, 3.529]
  - - [34, 64, 4736, 34, 34, 34, 34, 303104]
    - [313, 4.22]
  - - [35, 64, 4608, 35, 35, 35, 35, 294912]
    - [301, 4.324]
  - - [74, 2048, 1, 512, 74, 74, 74, 2048]
    - [291, 5.674]
  - - [5, 64, 1, 5, 5, 5, 5, 64]
    - [277, 0.0]
  - - [33, 32, 1, 33, 33, 33, 33, 32]
    - [297, 0.004]
  - - [3, 64, 512, 3, 3, 3, 3, 64]
    - [354, 0.044]
  - - [5, 64, 512, 5, 5, 5, 5, 64]
    - [340, 0.113]
  - - [5, 64, 960, 5, 5, 5, 5, 64]
    - [356, 0.163]
  - - [9, 64, 512, 9, 9, 9, 9, 64]
    - [340, 0.345]
  - - [27, 128, 32768, 27, 27, 27, 27, 128]
    - [335, 5.296]
  - - [33, 32, 200, 33, 33, 33, 33, 32]
    - [279, 0.881]
  - - [33, 32, 1600, 33, 33, 33, 33, 32]
    - [295, 2.69]
  - - [67, 2048, 1, 512, 67, 67, 67, 2048]
    - [289, 5.302]
  - - [74, 2048, 1, 960, 74, 74, 74, 2048]
    - [291, 7.055]
  - - [100, 2048, 1, 512, 100, 100, 100, 2048]
    - [283, 6.542]
  - - [257, 4096, 1, 1024, 257, 257, 257, 4096]
    - [328, 25.999]
  - - [13, 512, 1, 3456, 13, 13, 13, 512]
    - [336, 1.464]
  - - [13, 512, 1, 4096, 13, 13, 13, 512]
    - [338, 1.747]
  - - [13, 512, 1, 55296, 13, 13, 13, 512]
    - [366, 5.674]
  - - [13, 512, 1, 6912, 13, 13, 13, 512]
    - [339, 2.392]
  - - [13, 512, 1, 864, 13, 13, 13, 512]
    - [358, 0.414]
  - - [196, 512, 64, 1024, 196, 196, 196, 512]
    - [320, 46.0]
  - - [196, 1024, 64, 512, 196, 196, 196, 1024]
    - [305, 43.07]
  - - [196, 1024, 64, 1024, 196, 196, 196, 1024]
    - [306, 49.775]
  - - [49, 1024, 64, 2048, 49, 49, 49, 1024]
    - [300, 27.938]
  - - [49, 2048, 64, 1024, 49, 49, 49, 2048]
    - [319, 29.253]
  - - [196, 512, 32, 1024, 196, 196, 196, 512]
    - [320, 37.257]
  - - [196, 1024, 32, 512, 196, 196, 196, 1024]
    - [286, 37.945]
  - - [196, 1024, 32, 1024, 196, 196, 196, 1024]
    - [323, 45.356]
  - - [49, 1024, 32, 2048, 49, 49, 49, 1024]
    - [315, 26.783]
  - - [49, 2048, 32, 1024, 49, 49, 49, 2048]
    - [285, 25.709]
  - - [196, 1024, 32, 256, 196, 196, 196, 1024]
    - [317, 29.59]
  - - [196, 256, 32, 1024, 196, 196, 196, 256]
    - [303, 30.774]
  - - [49, 2048, 32, 512, 49, 49, 49, 2048]
    - [285, 21.611]
  - - [49, 512, 32, 2048, 49, 49, 49, 512]
    - [293, 21.49]
  - - [196, 256, 64, 1024, 196, 196, 196, 256]
    - [307, 36.505]
  - - [196, 1024, 64, 256, 196, 196, 196, 1024]
    - [324, 33.414]
  - - [49, 512, 64, 2048, 49, 49, 49, 512]
    - [284, 26.303]
  - - [49, 2048, 64, 512, 49, 49, 49, 2048]
    - [310, 24.979]
  - - [1225, 192, 64, 32, 1225, 1225, 1225, 192]
    - [294, 12.916]
  - - [1225, 192, 64, 48, 1225, 1225, 1225, 192]
    - [312, 16.696]
  - - [1225, 192, 64, 64, 1225, 1225, 1225, 192]
    - [296, 20.726]
  - - [1225, 256, 64, 48, 1225, 1225, 1225, 256]
    - [298, 18.901]
  - - [1225, 256, 64, 64, 1225, 1225, 1225, 256]
    - [314, 22.681]
  - - [1225, 288, 64, 48, 1225, 1225, 1225, 288]
    - [322, 19.888]
  - - [1225, 288, 64, 64, 1225, 1225, 1225, 288]
    - [326, 23.52]
  - - [5329, 64, 64, 80, 5329, 5329, 5329, 64]
    - [290, 20.101]
  - - [289, 768, 64, 128, 289, 289, 289, 768]
    - [327, 29.44]
  - - [289, 768, 64, 160, 289, 289, 289, 768]
    - [299, 33.028]
  - - [289, 768, 64, 192, 289, 289, 289, 768]
    - [331, 36.204]
  - - [1225, 192, 32, 32, 1225, 1225, 1225, 192]
    - [282, 11.103]
  - - [1225, 192, 32, 48, 1225, 1225, 1225, 192]
    - [321, 14.7]
  - - [1225, 192, 32, 64, 1225, 1225, 1225, 192]
    - [281, 17.338]
  - - [1225, 256, 32, 48, 1225, 1225, 1225, 256]
    - [298, 16.884]
  - - [1225, 256, 32, 64, 1225, 1225, 1225, 256]
    - [304, 20.238]
  - - [1225, 288, 32, 48, 1225, 1225, 1225, 288]
    - [280, 16.049]
  - - [1225, 288, 32, 64, 1225, 1225, 1225, 288]
    - [296, 20.065]
  - - [5329, 64, 32, 80, 5329, 5329, 5329, 64]
    - [302, 18.403]
  - - [289, 768, 32, 128, 289, 289, 289, 768]
    - [329, 25.55]
  - - [289, 768, 32, 160, 289, 289, 289, 768]
    - [317, 28.899]
  - - [289, 768, 32, 192, 289, 289, 289, 768]
    - [317, 31.589]
  - - [196, 2304, 1, 256, 196, 196, 196, 2304]
    - [287, 10.111]
  - - [49, 4608, 1, 512, 49, 49, 49, 4608]
    - [308, 6.935]
  - - [196, 1024, 128, 256, 196, 196, 196, 1024]
    - [318, 36.767]
  - - [196, 1024, 256, 256, 196, 196, 196, 1024]
    - [318, 38.098]
  - - [196, 1024, 128, 512, 196, 196, 196, 1024]
    - [306, 47.916]
  - - [196, 1024, 256, 512, 196, 196, 196, 1024]
    - [306, 48.847]
  - - [196, 256, 128, 1024, 196, 196, 196, 256]
    - [307, 44.925]
  - - [196, 256, 256, 1024, 196, 196, 196, 256]
    - [320, 50.49]
  - - [49, 2048, 128, 512, 49, 49, 49, 2048]
    - [298, 26.877]
  - - [49, 2048, 256, 512, 49, 49, 49, 2048]
    - [316, 27.881]
  - - [49, 512, 128, 2048, 49, 49, 49, 512]
    - [288, 26.935]
  - - [49, 512, 256, 2048, 49, 49, 49, 512]
    - [311, 30.454]
- null
