TRAIN_3.10/logic/arcturus_Cijk_Ailk_Bljk_HBH.yaml
- {MinimumRequiredVersion: 4.23.0}
- arcturus
- gfx908
- [Device 7380, Device 7388, Device 738c, Device 7390]
    SolutionIndex: 0
    SolutionNameMin: Cijk_Ailk_Bljk_HBH_MT32x32x32_MI16x16x16x1_SE_1LDSB0_GRVW2_LPB16_NLCA1_PLR2_SU0_SUS256_SRVW4_TT1_16_WG32_8_1_WGM1
    SolutionIndex: 1
    SolutionNameMin: Cijk_Ailk_Bljk_HBH_MT64x64x32_MI32x32x8x1_SE_1LDSB0_GRVW2_LPB8_NLCA1_PLR5_SU0_SUS256_SRVW4_TT1_32_WG64_4_1_WGM1
    SolutionIndex: 2
    SolutionNameMin: Cijk_Ailk_Bljk_HBH_MT64x128x32_MI32x32x8x1_SE_1LDSB0_GRVW2_LPB8_NLCA1_PLR5_SU0_SUS256_SRVW4_TT1_64_WG64_4_1_WGM1
    SolutionIndex: 3
    SolutionNameMin: Cijk_Ailk_Bljk_HBH_MT128x64x32_MI32x32x8x1_SE_1LDSB0_GRVW2_LPB8_NLCA1_PLR5_SU0_SUS256_SRVW4_TT2_32_WG64_4_1_WGM1
    SolutionIndex: 4
    SolutionNameMin: Cijk_Ailk_Bljk_HBH_MT32x32x32_MI16x16x16x1_SE_1LDSB0_GRVW4_LPB16_NLCA1_PLR2_SU0_SUS256_SRVW4_TT1_16_WG32_8_1_WGM1
    SolutionIndex: 5
    SolutionNameMin: Cijk_Ailk_Bljk_HBH_MT64x64x32_MI32x32x8x1_SE_1LDSB0_GRVW4_LPB8_NLCA1_PLR5_SU0_SUS256_SRVW4_TT1_32_WG64_4_1_WGM1
    SolutionIndex: 6
    SolutionNameMin: Cijk_Ailk_Bljk_HBH_MT64x128x32_MI32x32x8x1_SE_1LDSB0_GRVW4_LPB8_NLCA1_PLR5_SU0_SUS256_SRVW4_TT1_64_WG64_4_1_WGM1
    SolutionIndex: 7
    SolutionNameMin: Cijk_Ailk_Bljk_HBH_MT128x64x32_MI32x32x8x1_SE_1LDSB0_GRVW4_LPB8_NLCA1_PLR5_SU0_SUS256_SRVW4_TT2_32_WG64_4_1_WGM1
    SolutionIndex: 8
    SolutionNameMin: Cijk_Ailk_Bljk_HBH_MT256x160x32_MI32x32x8x1_SE_1LDSB0_GRVW4_LPB8_NLCA1_PLR5_SU0_SUS256_SRVW4_TT2_160_WG128_2_1_WGM1
    SolutionIndex: 9
    SolutionNameMin: Cijk_Ailk_Bljk_HBH_MT32x32x32_MI16x16x16x1_SE_1LDSB0_GRVW8_LPB16_NLCA1_PLR2_SU0_SUS256_SRVW4_TT1_16_WG32_8_1_WGM1
    SolutionIndex: 10
    SolutionNameMin: Cijk_Ailk_Bljk_HBH_MT64x64x32_MI32x32x8x1_SE_1LDSB0_GRVW8_LPB8_NLCA1_PLR5_SU0_SUS256_SRVW4_TT1_32_WG64_4_1_WGM1
    SolutionIndex: 11
    SolutionNameMin: Cijk_Ailk_Bljk_HBH_MT64x128x32_MI32x32x8x1_SE_1LDSB0_GRVW8_LPB8_NLCA1_PLR5_SU0_SUS256_SRVW4_TT1_64_WG64_4_1_WGM1
    SolutionIndex: 12
    SolutionNameMin: Cijk_Ailk_Bljk_HBH_MT128x64x32_MI32x32x8x1_SE_1LDSB0_GRVW8_LPB8_NLCA1_PLR5_SU0_SUS256_SRVW4_TT2_32_WG64_4_1_WGM1
    SolutionIndex: 13
    SolutionNameMin: Cijk_Ailk_Bljk_HBH_MT32x32x64_MI16x16x16x1_SE_1LDSB0_GRVW8_LPB16_NLCA1_PLR5_SU0_SUS256_SRVW4_TT1_16_WG32_8_1_WGM1
    SolutionIndex: 14
    SolutionNameMin: Cijk_Ailk_Bljk_HBH_MT64x64x64_MI32x32x8x1_SE_1LDSB0_GRVW8_LPB8_NLCA1_PLR9_SU0_SUS256_SRVW4_TT1_32_WG64_4_1_WGM1
    SolutionIndex: 15
    SolutionNameMin: Cijk_Ailk_Bljk_HBH_MT64x128x64_MI32x32x8x1_SE_1LDSB0_GRVW8_LPB8_NLCA1_PLR9_SU0_SUS256_SRVW4_TT1_64_WG64_4_1_WGM1
    SolutionIndex: 16
    SolutionNameMin: Cijk_Ailk_Bljk_HBH_MT128x96x64_MI32x32x8x1_SE_1LDSB0_GRVW8_LPB8_NLCA1_PLR9_SU0_SUS256_SRVW4_TT1_96_WG128_2_1_WGM1
    SolutionIndex: 17
    SolutionNameMin: Cijk_Ailk_Bljk_HBH_MT64x128x32_MI32x32x8x1_SE_1LDSB0_GRVW2_LPB8_NLCA1_PLR5_SU32_SUS128_SRVW4_TT1_64_WG64_4_1_WGM1
    SolutionIndex: 18
    SolutionNameMin: Cijk_Ailk_Bljk_HBH_MT64x128x32_MI32x32x8x1_SE_1LDSB0_GRVW8_LPB8_NLCA1_PLR5_SU32_SUS128_SRVW4_TT1_64_WG64_4_1_WGM1
    SolutionIndex: 19
    SolutionNameMin: Cijk_Ailk_Bljk_HBH_MT32x64x64_MI16x16x16x1_SE_1LDSB0_GRVW8_LPB16_NLCA1_PLR5_SU32_SUS128_SRVW4_TT1_32_WG32_8_1_WGM1
    SolutionIndex: 20
    SolutionNameMin: Cijk_Ailk_Bljk_HBH_MT64x128x64_MI32x32x8x1_SE_1LDSB0_GRVW8_LPB8_NLCA1_PLR9_SU32_SUS128_SRVW4_TT1_64_WG64_4_1_WGM1
    SolutionIndex: 21
    SolutionNameMin: Cijk_Ailk_Bljk_HBH_MT128x96x64_MI32x32x8x1_SE_1LDSB0_GRVW8_LPB8_NLCA1_PLR9_SU32_SUS128_SRVW4_TT1_96_WG128_2_1_WGM1
    SolutionIndex: 22
    SolutionNameMin: Cijk_Ailk_Bljk_HBH_MT32x32x64_MI16x16x16x1_SE_1LDSB0_GRVW8_LPB16_NLCA1_PLR5_SU32_SUS256_SRVW4_TT1_16_WG32_8_1_WGM1
    SolutionIndex: 23
    SolutionNameMin: Cijk_Ailk_Bljk_HBH_MT32x64x64_MI16x16x16x1_SE_1LDSB0_GRVW8_LPB16_NLCA1_PLR5_SU32_SUS256_SRVW4_TT1_32_WG32_8_1_WGM1
    SolutionIndex: 24
    SolutionNameMin: Cijk_Ailk_Bljk_HBH_MT64x128x64_MI32x32x8x1_SE_1LDSB0_GRVW8_LPB8_NLCA1_PLR9_SU32_SUS256_SRVW4_TT1_64_WG64_4_1_WGM1
    SolutionIndex: 25
    SolutionNameMin: Cijk_Ailk_Bljk_HBH_MT96x128x64_MI32x32x8x1_SE_1LDSB0_GRVW8_LPB8_NLCA3_PLR9_SU32_SUS256_SRVW0_TT3_32_WG32_8_1_WGM1
    SolutionIndex: 26
    SolutionNameMin: Cijk_Ailk_Bljk_HBH_MT64x64x32_MI32x32x8x1_SE_1LDSB0_GRVW2_LPB8_NLCA1_PLR5_SU0_SUS256_SRVW4_TT1_32_WG64_4_1_WGM2
    SolutionIndex: 27
    SolutionNameMin: Cijk_Ailk_Bljk_HBH_MT96x96x32_MI16x16x16x1_SE_1LDSB0_GRVW4_LPB16_NLCA3_PLR2_SU0_SUS256_SRVW0_TT3_48_WG32_8_1_WGM2
    SolutionIndex: 28
    SolutionNameMin: Cijk_Ailk_Bljk_HBH_MT64x128x32_MI32x32x8x1_SE_1LDSB0_GRVW4_LPB8_NLCA1_PLR5_SU0_SUS256_SRVW4_TT1_64_WG64_4_1_WGM2
    SolutionIndex: 29
    SolutionNameMin: Cijk_Ailk_Bljk_HBH_MT128x288x32_MI32x32x8x1_SE_1LDSB0_GRVW4_LPB8_NLCA1_PLR5_SU0_SUS256_SRVW4_TT1_288_WG128_2_1_WGM2
    SolutionIndex: 30
    SolutionNameMin: Cijk_Ailk_Bljk_HBH_MT256x160x32_MI32x32x8x1_SE_1LDSB0_GRVW4_LPB8_NLCA1_PLR5_SU0_SUS256_SRVW4_TT2_160_WG128_2_1_WGM2
    SolutionIndex: 31
    SolutionNameMin: Cijk_Ailk_Bljk_HBH_MT32x32x32_MI16x16x16x1_SE_1LDSB0_GRVW8_LPB16_NLCA1_PLR2_SU0_SUS256_SRVW4_TT1_16_WG32_8_1_WGM2
    SolutionIndex: 32
    SolutionNameMin: Cijk_Ailk_Bljk_HBH_MT32x64x32_MI16x16x16x1_SE_1LDSB0_GRVW8_LPB16_NLCA1_PLR2_SU0_SUS256_SRVW4_TT1_32_WG32_8_1_WGM2
    SolutionIndex: 33
    SolutionNameMin: Cijk_Ailk_Bljk_HBH_MT64x64x32_MI32x32x8x1_SE_1LDSB0_GRVW8_LPB8_NLCA1_PLR5_SU0_SUS256_SRVW4_TT1_32_WG64_4_1_WGM2
    SolutionIndex: 34
    SolutionNameMin: Cijk_Ailk_Bljk_HBH_MT64x128x32_MI32x32x8x1_SE_1LDSB0_GRVW8_LPB8_NLCA1_PLR5_SU0_SUS256_SRVW4_TT1_64_WG64_4_1_WGM2
    SolutionIndex: 35
    SolutionNameMin: Cijk_Ailk_Bljk_HBH_MT256x128x32_MI32x32x8x1_SE_1LDSB0_GRVW8_LPB8_NLCA1_PLR5_SU0_SUS256_SRVW4_TT4_64_WG64_4_1_WGM2
    SolutionIndex: 36
    SolutionNameMin: Cijk_Ailk_Bljk_HBH_MT32x32x64_MI16x16x16x1_SE_1LDSB0_GRVW8_LPB16_NLCA1_PLR5_SU0_SUS256_SRVW4_TT1_16_WG32_8_1_WGM2
    SolutionIndex: 37
    SolutionNameMin: Cijk_Ailk_Bljk_HBH_MT32x64x64_MI16x16x16x1_SE_1LDSB0_GRVW8_LPB16_NLCA1_PLR5_SU0_SUS256_SRVW4_TT1_32_WG32_8_1_WGM2
    SolutionIndex: 38
    SolutionNameMin: Cijk_Ailk_Bljk_HBH_MT128x96x64_MI32x32x8x1_SE_1LDSB0_GRVW8_LPB8_NLCA1_PLR9_SU0_SUS256_SRVW4_TT1_96_WG128_2_1_WGM2
    SolutionIndex: 39
    SolutionNameMin: Cijk_Ailk_Bljk_HBH_MT64x128x32_MI32x32x8x1_SE_1LDSB0_GRVW4_LPB8_NLCA1_PLR5_SU32_SUS128_SRVW4_TT1_64_WG64_4_1_WGM2
    SolutionIndex: 40
    SolutionNameMin: Cijk_Ailk_Bljk_HBH_MT256x160x32_MI32x32x8x1_SE_1LDSB0_GRVW4_LPB8_NLCA1_PLR5_SU32_SUS128_SRVW4_TT2_160_WG128_2_1_WGM2
    SolutionIndex: 41
    SolutionNameMin: Cijk_Ailk_Bljk_HBH_MT64x128x64_MI32x32x8x1_SE_1LDSB0_GRVW4_LPB8_NLCA1_PLR9_SU32_SUS128_SRVW4_TT1_64_WG64_4_1_WGM2
    SolutionIndex: 42
    SolutionNameMin: Cijk_Ailk_Bljk_HBH_MT64x128x64_MI32x32x8x1_SE_1LDSB0_GRVW8_LPB8_NLCA1_PLR9_SU32_SUS128_SRVW4_TT1_64_WG64_4_1_WGM2
    SolutionIndex: 43
    SolutionNameMin: Cijk_Ailk_Bljk_HBH_MT128x96x64_MI32x32x8x1_SE_1LDSB0_GRVW8_LPB8_NLCA1_PLR9_SU32_SUS128_SRVW4_TT1_96_WG128_2_1_WGM2
    SolutionIndex: 44
    SolutionNameMin: Cijk_Ailk_Bljk_HBH_MT64x128x32_MI32x32x8x1_SE_1LDSB0_GRVW2_LPB8_NLCA1_PLR5_SU32_SUS256_SRVW4_TT1_64_WG64_4_1_WGM2
    SolutionIndex: 45
    SolutionNameMin: Cijk_Ailk_Bljk_HBH_MT256x160x32_MI32x32x8x1_SE_1LDSB0_GRVW2_LPB8_NLCA2_PLR5_SU32_SUS256_SRVW4_TT2_160_WG128_2_1_WGM2
    SolutionIndex: 46
    SolutionNameMin: Cijk_Ailk_Bljk_HBH_MT128x96x32_MI32x32x8x1_SE_1LDSB0_GRVW4_LPB8_NLCA1_PLR5_SU32_SUS256_SRVW4_TT1_96_WG128_2_1_WGM2
    SolutionIndex: 47
    SolutionNameMin: Cijk_Ailk_Bljk_HBH_MT256x160x32_MI32x32x8x1_SE_1LDSB0_GRVW4_LPB8_NLCA1_PLR5_SU32_SUS256_SRVW4_TT2_160_WG128_2_1_WGM2
    SolutionIndex: 48
    SolutionNameMin: Cijk_Ailk_Bljk_HBH_MT64x64x32_MI32x32x8x1_SE_1LDSB0_GRVW8_LPB8_NLCA1_PLR5_SU32_SUS256_SRVW4_TT1_32_WG64_4_1_WGM2
    SolutionIndex: 49
    SolutionNameMin: Cijk_Ailk_Bljk_HBH_MT32x64x64_MI16x16x16x1_SE_1LDSB0_GRVW8_LPB16_NLCA1_PLR5_SU32_SUS256_SRVW4_TT1_32_WG32_8_1_WGM2
    SolutionIndex: 50
    SolutionNameMin: Cijk_Ailk_Bljk_HBH_MT96x96x64_MI16x16x16x1_SE_1LDSB0_GRVW8_LPB16_NLCA3_PLR5_SU32_SUS256_SRVW0_TT3_48_WG32_8_1_WGM2
    SolutionIndex: 51
    SolutionNameMin: Cijk_Ailk_Bljk_HBH_MT64x128x64_MI32x32x8x1_SE_1LDSB0_GRVW8_LPB8_NLCA1_PLR9_SU32_SUS256_SRVW4_TT1_64_WG64_4_1_WGM2
    SolutionIndex: 52
    SolutionNameMin: Cijk_Ailk_Bljk_HBH_MT64x64x32_MI32x32x8x1_SE_1LDSB0_GRVW2_LPB8_NLCA1_PLR5_SU0_SUS256_SRVW4_TT1_32_WG64_4_1_WGM15
    SolutionIndex: 53
    SolutionNameMin: Cijk_Ailk_Bljk_HBH_MT64x128x32_MI32x32x8x1_SE_1LDSB0_GRVW2_LPB8_NLCA1_PLR5_SU0_SUS256_SRVW4_TT1_64_WG64_4_1_WGM15
    SolutionIndex: 54
    SolutionNameMin: Cijk_Ailk_Bljk_HBH_MT64x64x64_MI32x32x8x1_SE_1LDSB0_GRVW2_LPB8_NLCA1_PLR9_SU0_SUS256_SRVW4_TT1_32_WG64_4_1_WGM15
    SolutionIndex: 55
    SolutionNameMin: Cijk_Ailk_Bljk_HBH_MT128x64x32_MI32x32x8x1_SE_1LDSB0_GRVW4_LPB8_NLCA1_PLR5_SU0_SUS256_SRVW4_TT2_32_WG64_4_1_WGM15
    SolutionIndex: 56
    SolutionNameMin: Cijk_Ailk_Bljk_HBH_MT256x128x32_MI32x32x8x1_SE_1LDSB0_GRVW4_LPB8_NLCA1_PLR5_SU0_SUS256_SRVW4_TT4_64_WG64_4_1_WGM15
    SolutionIndex: 57
    SolutionNameMin: Cijk_Ailk_Bljk_HBH_MT128x96x32_MI32x32x8x1_SE_1LDSB0_GRVW4_LPB8_NLCA1_PLR5_SU0_SUS256_SRVW4_TT1_96_WG128_2_1_WGM15
    SolutionIndex: 58
    SolutionNameMin: Cijk_Ailk_Bljk_HBH_MT128x288x32_MI32x32x8x1_SE_1LDSB0_GRVW4_LPB8_NLCA1_PLR5_SU0_SUS256_SRVW4_TT1_288_WG128_2_1_WGM15
    SolutionIndex: 59
    SolutionNameMin: Cijk_Ailk_Bljk_HBH_MT256x160x32_MI32x32x8x1_SE_1LDSB0_GRVW4_LPB8_NLCA1_PLR5_SU0_SUS256_SRVW4_TT2_160_WG128_2_1_WGM15
    SolutionIndex: 60
    SolutionNameMin: Cijk_Ailk_Bljk_HBH_MT32x32x64_MI16x16x16x1_SE_1LDSB0_GRVW4_LPB16_NLCA1_PLR5_SU0_SUS256_SRVW4_TT1_16_WG32_8_1_WGM15
    SolutionIndex: 61
    SolutionNameMin: Cijk_Ailk_Bljk_HBH_MT128x64x64_MI32x32x8x1_SE_1LDSB0_GRVW4_LPB8_NLCA1_PLR9_SU0_SUS256_SRVW4_TT2_32_WG64_4_1_WGM15
    SolutionIndex: 62
    SolutionNameMin: Cijk_Ailk_Bljk_HBH_MT64x32x32_MI16x16x16x1_SE_1LDSB0_GRVW8_LPB16_NLCA1_PLR2_SU0_SUS256_SRVW4_TT2_16_WG32_8_1_WGM15
    SolutionIndex: 63
    SolutionNameMin: Cijk_Ailk_Bljk_HBH_MT64x64x32_MI32x32x8x1_SE_1LDSB0_GRVW8_LPB8_NLCA1_PLR5_SU0_SUS256_SRVW4_TT1_32_WG64_4_1_WGM15
    SolutionIndex: 64
    SolutionNameMin: Cijk_Ailk_Bljk_HBH_MT128x256x32_MI32x32x8x1_SE_1LDSB0_GRVW8_LPB8_NLCA1_PLR5_SU0_SUS256_SRVW4_TT2_128_WG64_4_1_WGM15
    SolutionIndex: 65
    SolutionNameMin: Cijk_Ailk_Bljk_HBH_MT256x128x32_MI32x32x8x1_SE_1LDSB0_GRVW8_LPB8_NLCA1_PLR5_SU0_SUS256_SRVW4_TT4_64_WG64_4_1_WGM15
    SolutionIndex: 66
    SolutionNameMin: Cijk_Ailk_Bljk_HBH_MT32x32x64_MI16x16x16x1_SE_1LDSB0_GRVW8_LPB16_NLCA1_PLR5_SU0_SUS256_SRVW4_TT1_16_WG32_8_1_WGM15
    SolutionIndex: 67
    SolutionNameMin: Cijk_Ailk_Bljk_HBH_MT64x128x64_MI32x32x8x1_SE_1LDSB0_GRVW8_LPB8_NLCA1_PLR9_SU0_SUS256_SRVW4_TT1_64_WG64_4_1_WGM15
    SolutionIndex: 68
    SolutionNameMin: Cijk_Ailk_Bljk_HBH_MT128x64x64_MI32x32x8x1_SE_1LDSB0_GRVW8_LPB8_NLCA1_PLR9_SU0_SUS256_SRVW4_TT2_32_WG64_4_1_WGM15
    SolutionIndex: 69
    SolutionNameMin: Cijk_Ailk_Bljk_HBH_MT128x96x64_MI32x32x8x1_SE_1LDSB0_GRVW8_LPB8_NLCA1_PLR9_SU0_SUS256_SRVW4_TT1_96_WG128_2_1_WGM15
    SolutionIndex: 70
    SolutionNameMin: Cijk_Ailk_Bljk_HBH_MT64x128x32_MI32x32x8x1_SE_1LDSB0_GRVW2_LPB8_NLCA1_PLR5_SU32_SUS128_SRVW4_TT1_64_WG64_4_1_WGM15
    SolutionIndex: 71
    SolutionNameMin: Cijk_Ailk_Bljk_HBH_MT128x288x32_MI32x32x8x1_SE_1LDSB0_GRVW4_LPB8_NLCA1_PLR5_SU32_SUS128_SRVW4_TT1_288_WG128_2_1_WGM15
    SolutionIndex: 72
    SolutionNameMin: Cijk_Ailk_Bljk_HBH_MT256x160x32_MI32x32x8x1_SE_1LDSB0_GRVW4_LPB8_NLCA1_PLR5_SU32_SUS128_SRVW4_TT2_160_WG128_2_1_WGM15
    SolutionIndex: 73
    SolutionNameMin: Cijk_Ailk_Bljk_HBH_MT32x32x64_MI16x16x16x1_SE_1LDSB0_GRVW4_LPB16_NLCA1_PLR5_SU32_SUS128_SRVW4_TT1_16_WG32_8_1_WGM15
    SolutionIndex: 74
    SolutionNameMin: Cijk_Ailk_Bljk_HBH_MT64x128x64_MI32x32x8x1_SE_1LDSB0_GRVW4_LPB8_NLCA1_PLR9_SU32_SUS128_SRVW4_TT1_64_WG64_4_1_WGM15
    SolutionIndex: 75
    SolutionNameMin: Cijk_Ailk_Bljk_HBH_MT64x128x32_MI32x32x8x1_SE_1LDSB0_GRVW8_LPB8_NLCA1_PLR5_SU32_SUS128_SRVW4_TT1_64_WG64_4_1_WGM15
    SolutionIndex: 76
    SolutionNameMin: Cijk_Ailk_Bljk_HBH_MT128x256x32_MI32x32x8x1_SE_1LDSB0_GRVW8_LPB8_NLCA1_PLR5_SU32_SUS128_SRVW4_TT2_128_WG64_4_1_WGM15
    SolutionIndex: 77
    SolutionNameMin: Cijk_Ailk_Bljk_HBH_MT32x32x64_MI16x16x16x1_SE_1LDSB0_GRVW8_LPB16_NLCA1_PLR5_SU32_SUS128_SRVW4_TT1_16_WG32_8_1_WGM15
    SolutionIndex: 78
    SolutionNameMin: Cijk_Ailk_Bljk_HBH_MT64x128x64_MI32x32x8x1_SE_1LDSB0_GRVW8_LPB8_NLCA1_PLR9_SU32_SUS128_SRVW4_TT1_64_WG64_4_1_WGM15
    SolutionIndex: 79
    SolutionNameMin: Cijk_Ailk_Bljk_HBH_MT64x128x32_MI32x32x8x1_SE_1LDSB0_GRVW2_LPB8_NLCA1_PLR5_SU32_SUS256_SRVW4_TT1_64_WG64_4_1_WGM15
    SolutionIndex: 80
    SolutionNameMin: Cijk_Ailk_Bljk_HBH_MT128x288x32_MI32x32x8x1_SE_1LDSB0_GRVW2_LPB8_NLCA1_PLR5_SU32_SUS256_SRVW4_TT1_288_WG128_2_1_WGM15
    SolutionIndex: 81
    SolutionNameMin: Cijk_Ailk_Bljk_HBH_MT128x96x32_MI32x32x8x1_SE_1LDSB0_GRVW4_LPB8_NLCA1_PLR5_SU32_SUS256_SRVW4_TT1_96_WG128_2_1_WGM15
    SolutionIndex: 82
    SolutionNameMin: Cijk_Ailk_Bljk_HBH_MT256x160x32_MI32x32x8x1_SE_1LDSB0_GRVW4_LPB8_NLCA1_PLR5_SU32_SUS256_SRVW4_TT2_160_WG128_2_1_WGM15
    SolutionIndex: 83
    SolutionNameMin: Cijk_Ailk_Bljk_HBH_MT128x128x32_MI32x32x8x1_SE_1LDSB0_GRVW8_LPB8_NLCA1_PLR5_SU32_SUS256_SRVW4_TT2_64_WG64_4_1_WGM15
    SolutionIndex: 84
    SolutionNameMin: Cijk_Ailk_Bljk_HBH_MT32x32x64_MI16x16x16x1_SE_1LDSB0_GRVW8_LPB16_NLCA1_PLR5_SU32_SUS256_SRVW4_TT1_16_WG32_8_1_WGM15
    SolutionIndex: 85
    SolutionNameMin: Cijk_Ailk_Bljk_HBH_MT32x64x64_MI16x16x16x1_SE_1LDSB0_GRVW8_LPB16_NLCA1_PLR5_SU32_SUS256_SRVW4_TT1_32_WG32_8_1_WGM15
    SolutionIndex: 86
    SolutionNameMin: Cijk_Ailk_Bljk_HBH_MT64x128x64_MI32x32x8x1_SE_1LDSB0_GRVW8_LPB8_NLCA1_PLR9_SU32_SUS256_SRVW4_TT1_64_WG64_4_1_WGM15
    SolutionIndex: 87
    SolutionNameMin: Cijk_Ailk_Bljk_HBH_MT128x96x64_MI32x32x8x1_SE_1LDSB0_GRVW8_LPB8_NLCA1_PLR9_SU32_SUS256_SRVW4_TT1_96_WG128_2_1_WGM15
    SolutionIndex: 88
    SolutionNameMin: Cijk_Ailk_Bljk_HBH_MT32x64x32_MI16x16x16x1_SE_1LDSB1_GRVW2_LPB16_NLCA1_PLR2_SU0_SUS256_SRVW4_TT1_32_WG32_8_1_WGM1
    SolutionIndex: 89
    SolutionNameMin: Cijk_Ailk_Bljk_HBH_MT64x32x32_MI16x16x16x1_SE_1LDSB1_GRVW2_LPB16_NLCA1_PLR2_SU0_SUS256_SRVW4_TT2_16_WG32_8_1_WGM1
    SolutionIndex: 90
    SolutionNameMin: Cijk_Ailk_Bljk_HBH_MT128x128x32_MI32x32x8x1_SE_1LDSB1_GRVW2_LPB8_NLCA1_PLR5_SU0_SUS256_SRVW4_TT2_64_WG64_4_1_WGM1
    SolutionIndex: 91
    SolutionNameMin: Cijk_Ailk_Bljk_HBH_MT128x96x32_MI32x32x8x1_SE_1LDSB1_GRVW2_LPB8_NLCA1_PLR5_SU0_SUS256_SRVW4_TT1_96_WG128_2_1_WGM1
    SolutionIndex: 92
    SolutionNameMin: Cijk_Ailk_Bljk_HBH_MT128x128x64_MI32x32x8x1_SE_1LDSB1_GRVW2_LPB8_NLCA1_PLR9_SU0_SUS256_SRVW4_TT2_64_WG64_4_1_WGM1
    SolutionIndex: 93
    SolutionNameMin: Cijk_Ailk_Bljk_HBH_MT128x256x32_MI32x32x8x1_SE_1LDSB1_GRVW8_LPB8_NLCA1_PLR5_SU0_SUS256_SRVW4_TT2_128_WG64_4_1_WGM1
    SolutionIndex: 94
    SolutionNameMin: Cijk_Ailk_Bljk_HBH_MT256x128x32_MI32x32x8x1_SE_1LDSB1_GRVW8_LPB8_NLCA1_PLR5_SU0_SUS256_SRVW4_TT4_64_WG64_4_1_WGM1
    SolutionIndex: 95
    SolutionNameMin: Cijk_Ailk_Bljk_HBH_MT256x256x32_MI32x32x8x1_SE_1LDSB1_GRVW8_LPB8_NLCA1_PLR5_SU0_SUS256_SRVW4_TT4_128_WG64_4_1_WGM1
    SolutionIndex: 96
    SolutionNameMin: Cijk_Ailk_Bljk_HBH_MT160x160x64_MI16x16x16x1_SE_1LDSB1_GRVW8_LPB16_NLCA5_PLR5_SU0_SUS256_SRVW0_TT5_80_WG32_8_1_WGM1
    SolutionIndex: 97
    SolutionNameMin: Cijk_Ailk_Bljk_HBH_MT128x128x32_MI32x32x8x1_SE_1LDSB1_GRVW2_LPB8_NLCA1_PLR5_SU32_SUS128_SRVW4_TT2_64_WG64_4_1_WGM1
    SolutionIndex: 98
    SolutionNameMin: Cijk_Ailk_Bljk_HBH_MT128x96x32_MI32x32x8x1_SE_1LDSB1_GRVW2_LPB8_NLCA1_PLR5_SU32_SUS128_SRVW4_TT1_96_WG128_2_1_WGM1
    SolutionIndex: 99
    SolutionNameMin: Cijk_Ailk_Bljk_HBH_MT128x128x64_MI32x32x8x1_SE_1LDSB1_GRVW2_LPB8_NLCA1_PLR9_SU32_SUS128_SRVW4_TT2_64_WG64_4_1_WGM1
    SolutionIndex: 100
    SolutionNameMin: Cijk_Ailk_Bljk_HBH_MT128x256x32_MI32x32x8x1_SE_1LDSB1_GRVW8_LPB8_NLCA1_PLR5_SU32_SUS128_SRVW4_TT2_128_WG64_4_1_WGM1
    SolutionIndex: 101
    SolutionNameMin: Cijk_Ailk_Bljk_HBH_MT32x64x32_MI16x16x16x1_SE_1LDSB1_GRVW2_LPB16_NLCA1_PLR2_SU32_SUS256_SRVW4_TT1_32_WG32_8_1_WGM1
    SolutionIndex: 102
    SolutionNameMin: Cijk_Ailk_Bljk_HBH_MT128x128x32_MI32x32x8x1_SE_1LDSB1_GRVW2_LPB8_NLCA1_PLR5_SU32_SUS256_SRVW4_TT2_64_WG64_4_1_WGM1
    SolutionIndex: 103
    SolutionNameMin: Cijk_Ailk_Bljk_HBH_MT128x96x32_MI32x32x8x1_SE_1LDSB1_GRVW2_LPB8_NLCA1_PLR5_SU32_SUS256_SRVW4_TT1_96_WG128_2_1_WGM1
    SolutionIndex: 104
    SolutionNameMin: Cijk_Ailk_Bljk_HBH_MT128x96x64_MI32x32x8x1_SE_1LDSB1_GRVW2_LPB8_NLCA1_PLR9_SU32_SUS256_SRVW4_TT1_96_WG128_2_1_WGM1
    SolutionIndex: 105
    SolutionNameMin: Cijk_Ailk_Bljk_HBH_MT256x256x32_MI32x32x8x1_SE_1LDSB1_GRVW8_LPB8_NLCA1_PLR5_SU32_SUS256_SRVW4_TT4_128_WG64_4_1_WGM1
    SolutionIndex: 106
    SolutionNameMin: Cijk_Ailk_Bljk_HBH_MT32x64x32_MI16x16x16x1_SE_1LDSB1_GRVW2_LPB16_NLCA1_PLR2_SU0_SUS256_SRVW4_TT1_32_WG32_8_1_WGM2
    SolutionIndex: 107
    SolutionNameMin: Cijk_Ailk_Bljk_HBH_MT64x32x32_MI16x16x16x1_SE_1LDSB1_GRVW2_LPB16_NLCA1_PLR2_SU0_SUS256_SRVW4_TT2_16_WG32_8_1_WGM2
    SolutionIndex: 108
    SolutionNameMin: Cijk_Ailk_Bljk_HBH_MT128x128x32_MI32x32x8x1_SE_1LDSB1_GRVW2_LPB8_NLCA1_PLR5_SU0_SUS256_SRVW4_TT2_64_WG64_4_1_WGM2
    SolutionIndex: 109
    SolutionNameMin: Cijk_Ailk_Bljk_HBH_MT256x256x32_MI32x32x8x1_SE_1LDSB1_GRVW2_LPB8_NLCA2_PLR5_SU0_SUS256_SRVW4_TT4_128_WG64_4_1_WGM2
    SolutionIndex: 110
    SolutionNameMin: Cijk_Ailk_Bljk_HBH_MT128x96x32_MI32x32x8x1_SE_1LDSB1_GRVW2_LPB8_NLCA1_PLR5_SU0_SUS256_SRVW4_TT1_96_WG128_2_1_WGM2
    SolutionIndex: 111
    SolutionNameMin: Cijk_Ailk_Bljk_HBH_MT128x96x64_MI32x32x8x1_SE_1LDSB1_GRVW2_LPB8_NLCA1_PLR9_SU0_SUS256_SRVW4_TT1_96_WG128_2_1_WGM2
    SolutionIndex: 112
    SolutionNameMin: Cijk_Ailk_Bljk_HBH_MT128x160x64_MI32x32x8x1_SE_1LDSB1_GRVW2_LPB8_NLCA1_PLR9_SU0_SUS256_SRVW4_TT1_160_WG128_2_1_WGM2
    SolutionIndex: 113
    SolutionNameMin: Cijk_Ailk_Bljk_HBH_MT128x256x32_MI32x32x8x1_SE_1LDSB1_GRVW8_LPB8_NLCA1_PLR5_SU0_SUS256_SRVW4_TT2_128_WG64_4_1_WGM2
    SolutionIndex: 114
    SolutionNameMin: Cijk_Ailk_Bljk_HBH_MT256x128x32_MI32x32x8x1_SE_1LDSB1_GRVW8_LPB8_NLCA1_PLR5_SU0_SUS256_SRVW4_TT4_64_WG64_4_1_WGM2
    SolutionIndex: 115
    SolutionNameMin: Cijk_Ailk_Bljk_HBH_MT256x256x32_MI32x32x8x1_SE_1LDSB1_GRVW8_LPB8_NLCA1_PLR5_SU0_SUS256_SRVW4_TT4_128_WG64_4_1_WGM2
    SolutionIndex: 116
    SolutionNameMin: Cijk_Ailk_Bljk_HBH_MT160x160x64_MI16x16x16x1_SE_1LDSB1_GRVW8_LPB16_NLCA5_PLR5_SU0_SUS256_SRVW0_TT5_80_WG32_8_1_WGM2
    SolutionIndex: 117
    SolutionNameMin: Cijk_Ailk_Bljk_HBH_MT64x32x32_MI16x16x16x1_SE_1LDSB1_GRVW2_LPB16_NLCA1_PLR2_SU32_SUS128_SRVW4_TT2_16_WG32_8_1_WGM2
    SolutionIndex: 118
    SolutionNameMin: Cijk_Ailk_Bljk_HBH_MT128x128x32_MI32x32x8x1_SE_1LDSB1_GRVW2_LPB8_NLCA1_PLR5_SU32_SUS128_SRVW4_TT2_64_WG64_4_1_WGM2
    SolutionIndex: 119
    SolutionNameMin: Cijk_Ailk_Bljk_HBH_MT128x256x32_MI32x32x8x1_SE_1LDSB1_GRVW2_LPB8_NLCA1_PLR5_SU32_SUS128_SRVW4_TT2_128_WG64_4_1_WGM2
    SolutionIndex: 120
    SolutionNameMin: Cijk_Ailk_Bljk_HBH_MT256x256x32_MI32x32x8x1_SE_1LDSB1_GRVW2_LPB8_NLCA2_PLR5_SU32_SUS128_SRVW4_TT4_128_WG64_4_1_WGM2
    SolutionIndex: 121
    SolutionNameMin: Cijk_Ailk_Bljk_HBH_MT128x96x32_MI32x32x8x1_SE_1LDSB1_GRVW2_LPB8_NLCA1_PLR5_SU32_SUS128_SRVW4_TT1_96_WG128_2_1_WGM2
    SolutionIndex: 122
    SolutionNameMin: Cijk_Ailk_Bljk_HBH_MT128x160x64_MI32x32x8x1_SE_1LDSB1_GRVW2_LPB8_NLCA1_PLR9_SU32_SUS128_SRVW4_TT1_160_WG128_2_1_WGM2
    SolutionIndex: 123
    SolutionNameMin: Cijk_Ailk_Bljk_HBH_MT128x256x32_MI32x32x8x1_SE_1LDSB1_GRVW8_LPB8_NLCA1_PLR5_SU32_SUS128_SRVW4_TT2_128_WG64_4_1_WGM2
    SolutionIndex: 124
    SolutionNameMin: Cijk_Ailk_Bljk_HBH_MT256x128x32_MI32x32x8x1_SE_1LDSB1_GRVW8_LPB8_NLCA1_PLR5_SU32_SUS128_SRVW4_TT4_64_WG64_4_1_WGM2
    SolutionIndex: 125
    SolutionNameMin: Cijk_Ailk_Bljk_HBH_MT32x64x32_MI16x16x16x1_SE_1LDSB1_GRVW2_LPB16_NLCA1_PLR2_SU32_SUS256_SRVW4_TT1_32_WG32_8_1_WGM2
    SolutionIndex: 126
    SolutionNameMin: Cijk_Ailk_Bljk_HBH_MT64x32x32_MI16x16x16x1_SE_1LDSB1_GRVW2_LPB16_NLCA1_PLR2_SU32_SUS256_SRVW4_TT2_16_WG32_8_1_WGM2
    SolutionIndex: 127
    SolutionNameMin: Cijk_Ailk_Bljk_HBH_MT128x128x32_MI32x32x8x1_SE_1LDSB1_GRVW2_LPB8_NLCA1_PLR5_SU32_SUS256_SRVW4_TT2_64_WG64_4_1_WGM2
    SolutionIndex: 128
    SolutionNameMin: Cijk_Ailk_Bljk_HBH_MT128x96x64_MI32x32x8x1_SE_1LDSB1_GRVW2_LPB8_NLCA1_PLR9_SU32_SUS256_SRVW4_TT1_96_WG128_2_1_WGM2
    SolutionIndex: 129
    SolutionNameMin: Cijk_Ailk_Bljk_HBH_MT256x144x64_MI16x16x16x1_SE_1LDSB1_GRVW4_LPB16_NLCA1_PLR5_SU32_SUS256_SRVW4_TT4_144_WG64_4_1_WGM2
    SolutionIndex: 130
    SolutionNameMin: Cijk_Ailk_Bljk_HBH_MT128x256x32_MI32x32x8x1_SE_1LDSB1_GRVW8_LPB8_NLCA1_PLR5_SU32_SUS256_SRVW4_TT2_128_WG64_4_1_WGM2
    SolutionIndex: 131
    SolutionNameMin: Cijk_Ailk_Bljk_HBH_MT64x32x32_MI16x16x16x1_SE_1LDSB1_GRVW2_LPB16_NLCA1_PLR2_SU0_SUS256_SRVW4_TT2_16_WG32_8_1_WGM15
    SolutionIndex: 132
    SolutionNameMin: Cijk_Ailk_Bljk_HBH_MT128x144x32_MI16x16x16x1_SE_1LDSB1_GRVW2_LPB16_NLCA1_PLR2_SU0_SUS256_SRVW4_TT2_144_WG64_4_1_WGM15
    SolutionIndex: 133
    SolutionNameMin: Cijk_Ailk_Bljk_HBH_MT128x128x32_MI32x32x8x1_SE_1LDSB1_GRVW2_LPB8_NLCA1_PLR5_SU0_SUS256_SRVW4_TT2_64_WG64_4_1_WGM15
    SolutionIndex: 134
    SolutionNameMin: Cijk_Ailk_Bljk_HBH_MT128x256x32_MI32x32x8x1_SE_1LDSB1_GRVW2_LPB8_NLCA1_PLR5_SU0_SUS256_SRVW4_TT2_128_WG64_4_1_WGM15
    SolutionIndex: 135
    SolutionNameMin: Cijk_Ailk_Bljk_HBH_MT256x256x32_MI32x32x8x1_SE_1LDSB1_GRVW2_LPB8_NLCA2_PLR5_SU0_SUS256_SRVW4_TT4_128_WG64_4_1_WGM15
    SolutionIndex: 136
    SolutionNameMin: Cijk_Ailk_Bljk_HBH_MT128x96x32_MI32x32x8x1_SE_1LDSB1_GRVW2_LPB8_NLCA1_PLR5_SU0_SUS256_SRVW4_TT1_96_WG128_2_1_WGM15
    SolutionIndex: 137
    SolutionNameMin: Cijk_Ailk_Bljk_HBH_MT128x128x64_MI32x32x8x1_SE_1LDSB1_GRVW2_LPB8_NLCA1_PLR9_SU0_SUS256_SRVW4_TT2_64_WG64_4_1_WGM15
    SolutionIndex: 138
    SolutionNameMin: Cijk_Ailk_Bljk_HBH_MT128x96x64_MI32x32x8x1_SE_1LDSB1_GRVW2_LPB8_NLCA1_PLR9_SU0_SUS256_SRVW4_TT1_96_WG128_2_1_WGM15
    SolutionIndex: 139
    SolutionNameMin: Cijk_Ailk_Bljk_HBH_MT128x160x64_MI32x32x8x1_SE_1LDSB1_GRVW2_LPB8_NLCA1_PLR9_SU0_SUS256_SRVW4_TT1_160_WG128_2_1_WGM15
    SolutionIndex: 140
    SolutionNameMin: Cijk_Ailk_Bljk_HBH_MT128x256x32_MI32x32x8x1_SE_1LDSB1_GRVW8_LPB8_NLCA1_PLR5_SU0_SUS256_SRVW4_TT2_128_WG64_4_1_WGM15
    SolutionIndex: 141
    SolutionNameMin: Cijk_Ailk_Bljk_HBH_MT256x128x32_MI32x32x8x1_SE_1LDSB1_GRVW8_LPB8_NLCA1_PLR5_SU0_SUS256_SRVW4_TT4_64_WG64_4_1_WGM15
    SolutionIndex: 142
    SolutionNameMin: Cijk_Ailk_Bljk_HBH_MT256x256x32_MI32x32x8x1_SE_1LDSB1_GRVW8_LPB8_NLCA1_PLR5_SU0_SUS256_SRVW4_TT4_128_WG64_4_1_WGM15
    SolutionIndex: 143
    SolutionNameMin: Cijk_Ailk_Bljk_HBH_MT64x32x32_MI16x16x16x1_SE_1LDSB1_GRVW2_LPB16_NLCA1_PLR2_SU32_SUS128_SRVW4_TT2_16_WG32_8_1_WGM15
    SolutionIndex: 144
    SolutionNameMin: Cijk_Ailk_Bljk_HBH_MT128x144x32_MI16x16x16x1_SE_1LDSB1_GRVW2_LPB16_NLCA1_PLR2_SU32_SUS128_SRVW4_TT2_144_WG64_4_1_WGM15
    SolutionIndex: 145
    SolutionNameMin: Cijk_Ailk_Bljk_HBH_MT128x128x32_MI32x32x8x1_SE_1LDSB1_GRVW2_LPB8_NLCA1_PLR5_SU32_SUS128_SRVW4_TT2_64_WG64_4_1_WGM15
    SolutionIndex: 146
    SolutionNameMin: Cijk_Ailk_Bljk_HBH_MT256x256x32_MI32x32x8x1_SE_1LDSB1_GRVW2_LPB8_NLCA2_PLR5_SU32_SUS128_SRVW4_TT4_128_WG64_4_1_WGM15
    SolutionIndex: 147
    SolutionNameMin: Cijk_Ailk_Bljk_HBH_MT128x160x64_MI32x32x8x1_SE_1LDSB1_GRVW2_LPB8_NLCA1_PLR9_SU32_SUS128_SRVW4_TT1_160_WG128_2_1_WGM15
    SolutionIndex: 148
    SolutionNameMin: Cijk_Ailk_Bljk_HBH_MT128x256x32_MI32x32x8x1_SE_1LDSB1_GRVW8_LPB8_NLCA1_PLR5_SU32_SUS128_SRVW4_TT2_128_WG64_4_1_WGM15
    SolutionIndex: 149
    SolutionNameMin: Cijk_Ailk_Bljk_HBH_MT128x128x32_MI32x32x8x1_SE_1LDSB1_GRVW2_LPB8_NLCA1_PLR5_SU32_SUS256_SRVW4_TT2_64_WG64_4_1_WGM15
    SolutionIndex: 150
    SolutionNameMin: Cijk_Ailk_Bljk_HBH_MT256x128x32_MI32x32x8x1_SE_1LDSB1_GRVW2_LPB8_NLCA2_PLR5_SU32_SUS256_SRVW4_TT4_64_WG64_4_1_WGM15
    SolutionIndex: 151
    SolutionNameMin: Cijk_Ailk_Bljk_HBH_MT64x256x64_MI32x32x8x1_SE_1LDSB1_GRVW2_LPB8_NLCA1_PLR9_SU32_SUS256_SRVW4_TT1_128_WG64_4_1_WGM15
    SolutionIndex: 152
    SolutionNameMin: Cijk_Ailk_Bljk_HBH_MT128x96x64_MI32x32x8x1_SE_1LDSB1_GRVW2_LPB8_NLCA1_PLR9_SU32_SUS256_SRVW4_TT1_96_WG128_2_1_WGM15
    SolutionIndex: 153
    SolutionNameMin: Cijk_Ailk_Bljk_HBH_MT128x256x32_MI32x32x8x1_SE_1LDSB1_GRVW8_LPB8_NLCA1_PLR5_SU32_SUS256_SRVW4_TT2_128_WG64_4_1_WGM15
    SolutionIndex: 154
    SolutionNameMin: Cijk_Ailk_Bljk_HBH_MT256x256x32_MI32x32x8x1_SE_1LDSB1_GRVW8_LPB8_NLCA1_PLR5_SU32_SUS256_SRVW4_TT4_128_WG64_4_1_WGM15
    SolutionIndex: 155
    SolutionNameMin: Cijk_Ailk_Bljk_HBH_MT256x160x32_MI32x32x8x1_SE_1LDSB0_GRVW4_LPB8_NLCA1_PLR5_SU0_SUS256_SRVW0_TT2_160_WG128_2_1_WGM1
    SolutionIndex: 156
    SolutionNameMin: Cijk_Ailk_Bljk_HBH_MT256x160x32_MI32x32x8x1_SE_1LDSB0_GRVW4_LPB8_NLCA1_PLR5_SU32_SUS128_SRVW0_TT2_160_WG128_2_1_WGM1
    SolutionIndex: 157
    SolutionNameMin: Cijk_Ailk_Bljk_HBH_MT256x160x32_MI32x32x8x1_SE_1LDSB0_GRVW4_LPB8_NLCA1_PLR5_SU0_SUS256_SRVW0_TT2_160_WG128_2_1_WGM2
    SolutionIndex: 158
    SolutionNameMin: Cijk_Ailk_Bljk_HBH_MT32x32x64_MI16x16x16x1_SE_1LDSB0_GRVW8_LPB16_NLCA1_PLR5_SU0_SUS256_SRVW0_TT1_16_WG32_8_1_WGM2
    SolutionIndex: 159
    SolutionNameMin: Cijk_Ailk_Bljk_HBH_MT256x160x32_MI32x32x8x1_SE_1LDSB0_GRVW4_LPB8_NLCA1_PLR5_SU32_SUS128_SRVW0_TT2_160_WG128_2_1_WGM2
    SolutionIndex: 160
    SolutionNameMin: Cijk_Ailk_Bljk_HBH_MT96x128x64_MI32x32x8x1_SE_1LDSB0_GRVW4_LPB8_NLCA3_PLR9_SU32_SUS128_SRVW0_TT3_32_WG32_8_1_WGM2
    SolutionIndex: 161
    SolutionNameMin: Cijk_Ailk_Bljk_HBH_MT256x160x32_MI32x32x8x1_SE_1LDSB0_GRVW4_LPB8_NLCA1_PLR5_SU32_SUS256_SRVW0_TT2_160_WG128_2_1_WGM2
    SolutionIndex: 162
    SolutionNameMin: Cijk_Ailk_Bljk_HBH_MT256x160x32_MI32x32x8x1_SE_1LDSB0_GRVW4_LPB8_NLCA1_PLR5_SU0_SUS256_SRVW0_TT2_160_WG128_2_1_WGM15
    SolutionIndex: 163
    SolutionNameMin: Cijk_Ailk_Bljk_HBH_MT256x160x32_MI32x32x8x1_SE_1LDSB0_GRVW4_LPB8_NLCA1_PLR5_SU32_SUS128_SRVW0_TT2_160_WG128_2_1_WGM15
    SolutionIndex: 164
    SolutionNameMin: Cijk_Ailk_Bljk_HBH_MT256x160x32_MI32x32x8x1_SE_1LDSB0_GRVW4_LPB8_NLCA1_PLR5_SU32_SUS256_SRVW0_TT2_160_WG128_2_1_WGM15
    SolutionIndex: 165
    SolutionNameMin: Cijk_Ailk_Bljk_HBH_MT256x128x32_MI32x32x8x1_SE_1LDSB1_GRVW8_LPB8_NLCA1_PLR5_SU0_SUS256_SRVW0_TT4_64_WG64_4_1_WGM2
    SolutionIndex: 166
    SolutionNameMin: Cijk_Ailk_Bljk_HBH_MT256x160x32_MI32x32x8x1_SE_1LDSB1_GRVW2_LPB8_NLCA2_PLR5_SU0_SUS256_SRVW0_TT2_160_WG128_2_1_WGM15
    SolutionIndex: 167
    SolutionNameMin: Cijk_Ailk_Bljk_HBH_MT32x32x64_MI16x16x16x1_SE_1LDSB0_GRVW2_LPB16_NLCA1_PLR5_SU0_SUS256_SRVW0_TT1_16_WG32_8_1_WGM1
    SolutionIndex: 168
    SolutionNameMin: Cijk_Ailk_Bljk_HBH_MT256x128x32_MI32x32x8x1_SE_1LDSB0_GRVW8_LPB8_NLCA1_PLR5_SU0_SUS256_SRVW0_TT4_64_WG64_4_1_WGM1
    SolutionIndex: 169
    SolutionNameMin: Cijk_Ailk_Bljk_HBH_MT32x32x64_MI16x16x16x1_SE_1LDSB0_GRVW8_LPB16_NLCA1_PLR5_SU32_SUS128_SRVW0_TT1_16_WG32_8_1_WGM1
    SolutionIndex: 170
    SolutionNameMin: Cijk_Ailk_Bljk_HBH_MT32x64x64_MI16x16x16x1_SE_1LDSB0_GRVW8_LPB16_NLCA1_PLR5_SU32_SUS256_SRVW0_TT1_32_WG32_8_1_WGM1
    SolutionIndex: 171
    SolutionNameMin: Cijk_Ailk_Bljk_HBH_MT32x32x64_MI16x16x16x1_SE_1LDSB0_GRVW4_LPB16_NLCA1_PLR5_SU0_SUS256_SRVW0_TT1_16_WG32_8_1_WGM2
    SolutionIndex: 172
    SolutionNameMin: Cijk_Ailk_Bljk_HBH_MT32x64x64_MI16x16x16x1_SE_1LDSB0_GRVW8_LPB16_NLCA1_PLR5_SU0_SUS256_SRVW0_TT1_32_WG32_8_1_WGM2
    SolutionIndex: 173
    SolutionNameMin: Cijk_Ailk_Bljk_HBH_MT32x32x32_MI16x16x16x1_SE_1LDSB0_GRVW4_LPB16_NLCA1_PLR2_SU32_SUS128_SRVW0_TT1_16_WG32_8_1_WGM2
    SolutionIndex: 174
    SolutionNameMin: Cijk_Ailk_Bljk_HBH_MT64x64x64_MI32x32x8x1_SE_1LDSB0_GRVW8_LPB8_NLCA1_PLR9_SU32_SUS256_SRVW0_TT1_32_WG64_4_1_WGM2
    SolutionIndex: 175
    SolutionNameMin: Cijk_Ailk_Bljk_HBH_MT256x160x32_MI32x32x8x1_SE_1LDSB0_GRVW4_LPB8_NLCA1_PLR5_SU0_SUS256_SRVW0_TT2_160_WG128_2_1_WGM15
    SolutionIndex: 176
    SolutionNameMin: Cijk_Ailk_Bljk_HBH_MT32x32x64_MI16x16x16x1_SE_1LDSB0_GRVW8_LPB16_NLCA1_PLR5_SU0_SUS256_SRVW0_TT1_16_WG32_8_1_WGM15
    SolutionIndex: 177
    SolutionNameMin: Cijk_Ailk_Bljk_HBH_MT256x256x32_MI32x32x8x1_SE_1LDSB1_GRVW2_LPB8_NLCA2_PLR5_SU0_SUS256_SRVW0_TT4_128_WG64_4_1_WGM1
    SolutionIndex: 178
    SolutionNameMin: Cijk_Ailk_Bljk_HBH_MT256x128x32_MI32x32x8x1_SE_1LDSB1_GRVW8_LPB8_NLCA1_PLR5_SU0_SUS256_SRVW0_TT4_64_WG64_4_1_WGM1
    SolutionIndex: 179
    SolutionNameMin: Cijk_Ailk_Bljk_HBH_MT96x96x64_MI16x16x16x1_SE_1LDSB0_GRVW2_LPB16_NLCA3_PLR5_SU0_SUS256_SRVW0_TT3_48_WG32_8_1_WGM1
    SolutionIndex: 180
    SolutionNameMin: Cijk_Ailk_Bljk_HBH_MT96x96x64_MI16x16x16x1_SE_1LDSB0_GRVW8_LPB16_NLCA3_PLR5_SU0_SUS256_SRVW0_TT3_48_WG32_8_1_WGM1
    SolutionIndex: 181
    SolutionNameMin: Cijk_Ailk_Bljk_HBH_MT256x160x32_MI32x32x8x1_SE_1LDSB0_GRVW4_LPB8_NLCA1_PLR5_SU32_SUS128_SRVW0_TT2_160_WG128_2_1_WGM1
    SolutionIndex: 182
    SolutionNameMin: Cijk_Ailk_Bljk_HBH_MT96x96x64_MI16x16x16x1_SE_1LDSB0_GRVW8_LPB16_NLCA3_PLR5_SU32_SUS128_SRVW0_TT3_48_WG32_8_1_WGM1
    SolutionIndex: 183
    SolutionNameMin: Cijk_Ailk_Bljk_HBH_MT64x32x64_MI16x16x16x1_SE_1LDSB0_GRVW8_LPB16_NLCA1_PLR5_SU32_SUS256_SRVW0_TT2_16_WG32_8_1_WGM1
    SolutionIndex: 184
    SolutionNameMin: Cijk_Ailk_Bljk_HBH_MT32x32x64_MI16x16x16x1_SE_1LDSB0_GRVW8_LPB16_NLCA1_PLR5_SU0_SUS256_SRVW0_TT1_16_WG32_8_1_WGM2
    SolutionIndex: 185
    SolutionNameMin: Cijk_Ailk_Bljk_HBH_MT256x144x64_MI16x16x16x1_SE_1LDSB1_GRVW4_LPB16_NLCA1_PLR5_SU0_SUS256_SRVW0_TT4_144_WG64_4_1_WGM2
    SolutionIndex: 186
    SolutionNameMin: Cijk_Ailk_Bljk_HBH_MT256x144x64_MI16x16x16x1_SE_1LDSB1_GRVW4_LPB16_NLCA1_PLR5_SU0_SUS256_SRVW0_TT4_144_WG64_4_1_WGM15
    SolutionIndex: 187
    SolutionNameMin: Cijk_Ailk_Bljk_HBH_MT64x32x64_MI16x16x16x1_SE_1LDSB0_GRVW4_LPB16_NLCA1_PLR5_SU32_SUS128_SRVW0_TT2_16_WG32_8_1_WGM1
    SolutionIndex: 188
    SolutionNameMin: Cijk_Ailk_Bljk_HBH_MT64x128x64_MI32x32x8x1_SE_1LDSB0_GRVW4_LPB8_NLCA1_PLR9_SU32_SUS256_SRVW0_TT1_64_WG64_4_1_WGM2
    SolutionIndex: 189
    SolutionNameMin: Cijk_Ailk_Bljk_HBH_MT256x160x32_MI32x32x8x1_SE_1LDSB0_GRVW4_LPB8_NLCA1_PLR5_SU0_SUS256_SRVW0_TT2_160_WG128_2_1_WGM15
    SolutionIndex: 190
    SolutionNameMin: Cijk_Ailk_Bljk_HBH_MT256x128x32_MI32x32x8x1_SE_1LDSB0_GRVW8_LPB8_NLCA1_PLR5_SU0_SUS256_SRVW0_TT4_64_WG64_4_1_WGM1
    SolutionIndex: 191
    SolutionNameMin: Cijk_Ailk_Bljk_HBH_MT256x160x32_MI32x32x8x1_SE_1LDSB0_GRVW2_LPB8_NLCA2_PLR5_SU32_SUS128_SRVW0_TT2_160_WG128_2_1_WGM1
    SolutionIndex: 192
    SolutionNameMin: Cijk_Ailk_Bljk_HBH_MT128x96x64_MI32x32x8x1_SE_1LDSB0_GRVW8_LPB8_NLCA1_PLR9_SU0_SUS256_SRVW0_TT1_96_WG128_2_1_WGM15
    SolutionIndex: 193
    SolutionNameMin: Cijk_Ailk_Bljk_HBH_MT128x160x64_MI32x32x8x1_SE_1LDSB1_GRVW2_LPB8_NLCA1_PLR9_SU0_SUS256_SRVW0_TT1_160_WG128_2_1_WGM1
    SolutionIndex: 194
    SolutionNameMin: Cijk_Ailk_Bljk_HBH_MT256x256x32_MI32x32x8x1_SE_1LDSB1_GRVW4_LPB8_NLCA1_PLR5_SU0_SUS256_SRVW0_TT4_128_WG64_4_1_WGM1
    SolutionIndex: 195
    SolutionNameMin: Cijk_Ailk_Bljk_HBH_MT256x128x32_MI32x32x8x1_SE_1LDSB1_GRVW8_LPB8_NLCA1_PLR5_SU0_SUS256_SRVW0_TT4_64_WG64_4_1_WGM1
    SolutionIndex: 196
    SolutionNameMin: Cijk_Ailk_Bljk_HBH_MT128x160x64_MI32x32x8x1_SE_1LDSB1_GRVW2_LPB8_NLCA1_PLR9_SU0_SUS256_SRVW0_TT1_160_WG128_2_1_WGM15
    SolutionIndex: 197
    SolutionNameMin: Cijk_Ailk_Bljk_HBH_MT128x64x32_MI32x32x8x1_SE_1LDSB0_GRVW2_LPB8_NLCA1_PLR5_SU0_SUS256_SRVW4_TT2_32_WG64_4_1_WGM1
    SolutionIndex: 198
    SolutionNameMin: Cijk_Ailk_Bljk_HBH_MT128x64x32_MI32x32x8x1_SE_1LDSB0_GRVW4_LPB8_NLCA1_PLR5_SU0_SUS256_SRVW4_TT2_32_WG64_4_1_WGM1
    SolutionIndex: 199
    SolutionNameMin: Cijk_Ailk_Bljk_HBH_MT128x64x32_MI32x32x8x1_SE_1LDSB0_GRVW8_LPB8_NLCA1_PLR5_SU0_SUS256_SRVW4_TT2_32_WG64_4_1_WGM1
    SolutionIndex: 200
    SolutionNameMin: Cijk_Ailk_Bljk_HBH_MT64x128x64_MI32x32x8x1_SE_1LDSB0_GRVW8_LPB8_NLCA1_PLR9_SU0_SUS256_SRVW4_TT1_64_WG64_4_1_WGM1
    SolutionIndex: 201
    SolutionNameMin: Cijk_Ailk_Bljk_HBH_MT128x64x32_MI32x32x8x1_SE_1LDSB0_GRVW8_LPB8_NLCA1_PLR5_SU32_SUS256_SRVW4_TT2_32_WG64_4_1_WGM1
    SolutionIndex: 202
    SolutionNameMin: Cijk_Ailk_Bljk_HBH_MT64x32x32_MI16x16x16x1_SE_1LDSB0_GRVW4_LPB16_NLCA1_PLR2_SU0_SUS256_SRVW4_TT2_16_WG32_8_1_WGM2
    SolutionIndex: 203
    SolutionNameMin: Cijk_Ailk_Bljk_HBH_MT128x96x32_MI32x32x8x1_SE_1LDSB0_GRVW4_LPB8_NLCA1_PLR5_SU0_SUS256_SRVW4_TT1_96_WG128_2_1_WGM2
    SolutionIndex: 204
    SolutionNameMin: Cijk_Ailk_Bljk_HBH_MT256x160x32_MI32x32x8x1_SE_1LDSB0_GRVW4_LPB8_NLCA1_PLR5_SU0_SUS256_SRVW4_TT2_160_WG128_2_1_WGM2
    SolutionIndex: 205
    SolutionNameMin: Cijk_Ailk_Bljk_HBH_MT64x128x64_MI32x32x8x1_SE_1LDSB0_GRVW4_LPB8_NLCA1_PLR9_SU0_SUS256_SRVW4_TT1_64_WG64_4_1_WGM2
    SolutionIndex: 206
    SolutionNameMin: Cijk_Ailk_Bljk_HBH_MT128x64x32_MI32x32x8x1_SE_1LDSB0_GRVW8_LPB8_NLCA1_PLR5_SU0_SUS256_SRVW4_TT2_32_WG64_4_1_WGM2
    SolutionIndex: 207
    SolutionNameMin: Cijk_Ailk_Bljk_HBH_MT64x128x32_MI32x32x8x1_SE_1LDSB0_GRVW8_LPB8_NLCA1_PLR5_SU32_SUS256_SRVW4_TT1_64_WG64_4_1_WGM2
    SolutionIndex: 208
    SolutionNameMin: Cijk_Ailk_Bljk_HBH_MT64x128x64_MI32x32x8x1_SE_1LDSB0_GRVW8_LPB8_NLCA1_PLR9_SU32_SUS256_SRVW4_TT1_64_WG64_4_1_WGM2
    SolutionIndex: 209
    SolutionNameMin: Cijk_Ailk_Bljk_HBH_MT64x32x32_MI16x16x16x1_SE_1LDSB0_GRVW2_LPB16_NLCA1_PLR2_SU0_SUS256_SRVW4_TT2_16_WG32_8_1_WGM15
    SolutionIndex: 210
    SolutionNameMin: Cijk_Ailk_Bljk_HBH_MT128x64x32_MI32x32x8x1_SE_1LDSB0_GRVW4_LPB8_NLCA1_PLR5_SU0_SUS256_SRVW4_TT2_32_WG64_4_1_WGM15
    SolutionIndex: 211
    SolutionNameMin: Cijk_Ailk_Bljk_HBH_MT128x96x32_MI32x32x8x1_SE_1LDSB0_GRVW4_LPB8_NLCA1_PLR5_SU0_SUS256_SRVW4_TT1_96_WG128_2_1_WGM15
    SolutionIndex: 212
    SolutionNameMin: Cijk_Ailk_Bljk_HBH_MT128x64x32_MI32x32x8x1_SE_1LDSB0_GRVW8_LPB8_NLCA1_PLR5_SU0_SUS256_SRVW4_TT2_32_WG64_4_1_WGM15
    SolutionIndex: 213
    SolutionNameMin: Cijk_Ailk_Bljk_HBH_MT64x128x64_MI32x32x8x1_SE_1LDSB0_GRVW8_LPB8_NLCA1_PLR9_SU0_SUS256_SRVW4_TT1_64_WG64_4_1_WGM15
    SolutionIndex: 214
    SolutionNameMin: Cijk_Ailk_Bljk_HBH_MT64x128x64_MI32x32x8x1_SE_1LDSB0_GRVW8_LPB8_NLCA1_PLR9_SU32_SUS256_SRVW4_TT1_64_WG64_4_1_WGM15
    SolutionIndex: 215
    SolutionNameMin: Cijk_Ailk_Bljk_HBH_MT128x128x32_MI32x32x8x1_SE_1LDSB1_GRVW2_LPB8_NLCA1_PLR5_SU0_SUS256_SRVW4_TT2_64_WG64_4_1_WGM1
    SolutionIndex: 216
    SolutionNameMin: Cijk_Ailk_Bljk_HBH_MT128x96x32_MI32x32x8x1_SE_1LDSB1_GRVW2_LPB8_NLCA1_PLR5_SU0_SUS256_SRVW4_TT1_96_WG128_2_1_WGM1
    SolutionIndex: 217
    SolutionNameMin: Cijk_Ailk_Bljk_HBH_MT64x256x64_MI32x32x8x1_SE_1LDSB1_GRVW2_LPB8_NLCA1_PLR9_SU0_SUS256_SRVW4_TT1_128_WG64_4_1_WGM1
    SolutionIndex: 218
    SolutionNameMin: Cijk_Ailk_Bljk_HBH_MT128x96x32_MI32x32x8x1_SE_1LDSB1_GRVW2_LPB8_NLCA1_PLR5_SU32_SUS256_SRVW4_TT1_96_WG128_2_1_WGM1
    SolutionIndex: 219
    SolutionNameMin: Cijk_Ailk_Bljk_HBH_MT64x256x32_MI32x32x8x1_SE_1LDSB1_GRVW4_LPB8_NLCA1_PLR5_SU32_SUS256_SRVW4_TT1_128_WG64_4_1_WGM1
    SolutionIndex: 220
    SolutionNameMin: Cijk_Ailk_Bljk_HBH_MT128x128x32_MI32x32x8x1_SE_1LDSB1_GRVW2_LPB8_NLCA1_PLR5_SU0_SUS256_SRVW4_TT2_64_WG64_4_1_WGM2
    SolutionIndex: 221
    SolutionNameMin: Cijk_Ailk_Bljk_HBH_MT128x96x32_MI32x32x8x1_SE_1LDSB1_GRVW2_LPB8_NLCA1_PLR5_SU0_SUS256_SRVW4_TT1_96_WG128_2_1_WGM2
    SolutionIndex: 222
    SolutionNameMin: Cijk_Ailk_Bljk_HBH_MT128x256x32_MI32x32x8x1_SE_1LDSB1_GRVW8_LPB8_NLCA1_PLR5_SU0_SUS256_SRVW4_TT2_128_WG64_4_1_WGM2
    SolutionIndex: 223
    SolutionNameMin: Cijk_Ailk_Bljk_HBH_MT128x128x32_MI32x32x8x1_SE_1LDSB1_GRVW2_LPB8_NLCA1_PLR5_SU0_SUS256_SRVW4_TT2_64_WG64_4_1_WGM15
    SolutionIndex: 224
    SolutionNameMin: Cijk_Ailk_Bljk_HBH_MT128x96x32_MI32x32x8x1_SE_1LDSB1_GRVW2_LPB8_NLCA1_PLR5_SU0_SUS256_SRVW4_TT1_96_WG128_2_1_WGM15
    SolutionIndex: 225
    SolutionNameMin: Cijk_Ailk_Bljk_HBH_MT128x160x32_MI32x32x8x1_SE_1LDSB1_GRVW2_LPB8_NLCA1_PLR5_SU0_SUS256_SRVW4_TT1_160_WG128_2_1_WGM15
    SolutionIndex: 226
    SolutionNameMin: Cijk_Ailk_Bljk_HBH_MT128x256x32_MI32x32x8x1_SE_1LDSB1_GRVW8_LPB8_NLCA1_PLR5_SU0_SUS256_SRVW4_TT2_128_WG64_4_1_WGM15
    SolutionIndex: 227
    SolutionNameMin: Cijk_Ailk_Bljk_HBH_MT64x32x32_MI16x16x16x1_SE_1LDSB1_GRVW2_LPB16_NLCA1_PLR2_SU32_SUS128_SRVW4_TT2_16_WG32_8_1_WGM15
    SolutionIndex: 228
    SolutionNameMin: Cijk_Ailk_Bljk_HBH_MT128x96x32_MI32x32x8x1_SE_1LDSB1_GRVW2_LPB8_NLCA1_PLR5_SU32_SUS128_SRVW4_TT1_96_WG128_2_1_WGM15
    SolutionIndex: 229
    SolutionNameMin: Cijk_Ailk_Bljk_HBH_MT32x64x64_MI16x16x16x1_SE_1LDSB0_GRVW2_LPB16_NLCA1_PLR5_SU0_SUS256_SRVW0_TT1_32_WG32_8_1_WGM1
    SolutionIndex: 230
    SolutionNameMin: Cijk_Ailk_Bljk_HBH_MT32x32x64_MI16x16x16x1_SE_1LDSB0_GRVW4_LPB16_NLCA1_PLR5_SU0_SUS256_SRVW0_TT1_16_WG32_8_1_WGM1
    SolutionIndex: 231
    SolutionNameMin: Cijk_Ailk_Bljk_HBH_MT32x64x64_MI16x16x16x1_SE_1LDSB0_GRVW8_LPB16_NLCA1_PLR5_SU32_SUS256_SRVW0_TT1_32_WG32_8_1_WGM1
    SolutionIndex: 232
    SolutionNameMin: Cijk_Ailk_Bljk_HBH_MT128x128x64_MI32x32x8x1_SE_1LDSB1_GRVW2_LPB8_NLCA1_PLR9_SU32_SUS256_SRVW0_TT2_64_WG64_4_1_WGM1
    SolutionIndex: 233
    SolutionNameMin: Cijk_Ailk_Bljk_HBH_MT64x64x64_MI32x32x8x1_SE_1LDSB0_GRVW2_LPB8_NLCA1_PLR9_SU0_SUS256_SRVW0_TT1_32_WG64_4_1_WGM1
    SolutionIndex: 234
    SolutionNameMin: Cijk_Ailk_Bljk_HBH_MT32x64x64_MI16x16x16x1_SE_1LDSB0_GRVW8_LPB16_NLCA1_PLR5_SU0_SUS256_SRVW0_TT1_32_WG32_8_1_WGM15
    SolutionIndex: 235
    SolutionNameMin: Cijk_Ailk_Bljk_HBH_MT32x64x64_MI16x16x16x1_SE_1LDSB0_GRVW8_LPB16_NLCA1_PLR5_SU0_SUS256_SRVW0_TT1_32_WG32_8_1_WGM15
    SolutionIndex: 236
    SolutionNameMin: Cijk_Ailk_Bljk_HBH_MT64x16x32_MI16x16x16x1_SE_1LDSB0_GRVW2_LPB16_NLCA1_PLR2_SU0_SUS256_SRVW0_TT1_16_WG64_4_1_WGM1
    SolutionIndex: 237
    SolutionNameMin: Cijk_Ailk_Bljk_HBH_MT64x16x32_MI16x16x16x1_SE_1LDSB0_GRVW8_LPB16_NLCA1_PLR2_SU0_SUS256_SRVW0_TT1_16_WG64_4_1_WGM1
    SolutionIndex: 238
    SolutionNameMin: Cijk_Ailk_Bljk_HBH_MT64x16x32_MI16x16x16x1_SE_1LDSB0_GRVW2_LPB16_NLCA1_PLR2_SU0_SUS256_SRVW0_TT1_16_WG64_4_1_WGM2
    SolutionIndex: 239
    SolutionNameMin: Cijk_Ailk_Bljk_HBH_MT64x16x32_MI16x16x16x1_SE_1LDSB0_GRVW4_LPB16_NLCA1_PLR2_SU0_SUS256_SRVW0_TT1_16_WG64_4_1_WGM2
- - - [7680, 8192, 1, 8192, 8384, 8384, 8384, 8384]
    - [115, 95.504]
  - - [3840, 4096, 1, 4096, 4192, 4192, 4192, 4192]
    - [93, 94.147]
  - - [1920, 2048, 1, 2048, 2080, 2080, 2080, 2080]
    - [93, 87.127]
  - - [960, 1024, 1, 1024, 1056, 1056, 1056, 1056]
    - [78, 40.432]
  - - [480, 512, 1, 512, 544, 544, 544, 544]
    - [23, 11.215]
  - - [8192, 7680, 1, 8192, 8384, 8384, 8384, 8384]
    - [115, 95.231]
  - - [4096, 3840, 1, 4096, 4192, 4192, 4192, 4192]
    - [93, 93.766]
  - - [2048, 1920, 1, 2048, 2080, 2080, 2080, 2080]
    - [65, 84.966]
  - - [1024, 960, 1, 1024, 1056, 1056, 1056, 1056]
    - [50, 38.609]
  - - [512, 480, 1, 512, 544, 544, 544, 544]
    - [77, 11.109]
  - - [8192, 8192, 1, 8192, 8384, 8384, 8384, 8384]
    - [8, 92.536]
  - - [4096, 4096, 1, 4096, 4192, 4192, 4192, 4192]
    - [29, 86.638]
  - - [2048, 2048, 1, 2048, 2080, 2080, 2080, 2080]
    - [129, 70.393]
  - - [1024, 1024, 1, 1024, 1056, 1056, 1056, 1056]
    - [21, 38.798]
  - - [512, 512, 1, 512, 544, 544, 544, 544]
    - [49, 10.923]
  - - [64, 512, 16, 512, 64, 64, 64, 512]
    - [15, 15.225]
  - - [64, 512, 128, 512, 64, 64, 64, 512]
    - [15, 27.232]
  - - [1024, 1, 1, 2, 1024, 1024, 1024, 2]
    - [0, 0.0]
  - - [1024, 1, 1, 1024, 1024, 1024, 1024, 1024]
    - [171, 0.084]
  - - [1024, 8, 1, 1024, 1024, 1024, 1024, 1024]
    - [176, 0.623]
  - - [1024, 77, 1, 1024, 1024, 1024, 1024, 1024]
    - [13, 5.004]
  - - [1024, 77, 1, 30522, 1024, 1024, 1024, 30522]
    - [192, 30.937]
  - - [1024, 512, 1, 2, 1024, 1024, 1024, 2]
    - [33, 0.175]
  - - [1024, 512, 1, 1024, 1024, 1024, 1024, 1024]
    - [24, 21.94]
  - - [1024, 512, 1, 4096, 1024, 1024, 1024, 4096]
    - [160, 32.625]
  - - [1024, 616, 1, 1024, 1024, 1024, 1024, 1024]
    - [42, 25.944]
  - - [1024, 4096, 1, 2, 1024, 1024, 1024, 2]
    - [149, 0.639]
  - - [1024, 4096, 1, 1024, 1024, 1024, 1024, 1024]
    - [58, 63.499]
  - - [1024, 4096, 1, 4096, 1024, 1024, 1024, 4096]
    - [8, 73.921]
  - - [4096, 512, 1, 1024, 4096, 4096, 4096, 1024]
    - [116, 41.267]
  - - [4096, 4096, 1, 1024, 4096, 4096, 4096, 1024]
    - [130, 70.455]
  - - [64, 128, 128, 128, 64, 64, 64, 128]
    - [11, 11.524]
  - - [64, 128, 160, 128, 64, 64, 64, 128]
    - [2, 13.535]
  - - [1024, 10, 1, 2, 1024, 1024, 1024, 2]
    - [0, 0.003]
  - - [1024, 10, 1, 1024, 1024, 1024, 1024, 1024]
    - [176, 0.861]
  - - [1024, 160, 1, 1024, 1024, 1024, 1024, 1024]
    - [19, 10.065]
  - - [1024, 200, 1, 1024, 1024, 1024, 1024, 1024]
    - [85, 11.682]
  - - [1024, 200, 1, 30522, 1024, 1024, 1024, 30522]
    - [190, 45.917]
  - - [1024, 1024, 1, 2, 1024, 1024, 1024, 2]
    - [6, 0.28]
  - - [1024, 1024, 1, 1024, 1024, 1024, 1024, 1024]
    - [43, 37.08]
  - - [1024, 1024, 1, 4096, 1024, 1024, 1024, 4096]
    - [69, 45.213]
  - - [1024, 1280, 1, 2, 1024, 1024, 1024, 2]
    - [39, 0.346]
  - - [1024, 1280, 1, 1024, 1024, 1024, 1024, 1024]
    - [87, 42.579]
  - - [1024, 1280, 1, 4096, 1024, 1024, 1024, 4096]
    - [168, 50.648]
  - - [4096, 1024, 1, 1024, 4096, 4096, 4096, 1024]
    - [30, 55.903]
  - - [4096, 1280, 1, 1024, 4096, 4096, 4096, 1024]
    - [99, 54.553]
  - - [64, 128, 624, 128, 64, 64, 64, 128]
    - [11, 16.731]
  - - [1024, 39, 1, 2, 1024, 1024, 1024, 2]
    - [0, 0.012]
  - - [1024, 39, 1, 1024, 1024, 1024, 1024, 1024]
    - [169, 2.921]
  - - [1024, 780, 1, 1024, 1024, 1024, 1024, 1024]
    - [86, 32.851]
  - - [1024, 780, 1, 30522, 1024, 1024, 1024, 30522]
    - [181, 62.25]
  - - [1024, 4992, 1, 2, 1024, 1024, 1024, 2]
    - [91, 0.704]
  - - [1024, 4992, 1, 1024, 1024, 1024, 1024, 1024]
    - [152, 55.042]
  - - [1024, 4992, 1, 4096, 1024, 1024, 1024, 4096]
    - [152, 60.403]
  - - [4096, 4992, 1, 1024, 4096, 4096, 4096, 1024]
    - [113, 73.721]
  - - [64, 512, 64, 512, 64, 64, 64, 512]
    - [15, 23.983]
  - - [1024, 4, 1, 2, 1024, 1024, 1024, 2]
    - [0, 0.001]
  - - [1024, 4, 1, 1024, 1024, 1024, 1024, 1024]
    - [173, 0.324]
  - - [1024, 308, 1, 1024, 1024, 1024, 1024, 1024]
    - [85, 16.607]
  - - [1024, 308, 1, 30522, 1024, 1024, 1024, 30522]
    - [191, 52.468]
  - - [1024, 2048, 1, 2, 1024, 1024, 1024, 2]
    - [132, 0.413]
  - - [1024, 2048, 1, 1024, 1024, 1024, 1024, 1024]
    - [112, 45.78]
  - - [1024, 2048, 1, 4096, 1024, 1024, 1024, 4096]
    - [139, 59.24]
  - - [4096, 2048, 1, 1024, 4096, 4096, 4096, 1024]
    - [47, 63.298]
  - - [64, 128, 640, 128, 64, 64, 64, 128]
    - [34, 16.928]
  - - [1024, 40, 1, 2, 1024, 1024, 1024, 2]
    - [4, 0.013]
  - - [1024, 40, 1, 1024, 1024, 1024, 1024, 1024]
    - [169, 2.996]
  - - [1024, 800, 1, 1024, 1024, 1024, 1024, 1024]
    - [42, 33.125]
  - - [1024, 800, 1, 30522, 1024, 1024, 1024, 30522]
    - [185, 63.106]
  - - [1024, 5120, 1, 2, 1024, 1024, 1024, 2]
    - [90, 0.706]
  - - [1024, 5120, 1, 1024, 1024, 1024, 1024, 1024]
    - [138, 55.212]
  - - [1024, 5120, 1, 4096, 1024, 1024, 1024, 4096]
    - [116, 61.272]
  - - [4096, 5120, 1, 1024, 4096, 4096, 4096, 1024]
    - [113, 75.667]
  - - [64, 128, 656, 128, 64, 64, 64, 128]
    - [11, 17.399]
  - - [1024, 41, 1, 2, 1024, 1024, 1024, 2]
    - [9, 0.013]
  - - [1024, 41, 1, 1024, 1024, 1024, 1024, 1024]
    - [13, 2.683]
  - - [1024, 820, 1, 1024, 1024, 1024, 1024, 1024]
    - [86, 34.388]
  - - [1024, 820, 1, 30522, 1024, 1024, 1024, 30522]
    - [186, 64.147]
  - - [1024, 5248, 1, 2, 1024, 1024, 1024, 2]
    - [90, 0.745]
  - - [1024, 5248, 1, 1024, 1024, 1024, 1024, 1024]
    - [138, 56.038]
  - - [1024, 5248, 1, 4096, 1024, 1024, 1024, 4096]
    - [137, 62.178]
  - - [4096, 5248, 1, 1024, 4096, 4096, 4096, 1024]
    - [113, 75.734]
  - - [64, 512, 80, 512, 64, 64, 64, 512]
    - [15, 27.486]
  - - [1024, 5, 1, 2, 1024, 1024, 1024, 2]
    - [0, 0.001]
  - - [1024, 5, 1, 1024, 1024, 1024, 1024, 1024]
    - [172, 0.43]
  - - [1024, 385, 1, 1024, 1024, 1024, 1024, 1024]
    - [54, 19.081]
  - - [1024, 385, 1, 30522, 1024, 1024, 1024, 30522]
    - [194, 49.261]
  - - [1024, 2560, 1, 2, 1024, 1024, 1024, 2]
    - [90, 0.511]
  - - [1024, 2560, 1, 1024, 1024, 1024, 1024, 1024]
    - [69, 48.685]
  - - [1024, 2560, 1, 4096, 1024, 1024, 1024, 4096]
    - [96, 59.778]
  - - [4096, 2560, 1, 1024, 4096, 4096, 4096, 1024]
    - [100, 71.674]
  - - [64, 512, 96, 512, 64, 64, 64, 512]
    - [79, 28.656]
  - - [1024, 6, 1, 2, 1024, 1024, 1024, 2]
    - [238, 0.002]
  - - [1024, 6, 1, 1024, 1024, 1024, 1024, 1024]
    - [170, 0.499]
  - - [1024, 462, 1, 1024, 1024, 1024, 1024, 1024]
    - [51, 19.797]
  - - [1024, 462, 1, 30522, 1024, 1024, 1024, 30522]
    - [194, 57.528]
  - - [1024, 3072, 1, 2, 1024, 1024, 1024, 2]
    - [103, 0.566]
  - - [1024, 3072, 1, 1024, 1024, 1024, 1024, 1024]
    - [65, 53.736]
  - - [1024, 3072, 1, 4096, 1024, 1024, 1024, 4096]
    - [141, 69.42]
  - - [4096, 3072, 1, 1024, 4096, 4096, 4096, 1024]
    - [130, 68.049]
  - - [1024, 8, 1, 2, 1024, 1024, 1024, 2]
    - [0, 0.002]
  - - [1024, 160, 1, 30522, 1024, 1024, 1024, 30522]
    - [196, 40.695]
  - - [64, 128, 144, 128, 64, 64, 64, 128]
    - [70, 12.617]
  - - [1024, 9, 1, 2, 1024, 1024, 1024, 2]
    - [237, 0.003]
  - - [1024, 9, 1, 1024, 1024, 1024, 1024, 1024]
    - [176, 0.701]
  - - [1024, 180, 1, 1024, 1024, 1024, 1024, 1024]
    - [19, 10.836]
  - - [1024, 180, 1, 30522, 1024, 1024, 1024, 30522]
    - [195, 40.624]
  - - [1024, 1152, 1, 2, 1024, 1024, 1024, 2]
    - [34, 0.32]
  - - [1024, 1152, 1, 1024, 1024, 1024, 1024, 1024]
    - [38, 41.258]
  - - [1024, 1152, 1, 4096, 1024, 1024, 1024, 4096]
    - [69, 47.749]
  - - [4096, 1152, 1, 1024, 4096, 4096, 4096, 1024]
    - [46, 51.619]
  - - [256, 32768, 1, 128, 256, 256, 256, 128]
    - [90, 34.413]
  - - [512, 32768, 1, 256, 512, 512, 512, 256]
    - [133, 53.097]
  - - [1024, 32768, 1, 512, 1024, 1024, 1024, 512]
    - [113, 73.081]
  - - [1024, 32768, 1, 1024, 1024, 1024, 1024, 1024]
    - [113, 80.752]
  - - [64, 128, 512, 128, 64, 64, 64, 128]
    - [101, 16.26]
  - - [128, 128, 512, 64, 128, 128, 128, 64]
    - [90, 20.935]
  - - [1024, 32, 1, 2, 1024, 1024, 1024, 2]
    - [9, 0.01]
  - - [1024, 32, 1, 1024, 1024, 1024, 1024, 1024]
    - [36, 2.013]
  - - [1024, 4096, 1, 30528, 1024, 1024, 1024, 30528]
    - [82, 81.55]
  - - [512, 512, 64, 64, 512, 512, 512, 64]
    - [133, 28.875]
  - - [1024, 2048, 1, 30528, 1024, 1024, 1024, 30528]
    - [157, 77.021]
  - - [64, 4, 32768, 4, 64, 64, 2097152, 4]
    - [89, 0.145]
  - - [64, 4, 38400, 4, 64, 64, 2457600, 4]
    - [89, 0.147]
  - - [1024, 8192, 1, 1024, 1024, 1024, 1024, 1024]
    - [58, 63.699]
  - - [1024, 8192, 1, 4096, 1024, 1024, 1024, 4096]
    - [82, 76.342]
  - - [1024, 8192, 1, 33712, 1024, 1024, 1024, 33712]
    - [40, 81.904]
  - - [1024, 9600, 1, 1024, 1024, 1024, 1024, 1024]
    - [59, 77.985]
  - - [1024, 9600, 1, 4096, 1024, 1024, 1024, 4096]
    - [8, 81.124]
  - - [1024, 9600, 1, 33712, 1024, 1024, 1024, 33712]
    - [59, 86.197]
  - - [4096, 8192, 1, 1024, 4096, 4096, 4096, 1024]
    - [113, 77.427]
  - - [4096, 9600, 1, 1024, 4096, 4096, 4096, 1024]
    - [113, 77.584]
  - - [1024, 10064, 1, 1024, 1024, 1024, 1024, 1024]
    - [93, 70.643]
  - - [1024, 10064, 1, 4096, 1024, 1024, 1024, 4096]
    - [140, 78.178]
  - - [1024, 10080, 1, 1024, 1024, 1024, 1024, 1024]
    - [140, 71.01]
  - - [1024, 10080, 1, 4096, 1024, 1024, 1024, 4096]
    - [93, 78.427]
  - - [1024, 10080, 1, 42720, 1024, 1024, 1024, 42720]
    - [56, 83.194]
  - - [1024, 10200, 1, 1024, 1024, 1024, 1024, 1024]
    - [140, 68.935]
  - - [1024, 10200, 1, 4096, 1024, 1024, 1024, 4096]
    - [140, 79.25]
  - - [1024, 3840, 1, 1024, 1024, 1024, 1024, 1024]
    - [140, 67.05]
  - - [1024, 3840, 1, 4096, 1024, 1024, 1024, 4096]
    - [141, 80.777]
  - - [1024, 3968, 1, 1024, 1024, 1024, 1024, 1024]
    - [29, 55.468]
  - - [1024, 3968, 1, 4096, 1024, 1024, 1024, 4096]
    - [30, 71.842]
  - - [1024, 3968, 1, 42720, 1024, 1024, 1024, 42720]
    - [82, 79.292]
  - - [1024, 6528, 1, 1024, 1024, 1024, 1024, 1024]
    - [141, 65.234]
  - - [1024, 6528, 1, 4096, 1024, 1024, 1024, 4096]
    - [141, 75.188]
  - - [1024, 6528, 1, 42720, 1024, 1024, 1024, 42720]
    - [56, 81.238]
  - - [1024, 7104, 1, 1024, 1024, 1024, 1024, 1024]
    - [109, 69.365]
  - - [1024, 7104, 1, 4096, 1024, 1024, 1024, 4096]
    - [115, 85.171]
  - - [1024, 7104, 1, 42720, 1024, 1024, 1024, 42720]
    - [120, 87.46]
  - - [1024, 7200, 1, 1024, 1024, 1024, 1024, 1024]
    - [134, 66.404]
  - - [1024, 7200, 1, 4096, 1024, 1024, 1024, 4096]
    - [105, 81.871]
  - - [1024, 7200, 1, 42720, 1024, 1024, 1024, 42720]
    - [146, 88.717]
  - - [1024, 8064, 1, 1024, 1024, 1024, 1024, 1024]
    - [58, 63.56]
  - - [1024, 8064, 1, 4096, 1024, 1024, 1024, 4096]
    - [82, 75.383]
  - - [1024, 8160, 1, 1024, 1024, 1024, 1024, 1024]
    - [59, 67.861]
  - - [1024, 8160, 1, 4096, 1024, 1024, 1024, 4096]
    - [59, 77.686]
  - - [1024, 9216, 1, 1024, 1024, 1024, 1024, 1024]
    - [59, 69.782]
  - - [1024, 9216, 1, 4096, 1024, 1024, 1024, 4096]
    - [59, 84.58]
  - - [1024, 9520, 1, 1024, 1024, 1024, 1024, 1024]
    - [82, 70.827]
  - - [1024, 9520, 1, 4096, 1024, 1024, 1024, 4096]
    - [59, 81.823]
  - - [1024, 9520, 1, 42720, 1024, 1024, 1024, 42720]
    - [59, 94.975]
  - - [4096, 10064, 1, 1024, 4096, 4096, 4096, 1024]
    - [113, 76.454]
  - - [4096, 10080, 1, 1024, 4096, 4096, 4096, 1024]
    - [30, 77.067]
  - - [4096, 10200, 1, 1024, 4096, 4096, 4096, 1024]
    - [93, 77.622]
  - - [4096, 3840, 1, 1024, 4096, 4096, 4096, 1024]
    - [115, 80.994]
  - - [4096, 3968, 1, 1024, 4096, 4096, 4096, 1024]
    - [113, 69.939]
  - - [4096, 6528, 1, 1024, 4096, 4096, 4096, 1024]
    - [113, 73.086]
  - - [4096, 7104, 1, 1024, 4096, 4096, 4096, 1024]
    - [130, 76.292]
  - - [4096, 7200, 1, 1024, 4096, 4096, 4096, 1024]
    - [45, 77.642]
  - - [4096, 8064, 1, 1024, 4096, 4096, 4096, 1024]
    - [148, 76.236]
  - - [4096, 8160, 1, 1024, 4096, 4096, 4096, 1024]
    - [93, 77.181]
  - - [4096, 9216, 1, 1024, 4096, 4096, 4096, 1024]
    - [95, 80.694]
  - - [4096, 9520, 1, 1024, 4096, 4096, 4096, 1024]
    - [93, 78.079]
  - - [64, 14, 10880, 14, 64, 64, 696320, 14]
    - [107, 1.545]
  - - [64, 14, 10880, 15, 64, 64, 696320, 15]
    - [89, 1.667]
  - - [64, 15, 7680, 15, 64, 64, 491520, 15]
    - [89, 1.722]
  - - [64, 15, 10880, 15, 64, 64, 696320, 15]
    - [131, 1.773]
  - - [64, 15, 7680, 17, 64, 64, 491520, 17]
    - [89, 1.761]
  - - [64, 17, 6144, 17, 64, 64, 393216, 17]
    - [89, 1.886]
  - - [64, 17, 7680, 17, 64, 64, 491520, 17]
    - [131, 1.987]
  - - [64, 17, 6144, 21, 64, 64, 393216, 21]
    - [89, 2.289]
  - - [64, 21, 6144, 21, 64, 64, 393216, 21]
    - [89, 2.769]
  - - [64, 24, 4736, 24, 64, 64, 303104, 24]
    - [107, 3.544]
  - - [64, 24, 4736, 34, 64, 64, 303104, 34]
    - [89, 3.883]
  - - [64, 30, 2048, 30, 64, 64, 131072, 30]
    - [89, 4.279]
  - - [64, 31, 2048, 30, 64, 64, 131072, 30]
    - [107, 4.439]
  - - [64, 31, 2048, 31, 64, 64, 131072, 31]
    - [131, 4.517]
  - - [64, 32, 4608, 32, 64, 64, 294912, 32]
    - [131, 7.457]
  - - [64, 34, 4736, 34, 64, 64, 303104, 34]
    - [101, 3.693]
  - - [64, 35, 4608, 32, 64, 64, 294912, 32]
    - [89, 6.427]
  - - [64, 35, 4608, 35, 64, 64, 294912, 35]
    - [88, 3.582]
  - - [64, 512, 1, 512, 64, 64, 64, 512]
    - [22, 1.495]
  - - [512, 512, 1, 64, 512, 512, 512, 64]
    - [32, 2.908]
  - - [128, 128, 1, 64, 128, 128, 128, 64]
    - [22, 0.185]
  - - [64, 128, 1, 128, 64, 64, 64, 128]
    - [0, 0.156]
  - - [1024, 512, 1, 64, 1024, 1024, 1024, 64]
    - [10, 5.234]
  - - [64, 5, 1, 5, 64, 64, 64, 5]
    - [0, 0.0]
  - - [2048, 512, 1, 2048, 2048, 2048, 2048, 2048]
    - [21, 42.579]
  - - [512, 1600, 1, 512, 512, 512, 512, 512]
    - [61, 25.824]
  - - [32, 33, 1, 33, 32, 32, 32, 33]
    - [0, 0.004]
  - - [560, 1600, 1, 1024, 560, 560, 560, 1024]
    - [78, 33.281]
  - - [512, 1600, 1, 32, 512, 512, 512, 32]
    - [1, 4.543]
  - - [1024, 1600, 1, 1024, 1024, 1024, 1024, 1024]
    - [99, 41.869]
  - - [32, 33, 1600, 33, 32, 32, 32, 33]
    - [106, 2.57]
  - - [32, 200, 1, 1, 32, 32, 32, 1]
    - [0, 0.001]
  - - [64, 3, 512, 3, 64, 64, 64, 3]
    - [236, 0.034]
  - - [64, 5, 512, 5, 64, 64, 64, 5]
    - [238, 0.09]
  - - [64, 5, 960, 5, 64, 64, 64, 5]
    - [239, 0.139]
  - - [64, 9, 512, 9, 64, 64, 64, 9]
    - [89, 0.282]
  - - [64, 512, 1, 1, 64, 64, 64, 1]
    - [63, 0.007]
  - - [128, 27, 32768, 27, 128, 128, 128, 27]
    - [107, 4.982]
  - - [256, 1024, 1, 1, 256, 256, 256, 1]
    - [89, 0.052]
  - - [256, 8976, 1, 1536, 256, 256, 256, 1536]
    - [112, 56.271]
  - - [256, 8976, 1, 2048, 256, 256, 256, 2048]
    - [139, 60.497]
  - - [256, 8976, 1, 2304, 256, 256, 256, 2304]
    - [112, 59.984]
  - - [256, 8976, 1, 2560, 256, 256, 256, 2560]
    - [122, 60.696]
  - - [256, 8976, 1, 2816, 256, 256, 256, 2816]
    - [139, 60.8]
  - - [256, 8976, 1, 3072, 256, 256, 256, 3072]
    - [122, 62.03]
  - - [256, 8976, 1, 4352, 256, 256, 256, 4352]
    - [147, 63.752]
  - - [256, 8976, 1, 4864, 256, 256, 256, 4864]
    - [139, 62.784]
  - - [256, 8976, 1, 5376, 256, 256, 256, 5376]
    - [162, 63.872]
  - - [256, 8976, 1, 5632, 256, 256, 256, 5632]
    - [147, 66.363]
  - - [256, 8976, 1, 5888, 256, 256, 256, 5888]
    - [159, 66.189]
  - - [256, 8976, 1, 6144, 256, 256, 256, 6144]
    - [161, 66.898]
  - - [256, 8976, 1, 6656, 256, 256, 256, 6656]
    - [164, 68.322]
  - - [256, 8976, 1, 7168, 256, 256, 256, 7168]
    - [164, 69.529]
  - - [256, 8976, 1, 7424, 256, 256, 256, 7424]
    - [157, 69.838]
  - - [256, 8976, 1, 8192, 256, 256, 256, 8192]
    - [155, 70.018]
  - - [256, 8976, 1, 8448, 256, 256, 256, 8448]
    - [163, 72.177]
  - - [256, 8976, 1, 8960, 256, 256, 256, 8960]
    - [159, 72.82]
  - - [256, 8976, 1, 9472, 256, 256, 256, 9472]
    - [157, 73.349]
  - - [256, 8976, 1, 9728, 256, 256, 256, 9728]
    - [161, 73.973]
  - - [256, 8976, 1, 9984, 256, 256, 256, 9984]
    - [163, 74.471]
  - - [256, 8976, 1, 10240, 256, 256, 256, 10240]
    - [157, 74.269]
  - - [256, 8976, 1, 10496, 256, 256, 256, 10496]
    - [159, 75.037]
  - - [256, 8976, 1, 11008, 256, 256, 256, 11008]
    - [157, 75.389]
  - - [256, 8976, 1, 11520, 256, 256, 256, 11520]
    - [163, 76.272]
  - - [256, 8976, 1, 12288, 256, 256, 256, 12288]
    - [164, 76.816]
  - - [256, 8976, 1, 14336, 256, 256, 256, 14336]
    - [163, 78.846]
  - - [256, 8976, 1, 14848, 256, 256, 256, 14848]
    - [164, 78.976]
  - - [256, 8976, 1, 15104, 256, 256, 256, 15104]
    - [155, 79.124]
  - - [256, 8976, 1, 15872, 256, 256, 256, 15872]
    - [157, 79.432]
  - - [256, 8976, 1, 17152, 256, 256, 256, 17152]
    - [162, 79.733]
  - - [256, 8976, 1, 19712, 256, 256, 256, 19712]
    - [163, 81.565]
  - - [256, 8976, 1, 19968, 256, 256, 256, 19968]
    - [156, 81.219]
  - - [256, 8976, 1, 20480, 256, 256, 256, 20480]
    - [155, 81.497]
  - - [256, 8976, 1, 20992, 256, 256, 256, 20992]
    - [164, 81.69]
  - - [256, 8976, 1, 22016, 256, 256, 256, 22016]
    - [157, 81.657]
  - - [256, 8976, 1, 26112, 256, 256, 256, 26112]
    - [164, 83.349]
  - - [256, 8976, 1, 33536, 256, 256, 256, 33536]
    - [155, 85.014]
  - - [256, 8976, 1, 44505, 256, 256, 256, 44505]
    - [159, 81.41]
  - - [480, 32768, 1, 1024, 480, 480, 480, 1024]
    - [90, 67.17]
  - - [512, 200, 1, 1, 512, 512, 512, 1]
    - [0, 0.022]
  - - [512, 200, 1, 32, 512, 512, 512, 32]
    - [4, 0.626]
  - - [512, 215, 1, 2048, 512, 512, 512, 2048]
    - [188, 10.82]
  - - [512, 256, 1, 2048, 512, 512, 512, 2048]
    - [180, 12.436]
  - - [560, 200, 1, 1024, 560, 560, 560, 1024]
    - [174, 7.015]
  - - [768, 215, 1, 2048, 768, 768, 768, 2048]
    - [182, 15.07]
  - - [768, 256, 1, 2048, 768, 768, 768, 2048]
    - [179, 17.527]
  - - [1024, 1, 1, 200, 1024, 1024, 1024, 200]
    - [237, 0.022]
  - - [1024, 1, 1, 1600, 1024, 1024, 1024, 1600]
    - [184, 0.142]
  - - [1024, 200, 1, 1, 1024, 1024, 1024, 1]
    - [9, 0.045]
  - - [1024, 512, 1, 1, 1024, 1024, 1024, 1]
    - [5, 0.094]
  - - [1024, 960, 1, 64, 1024, 1024, 1024, 64]
    - [52, 9.2]
  - - [1024, 960, 1, 1024, 1024, 1024, 1024, 1024]
    - [68, 35.956]
  - - [1024, 1600, 1, 1, 1024, 1024, 1024, 1]
    - [7, 0.213]
  - - [1024, 1792, 1, 256, 1024, 1024, 1024, 256]
    - [83, 30.743]
  - - [1024, 2048, 1, 256, 1024, 1024, 1024, 256]
    - [144, 31.014]
  - - [1024, 2560, 1, 256, 1024, 1024, 1024, 256]
    - [57, 32.208]
  - - [1024, 3072, 1, 256, 1024, 1024, 1024, 256]
    - [133, 35.718]
  - - [1024, 3328, 1, 256, 1024, 1024, 1024, 256]
    - [64, 37.799]
  - - [1024, 3840, 1, 256, 1024, 1024, 1024, 256]
    - [76, 45.074]
  - - [1024, 4096, 1, 256, 1024, 1024, 1024, 256]
    - [71, 43.127]
  - - [1024, 4608, 1, 256, 1024, 1024, 1024, 256]
    - [111, 39.389]
  - - [1024, 4864, 1, 256, 1024, 1024, 1024, 256]
    - [133, 38.996]
  - - [1024, 5120, 1, 256, 1024, 1024, 1024, 256]
    - [145, 39.13]
  - - [1024, 5632, 1, 256, 1024, 1024, 1024, 256]
    - [145, 42.253]
  - - [1024, 6144, 1, 256, 1024, 1024, 1024, 256]
    - [140, 44.202]
  - - [1024, 6400, 1, 256, 1024, 1024, 1024, 256]
    - [140, 46.179]
  - - [1024, 7168, 1, 256, 1024, 1024, 1024, 256]
    - [140, 49.536]
  - - [1024, 7424, 1, 256, 1024, 1024, 1024, 256]
    - [153, 51.305]
  - - [1024, 7680, 1, 256, 1024, 1024, 1024, 256]
    - [140, 52.191]
  - - [1024, 7936, 1, 256, 1024, 1024, 1024, 256]
    - [127, 45.068]
  - - [1024, 8192, 1, 256, 1024, 1024, 1024, 256]
    - [133, 45.572]
  - - [1024, 8448, 1, 256, 1024, 1024, 1024, 256]
    - [133, 47.976]
  - - [1024, 8704, 1, 256, 1024, 1024, 1024, 256]
    - [133, 47.138]
  - - [1024, 8960, 1, 256, 1024, 1024, 1024, 256]
    - [133, 48.848]
  - - [1024, 9728, 1, 256, 1024, 1024, 1024, 256]
    - [123, 49.005]
  - - [1024, 9984, 1, 256, 1024, 1024, 1024, 256]
    - [153, 50.089]
  - - [1024, 10240, 1, 256, 1024, 1024, 1024, 256]
    - [153, 51.479]
  - - [1024, 10496, 1, 256, 1024, 1024, 1024, 256]
    - [148, 52.125]
  - - [1024, 11008, 1, 256, 1024, 1024, 1024, 256]
    - [148, 53.797]
  - - [1024, 11264, 1, 256, 1024, 1024, 1024, 256]
    - [148, 54.72]
  - - [1024, 11520, 1, 256, 1024, 1024, 1024, 256]
    - [148, 53.627]
  - - [1024, 12288, 1, 256, 1024, 1024, 1024, 256]
    - [133, 48.622]
  - - [1024, 13312, 1, 256, 1024, 1024, 1024, 256]
    - [148, 51.349]
  - - [1024, 13568, 1, 256, 1024, 1024, 1024, 256]
    - [153, 52.584]
  - - [1024, 14336, 1, 256, 1024, 1024, 1024, 256]
    - [140, 53.613]
  - - [1024, 14592, 1, 256, 1024, 1024, 1024, 256]
    - [140, 54.076]
  - - [1024, 14848, 1, 256, 1024, 1024, 1024, 256]
    - [140, 55.191]
  - - [1024, 15104, 1, 256, 1024, 1024, 1024, 256]
    - [153, 55.305]
  - - [1024, 16128, 1, 256, 1024, 1024, 1024, 256]
    - [127, 51.252]
  - - [1024, 17152, 1, 256, 1024, 1024, 1024, 256]
    - [140, 53.878]
  - - [1024, 18944, 1, 256, 1024, 1024, 1024, 256]
    - [153, 56.815]
  - - [1024, 19712, 1, 256, 1024, 1024, 1024, 256]
    - [123, 53.142]
  - - [1024, 19968, 1, 256, 1024, 1024, 1024, 256]
    - [130, 52.788]
  - - [1024, 20480, 1, 256, 1024, 1024, 1024, 256]
    - [148, 54.731]
  - - [1024, 20992, 1, 256, 1024, 1024, 1024, 256]
    - [123, 55.495]
  - - [1024, 21504, 1, 256, 1024, 1024, 1024, 256]
    - [148, 55.767]
  - - [1024, 22016, 1, 256, 1024, 1024, 1024, 256]
    - [130, 56.439]
  - - [1024, 23552, 1, 256, 1024, 1024, 1024, 256]
    - [148, 54.716]
  - - [1024, 28672, 1, 256, 1024, 1024, 1024, 256]
    - [148, 57.468]
  - - [1024, 33536, 1, 256, 1024, 1024, 1024, 256]
    - [140, 58.102]
  - - [1024, 40448, 1, 256, 1024, 1024, 1024, 256]
    - [130, 58.681]
  - - [1600, 512, 1, 1024, 1600, 1600, 1600, 1024]
    - [41, 33.549]
  - - [2048, 1, 1, 512, 2048, 2048, 2048, 512]
    - [158, 0.097]
  - - [2048, 512, 1, 1, 2048, 2048, 2048, 1]
    - [28, 0.151]
  - - [2048, 960, 1, 2048, 2048, 2048, 2048, 2048]
    - [147, 49.91]
  - - [2048, 1024, 1, 1, 2048, 2048, 2048, 1]
    - [118, 0.216]
  - - [2048, 1024, 1, 256, 2048, 2048, 2048, 256]
    - [81, 28.069]
  - - [3200, 1024, 1, 2048, 3200, 3200, 3200, 2048]
    - [94, 64.414]
  - - [4096, 1024, 1, 1, 4096, 4096, 4096, 1]
    - [90, 0.309]
  - - [2048, 1024, 1, 2048, 2048, 2048, 2048, 2048]
    - [139, 55.137]
  - - [2048, 1024, 1, 30592, 2048, 2048, 2048, 30592]
    - [166, 71.147]
  - - [2048, 1024, 1, 6144, 2048, 2048, 2048, 6144]
    - [122, 63.1]
  - - [2048, 1024, 1, 8192, 2048, 2048, 2048, 8192]
    - [162, 64.83]
  - - [2048, 2, 1, 2, 2048, 2048, 2048, 2]
    - [31, 0.001]
  - - [2048, 2, 1, 2048, 2048, 2048, 2048, 2048]
    - [187, 0.565]
  - - [8192, 1024, 1, 2048, 8192, 8192, 8192, 2048]
    - [8, 71.552]
  - - [1024, 16, 1, 1024, 1024, 1024, 1024, 1024]
    - [176, 1.319]
  - - [1024, 16, 1, 2, 1024, 1024, 1024, 2]
    - [239, 0.005]
  - - [1024, 8192, 1, 30592, 1024, 1024, 1024, 30592]
    - [72, 81.986]
  - - [1024, 8192, 1, 3072, 1024, 1024, 1024, 3072]
    - [82, 74.457]
  - - [512, 512, 256, 64, 512, 512, 512, 64]
    - [133, 33.274]
  - - [64, 512, 256, 512, 64, 64, 64, 512]
    - [67, 30.086]
  - - [1024, 2048, 1, 30592, 1024, 1024, 1024, 30592]
    - [162, 76.828]
  - - [1024, 2048, 1, 3072, 1024, 1024, 1024, 3072]
    - [147, 58.31]
  - - [1024, 4096, 1, 30592, 1024, 1024, 1024, 30592]
    - [59, 80.879]
  - - [1024, 4096, 1, 3072, 1024, 1024, 1024, 3072]
    - [58, 71.648]
  - - [512, 512, 128, 64, 512, 512, 512, 64]
    - [149, 31.402]
  - - [2560, 2048, 1, 1920, 2560, 2560, 2560, 1920]
    - [128, 61.372]
  - - [2560, 2048, 1, 2560, 2560, 2560, 2560, 2560]
    - [21, 63.374]
  - - [2560, 2048, 1, 7680, 2560, 2560, 2560, 7680]
    - [87, 66.017]
  - - [2560, 4, 1, 2, 2560, 2560, 2560, 2]
    - [0, 0.003]
  - - [2560, 4, 1, 2560, 2560, 2560, 2560, 2560]
    - [183, 1.333]
  - - [640, 2048, 1, 2560, 640, 640, 640, 2560]
    - [16, 54.612]
  - - [512, 512, 40, 64, 512, 512, 512, 64]
    - [133, 27.071]
  - - [64, 512, 40, 512, 64, 64, 64, 512]
    - [75, 25.022]
  - - [1536, 4096, 1, 1536, 1536, 1536, 1536, 1536]
    - [141, 67.34]
  - - [1536, 4096, 1, 4608, 1536, 1536, 1536, 4608]
    - [35, 73.13]
  - - [1536, 4096, 1, 50304, 1536, 1536, 1536, 50304]
    - [135, 76.555]
  - - [1536, 4096, 1, 6144, 1536, 1536, 1536, 6144]
    - [114, 73.917]
  - - [6144, 4096, 1, 1536, 6144, 6144, 6144, 1536]
    - [113, 81.512]
  - - [1024, 1024, 64, 96, 1024, 1024, 1024, 96]
    - [123, 48.195]
  - - [96, 1024, 64, 1024, 96, 96, 96, 1024]
    - [104, 43.406]
  - - [1536, 8192, 1, 1536, 1536, 1536, 1536, 1536]
    - [142, 71.126]
  - - [1536, 8192, 1, 4608, 1536, 1536, 1536, 4608]
    - [82, 78.653]
  - - [1536, 8192, 1, 50304, 1536, 1536, 1536, 50304]
    - [72, 82.818]
  - - [1536, 8192, 1, 6144, 1536, 1536, 1536, 6144]
    - [72, 79.716]
  - - [6144, 8192, 1, 1536, 6144, 6144, 6144, 1536]
    - [130, 86.949]
  - - [1024, 1024, 128, 96, 1024, 1024, 1024, 96]
    - [130, 50.159]
  - - [96, 1024, 128, 1024, 96, 96, 96, 1024]
    - [25, 45.762]
  - - [1024, 16384, 1, 1024, 1024, 1024, 1024, 1024]
    - [113, 71.489]
  - - [1024, 16384, 1, 3072, 1024, 1024, 1024, 3072]
    - [82, 76.744]
  - - [1024, 16384, 1, 4096, 1024, 1024, 1024, 4096]
    - [72, 78.294]
  - - [1024, 16384, 1, 50304, 1024, 1024, 1024, 50304]
    - [72, 82.44]
  - - [4096, 16384, 1, 1024, 4096, 4096, 4096, 1024]
    - [115, 80.218]
  - - [1024, 1024, 256, 64, 1024, 1024, 1024, 64]
    - [134, 36.31]
  - - [64, 1024, 256, 1024, 64, 64, 64, 1024]
    - [151, 37.759]
  - - [1024, 2048, 1, 50304, 1024, 1024, 1024, 50304]
    - [162, 78.85]
  - - [1024, 1024, 32, 64, 1024, 1024, 1024, 64]
    - [108, 32.573]
  - - [64, 1024, 32, 1024, 64, 64, 64, 1024]
    - [15, 27.913]
  - - [1024, 4096, 1, 50304, 1024, 1024, 1024, 50304]
    - [59, 81.816]
  - - [1024, 1024, 64, 64, 1024, 1024, 1024, 64]
    - [145, 34.442]
  - - [64, 1024, 64, 1024, 64, 64, 64, 1024]
    - [51, 32.546]
  - - [1024, 8192, 1, 50304, 1024, 1024, 1024, 50304]
    - [59, 82.127]
  - - [1024, 1024, 128, 64, 1024, 1024, 1024, 64]
    - [134, 35.649]
  - - [64, 1024, 128, 1024, 64, 64, 64, 1024]
    - [78, 35.618]
  - - [128, 128, 1024, 64, 128, 128, 128, 64]
    - [133, 20.057]
  - - [64, 128, 1024, 128, 64, 64, 64, 128]
    - [117, 17.691]
  - - [1024, 64, 1, 2, 1024, 1024, 1024, 2]
    - [4, 0.019]
  - - [1024, 8192, 1, 30528, 1024, 1024, 1024, 30528]
    - [82, 82.227]
  - - [1024, 64, 1, 1024, 1024, 1024, 1024, 1024]
    - [13, 4.078]
  - - [1024, 3456, 1, 1024, 1024, 1024, 1024, 1024]
    - [140, 60.238]
  - - [1024, 3456, 1, 512, 1024, 1024, 1024, 512]
    - [150, 48.727]
  - - [1024, 4096, 1, 512, 1024, 1024, 1024, 512]
    - [80, 54.911]
  - - [1024, 6912, 1, 1024, 1024, 1024, 1024, 1024]
    - [95, 72.234]
  - - [1024, 6912, 1, 512, 1024, 1024, 1024, 512]
    - [154, 62.457]
  - - [1024, 864, 1, 1024, 1024, 1024, 1024, 1024]
    - [86, 34.748]
  - - [1024, 864, 1, 512, 1024, 1024, 1024, 512]
    - [42, 25.849]
  - - [256, 3456, 1, 128, 256, 256, 256, 128]
    - [10, 13.587]
  - - [256, 4096, 1, 128, 256, 256, 256, 128]
    - [12, 13.362]
  - - [256, 55296, 1, 128, 256, 256, 256, 128]
    - [110, 40.374]
  - - [256, 6912, 1, 128, 256, 256, 256, 128]
    - [55, 21.852]
  - - [256, 864, 1, 128, 256, 256, 256, 128]
    - [60, 4.344]
  - - [480, 3456, 1, 1024, 480, 480, 480, 1024]
    - [6, 41.725]
  - - [480, 4096, 1, 1024, 480, 480, 480, 1024]
    - [27, 43.715]
  - - [480, 6912, 1, 1024, 480, 480, 480, 1024]
    - [124, 59.99]
  - - [480, 864, 1, 1024, 480, 480, 480, 1024]
    - [14, 20.593]
  - - [512, 3456, 1, 256, 512, 512, 512, 256]
    - [137, 29.646]
  - - [512, 4096, 1, 256, 512, 512, 512, 256]
    - [57, 27.012]
  - - [512, 55296, 1, 256, 512, 512, 512, 256]
    - [140, 55.734]
  - - [512, 6912, 1, 256, 512, 512, 512, 256]
    - [35, 40.959]
  - - [512, 864, 1, 256, 512, 512, 512, 256]
    - [62, 11.156]
  - - [1024, 640, 1, 30528, 1024, 1024, 1024, 30528]
    - [189, 74.24]
  - - [1024, 1280, 1, 30528, 1024, 1024, 1024, 30528]
    - [178, 72.389]
  - - [1024, 1600, 1, 30528, 1024, 1024, 1024, 30528]
    - [175, 84.721]
  - - [1024, 10240, 1, 1024, 1024, 1024, 1024, 1024]
    - [93, 71.981]
  - - [1024, 10240, 1, 4096, 1024, 1024, 1024, 4096]
    - [65, 79.045]
  - - [4096, 10240, 1, 1024, 4096, 4096, 4096, 1024]
    - [30, 78.245]
  - - [1024, 80, 1, 1024, 1024, 1024, 1024, 1024]
    - [77, 5.165]
  - - [1024, 80, 1, 2, 1024, 1024, 1024, 2]
    - [31, 0.025]
  - - [128, 128, 1280, 64, 128, 128, 128, 64]
    - [97, 20.694]
  - - [64, 128, 1280, 128, 64, 64, 64, 128]
    - [143, 17.97]
  - - [1024, 1640, 1, 30528, 1024, 1024, 1024, 30528]
    - [165, 76.717]
  - - [1024, 10496, 1, 1024, 1024, 1024, 1024, 1024]
    - [140, 73.57]
  - - [1024, 10496, 1, 4096, 1024, 1024, 1024, 4096]
    - [65, 80.625]
  - - [4096, 10496, 1, 1024, 4096, 4096, 4096, 1024]
    - [93, 80.248]
  - - [1024, 82, 1, 1024, 1024, 1024, 1024, 1024]
    - [19, 5.294]
  - - [1024, 82, 1, 2, 1024, 1024, 1024, 2]
    - [9, 0.027]
  - - [128, 128, 1312, 64, 128, 128, 128, 64]
    - [149, 20.699]
  - - [64, 128, 1312, 128, 64, 64, 64, 128]
    - [117, 17.982]
  - - [1024, 160, 1, 30528, 1024, 1024, 1024, 30528]
    - [193, 50.44]
  - - [1024, 240, 1, 30528, 1024, 1024, 1024, 30528]
    - [195, 59.502]
  - - [1024, 6144, 1, 4096, 1024, 1024, 1024, 4096]
    - [141, 72.119]
  - - [1024, 12, 1, 1024, 1024, 1024, 1024, 1024]
    - [167, 0.934]
  - - [4096, 6144, 1, 1024, 4096, 4096, 4096, 1024]
    - [93, 76.977]
  - - [1024, 6144, 1, 1024, 1024, 1024, 1024, 1024]
    - [65, 62.028]
  - - [1024, 12, 1, 2, 1024, 1024, 1024, 2]
    - [0, 0.004]
  - - [512, 512, 192, 64, 512, 512, 512, 64]
    - [145, 33.018]
  - - [64, 512, 192, 512, 64, 64, 64, 512]
    - [15, 28.958]
  - - [256, 4096, 1, 1, 256, 256, 256, 1]
    - [107, 0.136]
  - - [256, 6912, 1, 1, 256, 256, 256, 1]
    - [3, 0.213]
  - - [3136, 128, 64, 64, 3136, 3136, 3136, 64]
    - [97, 25.86]
  - - [3136, 256, 64, 64, 3136, 3136, 3136, 64]
    - [145, 31.956]
  - - [3136, 256, 64, 128, 3136, 3136, 3136, 128]
    - [93, 46.912]
  - - [784, 512, 64, 256, 784, 784, 784, 256]
    - [93, 50.908]
  - - [3136, 128, 64, 256, 3136, 3136, 3136, 256]
    - [108, 46.557]
  - - [3136, 256, 64, 256, 3136, 3136, 3136, 256]
    - [93, 61.333]
  - - [784, 256, 64, 512, 784, 784, 784, 512]
    - [93, 57.629]
  - - [784, 512, 64, 512, 784, 784, 784, 512]
    - [93, 61.826]
  - - [3136, 128, 32, 64, 3136, 3136, 3136, 64]
    - [133, 23.893]
  - - [3136, 256, 32, 64, 3136, 3136, 3136, 64]
    - [110, 29.762]
  - - [3136, 256, 32, 128, 3136, 3136, 3136, 128]
    - [90, 43.651]
  - - [784, 512, 32, 256, 784, 784, 784, 256]
    - [93, 47.711]
  - - [3136, 128, 32, 256, 3136, 3136, 3136, 256]
    - [133, 45.123]
  - - [3136, 256, 32, 256, 3136, 3136, 3136, 256]
    - [118, 55.851]
  - - [784, 256, 32, 512, 784, 784, 784, 512]
    - [90, 49.004]
  - - [784, 512, 32, 512, 784, 784, 784, 512]
    - [93, 55.851]
  - - [3136, 64, 64, 64, 3136, 3136, 3136, 64]
    - [89, 18.996]
  - - [3136, 64, 64, 256, 3136, 3136, 3136, 256]
    - [91, 30.2]
  - - [784, 512, 64, 128, 784, 784, 784, 128]
    - [133, 38.807]
  - - [784, 128, 64, 512, 784, 784, 784, 512]
    - [90, 43.222]
  - - [64, 192, 64, 1280, 64, 64, 64, 1280]
    - [48, 24.988]
  - - [64, 320, 64, 1280, 64, 64, 64, 1280]
    - [53, 27.024]
  - - [64, 384, 64, 1280, 64, 64, 64, 1280]
    - [18, 31.56]
  - - [64, 448, 64, 1280, 64, 64, 64, 1280]
    - [33, 30.403]
  - - [64, 192, 64, 2048, 64, 64, 64, 2048]
    - [1, 24.43]
  - - [64, 320, 64, 2048, 64, 64, 64, 2048]
    - [20, 27.071]
  - - [64, 384, 64, 2048, 64, 64, 64, 2048]
    - [44, 30.45]
  - - [64, 448, 64, 2048, 64, 64, 64, 2048]
    - [1, 30.53]
  - - [64, 192, 32, 1280, 64, 64, 64, 1280]
    - [37, 21.028]
  - - [64, 320, 32, 1280, 64, 64, 64, 1280]
    - [86, 25.824]
  - - [64, 384, 32, 1280, 64, 64, 64, 1280]
    - [20, 28.375]
  - - [64, 448, 32, 1280, 64, 64, 64, 1280]
    - [63, 29.387]
  - - [64, 192, 32, 2048, 64, 64, 64, 2048]
    - [14, 21.411]
  - - [64, 320, 32, 2048, 64, 64, 64, 2048]
    - [74, 26.897]
  - - [64, 384, 32, 2048, 64, 64, 64, 2048]
    - [86, 29.848]
  - - [64, 448, 32, 2048, 64, 64, 64, 2048]
    - [1, 29.604]
  - - [1024, 10224, 1, 1024, 1024, 1024, 1024, 1024]
    - [140, 67.836]
  - - [1024, 10192, 1, 1024, 1024, 1024, 1024, 1024]
    - [140, 69.746]
  - - [1024, 10208, 1, 1024, 1024, 1024, 1024, 1024]
    - [140, 69.037]
  - - [1024, 10224, 1, 4096, 1024, 1024, 1024, 4096]
    - [113, 78.597]
  - - [1024, 10224, 1, 3072, 1024, 1024, 1024, 3072]
    - [113, 77.256]
  - - [4096, 10224, 1, 1024, 4096, 4096, 4096, 1024]
    - [113, 77.444]
  - - [1024, 10240, 1, 3072, 1024, 1024, 1024, 3072]
    - [113, 78.362]
  - - [1024, 10192, 1, 3072, 1024, 1024, 1024, 3072]
    - [140, 77.813]
  - - [4096, 10192, 1, 1024, 4096, 4096, 4096, 1024]
    - [93, 77.727]
  - - [1024, 10192, 1, 4096, 1024, 1024, 1024, 4096]
    - [140, 79.017]
  - - [1024, 10200, 1, 3072, 1024, 1024, 1024, 3072]
    - [113, 77.833]
  - - [1024, 10184, 1, 1024, 1024, 1024, 1024, 1024]
    - [140, 69.497]
  - - [4096, 10208, 1, 1024, 4096, 4096, 4096, 1024]
    - [93, 77.864]
  - - [1024, 10208, 1, 3072, 1024, 1024, 1024, 3072]
    - [140, 78.28]
  - - [1024, 10208, 1, 4096, 1024, 1024, 1024, 4096]
    - [140, 78.953]
  - - [1024, 10224, 1, 2048, 1024, 1024, 1024, 2048]
    - [140, 74.873]
  - - [1024, 10240, 1, 2048, 1024, 1024, 1024, 2048]
    - [140, 76.736]
  - - [1024, 10120, 1, 1024, 1024, 1024, 1024, 1024]
    - [140, 70.733]
  - - [1024, 10192, 1, 2048, 1024, 1024, 1024, 2048]
    - [140, 76.202]
  - - [64, 24, 6816, 24, 436224, 436224, 1308672, 24]
    - [107, 3.552]
  - - [64, 24, 6816, 24, 1308672, 1308672, 1308672, 24]
    - [89, 3.478]
  - - [1024, 10152, 1, 1024, 1024, 1024, 1024, 1024]
    - [140, 69.764]
  - - [1024, 10080, 1, 3072, 1024, 1024, 1024, 3072]
    - [113, 77.178]
  - - [64, 26, 6272, 26, 1204224, 1204224, 1204224, 26]
    - [89, 3.83]
  - - [64, 26, 6272, 26, 401408, 401408, 1204224, 26]
    - [89, 3.962]
  - - [100352, 512, 1, 256, 100352, 100352, 100352, 256]
    - [123, 68.311]
  - - [12544, 2048, 1, 1024, 12544, 12544, 12544, 1024]
    - [113, 80.904]
  - - [12544, 64, 1, 147, 12544, 12544, 12544, 147]
    - [26, 9.688]
  - - [200704, 512, 1, 256, 200704, 200704, 200704, 256]
    - [123, 70.14]
  - - [25088, 1024, 1, 512, 25088, 25088, 25088, 512]
    - [123, 75.287]
  - - [3136, 64, 1, 576, 3136, 3136, 3136, 576]
    - [84, 9.659]
  - - [50176, 1024, 1, 512, 50176, 50176, 50176, 512]
    - [123, 78.48]
  - - [6272, 2048, 1, 1024, 6272, 6272, 6272, 1024]
    - [90, 69.506]
  - - [784, 128, 1, 1152, 784, 784, 784, 1152]
    - [22, 6.327]
  - - [3136, 128, 128, 256, 3136, 3136, 3136, 256]
    - [133, 48.178]
  - - [3136, 128, 256, 256, 3136, 3136, 3136, 256]
    - [108, 48.75]
  - - [3136, 256, 128, 64, 3136, 3136, 3136, 64]
    - [98, 33.072]
  - - [3136, 256, 256, 64, 3136, 3136, 3136, 64]
    - [110, 33.596]
  - - [3136, 64, 128, 256, 3136, 3136, 3136, 256]
    - [136, 31.195]
  - - [3136, 64, 256, 256, 3136, 3136, 3136, 256]
    - [111, 31.701]
  - - [3136, 64, 128, 64, 3136, 3136, 3136, 64]
    - [98, 20.682]
  - - [3136, 64, 256, 64, 3136, 3136, 3136, 64]
    - [98, 21.95]
  - - [784, 128, 128, 512, 784, 784, 784, 512]
    - [108, 47.601]
  - - [784, 128, 256, 512, 784, 784, 784, 512]
    - [90, 48.944]
  - - [784, 256, 128, 512, 784, 784, 784, 512]
    - [140, 59.18]
  - - [784, 256, 256, 512, 784, 784, 784, 512]
    - [93, 63.996]
  - - [784, 512, 128, 128, 784, 784, 784, 128]
    - [100, 41.983]
  - - [784, 512, 256, 128, 784, 784, 784, 128]
    - [100, 44.216]
  - - [128, 128, 2048, 64, 128, 128, 128, 64]
    - [102, 21.633]
  - - [64, 128, 2048, 128, 64, 64, 64, 128]
    - [126, 18.626]
  - - [1024, 2560, 1, 30528, 1024, 1024, 1024, 30528]
    - [177, 87.503]
  - - [1024, 128, 1, 1024, 1024, 1024, 1024, 1024]
    - [73, 8.0]
  - - [1024, 128, 1, 2, 1024, 1024, 1024, 2]
    - [9, 0.055]
  - - [128, 128, 1536, 64, 128, 128, 128, 64]
    - [90, 21.141]
  - - [64, 128, 1536, 128, 64, 64, 64, 128]
    - [143, 18.248]
  - - [1024, 12288, 1, 4096, 1024, 1024, 1024, 4096]
    - [72, 76.756]
  - - [1024, 12288, 1, 1024, 1024, 1024, 1024, 1024]
    - [142, 67.402]
  - - [4096, 12288, 1, 1024, 4096, 4096, 4096, 1024]
    - [93, 80.242]
  - - [1024, 1920, 1, 30528, 1024, 1024, 1024, 30528]
    - [165, 74.555]
  - - [1024, 96, 1, 1024, 1024, 1024, 1024, 1024]
    - [66, 6.365]
  - - [1024, 96, 1, 2, 1024, 1024, 1024, 2]
    - [9, 0.028]
  - - [128, 128, 192, 64, 128, 128, 128, 64]
    - [102, 16.822]
  - - [64, 128, 192, 128, 64, 64, 64, 128]
    - [17, 15.073]
  - - [768, 2048, 1, 2, 768, 768, 768, 2]
    - [11, 0.415]
  - - [3072, 2048, 1, 768, 3072, 3072, 3072, 768]
    - [130, 60.453]
  - - [768, 2048, 1, 3072, 768, 768, 768, 3072]
    - [92, 50.524]
  - - [768, 2048, 1, 768, 768, 768, 768, 768]
    - [6, 39.116]
  - - [384, 384, 144, 64, 384, 384, 384, 64]
    - [136, 29.303]
  - - [64, 384, 144, 384, 64, 64, 64, 384]
    - [18, 26.774]
  - - [768, 4608, 1, 2, 768, 768, 768, 2]
    - [108, 0.649]
  - - [3072, 4608, 1, 768, 3072, 3072, 3072, 768]
    - [93, 72.725]
  - - [768, 4608, 1, 3072, 768, 768, 768, 3072]
    - [141, 78.384]
  - - [768, 4608, 1, 768, 768, 768, 768, 768]
    - [35, 64.394]
  - - [512, 512, 48, 64, 512, 512, 512, 64]
    - [133, 27.208]
  - - [64, 512, 48, 512, 64, 64, 64, 512]
    - [28, 28.765]
  - - [128, 128, 256, 64, 128, 128, 128, 64]
    - [90, 15.799]
  - - [64, 128, 256, 128, 64, 64, 64, 128]
    - [125, 14.438]
  - - [384, 384, 192, 64, 384, 384, 384, 64]
    - [121, 30.012]
  - - [64, 384, 192, 384, 64, 64, 64, 384]
    - [67, 25.196]
  - - [1024, 4608, 1, 2, 1024, 1024, 1024, 2]
    - [97, 0.696]
  - - [4096, 4608, 1, 1024, 4096, 4096, 4096, 1024]
    - [119, 74.742]
  - - [1024, 4608, 1, 4096, 1024, 1024, 1024, 4096]
    - [59, 81.292]
  - - [1024, 4608, 1, 1024, 1024, 1024, 1024, 1024]
    - [30, 63.421]
  - - [8192, 1024, 1, 1024, 8192, 8192, 8192, 1024]
    - [8, 63.549]
  - - [8192, 4096, 1, 1024, 8192, 8192, 8192, 1024]
    - [123, 81.613]
  - - [479, 32768, 1, 1024, 479, 479, 479, 1024]
    - [226, 62.569]
  - - [74, 512, 1, 2048, 74, 74, 74, 2048]
    - [230, 4.874]
  - - [67, 512, 1, 2048, 67, 67, 67, 2048]
    - [234, 4.413]
  - - [74, 960, 1, 2048, 74, 74, 74, 2048]
    - [229, 7.321]
  - - [100, 512, 1, 2048, 100, 100, 100, 2048]
    - [231, 5.983]
  - - [257, 1024, 1, 4096, 257, 257, 257, 4096]
    - [232, 22.927]
  - - [196, 1024, 64, 512, 196, 196, 196, 512]
    - [220, 43.101]
  - - [196, 512, 64, 1024, 196, 196, 196, 1024]
    - [220, 44.152]
  - - [196, 1024, 64, 1024, 196, 196, 196, 1024]
    - [220, 50.887]
  - - [49, 2048, 64, 1024, 49, 49, 49, 1024]
    - [217, 25.06]
  - - [49, 1024, 64, 2048, 49, 49, 49, 2048]
    - [205, 24.366]
  - - [196, 1024, 32, 512, 196, 196, 196, 512]
    - [220, 38.181]
  - - [196, 512, 32, 1024, 196, 196, 196, 1024]
    - [220, 36.247]
  - - [196, 1024, 32, 1024, 196, 196, 196, 1024]
    - [204, 45.727]
  - - [49, 2048, 32, 1024, 49, 49, 49, 1024]
    - [214, 22.479]
  - - [49, 1024, 32, 2048, 49, 49, 49, 2048]
    - [228, 21.505]
  - - [196, 1024, 64, 256, 196, 196, 196, 256]
    - [223, 33.633]
  - - [196, 256, 64, 1024, 196, 196, 196, 1024]
    - [220, 35.742]
  - - [49, 2048, 64, 512, 49, 49, 49, 512]
    - [207, 21.581]
  - - [49, 512, 64, 2048, 49, 49, 49, 2048]
    - [200, 20.448]
  - - [1225, 32, 64, 192, 1225, 1225, 1225, 192]
    - [202, 13.914]
  - - [1225, 48, 64, 192, 1225, 1225, 1225, 192]
    - [216, 15.127]
  - - [1225, 64, 64, 192, 1225, 1225, 1225, 192]
    - [212, 22.941]
  - - [1225, 48, 64, 256, 1225, 1225, 1225, 256]
    - [216, 17.372]
  - - [1225, 64, 64, 256, 1225, 1225, 1225, 256]
    - [199, 25.523]
  - - [1225, 48, 64, 288, 1225, 1225, 1225, 288]
    - [221, 17.983]
  - - [1225, 64, 64, 288, 1225, 1225, 1225, 288]
    - [198, 27.211]
  - - [5329, 80, 64, 64, 5329, 5329, 5329, 64]
    - [227, 12.59]
  - - [289, 128, 64, 768, 289, 289, 289, 768]
    - [215, 31.746]
  - - [289, 160, 64, 768, 289, 289, 289, 768]
    - [225, 34.529]
  - - [289, 192, 64, 768, 289, 289, 289, 768]
    - [211, 37.48]
  - - [1225, 32, 32, 192, 1225, 1225, 1225, 192]
    - [209, 11.989]
  - - [1225, 48, 32, 192, 1225, 1225, 1225, 192]
    - [218, 13.258]
  - - [1225, 64, 32, 192, 1225, 1225, 1225, 192]
    - [201, 19.771]
  - - [1225, 48, 32, 256, 1225, 1225, 1225, 256]
    - [216, 15.026]
  - - [1225, 64, 32, 256, 1225, 1225, 1225, 256]
    - [197, 21.239]
  - - [1225, 48, 32, 288, 1225, 1225, 1225, 288]
    - [224, 16.151]
  - - [1225, 64, 32, 288, 1225, 1225, 1225, 288]
    - [210, 23.0]
  - - [5329, 80, 32, 64, 5329, 5329, 5329, 64]
    - [227, 12.195]
  - - [289, 128, 32, 768, 289, 289, 289, 768]
    - [206, 27.269]
  - - [289, 160, 32, 768, 289, 289, 289, 768]
    - [203, 28.061]
  - - [289, 192, 32, 768, 289, 289, 289, 768]
    - [211, 34.869]
  - - [196, 256, 1, 2304, 196, 196, 196, 2304]
    - [233, 6.891]
  - - [49, 512, 1, 4608, 49, 49, 49, 4608]
    - [235, 6.01]
  - - [196, 1024, 128, 256, 196, 196, 196, 256]
    - [223, 37.37]
  - - [196, 1024, 256, 256, 196, 196, 196, 256]
    - [223, 38.407]
  - - [196, 256, 128, 1024, 196, 196, 196, 1024]
    - [220, 42.652]
  - - [196, 256, 256, 1024, 196, 196, 196, 1024]
    - [223, 47.823]
  - - [196, 512, 128, 1024, 196, 196, 196, 1024]
    - [220, 49.635]
  - - [196, 512, 256, 1024, 196, 196, 196, 1024]
    - [222, 54.251]
  - - [49, 2048, 128, 512, 49, 49, 49, 512]
    - [219, 22.974]
  - - [49, 2048, 256, 512, 49, 49, 49, 512]
    - [219, 23.322]
  - - [49, 512, 128, 2048, 49, 49, 49, 2048]
    - [213, 23.856]
  - - [49, 512, 256, 2048, 49, 49, 49, 2048]
    - [208, 26.035]
- null
