TRAIN_3.10/logic/arcturus_Cijk_Ailk_Bjlk_HBH.yaml
- {MinimumRequiredVersion: 4.23.0}
- arcturus
- gfx908
- [Device 7380, Device 7388, Device 738c, Device 7390]
    SolutionIndex: 0
    SolutionNameMin: Cijk_Ailk_Bjlk_HBH_MT64x64x16_MI32x32x8x1_SE_AF0EM8_GRVW2_GSU1_SU0_SUS256_SRVW4_VAW2_WG64_4_1_WGM1
    SolutionIndex: 1
    SolutionNameMin: Cijk_Ailk_Bjlk_HBH_MT64x128x16_MI32x32x8x1_SE_AF0EM8_GRVW2_GSU1_SU0_SUS256_SRVW4_VAW2_WG64_4_1_WGM1
    SolutionIndex: 2
    SolutionNameMin: Cijk_Ailk_Bjlk_HBH_MT128x64x16_MI32x32x8x1_SE_AF0EM8_GRVW2_GSU1_SU0_SUS256_SRVW4_VAW2_WG64_4_1_WGM1
    SolutionIndex: 3
    SolutionNameMin: Cijk_Ailk_Bjlk_HBH_MT32x32x16_MI16x16x16x1_SE_AF0EM8_GRVW2_GSU1_SU0_SUS256_SRVW4_VAW2_WG32_8_1_WGM1
    SolutionIndex: 4
    SolutionNameMin: Cijk_Ailk_Bjlk_HBH_MT64x32x16_MI16x16x16x1_SE_AF0EM8_GRVW2_GSU1_SU0_SUS256_SRVW4_VAW2_WG32_8_1_WGM1
    SolutionIndex: 5
    SolutionNameMin: Cijk_Ailk_Bjlk_HBH_MT128x128x32_MI32x32x8x1_SE_AF0EM8_GRVW2_GSU1_SU0_SUS256_SRVW4_VAW2_WG64_4_1_WGM1
    SolutionIndex: 6
    SolutionNameMin: Cijk_Ailk_Bjlk_HBH_MT256x256x32_MI32x32x8x1_SE_AF0EM8_GRVW2_GSU1_SU0_SUS256_SRVW4_VAW2_WG64_4_1_WGM1
    SolutionIndex: 7
    SolutionNameMin: Cijk_Ailk_Bjlk_HBH_MT32x32x32_MI16x16x16x1_SE_AF0EM8_GRVW2_GSU1_SU0_SUS256_SRVW4_VAW2_WG32_8_1_WGM1
    SolutionIndex: 8
    SolutionNameMin: Cijk_Ailk_Bjlk_HBH_MT144x256x32_MI16x16x16x1_SE_AF0EM8_GRVW2_GSU1_SU0_SUS256_SRVW0_VAW2_WG16_16_1_WGM1
    SolutionIndex: 9
    SolutionNameMin: Cijk_Ailk_Bjlk_HBH_MT256x256x16_MI32x32x8x1_SE_AF0EM8_GRVW4_GSU1_SU0_SUS256_SRVW4_VAW2_WG64_4_1_WGM1
    SolutionIndex: 10
    SolutionNameMin: Cijk_Ailk_Bjlk_HBH_MT32x32x16_MI16x16x16x1_SE_AF0EM8_GRVW4_GSU1_SU0_SUS256_SRVW4_VAW2_WG32_8_1_WGM1
    SolutionIndex: 11
    SolutionNameMin: Cijk_Ailk_Bjlk_HBH_MT64x32x16_MI16x16x16x1_SE_AF0EM8_GRVW4_GSU1_SU0_SUS256_SRVW4_VAW2_WG32_8_1_WGM1
    SolutionIndex: 12
    SolutionNameMin: Cijk_Ailk_Bjlk_HBH_MT64x128x32_MI32x32x8x1_SE_AF0EM8_GRVW4_GSU1_SU0_SUS256_SRVW4_VAW2_WG64_4_1_WGM1
    SolutionIndex: 13
    SolutionNameMin: Cijk_Ailk_Bjlk_HBH_MT32x32x32_MI16x16x16x1_SE_AF0EM8_GRVW4_GSU1_SU0_SUS256_SRVW4_VAW2_WG32_8_1_WGM1
    SolutionIndex: 14
    SolutionNameMin: Cijk_Ailk_Bjlk_HBH_MT128x160x32_MI32x32x8x1_SE_AF0EM8_GRVW4_GSU1_SU0_SUS256_SRVW4_VAW2_WG128_2_1_WGM1
    SolutionIndex: 15
    SolutionNameMin: Cijk_Ailk_Bjlk_HBH_MT160x256x32_MI32x32x8x1_SE_AF0EM8_GRVW4_GSU1_SU0_SUS256_SRVW0_VAW2_WG32_8_1_WGM1
    SolutionIndex: 16
    SolutionNameMin: Cijk_Ailk_Bjlk_HBH_MT64x64x16_MI32x32x8x1_SE_AF0EM8_GRVW8_GSU1_SU0_SUS256_SRVW4_VAW2_WG64_4_1_WGM1
    SolutionIndex: 17
    SolutionNameMin: Cijk_Ailk_Bjlk_HBH_MT64x128x16_MI32x32x8x1_SE_AF0EM8_GRVW8_GSU1_SU0_SUS256_SRVW4_VAW2_WG64_4_1_WGM1
    SolutionIndex: 18
    SolutionNameMin: Cijk_Ailk_Bjlk_HBH_MT64x256x16_MI32x32x8x1_SE_AF0EM8_GRVW8_GSU1_SU0_SUS256_SRVW4_VAW2_WG64_4_1_WGM1
    SolutionIndex: 19
    SolutionNameMin: Cijk_Ailk_Bjlk_HBH_MT128x64x16_MI32x32x8x1_SE_AF0EM8_GRVW8_GSU1_SU0_SUS256_SRVW4_VAW2_WG64_4_1_WGM1
    SolutionIndex: 20
    SolutionNameMin: Cijk_Ailk_Bjlk_HBH_MT128x128x16_MI32x32x8x1_SE_AF0EM8_GRVW8_GSU1_SU0_SUS256_SRVW4_VAW2_WG64_4_1_WGM1
    SolutionIndex: 21
    SolutionNameMin: Cijk_Ailk_Bjlk_HBH_MT128x256x16_MI32x32x8x1_SE_AF0EM8_GRVW8_GSU1_SU0_SUS256_SRVW4_VAW2_WG64_4_1_WGM1
    SolutionIndex: 22
    SolutionNameMin: Cijk_Ailk_Bjlk_HBH_MT32x32x16_MI16x16x16x1_SE_AF0EM8_GRVW8_GSU1_SU0_SUS256_SRVW4_VAW2_WG32_8_1_WGM1
    SolutionIndex: 23
    SolutionNameMin: Cijk_Ailk_Bjlk_HBH_MT64x64x32_MI32x32x8x1_SE_AF0EM8_GRVW8_GSU1_SU0_SUS256_SRVW4_VAW2_WG64_4_1_WGM1
    SolutionIndex: 24
    SolutionNameMin: Cijk_Ailk_Bjlk_HBH_MT64x128x32_MI32x32x8x1_SE_AF0EM8_GRVW8_GSU1_SU0_SUS256_SRVW4_VAW2_WG64_4_1_WGM1
    SolutionIndex: 25
    SolutionNameMin: Cijk_Ailk_Bjlk_HBH_MT128x64x32_MI32x32x8x1_SE_AF0EM8_GRVW8_GSU1_SU0_SUS256_SRVW4_VAW2_WG64_4_1_WGM1
    SolutionIndex: 26
    SolutionNameMin: Cijk_Ailk_Bjlk_HBH_MT128x128x32_MI32x32x8x1_SE_AF0EM8_GRVW8_GSU1_SU0_SUS256_SRVW4_VAW2_WG64_4_1_WGM1
    SolutionIndex: 27
    SolutionNameMin: Cijk_Ailk_Bjlk_HBH_MT128x256x32_MI32x32x8x1_SE_AF0EM8_GRVW8_GSU1_SU0_SUS256_SRVW4_VAW2_WG64_4_1_WGM1
    SolutionIndex: 28
    SolutionNameMin: Cijk_Ailk_Bjlk_HBH_MT256x64x32_MI32x32x8x1_SE_AF0EM8_GRVW8_GSU1_SU0_SUS256_SRVW4_VAW2_WG64_4_1_WGM1
    SolutionIndex: 29
    SolutionNameMin: Cijk_Ailk_Bjlk_HBH_MT256x128x32_MI32x32x8x1_SE_AF0EM8_GRVW8_GSU1_SU0_SUS256_SRVW4_VAW2_WG64_4_1_WGM1
    SolutionIndex: 30
    SolutionNameMin: Cijk_Ailk_Bjlk_HBH_MT256x256x32_MI32x32x8x1_SE_AF0EM8_GRVW8_GSU1_SU0_SUS256_SRVW4_VAW2_WG64_4_1_WGM1
    SolutionIndex: 31
    SolutionNameMin: Cijk_Ailk_Bjlk_HBH_MT32x32x32_MI16x16x16x1_SE_AF0EM8_GRVW8_GSU1_SU0_SUS256_SRVW4_VAW2_WG32_8_1_WGM1
    SolutionIndex: 32
    SolutionNameMin: Cijk_Ailk_Bjlk_HBH_MT64x64x64_MI32x32x8x1_SE_AF0EM8_GRVW8_GSU1_SU0_SUS256_SRVW4_VAW2_WG64_4_1_WGM1
    SolutionIndex: 33
    SolutionNameMin: Cijk_Ailk_Bjlk_HBH_MT64x32x64_MI16x16x16x1_SE_AF0EM8_GRVW8_GSU1_SU0_SUS256_SRVW4_VAW2_WG32_8_1_WGM1
    SolutionIndex: 34
    SolutionNameMin: Cijk_Ailk_Bjlk_HBH_MT128x96x64_MI32x32x8x1_SE_AF0EM8_GRVW8_GSU1_SU0_SUS256_SRVW4_VAW2_WG128_2_1_WGM1
    SolutionIndex: 35
    SolutionNameMin: Cijk_Ailk_Bjlk_HBH_MT64x64x16_MI32x32x8x1_SE_AF0EM8_GRVW2_GSU1_SU32_SUS128_SRVW4_VAW2_WG64_4_1_WGM1
    SolutionIndex: 36
    SolutionNameMin: Cijk_Ailk_Bjlk_HBH_MT64x128x16_MI32x32x8x1_SE_AF0EM8_GRVW2_GSU1_SU32_SUS128_SRVW4_VAW2_WG64_4_1_WGM1
    SolutionIndex: 37
    SolutionNameMin: Cijk_Ailk_Bjlk_HBH_MT64x32x16_MI16x16x16x1_SE_AF0EM8_GRVW2_GSU1_SU32_SUS128_SRVW4_VAW2_WG32_8_1_WGM1
    SolutionIndex: 38
    SolutionNameMin: Cijk_Ailk_Bjlk_HBH_MT64x128x16_MI32x32x8x1_SE_AF0EM8_GRVW4_GSU1_SU32_SUS128_SRVW4_VAW2_WG64_4_1_WGM1
    SolutionIndex: 39
    SolutionNameMin: Cijk_Ailk_Bjlk_HBH_MT128x256x32_MI32x32x8x1_SE_AF0EM8_GRVW4_GSU1_SU32_SUS128_SRVW4_VAW2_WG64_4_1_WGM1
    SolutionIndex: 40
    SolutionNameMin: Cijk_Ailk_Bjlk_HBH_MT128x288x32_MI32x32x8x1_SE_AF0EM8_GRVW4_GSU1_SU32_SUS128_SRVW4_VAW2_WG128_2_1_WGM1
    SolutionIndex: 41
    SolutionNameMin: Cijk_Ailk_Bjlk_HBH_MT160x256x32_MI32x32x8x1_SE_AF0EM8_GRVW4_GSU1_SU32_SUS128_SRVW0_VAW2_WG32_8_1_WGM1
    SolutionIndex: 42
    SolutionNameMin: Cijk_Ailk_Bjlk_HBH_MT32x32x64_MI16x16x16x1_SE_AF0EM8_GRVW4_GSU1_SU32_SUS128_SRVW4_VAW2_WG32_8_1_WGM1
    SolutionIndex: 43
    SolutionNameMin: Cijk_Ailk_Bjlk_HBH_MT128x64x16_MI32x32x8x1_SE_AF0EM8_GRVW8_GSU1_SU32_SUS128_SRVW4_VAW2_WG64_4_1_WGM1
    SolutionIndex: 44
    SolutionNameMin: Cijk_Ailk_Bjlk_HBH_MT128x256x16_MI32x32x8x1_SE_AF0EM8_GRVW8_GSU1_SU32_SUS128_SRVW4_VAW2_WG64_4_1_WGM1
    SolutionIndex: 45
    SolutionNameMin: Cijk_Ailk_Bjlk_HBH_MT64x64x32_MI32x32x8x1_SE_AF0EM8_GRVW8_GSU1_SU32_SUS128_SRVW4_VAW2_WG64_4_1_WGM1
    SolutionIndex: 46
    SolutionNameMin: Cijk_Ailk_Bjlk_HBH_MT64x128x32_MI32x32x8x1_SE_AF0EM8_GRVW8_GSU1_SU32_SUS128_SRVW4_VAW2_WG64_4_1_WGM1
    SolutionIndex: 47
    SolutionNameMin: Cijk_Ailk_Bjlk_HBH_MT128x128x32_MI32x32x8x1_SE_AF0EM8_GRVW8_GSU1_SU32_SUS128_SRVW4_VAW2_WG64_4_1_WGM1
    SolutionIndex: 48
    SolutionNameMin: Cijk_Ailk_Bjlk_HBH_MT256x256x32_MI32x32x8x1_SE_AF0EM8_GRVW8_GSU1_SU32_SUS128_SRVW4_VAW2_WG64_4_1_WGM1
    SolutionIndex: 49
    SolutionNameMin: Cijk_Ailk_Bjlk_HBH_MT32x32x64_MI16x16x16x1_SE_AF0EM8_GRVW8_GSU1_SU32_SUS128_SRVW4_VAW2_WG32_8_1_WGM1
    SolutionIndex: 50
    SolutionNameMin: Cijk_Ailk_Bjlk_HBH_MT32x64x64_MI16x16x16x1_SE_AF0EM8_GRVW8_GSU1_SU32_SUS128_SRVW4_VAW2_WG32_8_1_WGM1
    SolutionIndex: 51
    SolutionNameMin: Cijk_Ailk_Bjlk_HBH_MT64x64x16_MI32x32x8x1_SE_AF0EM8_GRVW2_GSU1_SU32_SUS256_SRVW4_VAW2_WG64_4_1_WGM1
    SolutionIndex: 52
    SolutionNameMin: Cijk_Ailk_Bjlk_HBH_MT64x128x16_MI32x32x8x1_SE_AF0EM8_GRVW2_GSU1_SU32_SUS256_SRVW4_VAW2_WG64_4_1_WGM1
    SolutionIndex: 53
    SolutionNameMin: Cijk_Ailk_Bjlk_HBH_MT128x64x16_MI32x32x8x1_SE_AF0EM8_GRVW2_GSU1_SU32_SUS256_SRVW4_VAW2_WG64_4_1_WGM1
    SolutionIndex: 54
    SolutionNameMin: Cijk_Ailk_Bjlk_HBH_MT128x128x16_MI32x32x8x1_SE_AF0EM8_GRVW2_GSU1_SU32_SUS256_SRVW4_VAW2_WG64_4_1_WGM1
    SolutionIndex: 55
    SolutionNameMin: Cijk_Ailk_Bjlk_HBH_MT64x32x16_MI16x16x16x1_SE_AF0EM8_GRVW2_GSU1_SU32_SUS256_SRVW4_VAW2_WG32_8_1_WGM1
    SolutionIndex: 56
    SolutionNameMin: Cijk_Ailk_Bjlk_HBH_MT64x64x32_MI32x32x8x1_SE_AF0EM8_GRVW2_GSU1_SU32_SUS256_SRVW4_VAW2_WG64_4_1_WGM1
    SolutionIndex: 57
    SolutionNameMin: Cijk_Ailk_Bjlk_HBH_MT64x256x16_MI32x32x8x1_SE_AF0EM8_GRVW4_GSU1_SU32_SUS256_SRVW4_VAW2_WG64_4_1_WGM1
    SolutionIndex: 58
    SolutionNameMin: Cijk_Ailk_Bjlk_HBH_MT64x64x32_MI32x32x8x1_SE_AF0EM8_GRVW4_GSU1_SU32_SUS256_SRVW4_VAW2_WG64_4_1_WGM1
    SolutionIndex: 59
    SolutionNameMin: Cijk_Ailk_Bjlk_HBH_MT128x128x64_MI32x32x8x1_SE_AF0EM8_GRVW4_GSU1_SU32_SUS256_SRVW4_VAW2_WG64_4_1_WGM1
    SolutionIndex: 60
    SolutionNameMin: Cijk_Ailk_Bjlk_HBH_MT128x128x16_MI32x32x8x1_SE_AF0EM8_GRVW8_GSU1_SU32_SUS256_SRVW4_VAW2_WG64_4_1_WGM1
    SolutionIndex: 61
    SolutionNameMin: Cijk_Ailk_Bjlk_HBH_MT64x64x32_MI32x32x8x1_SE_AF0EM8_GRVW8_GSU1_SU32_SUS256_SRVW4_VAW2_WG64_4_1_WGM1
    SolutionIndex: 62
    SolutionNameMin: Cijk_Ailk_Bjlk_HBH_MT128x128x32_MI32x32x8x1_SE_AF0EM8_GRVW8_GSU1_SU32_SUS256_SRVW4_VAW2_WG64_4_1_WGM1
    SolutionIndex: 63
    SolutionNameMin: Cijk_Ailk_Bjlk_HBH_MT128x256x32_MI32x32x8x1_SE_AF0EM8_GRVW8_GSU1_SU32_SUS256_SRVW4_VAW2_WG64_4_1_WGM1
    SolutionIndex: 64
    SolutionNameMin: Cijk_Ailk_Bjlk_HBH_MT256x256x32_MI32x32x8x1_SE_AF0EM8_GRVW8_GSU1_SU32_SUS256_SRVW4_VAW2_WG64_4_1_WGM1
    SolutionIndex: 65
    SolutionNameMin: Cijk_Ailk_Bjlk_HBH_MT64x64x64_MI32x32x8x1_SE_AF0EM8_GRVW8_GSU1_SU32_SUS256_SRVW4_VAW2_WG64_4_1_WGM1
    SolutionIndex: 66
    SolutionNameMin: Cijk_Ailk_Bjlk_HBH_MT128x96x64_MI32x32x8x1_SE_AF0EM8_GRVW8_GSU1_SU32_SUS256_SRVW4_VAW2_WG128_2_1_WGM1
    SolutionIndex: 67
    SolutionNameMin: Cijk_Ailk_Bjlk_HBH_MT64x64x16_MI32x32x8x1_SE_AF0EM8_GRVW2_GSU1_SU0_SUS256_SRVW4_VAW2_WG64_4_1_WGM2
    SolutionIndex: 68
    SolutionNameMin: Cijk_Ailk_Bjlk_HBH_MT64x128x16_MI32x32x8x1_SE_AF0EM8_GRVW2_GSU1_SU0_SUS256_SRVW4_VAW2_WG64_4_1_WGM2
    SolutionIndex: 69
    SolutionNameMin: Cijk_Ailk_Bjlk_HBH_MT128x96x16_MI32x32x8x1_SE_AF0EM8_GRVW2_GSU1_SU0_SUS256_SRVW4_VAW2_WG128_2_1_WGM2
    SolutionIndex: 70
    SolutionNameMin: Cijk_Ailk_Bjlk_HBH_MT128x64x32_MI32x32x8x1_SE_AF0EM8_GRVW2_GSU1_SU0_SUS256_SRVW4_VAW2_WG64_4_1_WGM2
    SolutionIndex: 71
    SolutionNameMin: Cijk_Ailk_Bjlk_HBH_MT64x64x16_MI32x32x8x1_SE_AF0EM8_GRVW4_GSU1_SU0_SUS256_SRVW4_VAW2_WG64_4_1_WGM2
    SolutionIndex: 72
    SolutionNameMin: Cijk_Ailk_Bjlk_HBH_MT64x128x16_MI32x32x8x1_SE_AF0EM8_GRVW4_GSU1_SU0_SUS256_SRVW4_VAW2_WG64_4_1_WGM2
    SolutionIndex: 73
    SolutionNameMin: Cijk_Ailk_Bjlk_HBH_MT128x64x16_MI32x32x8x1_SE_AF0EM8_GRVW4_GSU1_SU0_SUS256_SRVW4_VAW2_WG64_4_1_WGM2
    SolutionIndex: 74
    SolutionNameMin: Cijk_Ailk_Bjlk_HBH_MT128x256x16_MI32x32x8x1_SE_AF0EM8_GRVW4_GSU1_SU0_SUS256_SRVW4_VAW2_WG64_4_1_WGM2
    SolutionIndex: 75
    SolutionNameMin: Cijk_Ailk_Bjlk_HBH_MT64x64x32_MI32x32x8x1_SE_AF0EM8_GRVW4_GSU1_SU0_SUS256_SRVW4_VAW2_WG64_4_1_WGM2
    SolutionIndex: 76
    SolutionNameMin: Cijk_Ailk_Bjlk_HBH_MT128x64x32_MI32x32x8x1_SE_AF0EM8_GRVW4_GSU1_SU0_SUS256_SRVW4_VAW2_WG64_4_1_WGM2
    SolutionIndex: 77
    SolutionNameMin: Cijk_Ailk_Bjlk_HBH_MT128x288x32_MI32x32x8x1_SE_AF0EM8_GRVW4_GSU1_SU0_SUS256_SRVW4_VAW2_WG128_2_1_WGM2
    SolutionIndex: 78
    SolutionNameMin: Cijk_Ailk_Bjlk_HBH_MT256x160x32_MI32x32x8x1_SE_AF0EM8_GRVW4_GSU1_SU0_SUS256_SRVW4_VAW2_WG128_2_1_WGM2
    SolutionIndex: 79
    SolutionNameMin: Cijk_Ailk_Bjlk_HBH_MT64x128x16_MI32x32x8x1_SE_AF0EM8_GRVW8_GSU1_SU0_SUS256_SRVW4_VAW2_WG64_4_1_WGM2
    SolutionIndex: 80
    SolutionNameMin: Cijk_Ailk_Bjlk_HBH_MT64x256x16_MI32x32x8x1_SE_AF0EM8_GRVW8_GSU1_SU0_SUS256_SRVW4_VAW2_WG64_4_1_WGM2
    SolutionIndex: 81
    SolutionNameMin: Cijk_Ailk_Bjlk_HBH_MT128x256x16_MI32x32x8x1_SE_AF0EM8_GRVW8_GSU1_SU0_SUS256_SRVW4_VAW2_WG64_4_1_WGM2
    SolutionIndex: 82
    SolutionNameMin: Cijk_Ailk_Bjlk_HBH_MT256x256x16_MI32x32x8x1_SE_AF0EM8_GRVW8_GSU1_SU0_SUS256_SRVW4_VAW2_WG64_4_1_WGM2
    SolutionIndex: 83
    SolutionNameMin: Cijk_Ailk_Bjlk_HBH_MT128x64x32_MI32x32x8x1_SE_AF0EM8_GRVW8_GSU1_SU0_SUS256_SRVW4_VAW2_WG64_4_1_WGM2
    SolutionIndex: 84
    SolutionNameMin: Cijk_Ailk_Bjlk_HBH_MT128x128x32_MI32x32x8x1_SE_AF0EM8_GRVW8_GSU1_SU0_SUS256_SRVW4_VAW2_WG64_4_1_WGM2
    SolutionIndex: 85
    SolutionNameMin: Cijk_Ailk_Bjlk_HBH_MT256x128x32_MI32x32x8x1_SE_AF0EM8_GRVW8_GSU1_SU0_SUS256_SRVW4_VAW2_WG64_4_1_WGM2
    SolutionIndex: 86
    SolutionNameMin: Cijk_Ailk_Bjlk_HBH_MT256x256x32_MI32x32x8x1_SE_AF0EM8_GRVW8_GSU1_SU0_SUS256_SRVW4_VAW2_WG64_4_1_WGM2
    SolutionIndex: 87
    SolutionNameMin: Cijk_Ailk_Bjlk_HBH_MT64x64x64_MI32x32x8x1_SE_AF0EM8_GRVW8_GSU1_SU0_SUS256_SRVW4_VAW2_WG64_4_1_WGM2
    SolutionIndex: 88
    SolutionNameMin: Cijk_Ailk_Bjlk_HBH_MT128x128x64_MI32x32x8x1_SE_AF0EM8_GRVW8_GSU1_SU0_SUS256_SRVW4_VAW2_WG64_4_1_WGM2
    SolutionIndex: 89
    SolutionNameMin: Cijk_Ailk_Bjlk_HBH_MT128x96x64_MI32x32x8x1_SE_AF0EM8_GRVW8_GSU1_SU0_SUS256_SRVW4_VAW2_WG128_2_1_WGM2
    SolutionIndex: 90
    SolutionNameMin: Cijk_Ailk_Bjlk_HBH_MT128x64x16_MI32x32x8x1_SE_AF0EM8_GRVW2_GSU1_SU32_SUS128_SRVW4_VAW2_WG64_4_1_WGM2
    SolutionIndex: 91
    SolutionNameMin: Cijk_Ailk_Bjlk_HBH_MT64x32x16_MI16x16x16x1_SE_AF0EM8_GRVW2_GSU1_SU32_SUS128_SRVW4_VAW2_WG32_8_1_WGM2
    SolutionIndex: 92
    SolutionNameMin: Cijk_Ailk_Bjlk_HBH_MT128x96x16_MI32x32x8x1_SE_AF0EM8_GRVW2_GSU1_SU32_SUS128_SRVW4_VAW2_WG128_2_1_WGM2
    SolutionIndex: 93
    SolutionNameMin: Cijk_Ailk_Bjlk_HBH_MT128x256x16_MI32x32x8x1_SE_AF0EM8_GRVW4_GSU1_SU32_SUS128_SRVW4_VAW2_WG64_4_1_WGM2
    SolutionIndex: 94
    SolutionNameMin: Cijk_Ailk_Bjlk_HBH_MT256x256x16_MI32x32x8x1_SE_AF0EM8_GRVW4_GSU1_SU32_SUS128_SRVW4_VAW2_WG64_4_1_WGM2
    SolutionIndex: 95
    SolutionNameMin: Cijk_Ailk_Bjlk_HBH_MT64x32x16_MI16x16x16x1_SE_AF0EM8_GRVW4_GSU1_SU32_SUS128_SRVW4_VAW2_WG32_8_1_WGM2
    SolutionIndex: 96
    SolutionNameMin: Cijk_Ailk_Bjlk_HBH_MT256x160x32_MI32x32x8x1_SE_AF0EM8_GRVW4_GSU1_SU32_SUS128_SRVW4_VAW2_WG128_2_1_WGM2
    SolutionIndex: 97
    SolutionNameMin: Cijk_Ailk_Bjlk_HBH_MT64x64x64_MI32x32x8x1_SE_AF0EM8_GRVW4_GSU1_SU32_SUS128_SRVW4_VAW2_WG64_4_1_WGM2
    SolutionIndex: 98
    SolutionNameMin: Cijk_Ailk_Bjlk_HBH_MT64x64x16_MI32x32x8x1_SE_AF0EM8_GRVW8_GSU1_SU32_SUS128_SRVW4_VAW2_WG64_4_1_WGM2
    SolutionIndex: 99
    SolutionNameMin: Cijk_Ailk_Bjlk_HBH_MT128x256x16_MI32x32x8x1_SE_AF0EM8_GRVW8_GSU1_SU32_SUS128_SRVW4_VAW2_WG64_4_1_WGM2
    SolutionIndex: 100
    SolutionNameMin: Cijk_Ailk_Bjlk_HBH_MT64x128x32_MI32x32x8x1_SE_AF0EM8_GRVW8_GSU1_SU32_SUS128_SRVW4_VAW2_WG64_4_1_WGM2
    SolutionIndex: 101
    SolutionNameMin: Cijk_Ailk_Bjlk_HBH_MT128x256x32_MI32x32x8x1_SE_AF0EM8_GRVW8_GSU1_SU32_SUS128_SRVW4_VAW2_WG64_4_1_WGM2
    SolutionIndex: 102
    SolutionNameMin: Cijk_Ailk_Bjlk_HBH_MT256x128x32_MI32x32x8x1_SE_AF0EM8_GRVW8_GSU1_SU32_SUS128_SRVW4_VAW2_WG64_4_1_WGM2
    SolutionIndex: 103
    SolutionNameMin: Cijk_Ailk_Bjlk_HBH_MT64x32x64_MI16x16x16x1_SE_AF0EM8_GRVW8_GSU1_SU32_SUS128_SRVW4_VAW2_WG32_8_1_WGM2
    SolutionIndex: 104
    SolutionNameMin: Cijk_Ailk_Bjlk_HBH_MT128x96x64_MI32x32x8x1_SE_AF0EM8_GRVW8_GSU1_SU32_SUS128_SRVW4_VAW2_WG128_2_1_WGM2
    SolutionIndex: 105
    SolutionNameMin: Cijk_Ailk_Bjlk_HBH_MT64x64x16_MI32x32x8x1_SE_AF0EM8_GRVW2_GSU1_SU32_SUS256_SRVW4_VAW2_WG64_4_1_WGM2
    SolutionIndex: 106
    SolutionNameMin: Cijk_Ailk_Bjlk_HBH_MT32x64x16_MI16x16x16x1_SE_AF0EM8_GRVW2_GSU1_SU32_SUS256_SRVW4_VAW2_WG32_8_1_WGM2
    SolutionIndex: 107
    SolutionNameMin: Cijk_Ailk_Bjlk_HBH_MT64x32x16_MI16x16x16x1_SE_AF0EM8_GRVW2_GSU1_SU32_SUS256_SRVW4_VAW2_WG32_8_1_WGM2
    SolutionIndex: 108
    SolutionNameMin: Cijk_Ailk_Bjlk_HBH_MT64x64x32_MI32x32x8x1_SE_AF0EM8_GRVW2_GSU1_SU32_SUS256_SRVW4_VAW2_WG64_4_1_WGM2
    SolutionIndex: 109
    SolutionNameMin: Cijk_Ailk_Bjlk_HBH_MT128x64x16_MI32x32x8x1_SE_AF0EM8_GRVW4_GSU1_SU32_SUS256_SRVW4_VAW2_WG64_4_1_WGM2
    SolutionIndex: 110
    SolutionNameMin: Cijk_Ailk_Bjlk_HBH_MT64x64x32_MI32x32x8x1_SE_AF0EM8_GRVW4_GSU1_SU32_SUS256_SRVW4_VAW2_WG64_4_1_WGM2
    SolutionIndex: 111
    SolutionNameMin: Cijk_Ailk_Bjlk_HBH_MT256x160x32_MI32x32x8x1_SE_AF0EM8_GRVW4_GSU1_SU32_SUS256_SRVW4_VAW2_WG128_2_1_WGM2
    SolutionIndex: 112
    SolutionNameMin: Cijk_Ailk_Bjlk_HBH_MT128x256x16_MI32x32x8x1_SE_AF0EM8_GRVW8_GSU1_SU32_SUS256_SRVW4_VAW2_WG64_4_1_WGM2
    SolutionIndex: 113
    SolutionNameMin: Cijk_Ailk_Bjlk_HBH_MT64x128x32_MI32x32x8x1_SE_AF0EM8_GRVW8_GSU1_SU32_SUS256_SRVW4_VAW2_WG64_4_1_WGM2
    SolutionIndex: 114
    SolutionNameMin: Cijk_Ailk_Bjlk_HBH_MT128x128x32_MI32x32x8x1_SE_AF0EM8_GRVW8_GSU1_SU32_SUS256_SRVW4_VAW2_WG64_4_1_WGM2
    SolutionIndex: 115
    SolutionNameMin: Cijk_Ailk_Bjlk_HBH_MT128x96x64_MI32x32x8x1_SE_AF0EM8_GRVW8_GSU1_SU32_SUS256_SRVW4_VAW2_WG128_2_1_WGM2
    SolutionIndex: 116
    SolutionNameMin: Cijk_Ailk_Bjlk_HBH_MT64x64x16_MI32x32x8x1_SE_AF0EM8_GRVW2_GSU1_SU0_SUS256_SRVW4_VAW2_WG64_4_1_WGM15
    SolutionIndex: 117
    SolutionNameMin: Cijk_Ailk_Bjlk_HBH_MT64x128x16_MI32x32x8x1_SE_AF0EM8_GRVW2_GSU1_SU0_SUS256_SRVW4_VAW2_WG64_4_1_WGM15
    SolutionIndex: 118
    SolutionNameMin: Cijk_Ailk_Bjlk_HBH_MT128x64x16_MI32x32x8x1_SE_AF0EM8_GRVW2_GSU1_SU0_SUS256_SRVW4_VAW2_WG64_4_1_WGM15
    SolutionIndex: 119
    SolutionNameMin: Cijk_Ailk_Bjlk_HBH_MT64x64x32_MI32x32x8x1_SE_AF0EM8_GRVW2_GSU1_SU0_SUS256_SRVW4_VAW2_WG64_4_1_WGM15
    SolutionIndex: 120
    SolutionNameMin: Cijk_Ailk_Bjlk_HBH_MT128x288x32_MI32x32x8x1_SE_AF0EM8_GRVW2_GSU1_SU0_SUS256_SRVW4_VAW2_WG128_2_1_WGM15
    SolutionIndex: 121
    SolutionNameMin: Cijk_Ailk_Bjlk_HBH_MT256x144x32_MI16x16x16x1_SE_AF0EM8_GRVW2_GSU1_SU0_SUS256_SRVW4_VAW2_WG64_4_1_WGM15
    SolutionIndex: 122
    SolutionNameMin: Cijk_Ailk_Bjlk_HBH_MT64x64x16_MI32x32x8x1_SE_AF0EM8_GRVW4_GSU1_SU0_SUS256_SRVW4_VAW2_WG64_4_1_WGM15
    SolutionIndex: 123
    SolutionNameMin: Cijk_Ailk_Bjlk_HBH_MT64x128x16_MI32x32x8x1_SE_AF0EM8_GRVW4_GSU1_SU0_SUS256_SRVW4_VAW2_WG64_4_1_WGM15
    SolutionIndex: 124
    SolutionNameMin: Cijk_Ailk_Bjlk_HBH_MT128x64x16_MI32x32x8x1_SE_AF0EM8_GRVW4_GSU1_SU0_SUS256_SRVW4_VAW2_WG64_4_1_WGM15
    SolutionIndex: 125
    SolutionNameMin: Cijk_Ailk_Bjlk_HBH_MT64x64x32_MI32x32x8x1_SE_AF0EM8_GRVW4_GSU1_SU0_SUS256_SRVW4_VAW2_WG64_4_1_WGM15
    SolutionIndex: 126
    SolutionNameMin: Cijk_Ailk_Bjlk_HBH_MT256x128x32_MI32x32x8x1_SE_AF0EM8_GRVW4_GSU1_SU0_SUS256_SRVW4_VAW2_WG64_4_1_WGM15
    SolutionIndex: 127
    SolutionNameMin: Cijk_Ailk_Bjlk_HBH_MT128x288x32_MI32x32x8x1_SE_AF0EM8_GRVW4_GSU1_SU0_SUS256_SRVW4_VAW2_WG128_2_1_WGM15
    SolutionIndex: 128
    SolutionNameMin: Cijk_Ailk_Bjlk_HBH_MT128x160x32_MI32x32x8x1_SE_AF0EM8_GRVW4_GSU1_SU0_SUS256_SRVW4_VAW2_WG128_2_1_WGM15
    SolutionIndex: 129
    SolutionNameMin: Cijk_Ailk_Bjlk_HBH_MT256x160x32_MI32x32x8x1_SE_AF0EM8_GRVW4_GSU1_SU0_SUS256_SRVW4_VAW2_WG128_2_1_WGM15
    SolutionIndex: 130
    SolutionNameMin: Cijk_Ailk_Bjlk_HBH_MT128x64x16_MI32x32x8x1_SE_AF0EM8_GRVW8_GSU1_SU0_SUS256_SRVW4_VAW2_WG64_4_1_WGM15
    SolutionIndex: 131
    SolutionNameMin: Cijk_Ailk_Bjlk_HBH_MT128x256x16_MI32x32x8x1_SE_AF0EM8_GRVW8_GSU1_SU0_SUS256_SRVW4_VAW2_WG64_4_1_WGM15
    SolutionIndex: 132
    SolutionNameMin: Cijk_Ailk_Bjlk_HBH_MT256x256x16_MI32x32x8x1_SE_AF0EM8_GRVW8_GSU1_SU0_SUS256_SRVW4_VAW2_WG64_4_1_WGM15
    SolutionIndex: 133
    SolutionNameMin: Cijk_Ailk_Bjlk_HBH_MT64x32x16_MI16x16x16x1_SE_AF0EM8_GRVW8_GSU1_SU0_SUS256_SRVW4_VAW2_WG32_8_1_WGM15
    SolutionIndex: 134
    SolutionNameMin: Cijk_Ailk_Bjlk_HBH_MT64x64x32_MI32x32x8x1_SE_AF0EM8_GRVW8_GSU1_SU0_SUS256_SRVW4_VAW2_WG64_4_1_WGM15
    SolutionIndex: 135
    SolutionNameMin: Cijk_Ailk_Bjlk_HBH_MT64x128x32_MI32x32x8x1_SE_AF0EM8_GRVW8_GSU1_SU0_SUS256_SRVW4_VAW2_WG64_4_1_WGM15
    SolutionIndex: 136
    SolutionNameMin: Cijk_Ailk_Bjlk_HBH_MT64x256x32_MI32x32x8x1_SE_AF0EM8_GRVW8_GSU1_SU0_SUS256_SRVW4_VAW2_WG64_4_1_WGM15
    SolutionIndex: 137
    SolutionNameMin: Cijk_Ailk_Bjlk_HBH_MT128x64x32_MI32x32x8x1_SE_AF0EM8_GRVW8_GSU1_SU0_SUS256_SRVW4_VAW2_WG64_4_1_WGM15
    SolutionIndex: 138
    SolutionNameMin: Cijk_Ailk_Bjlk_HBH_MT128x128x32_MI32x32x8x1_SE_AF0EM8_GRVW8_GSU1_SU0_SUS256_SRVW4_VAW2_WG64_4_1_WGM15
    SolutionIndex: 139
    SolutionNameMin: Cijk_Ailk_Bjlk_HBH_MT128x256x32_MI32x32x8x1_SE_AF0EM8_GRVW8_GSU1_SU0_SUS256_SRVW4_VAW2_WG64_4_1_WGM15
    SolutionIndex: 140
    SolutionNameMin: Cijk_Ailk_Bjlk_HBH_MT256x128x32_MI32x32x8x1_SE_AF0EM8_GRVW8_GSU1_SU0_SUS256_SRVW4_VAW2_WG64_4_1_WGM15
    SolutionIndex: 141
    SolutionNameMin: Cijk_Ailk_Bjlk_HBH_MT256x256x32_MI32x32x8x1_SE_AF0EM8_GRVW8_GSU1_SU0_SUS256_SRVW4_VAW2_WG64_4_1_WGM15
    SolutionIndex: 142
    SolutionNameMin: Cijk_Ailk_Bjlk_HBH_MT64x64x64_MI32x32x8x1_SE_AF0EM8_GRVW8_GSU1_SU0_SUS256_SRVW4_VAW2_WG64_4_1_WGM15
    SolutionIndex: 143
    SolutionNameMin: Cijk_Ailk_Bjlk_HBH_MT64x128x64_MI32x32x8x1_SE_AF0EM8_GRVW8_GSU1_SU0_SUS256_SRVW4_VAW2_WG64_4_1_WGM15
    SolutionIndex: 144
    SolutionNameMin: Cijk_Ailk_Bjlk_HBH_MT128x64x64_MI32x32x8x1_SE_AF0EM8_GRVW8_GSU1_SU0_SUS256_SRVW4_VAW2_WG64_4_1_WGM15
    SolutionIndex: 145
    SolutionNameMin: Cijk_Ailk_Bjlk_HBH_MT32x32x64_MI16x16x16x1_SE_AF0EM8_GRVW8_GSU1_SU0_SUS256_SRVW4_VAW2_WG32_8_1_WGM15
    SolutionIndex: 146
    SolutionNameMin: Cijk_Ailk_Bjlk_HBH_MT128x96x64_MI32x32x8x1_SE_AF0EM8_GRVW8_GSU1_SU0_SUS256_SRVW4_VAW2_WG128_2_1_WGM15
    SolutionIndex: 147
    SolutionNameMin: Cijk_Ailk_Bjlk_HBH_MT64x64x16_MI32x32x8x1_SE_AF0EM8_GRVW2_GSU1_SU32_SUS128_SRVW4_VAW2_WG64_4_1_WGM15
    SolutionIndex: 148
    SolutionNameMin: Cijk_Ailk_Bjlk_HBH_MT64x32x16_MI16x16x16x1_SE_AF0EM8_GRVW2_GSU1_SU32_SUS128_SRVW4_VAW2_WG32_8_1_WGM15
    SolutionIndex: 149
    SolutionNameMin: Cijk_Ailk_Bjlk_HBH_MT256x144x32_MI16x16x16x1_SE_AF0EM8_GRVW2_GSU1_SU32_SUS128_SRVW4_VAW2_WG64_4_1_WGM15
    SolutionIndex: 150
    SolutionNameMin: Cijk_Ailk_Bjlk_HBH_MT144x256x32_MI16x16x16x1_SE_AF0EM8_GRVW2_GSU1_SU32_SUS128_SRVW0_VAW2_WG16_16_1_WGM15
    SolutionIndex: 151
    SolutionNameMin: Cijk_Ailk_Bjlk_HBH_MT256x256x16_MI32x32x8x1_SE_AF0EM8_GRVW4_GSU1_SU32_SUS128_SRVW4_VAW2_WG64_4_1_WGM15
    SolutionIndex: 152
    SolutionNameMin: Cijk_Ailk_Bjlk_HBH_MT256x160x32_MI32x32x8x1_SE_AF0EM8_GRVW4_GSU1_SU32_SUS128_SRVW4_VAW2_WG128_2_1_WGM15
    SolutionIndex: 153
    SolutionNameMin: Cijk_Ailk_Bjlk_HBH_MT160x256x32_MI32x32x8x1_SE_AF0EM8_GRVW4_GSU1_SU32_SUS128_SRVW0_VAW2_WG32_8_1_WGM15
    SolutionIndex: 154
    SolutionNameMin: Cijk_Ailk_Bjlk_HBH_MT128x256x16_MI32x32x8x1_SE_AF0EM8_GRVW8_GSU1_SU32_SUS128_SRVW4_VAW2_WG64_4_1_WGM15
    SolutionIndex: 155
    SolutionNameMin: Cijk_Ailk_Bjlk_HBH_MT64x32x16_MI16x16x16x1_SE_AF0EM8_GRVW8_GSU1_SU32_SUS128_SRVW4_VAW2_WG32_8_1_WGM15
    SolutionIndex: 156
    SolutionNameMin: Cijk_Ailk_Bjlk_HBH_MT64x128x32_MI32x32x8x1_SE_AF0EM8_GRVW8_GSU1_SU32_SUS128_SRVW4_VAW2_WG64_4_1_WGM15
    SolutionIndex: 157
    SolutionNameMin: Cijk_Ailk_Bjlk_HBH_MT128x128x32_MI32x32x8x1_SE_AF0EM8_GRVW8_GSU1_SU32_SUS128_SRVW4_VAW2_WG64_4_1_WGM15
    SolutionIndex: 158
    SolutionNameMin: Cijk_Ailk_Bjlk_HBH_MT128x256x32_MI32x32x8x1_SE_AF0EM8_GRVW8_GSU1_SU32_SUS128_SRVW4_VAW2_WG64_4_1_WGM15
    SolutionIndex: 159
    SolutionNameMin: Cijk_Ailk_Bjlk_HBH_MT256x128x32_MI32x32x8x1_SE_AF0EM8_GRVW8_GSU1_SU32_SUS128_SRVW4_VAW2_WG64_4_1_WGM15
    SolutionIndex: 160
    SolutionNameMin: Cijk_Ailk_Bjlk_HBH_MT64x128x64_MI32x32x8x1_SE_AF0EM8_GRVW8_GSU1_SU32_SUS128_SRVW4_VAW2_WG64_4_1_WGM15
    SolutionIndex: 161
    SolutionNameMin: Cijk_Ailk_Bjlk_HBH_MT96x128x64_MI32x32x8x1_SE_AF0EM8_GRVW8_GSU1_SU32_SUS128_SRVW0_VAW2_WG32_8_1_WGM15
    SolutionIndex: 162
    SolutionNameMin: Cijk_Ailk_Bjlk_HBH_MT64x64x16_MI32x32x8x1_SE_AF0EM8_GRVW2_GSU1_SU32_SUS256_SRVW4_VAW2_WG64_4_1_WGM15
    SolutionIndex: 163
    SolutionNameMin: Cijk_Ailk_Bjlk_HBH_MT64x32x16_MI16x16x16x1_SE_AF0EM8_GRVW2_GSU1_SU32_SUS256_SRVW4_VAW2_WG32_8_1_WGM15
    SolutionIndex: 164
    SolutionNameMin: Cijk_Ailk_Bjlk_HBH_MT256x144x32_MI16x16x16x1_SE_AF0EM8_GRVW2_GSU1_SU32_SUS256_SRVW4_VAW2_WG64_4_1_WGM15
    SolutionIndex: 165
    SolutionNameMin: Cijk_Ailk_Bjlk_HBH_MT64x64x32_MI32x32x8x1_SE_AF0EM8_GRVW4_GSU1_SU32_SUS256_SRVW4_VAW2_WG64_4_1_WGM15
    SolutionIndex: 166
    SolutionNameMin: Cijk_Ailk_Bjlk_HBH_MT256x160x32_MI32x32x8x1_SE_AF0EM8_GRVW4_GSU1_SU32_SUS256_SRVW4_VAW2_WG128_2_1_WGM15
    SolutionIndex: 167
    SolutionNameMin: Cijk_Ailk_Bjlk_HBH_MT64x64x16_MI32x32x8x1_SE_AF0EM8_GRVW8_GSU1_SU32_SUS256_SRVW4_VAW2_WG64_4_1_WGM15
    SolutionIndex: 168
    SolutionNameMin: Cijk_Ailk_Bjlk_HBH_MT128x256x16_MI32x32x8x1_SE_AF0EM8_GRVW8_GSU1_SU32_SUS256_SRVW4_VAW2_WG64_4_1_WGM15
    SolutionIndex: 169
    SolutionNameMin: Cijk_Ailk_Bjlk_HBH_MT32x64x16_MI16x16x16x1_SE_AF0EM8_GRVW8_GSU1_SU32_SUS256_SRVW4_VAW2_WG32_8_1_WGM15
    SolutionIndex: 170
    SolutionNameMin: Cijk_Ailk_Bjlk_HBH_MT64x64x32_MI32x32x8x1_SE_AF0EM8_GRVW8_GSU1_SU32_SUS256_SRVW4_VAW2_WG64_4_1_WGM15
    SolutionIndex: 171
    SolutionNameMin: Cijk_Ailk_Bjlk_HBH_MT64x128x32_MI32x32x8x1_SE_AF0EM8_GRVW8_GSU1_SU32_SUS256_SRVW4_VAW2_WG64_4_1_WGM15
    SolutionIndex: 172
    SolutionNameMin: Cijk_Ailk_Bjlk_HBH_MT256x128x32_MI32x32x8x1_SE_AF0EM8_GRVW8_GSU1_SU32_SUS256_SRVW4_VAW2_WG64_4_1_WGM15
    SolutionIndex: 173
    SolutionNameMin: Cijk_Ailk_Bjlk_HBH_MT64x64x64_MI32x32x8x1_SE_AF0EM8_GRVW8_GSU1_SU32_SUS256_SRVW4_VAW2_WG64_4_1_WGM15
    SolutionIndex: 174
    SolutionNameMin: Cijk_Ailk_Bjlk_HBH_MT64x128x64_MI32x32x8x1_SE_AF0EM8_GRVW8_GSU1_SU32_SUS256_SRVW4_VAW2_WG64_4_1_WGM15
    SolutionIndex: 175
    SolutionNameMin: Cijk_Ailk_Bjlk_HBH_MT128x96x64_MI32x32x8x1_SE_AF0EM8_GRVW8_GSU1_SU32_SUS256_SRVW4_VAW2_WG128_2_1_WGM15
    SolutionIndex: 176
    SolutionNameMin: Cijk_Ailk_Bjlk_HBH_MT32x64x16_MI16x16x16x1_SE_AF0EM8_GRVW2_GSU1_SU0_SUS256_SRVW4_VAW2_WG32_8_1_WGM1
    SolutionIndex: 177
    SolutionNameMin: Cijk_Ailk_Bjlk_HBH_MT128x256x32_MI32x32x8x1_SE_AF0EM8_GRVW2_GSU1_SU0_SUS256_SRVW4_VAW2_WG64_4_1_WGM1
    SolutionIndex: 178
    SolutionNameMin: Cijk_Ailk_Bjlk_HBH_MT128x256x16_MI32x32x8x1_SE_AF0EM8_GRVW8_GSU1_SU0_SUS256_SRVW4_VAW2_WG64_4_1_WGM1
    SolutionIndex: 179
    SolutionNameMin: Cijk_Ailk_Bjlk_HBH_MT256x256x16_MI32x32x8x1_SE_AF0EM8_GRVW8_GSU1_SU0_SUS256_SRVW4_VAW2_WG64_4_1_WGM1
    SolutionIndex: 180
    SolutionNameMin: Cijk_Ailk_Bjlk_HBH_MT128x256x16_MI32x32x8x1_SE_AF0EM8_GRVW8_GSU1_SU32_SUS128_SRVW4_VAW2_WG64_4_1_WGM1
    SolutionIndex: 181
    SolutionNameMin: Cijk_Ailk_Bjlk_HBH_MT256x256x16_MI32x32x8x1_SE_AF0EM8_GRVW8_GSU1_SU32_SUS128_SRVW4_VAW2_WG64_4_1_WGM1
    SolutionIndex: 182
    SolutionNameMin: Cijk_Ailk_Bjlk_HBH_MT128x256x32_MI32x32x8x1_SE_AF0EM8_GRVW2_GSU1_SU32_SUS256_SRVW4_VAW2_WG64_4_1_WGM1
    SolutionIndex: 183
    SolutionNameMin: Cijk_Ailk_Bjlk_HBH_MT128x256x16_MI32x32x8x1_SE_AF0EM8_GRVW8_GSU1_SU32_SUS256_SRVW4_VAW2_WG64_4_1_WGM1
    SolutionIndex: 184
    SolutionNameMin: Cijk_Ailk_Bjlk_HBH_MT128x256x16_MI32x32x8x1_SE_AF0EM8_GRVW8_GSU1_SU0_SUS256_SRVW4_VAW2_WG64_4_1_WGM2
    SolutionIndex: 185
    SolutionNameMin: Cijk_Ailk_Bjlk_HBH_MT128x256x16_MI32x32x8x1_SE_AF0EM8_GRVW2_GSU1_SU32_SUS128_SRVW4_VAW2_WG64_4_1_WGM2
    SolutionIndex: 186
    SolutionNameMin: Cijk_Ailk_Bjlk_HBH_MT64x32x16_MI16x16x16x1_SE_AF0EM8_GRVW2_GSU1_SU32_SUS128_SRVW4_VAW2_WG32_8_1_WGM2
    SolutionIndex: 187
    SolutionNameMin: Cijk_Ailk_Bjlk_HBH_MT64x32x16_MI16x16x16x1_SE_AF0EM8_GRVW2_GSU1_SU32_SUS256_SRVW4_VAW2_WG32_8_1_WGM2
    SolutionIndex: 188
    SolutionNameMin: Cijk_Ailk_Bjlk_HBH_MT128x256x32_MI32x32x8x1_SE_AF0EM8_GRVW2_GSU1_SU0_SUS256_SRVW4_VAW2_WG64_4_1_WGM15
    SolutionIndex: 189
    SolutionNameMin: Cijk_Ailk_Bjlk_HBH_MT128x288x32_MI32x32x8x1_SE_AF0EM8_GRVW2_GSU1_SU0_SUS256_SRVW4_VAW2_WG128_2_1_WGM15
    SolutionIndex: 190
    SolutionNameMin: Cijk_Ailk_Bjlk_HBH_MT256x256x16_MI32x32x8x1_SE_AF0EM8_GRVW8_GSU1_SU0_SUS256_SRVW4_VAW2_WG64_4_1_WGM15
    SolutionIndex: 191
    SolutionNameMin: Cijk_Ailk_Bjlk_HBH_MT64x32x16_MI16x16x16x1_SE_AF0EM8_GRVW8_GSU1_SU0_SUS256_SRVW4_VAW2_WG32_8_1_WGM15
    SolutionIndex: 192
    SolutionNameMin: Cijk_Ailk_Bjlk_HBH_MT256x256x16_MI32x32x8x1_SE_AF0EM8_GRVW4_GSU1_SU32_SUS128_SRVW4_VAW2_WG64_4_1_WGM15
    SolutionIndex: 193
    SolutionNameMin: Cijk_Ailk_Bjlk_HBH_MT128x256x16_MI32x32x8x1_SE_AF0EM8_GRVW8_GSU1_SU32_SUS128_SRVW4_VAW2_WG64_4_1_WGM15
    SolutionIndex: 194
    SolutionNameMin: Cijk_Ailk_Bjlk_HBH_MT128x288x32_MI32x32x8x1_SE_AF0EM8_GRVW2_GSU1_SU32_SUS256_SRVW4_VAW2_WG128_2_1_WGM15
    SolutionIndex: 195
    SolutionNameMin: Cijk_Ailk_Bjlk_HBH_MT256x160x32_MI32x32x8x1_SE_AF0EM8_GRVW4_GSU2_SU0_SUS256_SRVW0_VAW1_WG128_2_1_WGM1
    SolutionIndex: 196
    SolutionNameMin: Cijk_Ailk_Bjlk_HBH_MT128x288x32_MI32x32x8x1_SE_AF0EM8_GRVW4_GSU2_SU0_SUS256_SRVW0_VAW1_WG128_2_1_WGM2
    SolutionIndex: 197
    SolutionNameMin: Cijk_Ailk_Bjlk_HBH_MT256x160x32_MI32x32x8x1_SE_AF0EM8_GRVW4_GSU2_SU0_SUS256_SRVW0_VAW1_WG128_2_1_WGM2
    SolutionIndex: 198
    SolutionNameMin: Cijk_Ailk_Bjlk_HBH_MT128x128x64_MI32x32x8x1_SE_AF0EM8_GRVW8_GSU2_SU0_SUS256_SRVW0_VAW1_WG64_4_1_WGM2
    SolutionIndex: 199
    SolutionNameMin: Cijk_Ailk_Bjlk_HBH_MT256x160x32_MI32x32x8x1_SE_AF0EM8_GRVW4_GSU2_SU32_SUS256_SRVW0_VAW1_WG128_2_1_WGM2
    SolutionIndex: 200
    SolutionNameMin: Cijk_Ailk_Bjlk_HBH_MT256x160x32_MI32x32x8x1_SE_AF0EM8_GRVW4_GSU2_SU0_SUS256_SRVW0_VAW1_WG128_2_1_WGM15
    SolutionIndex: 201
    SolutionNameMin: Cijk_Ailk_Bjlk_HBH_MT128x256x32_MI32x32x8x1_SE_AF0EM8_GRVW8_GSU2_SU0_SUS256_SRVW0_VAW1_WG64_4_1_WGM15
    SolutionIndex: 202
    SolutionNameMin: Cijk_Ailk_Bjlk_HBH_MT128x288x32_MI32x32x8x1_SE_AF0EM8_GRVW4_GSU3_SU0_SUS256_SRVW0_VAW1_WG128_2_1_WGM1
    SolutionIndex: 203
    SolutionNameMin: Cijk_Ailk_Bjlk_HBH_MT128x256x32_MI32x32x8x1_SE_AF0EM8_GRVW8_GSU3_SU0_SUS256_SRVW0_VAW1_WG64_4_1_WGM1
    SolutionIndex: 204
    SolutionNameMin: Cijk_Ailk_Bjlk_HBH_MT128x128x64_MI32x32x8x1_SE_AF0EM8_GRVW8_GSU3_SU0_SUS256_SRVW0_VAW1_WG64_4_1_WGM1
    SolutionIndex: 205
    SolutionNameMin: Cijk_Ailk_Bjlk_HBH_MT96x96x64_MI16x16x16x1_SE_AF0EM8_GRVW8_GSU3_SU0_SUS256_SRVW0_VAW1_WG32_8_1_WGM1
    SolutionIndex: 206
    SolutionNameMin: Cijk_Ailk_Bjlk_HBH_MT128x256x32_MI32x32x8x1_SE_AF0EM8_GRVW8_GSU3_SU32_SUS128_SRVW0_VAW1_WG64_4_1_WGM1
    SolutionIndex: 207
    SolutionNameMin: Cijk_Ailk_Bjlk_HBH_MT256x128x32_MI32x32x8x1_SE_AF0EM8_GRVW8_GSU3_SU32_SUS128_SRVW0_VAW1_WG64_4_1_WGM1
    SolutionIndex: 208
    SolutionNameMin: Cijk_Ailk_Bjlk_HBH_MT256x256x16_MI32x32x8x1_SE_AF0EM8_GRVW4_GSU3_SU32_SUS256_SRVW0_VAW1_WG64_4_1_WGM1
    SolutionIndex: 209
    SolutionNameMin: Cijk_Ailk_Bjlk_HBH_MT64x32x32_MI16x16x16x1_SE_AF0EM8_GRVW4_GSU3_SU32_SUS256_SRVW0_VAW1_WG32_8_1_WGM1
    SolutionIndex: 210
    SolutionNameMin: Cijk_Ailk_Bjlk_HBH_MT256x128x32_MI32x32x8x1_SE_AF0EM8_GRVW8_GSU3_SU32_SUS256_SRVW0_VAW1_WG64_4_1_WGM1
    SolutionIndex: 211
    SolutionNameMin: Cijk_Ailk_Bjlk_HBH_MT128x128x64_MI32x32x8x1_SE_AF0EM8_GRVW8_GSU3_SU32_SUS256_SRVW0_VAW1_WG64_4_1_WGM1
    SolutionIndex: 212
    SolutionNameMin: Cijk_Ailk_Bjlk_HBH_MT96x128x64_MI32x32x8x1_SE_AF0EM8_GRVW2_GSU3_SU0_SUS256_SRVW0_VAW1_WG32_8_1_WGM2
    SolutionIndex: 213
    SolutionNameMin: Cijk_Ailk_Bjlk_HBH_MT128x288x32_MI32x32x8x1_SE_AF0EM8_GRVW4_GSU3_SU0_SUS256_SRVW0_VAW1_WG128_2_1_WGM2
    SolutionIndex: 214
    SolutionNameMin: Cijk_Ailk_Bjlk_HBH_MT128x256x32_MI32x32x8x1_SE_AF0EM8_GRVW8_GSU3_SU0_SUS256_SRVW0_VAW1_WG64_4_1_WGM2
    SolutionIndex: 215
    SolutionNameMin: Cijk_Ailk_Bjlk_HBH_MT256x128x32_MI32x32x8x1_SE_AF0EM8_GRVW8_GSU3_SU0_SUS256_SRVW0_VAW1_WG64_4_1_WGM2
    SolutionIndex: 216
    SolutionNameMin: Cijk_Ailk_Bjlk_HBH_MT32x32x64_MI16x16x16x1_SE_AF0EM8_GRVW8_GSU3_SU0_SUS256_SRVW0_VAW1_WG32_8_1_WGM2
    SolutionIndex: 217
    SolutionNameMin: Cijk_Ailk_Bjlk_HBH_MT256x256x16_MI32x32x8x1_SE_AF0EM8_GRVW4_GSU3_SU32_SUS128_SRVW0_VAW1_WG64_4_1_WGM2
    SolutionIndex: 218
    SolutionNameMin: Cijk_Ailk_Bjlk_HBH_MT256x128x32_MI32x32x8x1_SE_AF0EM8_GRVW8_GSU3_SU32_SUS128_SRVW0_VAW1_WG64_4_1_WGM2
    SolutionIndex: 219
    SolutionNameMin: Cijk_Ailk_Bjlk_HBH_MT256x160x32_MI32x32x8x1_SE_AF0EM8_GRVW4_GSU3_SU32_SUS256_SRVW0_VAW1_WG128_2_1_WGM2
    SolutionIndex: 220
    SolutionNameMin: Cijk_Ailk_Bjlk_HBH_MT32x32x64_MI16x16x16x1_SE_AF0EM8_GRVW2_GSU3_SU0_SUS256_SRVW0_VAW1_WG32_8_1_WGM15
    SolutionIndex: 221
    SolutionNameMin: Cijk_Ailk_Bjlk_HBH_MT32x32x32_MI16x16x16x1_SE_AF0EM8_GRVW4_GSU3_SU0_SUS256_SRVW0_VAW1_WG32_8_1_WGM15
    SolutionIndex: 222
    SolutionNameMin: Cijk_Ailk_Bjlk_HBH_MT256x160x32_MI32x32x8x1_SE_AF0EM8_GRVW4_GSU3_SU0_SUS256_SRVW0_VAW1_WG128_2_1_WGM15
    SolutionIndex: 223
    SolutionNameMin: Cijk_Ailk_Bjlk_HBH_MT256x256x16_MI32x32x8x1_SE_AF0EM8_GRVW8_GSU3_SU0_SUS256_SRVW0_VAW1_WG64_4_1_WGM15
    SolutionIndex: 224
    SolutionNameMin: Cijk_Ailk_Bjlk_HBH_MT128x256x32_MI32x32x8x1_SE_AF0EM8_GRVW8_GSU3_SU0_SUS256_SRVW0_VAW1_WG64_4_1_WGM15
    SolutionIndex: 225
    SolutionNameMin: Cijk_Ailk_Bjlk_HBH_MT256x128x32_MI32x32x8x1_SE_AF0EM8_GRVW8_GSU3_SU0_SUS256_SRVW0_VAW1_WG64_4_1_WGM15
    SolutionIndex: 226
    SolutionNameMin: Cijk_Ailk_Bjlk_HBH_MT128x128x64_MI32x32x8x1_SE_AF0EM8_GRVW8_GSU3_SU0_SUS256_SRVW0_VAW1_WG64_4_1_WGM15
    SolutionIndex: 227
    SolutionNameMin: Cijk_Ailk_Bjlk_HBH_MT128x256x32_MI32x32x8x1_SE_AF0EM8_GRVW4_GSU3_SU32_SUS128_SRVW0_VAW1_WG64_4_1_WGM15
    SolutionIndex: 228
    SolutionNameMin: Cijk_Ailk_Bjlk_HBH_MT128x128x32_MI32x32x8x1_SE_AF0EM8_GRVW8_GSU3_SU32_SUS128_SRVW0_VAW1_WG64_4_1_WGM15
    SolutionIndex: 229
    SolutionNameMin: Cijk_Ailk_Bjlk_HBH_MT32x32x64_MI16x16x16x1_SE_AF0EM8_GRVW8_GSU5_SU0_SUS256_SRVW0_VAW1_WG32_8_1_WGM1
    SolutionIndex: 230
    SolutionNameMin: Cijk_Ailk_Bjlk_HBH_MT96x128x64_MI32x32x8x1_SE_AF0EM8_GRVW8_GSU5_SU0_SUS256_SRVW0_VAW1_WG32_8_1_WGM1
    SolutionIndex: 231
    SolutionNameMin: Cijk_Ailk_Bjlk_HBH_MT128x256x32_MI32x32x8x1_SE_AF0EM8_GRVW8_GSU5_SU32_SUS128_SRVW0_VAW1_WG64_4_1_WGM1
    SolutionIndex: 232
    SolutionNameMin: Cijk_Ailk_Bjlk_HBH_MT256x160x32_MI32x32x8x1_SE_AF0EM8_GRVW4_GSU5_SU0_SUS256_SRVW0_VAW1_WG128_2_1_WGM2
    SolutionIndex: 233
    SolutionNameMin: Cijk_Ailk_Bjlk_HBH_MT96x128x64_MI32x32x8x1_SE_AF0EM8_GRVW4_GSU5_SU0_SUS256_SRVW0_VAW1_WG32_8_1_WGM2
    SolutionIndex: 234
    SolutionNameMin: Cijk_Ailk_Bjlk_HBH_MT32x32x64_MI16x16x16x1_SE_AF0EM8_GRVW2_GSU5_SU0_SUS256_SRVW0_VAW1_WG32_8_1_WGM15
    SolutionIndex: 235
    SolutionNameMin: Cijk_Ailk_Bjlk_HBH_MT96x128x64_MI32x32x8x1_SE_AF0EM8_GRVW8_GSU5_SU32_SUS128_SRVW0_VAW1_WG32_8_1_WGM15
    SolutionIndex: 236
    SolutionNameMin: Cijk_Ailk_Bjlk_HBH_MT96x128x64_MI32x32x8x1_SE_AF0EM8_GRVW8_GSU5_SU32_SUS256_SRVW0_VAW1_WG32_8_1_WGM15
    SolutionIndex: 237
    SolutionNameMin: Cijk_Ailk_Bjlk_HBH_MT64x64x64_MI32x32x8x1_SE_AF0EM8_GRVW2_GSU7_SU0_SUS256_SRVW0_VAW1_WG64_4_1_WGM1
    SolutionIndex: 238
    SolutionNameMin: Cijk_Ailk_Bjlk_HBH_MT128x128x64_MI32x32x8x1_SE_AF0EM8_GRVW2_GSU7_SU0_SUS256_SRVW0_VAW1_WG64_4_1_WGM1
    SolutionIndex: 239
    SolutionNameMin: Cijk_Ailk_Bjlk_HBH_MT32x32x64_MI16x16x16x1_SE_AF0EM8_GRVW2_GSU7_SU0_SUS256_SRVW0_VAW1_WG32_8_1_WGM1
    SolutionIndex: 240
    SolutionNameMin: Cijk_Ailk_Bjlk_HBH_MT128x256x32_MI32x32x8x1_SE_AF0EM8_GRVW4_GSU7_SU0_SUS256_SRVW0_VAW1_WG64_4_1_WGM1
    SolutionIndex: 241
    SolutionNameMin: Cijk_Ailk_Bjlk_HBH_MT128x160x32_MI32x32x8x1_SE_AF0EM8_GRVW4_GSU7_SU0_SUS256_SRVW0_VAW1_WG128_2_1_WGM1
    SolutionIndex: 242
    SolutionNameMin: Cijk_Ailk_Bjlk_HBH_MT128x128x64_MI32x32x8x1_SE_AF0EM8_GRVW4_GSU7_SU0_SUS256_SRVW0_VAW1_WG64_4_1_WGM1
    SolutionIndex: 243
    SolutionNameMin: Cijk_Ailk_Bjlk_HBH_MT128x128x64_MI32x32x8x1_SE_AF0EM8_GRVW8_GSU7_SU0_SUS256_SRVW0_VAW1_WG64_4_1_WGM1
    SolutionIndex: 244
    SolutionNameMin: Cijk_Ailk_Bjlk_HBH_MT256x256x16_MI32x32x8x1_SE_AF0EM8_GRVW4_GSU7_SU32_SUS128_SRVW0_VAW1_WG64_4_1_WGM1
    SolutionIndex: 245
    SolutionNameMin: Cijk_Ailk_Bjlk_HBH_MT128x64x64_MI32x32x8x1_SE_AF0EM8_GRVW8_GSU7_SU32_SUS128_SRVW0_VAW1_WG64_4_1_WGM1
    SolutionIndex: 246
    SolutionNameMin: Cijk_Ailk_Bjlk_HBH_MT128x128x64_MI32x32x8x1_SE_AF0EM8_GRVW8_GSU7_SU32_SUS128_SRVW0_VAW1_WG64_4_1_WGM1
    SolutionIndex: 247
    SolutionNameMin: Cijk_Ailk_Bjlk_HBH_MT128x128x64_MI32x32x8x1_SE_AF0EM8_GRVW8_GSU7_SU32_SUS256_SRVW0_VAW1_WG64_4_1_WGM1
    SolutionIndex: 248
    SolutionNameMin: Cijk_Ailk_Bjlk_HBH_MT128x128x64_MI32x32x8x1_SE_AF0EM8_GRVW4_GSU7_SU0_SUS256_SRVW0_VAW1_WG64_4_1_WGM2
    SolutionIndex: 249
    SolutionNameMin: Cijk_Ailk_Bjlk_HBH_MT128x128x64_MI32x32x8x1_SE_AF0EM8_GRVW8_GSU7_SU0_SUS256_SRVW0_VAW1_WG64_4_1_WGM2
    SolutionIndex: 250
    SolutionNameMin: Cijk_Ailk_Bjlk_HBH_MT256x256x16_MI32x32x8x1_SE_AF0EM8_GRVW4_GSU7_SU32_SUS128_SRVW0_VAW1_WG64_4_1_WGM2
    SolutionIndex: 251
    SolutionNameMin: Cijk_Ailk_Bjlk_HBH_MT64x128x64_MI32x32x8x1_SE_AF0EM8_GRVW8_GSU7_SU32_SUS128_SRVW0_VAW1_WG64_4_1_WGM2
    SolutionIndex: 252
    SolutionNameMin: Cijk_Ailk_Bjlk_HBH_MT128x128x64_MI32x32x8x1_SE_AF0EM8_GRVW8_GSU7_SU32_SUS128_SRVW0_VAW1_WG64_4_1_WGM2
    SolutionIndex: 253
    SolutionNameMin: Cijk_Ailk_Bjlk_HBH_MT128x64x64_MI32x32x8x1_SE_AF0EM8_GRVW8_GSU7_SU32_SUS256_SRVW0_VAW1_WG64_4_1_WGM2
    SolutionIndex: 254
    SolutionNameMin: Cijk_Ailk_Bjlk_HBH_MT128x128x64_MI32x32x8x1_SE_AF0EM8_GRVW8_GSU7_SU32_SUS256_SRVW0_VAW1_WG64_4_1_WGM2
    SolutionIndex: 255
    SolutionNameMin: Cijk_Ailk_Bjlk_HBH_MT256x256x16_MI32x32x8x1_SE_AF0EM8_GRVW8_GSU7_SU0_SUS256_SRVW0_VAW1_WG64_4_1_WGM15
    SolutionIndex: 256
    SolutionNameMin: Cijk_Ailk_Bjlk_HBH_MT256x128x32_MI32x32x8x1_SE_AF0EM8_GRVW8_GSU7_SU0_SUS256_SRVW0_VAW1_WG64_4_1_WGM15
    SolutionIndex: 257
    SolutionNameMin: Cijk_Ailk_Bjlk_HBH_MT256x256x32_MI32x32x8x1_SE_AF0EM8_GRVW8_GSU7_SU0_SUS256_SRVW0_VAW1_WG64_4_1_WGM15
    SolutionIndex: 258
    SolutionNameMin: Cijk_Ailk_Bjlk_HBH_MT32x32x64_MI16x16x16x1_SE_AF0EM8_GRVW2_GSU7_SU32_SUS128_SRVW0_VAW1_WG32_8_1_WGM15
    SolutionIndex: 259
    SolutionNameMin: Cijk_Ailk_Bjlk_HBH_MT256x128x32_MI32x32x8x1_SE_AF0EM8_GRVW8_GSU7_SU32_SUS128_SRVW0_VAW1_WG64_4_1_WGM15
    SolutionIndex: 260
    SolutionNameMin: Cijk_Ailk_Bjlk_HBH_MT256x256x32_MI32x32x8x1_SE_AF0EM8_GRVW8_GSU7_SU32_SUS128_SRVW0_VAW1_WG64_4_1_WGM15
    SolutionIndex: 261
    SolutionNameMin: Cijk_Ailk_Bjlk_HBH_MT128x128x64_MI32x32x8x1_SE_AF0EM8_GRVW8_GSU7_SU32_SUS128_SRVW0_VAW1_WG64_4_1_WGM15
    SolutionIndex: 262
    SolutionNameMin: Cijk_Ailk_Bjlk_HBH_MT32x32x64_MI16x16x16x1_SE_AF0EM8_GRVW2_GSU7_SU32_SUS256_SRVW0_VAW1_WG32_8_1_WGM15
    SolutionIndex: 263
    SolutionNameMin: Cijk_Ailk_Bjlk_HBH_MT256x256x16_MI32x32x8x1_SE_AF0EM8_GRVW4_GSU7_SU32_SUS256_SRVW0_VAW1_WG64_4_1_WGM15
    SolutionIndex: 264
    SolutionNameMin: Cijk_Ailk_Bjlk_HBH_MT256x256x32_MI32x32x8x1_SE_AF0EM8_GRVW8_GSU7_SU32_SUS256_SRVW0_VAW1_WG64_4_1_WGM15
    SolutionIndex: 265
    SolutionNameMin: Cijk_Ailk_Bjlk_HBH_MT256x256x16_MI32x32x8x1_SE_AF0EM8_GRVW8_GSU7_SU0_SUS256_SRVW0_VAW1_WG64_4_1_WGM15
    SolutionIndex: 266
    SolutionNameMin: Cijk_Ailk_Bjlk_HBH_MT256x128x32_MI32x32x8x1_SE_AF0EM8_GRVW8_GSU15_SU0_SUS256_SRVW0_VAW1_WG64_4_1_WGM1
    SolutionIndex: 267
    SolutionNameMin: Cijk_Ailk_Bjlk_HBH_MT64x64x64_MI32x32x8x1_SE_AF0EM8_GRVW8_GSU15_SU0_SUS256_SRVW0_VAW1_WG64_4_1_WGM1
    SolutionIndex: 268
    SolutionNameMin: Cijk_Ailk_Bjlk_HBH_MT64x64x64_MI32x32x8x1_SE_AF0EM8_GRVW8_GSU15_SU32_SUS128_SRVW0_VAW1_WG64_4_1_WGM1
    SolutionIndex: 269
    SolutionNameMin: Cijk_Ailk_Bjlk_HBH_MT64x64x64_MI32x32x8x1_SE_AF0EM8_GRVW8_GSU15_SU32_SUS256_SRVW0_VAW1_WG64_4_1_WGM1
    SolutionIndex: 270
    SolutionNameMin: Cijk_Ailk_Bjlk_HBH_MT128x256x32_MI32x32x8x1_SE_AF0EM8_GRVW8_GSU15_SU0_SUS256_SRVW0_VAW1_WG64_4_1_WGM2
    SolutionIndex: 271
    SolutionNameMin: Cijk_Ailk_Bjlk_HBH_MT256x128x32_MI32x32x8x1_SE_AF0EM8_GRVW8_GSU15_SU0_SUS256_SRVW0_VAW1_WG64_4_1_WGM2
    SolutionIndex: 272
    SolutionNameMin: Cijk_Ailk_Bjlk_HBH_MT64x64x64_MI32x32x8x1_SE_AF0EM8_GRVW8_GSU15_SU0_SUS256_SRVW0_VAW1_WG64_4_1_WGM2
    SolutionIndex: 273
    SolutionNameMin: Cijk_Ailk_Bjlk_HBH_MT256x256x16_MI32x32x8x1_SE_AF0EM8_GRVW4_GSU15_SU0_SUS256_SRVW0_VAW1_WG64_4_1_WGM15
    SolutionIndex: 274
    SolutionNameMin: Cijk_Ailk_Bjlk_HBH_MT128x128x32_MI32x32x8x1_SE_AF0EM8_GRVW8_GSU15_SU0_SUS256_SRVW0_VAW1_WG64_4_1_WGM15
    SolutionIndex: 275
    SolutionNameMin: Cijk_Ailk_Bjlk_HBH_MT256x128x32_MI32x32x8x1_SE_AF0EM8_GRVW8_GSU15_SU0_SUS256_SRVW0_VAW1_WG64_4_1_WGM15
    SolutionIndex: 276
    SolutionNameMin: Cijk_Ailk_Bjlk_HBH_MT128x128x64_MI32x32x8x1_SE_AF0EM8_GRVW8_GSU15_SU0_SUS256_SRVW0_VAW1_WG64_4_1_WGM15
    SolutionIndex: 277
    SolutionNameMin: Cijk_Ailk_Bjlk_HBH_MT64x64x16_MI32x32x8x1_SE_AF0EM1_GRVW2_GSU1_SU0_SUS256_SRVW4_VAW2_WG64_4_1_WGM1
    SolutionIndex: 278
    SolutionNameMin: Cijk_Ailk_Bjlk_HBH_MT32x64x16_MI16x16x16x1_SE_AF0EM1_GRVW2_GSU1_SU0_SUS256_SRVW4_VAW2_WG32_8_1_WGM1
    SolutionIndex: 279
    SolutionNameMin: Cijk_Ailk_Bjlk_HBH_MT64x32x16_MI16x16x16x1_SE_AF0EM1_GRVW2_GSU1_SU0_SUS256_SRVW4_VAW2_WG32_8_1_WGM1
    SolutionIndex: 280
    SolutionNameMin: Cijk_Ailk_Bjlk_HBH_MT128x96x16_MI32x32x8x1_SE_AF0EM1_GRVW2_GSU1_SU0_SUS256_SRVW4_VAW2_WG128_2_1_WGM1
    SolutionIndex: 281
    SolutionNameMin: Cijk_Ailk_Bjlk_HBH_MT128x96x32_MI32x32x8x1_SE_AF0EM1_GRVW2_GSU1_SU0_SUS256_SRVW4_VAW2_WG128_2_1_WGM1
    SolutionIndex: 282
    SolutionNameMin: Cijk_Ailk_Bjlk_HBH_MT64x64x32_MI32x32x8x1_SE_AF0EM1_GRVW4_GSU1_SU0_SUS256_SRVW4_VAW2_WG64_4_1_WGM1
    SolutionIndex: 283
    SolutionNameMin: Cijk_Ailk_Bjlk_HBH_MT32x32x64_MI16x16x16x1_SE_AF0EM1_GRVW4_GSU1_SU0_SUS256_SRVW4_VAW2_WG32_8_1_WGM1
    SolutionIndex: 284
    SolutionNameMin: Cijk_Ailk_Bjlk_HBH_MT64x128x16_MI32x32x8x1_SE_AF0EM1_GRVW8_GSU1_SU0_SUS256_SRVW4_VAW2_WG64_4_1_WGM1
    SolutionIndex: 285
    SolutionNameMin: Cijk_Ailk_Bjlk_HBH_MT64x128x32_MI32x32x8x1_SE_AF0EM1_GRVW8_GSU1_SU0_SUS256_SRVW4_VAW2_WG64_4_1_WGM1
    SolutionIndex: 286
    SolutionNameMin: Cijk_Ailk_Bjlk_HBH_MT128x128x32_MI32x32x8x1_SE_AF0EM1_GRVW8_GSU1_SU0_SUS256_SRVW4_VAW2_WG64_4_1_WGM1
    SolutionIndex: 287
    SolutionNameMin: Cijk_Ailk_Bjlk_HBH_MT64x64x64_MI32x32x8x1_SE_AF0EM1_GRVW8_GSU1_SU0_SUS256_SRVW4_VAW2_WG64_4_1_WGM1
    SolutionIndex: 288
    SolutionNameMin: Cijk_Ailk_Bjlk_HBH_MT64x128x64_MI32x32x8x1_SE_AF0EM1_GRVW8_GSU1_SU0_SUS256_SRVW4_VAW2_WG64_4_1_WGM1
    SolutionIndex: 289
    SolutionNameMin: Cijk_Ailk_Bjlk_HBH_MT32x32x64_MI16x16x16x1_SE_AF0EM1_GRVW8_GSU1_SU0_SUS256_SRVW4_VAW2_WG32_8_1_WGM1
    SolutionIndex: 290
    SolutionNameMin: Cijk_Ailk_Bjlk_HBH_MT128x64x16_MI32x32x8x1_SE_AF0EM1_GRVW2_GSU1_SU32_SUS128_SRVW4_VAW2_WG64_4_1_WGM1
    SolutionIndex: 291
    SolutionNameMin: Cijk_Ailk_Bjlk_HBH_MT32x32x64_MI16x16x16x1_SE_AF0EM1_GRVW2_GSU1_SU32_SUS128_SRVW4_VAW2_WG32_8_1_WGM1
    SolutionIndex: 292
    SolutionNameMin: Cijk_Ailk_Bjlk_HBH_MT32x32x16_MI16x16x16x1_SE_AF0EM1_GRVW4_GSU1_SU32_SUS128_SRVW4_VAW2_WG32_8_1_WGM1
    SolutionIndex: 293
    SolutionNameMin: Cijk_Ailk_Bjlk_HBH_MT64x128x32_MI32x32x8x1_SE_AF0EM1_GRVW8_GSU1_SU32_SUS128_SRVW4_VAW2_WG64_4_1_WGM1
    SolutionIndex: 294
    SolutionNameMin: Cijk_Ailk_Bjlk_HBH_MT64x64x16_MI32x32x8x1_SE_AF0EM1_GRVW2_GSU1_SU32_SUS256_SRVW4_VAW2_WG64_4_1_WGM1
    SolutionIndex: 295
    SolutionNameMin: Cijk_Ailk_Bjlk_HBH_MT64x32x16_MI16x16x16x1_SE_AF0EM1_GRVW2_GSU1_SU32_SUS256_SRVW4_VAW2_WG32_8_1_WGM1
    SolutionIndex: 296
    SolutionNameMin: Cijk_Ailk_Bjlk_HBH_MT128x96x16_MI32x32x8x1_SE_AF0EM1_GRVW2_GSU1_SU32_SUS256_SRVW4_VAW2_WG128_2_1_WGM1
    SolutionIndex: 297
    SolutionNameMin: Cijk_Ailk_Bjlk_HBH_MT32x32x16_MI16x16x16x1_SE_AF0EM1_GRVW4_GSU1_SU32_SUS256_SRVW4_VAW2_WG32_8_1_WGM1
    SolutionIndex: 298
    SolutionNameMin: Cijk_Ailk_Bjlk_HBH_MT64x128x16_MI32x32x8x1_SE_AF0EM1_GRVW8_GSU1_SU32_SUS256_SRVW4_VAW2_WG64_4_1_WGM1
    SolutionIndex: 299
    SolutionNameMin: Cijk_Ailk_Bjlk_HBH_MT128x256x16_MI32x32x8x1_SE_AF0EM1_GRVW8_GSU1_SU32_SUS256_SRVW4_VAW2_WG64_4_1_WGM1
    SolutionIndex: 300
    SolutionNameMin: Cijk_Ailk_Bjlk_HBH_MT64x128x32_MI32x32x8x1_SE_AF0EM1_GRVW8_GSU1_SU32_SUS256_SRVW4_VAW2_WG64_4_1_WGM1
    SolutionIndex: 301
    SolutionNameMin: Cijk_Ailk_Bjlk_HBH_MT64x64x16_MI32x32x8x1_SE_AF0EM1_GRVW2_GSU1_SU0_SUS256_SRVW4_VAW2_WG64_4_1_WGM2
    SolutionIndex: 302
    SolutionNameMin: Cijk_Ailk_Bjlk_HBH_MT128x64x16_MI32x32x8x1_SE_AF0EM1_GRVW2_GSU1_SU0_SUS256_SRVW4_VAW2_WG64_4_1_WGM2
    SolutionIndex: 303
    SolutionNameMin: Cijk_Ailk_Bjlk_HBH_MT128x96x32_MI32x32x8x1_SE_AF0EM1_GRVW4_GSU1_SU0_SUS256_SRVW4_VAW2_WG128_2_1_WGM2
    SolutionIndex: 304
    SolutionNameMin: Cijk_Ailk_Bjlk_HBH_MT64x128x16_MI32x32x8x1_SE_AF0EM1_GRVW8_GSU1_SU0_SUS256_SRVW4_VAW2_WG64_4_1_WGM2
    SolutionIndex: 305
    SolutionNameMin: Cijk_Ailk_Bjlk_HBH_MT128x128x16_MI32x32x8x1_SE_AF0EM1_GRVW8_GSU1_SU0_SUS256_SRVW4_VAW2_WG64_4_1_WGM2
    SolutionIndex: 306
    SolutionNameMin: Cijk_Ailk_Bjlk_HBH_MT128x256x16_MI32x32x8x1_SE_AF0EM1_GRVW8_GSU1_SU0_SUS256_SRVW4_VAW2_WG64_4_1_WGM2
    SolutionIndex: 307
    SolutionNameMin: Cijk_Ailk_Bjlk_HBH_MT128x128x32_MI32x32x8x1_SE_AF0EM1_GRVW8_GSU1_SU0_SUS256_SRVW4_VAW2_WG64_4_1_WGM2
    SolutionIndex: 308
    SolutionNameMin: Cijk_Ailk_Bjlk_HBH_MT32x32x64_MI16x16x16x1_SE_AF0EM1_GRVW8_GSU1_SU0_SUS256_SRVW4_VAW2_WG32_8_1_WGM2
    SolutionIndex: 309
    SolutionNameMin: Cijk_Ailk_Bjlk_HBH_MT32x64x16_MI16x16x16x1_SE_AF0EM1_GRVW2_GSU1_SU32_SUS128_SRVW4_VAW2_WG32_8_1_WGM2
    SolutionIndex: 310
    SolutionNameMin: Cijk_Ailk_Bjlk_HBH_MT64x128x16_MI32x32x8x1_SE_AF0EM1_GRVW8_GSU1_SU32_SUS128_SRVW4_VAW2_WG64_4_1_WGM2
    SolutionIndex: 311
    SolutionNameMin: Cijk_Ailk_Bjlk_HBH_MT64x128x32_MI32x32x8x1_SE_AF0EM1_GRVW8_GSU1_SU32_SUS128_SRVW4_VAW2_WG64_4_1_WGM2
    SolutionIndex: 312
    SolutionNameMin: Cijk_Ailk_Bjlk_HBH_MT64x64x16_MI32x32x8x1_SE_AF0EM1_GRVW2_GSU1_SU32_SUS256_SRVW4_VAW2_WG64_4_1_WGM2
    SolutionIndex: 313
    SolutionNameMin: Cijk_Ailk_Bjlk_HBH_MT64x64x16_MI32x32x8x1_SE_AF0EM1_GRVW2_GSU1_SU0_SUS256_SRVW4_VAW2_WG64_4_1_WGM15
    SolutionIndex: 314
    SolutionNameMin: Cijk_Ailk_Bjlk_HBH_MT128x128x16_MI32x32x8x1_SE_AF0EM1_GRVW2_GSU1_SU0_SUS256_SRVW4_VAW2_WG64_4_1_WGM15
    SolutionIndex: 315
    SolutionNameMin: Cijk_Ailk_Bjlk_HBH_MT64x128x16_MI32x32x8x1_SE_AF0EM1_GRVW4_GSU1_SU0_SUS256_SRVW4_VAW2_WG64_4_1_WGM15
    SolutionIndex: 316
    SolutionNameMin: Cijk_Ailk_Bjlk_HBH_MT64x128x16_MI32x32x8x1_SE_AF0EM1_GRVW8_GSU1_SU0_SUS256_SRVW4_VAW2_WG64_4_1_WGM15
    SolutionIndex: 317
    SolutionNameMin: Cijk_Ailk_Bjlk_HBH_MT128x128x16_MI32x32x8x1_SE_AF0EM1_GRVW8_GSU1_SU0_SUS256_SRVW4_VAW2_WG64_4_1_WGM15
    SolutionIndex: 318
    SolutionNameMin: Cijk_Ailk_Bjlk_HBH_MT128x256x16_MI32x32x8x1_SE_AF0EM1_GRVW8_GSU1_SU0_SUS256_SRVW4_VAW2_WG64_4_1_WGM15
    SolutionIndex: 319
    SolutionNameMin: Cijk_Ailk_Bjlk_HBH_MT64x128x32_MI32x32x8x1_SE_AF0EM1_GRVW8_GSU1_SU0_SUS256_SRVW4_VAW2_WG64_4_1_WGM15
    SolutionIndex: 320
    SolutionNameMin: Cijk_Ailk_Bjlk_HBH_MT128x128x32_MI32x32x8x1_SE_AF0EM1_GRVW8_GSU1_SU0_SUS256_SRVW4_VAW2_WG64_4_1_WGM15
    SolutionIndex: 321
    SolutionNameMin: Cijk_Ailk_Bjlk_HBH_MT64x64x16_MI32x32x8x1_SE_AF0EM1_GRVW2_GSU1_SU32_SUS128_SRVW4_VAW2_WG64_4_1_WGM15
    SolutionIndex: 322
    SolutionNameMin: Cijk_Ailk_Bjlk_HBH_MT128x96x16_MI32x32x8x1_SE_AF0EM1_GRVW2_GSU1_SU32_SUS128_SRVW4_VAW2_WG128_2_1_WGM15
    SolutionIndex: 323
    SolutionNameMin: Cijk_Ailk_Bjlk_HBH_MT256x160x32_MI32x32x8x1_SE_AF0EM1_GRVW4_GSU1_SU32_SUS128_SRVW4_VAW2_WG128_2_1_WGM15
    SolutionIndex: 324
    SolutionNameMin: Cijk_Ailk_Bjlk_HBH_MT128x128x32_MI32x32x8x1_SE_AF0EM1_GRVW8_GSU1_SU32_SUS128_SRVW4_VAW2_WG64_4_1_WGM15
    SolutionIndex: 325
    SolutionNameMin: Cijk_Ailk_Bjlk_HBH_MT64x64x16_MI32x32x8x1_SE_AF0EM1_GRVW2_GSU1_SU32_SUS256_SRVW4_VAW2_WG64_4_1_WGM15
    SolutionIndex: 326
    SolutionNameMin: Cijk_Ailk_Bjlk_HBH_MT128x96x16_MI32x32x8x1_SE_AF0EM1_GRVW2_GSU1_SU32_SUS256_SRVW4_VAW2_WG128_2_1_WGM15
    SolutionIndex: 327
    SolutionNameMin: Cijk_Ailk_Bjlk_HBH_MT128x128x16_MI32x32x8x1_SE_AF0EM1_GRVW4_GSU1_SU32_SUS256_SRVW4_VAW2_WG64_4_1_WGM15
    SolutionIndex: 328
    SolutionNameMin: Cijk_Ailk_Bjlk_HBH_MT96x128x64_MI32x32x8x1_SE_AF0EM1_GRVW4_GSU1_SU32_SUS256_SRVW0_VAW2_WG32_8_1_WGM15
    SolutionIndex: 329
    SolutionNameMin: Cijk_Ailk_Bjlk_HBH_MT128x128x16_MI32x32x8x1_SE_AF0EM1_GRVW8_GSU1_SU32_SUS256_SRVW4_VAW2_WG64_4_1_WGM15
    SolutionIndex: 330
    SolutionNameMin: Cijk_Ailk_Bjlk_HBH_MT32x64x16_MI16x16x16x1_SE_AF0EM1_GRVW8_GSU1_SU32_SUS256_SRVW4_VAW2_WG32_8_1_WGM15
    SolutionIndex: 331
    SolutionNameMin: Cijk_Ailk_Bjlk_HBH_MT128x256x16_MI32x32x8x1_SE_AF0EM1_GRVW8_GSU1_SU0_SUS256_SRVW4_VAW2_WG64_4_1_WGM1
    SolutionIndex: 332
    SolutionNameMin: Cijk_Ailk_Bjlk_HBH_MT32x64x16_MI16x16x16x1_SE_AF0EM1_GRVW2_GSU1_SU32_SUS256_SRVW4_VAW2_WG32_8_1_WGM1
    SolutionIndex: 333
    SolutionNameMin: Cijk_Ailk_Bjlk_HBH_MT32x64x16_MI16x16x16x1_SE_AF0EM1_GRVW2_GSU1_SU0_SUS256_SRVW4_VAW2_WG32_8_1_WGM2
    SolutionIndex: 334
    SolutionNameMin: Cijk_Ailk_Bjlk_HBH_MT32x64x16_MI16x16x16x1_SE_AF0EM1_GRVW2_GSU1_SU32_SUS128_SRVW4_VAW2_WG32_8_1_WGM2
    SolutionIndex: 335
    SolutionNameMin: Cijk_Ailk_Bjlk_HBH_MT32x64x16_MI16x16x16x1_SE_AF0EM1_GRVW2_GSU1_SU32_SUS256_SRVW4_VAW2_WG32_8_1_WGM2
    SolutionIndex: 336
    SolutionNameMin: Cijk_Ailk_Bjlk_HBH_MT32x32x64_MI16x16x16x1_SE_AF0EM1_GRVW8_GSU7_SU0_SUS256_SRVW0_VAW1_WG32_8_1_WGM1
    SolutionIndex: 337
    SolutionNameMin: Cijk_Ailk_Bjlk_HBH_MT128x256x32_MI32x32x8x1_SE_AF0EM1_GRVW8_GSU7_SU32_SUS128_SRVW0_VAW1_WG64_4_1_WGM2
    SolutionIndex: 338
    SolutionNameMin: Cijk_Ailk_Bjlk_HBH_MT32x32x64_MI16x16x16x1_SE_AF0EM1_GRVW8_GSU15_SU0_SUS256_SRVW0_VAW1_WG32_8_1_WGM1
    SolutionIndex: 339
    SolutionNameMin: Cijk_Ailk_Bjlk_HBH_MT32x32x64_MI16x16x16x1_SE_AF0EM1_GRVW8_GSU15_SU32_SUS128_SRVW0_VAW1_WG32_8_1_WGM1
    SolutionIndex: 340
    SolutionNameMin: Cijk_Ailk_Bjlk_HBH_MT16x16x16_MI16x16x16x1_SE_AF0EM1_GRVW2_GSU1_SU0_SUS256_SRVW0_VAW2_WG16_4_1_WGM1
    SolutionIndex: 341
    SolutionNameMin: Cijk_Ailk_Bjlk_HBH_MT16x16x16_MI16x16x16x1_SE_AF0EM8_GRVW2_GSU1_SU0_SUS256_SRVW0_VAW2_WG16_4_1_WGM1
    SolutionIndex: 342
    SolutionNameMin: Cijk_Ailk_Bjlk_HBH_MT16x64x32_MI16x16x16x1_SE_AF0EM8_GRVW2_GSU1_SU0_SUS256_SRVW0_VAW2_WG16_16_1_WGM1
    SolutionIndex: 343
    SolutionNameMin: Cijk_Ailk_Bjlk_HBH_MT64x16x64_MI16x16x16x1_SE_AF0EM8_GRVW2_GSU1_SU0_SUS256_SRVW0_VAW2_WG64_4_1_WGM1
    SolutionIndex: 344
    SolutionNameMin: Cijk_Ailk_Bjlk_HBH_MT16x16x16_MI16x16x16x1_SE_AF0EM1_GRVW4_GSU1_SU0_SUS256_SRVW0_VAW2_WG16_4_1_WGM1
    SolutionIndex: 345
    SolutionNameMin: Cijk_Ailk_Bjlk_HBH_MT64x16x32_MI16x16x16x1_SE_AF0EM8_GRVW4_GSU1_SU0_SUS256_SRVW0_VAW2_WG64_4_1_WGM1
    SolutionIndex: 346
    SolutionNameMin: Cijk_Ailk_Bjlk_HBH_MT16x16x16_MI16x16x16x1_SE_AF0EM1_GRVW8_GSU1_SU0_SUS256_SRVW0_VAW2_WG16_4_1_WGM1
    SolutionIndex: 347
    SolutionNameMin: Cijk_Ailk_Bjlk_HBH_MT64x16x32_MI16x16x16x1_SE_AF0EM8_GRVW8_GSU1_SU0_SUS256_SRVW0_VAW2_WG64_4_1_WGM1
    SolutionIndex: 348
    SolutionNameMin: Cijk_Ailk_Bjlk_HBH_MT16x16x16_MI16x16x16x1_SE_AF0EM1_GRVW2_GSU1_SU32_SUS128_SRVW0_VAW2_WG16_4_1_WGM1
    SolutionIndex: 349
    SolutionNameMin: Cijk_Ailk_Bjlk_HBH_MT16x16x16_MI16x16x16x1_SE_AF0EM8_GRVW2_GSU1_SU32_SUS128_SRVW4_VAW2_WG16_4_1_WGM1
    SolutionIndex: 350
    SolutionNameMin: Cijk_Ailk_Bjlk_HBH_MT16x16x16_MI16x16x16x1_SE_AF0EM1_GRVW2_GSU1_SU32_SUS256_SRVW4_VAW2_WG16_4_1_WGM1
    SolutionIndex: 351
    SolutionNameMin: Cijk_Ailk_Bjlk_HBH_MT16x16x16_MI16x16x16x1_SE_AF0EM8_GRVW2_GSU1_SU0_SUS256_SRVW0_VAW2_WG16_4_1_WGM2
    SolutionIndex: 352
    SolutionNameMin: Cijk_Ailk_Bjlk_HBH_MT16x64x32_MI16x16x16x1_SE_AF0EM8_GRVW2_GSU1_SU0_SUS256_SRVW0_VAW2_WG16_16_1_WGM2
    SolutionIndex: 353
    SolutionNameMin: Cijk_Ailk_Bjlk_HBH_MT64x16x32_MI16x16x16x1_SE_AF0EM8_GRVW4_GSU1_SU0_SUS256_SRVW0_VAW2_WG64_4_1_WGM2
    SolutionIndex: 354
    SolutionNameMin: Cijk_Ailk_Bjlk_HBH_MT16x16x16_MI16x16x16x1_SE_AF0EM1_GRVW2_GSU1_SU0_SUS256_SRVW0_VAW2_WG16_4_1_WGM15
    SolutionIndex: 355
    SolutionNameMin: Cijk_Ailk_Bjlk_HBH_MT16x16x16_MI16x16x16x1_SE_AF0EM8_GRVW2_GSU1_SU0_SUS256_SRVW0_VAW2_WG16_4_1_WGM15
    SolutionIndex: 356
    SolutionNameMin: Cijk_Ailk_Bjlk_HBH_MT16x16x16_MI16x16x16x1_SE_AF0EM1_GRVW8_GSU1_SU0_SUS256_SRVW0_VAW2_WG16_4_1_WGM15
    SolutionIndex: 357
    SolutionNameMin: Cijk_Ailk_Bjlk_HBH_MT16x16x64_MI16x16x16x1_SE_AF0EM1_GRVW2_GSU2_SU32_SUS256_SRVW0_VAW1_WG16_4_1_WGM2
    SolutionIndex: 358
    SolutionNameMin: Cijk_Ailk_Bjlk_HBH_MT16x16x32_MI16x16x16x1_SE_AF0EM1_GRVW8_GSU3_SU0_SUS256_SRVW0_VAW1_WG16_4_1_WGM1
    SolutionIndex: 359
    SolutionNameMin: Cijk_Ailk_Bjlk_HBH_MT16x16x64_MI16x16x16x1_SE_AF0EM8_GRVW2_GSU3_SU0_SUS256_SRVW0_VAW1_WG16_4_1_WGM15
    SolutionIndex: 360
    SolutionNameMin: Cijk_Ailk_Bjlk_HBH_MT64x16x64_MI16x16x16x1_SE_AF0EM8_GRVW2_GSU7_SU32_SUS128_SRVW0_VAW1_WG64_4_1_WGM15
    SolutionIndex: 361
    SolutionNameMin: Cijk_Ailk_Bjlk_HBH_MT64x16x64_MI16x16x16x1_SE_AF0EM1_GRVW2_GSU15_SU32_SUS128_SRVW0_VAW1_WG64_4_1_WGM1
    SolutionIndex: 362
    SolutionNameMin: Cijk_Ailk_Bjlk_HBH_MT64x16x64_MI16x16x16x1_SE_AF0EM8_GRVW2_GSU15_SU32_SUS128_SRVW0_VAW1_WG64_4_1_WGM1
    SolutionIndex: 363
    SolutionNameMin: Cijk_Ailk_Bjlk_HBH_MT16x64x64_MI16x16x16x1_SE_AF0EM1_GRVW2_GSU15_SU0_SUS256_SRVW4_VAW1_WG16_16_1_WGM2
    SolutionIndex: 364
    SolutionNameMin: Cijk_Ailk_Bjlk_HBH_MT64x16x64_MI16x16x16x1_SE_AF0EM1_GRVW2_GSU15_SU0_SUS256_SRVW0_VAW1_WG64_4_1_WGM15
    SolutionIndex: 365
    SolutionNameMin: Cijk_Ailk_Bjlk_HBH_MT64x16x64_MI16x16x16x1_SE_AF0EM8_GRVW2_GSU15_SU0_SUS256_SRVW0_VAW1_WG64_4_1_WGM15
    SolutionIndex: 366
    SolutionNameMin: Cijk_Ailk_Bjlk_HBH_MT16x64x64_MI16x16x16x1_SE_AF0EM1_GRVW8_GSU15_SU0_SUS256_SRVW0_VAW1_WG16_16_1_WGM15
- - - [7680, 8192, 1, 8192, 8384, 8384, 8384, 8384]
    - [30, 127618.0]
  - - [3840, 4096, 1, 4096, 4192, 4192, 4192, 4192]
    - [30, 124544.0]
  - - [1920, 2048, 1, 2048, 2080, 2080, 2080, 2080]
    - [39, 107431.0]
  - - [960, 1024, 1, 1024, 1056, 1056, 1056, 1056]
    - [160, 51569.0]
  - - [480, 512, 1, 512, 544, 544, 544, 544]
    - [50, 13559.0]
  - - [8192, 7680, 1, 8192, 8384, 8384, 8384, 8384]
    - [86, 127386.0]
  - - [4096, 3840, 1, 4096, 4192, 4192, 4192, 4192]
    - [30, 124371.0]
  - - [2048, 1920, 1, 2048, 2080, 2080, 2080, 2080]
    - [140, 113360.0]
  - - [1024, 960, 1, 1024, 1056, 1056, 1056, 1056]
    - [144, 52869.0]
  - - [512, 480, 1, 512, 544, 544, 544, 544]
    - [103, 13329.0]
  - - [8192, 8192, 1, 8192, 8384, 8384, 8384, 8384]
    - [78, 123416.0]
  - - [4096, 4096, 1, 4096, 4192, 4192, 4192, 4192]
    - [40, 110071.0]
  - - [2048, 2048, 1, 2048, 2080, 2080, 2080, 2080]
    - [149, 96127.0]
  - - [1024, 1024, 1, 1024, 1056, 1056, 1056, 1056]
    - [161, 46766.0]
  - - [512, 512, 1, 512, 544, 544, 544, 544]
    - [33, 12070.0]
  - - [64, 512, 16, 512, 64, 64, 64, 512]
    - [142, 23797.0]
  - - [1024, 2, 1, 1, 1024, 1024, 1024, 2]
    - [0, 0.0]
  - - [1024, 2, 1, 512, 1024, 1024, 1024, 2]
    - [357, 126.0]
  - - [1024, 1024, 1, 1, 1024, 1024, 1024, 1024]
    - [0, 257.0]
  - - [1024, 1024, 1, 77, 1024, 1024, 1024, 1024]
    - [162, 10970.0]
  - - [1024, 1024, 1, 512, 1024, 1024, 1024, 1024]
    - [134, 32420.0]
  - - [1024, 4096, 1, 512, 1024, 1024, 1024, 4096]
    - [194, 72550.0]
  - - [1024, 30522, 1, 77, 1024, 1024, 1024, 30522]
    - [93, 37139.0]
  - - [4096, 1024, 1, 512, 4096, 4096, 4096, 1024]
    - [157, 61008.0]
  - - [64, 128, 160, 128, 64, 64, 64, 128]
    - [58, 19600.0]
  - - [1024, 2, 1, 10, 1024, 1024, 1024, 2]
    - [3, 4.0]
  - - [1024, 2, 1, 1280, 1024, 1024, 1024, 2]
    - [234, 293.0]
  - - [1024, 1024, 1, 10, 1024, 1024, 1024, 1024]
    - [0, 2081.0]
  - - [1024, 1024, 1, 200, 1024, 1024, 1024, 1024]
    - [125, 19859.0]
  - - [1024, 1024, 1, 1280, 1024, 1024, 1024, 1024]
    - [104, 48913.0]
  - - [1024, 4096, 1, 1280, 1024, 1024, 1024, 4096]
    - [189, 88768.0]
  - - [1024, 30522, 1, 200, 1024, 1024, 1024, 30522]
    - [154, 64897.0]
  - - [4096, 1024, 1, 1280, 4096, 4096, 4096, 1024]
    - [111, 82953.0]
  - - [64, 128, 624, 128, 64, 64, 64, 128]
    - [16, 24488.0]
  - - [1024, 2, 1, 39, 1024, 1024, 1024, 2]
    - [345, 16.0]
  - - [1024, 2, 1, 4992, 1024, 1024, 1024, 2]
    - [362, 756.0]
  - - [1024, 1024, 1, 39, 1024, 1024, 1024, 1024]
    - [0, 6816.0]
  - - [1024, 1024, 1, 780, 1024, 1024, 1024, 1024]
    - [110, 33520.0]
  - - [1024, 1024, 1, 4992, 1024, 1024, 1024, 1024]
    - [115, 63835.0]
  - - [1024, 4096, 1, 4992, 1024, 1024, 1024, 4096]
    - [129, 99895.0]
  - - [1024, 30522, 1, 780, 1024, 1024, 1024, 30522]
    - [179, 94315.0]
  - - [4096, 1024, 1, 4992, 4096, 4096, 4096, 1024]
    - [153, 97151.0]
  - - [64, 512, 64, 512, 64, 64, 64, 512]
    - [79, 38239.0]
  - - [1024, 2, 1, 4, 1024, 1024, 1024, 2]
    - [2, 2.0]
  - - [1024, 2, 1, 2048, 1024, 1024, 1024, 2]
    - [262, 426.0]
  - - [1024, 1024, 1, 4, 1024, 1024, 1024, 1024]
    - [0, 889.0]
  - - [1024, 1024, 1, 308, 1024, 1024, 1024, 1024]
    - [165, 24030.0]
  - - [1024, 1024, 1, 2048, 1024, 1024, 1024, 1024]
    - [115, 56872.0]
  - - [1024, 4096, 1, 2048, 1024, 1024, 1024, 4096]
    - [189, 93450.0]
  - - [1024, 30522, 1, 308, 1024, 1024, 1024, 30522]
    - [168, 75822.0]
  - - [4096, 1024, 1, 2048, 4096, 4096, 4096, 1024]
    - [129, 88666.0]
  - - [64, 128, 640, 128, 64, 64, 64, 128]
    - [116, 24892.0]
  - - [1024, 2, 1, 40, 1024, 1024, 1024, 2]
    - [342, 15.0]
  - - [1024, 2, 1, 5120, 1024, 1024, 1024, 2]
    - [361, 753.0]
  - - [1024, 1024, 1, 40, 1024, 1024, 1024, 1024]
    - [67, 6991.0]
  - - [1024, 1024, 1, 800, 1024, 1024, 1024, 1024]
    - [100, 35666.0]
  - - [1024, 1024, 1, 5120, 1024, 1024, 1024, 1024]
    - [104, 64652.0]
  - - [1024, 4096, 1, 5120, 1024, 1024, 1024, 4096]
    - [129, 100088.0]
  - - [1024, 30522, 1, 800, 1024, 1024, 1024, 30522]
    - [6, 100919.0]
  - - [4096, 1024, 1, 5120, 4096, 4096, 4096, 1024]
    - [15, 96803.0]
  - - [64, 128, 656, 128, 64, 64, 64, 128]
    - [162, 24995.0]
  - - [1024, 2, 1, 41, 1024, 1024, 1024, 2]
    - [347, 16.0]
  - - [1024, 2, 1, 5248, 1024, 1024, 1024, 2]
    - [364, 777.0]
  - - [1024, 1024, 1, 41, 1024, 1024, 1024, 1024]
    - [67, 6890.0]
  - - [1024, 1024, 1, 820, 1024, 1024, 1024, 1024]
    - [108, 32276.0]
  - - [1024, 1024, 1, 5248, 1024, 1024, 1024, 1024]
    - [146, 63574.0]
  - - [1024, 4096, 1, 5248, 1024, 1024, 1024, 4096]
    - [129, 100272.0]
  - - [1024, 30522, 1, 820, 1024, 1024, 1024, 30522]
    - [132, 96261.0]
  - - [4096, 1024, 1, 5248, 4096, 4096, 4096, 1024]
    - [41, 97190.0]
  - - [64, 512, 80, 512, 64, 64, 64, 512]
    - [68, 41222.0]
  - - [1024, 2, 1, 5, 1024, 1024, 1024, 2]
    - [0, 2.0]
  - - [1024, 2, 1, 2560, 1024, 1024, 1024, 2]
    - [360, 485.0]
  - - [1024, 1024, 1, 5, 1024, 1024, 1024, 1024]
    - [116, 1130.0]
  - - [1024, 1024, 1, 385, 1024, 1024, 1024, 1024]
    - [170, 26559.0]
  - - [1024, 1024, 1, 2560, 1024, 1024, 1024, 1024]
    - [115, 58457.0]
  - - [1024, 4096, 1, 2560, 1024, 1024, 1024, 4096]
    - [189, 94586.0]
  - - [1024, 30522, 1, 385, 1024, 1024, 1024, 30522]
    - [154, 82644.0]
  - - [4096, 1024, 1, 2560, 4096, 4096, 4096, 1024]
    - [96, 92564.0]
  - - [64, 512, 96, 512, 64, 64, 64, 512]
    - [57, 42296.0]
  - - [1024, 2, 1, 6, 1024, 1024, 1024, 2]
    - [352, 3.0]
  - - [1024, 2, 1, 3072, 1024, 1024, 1024, 2]
    - [237, 554.0]
  - - [1024, 1024, 1, 6, 1024, 1024, 1024, 1024]
    - [105, 1311.0]
  - - [1024, 1024, 1, 462, 1024, 1024, 1024, 1024]
    - [134, 27651.0]
  - - [1024, 1024, 1, 3072, 1024, 1024, 1024, 1024]
    - [175, 60641.0]
  - - [1024, 4096, 1, 3072, 1024, 1024, 1024, 4096]
    - [189, 95472.0]
  - - [1024, 30522, 1, 462, 1024, 1024, 1024, 30522]
    - [154, 83756.0]
  - - [4096, 1024, 1, 3072, 4096, 4096, 4096, 1024]
    - [129, 94464.0]
  - - [64, 128, 128, 128, 64, 64, 64, 128]
    - [61, 16777.0]
  - - [1024, 2, 1, 8, 1024, 1024, 1024, 2]
    - [3, 3.0]
  - - [1024, 2, 1, 1024, 1024, 1024, 1024, 2]
    - [220, 228.0]
  - - [1024, 1024, 1, 8, 1024, 1024, 1024, 1024]
    - [67, 1777.0]
  - - [1024, 1024, 1, 160, 1024, 1024, 1024, 1024]
    - [119, 21845.0]
  - - [1024, 1024, 1, 1024, 1024, 1024, 1024, 1024]
    - [104, 44151.0]
  - - [1024, 4096, 1, 1024, 1024, 1024, 1024, 4096]
    - [120, 84948.0]
  - - [1024, 30522, 1, 160, 1024, 1024, 1024, 30522]
    - [185, 64978.0]
  - - [4096, 1024, 1, 1024, 4096, 4096, 4096, 1024]
    - [8, 73645.0]
  - - [64, 128, 144, 128, 64, 64, 64, 128]
    - [125, 18325.0]
  - - [1024, 2, 1, 9, 1024, 1024, 1024, 2]
    - [3, 4.0]
  - - [1024, 2, 1, 1152, 1024, 1024, 1024, 2]
    - [359, 248.0]
  - - [1024, 1024, 1, 9, 1024, 1024, 1024, 1024]
    - [0, 1872.0]
  - - [1024, 1024, 1, 180, 1024, 1024, 1024, 1024]
    - [119, 18725.0]
  - - [1024, 1024, 1, 1152, 1024, 1024, 1024, 1024]
    - [104, 47039.0]
  - - [1024, 4096, 1, 1152, 1024, 1024, 1024, 4096]
    - [189, 86904.0]
  - - [1024, 30522, 1, 180, 1024, 1024, 1024, 30522]
    - [81, 61579.0]
  - - [4096, 1024, 1, 1152, 4096, 4096, 4096, 1024]
    - [150, 79997.0]
  - - [256, 128, 1, 32768, 256, 256, 256, 128]
    - [267, 30574.0]
  - - [256, 32768, 1, 1, 256, 256, 256, 32768]
    - [51, 628.0]
  - - [512, 256, 1, 32768, 512, 512, 512, 256]
    - [274, 63087.0]
  - - [1024, 512, 1, 32768, 1024, 1024, 1024, 512]
    - [273, 92524.0]
  - - [1024, 1024, 1, 32768, 1024, 1024, 1024, 1024]
    - [257, 102480.0]
  - - [64, 128, 512, 128, 64, 64, 64, 128]
    - [75, 23547.0]
  - - [128, 64, 512, 128, 128, 128, 128, 64]
    - [75, 23630.0]
  - - [1024, 2, 1, 32, 1024, 1024, 1024, 2]
    - [353, 15.0]
  - - [1024, 1024, 1, 32, 1024, 1024, 131072, 1024]
    - [134, 7232.0]
  - - [1024, 1024, 1, 4096, 1024, 1024, 1024, 1024]
    - [89, 61568.0]
  - - [1024, 4096, 1, 4096, 1024, 1024, 1024, 4096]
    - [129, 97835.0]
  - - [1024, 30528, 1, 4096, 1024, 1024, 1024, 30528]
    - [141, 121890.0]
  - - [4096, 1024, 1, 4096, 4096, 4096, 4096, 1024]
    - [129, 98014.0]
  - - [512, 64, 64, 512, 512, 512, 512, 64]
    - [43, 37915.0]
  - - [1024, 1024, 1, 4, 1024, 1024, 524288, 1024]
    - [98, 904.0]
  - - [1024, 30528, 1, 2048, 1024, 1024, 1024, 30528]
    - [64, 115881.0]
  - - [64, 4, 32768, 4, 64, 64, 2097152, 4]
    - [341, 270.0]
  - - [64, 4, 38400, 4, 64, 64, 2457600, 4]
    - [341, 271.0]
  - - [1024, 1024, 1, 8192, 1024, 1024, 1024, 1024]
    - [206, 72944.0]
  - - [1024, 1024, 1, 9600, 1024, 1024, 1024, 1024]
    - [225, 76306.0]
  - - [1024, 4096, 1, 8192, 1024, 1024, 1024, 4096]
    - [129, 103868.0]
  - - [1024, 4096, 1, 9600, 1024, 1024, 1024, 4096]
    - [129, 104792.0]
  - - [1024, 33712, 1, 8192, 1024, 1024, 1024, 33712]
    - [193, 116136.0]
  - - [1024, 33712, 1, 9600, 1024, 1024, 1024, 33712]
    - [99, 116868.0]
  - - [4096, 1024, 1, 8192, 4096, 4096, 4096, 1024]
    - [15, 100797.0]
  - - [4096, 1024, 1, 9600, 4096, 4096, 4096, 1024]
    - [41, 101271.0]
  - - [1024, 1024, 1, 10064, 1024, 1024, 1024, 1024]
    - [215, 75767.0]
  - - [1024, 1024, 1, 10080, 1024, 1024, 1024, 1024]
    - [225, 76282.0]
  - - [1024, 1024, 1, 10200, 1024, 1024, 1024, 1024]
    - [250, 74982.0]
  - - [1024, 1024, 1, 3840, 1024, 1024, 1024, 1024]
    - [104, 62138.0]
  - - [1024, 1024, 1, 3968, 1024, 1024, 1024, 1024]
    - [175, 62662.0]
  - - [1024, 1024, 1, 6528, 1024, 1024, 1024, 1024]
    - [203, 66690.0]
  - - [1024, 1024, 1, 7104, 1024, 1024, 1024, 1024]
    - [207, 69229.0]
  - - [1024, 1024, 1, 7200, 1024, 1024, 1024, 1024]
    - [225, 70956.0]
  - - [1024, 1024, 1, 8064, 1024, 1024, 1024, 1024]
    - [225, 71853.0]
  - - [1024, 1024, 1, 8160, 1024, 1024, 1024, 1024]
    - [225, 72218.0]
  - - [1024, 1024, 1, 9216, 1024, 1024, 1024, 1024]
    - [214, 75356.0]
  - - [1024, 1024, 1, 9520, 1024, 1024, 1024, 1024]
    - [265, 74674.0]
  - - [1024, 4096, 1, 10064, 1024, 1024, 1024, 4096]
    - [129, 104215.0]
  - - [1024, 4096, 1, 10080, 1024, 1024, 1024, 4096]
    - [129, 104484.0]
  - - [1024, 4096, 1, 10200, 1024, 1024, 1024, 4096]
    - [129, 104001.0]
  - - [1024, 4096, 1, 3840, 1024, 1024, 1024, 4096]
    - [166, 96606.0]
  - - [1024, 4096, 1, 3968, 1024, 1024, 1024, 4096]
    - [129, 97441.0]
  - - [1024, 4096, 1, 6528, 1024, 1024, 1024, 4096]
    - [129, 102257.0]
  - - [1024, 4096, 1, 7104, 1024, 1024, 1024, 4096]
    - [129, 102859.0]
  - - [1024, 4096, 1, 7200, 1024, 1024, 1024, 4096]
    - [129, 102578.0]
  - - [1024, 4096, 1, 8064, 1024, 1024, 1024, 4096]
    - [166, 103497.0]
  - - [1024, 4096, 1, 8160, 1024, 1024, 1024, 4096]
    - [166, 103014.0]
  - - [1024, 4096, 1, 9216, 1024, 1024, 1024, 4096]
    - [166, 103866.0]
  - - [1024, 4096, 1, 9520, 1024, 1024, 1024, 4096]
    - [129, 103252.0]
  - - [1024, 42720, 1, 10080, 1024, 1024, 1024, 42720]
    - [129, 124450.0]
  - - [1024, 42720, 1, 3968, 1024, 1024, 1024, 42720]
    - [129, 122336.0]
  - - [1024, 42720, 1, 6528, 1024, 1024, 1024, 42720]
    - [129, 124520.0]
  - - [1024, 42720, 1, 7104, 1024, 1024, 1024, 42720]
    - [152, 124096.0]
  - - [1024, 42720, 1, 7200, 1024, 1024, 1024, 42720]
    - [129, 124417.0]
  - - [1024, 42720, 1, 9520, 1024, 1024, 1024, 42720]
    - [129, 123768.0]
  - - [4096, 1024, 1, 10064, 4096, 4096, 4096, 1024]
    - [15, 100772.0]
  - - [4096, 1024, 1, 10080, 4096, 4096, 4096, 1024]
    - [15, 101964.0]
  - - [4096, 1024, 1, 10200, 4096, 4096, 4096, 1024]
    - [153, 102017.0]
  - - [4096, 1024, 1, 3840, 4096, 4096, 4096, 1024]
    - [129, 96884.0]
  - - [4096, 1024, 1, 3968, 4096, 4096, 4096, 1024]
    - [129, 96492.0]
  - - [4096, 1024, 1, 6528, 4096, 4096, 4096, 1024]
    - [15, 98860.0]
  - - [4096, 1024, 1, 7104, 4096, 4096, 4096, 1024]
    - [15, 99507.0]
  - - [4096, 1024, 1, 7200, 4096, 4096, 4096, 1024]
    - [129, 100289.0]
  - - [4096, 1024, 1, 8064, 4096, 4096, 4096, 1024]
    - [153, 101339.0]
  - - [4096, 1024, 1, 8160, 4096, 4096, 4096, 1024]
    - [15, 100285.0]
  - - [4096, 1024, 1, 9216, 4096, 4096, 4096, 1024]
    - [153, 102652.0]
  - - [4096, 1024, 1, 9520, 4096, 4096, 4096, 1024]
    - [15, 100508.0]
  - - [24, 64, 4736, 24, 24, 24, 24, 303104]
    - [106, 5429.0]
  - - [32, 64, 4608, 32, 32, 32, 32, 294912]
    - [169, 10013.0]
  - - [32, 64, 4608, 35, 32, 32, 32, 294912]
    - [176, 7590.0]
  - - [64, 14, 10880, 14, 64, 64, 696320, 14]
    - [341, 2853.0]
  - - [64, 15, 10880, 14, 64, 64, 696320, 15]
    - [351, 2967.0]
  - - [64, 15, 7680, 15, 64, 64, 491520, 15]
    - [355, 2986.0]
  - - [64, 15, 10880, 15, 64, 64, 696320, 15]
    - [349, 3114.0]
  - - [64, 17, 7680, 15, 64, 64, 491520, 17]
    - [37, 3278.0]
  - - [64, 17, 6144, 17, 64, 64, 393216, 17]
    - [107, 2875.0]
  - - [64, 17, 7680, 17, 64, 64, 491520, 17]
    - [95, 3258.0]
  - - [64, 21, 6144, 17, 64, 64, 393216, 21]
    - [155, 3461.0]
  - - [64, 21, 6144, 21, 64, 64, 393216, 21]
    - [91, 4129.0]
  - - [64, 24, 4736, 24, 64, 64, 303104, 24]
    - [148, 5654.0]
  - - [64, 30, 2048, 30, 64, 64, 131072, 30]
    - [55, 6439.0]
  - - [64, 30, 2048, 31, 64, 64, 131072, 30]
    - [148, 6683.0]
  - - [64, 31, 2048, 31, 64, 64, 131072, 31]
    - [163, 6876.0]
  - - [64, 32, 4608, 32, 64, 64, 294912, 32]
    - [133, 10040.0]
  - - [64, 32, 4608, 35, 64, 64, 294912, 32]
    - [186, 7618.0]
  - - [64, 34, 4736, 24, 64, 64, 303104, 34]
    - [147, 6159.0]
  - - [64, 34, 4736, 34, 64, 64, 303104, 34]
    - [147, 7030.0]
  - - [64, 35, 4608, 35, 64, 64, 294912, 35]
    - [67, 7123.0]
  - - [512, 64, 1, 512, 512, 512, 512, 64]
    - [49, 1924.0]
  - - [64, 512, 1, 512, 64, 64, 64, 512]
    - [49, 1907.0]
  - - [64, 128, 1, 128, 64, 64, 64, 128]
    - [31, 190.0]
  - - [128, 64, 1, 128, 128, 128, 128, 64]
    - [145, 193.0]
  - - [2048, 2048, 1, 512, 2048, 2048, 2048, 2048]
    - [121, 73143.0]
  - - [1024, 64, 1, 512, 1024, 1024, 1024, 64]
    - [42, 3848.0]
  - - [2048, 512, 1, 1, 2048, 2048, 2048, 512]
    - [67, 257.0]
  - - [1600, 1024, 1, 512, 1600, 1600, 1600, 1024]
    - [137, 43151.0]
  - - [512, 32, 1, 1600, 512, 512, 512, 32]
    - [229, 2540.0]
  - - [560, 1024, 1, 1600, 560, 560, 560, 1024]
    - [174, 34032.0]
  - - [1024, 1600, 1, 1, 1024, 1024, 1024, 1600]
    - [0, 366.0]
  - - [1024, 1024, 1, 1600, 1024, 1024, 1024, 1024]
    - [66, 51150.0]
  - - [512, 512, 1, 1600, 512, 512, 512, 512]
    - [205, 22029.0]
  - - [256, 1280, 1, 8976, 256, 256, 256, 1280]
    - [241, 53830.0]
  - - [256, 2560, 1, 8976, 256, 256, 256, 2560]
    - [226, 70365.0]
  - - [256, 2816, 1, 8976, 256, 256, 256, 2816]
    - [231, 70951.0]
  - - [256, 3328, 1, 8976, 256, 256, 256, 3328]
    - [198, 73306.0]
  - - [256, 3584, 1, 8976, 256, 256, 256, 3584]
    - [198, 75806.0]
  - - [256, 3840, 1, 8976, 256, 256, 256, 3840]
    - [232, 78896.0]
  - - [256, 4096, 1, 8976, 256, 256, 256, 4096]
    - [207, 74604.0]
  - - [256, 4352, 1, 8976, 256, 256, 256, 4352]
    - [214, 77593.0]
  - - [256, 4864, 1, 8976, 256, 256, 256, 4864]
    - [227, 87373.0]
  - - [256, 5120, 1, 8976, 256, 256, 256, 5120]
    - [224, 91287.0]
  - - [256, 5632, 1, 8976, 256, 256, 256, 5632]
    - [202, 88835.0]
  - - [256, 5888, 1, 8976, 256, 256, 256, 5888]
    - [219, 86863.0]
  - - [256, 6144, 1, 8976, 256, 256, 256, 6144]
    - [222, 90454.0]
  - - [256, 7168, 1, 8976, 256, 256, 256, 7168]
    - [201, 93288.0]
  - - [256, 8192, 1, 8976, 256, 256, 256, 8192]
    - [196, 88459.0]
  - - [256, 8960, 1, 8976, 256, 256, 256, 8960]
    - [195, 94305.0]
  - - [256, 9728, 1, 8976, 256, 256, 256, 9728]
    - [223, 93670.0]
  - - [256, 9984, 1, 8976, 256, 256, 256, 9984]
    - [208, 95654.0]
  - - [256, 10240, 1, 8976, 256, 256, 256, 10240]
    - [217, 97554.0]
  - - [256, 10496, 1, 8976, 256, 256, 256, 10496]
    - [213, 85019.0]
  - - [256, 11008, 1, 8976, 256, 256, 256, 11008]
    - [27, 87055.0]
  - - [256, 11264, 1, 8976, 256, 256, 256, 11264]
    - [27, 89080.0]
  - - [256, 11520, 1, 8976, 256, 256, 256, 11520]
    - [63, 91004.0]
  - - [256, 11776, 1, 8976, 256, 256, 256, 11776]
    - [27, 92898.0]
  - - [256, 12544, 1, 8976, 256, 256, 256, 12544]
    - [85, 98713.0]
  - - [256, 12800, 1, 8976, 256, 256, 256, 12800]
    - [85, 100590.0]
  - - [256, 13312, 1, 8976, 256, 256, 256, 13312]
    - [158, 106835.0]
  - - [256, 13568, 1, 8976, 256, 256, 256, 13568]
    - [159, 109317.0]
  - - [256, 14336, 1, 8976, 256, 256, 256, 14336]
    - [159, 115214.0]
  - - [256, 14848, 1, 8976, 256, 256, 256, 14848]
    - [29, 118963.0]
  - - [256, 15104, 1, 8976, 256, 256, 256, 15104]
    - [172, 120778.0]
  - - [256, 15872, 1, 8976, 256, 256, 256, 15872]
    - [127, 111193.0]
  - - [256, 16128, 1, 8976, 256, 256, 256, 16128]
    - [127, 112877.0]
  - - [256, 17152, 1, 8976, 256, 256, 256, 17152]
    - [127, 117833.0]
  - - [256, 17408, 1, 8976, 256, 256, 256, 17408]
    - [152, 109556.0]
  - - [256, 18688, 1, 8976, 256, 256, 256, 18688]
    - [129, 117252.0]
  - - [256, 19968, 1, 8976, 256, 256, 256, 19968]
    - [26, 93962.0]
  - - [256, 20480, 1, 8976, 256, 256, 256, 20480]
    - [84, 94361.0]
  - - [256, 20992, 1, 8976, 256, 256, 256, 20992]
    - [138, 97914.0]
  - - [256, 21248, 1, 8976, 256, 256, 256, 21248]
    - [138, 95420.0]
  - - [256, 22016, 1, 8976, 256, 256, 256, 22016]
    - [84, 98087.0]
  - - [256, 26112, 1, 8976, 256, 256, 256, 26112]
    - [151, 107668.0]
  - - [256, 32512, 1, 8976, 256, 256, 256, 32512]
    - [77, 112770.0]
  - - [256, 33536, 1, 8976, 256, 256, 256, 33536]
    - [77, 116518.0]
  - - [256, 44505, 1, 8976, 256, 256, 256, 44505]
    - [159, 117095.0]
  - - [480, 1024, 1, 32768, 480, 480, 480, 1024]
    - [259, 93466.0]
  - - [512, 32, 1, 200, 512, 512, 512, 32]
    - [13, 418.0]
  - - [512, 512, 1, 200, 512, 512, 512, 512]
    - [7, 6687.0]
  - - [512, 2048, 1, 256, 512, 512, 512, 2048]
    - [135, 25614.0]
  - - [560, 1024, 1, 200, 560, 560, 560, 1024]
    - [45, 11947.0]
  - - [768, 2048, 1, 256, 768, 768, 768, 2048]
    - [83, 35445.0]
  - - [1024, 64, 1, 960, 1024, 1024, 1024, 64]
    - [216, 5009.0]
  - - [1024, 256, 1, 1024, 1024, 1024, 1024, 256]
    - [65, 16289.0]
  - - [1024, 256, 1, 1280, 1024, 1024, 1024, 256]
    - [173, 17332.0]
  - - [1024, 256, 1, 2304, 1024, 1024, 1024, 256]
    - [233, 24276.0]
  - - [1024, 256, 1, 2816, 1024, 1024, 1024, 256]
    - [230, 28047.0]
  - - [1024, 256, 1, 3072, 1024, 1024, 1024, 256]
    - [230, 29178.0]
  - - [1024, 256, 1, 3328, 1024, 1024, 1024, 256]
    - [235, 30633.0]
  - - [1024, 256, 1, 3584, 1024, 1024, 1024, 256]
    - [236, 31485.0]
  - - [1024, 256, 1, 4096, 1024, 1024, 1024, 256]
    - [243, 34327.0]
  - - [1024, 256, 1, 4352, 1024, 1024, 1024, 256]
    - [243, 36660.0]
  - - [1024, 256, 1, 4608, 1024, 1024, 1024, 256]
    - [247, 37283.0]
  - - [1024, 256, 1, 5120, 1024, 1024, 1024, 256]
    - [249, 38926.0]
  - - [1024, 256, 1, 5376, 1024, 1024, 1024, 256]
    - [243, 40873.0]
  - - [1024, 256, 1, 5632, 1024, 1024, 1024, 256]
    - [242, 41379.0]
  - - [1024, 256, 1, 6144, 1024, 1024, 1024, 256]
    - [247, 43111.0]
  - - [1024, 256, 1, 6400, 1024, 1024, 1024, 256]
    - [254, 44337.0]
  - - [1024, 256, 1, 7680, 1024, 1024, 1024, 256]
    - [246, 47663.0]
  - - [1024, 256, 1, 7936, 1024, 1024, 1024, 256]
    - [242, 49251.0]
  - - [1024, 256, 1, 8192, 1024, 1024, 1024, 256]
    - [242, 49345.0]
  - - [1024, 256, 1, 8448, 1024, 1024, 1024, 256]
    - [252, 50793.0]
  - - [1024, 256, 1, 9728, 1024, 1024, 1024, 256]
    - [248, 52343.0]
  - - [1024, 256, 1, 9984, 1024, 1024, 1024, 256]
    - [261, 52852.0]
  - - [1024, 256, 1, 10496, 1024, 1024, 1024, 256]
    - [243, 53572.0]
  - - [1024, 256, 1, 11520, 1024, 1024, 1024, 256]
    - [238, 56426.0]
  - - [1024, 256, 1, 12032, 1024, 1024, 1024, 256]
    - [271, 58151.0]
  - - [1024, 256, 1, 13568, 1024, 1024, 1024, 256]
    - [266, 61578.0]
  - - [1024, 256, 1, 14336, 1024, 1024, 1024, 256]
    - [266, 63310.0]
  - - [1024, 256, 1, 14848, 1024, 1024, 1024, 256]
    - [266, 64357.0]
  - - [1024, 256, 1, 15104, 1024, 1024, 1024, 256]
    - [275, 65122.0]
  - - [1024, 256, 1, 15872, 1024, 1024, 1024, 256]
    - [275, 66679.0]
  - - [1024, 256, 1, 16128, 1024, 1024, 1024, 256]
    - [266, 66226.0]
  - - [1024, 256, 1, 17152, 1024, 1024, 1024, 256]
    - [271, 67797.0]
  - - [1024, 256, 1, 17408, 1024, 1024, 1024, 256]
    - [275, 68314.0]
  - - [1024, 256, 1, 18944, 1024, 1024, 1024, 256]
    - [271, 71598.0]
  - - [1024, 256, 1, 19712, 1024, 1024, 1024, 256]
    - [271, 71929.0]
  - - [1024, 256, 1, 19968, 1024, 1024, 1024, 256]
    - [266, 73026.0]
  - - [1024, 256, 1, 21248, 1024, 1024, 1024, 256]
    - [275, 73991.0]
  - - [1024, 256, 1, 21504, 1024, 1024, 1024, 256]
    - [270, 72569.0]
  - - [1024, 256, 1, 22016, 1024, 1024, 1024, 256]
    - [271, 76180.0]
  - - [1024, 256, 1, 28672, 1024, 1024, 1024, 256]
    - [266, 83886.0]
  - - [1024, 256, 1, 33536, 1024, 1024, 1024, 256]
    - [266, 85319.0]
  - - [1024, 1024, 1, 960, 1024, 1024, 1024, 1024]
    - [115, 43092.0]
  - - [1600, 1024, 1, 960, 1600, 1600, 1600, 1024]
    - [59, 57153.0]
  - - [2048, 256, 1, 1024, 2048, 2048, 2048, 256]
    - [87, 29959.0]
  - - [2048, 960, 1, 1, 2048, 2048, 2048, 960]
    - [2, 410.0]
  - - [2048, 2048, 1, 960, 2048, 2048, 2048, 2048]
    - [121, 81311.0]
  - - [2048, 2048, 1, 1024, 2048, 2048, 2048, 2048]
    - [164, 78952.0]
  - - [3200, 2048, 1, 1024, 3200, 3200, 3200, 2048]
    - [158, 88394.0]
  - - [4096, 4096, 1, 1024, 4096, 4096, 4096, 4096]
    - [101, 94644.0]
  - - [2048, 2, 1, 2, 2048, 2048, 2048, 2]
    - [3, 2.0]
  - - [2048, 2048, 1, 2, 2048, 2048, 1048576, 2048]
    - [92, 1116.0]
  - - [2048, 30592, 1, 1024, 2048, 2048, 2048, 30592]
    - [86, 110158.0]
  - - [2048, 6144, 1, 1024, 2048, 2048, 2048, 6144]
    - [141, 91930.0]
  - - [2048, 8192, 1, 1024, 2048, 2048, 2048, 8192]
    - [27, 94603.0]
  - - [8192, 2048, 1, 1024, 8192, 8192, 8192, 2048]
    - [112, 94811.0]
  - - [1024, 1024, 1, 16, 1024, 1024, 524288, 1024]
    - [191, 4194.0]
  - - [1024, 2, 1, 16, 1024, 1024, 1024, 2]
    - [10, 7.0]
  - - [1024, 30592, 1, 8192, 1024, 1024, 1024, 30592]
    - [9, 126291.0]
  - - [1024, 3072, 1, 8192, 1024, 1024, 1024, 3072]
    - [172, 97939.0]
  - - [512, 64, 256, 512, 512, 512, 512, 64]
    - [2, 45306.0]
  - - [64, 512, 256, 512, 64, 64, 64, 512]
    - [46, 45002.0]
  - - [1024, 30592, 1, 2048, 1024, 1024, 1024, 30592]
    - [82, 117141.0]
  - - [1024, 3072, 1, 2048, 1024, 1024, 1024, 3072]
    - [27, 84325.0]
  - - [1024, 1024, 1, 8, 1024, 1024, 524288, 1024]
    - [0, 1808.0]
  - - [1024, 30592, 1, 4096, 1024, 1024, 1024, 30592]
    - [86, 122923.0]
  - - [1024, 3072, 1, 4096, 1024, 1024, 1024, 3072]
    - [172, 92830.0]
  - - [512, 64, 128, 512, 512, 512, 512, 64]
    - [70, 39768.0]
  - - [64, 512, 128, 512, 64, 64, 64, 512]
    - [135, 40065.0]
  - - [2560, 1920, 1, 2048, 2560, 2560, 2560, 1920]
    - [78, 116293.0]
  - - [2560, 2, 1, 4, 2560, 2560, 2560, 2]
    - [355, 6.0]
  - - [2560, 2560, 1, 2048, 2560, 2560, 2560, 2560]
    - [27, 99039.0]
  - - [2560, 2560, 1, 4, 2560, 2560, 1310720, 2560]
    - [74, 2374.0]
  - - [2560, 7680, 1, 2048, 2560, 2560, 2560, 7680]
    - [129, 119128.0]
  - - [640, 2560, 1, 2048, 640, 640, 640, 2560]
    - [88, 72692.0]
  - - [512, 64, 40, 512, 512, 512, 512, 64]
    - [137, 35849.0]
  - - [64, 512, 40, 512, 64, 64, 64, 512]
    - [24, 36003.0]
  - - [1536, 1536, 1, 4096, 1536, 1536, 1536, 1536]
    - [14, 86098.0]
  - - [1536, 4608, 1, 4096, 1536, 1536, 1536, 4608]
    - [86, 112125.0]
  - - [1536, 50304, 1, 4096, 1536, 1536, 1536, 50304]
    - [102, 122308.0]
  - - [1536, 6144, 1, 4096, 1536, 1536, 1536, 6144]
    - [129, 114688.0]
  - - [6144, 1536, 1, 4096, 6144, 6144, 6144, 1536]
    - [129, 114444.0]
  - - [1024, 96, 64, 1024, 1024, 1024, 1024, 96]
    - [34, 64476.0]
  - - [96, 1024, 64, 1024, 96, 96, 96, 1024]
    - [47, 62282.0]
  - - [1536, 1536, 1, 8192, 1536, 1536, 1536, 1536]
    - [200, 95832.0]
  - - [1536, 4608, 1, 8192, 1536, 1536, 1536, 4608]
    - [48, 114643.0]
  - - [1536, 50304, 1, 8192, 1536, 1536, 1536, 50304]
    - [141, 124848.0]
  - - [1536, 6144, 1, 8192, 1536, 1536, 1536, 6144]
    - [129, 119231.0]
  - - [6144, 1536, 1, 8192, 6144, 6144, 6144, 1536]
    - [129, 118923.0]
  - - [1024, 96, 128, 1024, 1024, 1024, 1024, 96]
    - [89, 70179.0]
  - - [96, 1024, 128, 1024, 96, 96, 96, 1024]
    - [62, 69036.0]
  - - [1024, 1024, 1, 16384, 1024, 1024, 1024, 1024]
    - [244, 88556.0]
  - - [1024, 3072, 1, 16384, 1024, 1024, 1024, 3072]
    - [140, 100994.0]
  - - [1024, 4096, 1, 16384, 1024, 1024, 1024, 4096]
    - [129, 105024.0]
  - - [1024, 50304, 1, 16384, 1024, 1024, 1024, 50304]
    - [129, 121935.0]
  - - [4096, 1024, 1, 16384, 4096, 4096, 4096, 1024]
    - [15, 104272.0]
  - - [1024, 64, 256, 1024, 1024, 1024, 1024, 64]
    - [28, 54052.0]
  - - [64, 1024, 256, 1024, 64, 64, 64, 1024]
    - [136, 54120.0]
  - - [1024, 50304, 1, 2048, 1024, 1024, 1024, 50304]
    - [152, 113474.0]
  - - [1024, 64, 32, 1024, 1024, 1024, 1024, 64]
    - [130, 45040.0]
  - - [64, 1024, 32, 1024, 64, 64, 64, 1024]
    - [38, 44443.0]
  - - [1024, 50304, 1, 4096, 1024, 1024, 1024, 50304]
    - [152, 118209.0]
  - - [1024, 64, 64, 1024, 1024, 1024, 1024, 64]
    - [25, 47427.0]
  - - [64, 1024, 64, 1024, 64, 64, 64, 1024]
    - [113, 47637.0]
  - - [1024, 50304, 1, 8192, 1024, 1024, 1024, 50304]
    - [78, 120643.0]
  - - [1024, 64, 128, 1024, 1024, 1024, 1024, 64]
    - [124, 53129.0]
  - - [64, 1024, 128, 1024, 64, 64, 64, 1024]
    - [46, 52712.0]
  - - [1024, 2, 1, 64, 1024, 1024, 1024, 2]
    - [343, 26.0]
  - - [1024, 30528, 1, 8192, 1024, 1024, 1024, 30528]
    - [141, 125297.0]
  - - [1024, 1024, 1, 64, 1024, 1024, 131072, 1024]
    - [134, 12157.0]
  - - [64, 128, 1024, 128, 64, 64, 64, 128]
    - [68, 25961.0]
  - - [128, 64, 1024, 128, 128, 128, 128, 64]
    - [118, 26421.0]
  - - [1024, 1024, 1, 3456, 1024, 1024, 1024, 1024]
    - [104, 61214.0]
  - - [1024, 1024, 1, 6912, 1024, 1024, 1024, 1024]
    - [218, 69317.0]
  - - [1024, 1024, 1, 864, 1024, 1024, 1024, 1024]
    - [125, 35389.0]
  - - [1024, 512, 1, 3456, 1024, 1024, 1024, 512]
    - [228, 43389.0]
  - - [1024, 512, 1, 4096, 1024, 1024, 1024, 512]
    - [204, 47260.0]
  - - [1024, 512, 1, 6912, 1024, 1024, 1024, 512]
    - [256, 59761.0]
  - - [1024, 512, 1, 864, 1024, 1024, 1024, 512]
    - [97, 23398.0]
  - - [256, 128, 1, 3456, 256, 256, 256, 128]
    - [239, 8632.0]
  - - [256, 128, 1, 4096, 256, 256, 256, 128]
    - [268, 9927.0]
  - - [256, 128, 1, 55296, 256, 256, 256, 128]
    - [272, 37313.0]
  - - [256, 128, 1, 6912, 256, 256, 256, 128]
    - [269, 14519.0]
  - - [256, 128, 1, 864, 256, 256, 256, 128]
    - [221, 2583.0]
  - - [256, 3456, 1, 1, 256, 256, 256, 3456]
    - [4, 217.0]
  - - [256, 4096, 1, 1, 256, 256, 256, 4096]
    - [11, 238.0]
  - - [256, 6912, 1, 1, 256, 256, 256, 6912]
    - [35, 357.0]
  - - [256, 864, 1, 1, 256, 256, 256, 864]
    - [22, 75.0]
  - - [480, 1024, 1, 3456, 480, 480, 480, 1024]
    - [212, 46362.0]
  - - [480, 1024, 1, 4096, 480, 480, 480, 1024]
    - [212, 48771.0]
  - - [480, 1024, 1, 6912, 480, 480, 480, 1024]
    - [240, 60929.0]
  - - [480, 1024, 1, 864, 480, 480, 480, 1024]
    - [23, 22211.0]
  - - [512, 256, 1, 3456, 512, 512, 512, 256]
    - [251, 23398.0]
  - - [512, 256, 1, 4096, 512, 512, 512, 256]
    - [253, 26317.0]
  - - [512, 256, 1, 55296, 512, 512, 512, 256]
    - [276, 74138.0]
  - - [512, 256, 1, 6912, 512, 512, 512, 256]
    - [245, 34421.0]
  - - [512, 256, 1, 864, 512, 512, 512, 256]
    - [209, 8632.0]
  - - [30528, 1024, 1, 640, 30528, 30528, 30528, 1024]
    - [94, 99874.0]
  - - [1024, 1024, 1, 32, 1024, 1024, 1024, 1024]
    - [125, 7358.0]
  - - [30528, 1024, 1, 1280, 30528, 30528, 30528, 1024]
    - [181, 111272.0]
  - - [1024, 1024, 1, 64, 1024, 1024, 1024, 1024]
    - [170, 12336.0]
  - - [4096, 1024, 1, 10240, 4096, 4096, 4096, 1024]
    - [15, 103503.0]
  - - [1024, 4096, 1, 10240, 1024, 1024, 1024, 4096]
    - [129, 105145.0]
  - - [30528, 1024, 1, 1600, 30528, 30528, 30528, 1024]
    - [190, 115268.0]
  - - [1024, 2, 1, 80, 1024, 1024, 1024, 2]
    - [341, 31.0]
  - - [1024, 1024, 1, 10240, 1024, 1024, 1024, 1024]
    - [203, 77048.0]
  - - [1024, 1024, 1, 80, 1024, 1024, 1024, 1024]
    - [122, 13443.0]
  - - [64, 128, 1280, 128, 64, 64, 64, 128]
    - [117, 26973.0]
  - - [128, 64, 1280, 128, 128, 128, 128, 64]
    - [53, 26421.0]
  - - [1024, 4096, 1, 10496, 1024, 1024, 1024, 4096]
    - [129, 103574.0]
  - - [30528, 1024, 1, 1640, 30528, 30528, 30528, 1024]
    - [190, 111937.0]
  - - [4096, 1024, 1, 10496, 4096, 4096, 4096, 1024]
    - [15, 102724.0]
  - - [1024, 1024, 1, 10496, 1024, 1024, 1024, 1024]
    - [264, 77506.0]
  - - [1024, 1024, 1, 82, 1024, 1024, 1024, 1024]
    - [71, 11683.0]
  - - [1024, 2, 1, 82, 1024, 1024, 1024, 2]
    - [355, 29.0]
  - - [128, 64, 1312, 128, 128, 128, 128, 64]
    - [90, 26538.0]
  - - [64, 128, 1312, 128, 64, 64, 64, 128]
    - [52, 27039.0]
  - - [30528, 1024, 1, 160, 30528, 30528, 30528, 1024]
    - [151, 63217.0]
  - - [1024, 4096, 1, 6144, 1024, 1024, 1024, 4096]
    - [129, 102066.0]
  - - [30528, 1024, 1, 240, 30528, 30528, 30528, 1024]
    - [192, 72587.0]
  - - [4096, 1024, 1, 6144, 4096, 4096, 4096, 1024]
    - [15, 98508.0]
  - - [1024, 1024, 1, 12, 1024, 1024, 1024, 1024]
    - [0, 2458.0]
  - - [1024, 2, 1, 12, 1024, 1024, 1024, 2]
    - [3, 5.0]
  - - [1024, 1024, 1, 6144, 1024, 1024, 1024, 1024]
    - [210, 65847.0]
  - - [64, 512, 192, 512, 64, 64, 64, 512]
    - [68, 44345.0]
  - - [512, 64, 192, 512, 512, 512, 512, 64]
    - [137, 43296.0]
  - - [3136, 64, 64, 128, 3136, 3136, 3136, 64]
    - [35, 32778.0]
  - - [3136, 64, 64, 256, 3136, 3136, 3136, 64]
    - [19, 41688.0]
  - - [3136, 128, 64, 256, 3136, 3136, 3136, 128]
    - [26, 66782.0]
  - - [784, 256, 64, 512, 784, 784, 784, 256]
    - [131, 77702.0]
  - - [3136, 256, 64, 128, 3136, 3136, 3136, 256]
    - [188, 66673.0]
  - - [3136, 256, 64, 256, 3136, 3136, 3136, 256]
    - [131, 85767.0]
  - - [784, 512, 64, 256, 784, 784, 784, 512]
    - [21, 72558.0]
  - - [784, 512, 64, 512, 784, 784, 784, 512]
    - [81, 84663.0]
  - - [3136, 64, 32, 128, 3136, 3136, 3136, 64]
    - [56, 29614.0]
  - - [3136, 64, 32, 256, 3136, 3136, 3136, 64]
    - [69, 38851.0]
  - - [3136, 128, 32, 256, 3136, 3136, 3136, 128]
    - [84, 62947.0]
  - - [784, 256, 32, 512, 784, 784, 784, 256]
    - [26, 69199.0]
  - - [3136, 256, 32, 128, 3136, 3136, 3136, 256]
    - [60, 59571.0]
  - - [3136, 256, 32, 256, 3136, 3136, 3136, 256]
    - [26, 78443.0]
  - - [784, 512, 32, 256, 784, 784, 784, 512]
    - [112, 65557.0]
  - - [784, 512, 32, 512, 784, 784, 784, 512]
    - [81, 77775.0]
  - - [3136, 256, 32, 64, 3136, 3136, 3136, 256]
    - [60, 39372.0]
  - - [3136, 64, 32, 64, 3136, 3136, 3136, 64]
    - [23, 23249.0]
  - - [784, 512, 32, 128, 784, 784, 784, 512]
    - [20, 50872.0]
  - - [784, 128, 32, 512, 784, 784, 784, 128]
    - [84, 61904.0]
  - - [3136, 64, 64, 64, 3136, 3136, 3136, 64]
    - [45, 26622.0]
  - - [3136, 256, 64, 64, 3136, 3136, 3136, 256]
    - [54, 42683.0]
  - - [784, 128, 64, 512, 784, 784, 784, 128]
    - [84, 67495.0]
  - - [784, 512, 64, 128, 784, 784, 784, 512]
    - [188, 57089.0]
  - - [64, 1280, 64, 192, 64, 64, 64, 1280]
    - [1, 36367.0]
  - - [64, 1280, 64, 320, 64, 64, 64, 1280]
    - [36, 42539.0]
  - - [64, 1280, 64, 384, 64, 64, 64, 1280]
    - [135, 44306.0]
  - - [64, 1280, 64, 448, 64, 64, 64, 1280]
    - [24, 46309.0]
  - - [64, 2048, 64, 192, 64, 64, 64, 2048]
    - [123, 38348.0]
  - - [64, 2048, 64, 320, 64, 64, 64, 2048]
    - [68, 43577.0]
  - - [64, 2048, 64, 384, 64, 64, 64, 2048]
    - [171, 44889.0]
  - - [64, 2048, 64, 448, 64, 64, 64, 2048]
    - [24, 46976.0]
  - - [64, 1280, 32, 192, 64, 64, 64, 1280]
    - [18, 34008.0]
  - - [64, 1280, 32, 320, 64, 64, 64, 1280]
    - [18, 40960.0]
  - - [64, 1280, 32, 384, 64, 64, 64, 1280]
    - [18, 42510.0]
  - - [64, 1280, 32, 448, 64, 64, 64, 1280]
    - [80, 44893.0]
  - - [64, 2048, 32, 192, 64, 64, 64, 2048]
    - [72, 33780.0]
  - - [64, 2048, 32, 320, 64, 64, 64, 2048]
    - [24, 39017.0]
  - - [64, 2048, 32, 384, 64, 64, 64, 2048]
    - [156, 41003.0]
  - - [64, 2048, 32, 448, 64, 64, 64, 2048]
    - [156, 42245.0]
  - - [1024, 1024, 1, 10224, 1024, 1024, 1024, 1024]
    - [263, 76227.0]
  - - [1024, 1024, 1, 10192, 1024, 1024, 1024, 1024]
    - [255, 76249.0]
  - - [1024, 1024, 1, 10208, 1024, 1024, 1024, 1024]
    - [206, 77072.0]
  - - [1024, 4096, 1, 10224, 1024, 1024, 1024, 4096]
    - [129, 104205.0]
  - - [4096, 1024, 1, 10224, 4096, 4096, 4096, 1024]
    - [15, 101521.0]
  - - [1024, 3072, 1, 10224, 1024, 1024, 1024, 3072]
    - [140, 97484.0]
  - - [1024, 3072, 1, 10240, 1024, 1024, 1024, 3072]
    - [140, 99298.0]
  - - [4096, 1024, 1, 10192, 4096, 4096, 4096, 1024]
    - [41, 100916.0]
  - - [1024, 3072, 1, 10192, 1024, 1024, 1024, 3072]
    - [126, 97155.0]
  - - [1024, 4096, 1, 10192, 1024, 1024, 1024, 4096]
    - [129, 104223.0]
  - - [1024, 3072, 1, 10200, 1024, 1024, 1024, 3072]
    - [140, 97161.0]
  - - [1024, 1024, 1, 10184, 1024, 1024, 1024, 1024]
    - [225, 76233.0]
  - - [4096, 1024, 1, 10208, 4096, 4096, 4096, 1024]
    - [15, 101228.0]
  - - [1024, 3072, 1, 10208, 1024, 1024, 1024, 3072]
    - [140, 99036.0]
  - - [1024, 4096, 1, 10208, 1024, 1024, 1024, 4096]
    - [166, 103559.0]
  - - [1024, 2048, 1, 10224, 1024, 1024, 1024, 2048]
    - [199, 87472.0]
  - - [1024, 2048, 1, 10240, 1024, 1024, 1024, 2048]
    - [200, 90933.0]
  - - [1024, 1024, 1, 10120, 1024, 1024, 1024, 1024]
    - [214, 76806.0]
  - - [1024, 2048, 1, 10192, 1024, 1024, 1024, 2048]
    - [197, 87858.0]
  - - [64, 24, 6816, 24, 1308672, 1308672, 436224, 24]
    - [148, 5549.0]
  - - [64, 24, 6816, 24, 1308672, 1308672, 1308672, 24]
    - [107, 5387.0]
  - - [1024, 1024, 1, 10152, 1024, 1024, 1024, 1024]
    - [224, 77183.0]
  - - [1024, 3072, 1, 10080, 1024, 1024, 1024, 3072]
    - [140, 99065.0]
  - - [64, 26, 6272, 26, 1204224, 1204224, 401408, 26]
    - [107, 6003.0]
  - - [64, 26, 6272, 26, 1204224, 1204224, 1204224, 26]
    - [187, 5899.0]
  - - [100352, 256, 1, 512, 100352, 100352, 100352, 256]
    - [44, 94546.0]
  - - [12544, 1024, 1, 2048, 12544, 12544, 12544, 1024]
    - [9, 99405.0]
  - - [12544, 147, 1, 64, 12544, 12544, 12544, 147]
    - [98, 15862.0]
  - - [200704, 256, 1, 512, 200704, 200704, 200704, 256]
    - [180, 99285.0]
  - - [25088, 512, 1, 1024, 25088, 25088, 25088, 512]
    - [114, 93898.0]
  - - [3136, 576, 1, 64, 3136, 3136, 3136, 576]
    - [167, 17410.0]
  - - [50176, 512, 1, 1024, 50176, 50176, 50176, 512]
    - [99, 106143.0]
  - - [6272, 1024, 1, 2048, 6272, 6272, 6272, 1024]
    - [139, 96545.0]
  - - [784, 1152, 1, 128, 784, 784, 784, 1152]
    - [143, 17203.0]
  - - [3136, 256, 128, 128, 3136, 3136, 3136, 256]
    - [177, 70143.0]
  - - [3136, 256, 256, 128, 3136, 3136, 3136, 256]
    - [182, 72065.0]
  - - [3136, 256, 128, 64, 3136, 3136, 3136, 256]
    - [26, 44849.0]
  - - [3136, 256, 256, 64, 3136, 3136, 3136, 256]
    - [62, 45913.0]
  - - [3136, 64, 128, 256, 3136, 3136, 3136, 64]
    - [19, 43086.0]
  - - [3136, 64, 256, 256, 3136, 3136, 3136, 64]
    - [19, 43739.0]
  - - [3136, 64, 128, 64, 3136, 3136, 3136, 64]
    - [134, 28825.0]
  - - [3136, 64, 256, 64, 3136, 3136, 3136, 64]
    - [23, 30201.0]
  - - [784, 128, 128, 512, 784, 784, 784, 128]
    - [26, 71735.0]
  - - [784, 128, 256, 512, 784, 784, 784, 128]
    - [138, 72977.0]
  - - [784, 512, 128, 128, 784, 784, 784, 512]
    - [81, 61811.0]
  - - [784, 512, 256, 128, 784, 784, 784, 512]
    - [183, 65090.0]
  - - [784, 512, 128, 256, 784, 784, 784, 512]
    - [178, 78480.0]
  - - [784, 512, 256, 256, 784, 784, 784, 512]
    - [178, 81596.0]
  - - [64, 128, 2048, 128, 64, 64, 64, 128]
    - [36, 27475.0]
  - - [128, 64, 2048, 128, 128, 128, 128, 64]
    - [2, 27560.0]
  - - [30528, 1024, 1, 2560, 30528, 30528, 30528, 1024]
    - [151, 119515.0]
  - - [1024, 1024, 1, 128, 1024, 1024, 1024, 1024]
    - [165, 18437.0]
  - - [1024, 2, 1, 128, 1024, 1024, 1024, 2]
    - [345, 46.0]
  - - [128, 64, 1536, 128, 128, 128, 128, 64]
    - [118, 26879.0]
  - - [64, 128, 1536, 128, 64, 64, 64, 128]
    - [1, 27060.0]
  - - [1024, 4096, 1, 12288, 1024, 1024, 1024, 4096]
    - [129, 106083.0]
  - - [30528, 1024, 1, 1920, 30528, 30528, 30528, 1024]
    - [94, 116753.0]
  - - [1024, 1024, 1, 96, 1024, 1024, 1024, 1024]
    - [170, 16556.0]
  - - [1024, 1024, 1, 12288, 1024, 1024, 1024, 1024]
    - [260, 81674.0]
  - - [4096, 1024, 1, 12288, 4096, 4096, 4096, 1024]
    - [41, 101824.0]
  - - [1024, 2, 1, 96, 1024, 1024, 1024, 2]
    - [355, 36.0]
  - - [25600, 128, 25, 128, 25600, 25600, 25600, 128]
    - [5, 58803.0]
  - - [12544, 128, 36, 128, 12544, 12544, 12544, 128]
    - [5, 57911.0]
  - - [9216, 128, 49, 128, 9216, 9216, 9216, 128]
    - [5, 58057.0]
  - - [6400, 128, 64, 128, 6400, 6400, 6400, 128]
    - [5, 57653.0]
  - - [6400, 256, 25, 256, 6400, 6400, 6400, 256]
    - [184, 86459.0]
  - - [4096, 256, 36, 256, 4096, 4096, 4096, 256]
    - [81, 83480.0]
  - - [2304, 256, 49, 256, 2304, 2304, 2304, 256]
    - [26, 80843.0]
  - - [2304, 256, 64, 256, 2304, 2304, 2304, 256]
    - [81, 84002.0]
  - - [2304, 512, 25, 512, 2304, 2304, 2304, 512]
    - [81, 98509.0]
  - - [1024, 512, 36, 512, 1024, 1024, 1024, 512]
    - [131, 94742.0]
  - - [1024, 512, 49, 512, 1024, 1024, 1024, 512]
    - [81, 96829.0]
  - - [1024, 512, 64, 512, 1024, 1024, 1024, 512]
    - [131, 99651.0]
  - - [92416, 64, 25, 64, 92416, 92416, 92416, 64]
    - [2, 30805.0]
  - - [50176, 64, 36, 64, 50176, 50176, 50176, 64]
    - [25, 30797.0]
  - - [36864, 64, 49, 64, 36864, 36864, 36864, 64]
    - [118, 31004.0]
  - - [25600, 64, 64, 64, 25600, 25600, 25600, 64]
    - [2, 31069.0]
  - - [64, 128, 192, 128, 64, 64, 64, 128]
    - [12, 20972.0]
  - - [128, 64, 192, 128, 128, 128, 128, 64]
    - [16, 20295.0]
  - - [768, 2, 1, 2048, 768, 768, 768, 2]
    - [258, 317.0]
  - - [3072, 768, 1, 2048, 3072, 3072, 3072, 768]
    - [128, 83538.0]
  - - [768, 3072, 1, 2048, 768, 768, 768, 3072]
    - [128, 82398.0]
  - - [768, 768, 1, 2048, 768, 768, 768, 768]
    - [32, 39118.0]
  - - [64, 384, 144, 384, 64, 64, 64, 384]
    - [52, 43556.0]
  - - [384, 64, 144, 384, 384, 384, 384, 64]
    - [76, 40158.0]
  - - [768, 2, 1, 4608, 768, 768, 768, 2]
    - [365, 582.0]
  - - [3072, 768, 1, 4608, 3072, 3072, 3072, 768]
    - [128, 90476.0]
  - - [768, 3072, 1, 4608, 768, 768, 768, 3072]
    - [128, 87958.0]
  - - [768, 768, 1, 4608, 768, 768, 768, 768]
    - [211, 56529.0]
  - - [64, 512, 48, 512, 64, 64, 64, 512]
    - [24, 38866.0]
  - - [512, 64, 48, 512, 512, 512, 512, 64]
    - [137, 38275.0]
  - - [64, 128, 256, 128, 64, 64, 64, 128]
    - [17, 22982.0]
  - - [128, 64, 256, 128, 128, 128, 128, 64]
    - [109, 22982.0]
  - - [64, 384, 192, 384, 64, 64, 64, 384]
    - [135, 39390.0]
  - - [384, 64, 192, 384, 384, 384, 384, 64]
    - [73, 42177.0]
  - - [1024, 2, 1, 4608, 1024, 1024, 1024, 2]
    - [362, 715.0]
  - - [4096, 1024, 1, 4608, 4096, 4096, 4096, 1024]
    - [41, 95115.0]
  - - [1024, 4096, 1, 4608, 1024, 1024, 1024, 4096]
    - [129, 99135.0]
  - - [1024, 1024, 1, 4608, 1024, 1024, 1024, 1024]
    - [115, 62849.0]
  - - [13, 512, 1, 32768, 13, 13, 13, 512]
    - [363, 6569.0]
  - - [479, 1024, 1, 32768, 479, 479, 479, 1024]
    - [337, 82244.0]
  - - [4, 64, 32768, 4, 4, 4, 4, 2097152]
    - [344, 269.0]
  - - [4, 64, 38400, 4, 4, 4, 4, 2457600]
    - [346, 270.0]
  - - [14, 64, 10880, 14, 14, 14, 14, 696320]
    - [348, 2494.0]
  - - [15, 64, 10880, 14, 15, 15, 15, 696320]
    - [350, 2585.0]
  - - [15, 64, 7680, 15, 15, 15, 15, 491520]
    - [350, 2643.0]
  - - [15, 64, 10880, 15, 15, 15, 15, 696320]
    - [350, 2743.0]
  - - [17, 64, 7680, 15, 17, 17, 17, 491520]
    - [278, 2594.0]
  - - [17, 64, 6144, 17, 17, 17, 17, 393216]
    - [330, 2458.0]
  - - [17, 64, 7680, 17, 17, 17, 17, 491520]
    - [334, 2631.0]
  - - [21, 64, 6144, 17, 21, 21, 21, 393216]
    - [335, 2964.0]
  - - [21, 64, 6144, 21, 21, 21, 21, 393216]
    - [309, 3536.0]
  - - [30, 64, 2048, 30, 30, 30, 30, 131072]
    - [332, 5174.0]
  - - [30, 64, 2048, 31, 30, 30, 30, 131072]
    - [333, 5365.0]
  - - [31, 64, 2048, 31, 31, 31, 31, 131072]
    - [292, 5319.0]
  - - [34, 64, 4736, 24, 34, 34, 34, 303104]
    - [325, 4713.0]
  - - [34, 64, 4736, 34, 34, 34, 34, 303104]
    - [313, 5637.0]
  - - [35, 64, 4608, 35, 35, 35, 35, 294912]
    - [301, 5775.0]
  - - [74, 2048, 1, 512, 74, 74, 74, 2048]
    - [291, 7578.0]
  - - [5, 64, 1, 5, 5, 5, 5, 64]
    - [277, 0.0]
  - - [33, 32, 1, 33, 33, 33, 33, 32]
    - [297, 5.0]
  - - [3, 64, 512, 3, 3, 3, 3, 64]
    - [354, 59.0]
  - - [5, 64, 512, 5, 5, 5, 5, 64]
    - [340, 151.0]
  - - [5, 64, 960, 5, 5, 5, 5, 64]
    - [356, 218.0]
  - - [9, 64, 512, 9, 9, 9, 9, 64]
    - [340, 461.0]
  - - [27, 128, 32768, 27, 27, 27, 27, 128]
    - [335, 7074.0]
  - - [33, 32, 200, 33, 33, 33, 33, 32]
    - [279, 1177.0]
  - - [33, 32, 1600, 33, 33, 33, 33, 32]
    - [295, 3593.0]
  - - [67, 2048, 1, 512, 67, 67, 67, 2048]
    - [289, 7082.0]
  - - [74, 2048, 1, 960, 74, 74, 74, 2048]
    - [291, 9423.0]
  - - [100, 2048, 1, 512, 100, 100, 100, 2048]
    - [283, 8738.0]
  - - [257, 4096, 1, 1024, 257, 257, 257, 4096]
    - [328, 34727.0]
  - - [13, 512, 1, 3456, 13, 13, 13, 512]
    - [336, 1956.0]
  - - [13, 512, 1, 4096, 13, 13, 13, 512]
    - [338, 2334.0]
  - - [13, 512, 1, 55296, 13, 13, 13, 512]
    - [366, 7579.0]
  - - [13, 512, 1, 6912, 13, 13, 13, 512]
    - [339, 3195.0]
  - - [13, 512, 1, 864, 13, 13, 13, 512]
    - [358, 553.0]
  - - [196, 512, 64, 1024, 196, 196, 196, 512]
    - [320, 61441.0]
  - - [196, 1024, 64, 512, 196, 196, 196, 1024]
    - [305, 57528.0]
  - - [196, 1024, 64, 1024, 196, 196, 196, 1024]
    - [306, 66484.0]
  - - [49, 1024, 64, 2048, 49, 49, 49, 1024]
    - [300, 37316.0]
  - - [49, 2048, 64, 1024, 49, 49, 49, 2048]
    - [319, 39072.0]
  - - [196, 512, 32, 1024, 196, 196, 196, 512]
    - [320, 49763.0]
  - - [196, 1024, 32, 512, 196, 196, 196, 1024]
    - [286, 50683.0]
  - - [196, 1024, 32, 1024, 196, 196, 196, 1024]
    - [323, 60581.0]
  - - [49, 1024, 32, 2048, 49, 49, 49, 1024]
    - [315, 35774.0]
  - - [49, 2048, 32, 1024, 49, 49, 49, 2048]
    - [285, 34339.0]
  - - [196, 1024, 32, 256, 196, 196, 196, 1024]
    - [317, 39523.0]
  - - [196, 256, 32, 1024, 196, 196, 196, 256]
    - [303, 41104.0]
  - - [49, 2048, 32, 512, 49, 49, 49, 2048]
    - [285, 28865.0]
  - - [49, 512, 32, 2048, 49, 49, 49, 512]
    - [293, 28704.0]
  - - [196, 256, 64, 1024, 196, 196, 196, 256]
    - [307, 48759.0]
  - - [196, 1024, 64, 256, 196, 196, 196, 1024]
    - [324, 44630.0]
  - - [49, 512, 64, 2048, 49, 49, 49, 512]
    - [284, 35132.0]
  - - [49, 2048, 64, 512, 49, 49, 49, 2048]
    - [310, 33364.0]
  - - [1225, 192, 64, 32, 1225, 1225, 1225, 192]
    - [294, 17252.0]
  - - [1225, 192, 64, 48, 1225, 1225, 1225, 192]
    - [312, 22300.0]
  - - [1225, 192, 64, 64, 1225, 1225, 1225, 192]
    - [296, 27683.0]
  - - [1225, 256, 64, 48, 1225, 1225, 1225, 256]
    - [298, 25246.0]
  - - [1225, 256, 64, 64, 1225, 1225, 1225, 256]
    - [314, 30295.0]
  - - [1225, 288, 64, 48, 1225, 1225, 1225, 288]
    - [322, 26564.0]
  - - [1225, 288, 64, 64, 1225, 1225, 1225, 288]
    - [326, 31415.0]
  - - [5329, 64, 64, 80, 5329, 5329, 5329, 64]
    - [290, 26848.0]
  - - [289, 768, 64, 128, 289, 289, 289, 768]
    - [327, 39322.0]
  - - [289, 768, 64, 160, 289, 289, 289, 768]
    - [299, 44115.0]
  - - [289, 768, 64, 192, 289, 289, 289, 768]
    - [331, 48357.0]
  - - [1225, 192, 32, 32, 1225, 1225, 1225, 192]
    - [282, 14830.0]
  - - [1225, 192, 32, 48, 1225, 1225, 1225, 192]
    - [321, 19634.0]
  - - [1225, 192, 32, 64, 1225, 1225, 1225, 192]
    - [281, 23158.0]
  - - [1225, 256, 32, 48, 1225, 1225, 1225, 256]
    - [298, 22551.0]
  - - [1225, 256, 32, 64, 1225, 1225, 1225, 256]
    - [304, 27031.0]
  - - [1225, 288, 32, 48, 1225, 1225, 1225, 288]
    - [280, 21436.0]
  - - [1225, 288, 32, 64, 1225, 1225, 1225, 288]
    - [296, 26800.0]
  - - [5329, 64, 32, 80, 5329, 5329, 5329, 64]
    - [302, 24581.0]
  - - [289, 768, 32, 128, 289, 289, 289, 768]
    - [329, 34126.0]
  - - [289, 768, 32, 160, 289, 289, 289, 768]
    - [317, 38600.0]
  - - [289, 768, 32, 192, 289, 289, 289, 768]
    - [317, 42193.0]
  - - [196, 2304, 1, 256, 196, 196, 196, 2304]
    - [287, 13505.0]
  - - [49, 4608, 1, 512, 49, 49, 49, 4608]
    - [308, 9263.0]
  - - [196, 1024, 128, 256, 196, 196, 196, 1024]
    - [318, 49109.0]
  - - [196, 1024, 256, 256, 196, 196, 196, 1024]
    - [318, 50887.0]
  - - [196, 1024, 128, 512, 196, 196, 196, 1024]
    - [306, 64000.0]
  - - [196, 1024, 256, 512, 196, 196, 196, 1024]
    - [306, 65244.0]
  - - [196, 256, 128, 1024, 196, 196, 196, 256]
    - [307, 60006.0]
  - - [196, 256, 256, 1024, 196, 196, 196, 256]
    - [320, 67439.0]
  - - [49, 2048, 128, 512, 49, 49, 49, 2048]
    - [298, 35899.0]
  - - [49, 2048, 256, 512, 49, 49, 49, 2048]
    - [316, 37240.0]
  - - [49, 512, 128, 2048, 49, 49, 49, 512]
    - [288, 35977.0]
  - - [49, 512, 256, 2048, 49, 49, 49, 512]
    - [311, 40677.0]
- null
