TRAIN_3.10/logic/arcturus_Cijk_Alik_Bljk_HBH.yaml
- {MinimumRequiredVersion: 4.23.0}
- arcturus
- gfx908
- [Device 7380, Device 7388, Device 738c, Device 7390]
    SolutionIndex: 0
    SolutionNameMin: Cijk_Alik_Bljk_HBH_MT128x256x32_MI32x32x8x1_SE_1LDSB0_AF0EM8_GRVW2_LBSPP128_LPA8_LPB8_PLR5_SU0_SUS256_SRVW4_TT2_128_WG64_4_1_WGM1
    SolutionIndex: 1
    SolutionNameMin: Cijk_Alik_Bljk_HBH_MT64x32x32_MI16x16x16x1_SE_1LDSB0_AF0EM8_GRVW4_LBSPP128_LPA16_LPB16_PLR2_SU0_SUS256_SRVW4_TT2_16_WG32_8_1_WGM1
    SolutionIndex: 2
    SolutionNameMin: Cijk_Alik_Bljk_HBH_MT32x32x64_MI16x16x16x1_SE_1LDSB0_AF0EM8_GRVW4_LBSPP128_LPA16_LPB16_PLR5_SU0_SUS256_SRVW4_TT1_16_WG32_8_1_WGM1
    SolutionIndex: 3
    SolutionNameMin: Cijk_Alik_Bljk_HBH_MT32x32x32_MI16x16x16x1_SE_1LDSB0_AF0EM8_GRVW8_LBSPP128_LPA16_LPB16_PLR2_SU0_SUS256_SRVW4_TT1_16_WG32_8_1_WGM1
    SolutionIndex: 4
    SolutionNameMin: Cijk_Alik_Bljk_HBH_MT64x32x32_MI16x16x16x1_SE_1LDSB0_AF0EM8_GRVW8_LBSPP128_LPA16_LPB16_PLR2_SU0_SUS256_SRVW4_TT2_16_WG32_8_1_WGM1
    SolutionIndex: 5
    SolutionNameMin: Cijk_Alik_Bljk_HBH_MT64x128x32_MI32x32x8x1_SE_1LDSB0_AF0EM8_GRVW8_LBSPP128_LPA8_LPB8_PLR5_SU0_SUS256_SRVW4_TT1_64_WG64_4_1_WGM1
    SolutionIndex: 6
    SolutionNameMin: Cijk_Alik_Bljk_HBH_MT32x32x64_MI16x16x16x1_SE_1LDSB0_AF0EM8_GRVW8_LBSPP128_LPA16_LPB16_PLR5_SU0_SUS256_SRVW4_TT1_16_WG32_8_1_WGM1
    SolutionIndex: 7
    SolutionNameMin: Cijk_Alik_Bljk_HBH_MT32x32x64_MI16x16x16x1_SE_1LDSB0_AF0EM8_GRVW8_LBSPP128_LPA16_LPB16_PLR5_SU32_SUS128_SRVW4_TT1_16_WG32_8_1_WGM1
    SolutionIndex: 8
    SolutionNameMin: Cijk_Alik_Bljk_HBH_MT32x32x64_MI16x16x16x1_SE_1LDSB0_AF0EM8_GRVW2_LBSPP128_LPA16_LPB16_PLR5_SU32_SUS256_SRVW4_TT1_16_WG32_8_1_WGM1
    SolutionIndex: 9
    SolutionNameMin: Cijk_Alik_Bljk_HBH_MT32x32x64_MI16x16x16x1_SE_1LDSB0_AF0EM8_GRVW2_LBSPP128_LPA16_LPB16_PLR5_SU0_SUS256_SRVW4_TT1_16_WG32_8_1_WGM2
    SolutionIndex: 10
    SolutionNameMin: Cijk_Alik_Bljk_HBH_MT128x96x64_MI32x32x8x1_SE_1LDSB0_AF0EM8_GRVW2_LBSPP128_LPA8_LPB8_PLR9_SU0_SUS256_SRVW4_TT1_96_WG128_2_1_WGM2
    SolutionIndex: 11
    SolutionNameMin: Cijk_Alik_Bljk_HBH_MT128x96x32_MI32x32x8x1_SE_1LDSB0_AF0EM8_GRVW4_LBSPP128_LPA8_LPB8_PLR5_SU0_SUS256_SRVW4_TT1_96_WG128_2_1_WGM2
    SolutionIndex: 12
    SolutionNameMin: Cijk_Alik_Bljk_HBH_MT32x32x64_MI16x16x16x1_SE_1LDSB0_AF0EM8_GRVW4_LBSPP128_LPA16_LPB16_PLR5_SU0_SUS256_SRVW4_TT1_16_WG32_8_1_WGM2
    SolutionIndex: 13
    SolutionNameMin: Cijk_Alik_Bljk_HBH_MT32x32x64_MI16x16x16x1_SE_1LDSB0_AF0EM8_GRVW2_LBSPP128_LPA16_LPB16_PLR5_SU32_SUS128_SRVW4_TT1_16_WG32_8_1_WGM2
    SolutionIndex: 14
    SolutionNameMin: Cijk_Alik_Bljk_HBH_MT128x128x32_MI32x32x8x1_SE_1LDSB0_AF0EM8_GRVW8_LBSPP128_LPA8_LPB8_PLR5_SU32_SUS128_SRVW4_TT2_64_WG64_4_1_WGM2
    SolutionIndex: 15
    SolutionNameMin: Cijk_Alik_Bljk_HBH_MT32x32x64_MI16x16x16x1_SE_1LDSB0_AF0EM8_GRVW8_LBSPP128_LPA16_LPB16_PLR5_SU32_SUS128_SRVW4_TT1_16_WG32_8_1_WGM2
    SolutionIndex: 16
    SolutionNameMin: Cijk_Alik_Bljk_HBH_MT128x64x64_MI32x32x8x1_SE_1LDSB0_AF0EM8_GRVW8_LBSPP128_LPA8_LPB8_PLR9_SU32_SUS128_SRVW4_TT2_32_WG64_4_1_WGM2
    SolutionIndex: 17
    SolutionNameMin: Cijk_Alik_Bljk_HBH_MT128x96x64_MI32x32x8x1_SE_1LDSB0_AF0EM8_GRVW2_LBSPP128_LPA8_LPB8_PLR9_SU32_SUS256_SRVW4_TT1_96_WG128_2_1_WGM2
    SolutionIndex: 18
    SolutionNameMin: Cijk_Alik_Bljk_HBH_MT32x32x64_MI16x16x16x1_SE_1LDSB0_AF0EM8_GRVW8_LBSPP128_LPA16_LPB16_PLR5_SU32_SUS256_SRVW4_TT1_16_WG32_8_1_WGM2
    SolutionIndex: 19
    SolutionNameMin: Cijk_Alik_Bljk_HBH_MT64x128x64_MI32x32x8x1_SE_1LDSB0_AF0EM8_GRVW8_LBSPP128_LPA8_LPB8_PLR9_SU32_SUS256_SRVW4_TT1_64_WG64_4_1_WGM2
    SolutionIndex: 20
    SolutionNameMin: Cijk_Alik_Bljk_HBH_MT32x32x32_MI16x16x16x1_SE_1LDSB0_AF0EM8_GRVW2_LBSPP128_LPA16_LPB16_PLR2_SU0_SUS256_SRVW4_TT1_16_WG32_8_1_WGM15
    SolutionIndex: 21
    SolutionNameMin: Cijk_Alik_Bljk_HBH_MT128x96x32_MI32x32x8x1_SE_1LDSB0_AF0EM8_GRVW2_LBSPP128_LPA8_LPB8_PLR5_SU0_SUS256_SRVW4_TT1_96_WG128_2_1_WGM15
    SolutionIndex: 22
    SolutionNameMin: Cijk_Alik_Bljk_HBH_MT128x288x32_MI32x32x8x1_SE_1LDSB0_AF0EM8_GRVW2_LBSPP128_LPA8_LPB8_PLR5_SU0_SUS256_SRVW4_TT1_288_WG128_2_1_WGM15
    SolutionIndex: 23
    SolutionNameMin: Cijk_Alik_Bljk_HBH_MT32x32x64_MI16x16x16x1_SE_1LDSB0_AF0EM8_GRVW2_LBSPP128_LPA16_LPB16_PLR5_SU0_SUS256_SRVW4_TT1_16_WG32_8_1_WGM15
    SolutionIndex: 24
    SolutionNameMin: Cijk_Alik_Bljk_HBH_MT64x128x64_MI32x32x8x1_SE_1LDSB0_AF0EM8_GRVW2_LBSPP128_LPA8_LPB8_PLR9_SU0_SUS256_SRVW4_TT1_64_WG64_4_1_WGM15
    SolutionIndex: 25
    SolutionNameMin: Cijk_Alik_Bljk_HBH_MT32x32x64_MI16x16x16x1_SE_1LDSB0_AF0EM8_GRVW4_LBSPP128_LPA16_LPB16_PLR5_SU0_SUS256_SRVW4_TT1_16_WG32_8_1_WGM15
    SolutionIndex: 26
    SolutionNameMin: Cijk_Alik_Bljk_HBH_MT128x256x32_MI32x32x8x1_SE_1LDSB0_AF0EM8_GRVW8_LBSPP128_LPA8_LPB8_PLR5_SU0_SUS256_SRVW4_TT2_128_WG64_4_1_WGM15
    SolutionIndex: 27
    SolutionNameMin: Cijk_Alik_Bljk_HBH_MT32x32x64_MI16x16x16x1_SE_1LDSB0_AF0EM8_GRVW8_LBSPP128_LPA16_LPB16_PLR5_SU0_SUS256_SRVW4_TT1_16_WG32_8_1_WGM15
    SolutionIndex: 28
    SolutionNameMin: Cijk_Alik_Bljk_HBH_MT64x32x64_MI16x16x16x1_SE_1LDSB0_AF0EM8_GRVW8_LBSPP128_LPA16_LPB16_PLR5_SU0_SUS256_SRVW4_TT2_16_WG32_8_1_WGM15
    SolutionIndex: 29
    SolutionNameMin: Cijk_Alik_Bljk_HBH_MT128x64x64_MI32x32x8x1_SE_1LDSB0_AF0EM8_GRVW8_LBSPP128_LPA8_LPB8_PLR9_SU0_SUS256_SRVW4_TT2_32_WG64_4_1_WGM15
    SolutionIndex: 30
    SolutionNameMin: Cijk_Alik_Bljk_HBH_MT32x32x64_MI16x16x16x1_SE_1LDSB0_AF0EM8_GRVW2_LBSPP128_LPA16_LPB16_PLR5_SU32_SUS128_SRVW4_TT1_16_WG32_8_1_WGM15
    SolutionIndex: 31
    SolutionNameMin: Cijk_Alik_Bljk_HBH_MT64x128x64_MI32x32x8x1_SE_1LDSB0_AF0EM8_GRVW2_LBSPP128_LPA8_LPB8_PLR9_SU32_SUS128_SRVW4_TT1_64_WG64_4_1_WGM15
    SolutionIndex: 32
    SolutionNameMin: Cijk_Alik_Bljk_HBH_MT128x96x64_MI32x32x8x1_SE_1LDSB0_AF0EM8_GRVW2_LBSPP128_LPA8_LPB8_PLR9_SU32_SUS128_SRVW4_TT1_96_WG128_2_1_WGM15
    SolutionIndex: 33
    SolutionNameMin: Cijk_Alik_Bljk_HBH_MT64x128x32_MI32x32x8x1_SE_1LDSB0_AF0EM8_GRVW4_LBSPP128_LPA8_LPB8_PLR5_SU32_SUS128_SRVW4_TT1_64_WG64_4_1_WGM15
    SolutionIndex: 34
    SolutionNameMin: Cijk_Alik_Bljk_HBH_MT32x32x64_MI16x16x16x1_SE_1LDSB0_AF0EM8_GRVW4_LBSPP128_LPA16_LPB16_PLR5_SU32_SUS128_SRVW4_TT1_16_WG32_8_1_WGM15
    SolutionIndex: 35
    SolutionNameMin: Cijk_Alik_Bljk_HBH_MT32x32x64_MI16x16x16x1_SE_1LDSB0_AF0EM8_GRVW8_LBSPP128_LPA16_LPB16_PLR5_SU32_SUS128_SRVW4_TT1_16_WG32_8_1_WGM15
    SolutionIndex: 36
    SolutionNameMin: Cijk_Alik_Bljk_HBH_MT32x64x64_MI16x16x16x1_SE_1LDSB0_AF0EM8_GRVW8_LBSPP128_LPA16_LPB16_PLR5_SU32_SUS128_SRVW4_TT1_32_WG32_8_1_WGM15
    SolutionIndex: 37
    SolutionNameMin: Cijk_Alik_Bljk_HBH_MT64x64x64_MI32x32x8x1_SE_1LDSB0_AF0EM8_GRVW8_LBSPP128_LPA8_LPB8_PLR9_SU32_SUS128_SRVW4_TT1_32_WG64_4_1_WGM15
    SolutionIndex: 38
    SolutionNameMin: Cijk_Alik_Bljk_HBH_MT128x64x64_MI32x32x8x1_SE_1LDSB0_AF0EM8_GRVW8_LBSPP128_LPA8_LPB8_PLR9_SU32_SUS128_SRVW4_TT2_32_WG64_4_1_WGM15
    SolutionIndex: 39
    SolutionNameMin: Cijk_Alik_Bljk_HBH_MT128x96x64_MI32x32x8x1_SE_1LDSB0_AF0EM8_GRVW2_LBSPP128_LPA8_LPB8_PLR9_SU32_SUS256_SRVW4_TT1_96_WG128_2_1_WGM15
    SolutionIndex: 40
    SolutionNameMin: Cijk_Alik_Bljk_HBH_MT64x64x32_MI32x32x8x1_SE_1LDSB1_AF0EM8_GRVW2_LBSPP128_LPA8_LPB8_PLR5_SU0_SUS256_SRVW4_TT1_32_WG64_4_1_WGM1
    SolutionIndex: 41
    SolutionNameMin: Cijk_Alik_Bljk_HBH_MT128x64x32_MI32x32x8x1_SE_1LDSB1_AF0EM8_GRVW2_LBSPP128_LPA8_LPB8_PLR5_SU0_SUS256_SRVW4_TT2_32_WG64_4_1_WGM1
    SolutionIndex: 42
    SolutionNameMin: Cijk_Alik_Bljk_HBH_MT256x256x32_MI32x32x8x1_SE_1LDSB1_AF0EM8_GRVW2_LBSPP128_LPA8_LPB8_PLR5_SU0_SUS256_SRVW4_TT4_128_WG64_4_1_WGM1
    SolutionIndex: 43
    SolutionNameMin: Cijk_Alik_Bljk_HBH_MT160x160x64_MI16x16x16x1_SE_1LDSB1_AF0EM8_GRVW2_LBSPP128_LPA16_LPB16_PLR5_SU0_SUS256_SRVW0_TT5_80_WG32_8_1_WGM1
    SolutionIndex: 44
    SolutionNameMin: Cijk_Alik_Bljk_HBH_MT144x128x64_MI16x16x16x1_SE_1LDSB1_AF0EM8_GRVW2_LBSPP128_LPA16_LPB16_PLR5_SU0_SUS256_SRVW0_TT9_32_WG16_16_1_WGM1
    SolutionIndex: 45
    SolutionNameMin: Cijk_Alik_Bljk_HBH_MT64x64x64_MI32x32x8x1_SE_1LDSB1_AF0EM8_GRVW2_LBSPP128_LPA8_LPB8_PLR9_SU0_SUS256_SRVW4_TT1_32_WG64_4_1_WGM1
    SolutionIndex: 46
    SolutionNameMin: Cijk_Alik_Bljk_HBH_MT128x256x64_MI32x32x8x1_SE_1LDSB1_AF0EM8_GRVW2_LBSPP128_LPA8_LPB8_PLR9_SU0_SUS256_SRVW4_TT2_128_WG64_4_1_WGM1
    SolutionIndex: 47
    SolutionNameMin: Cijk_Alik_Bljk_HBH_MT256x128x64_MI32x32x8x1_SE_1LDSB1_AF0EM8_GRVW2_LBSPP128_LPA8_LPB8_PLR9_SU0_SUS256_SRVW4_TT4_64_WG64_4_1_WGM1
    SolutionIndex: 48
    SolutionNameMin: Cijk_Alik_Bljk_HBH_MT256x160x64_MI32x32x8x1_SE_1LDSB1_AF0EM8_GRVW2_LBSPP128_LPA8_LPB8_PLR9_SU0_SUS256_SRVW4_TT2_160_WG128_2_1_WGM1
    SolutionIndex: 49
    SolutionNameMin: Cijk_Alik_Bljk_HBH_MT32x64x32_MI16x16x16x1_SE_1LDSB1_AF0EM8_GRVW4_LBSPP128_LPA16_LPB16_PLR2_SU0_SUS256_SRVW4_TT1_32_WG32_8_1_WGM1
    SolutionIndex: 50
    SolutionNameMin: Cijk_Alik_Bljk_HBH_MT128x96x32_MI32x32x8x1_SE_1LDSB1_AF0EM8_GRVW4_LBSPP128_LPA8_LPB8_PLR5_SU0_SUS256_SRVW4_TT1_96_WG128_2_1_WGM1
    SolutionIndex: 51
    SolutionNameMin: Cijk_Alik_Bljk_HBH_MT128x128x64_MI32x32x8x1_SE_1LDSB1_AF0EM8_GRVW4_LBSPP128_LPA8_LPB8_PLR9_SU0_SUS256_SRVW4_TT2_64_WG64_4_1_WGM1
    SolutionIndex: 52
    SolutionNameMin: Cijk_Alik_Bljk_HBH_MT32x32x32_MI16x16x16x1_SE_1LDSB1_AF0EM8_GRVW8_LBSPP128_LPA16_LPB16_PLR2_SU0_SUS256_SRVW4_TT1_16_WG32_8_1_WGM1
    SolutionIndex: 53
    SolutionNameMin: Cijk_Alik_Bljk_HBH_MT64x128x32_MI32x32x8x1_SE_1LDSB1_AF0EM8_GRVW8_LBSPP128_LPA8_LPB8_PLR5_SU0_SUS256_SRVW4_TT1_64_WG64_4_1_WGM1
    SolutionIndex: 54
    SolutionNameMin: Cijk_Alik_Bljk_HBH_MT128x64x32_MI32x32x8x1_SE_1LDSB1_AF0EM8_GRVW8_LBSPP128_LPA8_LPB8_PLR5_SU0_SUS256_SRVW4_TT2_32_WG64_4_1_WGM1
    SolutionIndex: 55
    SolutionNameMin: Cijk_Alik_Bljk_HBH_MT128x128x32_MI32x32x8x1_SE_1LDSB1_AF0EM8_GRVW8_LBSPP128_LPA8_LPB8_PLR5_SU0_SUS256_SRVW4_TT2_64_WG64_4_1_WGM1
    SolutionIndex: 56
    SolutionNameMin: Cijk_Alik_Bljk_HBH_MT128x256x32_MI32x32x8x1_SE_1LDSB1_AF0EM8_GRVW8_LBSPP128_LPA8_LPB8_PLR5_SU0_SUS256_SRVW4_TT2_128_WG64_4_1_WGM1
    SolutionIndex: 57
    SolutionNameMin: Cijk_Alik_Bljk_HBH_MT64x32x64_MI16x16x16x1_SE_1LDSB1_AF0EM8_GRVW8_LBSPP128_LPA16_LPB16_PLR5_SU0_SUS256_SRVW4_TT2_16_WG32_8_1_WGM1
    SolutionIndex: 58
    SolutionNameMin: Cijk_Alik_Bljk_HBH_MT64x64x64_MI32x32x8x1_SE_1LDSB1_AF0EM8_GRVW8_LBSPP128_LPA8_LPB8_PLR9_SU0_SUS256_SRVW4_TT1_32_WG64_4_1_WGM1
    SolutionIndex: 59
    SolutionNameMin: Cijk_Alik_Bljk_HBH_MT64x128x64_MI32x32x8x1_SE_1LDSB1_AF0EM8_GRVW8_LBSPP128_LPA8_LPB8_PLR9_SU0_SUS256_SRVW4_TT1_64_WG64_4_1_WGM1
    SolutionIndex: 60
    SolutionNameMin: Cijk_Alik_Bljk_HBH_MT96x128x64_MI32x32x8x1_SE_1LDSB1_AF0EM8_GRVW8_LBSPP128_LPA8_LPB8_PLR9_SU0_SUS256_SRVW0_TT3_32_WG32_8_1_WGM1
    SolutionIndex: 61
    SolutionNameMin: Cijk_Alik_Bljk_HBH_MT256x256x32_MI32x32x8x1_SE_1LDSB1_AF0EM8_GRVW2_LBSPP128_LPA8_LPB8_PLR5_SU32_SUS128_SRVW4_TT4_128_WG64_4_1_WGM1
    SolutionIndex: 62
    SolutionNameMin: Cijk_Alik_Bljk_HBH_MT256x160x64_MI32x32x8x1_SE_1LDSB1_AF0EM8_GRVW2_LBSPP128_LPA8_LPB8_PLR9_SU32_SUS128_SRVW4_TT2_160_WG128_2_1_WGM1
    SolutionIndex: 63
    SolutionNameMin: Cijk_Alik_Bljk_HBH_MT128x96x32_MI32x32x8x1_SE_1LDSB1_AF0EM8_GRVW4_LBSPP128_LPA8_LPB8_PLR5_SU32_SUS128_SRVW4_TT1_96_WG128_2_1_WGM1
    SolutionIndex: 64
    SolutionNameMin: Cijk_Alik_Bljk_HBH_MT64x64x64_MI32x32x8x1_SE_1LDSB1_AF0EM8_GRVW4_LBSPP128_LPA8_LPB8_PLR9_SU32_SUS128_SRVW4_TT1_32_WG64_4_1_WGM1
    SolutionIndex: 65
    SolutionNameMin: Cijk_Alik_Bljk_HBH_MT64x64x32_MI32x32x8x1_SE_1LDSB1_AF0EM8_GRVW8_LBSPP128_LPA8_LPB8_PLR5_SU32_SUS128_SRVW4_TT1_32_WG64_4_1_WGM1
    SolutionIndex: 66
    SolutionNameMin: Cijk_Alik_Bljk_HBH_MT128x128x32_MI32x32x8x1_SE_1LDSB1_AF0EM8_GRVW8_LBSPP128_LPA8_LPB8_PLR5_SU32_SUS128_SRVW4_TT2_64_WG64_4_1_WGM1
    SolutionIndex: 67
    SolutionNameMin: Cijk_Alik_Bljk_HBH_MT128x256x32_MI32x32x8x1_SE_1LDSB1_AF0EM8_GRVW8_LBSPP128_LPA8_LPB8_PLR5_SU32_SUS128_SRVW4_TT2_128_WG64_4_1_WGM1
    SolutionIndex: 68
    SolutionNameMin: Cijk_Alik_Bljk_HBH_MT64x64x64_MI32x32x8x1_SE_1LDSB1_AF0EM8_GRVW8_LBSPP128_LPA8_LPB8_PLR9_SU32_SUS128_SRVW4_TT1_32_WG64_4_1_WGM1
    SolutionIndex: 69
    SolutionNameMin: Cijk_Alik_Bljk_HBH_MT64x128x64_MI32x32x8x1_SE_1LDSB1_AF0EM8_GRVW8_LBSPP128_LPA8_LPB8_PLR9_SU32_SUS128_SRVW4_TT1_64_WG64_4_1_WGM1
    SolutionIndex: 70
    SolutionNameMin: Cijk_Alik_Bljk_HBH_MT128x128x64_MI32x32x8x1_SE_1LDSB1_AF0EM8_GRVW8_LBSPP128_LPA8_LPB8_PLR9_SU32_SUS128_SRVW4_TT2_64_WG64_4_1_WGM1
    SolutionIndex: 71
    SolutionNameMin: Cijk_Alik_Bljk_HBH_MT256x256x32_MI32x32x8x1_SE_1LDSB1_AF0EM8_GRVW2_LBSPP128_LPA8_LPB8_PLR5_SU32_SUS256_SRVW4_TT4_128_WG64_4_1_WGM1
    SolutionIndex: 72
    SolutionNameMin: Cijk_Alik_Bljk_HBH_MT144x256x64_MI16x16x16x1_SE_1LDSB1_AF0EM8_GRVW2_LBSPP128_LPA16_LPB16_PLR5_SU32_SUS256_SRVW0_TT9_64_WG16_16_1_WGM1
    SolutionIndex: 73
    SolutionNameMin: Cijk_Alik_Bljk_HBH_MT256x128x64_MI32x32x8x1_SE_1LDSB1_AF0EM8_GRVW4_LBSPP128_LPA8_LPB8_PLR9_SU32_SUS256_SRVW4_TT4_64_WG64_4_1_WGM1
    SolutionIndex: 74
    SolutionNameMin: Cijk_Alik_Bljk_HBH_MT64x64x32_MI32x32x8x1_SE_1LDSB1_AF0EM8_GRVW8_LBSPP128_LPA8_LPB8_PLR5_SU32_SUS256_SRVW4_TT1_32_WG64_4_1_WGM1
    SolutionIndex: 75
    SolutionNameMin: Cijk_Alik_Bljk_HBH_MT128x128x32_MI32x32x8x1_SE_1LDSB1_AF0EM8_GRVW8_LBSPP128_LPA8_LPB8_PLR5_SU32_SUS256_SRVW4_TT2_64_WG64_4_1_WGM1
    SolutionIndex: 76
    SolutionNameMin: Cijk_Alik_Bljk_HBH_MT64x32x64_MI16x16x16x1_SE_1LDSB1_AF0EM8_GRVW8_LBSPP128_LPA16_LPB16_PLR5_SU32_SUS256_SRVW4_TT2_16_WG32_8_1_WGM1
    SolutionIndex: 77
    SolutionNameMin: Cijk_Alik_Bljk_HBH_MT64x128x64_MI32x32x8x1_SE_1LDSB1_AF0EM8_GRVW8_LBSPP128_LPA8_LPB8_PLR9_SU32_SUS256_SRVW4_TT1_64_WG64_4_1_WGM1
    SolutionIndex: 78
    SolutionNameMin: Cijk_Alik_Bljk_HBH_MT128x128x64_MI32x32x8x1_SE_1LDSB1_AF0EM8_GRVW8_LBSPP128_LPA8_LPB8_PLR9_SU32_SUS256_SRVW4_TT2_64_WG64_4_1_WGM1
    SolutionIndex: 79
    SolutionNameMin: Cijk_Alik_Bljk_HBH_MT32x64x32_MI16x16x16x1_SE_1LDSB1_AF0EM8_GRVW2_LBSPP128_LPA16_LPB16_PLR2_SU0_SUS256_SRVW4_TT1_32_WG32_8_1_WGM2
    SolutionIndex: 80
    SolutionNameMin: Cijk_Alik_Bljk_HBH_MT128x256x32_MI32x32x8x1_SE_1LDSB1_AF0EM8_GRVW2_LBSPP128_LPA8_LPB8_PLR5_SU0_SUS256_SRVW4_TT2_128_WG64_4_1_WGM2
    SolutionIndex: 81
    SolutionNameMin: Cijk_Alik_Bljk_HBH_MT256x256x32_MI32x32x8x1_SE_1LDSB1_AF0EM8_GRVW2_LBSPP128_LPA8_LPB8_PLR5_SU0_SUS256_SRVW4_TT4_128_WG64_4_1_WGM2
    SolutionIndex: 82
    SolutionNameMin: Cijk_Alik_Bljk_HBH_MT128x96x32_MI32x32x8x1_SE_1LDSB1_AF0EM8_GRVW2_LBSPP128_LPA8_LPB8_PLR5_SU0_SUS256_SRVW4_TT1_96_WG128_2_1_WGM2
    SolutionIndex: 83
    SolutionNameMin: Cijk_Alik_Bljk_HBH_MT128x160x32_MI32x32x8x1_SE_1LDSB1_AF0EM8_GRVW2_LBSPP128_LPA8_LPB8_PLR5_SU0_SUS256_SRVW4_TT1_160_WG128_2_1_WGM2
    SolutionIndex: 84
    SolutionNameMin: Cijk_Alik_Bljk_HBH_MT160x160x64_MI16x16x16x1_SE_1LDSB1_AF0EM8_GRVW2_LBSPP128_LPA16_LPB16_PLR5_SU0_SUS256_SRVW0_TT5_80_WG32_8_1_WGM2
    SolutionIndex: 85
    SolutionNameMin: Cijk_Alik_Bljk_HBH_MT128x144x64_MI16x16x16x1_SE_1LDSB1_AF0EM8_GRVW2_LBSPP128_LPA16_LPB16_PLR5_SU0_SUS256_SRVW4_TT2_144_WG64_4_1_WGM2
    SolutionIndex: 86
    SolutionNameMin: Cijk_Alik_Bljk_HBH_MT256x144x64_MI16x16x16x1_SE_1LDSB1_AF0EM8_GRVW2_LBSPP128_LPA16_LPB16_PLR5_SU0_SUS256_SRVW4_TT4_144_WG64_4_1_WGM2
    SolutionIndex: 87
    SolutionNameMin: Cijk_Alik_Bljk_HBH_MT128x256x64_MI32x32x8x1_SE_1LDSB1_AF0EM8_GRVW2_LBSPP128_LPA8_LPB8_PLR9_SU0_SUS256_SRVW4_TT2_128_WG64_4_1_WGM2
    SolutionIndex: 88
    SolutionNameMin: Cijk_Alik_Bljk_HBH_MT256x160x64_MI32x32x8x1_SE_1LDSB1_AF0EM8_GRVW2_LBSPP128_LPA8_LPB8_PLR9_SU0_SUS256_SRVW4_TT2_160_WG128_2_1_WGM2
    SolutionIndex: 89
    SolutionNameMin: Cijk_Alik_Bljk_HBH_MT128x128x32_MI32x32x8x1_SE_1LDSB1_AF0EM8_GRVW4_LBSPP128_LPA8_LPB8_PLR5_SU0_SUS256_SRVW4_TT2_64_WG64_4_1_WGM2
    SolutionIndex: 90
    SolutionNameMin: Cijk_Alik_Bljk_HBH_MT128x256x32_MI32x32x8x1_SE_1LDSB1_AF0EM8_GRVW4_LBSPP128_LPA8_LPB8_PLR5_SU0_SUS256_SRVW4_TT2_128_WG64_4_1_WGM2
    SolutionIndex: 91
    SolutionNameMin: Cijk_Alik_Bljk_HBH_MT128x160x32_MI32x32x8x1_SE_1LDSB1_AF0EM8_GRVW4_LBSPP128_LPA8_LPB8_PLR5_SU0_SUS256_SRVW4_TT1_160_WG128_2_1_WGM2
    SolutionIndex: 92
    SolutionNameMin: Cijk_Alik_Bljk_HBH_MT64x64x64_MI32x32x8x1_SE_1LDSB1_AF0EM8_GRVW4_LBSPP128_LPA8_LPB8_PLR9_SU0_SUS256_SRVW4_TT1_32_WG64_4_1_WGM2
    SolutionIndex: 93
    SolutionNameMin: Cijk_Alik_Bljk_HBH_MT128x256x64_MI32x32x8x1_SE_1LDSB1_AF0EM8_GRVW4_LBSPP128_LPA8_LPB8_PLR9_SU0_SUS256_SRVW4_TT2_128_WG64_4_1_WGM2
    SolutionIndex: 94
    SolutionNameMin: Cijk_Alik_Bljk_HBH_MT128x96x64_MI32x32x8x1_SE_1LDSB1_AF0EM8_GRVW4_LBSPP128_LPA8_LPB8_PLR9_SU0_SUS256_SRVW4_TT1_96_WG128_2_1_WGM2
    SolutionIndex: 95
    SolutionNameMin: Cijk_Alik_Bljk_HBH_MT128x288x64_MI32x32x8x1_SE_1LDSB1_AF0EM8_GRVW4_LBSPP128_LPA8_LPB8_PLR9_SU0_SUS256_SRVW4_TT1_288_WG128_2_1_WGM2
    SolutionIndex: 96
    SolutionNameMin: Cijk_Alik_Bljk_HBH_MT128x256x32_MI32x32x8x1_SE_1LDSB1_AF0EM8_GRVW8_LBSPP128_LPA8_LPB8_PLR5_SU0_SUS256_SRVW4_TT2_128_WG64_4_1_WGM2
    SolutionIndex: 97
    SolutionNameMin: Cijk_Alik_Bljk_HBH_MT64x128x64_MI32x32x8x1_SE_1LDSB1_AF0EM8_GRVW8_LBSPP128_LPA8_LPB8_PLR9_SU0_SUS256_SRVW4_TT1_64_WG64_4_1_WGM2
    SolutionIndex: 98
    SolutionNameMin: Cijk_Alik_Bljk_HBH_MT128x64x64_MI32x32x8x1_SE_1LDSB1_AF0EM8_GRVW8_LBSPP128_LPA8_LPB8_PLR9_SU0_SUS256_SRVW4_TT2_32_WG64_4_1_WGM2
    SolutionIndex: 99
    SolutionNameMin: Cijk_Alik_Bljk_HBH_MT128x128x64_MI32x32x8x1_SE_1LDSB1_AF0EM8_GRVW8_LBSPP128_LPA8_LPB8_PLR9_SU0_SUS256_SRVW4_TT2_64_WG64_4_1_WGM2
    SolutionIndex: 100
    SolutionNameMin: Cijk_Alik_Bljk_HBH_MT128x96x64_MI32x32x8x1_SE_1LDSB1_AF0EM8_GRVW8_LBSPP128_LPA8_LPB8_PLR9_SU0_SUS256_SRVW4_TT1_96_WG128_2_1_WGM2
    SolutionIndex: 101
    SolutionNameMin: Cijk_Alik_Bljk_HBH_MT128x160x64_MI32x32x8x1_SE_1LDSB1_AF0EM8_GRVW8_LBSPP128_LPA8_LPB8_PLR9_SU0_SUS256_SRVW4_TT1_160_WG128_2_1_WGM2
    SolutionIndex: 102
    SolutionNameMin: Cijk_Alik_Bljk_HBH_MT256x256x32_MI32x32x8x1_SE_1LDSB1_AF0EM8_GRVW2_LBSPP128_LPA8_LPB8_PLR5_SU32_SUS128_SRVW4_TT4_128_WG64_4_1_WGM2
    SolutionIndex: 103
    SolutionNameMin: Cijk_Alik_Bljk_HBH_MT256x144x64_MI16x16x16x1_SE_1LDSB1_AF0EM8_GRVW2_LBSPP128_LPA16_LPB16_PLR5_SU32_SUS128_SRVW4_TT4_144_WG64_4_1_WGM2
    SolutionIndex: 104
    SolutionNameMin: Cijk_Alik_Bljk_HBH_MT144x256x64_MI16x16x16x1_SE_1LDSB1_AF0EM8_GRVW2_LBSPP128_LPA16_LPB16_PLR5_SU32_SUS128_SRVW0_TT9_64_WG16_16_1_WGM2
    SolutionIndex: 105
    SolutionNameMin: Cijk_Alik_Bljk_HBH_MT256x160x64_MI32x32x8x1_SE_1LDSB1_AF0EM8_GRVW2_LBSPP128_LPA8_LPB8_PLR9_SU32_SUS128_SRVW4_TT2_160_WG128_2_1_WGM2
    SolutionIndex: 106
    SolutionNameMin: Cijk_Alik_Bljk_HBH_MT128x288x32_MI32x32x8x1_SE_1LDSB1_AF0EM8_GRVW4_LBSPP128_LPA8_LPB8_PLR5_SU32_SUS128_SRVW4_TT1_288_WG128_2_1_WGM2
    SolutionIndex: 107
    SolutionNameMin: Cijk_Alik_Bljk_HBH_MT128x256x64_MI32x32x8x1_SE_1LDSB1_AF0EM8_GRVW4_LBSPP128_LPA8_LPB8_PLR9_SU32_SUS128_SRVW4_TT2_128_WG64_4_1_WGM2
    SolutionIndex: 108
    SolutionNameMin: Cijk_Alik_Bljk_HBH_MT128x96x64_MI32x32x8x1_SE_1LDSB1_AF0EM8_GRVW4_LBSPP128_LPA8_LPB8_PLR9_SU32_SUS128_SRVW4_TT1_96_WG128_2_1_WGM2
    SolutionIndex: 109
    SolutionNameMin: Cijk_Alik_Bljk_HBH_MT128x288x64_MI32x32x8x1_SE_1LDSB1_AF0EM8_GRVW4_LBSPP128_LPA8_LPB8_PLR9_SU32_SUS128_SRVW4_TT1_288_WG128_2_1_WGM2
    SolutionIndex: 110
    SolutionNameMin: Cijk_Alik_Bljk_HBH_MT128x160x64_MI32x32x8x1_SE_1LDSB1_AF0EM8_GRVW4_LBSPP128_LPA8_LPB8_PLR9_SU32_SUS128_SRVW4_TT1_160_WG128_2_1_WGM2
    SolutionIndex: 111
    SolutionNameMin: Cijk_Alik_Bljk_HBH_MT128x128x32_MI32x32x8x1_SE_1LDSB1_AF0EM8_GRVW8_LBSPP128_LPA8_LPB8_PLR5_SU32_SUS128_SRVW4_TT2_64_WG64_4_1_WGM2
    SolutionIndex: 112
    SolutionNameMin: Cijk_Alik_Bljk_HBH_MT128x256x32_MI32x32x8x1_SE_1LDSB1_AF0EM8_GRVW8_LBSPP128_LPA8_LPB8_PLR5_SU32_SUS128_SRVW4_TT2_128_WG64_4_1_WGM2
    SolutionIndex: 113
    SolutionNameMin: Cijk_Alik_Bljk_HBH_MT64x64x64_MI32x32x8x1_SE_1LDSB1_AF0EM8_GRVW8_LBSPP128_LPA8_LPB8_PLR9_SU32_SUS128_SRVW4_TT1_32_WG64_4_1_WGM2
    SolutionIndex: 114
    SolutionNameMin: Cijk_Alik_Bljk_HBH_MT64x128x64_MI32x32x8x1_SE_1LDSB1_AF0EM8_GRVW8_LBSPP128_LPA8_LPB8_PLR9_SU32_SUS128_SRVW4_TT1_64_WG64_4_1_WGM2
    SolutionIndex: 115
    SolutionNameMin: Cijk_Alik_Bljk_HBH_MT128x128x64_MI32x32x8x1_SE_1LDSB1_AF0EM8_GRVW8_LBSPP128_LPA8_LPB8_PLR9_SU32_SUS128_SRVW4_TT2_64_WG64_4_1_WGM2
    SolutionIndex: 116
    SolutionNameMin: Cijk_Alik_Bljk_HBH_MT128x96x64_MI32x32x8x1_SE_1LDSB1_AF0EM8_GRVW8_LBSPP128_LPA8_LPB8_PLR9_SU32_SUS128_SRVW4_TT1_96_WG128_2_1_WGM2
    SolutionIndex: 117
    SolutionNameMin: Cijk_Alik_Bljk_HBH_MT128x256x32_MI32x32x8x1_SE_1LDSB1_AF0EM8_GRVW2_LBSPP128_LPA8_LPB8_PLR5_SU32_SUS256_SRVW4_TT2_128_WG64_4_1_WGM2
    SolutionIndex: 118
    SolutionNameMin: Cijk_Alik_Bljk_HBH_MT256x256x32_MI32x32x8x1_SE_1LDSB1_AF0EM8_GRVW2_LBSPP128_LPA8_LPB8_PLR5_SU32_SUS256_SRVW4_TT4_128_WG64_4_1_WGM2
    SolutionIndex: 119
    SolutionNameMin: Cijk_Alik_Bljk_HBH_MT256x144x64_MI16x16x16x1_SE_1LDSB1_AF0EM8_GRVW2_LBSPP128_LPA16_LPB16_PLR5_SU32_SUS256_SRVW4_TT4_144_WG64_4_1_WGM2
    SolutionIndex: 120
    SolutionNameMin: Cijk_Alik_Bljk_HBH_MT144x256x64_MI16x16x16x1_SE_1LDSB1_AF0EM8_GRVW2_LBSPP128_LPA16_LPB16_PLR5_SU32_SUS256_SRVW0_TT9_64_WG16_16_1_WGM2
    SolutionIndex: 121
    SolutionNameMin: Cijk_Alik_Bljk_HBH_MT256x128x64_MI32x32x8x1_SE_1LDSB1_AF0EM8_GRVW2_LBSPP128_LPA8_LPB8_PLR9_SU32_SUS256_SRVW4_TT4_64_WG64_4_1_WGM2
    SolutionIndex: 122
    SolutionNameMin: Cijk_Alik_Bljk_HBH_MT160x128x64_MI32x32x8x1_SE_1LDSB1_AF0EM8_GRVW2_LBSPP128_LPA8_LPB8_PLR9_SU32_SUS256_SRVW0_TT5_32_WG32_8_1_WGM2
    SolutionIndex: 123
    SolutionNameMin: Cijk_Alik_Bljk_HBH_MT256x160x64_MI32x32x8x1_SE_1LDSB1_AF0EM8_GRVW2_LBSPP128_LPA8_LPB8_PLR9_SU32_SUS256_SRVW4_TT2_160_WG128_2_1_WGM2
    SolutionIndex: 124
    SolutionNameMin: Cijk_Alik_Bljk_HBH_MT128x96x64_MI32x32x8x1_SE_1LDSB1_AF0EM8_GRVW4_LBSPP128_LPA8_LPB8_PLR9_SU32_SUS256_SRVW4_TT1_96_WG128_2_1_WGM2
    SolutionIndex: 125
    SolutionNameMin: Cijk_Alik_Bljk_HBH_MT128x128x32_MI32x32x8x1_SE_1LDSB1_AF0EM8_GRVW8_LBSPP128_LPA8_LPB8_PLR5_SU32_SUS256_SRVW4_TT2_64_WG64_4_1_WGM2
    SolutionIndex: 126
    SolutionNameMin: Cijk_Alik_Bljk_HBH_MT128x256x32_MI32x32x8x1_SE_1LDSB1_AF0EM8_GRVW8_LBSPP128_LPA8_LPB8_PLR5_SU32_SUS256_SRVW4_TT2_128_WG64_4_1_WGM2
    SolutionIndex: 127
    SolutionNameMin: Cijk_Alik_Bljk_HBH_MT64x64x64_MI32x32x8x1_SE_1LDSB1_AF0EM8_GRVW8_LBSPP128_LPA8_LPB8_PLR9_SU32_SUS256_SRVW4_TT1_32_WG64_4_1_WGM2
    SolutionIndex: 128
    SolutionNameMin: Cijk_Alik_Bljk_HBH_MT64x128x64_MI32x32x8x1_SE_1LDSB1_AF0EM8_GRVW8_LBSPP128_LPA8_LPB8_PLR9_SU32_SUS256_SRVW4_TT1_64_WG64_4_1_WGM2
    SolutionIndex: 129
    SolutionNameMin: Cijk_Alik_Bljk_HBH_MT128x128x64_MI32x32x8x1_SE_1LDSB1_AF0EM8_GRVW8_LBSPP128_LPA8_LPB8_PLR9_SU32_SUS256_SRVW4_TT2_64_WG64_4_1_WGM2
    SolutionIndex: 130
    SolutionNameMin: Cijk_Alik_Bljk_HBH_MT96x128x64_MI32x32x8x1_SE_1LDSB1_AF0EM8_GRVW8_LBSPP128_LPA8_LPB8_PLR9_SU32_SUS256_SRVW0_TT3_32_WG32_8_1_WGM2
    SolutionIndex: 131
    SolutionNameMin: Cijk_Alik_Bljk_HBH_MT128x160x64_MI32x32x8x1_SE_1LDSB1_AF0EM8_GRVW8_LBSPP128_LPA8_LPB8_PLR9_SU32_SUS256_SRVW4_TT1_160_WG128_2_1_WGM2
    SolutionIndex: 132
    SolutionNameMin: Cijk_Alik_Bljk_HBH_MT32x64x32_MI16x16x16x1_SE_1LDSB1_AF0EM8_GRVW2_LBSPP128_LPA16_LPB16_PLR2_SU0_SUS256_SRVW4_TT1_32_WG32_8_1_WGM15
    SolutionIndex: 133
    SolutionNameMin: Cijk_Alik_Bljk_HBH_MT128x144x32_MI16x16x16x1_SE_1LDSB1_AF0EM8_GRVW2_LBSPP128_LPA16_LPB16_PLR2_SU0_SUS256_SRVW4_TT2_144_WG64_4_1_WGM15
    SolutionIndex: 134
    SolutionNameMin: Cijk_Alik_Bljk_HBH_MT64x64x32_MI32x32x8x1_SE_1LDSB1_AF0EM8_GRVW2_LBSPP128_LPA8_LPB8_PLR5_SU0_SUS256_SRVW4_TT1_32_WG64_4_1_WGM15
    SolutionIndex: 135
    SolutionNameMin: Cijk_Alik_Bljk_HBH_MT128x128x32_MI32x32x8x1_SE_1LDSB1_AF0EM8_GRVW2_LBSPP128_LPA8_LPB8_PLR5_SU0_SUS256_SRVW4_TT2_64_WG64_4_1_WGM15
    SolutionIndex: 136
    SolutionNameMin: Cijk_Alik_Bljk_HBH_MT256x256x32_MI32x32x8x1_SE_1LDSB1_AF0EM8_GRVW2_LBSPP128_LPA8_LPB8_PLR5_SU0_SUS256_SRVW4_TT4_128_WG64_4_1_WGM15
    SolutionIndex: 137
    SolutionNameMin: Cijk_Alik_Bljk_HBH_MT128x144x64_MI16x16x16x1_SE_1LDSB1_AF0EM8_GRVW2_LBSPP128_LPA16_LPB16_PLR5_SU0_SUS256_SRVW4_TT2_144_WG64_4_1_WGM15
    SolutionIndex: 138
    SolutionNameMin: Cijk_Alik_Bljk_HBH_MT256x144x64_MI16x16x16x1_SE_1LDSB1_AF0EM8_GRVW2_LBSPP128_LPA16_LPB16_PLR5_SU0_SUS256_SRVW4_TT4_144_WG64_4_1_WGM15
    SolutionIndex: 139
    SolutionNameMin: Cijk_Alik_Bljk_HBH_MT64x64x64_MI32x32x8x1_SE_1LDSB1_AF0EM8_GRVW2_LBSPP128_LPA8_LPB8_PLR9_SU0_SUS256_SRVW4_TT1_32_WG64_4_1_WGM15
    SolutionIndex: 140
    SolutionNameMin: Cijk_Alik_Bljk_HBH_MT128x256x64_MI32x32x8x1_SE_1LDSB1_AF0EM8_GRVW2_LBSPP128_LPA8_LPB8_PLR9_SU0_SUS256_SRVW4_TT2_128_WG64_4_1_WGM15
    SolutionIndex: 141
    SolutionNameMin: Cijk_Alik_Bljk_HBH_MT256x128x64_MI32x32x8x1_SE_1LDSB1_AF0EM8_GRVW2_LBSPP128_LPA8_LPB8_PLR9_SU0_SUS256_SRVW4_TT4_64_WG64_4_1_WGM15
    SolutionIndex: 142
    SolutionNameMin: Cijk_Alik_Bljk_HBH_MT128x160x64_MI32x32x8x1_SE_1LDSB1_AF0EM8_GRVW2_LBSPP128_LPA8_LPB8_PLR9_SU0_SUS256_SRVW4_TT1_160_WG128_2_1_WGM15
    SolutionIndex: 143
    SolutionNameMin: Cijk_Alik_Bljk_HBH_MT256x160x64_MI32x32x8x1_SE_1LDSB1_AF0EM8_GRVW2_LBSPP128_LPA8_LPB8_PLR9_SU0_SUS256_SRVW4_TT2_160_WG128_2_1_WGM15
    SolutionIndex: 144
    SolutionNameMin: Cijk_Alik_Bljk_HBH_MT128x64x32_MI32x32x8x1_SE_1LDSB1_AF0EM8_GRVW4_LBSPP128_LPA8_LPB8_PLR5_SU0_SUS256_SRVW4_TT2_32_WG64_4_1_WGM15
    SolutionIndex: 145
    SolutionNameMin: Cijk_Alik_Bljk_HBH_MT128x128x32_MI32x32x8x1_SE_1LDSB1_AF0EM8_GRVW4_LBSPP128_LPA8_LPB8_PLR5_SU0_SUS256_SRVW4_TT2_64_WG64_4_1_WGM15
    SolutionIndex: 146
    SolutionNameMin: Cijk_Alik_Bljk_HBH_MT128x96x32_MI32x32x8x1_SE_1LDSB1_AF0EM8_GRVW4_LBSPP128_LPA8_LPB8_PLR5_SU0_SUS256_SRVW4_TT1_96_WG128_2_1_WGM15
    SolutionIndex: 147
    SolutionNameMin: Cijk_Alik_Bljk_HBH_MT128x160x32_MI32x32x8x1_SE_1LDSB1_AF0EM8_GRVW4_LBSPP128_LPA8_LPB8_PLR5_SU0_SUS256_SRVW4_TT1_160_WG128_2_1_WGM15
    SolutionIndex: 148
    SolutionNameMin: Cijk_Alik_Bljk_HBH_MT64x64x64_MI32x32x8x1_SE_1LDSB1_AF0EM8_GRVW4_LBSPP128_LPA8_LPB8_PLR9_SU0_SUS256_SRVW4_TT1_32_WG64_4_1_WGM15
    SolutionIndex: 149
    SolutionNameMin: Cijk_Alik_Bljk_HBH_MT64x256x64_MI32x32x8x1_SE_1LDSB1_AF0EM8_GRVW4_LBSPP128_LPA8_LPB8_PLR9_SU0_SUS256_SRVW4_TT1_128_WG64_4_1_WGM15
    SolutionIndex: 150
    SolutionNameMin: Cijk_Alik_Bljk_HBH_MT128x96x64_MI32x32x8x1_SE_1LDSB1_AF0EM8_GRVW4_LBSPP128_LPA8_LPB8_PLR9_SU0_SUS256_SRVW4_TT1_96_WG128_2_1_WGM15
    SolutionIndex: 151
    SolutionNameMin: Cijk_Alik_Bljk_HBH_MT128x288x64_MI32x32x8x1_SE_1LDSB1_AF0EM8_GRVW4_LBSPP128_LPA8_LPB8_PLR9_SU0_SUS256_SRVW4_TT1_288_WG128_2_1_WGM15
    SolutionIndex: 152
    SolutionNameMin: Cijk_Alik_Bljk_HBH_MT128x160x64_MI32x32x8x1_SE_1LDSB1_AF0EM8_GRVW4_LBSPP128_LPA8_LPB8_PLR9_SU0_SUS256_SRVW4_TT1_160_WG128_2_1_WGM15
    SolutionIndex: 153
    SolutionNameMin: Cijk_Alik_Bljk_HBH_MT256x160x64_MI32x32x8x1_SE_1LDSB1_AF0EM8_GRVW4_LBSPP128_LPA8_LPB8_PLR9_SU0_SUS256_SRVW4_TT2_160_WG128_2_1_WGM15
    SolutionIndex: 154
    SolutionNameMin: Cijk_Alik_Bljk_HBH_MT64x128x32_MI32x32x8x1_SE_1LDSB1_AF0EM8_GRVW8_LBSPP128_LPA8_LPB8_PLR5_SU0_SUS256_SRVW4_TT1_64_WG64_4_1_WGM15
    SolutionIndex: 155
    SolutionNameMin: Cijk_Alik_Bljk_HBH_MT128x128x32_MI32x32x8x1_SE_1LDSB1_AF0EM8_GRVW8_LBSPP128_LPA8_LPB8_PLR5_SU0_SUS256_SRVW4_TT2_64_WG64_4_1_WGM15
    SolutionIndex: 156
    SolutionNameMin: Cijk_Alik_Bljk_HBH_MT128x256x32_MI32x32x8x1_SE_1LDSB1_AF0EM8_GRVW8_LBSPP128_LPA8_LPB8_PLR5_SU0_SUS256_SRVW4_TT2_128_WG64_4_1_WGM15
    SolutionIndex: 157
    SolutionNameMin: Cijk_Alik_Bljk_HBH_MT256x128x32_MI32x32x8x1_SE_1LDSB1_AF0EM8_GRVW8_LBSPP128_LPA8_LPB8_PLR5_SU0_SUS256_SRVW4_TT4_64_WG64_4_1_WGM15
    SolutionIndex: 158
    SolutionNameMin: Cijk_Alik_Bljk_HBH_MT64x64x64_MI32x32x8x1_SE_1LDSB1_AF0EM8_GRVW8_LBSPP128_LPA8_LPB8_PLR9_SU0_SUS256_SRVW4_TT1_32_WG64_4_1_WGM15
    SolutionIndex: 159
    SolutionNameMin: Cijk_Alik_Bljk_HBH_MT64x128x64_MI32x32x8x1_SE_1LDSB1_AF0EM8_GRVW8_LBSPP128_LPA8_LPB8_PLR9_SU0_SUS256_SRVW4_TT1_64_WG64_4_1_WGM15
    SolutionIndex: 160
    SolutionNameMin: Cijk_Alik_Bljk_HBH_MT128x128x64_MI32x32x8x1_SE_1LDSB1_AF0EM8_GRVW8_LBSPP128_LPA8_LPB8_PLR9_SU0_SUS256_SRVW4_TT2_64_WG64_4_1_WGM15
    SolutionIndex: 161
    SolutionNameMin: Cijk_Alik_Bljk_HBH_MT128x96x64_MI32x32x8x1_SE_1LDSB1_AF0EM8_GRVW8_LBSPP128_LPA8_LPB8_PLR9_SU0_SUS256_SRVW4_TT1_96_WG128_2_1_WGM15
    SolutionIndex: 162
    SolutionNameMin: Cijk_Alik_Bljk_HBH_MT128x160x64_MI32x32x8x1_SE_1LDSB1_AF0EM8_GRVW8_LBSPP128_LPA8_LPB8_PLR9_SU0_SUS256_SRVW4_TT1_160_WG128_2_1_WGM15
    SolutionIndex: 163
    SolutionNameMin: Cijk_Alik_Bljk_HBH_MT64x64x32_MI32x32x8x1_SE_1LDSB1_AF0EM8_GRVW2_LBSPP128_LPA8_LPB8_PLR5_SU32_SUS128_SRVW4_TT1_32_WG64_4_1_WGM15
    SolutionIndex: 164
    SolutionNameMin: Cijk_Alik_Bljk_HBH_MT128x128x32_MI32x32x8x1_SE_1LDSB1_AF0EM8_GRVW2_LBSPP128_LPA8_LPB8_PLR5_SU32_SUS128_SRVW4_TT2_64_WG64_4_1_WGM15
    SolutionIndex: 165
    SolutionNameMin: Cijk_Alik_Bljk_HBH_MT256x256x32_MI32x32x8x1_SE_1LDSB1_AF0EM8_GRVW2_LBSPP128_LPA8_LPB8_PLR5_SU32_SUS128_SRVW4_TT4_128_WG64_4_1_WGM15
    SolutionIndex: 166
    SolutionNameMin: Cijk_Alik_Bljk_HBH_MT128x160x32_MI32x32x8x1_SE_1LDSB1_AF0EM8_GRVW2_LBSPP128_LPA8_LPB8_PLR5_SU32_SUS128_SRVW4_TT1_160_WG128_2_1_WGM15
    SolutionIndex: 167
    SolutionNameMin: Cijk_Alik_Bljk_HBH_MT128x256x64_MI32x32x8x1_SE_1LDSB1_AF0EM8_GRVW2_LBSPP128_LPA8_LPB8_PLR9_SU32_SUS128_SRVW4_TT2_128_WG64_4_1_WGM15
    SolutionIndex: 168
    SolutionNameMin: Cijk_Alik_Bljk_HBH_MT128x160x32_MI32x32x8x1_SE_1LDSB1_AF0EM8_GRVW4_LBSPP128_LPA8_LPB8_PLR5_SU32_SUS128_SRVW4_TT1_160_WG128_2_1_WGM15
    SolutionIndex: 169
    SolutionNameMin: Cijk_Alik_Bljk_HBH_MT64x64x64_MI32x32x8x1_SE_1LDSB1_AF0EM8_GRVW4_LBSPP128_LPA8_LPB8_PLR9_SU32_SUS128_SRVW4_TT1_32_WG64_4_1_WGM15
    SolutionIndex: 170
    SolutionNameMin: Cijk_Alik_Bljk_HBH_MT128x128x64_MI32x32x8x1_SE_1LDSB1_AF0EM8_GRVW4_LBSPP128_LPA8_LPB8_PLR9_SU32_SUS128_SRVW4_TT2_64_WG64_4_1_WGM15
    SolutionIndex: 171
    SolutionNameMin: Cijk_Alik_Bljk_HBH_MT128x288x64_MI32x32x8x1_SE_1LDSB1_AF0EM8_GRVW4_LBSPP128_LPA8_LPB8_PLR9_SU32_SUS128_SRVW4_TT1_288_WG128_2_1_WGM15
    SolutionIndex: 172
    SolutionNameMin: Cijk_Alik_Bljk_HBH_MT128x160x64_MI32x32x8x1_SE_1LDSB1_AF0EM8_GRVW4_LBSPP128_LPA8_LPB8_PLR9_SU32_SUS128_SRVW4_TT1_160_WG128_2_1_WGM15
    SolutionIndex: 173
    SolutionNameMin: Cijk_Alik_Bljk_HBH_MT64x128x32_MI32x32x8x1_SE_1LDSB1_AF0EM8_GRVW8_LBSPP128_LPA8_LPB8_PLR5_SU32_SUS128_SRVW4_TT1_64_WG64_4_1_WGM15
    SolutionIndex: 174
    SolutionNameMin: Cijk_Alik_Bljk_HBH_MT128x128x32_MI32x32x8x1_SE_1LDSB1_AF0EM8_GRVW8_LBSPP128_LPA8_LPB8_PLR5_SU32_SUS128_SRVW4_TT2_64_WG64_4_1_WGM15
    SolutionIndex: 175
    SolutionNameMin: Cijk_Alik_Bljk_HBH_MT128x256x32_MI32x32x8x1_SE_1LDSB1_AF0EM8_GRVW8_LBSPP128_LPA8_LPB8_PLR5_SU32_SUS128_SRVW4_TT2_128_WG64_4_1_WGM15
    SolutionIndex: 176
    SolutionNameMin: Cijk_Alik_Bljk_HBH_MT32x64x64_MI16x16x16x1_SE_1LDSB1_AF0EM8_GRVW8_LBSPP128_LPA16_LPB16_PLR5_SU32_SUS128_SRVW4_TT1_32_WG32_8_1_WGM15
    SolutionIndex: 177
    SolutionNameMin: Cijk_Alik_Bljk_HBH_MT64x32x64_MI16x16x16x1_SE_1LDSB1_AF0EM8_GRVW8_LBSPP128_LPA16_LPB16_PLR5_SU32_SUS128_SRVW4_TT2_16_WG32_8_1_WGM15
    SolutionIndex: 178
    SolutionNameMin: Cijk_Alik_Bljk_HBH_MT64x64x64_MI32x32x8x1_SE_1LDSB1_AF0EM8_GRVW8_LBSPP128_LPA8_LPB8_PLR9_SU32_SUS128_SRVW4_TT1_32_WG64_4_1_WGM15
    SolutionIndex: 179
    SolutionNameMin: Cijk_Alik_Bljk_HBH_MT64x128x64_MI32x32x8x1_SE_1LDSB1_AF0EM8_GRVW8_LBSPP128_LPA8_LPB8_PLR9_SU32_SUS128_SRVW4_TT1_64_WG64_4_1_WGM15
    SolutionIndex: 180
    SolutionNameMin: Cijk_Alik_Bljk_HBH_MT128x64x64_MI32x32x8x1_SE_1LDSB1_AF0EM8_GRVW8_LBSPP128_LPA8_LPB8_PLR9_SU32_SUS128_SRVW4_TT2_32_WG64_4_1_WGM15
    SolutionIndex: 181
    SolutionNameMin: Cijk_Alik_Bljk_HBH_MT128x128x64_MI32x32x8x1_SE_1LDSB1_AF0EM8_GRVW8_LBSPP128_LPA8_LPB8_PLR9_SU32_SUS128_SRVW4_TT2_64_WG64_4_1_WGM15
    SolutionIndex: 182
    SolutionNameMin: Cijk_Alik_Bljk_HBH_MT128x96x64_MI32x32x8x1_SE_1LDSB1_AF0EM8_GRVW8_LBSPP128_LPA8_LPB8_PLR9_SU32_SUS128_SRVW4_TT1_96_WG128_2_1_WGM15
    SolutionIndex: 183
    SolutionNameMin: Cijk_Alik_Bljk_HBH_MT96x128x64_MI32x32x8x1_SE_1LDSB1_AF0EM8_GRVW8_LBSPP128_LPA8_LPB8_PLR9_SU32_SUS128_SRVW0_TT3_32_WG32_8_1_WGM15
    SolutionIndex: 184
    SolutionNameMin: Cijk_Alik_Bljk_HBH_MT128x160x64_MI32x32x8x1_SE_1LDSB1_AF0EM8_GRVW8_LBSPP128_LPA8_LPB8_PLR9_SU32_SUS128_SRVW4_TT1_160_WG128_2_1_WGM15
    SolutionIndex: 185
    SolutionNameMin: Cijk_Alik_Bljk_HBH_MT256x144x64_MI16x16x16x1_SE_1LDSB1_AF0EM8_GRVW2_LBSPP128_LPA16_LPB16_PLR5_SU32_SUS256_SRVW4_TT4_144_WG64_4_1_WGM15
    SolutionIndex: 186
    SolutionNameMin: Cijk_Alik_Bljk_HBH_MT128x128x64_MI32x32x8x1_SE_1LDSB1_AF0EM8_GRVW4_LBSPP128_LPA8_LPB8_PLR9_SU32_SUS256_SRVW4_TT2_64_WG64_4_1_WGM15
    SolutionIndex: 187
    SolutionNameMin: Cijk_Alik_Bljk_HBH_MT64x64x32_MI32x32x8x1_SE_1LDSB1_AF0EM8_GRVW8_LBSPP128_LPA8_LPB8_PLR5_SU32_SUS256_SRVW4_TT1_32_WG64_4_1_WGM15
    SolutionIndex: 188
    SolutionNameMin: Cijk_Alik_Bljk_HBH_MT128x128x32_MI32x32x8x1_SE_1LDSB1_AF0EM8_GRVW8_LBSPP128_LPA8_LPB8_PLR5_SU32_SUS256_SRVW4_TT2_64_WG64_4_1_WGM15
    SolutionIndex: 189
    SolutionNameMin: Cijk_Alik_Bljk_HBH_MT128x256x32_MI32x32x8x1_SE_1LDSB1_AF0EM8_GRVW8_LBSPP128_LPA8_LPB8_PLR5_SU32_SUS256_SRVW4_TT2_128_WG64_4_1_WGM15
    SolutionIndex: 190
    SolutionNameMin: Cijk_Alik_Bljk_HBH_MT64x64x64_MI32x32x8x1_SE_1LDSB1_AF0EM8_GRVW8_LBSPP128_LPA8_LPB8_PLR9_SU32_SUS256_SRVW4_TT1_32_WG64_4_1_WGM15
    SolutionIndex: 191
    SolutionNameMin: Cijk_Alik_Bljk_HBH_MT64x128x64_MI32x32x8x1_SE_1LDSB1_AF0EM8_GRVW8_LBSPP128_LPA8_LPB8_PLR9_SU32_SUS256_SRVW4_TT1_64_WG64_4_1_WGM15
    SolutionIndex: 192
    SolutionNameMin: Cijk_Alik_Bljk_HBH_MT128x128x64_MI32x32x8x1_SE_1LDSB1_AF0EM8_GRVW8_LBSPP128_LPA8_LPB8_PLR9_SU32_SUS256_SRVW4_TT2_64_WG64_4_1_WGM15
    SolutionIndex: 193
    SolutionNameMin: Cijk_Alik_Bljk_HBH_MT128x96x64_MI32x32x8x1_SE_1LDSB1_AF0EM8_GRVW8_LBSPP128_LPA8_LPB8_PLR9_SU32_SUS256_SRVW4_TT1_96_WG128_2_1_WGM15
    SolutionIndex: 194
    SolutionNameMin: Cijk_Alik_Bljk_HBH_MT64x128x64_MI32x32x8x1_SE_1LDSB0_AF0EM8_GRVW2_LBSPP128_LPA8_LPB8_PLR9_SU0_SUS256_SRVW0_TT1_64_WG64_4_1_WGM2
    SolutionIndex: 195
    SolutionNameMin: Cijk_Alik_Bljk_HBH_MT128x144x64_MI16x16x16x1_SE_1LDSB1_AF0EM8_GRVW2_LBSPP128_LPA16_LPB16_PLR5_SU0_SUS256_SRVW0_TT2_144_WG64_4_1_WGM1
    SolutionIndex: 196
    SolutionNameMin: Cijk_Alik_Bljk_HBH_MT144x128x64_MI16x16x16x1_SE_1LDSB1_AF0EM8_GRVW2_LBSPP128_LPA16_LPB16_PLR5_SU0_SUS256_SRVW0_TT9_32_WG16_16_1_WGM1
    SolutionIndex: 197
    SolutionNameMin: Cijk_Alik_Bljk_HBH_MT160x160x64_MI16x16x16x1_SE_1LDSB1_AF0EM8_GRVW2_LBSPP128_LPA16_LPB16_PLR5_SU0_SUS256_SRVW0_TT5_80_WG32_8_1_WGM2
    SolutionIndex: 198
    SolutionNameMin: Cijk_Alik_Bljk_HBH_MT144x128x64_MI16x16x16x1_SE_1LDSB1_AF0EM8_GRVW2_LBSPP128_LPA16_LPB16_PLR5_SU0_SUS256_SRVW0_TT9_32_WG16_16_1_WGM2
    SolutionIndex: 199
    SolutionNameMin: Cijk_Alik_Bljk_HBH_MT64x32x64_MI16x16x16x1_SE_1LDSB1_AF0EM8_GRVW2_LBSPP128_LPA16_LPB16_PLR5_SU0_SUS256_SRVW0_TT2_16_WG32_8_1_WGM1
    SolutionIndex: 200
    SolutionNameMin: Cijk_Alik_Bljk_HBH_MT128x64x64_MI32x32x8x1_SE_1LDSB1_AF0EM8_GRVW8_LBSPP128_LPA8_LPB8_PLR9_SU0_SUS256_SRVW0_TT2_32_WG64_4_1_WGM1
    SolutionIndex: 201
    SolutionNameMin: Cijk_Alik_Bljk_HBH_MT128x128x64_MI32x32x8x1_SE_1LDSB1_AF0EM8_GRVW8_LBSPP128_LPA8_LPB8_PLR9_SU0_SUS256_SRVW0_TT2_64_WG64_4_1_WGM1
    SolutionIndex: 202
    SolutionNameMin: Cijk_Alik_Bljk_HBH_MT128x128x64_MI32x32x8x1_SE_1LDSB1_AF0EM8_GRVW2_LBSPP128_LPA8_LPB8_PLR9_SU0_SUS256_SRVW0_TT2_64_WG64_4_1_WGM2
    SolutionIndex: 203
    SolutionNameMin: Cijk_Alik_Bljk_HBH_MT128x256x64_MI32x32x8x1_SE_1LDSB1_AF0EM8_GRVW2_LBSPP128_LPA8_LPB8_PLR9_SU0_SUS256_SRVW0_TT2_128_WG64_4_1_WGM2
    SolutionIndex: 204
    SolutionNameMin: Cijk_Alik_Bljk_HBH_MT64x64x64_MI32x32x8x1_SE_1LDSB1_AF0EM8_GRVW8_LBSPP128_LPA8_LPB8_PLR9_SU0_SUS256_SRVW0_TT1_32_WG64_4_1_WGM15
    SolutionIndex: 205
    SolutionNameMin: Cijk_Alik_Bljk_HBH_MT128x128x64_MI32x32x8x1_SE_1LDSB1_AF0EM8_GRVW8_LBSPP128_LPA8_LPB8_PLR9_SU32_SUS128_SRVW0_TT2_64_WG64_4_1_WGM15
    SolutionIndex: 206
    SolutionNameMin: Cijk_Alik_Bljk_HBH_MT32x64x64_MI16x16x16x1_SE_1LDSB1_AF0EM8_GRVW8_LBSPP128_LPA16_LPB16_PLR5_SU32_SUS256_SRVW0_TT1_32_WG32_8_1_WGM15
    SolutionIndex: 207
    SolutionNameMin: Cijk_Alik_Bljk_HBH_MT128x128x64_MI32x32x8x1_SE_1LDSB1_AF0EM8_GRVW8_LBSPP128_LPA8_LPB8_PLR9_SU32_SUS256_SRVW0_TT2_64_WG64_4_1_WGM15
    SolutionIndex: 208
    SolutionNameMin: Cijk_Alik_Bljk_HBH_MT32x32x64_MI16x16x16x1_SE_1LDSB0_AF0EM8_GRVW8_LBSPP128_LPA16_LPB16_PLR5_SU0_SUS256_SRVW0_TT1_16_WG32_8_1_WGM1
    SolutionIndex: 209
    SolutionNameMin: Cijk_Alik_Bljk_HBH_MT32x64x64_MI16x16x16x1_SE_1LDSB0_AF0EM8_GRVW8_LBSPP128_LPA16_LPB16_PLR5_SU0_SUS256_SRVW0_TT1_32_WG32_8_1_WGM1
    SolutionIndex: 210
    SolutionNameMin: Cijk_Alik_Bljk_HBH_MT64x32x64_MI16x16x16x1_SE_1LDSB0_AF0EM8_GRVW8_LBSPP128_LPA16_LPB16_PLR5_SU0_SUS256_SRVW0_TT2_16_WG32_8_1_WGM1
    SolutionIndex: 211
    SolutionNameMin: Cijk_Alik_Bljk_HBH_MT64x32x64_MI16x16x16x1_SE_1LDSB0_AF0EM8_GRVW8_LBSPP128_LPA16_LPB16_PLR5_SU0_SUS256_SRVW0_TT2_16_WG32_8_1_WGM2
    SolutionIndex: 212
    SolutionNameMin: Cijk_Alik_Bljk_HBH_MT32x32x64_MI16x16x16x1_SE_1LDSB0_AF0EM8_GRVW8_LBSPP128_LPA16_LPB16_PLR5_SU0_SUS256_SRVW0_TT1_16_WG32_8_1_WGM15
    SolutionIndex: 213
    SolutionNameMin: Cijk_Alik_Bljk_HBH_MT32x64x64_MI16x16x16x1_SE_1LDSB0_AF0EM8_GRVW8_LBSPP128_LPA16_LPB16_PLR5_SU0_SUS256_SRVW0_TT1_32_WG32_8_1_WGM15
    SolutionIndex: 214
    SolutionNameMin: Cijk_Alik_Bljk_HBH_MT32x32x64_MI16x16x16x1_SE_1LDSB0_AF0EM8_GRVW8_LBSPP128_LPA16_LPB16_PLR5_SU32_SUS128_SRVW0_TT1_16_WG32_8_1_WGM15
    SolutionIndex: 215
    SolutionNameMin: Cijk_Alik_Bljk_HBH_MT32x32x32_MI16x16x16x1_SE_1LDSB0_AF0EM1_GRVW2_LBSPP128_LPA16_LPB16_PLR2_SU0_SUS256_SRVW4_TT1_16_WG32_8_1_WGM1
    SolutionIndex: 216
    SolutionNameMin: Cijk_Alik_Bljk_HBH_MT32x32x64_MI16x16x16x1_SE_1LDSB0_AF0EM1_GRVW4_LBSPP128_LPA16_LPB16_PLR5_SU0_SUS256_SRVW4_TT1_16_WG32_8_1_WGM1
    SolutionIndex: 217
    SolutionNameMin: Cijk_Alik_Bljk_HBH_MT32x32x64_MI16x16x16x1_SE_1LDSB0_AF0EM1_GRVW8_LBSPP128_LPA16_LPB16_PLR5_SU0_SUS256_SRVW4_TT1_16_WG32_8_1_WGM1
    SolutionIndex: 218
    SolutionNameMin: Cijk_Alik_Bljk_HBH_MT64x32x64_MI16x16x16x1_SE_1LDSB1_AF0EM1_GRVW2_LBSPP128_LPA16_LPB16_PLR5_SU0_SUS256_SRVW4_TT2_16_WG32_8_1_WGM1
    SolutionIndex: 219
    SolutionNameMin: Cijk_Alik_Bljk_HBH_MT256x160x64_MI32x32x8x1_SE_1LDSB1_AF0EM1_GRVW2_LBSPP128_LPA8_LPB8_PLR9_SU0_SUS256_SRVW4_TT2_160_WG128_2_1_WGM1
    SolutionIndex: 220
    SolutionNameMin: Cijk_Alik_Bljk_HBH_MT32x32x32_MI16x16x16x1_SE_1LDSB1_AF0EM1_GRVW4_LBSPP128_LPA16_LPB16_PLR2_SU0_SUS256_SRVW4_TT1_16_WG32_8_1_WGM1
    SolutionIndex: 221
    SolutionNameMin: Cijk_Alik_Bljk_HBH_MT32x32x32_MI16x16x16x1_SE_1LDSB1_AF0EM1_GRVW8_LBSPP128_LPA16_LPB16_PLR2_SU0_SUS256_SRVW4_TT1_16_WG32_8_1_WGM1
    SolutionIndex: 222
    SolutionNameMin: Cijk_Alik_Bljk_HBH_MT64x64x32_MI32x32x8x1_SE_1LDSB1_AF0EM1_GRVW8_LBSPP128_LPA8_LPB8_PLR5_SU0_SUS256_SRVW4_TT1_32_WG64_4_1_WGM1
    SolutionIndex: 223
    SolutionNameMin: Cijk_Alik_Bljk_HBH_MT64x32x64_MI16x16x16x1_SE_1LDSB1_AF0EM1_GRVW8_LBSPP128_LPA16_LPB16_PLR5_SU0_SUS256_SRVW4_TT2_16_WG32_8_1_WGM1
    SolutionIndex: 224
    SolutionNameMin: Cijk_Alik_Bljk_HBH_MT64x64x32_MI32x32x8x1_SE_1LDSB1_AF0EM1_GRVW2_LBSPP128_LPA8_LPB8_PLR5_SU32_SUS128_SRVW4_TT1_32_WG64_4_1_WGM1
    SolutionIndex: 225
    SolutionNameMin: Cijk_Alik_Bljk_HBH_MT32x32x32_MI16x16x16x1_SE_1LDSB1_AF0EM1_GRVW4_LBSPP128_LPA16_LPB16_PLR2_SU32_SUS128_SRVW4_TT1_16_WG32_8_1_WGM1
    SolutionIndex: 226
    SolutionNameMin: Cijk_Alik_Bljk_HBH_MT32x32x32_MI16x16x16x1_SE_1LDSB1_AF0EM1_GRVW4_LBSPP128_LPA16_LPB16_PLR2_SU0_SUS256_SRVW4_TT1_16_WG32_8_1_WGM2
    SolutionIndex: 227
    SolutionNameMin: Cijk_Alik_Bljk_HBH_MT128x96x64_MI32x32x8x1_SE_1LDSB1_AF0EM1_GRVW8_LBSPP128_LPA8_LPB8_PLR9_SU32_SUS128_SRVW4_TT1_96_WG128_2_1_WGM2
    SolutionIndex: 228
    SolutionNameMin: Cijk_Alik_Bljk_HBH_MT256x160x64_MI32x32x8x1_SE_1LDSB1_AF0EM1_GRVW4_LBSPP128_LPA8_LPB8_PLR9_SU0_SUS256_SRVW4_TT2_160_WG128_2_1_WGM15
    SolutionIndex: 229
    SolutionNameMin: Cijk_Alik_Bljk_HBH_MT128x128x32_MI32x32x8x1_SE_1LDSB1_AF0EM1_GRVW8_LBSPP128_LPA8_LPB8_PLR5_SU0_SUS256_SRVW4_TT2_64_WG64_4_1_WGM15
    SolutionIndex: 230
    SolutionNameMin: Cijk_Alik_Bljk_HBH_MT128x160x32_MI32x32x8x1_SE_1LDSB1_AF0EM1_GRVW2_LBSPP128_LPA8_LPB8_PLR5_SU32_SUS128_SRVW4_TT1_160_WG128_2_1_WGM15
    SolutionIndex: 231
    SolutionNameMin: Cijk_Alik_Bljk_HBH_MT256x160x64_MI32x32x8x1_SE_1LDSB1_AF0EM1_GRVW2_LBSPP128_LPA8_LPB8_PLR9_SU32_SUS128_SRVW4_TT2_160_WG128_2_1_WGM15
    SolutionIndex: 232
    SolutionNameMin: Cijk_Alik_Bljk_HBH_MT128x128x32_MI32x32x8x1_SE_1LDSB1_AF0EM1_GRVW4_LBSPP128_LPA8_LPB8_PLR5_SU32_SUS128_SRVW4_TT2_64_WG64_4_1_WGM15
    SolutionIndex: 233
    SolutionNameMin: Cijk_Alik_Bljk_HBH_MT128x96x64_MI32x32x8x1_SE_1LDSB1_AF0EM1_GRVW4_LBSPP128_LPA8_LPB8_PLR9_SU32_SUS128_SRVW4_TT1_96_WG128_2_1_WGM15
    SolutionIndex: 234
    SolutionNameMin: Cijk_Alik_Bljk_HBH_MT128x256x32_MI32x32x8x1_SE_1LDSB1_AF0EM1_GRVW8_LBSPP128_LPA8_LPB8_PLR5_SU32_SUS128_SRVW4_TT2_128_WG64_4_1_WGM15
    SolutionIndex: 235
    SolutionNameMin: Cijk_Alik_Bljk_HBH_MT256x160x64_MI32x32x8x1_SE_1LDSB1_AF0EM1_GRVW2_LBSPP128_LPA8_LPB8_PLR9_SU32_SUS256_SRVW4_TT2_160_WG128_2_1_WGM15
    SolutionIndex: 236
    SolutionNameMin: Cijk_Alik_Bljk_HBH_MT128x128x32_MI32x32x8x1_SE_1LDSB1_AF0EM1_GRVW8_LBSPP128_LPA8_LPB8_PLR5_SU32_SUS256_SRVW4_TT2_64_WG64_4_1_WGM15
    SolutionIndex: 237
    SolutionNameMin: Cijk_Alik_Bljk_HBH_MT32x32x64_MI16x16x16x1_SE_1LDSB0_AF0EM1_GRVW2_LBSPP128_LPA16_LPB16_PLR5_SU0_SUS256_SRVW0_TT1_16_WG32_8_1_WGM1
    SolutionIndex: 238
    SolutionNameMin: Cijk_Alik_Bljk_HBH_MT32x32x64_MI16x16x16x1_SE_1LDSB0_AF0EM1_GRVW8_LBSPP128_LPA16_LPB16_PLR5_SU0_SUS256_SRVW0_TT1_16_WG32_8_1_WGM1
    SolutionIndex: 239
    SolutionNameMin: Cijk_Alik_Bljk_HBH_MT32x32x64_MI16x16x16x1_SE_1LDSB0_AF0EM1_GRVW8_LBSPP128_LPA16_LPB16_PLR5_SU32_SUS256_SRVW0_TT1_16_WG32_8_1_WGM2
    SolutionIndex: 240
    SolutionNameMin: Cijk_Alik_Bljk_HBH_MT32x32x64_MI16x16x16x1_SE_1LDSB0_AF0EM1_GRVW2_LBSPP128_LPA16_LPB16_PLR5_SU0_SUS256_SRVW0_TT1_16_WG32_8_1_WGM1
    SolutionIndex: 241
    SolutionNameMin: Cijk_Alik_Bljk_HBH_MT32x32x64_MI16x16x16x1_SE_1LDSB0_AF0EM1_GRVW4_LBSPP128_LPA16_LPB16_PLR5_SU0_SUS256_SRVW0_TT1_16_WG32_8_1_WGM1
    SolutionIndex: 242
    SolutionNameMin: Cijk_Alik_Bljk_HBH_MT32x32x64_MI16x16x16x1_SE_1LDSB0_AF0EM1_GRVW4_LBSPP128_LPA16_LPB16_PLR5_SU32_SUS128_SRVW0_TT1_16_WG32_8_1_WGM2
    SolutionIndex: 243
    SolutionNameMin: Cijk_Alik_Bljk_HBH_MT32x32x64_MI16x16x16x1_SE_1LDSB0_AF0EM1_GRVW8_LBSPP128_LPA16_LPB16_PLR5_SU32_SUS256_SRVW0_TT1_16_WG32_8_1_WGM2
    SolutionIndex: 244
    SolutionNameMin: Cijk_Alik_Bljk_HBH_MT32x32x64_MI16x16x16x1_SE_1LDSB0_AF0EM1_GRVW8_LBSPP128_LPA16_LPB16_PLR5_SU32_SUS256_SRVW0_TT1_16_WG32_8_1_WGM2
    SolutionIndex: 245
    SolutionNameMin: Cijk_Alik_Bljk_HBH_MT16x16x32_MI16x16x16x1_SE_1LDSB0_AF0EM1_GRVW2_LBSPP128_LPA16_LPB16_PLR2_SU0_SUS256_SRVW0_TT1_16_WG16_4_1_WGM1
    SolutionIndex: 246
    SolutionNameMin: Cijk_Alik_Bljk_HBH_MT16x16x32_MI16x16x16x1_SE_1LDSB0_AF0EM1_GRVW4_LBSPP128_LPA16_LPB16_PLR2_SU0_SUS256_SRVW0_TT1_16_WG16_4_1_WGM1
    SolutionIndex: 247
    SolutionNameMin: Cijk_Alik_Bljk_HBH_MT16x16x64_MI16x16x16x1_SE_1LDSB0_AF0EM8_GRVW8_LBSPP128_LPA16_LPB16_PLR5_SU0_SUS256_SRVW0_TT1_16_WG16_4_1_WGM1
    SolutionIndex: 248
    SolutionNameMin: Cijk_Alik_Bljk_HBH_MT16x16x128_MI16x16x16x1_SE_1LDSB0_AF0EM1_GRVW8_LBSPP256_LPA16_LPB16_PLR9_SU0_SUS256_SRVW0_TT1_16_WG16_4_1_WGM1
    SolutionIndex: 249
    SolutionNameMin: Cijk_Alik_Bljk_HBH_MT16x16x128_MI16x16x16x1_SE_1LDSB0_AF0EM8_GRVW8_LBSPP256_LPA16_LPB16_PLR9_SU0_SUS256_SRVW0_TT1_16_WG16_4_1_WGM1
    SolutionIndex: 250
    SolutionNameMin: Cijk_Alik_Bljk_HBH_MT16x16x128_MI16x16x16x1_SE_1LDSB0_AF0EM8_GRVW8_LBSPP256_LPA16_LPB16_PLR9_SU32_SUS256_SRVW0_TT1_16_WG16_4_1_WGM1
    SolutionIndex: 251
    SolutionNameMin: Cijk_Alik_Bljk_HBH_MT16x16x32_MI16x16x16x1_SE_1LDSB0_AF0EM1_GRVW2_LBSPP128_LPA16_LPB16_PLR2_SU0_SUS256_SRVW0_TT1_16_WG16_4_1_WGM2
    SolutionIndex: 252
    SolutionNameMin: Cijk_Alik_Bljk_HBH_MT16x16x128_MI16x16x16x1_SE_1LDSB0_AF0EM8_GRVW8_LBSPP256_LPA16_LPB16_PLR9_SU0_SUS256_SRVW0_TT1_16_WG16_4_1_WGM2
    SolutionIndex: 253
    SolutionNameMin: Cijk_Alik_Bljk_HBH_MT16x16x32_MI16x16x16x1_SE_1LDSB0_AF0EM1_GRVW4_LBSPP128_LPA16_LPB16_PLR2_SU0_SUS256_SRVW0_TT1_16_WG16_4_1_WGM15
    SolutionIndex: 254
    SolutionNameMin: Cijk_Alik_Bljk_HBH_MT16x16x64_MI16x16x16x1_SE_1LDSB0_AF0EM1_GRVW8_LBSPP128_LPA16_LPB16_PLR5_SU0_SUS256_SRVW0_TT1_16_WG16_4_1_WGM15
    SolutionIndex: 255
    SolutionNameMin: Cijk_Alik_Bljk_HBH_MT16x16x128_MI16x16x16x1_SE_1LDSB0_AF0EM1_GRVW8_LBSPP256_LPA16_LPB16_PLR9_SU0_SUS256_SRVW0_TT1_16_WG16_4_1_WGM15
    SolutionIndex: 256
    SolutionNameMin: Cijk_Alik_Bljk_HBH_MT16x16x128_MI16x16x16x1_SE_1LDSB0_AF0EM8_GRVW8_LBSPP256_LPA16_LPB16_PLR9_SU0_SUS256_SRVW0_TT1_16_WG16_4_1_WGM15
    SolutionIndex: 257
    SolutionNameMin: Cijk_Alik_Bljk_HBH_MT16x16x32_MI16x16x16x1_SE_1LDSB1_AF0EM1_GRVW2_LBSPP128_LPA16_LPB16_PLR2_SU0_SUS256_SRVW0_TT1_16_WG16_4_1_WGM1
    SolutionIndex: 258
    SolutionNameMin: Cijk_Alik_Bljk_HBH_MT16x16x32_MI16x16x16x1_SE_1LDSB1_AF0EM1_GRVW8_LBSPP128_LPA16_LPB16_PLR2_SU0_SUS256_SRVW0_TT1_16_WG16_4_1_WGM1
    SolutionIndex: 259
    SolutionNameMin: Cijk_Alik_Bljk_HBH_MT64x4x64_MI4x4x4x16_SE_1LDSB1_AF0EM1_GRVW8_LBSPP128_LPA8_LPB8_PLR17_SU0_SUS256_SRVW0_TT1_4_WG64_1_1_WGM1
    SolutionIndex: 260
    SolutionNameMin: Cijk_Alik_Bljk_HBH_MT16x16x32_MI16x16x16x1_SE_1LDSB1_AF0EM1_GRVW2_LBSPP128_LPA16_LPB16_PLR2_SU0_SUS256_SRVW4_TT1_16_WG16_4_1_WGM1
    SolutionIndex: 261
    SolutionNameMin: Cijk_Alik_Bljk_HBH_MT16x16x128_MI16x16x16x1_SE_1LDSB1_AF0EM1_GRVW8_LBSPP256_LPA16_LPB16_PLR9_SU0_SUS256_SRVW0_TT1_16_WG16_4_1_WGM1
    SolutionIndex: 262
    SolutionNameMin: Cijk_Alik_Bljk_HBH_MT16x16x128_MI16x16x16x1_SE_1LDSB1_AF0EM8_GRVW8_LBSPP256_LPA16_LPB16_PLR9_SU0_SUS256_SRVW0_TT1_16_WG16_4_1_WGM1
    SolutionIndex: 263
    SolutionNameMin: Cijk_Alik_Bljk_HBH_MT16x16x128_MI16x16x16x1_SE_1LDSB1_AF0EM8_GRVW8_LBSPP256_LPA16_LPB16_PLR9_SU0_SUS256_SRVW4_TT1_16_WG16_4_1_WGM1
    SolutionIndex: 264
    SolutionNameMin: Cijk_Alik_Bljk_HBH_MT16x16x32_MI16x16x16x1_SE_1LDSB1_AF0EM1_GRVW4_LBSPP128_LPA16_LPB16_PLR2_SU32_SUS256_SRVW0_TT1_16_WG16_4_1_WGM1
    SolutionIndex: 265
    SolutionNameMin: Cijk_Alik_Bljk_HBH_MT16x16x128_MI16x16x16x1_SE_1LDSB1_AF0EM8_GRVW4_LBSPP256_LPA16_LPB16_PLR9_SU32_SUS256_SRVW0_TT1_16_WG16_4_1_WGM1
    SolutionIndex: 266
    SolutionNameMin: Cijk_Alik_Bljk_HBH_MT16x16x128_MI16x16x16x1_SE_1LDSB1_AF0EM8_GRVW8_LBSPP256_LPA16_LPB16_PLR9_SU32_SUS256_SRVW0_TT1_16_WG16_4_1_WGM1
    SolutionIndex: 267
    SolutionNameMin: Cijk_Alik_Bljk_HBH_MT16x16x128_MI16x16x16x1_SE_1LDSB1_AF0EM1_GRVW8_LBSPP256_LPA16_LPB16_PLR9_SU0_SUS256_SRVW0_TT1_16_WG16_4_1_WGM2
    SolutionIndex: 268
    SolutionNameMin: Cijk_Alik_Bljk_HBH_MT16x16x128_MI16x16x16x1_SE_1LDSB1_AF0EM1_GRVW8_LBSPP256_LPA16_LPB16_PLR9_SU0_SUS256_SRVW0_TT1_16_WG16_4_1_WGM15
    SolutionIndex: 269
    SolutionNameMin: Cijk_Alik_Bljk_HBH_MT16x16x128_MI16x16x16x1_SE_1LDSB1_AF0EM8_GRVW8_LBSPP256_LPA16_LPB16_PLR9_SU0_SUS256_SRVW0_TT1_16_WG16_4_1_WGM15
    SolutionIndex: 270
    SolutionNameMin: Cijk_Alik_Bljk_HBH_MT16x16x32_MI16x16x16x1_SE_1LDSB1_AF0EM1_GRVW2_LBSPP128_LPA16_LPB16_PLR2_SU32_SUS256_SRVW0_TT1_16_WG16_4_1_WGM15
    SolutionIndex: 271
    SolutionNameMin: Cijk_Alik_Bljk_HBH_MT16x16x32_MI16x16x16x1_SE_1LDSB1_AF0EM1_GRVW2_LBSPP128_LPA16_LPB16_PLR2_SU32_SUS256_SRVW4_TT1_16_WG16_4_1_WGM15
- - - [7680, 8192, 1, 8192, 8384, 8384, 8384, 8384]
    - [81, 95.518]
  - - [3840, 4096, 1, 4096, 4192, 4192, 4192, 4192]
    - [90, 93.606]
  - - [1920, 2048, 1, 2048, 2080, 2080, 2080, 2080]
    - [0, 87.227]
  - - [960, 1024, 1, 1024, 1056, 1056, 1056, 1056]
    - [19, 40.781]
  - - [480, 512, 1, 512, 544, 544, 544, 544]
    - [7, 12.14]
  - - [8192, 7680, 1, 8192, 8384, 8384, 8384, 8384]
    - [42, 95.447]
  - - [4096, 3840, 1, 4096, 4192, 4192, 4192, 4192]
    - [81, 93.606]
  - - [2048, 1920, 1, 2048, 2080, 2080, 2080, 2080]
    - [157, 86.926]
  - - [1024, 960, 1, 1024, 1056, 1056, 1056, 1056]
    - [29, 40.959]
  - - [512, 480, 1, 512, 544, 544, 544, 544]
    - [30, 11.776]
  - - [8192, 8192, 1, 8192, 8384, 8384, 8384, 8384]
    - [153, 92.328]
  - - [4096, 4096, 1, 4096, 4192, 4192, 4192, 4192]
    - [22, 86.324]
  - - [2048, 2048, 1, 2048, 2080, 2080, 2080, 2080]
    - [119, 79.91]
  - - [1024, 1024, 1, 1024, 1056, 1056, 1056, 1056]
    - [183, 41.353]
  - - [512, 512, 1, 512, 544, 544, 544, 544]
    - [176, 12.078]
  - - [512, 512, 16, 64, 512, 512, 64, 64]
    - [75, 20.935]
  - - [512, 512, 128, 64, 512, 512, 64, 64]
    - [135, 31.353]
  - - [1024, 1, 1, 1024, 1024, 1024, 1024, 1024]
    - [263, 0.101]
  - - [1024, 77, 1, 1024, 1024, 1024, 1024, 1024]
    - [13, 5.284]
  - - [1024, 512, 1, 1024, 1024, 1024, 1024, 1024]
    - [68, 24.272]
  - - [1024, 512, 1, 4096, 1024, 1024, 4096, 4096]
    - [207, 32.363]
  - - [4096, 512, 1, 1024, 4096, 4096, 1024, 1024]
    - [44, 55.212]
  - - [128, 128, 128, 64, 128, 128, 64, 64]
    - [74, 13.956]
  - - [128, 128, 160, 64, 128, 128, 64, 64]
    - [54, 16.527]
  - - [1024, 10, 1, 1024, 1024, 1024, 1024, 1024]
    - [262, 1.055]
  - - [1024, 200, 1, 1024, 1024, 1024, 1024, 1024]
    - [36, 12.421]
  - - [1024, 1280, 1, 1024, 1024, 1024, 1024, 1024]
    - [193, 43.614]
  - - [1024, 1280, 1, 4096, 1024, 1024, 4096, 4096]
    - [203, 48.875]
  - - [4096, 1280, 1, 1024, 4096, 4096, 1024, 1024]
    - [115, 60.1]
  - - [128, 128, 624, 64, 128, 128, 64, 64]
    - [163, 19.69]
  - - [1024, 39, 1, 1024, 1024, 1024, 1024, 1024]
    - [206, 2.835]
  - - [1024, 780, 1, 1024, 1024, 1024, 1024, 1024]
    - [191, 33.28]
  - - [1024, 4992, 1, 1024, 1024, 1024, 1024, 1024]
    - [100, 60.854]
  - - [1024, 4992, 1, 4096, 1024, 1024, 4096, 4096]
    - [43, 67.128]
  - - [4096, 4992, 1, 1024, 4096, 4096, 1024, 1024]
    - [145, 71.514]
  - - [512, 512, 64, 64, 512, 512, 64, 64]
    - [145, 29.818]
  - - [1024, 4, 1, 1024, 1024, 1024, 1024, 1024]
    - [262, 0.409]
  - - [1024, 308, 1, 1024, 1024, 1024, 1024, 1024]
    - [127, 16.699]
  - - [1024, 2048, 1, 1024, 1024, 1024, 1024, 1024]
    - [137, 54.464]
  - - [1024, 2048, 1, 4096, 1024, 1024, 4096, 4096]
    - [152, 60.994]
  - - [4096, 2048, 1, 1024, 4096, 4096, 1024, 1024]
    - [72, 65.893]
  - - [128, 128, 640, 64, 128, 128, 64, 64]
    - [65, 19.688]
  - - [1024, 40, 1, 1024, 1024, 1024, 1024, 1024]
    - [7, 2.824]
  - - [1024, 800, 1, 1024, 1024, 1024, 1024, 1024]
    - [179, 33.406]
  - - [1024, 5120, 1, 1024, 1024, 1024, 1024, 1024]
    - [124, 59.885]
  - - [1024, 5120, 1, 4096, 1024, 1024, 4096, 4096]
    - [43, 65.871]
  - - [4096, 5120, 1, 1024, 4096, 4096, 1024, 1024]
    - [96, 74.489]
  - - [128, 128, 656, 64, 128, 128, 64, 64]
    - [187, 19.746]
  - - [1024, 41, 1, 1024, 1024, 1024, 1024, 1024]
    - [7, 2.894]
  - - [1024, 820, 1, 1024, 1024, 1024, 1024, 1024]
    - [24, 33.953]
  - - [1024, 5248, 1, 1024, 1024, 1024, 1024, 1024]
    - [100, 60.374]
  - - [1024, 5248, 1, 4096, 1024, 1024, 4096, 4096]
    - [186, 65.354]
  - - [4096, 5248, 1, 1024, 4096, 4096, 1024, 1024]
    - [56, 74.367]
  - - [512, 512, 80, 64, 512, 512, 64, 64]
    - [164, 29.907]
  - - [1024, 5, 1, 1024, 1024, 1024, 1024, 1024]
    - [252, 0.496]
  - - [1024, 385, 1, 1024, 1024, 1024, 1024, 1024]
    - [158, 21.466]
  - - [1024, 2560, 1, 1024, 1024, 1024, 1024, 1024]
    - [43, 55.091]
  - - [1024, 2560, 1, 4096, 1024, 1024, 4096, 4096]
    - [84, 63.318]
  - - [4096, 2560, 1, 1024, 4096, 4096, 1024, 1024]
    - [126, 71.469]
  - - [512, 512, 96, 64, 512, 512, 64, 64]
    - [145, 29.848]
  - - [1024, 6, 1, 1024, 1024, 1024, 1024, 1024]
    - [256, 0.6]
  - - [1024, 462, 1, 1024, 1024, 1024, 1024, 1024]
    - [190, 23.25]
  - - [1024, 3072, 1, 1024, 1024, 1024, 1024, 1024]
    - [155, 55.011]
  - - [1024, 3072, 1, 4096, 1024, 1024, 4096, 4096]
    - [107, 64.174]
  - - [4096, 3072, 1, 1024, 4096, 4096, 1024, 1024]
    - [171, 67.441]
  - - [1024, 8, 1, 1024, 1024, 1024, 1024, 1024]
    - [250, 0.801]
  - - [1024, 160, 1, 1024, 1024, 1024, 1024, 1024]
    - [25, 10.467]
  - - [1024, 1024, 1, 1024, 1024, 1024, 1024, 1024]
    - [182, 36.146]
  - - [1024, 1024, 1, 4096, 1024, 1024, 4096, 4096]
    - [32, 43.785]
  - - [4096, 1024, 1, 1024, 4096, 4096, 1024, 1024]
    - [120, 62.221]
  - - [128, 128, 144, 64, 128, 128, 64, 64]
    - [53, 15.195]
  - - [1024, 9, 1, 1024, 1024, 1024, 1024, 1024]
    - [249, 0.91]
  - - [1024, 180, 1, 1024, 1024, 1024, 1024, 1024]
    - [35, 11.323]
  - - [1024, 1152, 1, 1024, 1024, 1024, 1024, 1024]
    - [124, 41.562]
  - - [1024, 1152, 1, 4096, 1024, 1024, 4096, 4096]
    - [197, 45.814]
  - - [4096, 1152, 1, 1024, 4096, 4096, 1024, 1024]
    - [161, 57.824]
  - - [128, 32768, 1, 256, 128, 128, 256, 256]
    - [133, 35.383]
  - - [256, 32768, 1, 512, 256, 256, 512, 512]
    - [182, 56.374]
  - - [512, 32768, 1, 13, 512, 512, 13, 13]
    - [155, 5.429]
  - - [512, 32768, 1, 1024, 512, 512, 1024, 1024]
    - [83, 71.015]
  - - [1024, 32768, 1, 479, 1024, 1024, 479, 479]
    - [80, 52.778]
  - - [1024, 32768, 1, 1024, 1024, 1024, 1024, 1024]
    - [56, 79.436]
  - - [32768, 1, 1, 256, 32768, 32768, 256, 256]
    - [259, 0.53]
  - - [64, 128, 512, 128, 64, 64, 128, 128]
    - [92, 20.507]
  - - [128, 128, 512, 64, 128, 128, 64, 64]
    - [154, 19.104]
  - - [1024, 32, 1, 1024, 1024, 1024, 1024, 131072]
    - [7, 2.166]
  - - [1024, 4096, 1, 1024, 1024, 1024, 1024, 1024]
    - [95, 68.011]
  - - [1024, 4096, 1, 4096, 1024, 1024, 4096, 4096]
    - [119, 74.4]
  - - [4096, 4096, 1, 1024, 4096, 4096, 1024, 1024]
    - [96, 70.765]
  - - [30528, 4096, 1, 1024, 30528, 30528, 1024, 1024]
    - [175, 85.154]
  - - [64, 512, 64, 512, 64, 64, 512, 512]
    - [127, 28.386]
  - - [1024, 4, 1, 1024, 1024, 1024, 1024, 524288]
    - [250, 0.409]
  - - [30528, 2048, 1, 1024, 30528, 30528, 1024, 1024]
    - [112, 82.222]
  - - [1024, 8192, 1, 1024, 1024, 1024, 1024, 1024]
    - [109, 64.777]
  - - [1024, 8192, 1, 4096, 1024, 1024, 4096, 4096]
    - [185, 76.306]
  - - [1024, 9600, 1, 1024, 1024, 1024, 1024, 1024]
    - [48, 76.404]
  - - [1024, 9600, 1, 4096, 1024, 1024, 4096, 4096]
    - [143, 89.912]
  - - [4096, 8192, 1, 1024, 4096, 4096, 1024, 1024]
    - [96, 79.104]
  - - [4096, 9600, 1, 1024, 4096, 4096, 1024, 1024]
    - [123, 78.932]
  - - [33712, 8192, 1, 1024, 33712, 33712, 1024, 1024]
    - [175, 86.895]
  - - [33712, 9600, 1, 1024, 33712, 33712, 1024, 1024]
    - [175, 85.734]
  - - [1024, 10064, 1, 1024, 1024, 1024, 1024, 1024]
    - [56, 67.274]
  - - [1024, 10064, 1, 4096, 1024, 1024, 4096, 4096]
    - [156, 76.527]
  - - [1024, 10080, 1, 1024, 1024, 1024, 1024, 1024]
    - [56, 67.244]
  - - [1024, 10080, 1, 4096, 1024, 1024, 4096, 4096]
    - [96, 77.233]
  - - [1024, 10200, 1, 1024, 1024, 1024, 1024, 1024]
    - [175, 66.199]
  - - [1024, 10200, 1, 4096, 1024, 1024, 4096, 4096]
    - [156, 75.371]
  - - [1024, 3840, 1, 1024, 1024, 1024, 1024, 1024]
    - [87, 70.303]
  - - [1024, 3840, 1, 4096, 1024, 1024, 4096, 4096]
    - [87, 78.669]
  - - [1024, 3968, 1, 1024, 1024, 1024, 1024, 1024]
    - [103, 62.501]
  - - [1024, 3968, 1, 4096, 1024, 1024, 4096, 4096]
    - [103, 72.987]
  - - [1024, 6528, 1, 1024, 1024, 1024, 1024, 1024]
    - [175, 62.927]
  - - [1024, 6528, 1, 4096, 1024, 1024, 4096, 4096]
    - [71, 74.596]
  - - [1024, 7104, 1, 1024, 1024, 1024, 1024, 1024]
    - [118, 68.886]
  - - [1024, 7104, 1, 4096, 1024, 1024, 4096, 4096]
    - [102, 84.679]
  - - [1024, 7200, 1, 1024, 1024, 1024, 1024, 1024]
    - [96, 69.817]
  - - [1024, 7200, 1, 4096, 1024, 1024, 4096, 4096]
    - [81, 81.634]
  - - [1024, 8064, 1, 1024, 1024, 1024, 1024, 1024]
    - [171, 68.042]
  - - [1024, 8064, 1, 4096, 1024, 1024, 4096, 4096]
    - [119, 76.494]
  - - [1024, 8160, 1, 1024, 1024, 1024, 1024, 1024]
    - [48, 67.29]
  - - [1024, 8160, 1, 4096, 1024, 1024, 4096, 4096]
    - [88, 77.875]
  - - [1024, 9216, 1, 1024, 1024, 1024, 1024, 1024]
    - [147, 68.462]
  - - [1024, 9216, 1, 4096, 1024, 1024, 4096, 4096]
    - [62, 86.213]
  - - [1024, 9520, 1, 1024, 1024, 1024, 1024, 1024]
    - [88, 69.252]
  - - [1024, 9520, 1, 4096, 1024, 1024, 4096, 4096]
    - [48, 86.762]
  - - [4096, 10064, 1, 1024, 4096, 4096, 1024, 1024]
    - [96, 78.881]
  - - [4096, 10080, 1, 1024, 4096, 4096, 1024, 1024]
    - [175, 78.865]
  - - [4096, 10200, 1, 1024, 4096, 4096, 1024, 1024]
    - [175, 79.788]
  - - [4096, 3840, 1, 1024, 4096, 4096, 1024, 1024]
    - [118, 79.962]
  - - [4096, 3968, 1, 1024, 4096, 4096, 1024, 1024]
    - [147, 72.579]
  - - [4096, 6528, 1, 1024, 4096, 4096, 1024, 1024]
    - [175, 77.065]
  - - [4096, 7104, 1, 1024, 4096, 4096, 1024, 1024]
    - [56, 76.043]
  - - [4096, 7200, 1, 1024, 4096, 4096, 1024, 1024]
    - [48, 80.084]
  - - [4096, 8064, 1, 1024, 4096, 4096, 1024, 1024]
    - [96, 77.221]
  - - [4096, 8160, 1, 1024, 4096, 4096, 1024, 1024]
    - [48, 78.601]
  - - [4096, 9216, 1, 1024, 4096, 4096, 1024, 1024]
    - [96, 80.3]
  - - [4096, 9520, 1, 1024, 4096, 4096, 1024, 1024]
    - [88, 79.524]
  - - [42720, 10080, 1, 1024, 42720, 42720, 1024, 1024]
    - [175, 86.053]
  - - [42720, 3968, 1, 1024, 42720, 42720, 1024, 1024]
    - [175, 84.678]
  - - [42720, 6528, 1, 1024, 42720, 42720, 1024, 1024]
    - [175, 85.299]
  - - [42720, 7104, 1, 1024, 42720, 42720, 1024, 1024]
    - [175, 87.368]
  - - [42720, 7200, 1, 1024, 42720, 42720, 1024, 1024]
    - [175, 85.25]
  - - [42720, 9520, 1, 1024, 42720, 42720, 1024, 1024]
    - [175, 85.211]
  - - [24, 24, 4736, 64, 24, 24, 303104, 303104]
    - [52, 5.154]
  - - [32, 32, 4608, 64, 32, 32, 294912, 294912]
    - [49, 6.482]
  - - [32, 35, 4608, 64, 32, 32, 294912, 294912]
    - [79, 6.662]
  - - [64, 512, 1, 512, 64, 64, 512, 512]
    - [15, 1.707]
  - - [512, 512, 1, 64, 512, 512, 64, 64]
    - [76, 3.079]
  - - [128, 128, 1, 64, 128, 128, 64, 64]
    - [6, 0.196]
  - - [1024, 8, 1, 1024, 1024, 1024, 1024, 131072]
    - [256, 0.818]
  - - [64, 128, 1, 128, 64, 64, 128, 128]
    - [6, 0.163]
  - - [2048, 512, 1, 2048, 2048, 2048, 2048, 2048]
    - [39, 41.869]
  - - [1024, 512, 1, 1600, 1024, 1024, 1600, 1600]
    - [178, 29.85]
  - - [2048, 512, 1, 74, 2048, 2048, 74, 74]
    - [134, 6.982]
  - - [512, 1, 1, 2048, 512, 512, 2048, 2048]
    - [213, 0.091]
  - - [64, 512, 1, 1024, 64, 64, 1024, 1024]
    - [27, 2.275]
  - - [1024, 1600, 1, 560, 1024, 1024, 560, 560]
    - [14, 30.234]
  - - [1600, 1, 1, 1024, 1600, 1600, 1024, 1024]
    - [250, 0.162]
  - - [512, 1600, 1, 512, 512, 512, 512, 512]
    - [38, 25.824]
  - - [1024, 1600, 1, 1024, 1024, 1024, 1024, 1024]
    - [181, 47.435]
  - - [32, 1600, 1, 512, 32, 32, 512, 512]
    - [6, 2.582]
  - - [64, 960, 1, 1024, 64, 64, 1024, 1024]
    - [12, 4.118]
  - - [200, 1, 1, 1024, 200, 200, 1024, 1024]
    - [249, 0.02]
  - - [256, 684, 1, 1024, 256, 256, 1024, 1024]
    - [36, 10.826]
  - - [256, 1280, 1, 1024, 256, 256, 1024, 1024]
    - [68, 17.543]
  - - [256, 1536, 1, 1024, 256, 256, 1024, 1024]
    - [139, 20.705]
  - - [256, 2304, 1, 1024, 256, 256, 1024, 1024]
    - [178, 25.576]
  - - [256, 2560, 1, 1024, 256, 256, 1024, 1024]
    - [31, 27.667]
  - - [256, 2816, 1, 1024, 256, 256, 1024, 1024]
    - [31, 30.3]
  - - [256, 3328, 1, 1024, 256, 256, 1024, 1024]
    - [180, 34.449]
  - - [256, 3584, 1, 1024, 256, 256, 1024, 1024]
    - [159, 36.183]
  - - [256, 4608, 1, 1024, 256, 256, 1024, 1024]
    - [116, 40.374]
  - - [256, 4864, 1, 1024, 256, 256, 1024, 1024]
    - [17, 41.148]
  - - [256, 5376, 1, 1024, 256, 256, 1024, 1024]
    - [10, 46.604]
  - - [256, 5888, 1, 1024, 256, 256, 1024, 1024]
    - [192, 46.899]
  - - [256, 6144, 1, 1024, 256, 256, 1024, 1024]
    - [129, 48.466]
  - - [256, 6400, 1, 1024, 256, 256, 1024, 1024]
    - [170, 49.53]
  - - [256, 6656, 1, 1024, 256, 256, 1024, 1024]
    - [181, 51.838]
  - - [256, 7168, 1, 1024, 256, 256, 1024, 1024]
    - [99, 57.468]
  - - [256, 7424, 1, 1024, 256, 256, 1024, 1024]
    - [99, 59.326]
  - - [256, 7936, 1, 1024, 256, 256, 1024, 1024]
    - [85, 54.384]
  - - [256, 8192, 1, 1024, 256, 256, 1024, 1024]
    - [110, 50.879]
  - - [256, 8448, 1, 1024, 256, 256, 1024, 1024]
    - [172, 51.047]
  - - [256, 8960, 1, 1024, 256, 256, 1024, 1024]
    - [101, 62.094]
  - - [256, 9984, 1, 1024, 256, 256, 1024, 1024]
    - [94, 50.502]
  - - [256, 10496, 1, 1024, 256, 256, 1024, 1024]
    - [21, 53.869]
  - - [256, 11264, 1, 1024, 256, 256, 1024, 1024]
    - [146, 55.489]
  - - [256, 11520, 1, 1024, 256, 256, 1024, 1024]
    - [11, 52.24]
  - - [256, 11776, 1, 1024, 256, 256, 1024, 1024]
    - [174, 52.912]
  - - [256, 12544, 1, 1024, 256, 256, 1024, 1024]
    - [155, 55.548]
  - - [256, 13312, 1, 1024, 256, 256, 1024, 1024]
    - [93, 60.033]
  - - [256, 14336, 1, 1024, 256, 256, 1024, 1024]
    - [87, 66.234]
  - - [256, 14592, 1, 1024, 256, 256, 1024, 1024]
    - [87, 67.672]
  - - [256, 14848, 1, 1024, 256, 256, 1024, 1024]
    - [87, 68.342]
  - - [256, 15104, 1, 1024, 256, 256, 1024, 1024]
    - [140, 69.782]
  - - [256, 16128, 1, 1024, 256, 256, 1024, 1024]
    - [151, 66.61]
  - - [256, 18176, 1, 1024, 256, 256, 1024, 1024]
    - [101, 60.421]
  - - [256, 18944, 1, 1024, 256, 256, 1024, 1024]
    - [184, 63.06]
  - - [256, 19200, 1, 1024, 256, 256, 1024, 1024]
    - [88, 76.59]
  - - [256, 20480, 1, 1024, 256, 256, 1024, 1024]
    - [108, 60.028]
  - - [256, 20992, 1, 1024, 256, 256, 1024, 1024]
    - [145, 60.445]
  - - [256, 21248, 1, 1024, 256, 256, 1024, 1024]
    - [89, 60.684]
  - - [256, 21504, 1, 1024, 256, 256, 1024, 1024]
    - [150, 61.775]
  - - [256, 22016, 1, 1024, 256, 256, 1024, 1024]
    - [160, 62.153]
  - - [256, 22344, 1, 1024, 256, 256, 1024, 1024]
    - [181, 61.384]
  - - [256, 23296, 1, 1024, 256, 256, 1024, 1024]
    - [96, 57.905]
  - - [256, 23552, 1, 1024, 256, 256, 1024, 1024]
    - [96, 58.07]
  - - [256, 31488, 1, 1024, 256, 256, 1024, 1024]
    - [100, 64.428]
  - - [256, 33536, 1, 1024, 256, 256, 1024, 1024]
    - [95, 64.376]
  - - [256, 44505, 1, 1024, 256, 256, 1024, 1024]
    - [156, 67.647]
  - - [960, 1, 1, 2048, 960, 960, 2048, 2048]
    - [212, 0.162]
  - - [1024, 200, 1, 560, 1024, 1024, 560, 560]
    - [57, 7.95]
  - - [1024, 960, 1, 1024, 1024, 1024, 1024, 1024]
    - [29, 37.089]
  - - [1024, 960, 1, 1600, 1024, 1024, 1600, 1600]
    - [182, 45.572]
  - - [1024, 32768, 1, 480, 1024, 1024, 480, 480]
    - [126, 79.373]
  - - [1280, 8976, 1, 256, 1280, 1280, 256, 256]
    - [155, 51.163]
  - - [1792, 8976, 1, 256, 1792, 1792, 256, 256]
    - [66, 54.895]
  - - [2048, 114, 1, 512, 2048, 2048, 512, 512]
    - [177, 10.358]
  - - [2048, 114, 1, 768, 2048, 2048, 768, 768]
    - [177, 12.809]
  - - [2048, 215, 1, 512, 2048, 2048, 512, 512]
    - [169, 16.613]
  - - [2048, 215, 1, 768, 2048, 2048, 768, 768]
    - [190, 20.287]
  - - [2048, 256, 1, 512, 2048, 2048, 512, 512]
    - [113, 19.177]
  - - [2048, 256, 1, 768, 2048, 2048, 768, 768]
    - [68, 22.977]
  - - [2048, 512, 1, 67, 2048, 2048, 67, 67]
    - [134, 6.446]
  - - [2048, 512, 1, 100, 2048, 2048, 100, 100]
    - [134, 8.84]
  - - [2048, 684, 1, 512, 2048, 2048, 512, 512]
    - [33, 30.932]
  - - [2048, 684, 1, 768, 2048, 2048, 768, 768]
    - [99, 37.29]
  - - [2048, 960, 1, 74, 2048, 2048, 74, 74]
    - [144, 10.721]
  - - [2048, 960, 1, 2048, 2048, 2048, 2048, 2048]
    - [131, 58.513]
  - - [2048, 1536, 1, 512, 2048, 2048, 512, 512]
    - [188, 50.243]
  - - [2048, 1536, 1, 768, 2048, 2048, 768, 768]
    - [55, 56.951]
  - - [2048, 8976, 1, 256, 2048, 2048, 256, 256]
    - [66, 53.644]
  - - [2304, 8976, 1, 256, 2304, 2304, 256, 256]
    - [111, 57.881]
  - - [2560, 8976, 1, 256, 2560, 2560, 256, 256]
    - [66, 56.406]
  - - [2816, 8976, 1, 256, 2816, 2816, 256, 256]
    - [66, 59.022]
  - - [3072, 8976, 1, 256, 3072, 3072, 256, 256]
    - [66, 58.358]
  - - [3328, 8976, 1, 256, 3328, 3328, 256, 256]
    - [66, 59.838]
  - - [3840, 8976, 1, 256, 3840, 3840, 256, 256]
    - [66, 58.774]
  - - [4096, 8976, 1, 256, 4096, 4096, 256, 256]
    - [66, 56.391]
  - - [4352, 8976, 1, 256, 4352, 4352, 256, 256]
    - [66, 59.12]
  - - [4608, 8976, 1, 256, 4608, 4608, 256, 256]
    - [174, 59.054]
  - - [4864, 8976, 1, 256, 4864, 4864, 256, 256]
    - [66, 58.664]
  - - [5120, 8976, 1, 256, 5120, 5120, 256, 256]
    - [174, 59.323]
  - - [5376, 8976, 1, 256, 5376, 5376, 256, 256]
    - [175, 59.317]
  - - [5632, 8976, 1, 256, 5632, 5632, 256, 256]
    - [174, 59.282]
  - - [5888, 8976, 1, 256, 5888, 5888, 256, 256]
    - [166, 59.112]
  - - [6144, 8976, 1, 256, 6144, 6144, 256, 256]
    - [168, 59.116]
  - - [6400, 8976, 1, 256, 6400, 6400, 256, 256]
    - [175, 59.969]
  - - [7168, 8976, 1, 256, 7168, 7168, 256, 256]
    - [112, 60.783]
  - - [7936, 8976, 1, 256, 7936, 7936, 256, 256]
    - [174, 59.88]
  - - [8192, 8976, 1, 256, 8192, 8192, 256, 256]
    - [112, 60.145]
  - - [8448, 8976, 1, 256, 8448, 8448, 256, 256]
    - [112, 61.709]
  - - [8960, 8976, 1, 256, 8960, 8960, 256, 256]
    - [112, 60.84]
  - - [9472, 8976, 1, 256, 9472, 9472, 256, 256]
    - [112, 60.731]
  - - [9728, 8976, 1, 256, 9728, 9728, 256, 256]
    - [112, 61.965]
  - - [9984, 8976, 1, 256, 9984, 9984, 256, 256]
    - [112, 61.361]
  - - [10240, 8976, 1, 256, 10240, 10240, 256, 256]
    - [112, 61.96]
  - - [10496, 8976, 1, 256, 10496, 10496, 256, 256]
    - [112, 61.957]
  - - [11264, 8976, 1, 256, 11264, 11264, 256, 256]
    - [112, 62.333]
  - - [11776, 8976, 1, 256, 11776, 11776, 256, 256]
    - [112, 62.636]
  - - [12544, 8976, 1, 256, 12544, 12544, 256, 256]
    - [112, 62.442]
  - - [13312, 8976, 1, 256, 13312, 13312, 256, 256]
    - [112, 62.287]
  - - [13568, 8976, 1, 256, 13568, 13568, 256, 256]
    - [112, 62.612]
  - - [13824, 8976, 1, 256, 13824, 13824, 256, 256]
    - [112, 62.388]
  - - [15104, 8976, 1, 256, 15104, 15104, 256, 256]
    - [112, 63.228]
  - - [15360, 8976, 1, 256, 15360, 15360, 256, 256]
    - [112, 61.914]
  - - [15872, 8976, 1, 256, 15872, 15872, 256, 256]
    - [112, 62.639]
  - - [16128, 8976, 1, 256, 16128, 16128, 256, 256]
    - [175, 62.638]
  - - [17152, 8976, 1, 256, 17152, 17152, 256, 256]
    - [112, 62.675]
  - - [18176, 8976, 1, 256, 18176, 18176, 256, 256]
    - [112, 63.104]
  - - [18688, 8976, 1, 256, 18688, 18688, 256, 256]
    - [112, 63.478]
  - - [18944, 8976, 1, 256, 18944, 18944, 256, 256]
    - [112, 63.111]
  - - [19712, 8976, 1, 256, 19712, 19712, 256, 256]
    - [112, 63.023]
  - - [19968, 8976, 1, 256, 19968, 19968, 256, 256]
    - [112, 62.732]
  - - [20480, 8976, 1, 256, 20480, 20480, 256, 256]
    - [112, 62.746]
  - - [20992, 8976, 1, 256, 20992, 20992, 256, 256]
    - [112, 63.1]
  - - [21248, 8976, 1, 256, 21248, 21248, 256, 256]
    - [112, 63.216]
  - - [23552, 8976, 1, 256, 23552, 23552, 256, 256]
    - [112, 63.096]
  - - [28672, 8976, 1, 256, 28672, 28672, 256, 256]
    - [112, 63.584]
  - - [31488, 8976, 1, 256, 31488, 31488, 256, 256]
    - [112, 63.521]
  - - [33536, 8976, 1, 256, 33536, 33536, 256, 256]
    - [112, 63.894]
  - - [2048, 1024, 1, 2048, 2048, 2048, 2048, 2048]
    - [172, 60.534]
  - - [2048, 1024, 1, 8192, 2048, 2048, 8192, 8192]
    - [184, 67.412]
  - - [2048, 2, 1, 2048, 2048, 2048, 2048, 1048576]
    - [211, 0.573]
  - - [30592, 1024, 1, 2048, 30592, 30592, 2048, 2048]
    - [118, 87.293]
  - - [6144, 1024, 1, 2048, 6144, 6144, 2048, 2048]
    - [136, 66.401]
  - - [8192, 1024, 1, 2048, 8192, 8192, 2048, 2048]
    - [72, 74.159]
  - - [1024, 16, 1, 1024, 1024, 1024, 1024, 524288]
    - [249, 1.688]
  - - [30592, 8192, 1, 1024, 30592, 30592, 1024, 1024]
    - [175, 86.999]
  - - [3072, 8192, 1, 1024, 3072, 3072, 1024, 1024]
    - [56, 76.878]
  - - [512, 512, 256, 64, 512, 512, 64, 64]
    - [164, 32.599]
  - - [64, 512, 256, 512, 64, 64, 512, 512]
    - [59, 32.52]
  - - [30592, 2048, 1, 1024, 30592, 30592, 1024, 1024]
    - [175, 82.952]
  - - [3072, 2048, 1, 1024, 3072, 3072, 1024, 1024]
    - [126, 63.532]
  - - [1024, 8, 1, 1024, 1024, 1024, 1024, 524288]
    - [269, 0.809]
  - - [30592, 4096, 1, 1024, 30592, 30592, 1024, 1024]
    - [175, 84.594]
  - - [3072, 4096, 1, 1024, 3072, 3072, 1024, 1024]
    - [151, 67.858]
  - - [64, 512, 128, 512, 64, 64, 512, 512]
    - [58, 30.919]
  - - [1920, 2048, 1, 2560, 1920, 1920, 2560, 2560]
    - [46, 80.656]
  - - [2560, 2048, 1, 2560, 2560, 2560, 2560, 2560]
    - [115, 70.094]
  - - [2560, 2048, 1, 640, 2560, 2560, 640, 640]
    - [193, 57.407]
  - - [2560, 4, 1, 2560, 2560, 2560, 2560, 1310720]
    - [265, 1.487]
  - - [7680, 2048, 1, 2560, 7680, 7680, 2560, 2560]
    - [42, 89.698]
  - - [512, 512, 40, 64, 512, 512, 64, 64]
    - [89, 26.725]
  - - [64, 512, 40, 512, 64, 64, 512, 512]
    - [59, 26.955]
  - - [1536, 4096, 1, 1536, 1536, 1536, 1536, 1536]
    - [94, 63.734]
  - - [1536, 4096, 1, 6144, 1536, 1536, 6144, 6144]
    - [165, 74.159]
  - - [4608, 4096, 1, 1536, 4608, 4608, 1536, 1536]
    - [67, 79.727]
  - - [50304, 4096, 1, 1536, 50304, 50304, 1536, 1536]
    - [112, 87.875]
  - - [6144, 4096, 1, 1536, 6144, 6144, 1536, 1536]
    - [112, 78.369]
  - - [1024, 1024, 64, 96, 1024, 1024, 96, 96]
    - [96, 47.511]
  - - [96, 1024, 64, 1024, 96, 96, 1024, 1024]
    - [130, 45.503]
  - - [1536, 8192, 1, 1536, 1536, 1536, 1536, 1536]
    - [171, 73.169]
  - - [1536, 8192, 1, 6144, 1536, 1536, 6144, 6144]
    - [104, 83.651]
  - - [4608, 8192, 1, 1536, 4608, 4608, 1536, 1536]
    - [118, 82.983]
  - - [50304, 8192, 1, 1536, 50304, 50304, 1536, 1536]
    - [112, 88.812]
  - - [6144, 8192, 1, 1536, 6144, 6144, 1536, 1536]
    - [175, 86.182]
  - - [1024, 1024, 128, 96, 1024, 1024, 96, 96]
    - [96, 50.034]
  - - [96, 1024, 128, 1024, 96, 96, 1024, 1024]
    - [60, 48.938]
  - - [1024, 16384, 1, 1024, 1024, 1024, 1024, 1024]
    - [145, 70.208]
  - - [1024, 16384, 1, 4096, 1024, 1024, 4096, 4096]
    - [138, 77.54]
  - - [3072, 16384, 1, 1024, 3072, 3072, 1024, 1024]
    - [175, 81.987]
  - - [4096, 16384, 1, 1024, 4096, 4096, 1024, 1024]
    - [96, 80.722]
  - - [50304, 16384, 1, 1024, 50304, 50304, 1024, 1024]
    - [126, 86.369]
  - - [1024, 1024, 256, 64, 1024, 1024, 64, 64]
    - [125, 36.195]
  - - [64, 1024, 256, 1024, 64, 64, 1024, 1024]
    - [149, 38.427]
  - - [50304, 2048, 1, 1024, 50304, 50304, 1024, 1024]
    - [175, 84.073]
  - - [1024, 1024, 32, 64, 1024, 1024, 64, 64]
    - [66, 32.415]
  - - [64, 1024, 32, 1024, 64, 64, 1024, 1024]
    - [64, 31.402]
  - - [50304, 4096, 1, 1024, 50304, 50304, 1024, 1024]
    - [175, 86.755]
  - - [1024, 1024, 64, 64, 1024, 1024, 64, 64]
    - [55, 34.006]
  - - [64, 1024, 64, 1024, 64, 64, 1024, 1024]
    - [159, 34.384]
  - - [50304, 8192, 1, 1024, 50304, 50304, 1024, 1024]
    - [175, 88.454]
  - - [1024, 1024, 128, 64, 1024, 1024, 64, 64]
    - [66, 35.539]
  - - [64, 1024, 128, 1024, 64, 64, 1024, 1024]
    - [128, 36.358]
  - - [1024, 64, 1, 1024, 1024, 1024, 1024, 131072]
    - [34, 4.422]
  - - [30528, 8192, 1, 1024, 30528, 30528, 1024, 1024]
    - [175, 87.646]
  - - [128, 128, 1024, 64, 128, 128, 64, 64]
    - [58, 21.245]
  - - [64, 128, 1024, 128, 64, 64, 128, 128]
    - [58, 19.399]
  - - [1024, 3456, 1, 1024, 1024, 1024, 1024, 1024]
    - [167, 62.114]
  - - [1024, 3456, 1, 480, 1024, 1024, 480, 480]
    - [26, 56.374]
  - - [1024, 4096, 1, 480, 1024, 1024, 480, 480]
    - [106, 60.778]
  - - [1024, 6912, 1, 1024, 1024, 1024, 1024, 1024]
    - [61, 70.728]
  - - [1024, 6912, 1, 480, 1024, 1024, 480, 480]
    - [126, 65.153]
  - - [1024, 864, 1, 1024, 1024, 1024, 1024, 1024]
    - [24, 34.748]
  - - [1024, 864, 1, 480, 1024, 1024, 480, 480]
    - [5, 25.314]
  - - [128, 3456, 1, 256, 128, 128, 256, 256]
    - [37, 12.617]
  - - [128, 4096, 1, 256, 128, 128, 256, 256]
    - [190, 13.956]
  - - [128, 55296, 1, 256, 128, 128, 256, 256]
    - [67, 44.742]
  - - [128, 6912, 1, 256, 128, 128, 256, 256]
    - [128, 19.809]
  - - [128, 864, 1, 256, 128, 128, 256, 256]
    - [2, 3.955]
  - - [256, 3456, 1, 512, 256, 256, 512, 512]
    - [16, 27.708]
  - - [256, 4096, 1, 512, 256, 256, 512, 512]
    - [98, 28.069]
  - - [256, 55296, 1, 512, 256, 256, 512, 512]
    - [56, 60.778]
  - - [256, 6912, 1, 512, 256, 256, 512, 512]
    - [160, 45.098]
  - - [256, 864, 1, 512, 256, 256, 512, 512]
    - [28, 10.598]
  - - [3456, 1, 1, 256, 3456, 3456, 256, 256]
    - [248, 0.145]
  - - [4096, 1, 1, 256, 4096, 4096, 256, 256]
    - [269, 0.163]
  - - [512, 3456, 1, 1024, 512, 512, 1024, 1024]
    - [99, 54.003]
  - - [512, 3456, 1, 13, 512, 512, 13, 13]
    - [53, 2.563]
  - - [512, 4096, 1, 1024, 512, 512, 1024, 1024]
    - [162, 50.496]
  - - [512, 4096, 1, 13, 512, 512, 13, 13]
    - [187, 2.658]
  - - [512, 55296, 1, 13, 512, 512, 13, 13]
    - [50, 5.818]
  - - [512, 6912, 1, 1024, 512, 512, 1024, 1024]
    - [87, 63.989]
  - - [512, 6912, 1, 13, 512, 512, 13, 13]
    - [173, 3.81]
  - - [512, 864, 1, 1024, 512, 512, 1024, 1024]
    - [190, 22.67]
  - - [512, 864, 1, 13, 512, 512, 13, 13]
    - [4, 0.912]
  - - [6912, 1, 1, 256, 6912, 6912, 256, 256]
    - [247, 0.247]
  - - [864, 1, 1, 256, 864, 864, 256, 256]
    - [250, 0.032]
  - - [1024, 32, 1, 1024, 1024, 1024, 1024, 1024]
    - [9, 2.196]
  - - [30528, 640, 1, 1024, 30528, 30528, 1024, 1024]
    - [143, 74.566]
  - - [30528, 1280, 1, 1024, 30528, 30528, 1024, 1024]
    - [126, 79.895]
  - - [1024, 64, 1, 1024, 1024, 1024, 1024, 1024]
    - [34, 4.486]
  - - [30528, 1600, 1, 1024, 30528, 30528, 1024, 1024]
    - [143, 78.066]
  - - [1024, 10240, 1, 1024, 1024, 1024, 1024, 1024]
    - [156, 68.498]
  - - [1024, 80, 1, 1024, 1024, 1024, 1024, 1024]
    - [35, 5.528]
  - - [4096, 10240, 1, 1024, 4096, 4096, 1024, 1024]
    - [175, 80.18]
  - - [1024, 10240, 1, 4096, 1024, 1024, 4096, 4096]
    - [156, 76.78]
  - - [64, 128, 1280, 128, 64, 64, 128, 128]
    - [113, 19.719]
  - - [128, 128, 1280, 64, 128, 128, 64, 64]
    - [45, 21.508]
  - - [1024, 10496, 1, 4096, 1024, 1024, 4096, 4096]
    - [156, 78.639]
  - - [30528, 1640, 1, 1024, 30528, 30528, 1024, 1024]
    - [189, 77.373]
  - - [1024, 82, 1, 1024, 1024, 1024, 1024, 1024]
    - [35, 5.667]
  - - [4096, 10496, 1, 1024, 4096, 4096, 1024, 1024]
    - [117, 78.177]
  - - [1024, 10496, 1, 1024, 1024, 1024, 1024, 1024]
    - [156, 70.306]
  - - [64, 128, 1312, 128, 64, 64, 128, 128]
    - [58, 19.626]
  - - [128, 128, 1312, 64, 128, 128, 64, 64]
    - [58, 21.711]
  - - [30528, 160, 1, 1024, 30528, 30528, 1024, 1024]
    - [48, 72.124]
  - - [1024, 12, 1, 1024, 1024, 1024, 1024, 1024]
    - [249, 1.226]
  - - [30528, 240, 1, 1024, 30528, 30528, 1024, 1024]
    - [61, 73.139]
  - - [1024, 6144, 1, 1024, 1024, 1024, 1024, 1024]
    - [156, 60.901]
  - - [4096, 6144, 1, 1024, 4096, 4096, 1024, 1024]
    - [56, 76.294]
  - - [1024, 6144, 1, 4096, 1024, 1024, 4096, 4096]
    - [102, 71.947]
  - - [64, 512, 192, 512, 64, 64, 512, 512]
    - [77, 32.242]
  - - [512, 512, 192, 64, 512, 512, 64, 64]
    - [135, 32.208]
  - - [1024, 10224, 1, 1024, 1024, 1024, 1024, 1024]
    - [112, 66.136]
  - - [1024, 10192, 1, 1024, 1024, 1024, 1024, 1024]
    - [112, 65.67]
  - - [1024, 10208, 1, 1024, 1024, 1024, 1024, 1024]
    - [112, 65.515]
  - - [1024, 10224, 1, 4096, 1024, 1024, 4096, 4096]
    - [156, 75.195]
  - - [4096, 10224, 1, 1024, 4096, 4096, 1024, 1024]
    - [175, 79.737]
  - - [3072, 10224, 1, 1024, 3072, 3072, 1024, 1024]
    - [136, 78.362]
  - - [3072, 10240, 1, 1024, 3072, 3072, 1024, 1024]
    - [136, 82.366]
  - - [1024, 10192, 1, 4096, 1024, 1024, 4096, 4096]
    - [156, 75.755]
  - - [4096, 10192, 1, 1024, 4096, 4096, 1024, 1024]
    - [175, 79.821]
  - - [3072, 10192, 1, 1024, 3072, 3072, 1024, 1024]
    - [136, 78.076]
  - - [3072, 10200, 1, 1024, 3072, 3072, 1024, 1024]
    - [175, 78.484]
  - - [1024, 10184, 1, 1024, 1024, 1024, 1024, 1024]
    - [112, 66.271]
  - - [3072, 10208, 1, 1024, 3072, 3072, 1024, 1024]
    - [175, 79.125]
  - - [1024, 10208, 1, 4096, 1024, 1024, 4096, 4096]
    - [156, 75.12]
  - - [4096, 10208, 1, 1024, 4096, 4096, 1024, 1024]
    - [96, 79.834]
  - - [2048, 10224, 1, 1024, 2048, 2048, 1024, 1024]
    - [83, 71.612]
  - - [2048, 10240, 1, 1024, 2048, 2048, 1024, 1024]
    - [56, 74.187]
  - - [1024, 10120, 1, 1024, 1024, 1024, 1024, 1024]
    - [56, 67.373]
  - - [2048, 10192, 1, 1024, 2048, 2048, 1024, 1024]
    - [91, 72.475]
  - - [24, 24, 6816, 64, 24, 24, 1308672, 1308672]
    - [57, 4.693]
  - - [24, 24, 6816, 64, 24, 24, 1308672, 436224]
    - [57, 4.722]
  - - [1024, 10152, 1, 1024, 1024, 1024, 1024, 1024]
    - [112, 67.086]
  - - [3072, 10080, 1, 1024, 3072, 3072, 1024, 1024]
    - [175, 79.175]
  - - [1024, 2048, 1, 49, 1024, 1024, 49, 49]
    - [41, 8.51]
  - - [1024, 256, 1, 196, 1024, 1024, 196, 196]
    - [20, 5.284]
  - - [1024, 512, 1, 196, 1024, 1024, 196, 196]
    - [132, 8.822]
  - - [1152, 128, 1, 784, 1152, 1152, 784, 784]
    - [23, 7.565]
  - - [128, 512, 1, 784, 128, 128, 784, 784]
    - [13, 3.339]
  - - [2048, 512, 1, 49, 2048, 2048, 49, 49]
    - [134, 5.227]
  - - [2304, 256, 1, 196, 2304, 2304, 196, 196]
    - [132, 9.659]
  - - [256, 1024, 1, 196, 256, 256, 196, 196]
    - [3, 5.284]
  - - [256, 128, 1, 3136, 256, 256, 3136, 3136]
    - [209, 5.724]
  - - [256, 512, 1, 784, 256, 256, 784, 784]
    - [8, 6.587]
  - - [256, 64, 1, 3136, 256, 256, 3136, 3136]
    - [208, 3.435]
  - - [4608, 512, 1, 49, 4608, 4608, 49, 49]
    - [134, 9.016]
  - - [512, 1024, 1, 196, 512, 512, 196, 196]
    - [1, 8.988]
  - - [512, 128, 1, 784, 512, 512, 784, 784]
    - [18, 3.339]
  - - [512, 2048, 1, 49, 512, 512, 49, 49]
    - [40, 5.343]
  - - [512, 256, 1, 784, 512, 512, 784, 784]
    - [30, 6.773]
  - - [576, 64, 1, 3136, 576, 576, 3136, 3136]
    - [210, 6.402]
  - - [64, 256, 1, 3136, 64, 64, 3136, 3136]
    - [214, 3.41]
  - - [64, 64, 1, 3136, 64, 64, 3136, 3136]
    - [214, 0.841]
  - - [128, 128, 49, 12800, 128, 128, 12800, 12800]
    - [196, 41.097]
  - - [128, 128, 25, 25088, 128, 128, 25088, 25088]
    - [205, 36.208]
  - - [128, 128, 49, 25600, 128, 128, 25600, 25600]
    - [196, 43.515]
  - - [128, 128, 25, 50176, 128, 128, 50176, 50176]
    - [201, 37.391]
  - - [256, 256, 25, 12544, 256, 256, 12544, 12544]
    - [129, 63.331]
  - - [256, 256, 49, 3200, 256, 256, 3200, 3200]
    - [46, 62.61]
  - - [256, 256, 25, 6272, 256, 256, 6272, 6272]
    - [181, 61.885]
  - - [256, 256, 49, 6400, 256, 256, 6400, 6400]
    - [47, 67.369]
  - - [512, 512, 49, 1152, 512, 512, 1152, 1152]
    - [81, 67.85]
  - - [512, 512, 25, 2048, 512, 512, 2048, 2048]
    - [102, 68.414]
  - - [512, 512, 49, 2304, 512, 512, 2304, 2304]
    - [136, 73.136]
  - - [512, 512, 25, 4096, 512, 512, 4096, 4096]
    - [118, 74.744]
  - - [64, 128, 2048, 128, 64, 64, 128, 128]
    - [158, 20.057]
  - - [128, 128, 2048, 64, 128, 128, 64, 64]
    - [58, 22.556]
  - - [30528, 2560, 1, 1024, 30528, 30528, 1024, 1024]
    - [175, 83.113]
  - - [1024, 128, 1, 1024, 1024, 1024, 1024, 1024]
    - [15, 8.784]
  - - [64, 128, 1536, 128, 64, 64, 128, 128]
    - [58, 19.781]
  - - [128, 128, 1536, 64, 128, 128, 64, 64]
    - [113, 21.94]
  - - [1024, 12288, 1, 1024, 1024, 1024, 1024, 1024]
    - [171, 67.177]
  - - [1024, 12288, 1, 4096, 1024, 1024, 4096, 4096]
    - [151, 77.384]
  - - [30528, 1920, 1, 1024, 30528, 30528, 1024, 1024]
    - [143, 78.428]
  - - [1024, 96, 1, 1024, 1024, 1024, 1024, 1024]
    - [15, 6.729]
  - - [4096, 12288, 1, 1024, 4096, 4096, 1024, 1024]
    - [175, 80.282]
  - - [128, 128, 36, 12544, 128, 128, 12544, 12544]
    - [202, 37.266]
  - - [128, 128, 49, 9216, 128, 128, 9216, 9216]
    - [195, 39.612]
  - - [128, 128, 64, 6400, 128, 128, 6400, 6400]
    - [78, 36.219]
  - - [128, 128, 81, 12544, 128, 128, 12544, 12544]
    - [99, 40.101]
  - - [128, 128, 121, 9216, 128, 128, 9216, 9216]
    - [200, 33.858]
  - - [128, 128, 169, 6400, 128, 128, 6400, 6400]
    - [198, 40.707]
  - - [256, 256, 36, 4096, 256, 256, 4096, 4096]
    - [141, 48.518]
  - - [256, 256, 49, 2304, 256, 256, 2304, 2304]
    - [73, 59.537]
  - - [256, 256, 64, 2304, 256, 256, 2304, 2304]
    - [100, 52.58]
  - - [256, 256, 81, 4096, 256, 256, 4096, 4096]
    - [51, 61.18]
  - - [256, 256, 121, 2304, 256, 256, 2304, 2304]
    - [94, 56.994]
  - - [256, 256, 169, 2304, 256, 256, 2304, 2304]
    - [121, 71.012]
  - - [512, 512, 81, 1024, 512, 512, 1024, 1024]
    - [81, 73.301]
  - - [512, 512, 121, 1024, 512, 512, 1024, 1024]
    - [56, 70.773]
  - - [512, 512, 169, 1024, 512, 512, 1024, 1024]
    - [81, 76.455]
  - - [512, 512, 36, 1024, 512, 512, 1024, 1024]
    - [89, 60.615]
  - - [512, 512, 49, 1024, 512, 512, 1024, 1024]
    - [136, 67.192]
  - - [512, 512, 64, 1024, 512, 512, 1024, 1024]
    - [96, 66.246]
  - - [64, 64, 36, 50176, 64, 64, 50176, 50176]
    - [199, 20.299]
  - - [64, 64, 49, 36864, 64, 64, 36864, 36864]
    - [194, 21.739]
  - - [64, 64, 64, 25600, 64, 64, 25600, 25600]
    - [204, 20.625]
  - - [128, 128, 192, 64, 128, 128, 64, 64]
    - [55, 17.286]
  - - [64, 128, 192, 128, 64, 64, 128, 128]
    - [114, 15.833]
  - - [768, 2048, 1, 768, 768, 768, 768, 768]
    - [70, 44.86]
  - - [3072, 2048, 1, 768, 3072, 3072, 768, 768]
    - [67, 59.814]
  - - [768, 2048, 1, 3072, 768, 768, 3072, 3072]
    - [181, 59.421]
  - - [768, 16, 1, 768, 768, 768, 768, 768]
    - [252, 1.09]
  - - [384, 384, 144, 64, 384, 384, 64, 64]
    - [63, 28.838]
  - - [64, 384, 144, 384, 64, 64, 384, 384]
    - [77, 28.325]
  - - [768, 4608, 1, 768, 768, 768, 768, 768]
    - [46, 60.561]
  - - [3072, 4608, 1, 768, 3072, 3072, 768, 768]
    - [118, 69.687]
  - - [768, 4608, 1, 3072, 768, 768, 3072, 3072]
    - [140, 74.156]
  - - [768, 12, 1, 768, 768, 768, 768, 768]
    - [262, 0.752]
  - - [512, 512, 48, 64, 512, 512, 64, 64]
    - [145, 27.306]
  - - [64, 512, 48, 512, 64, 64, 512, 512]
    - [97, 30.026]
  - - [768, 4, 1, 768, 768, 768, 768, 768]
    - [249, 0.246]
  - - [128, 128, 256, 64, 128, 128, 64, 64]
    - [53, 17.325]
  - - [64, 128, 256, 128, 64, 64, 128, 128]
    - [58, 16.313]
  - - [1024, 16, 1, 1024, 1024, 1024, 1024, 1024]
    - [266, 1.707]
  - - [384, 384, 192, 64, 384, 384, 64, 64]
    - [82, 29.491]
  - - [64, 384, 192, 384, 64, 64, 384, 384]
    - [69, 28.262]
  - - [1024, 4608, 1, 1024, 1024, 1024, 1024, 1024]
    - [184, 61.355]
  - - [4096, 4608, 1, 1024, 4096, 4096, 1024, 1024]
    - [96, 77.729]
  - - [1024, 4608, 1, 4096, 1024, 1024, 4096, 4096]
    - [105, 81.439]
  - - [2880, 3072, 1, 3072, 2880, 2880, 3072, 3072]
    - [120, 82.156]
  - - [3072, 3072, 1, 3072, 3072, 3072, 3072, 3072]
    - [48, 82.491]
  - - [3072, 512, 1, 3072, 3072, 3072, 3072, 3072]
    - [181, 60.86]
  - - [4096, 512, 1, 4096, 4096, 4096, 4096, 4096]
    - [122, 57.461]
  - - [512, 1024, 1, 1024, 512, 512, 1024, 1024]
    - [148, 24.873]
  - - [512, 2048, 1, 2048, 512, 512, 2048, 2048]
    - [10, 44.17]
  - - [512, 3072, 1, 3072, 512, 512, 3072, 3072]
    - [192, 58.271]
  - - [512, 4096, 1, 4096, 512, 512, 4096, 4096]
    - [142, 60.901]
  - - [512, 8192, 1, 8192, 512, 512, 8192, 8192]
    - [86, 78.948]
  - - [64, 1024, 1, 1024, 64, 64, 1024, 1024]
    - [25, 4.361]
  - - [8192, 512, 1, 8192, 8192, 8192, 8192, 8192]
    - [104, 78.774]
  - - [2, 1, 1, 1024, 2, 2, 1024, 1024]
    - [215, 0.0]
  - - [2, 8, 1, 1024, 2, 2, 1024, 1024]
    - [238, 0.001]
  - - [30522, 77, 1, 1024, 30522, 30522, 1024, 1024]
    - [227, 35.027]
  - - [30522, 616, 1, 1024, 30522, 30522, 1024, 1024]
    - [232, 65.662]
  - - [2, 10, 1, 1024, 2, 2, 1024, 1024]
    - [217, 0.001]
  - - [30522, 160, 1, 1024, 30522, 30522, 1024, 1024]
    - [228, 66.952]
  - - [30522, 200, 1, 1024, 30522, 30522, 1024, 1024]
    - [234, 50.958]
  - - [2, 39, 1, 1024, 2, 2, 1024, 1024]
    - [239, 0.007]
  - - [30522, 780, 1, 1024, 30522, 30522, 1024, 1024]
    - [230, 69.877]
  - - [2, 4, 1, 1024, 2, 2, 1024, 1024]
    - [216, 0.001]
  - - [30522, 308, 1, 1024, 30522, 30522, 1024, 1024]
    - [219, 61.662]
  - - [2, 40, 1, 1024, 2, 2, 1024, 1024]
    - [238, 0.007]
  - - [30522, 800, 1, 1024, 30522, 30522, 1024, 1024]
    - [235, 74.951]
  - - [2, 41, 1, 1024, 2, 2, 1024, 1024]
    - [238, 0.007]
  - - [30522, 820, 1, 1024, 30522, 30522, 1024, 1024]
    - [236, 67.581]
  - - [2, 5, 1, 1024, 2, 2, 1024, 1024]
    - [215, 0.001]
  - - [30522, 385, 1, 1024, 30522, 30522, 1024, 1024]
    - [230, 58.652]
  - - [2, 6, 1, 1024, 2, 2, 1024, 1024]
    - [215, 0.001]
  - - [30522, 462, 1, 1024, 30522, 30522, 1024, 1024]
    - [231, 64.044]
  - - [2, 9, 1, 1024, 2, 2, 1024, 1024]
    - [237, 0.001]
  - - [30522, 180, 1, 1024, 30522, 30522, 1024, 1024]
    - [233, 47.347]
  - - [2, 32, 1, 1024, 2, 2, 1024, 1024]
    - [240, 0.005]
  - - [4, 4, 32768, 64, 4, 4, 2097152, 2097152]
    - [257, 0.74]
  - - [4, 4, 38400, 64, 4, 4, 2457600, 2457600]
    - [258, 0.751]
  - - [14, 14, 10880, 64, 14, 14, 696320, 696320]
    - [270, 3.344]
  - - [15, 14, 10880, 64, 15, 15, 696320, 696320]
    - [260, 3.473]
  - - [15, 15, 7680, 64, 15, 15, 491520, 491520]
    - [271, 3.383]
  - - [15, 15, 10880, 64, 15, 15, 696320, 696320]
    - [264, 3.585]
  - - [17, 15, 7680, 64, 17, 17, 491520, 491520]
    - [220, 3.0]
  - - [17, 17, 6144, 64, 17, 17, 393216, 393216]
    - [220, 2.741]
  - - [17, 17, 7680, 64, 17, 17, 491520, 491520]
    - [220, 3.34]
  - - [21, 17, 6144, 64, 21, 21, 393216, 393216]
    - [221, 3.121]
  - - [21, 21, 6144, 64, 21, 21, 393216, 393216]
    - [220, 3.513]
  - - [30, 30, 2048, 64, 30, 30, 131072, 131072]
    - [221, 4.718]
  - - [30, 31, 2048, 64, 30, 30, 131072, 131072]
    - [221, 4.793]
  - - [31, 31, 2048, 64, 31, 31, 131072, 131072]
    - [226, 4.851]
  - - [34, 24, 4736, 64, 34, 34, 303104, 303104]
    - [223, 5.772]
  - - [34, 34, 4736, 64, 34, 34, 303104, 303104]
    - [224, 6.141]
  - - [35, 35, 4608, 64, 35, 35, 294912, 294912]
    - [224, 5.89]
  - - [2, 2048, 1, 1024, 2, 2, 1024, 1024]
    - [267, 0.427]
  - - [2, 1024, 1, 1024, 2, 2, 1024, 1024]
    - [268, 0.196]
  - - [5, 5, 1, 64, 5, 5, 64, 64]
    - [215, 0.0]
  - - [33, 33, 1, 32, 33, 33, 32, 32]
    - [225, 0.005]
  - - [3, 3, 512, 64, 3, 3, 64, 64]
    - [251, 0.058]
  - - [5, 5, 512, 64, 5, 5, 64, 64]
    - [246, 0.153]
  - - [5, 5, 960, 64, 5, 5, 64, 64]
    - [253, 0.271]
  - - [9, 9, 512, 64, 9, 9, 64, 64]
    - [245, 0.478]
  - - [27, 27, 32768, 128, 27, 27, 128, 128]
    - [218, 8.499]
  - - [33, 33, 1600, 32, 33, 33, 32, 32]
    - [222, 3.088]
  - - [684, 8976, 1, 256, 684, 684, 256, 256]
    - [229, 39.224]
  - - [44505, 8976, 1, 256, 44505, 44505, 256, 256]
    - [234, 61.793]
  - - [2, 2, 1, 2048, 2, 2, 2048, 2048]
    - [237, 0.001]
  - - [2, 16, 1, 1024, 2, 2, 1024, 1024]
    - [241, 0.003]
  - - [2, 4, 1, 2560, 2, 2, 2560, 2560]
    - [240, 0.001]
  - - [2, 64, 1, 1024, 2, 2, 1024, 1024]
    - [242, 0.011]
  - - [2, 80, 1, 1024, 2, 2, 1024, 1024]
    - [243, 0.016]
  - - [2, 82, 1, 1024, 2, 2, 1024, 1024]
    - [267, 0.016]
  - - [2, 12, 1, 1024, 2, 2, 1024, 1024]
    - [240, 0.002]
  - - [1, 4096, 1, 256, 1, 1, 256, 256]
    - [267, 0.163]
  - - [1, 6912, 1, 256, 1, 1, 256, 256]
    - [254, 0.247]
  - - [26, 26, 6272, 64, 26, 26, 1204224, 1204224]
    - [223, 4.765]
  - - [26, 26, 6272, 64, 26, 26, 1204224, 401408]
    - [223, 4.874]
  - - [147, 64, 1, 12544, 147, 147, 12544, 12544]
    - [244, 6.24]
  - - [2, 128, 1, 1024, 2, 2, 1024, 1024]
    - [261, 0.03]
  - - [2, 96, 1, 1024, 2, 2, 1024, 1024]
    - [267, 0.019]
  - - [2, 2048, 1, 768, 2, 2, 768, 768]
    - [255, 0.383]
  - - [2, 4608, 1, 768, 2, 2, 768, 768]
    - [261, 0.728]
  - - [2, 4608, 1, 1024, 2, 2, 1024, 1024]
    - [261, 0.825]
- null
