TRAIN_3.10/logic/arcturus_Cijk_Ailk_Bljk_HBH.yaml
- {MinimumRequiredVersion: 4.23.0}
- arcturus
- gfx908
- [Device 7380, Device 7388, Device 738c, Device 7390]
    SolutionIndex: 0
    SolutionNameMin: Cijk_Ailk_Bljk_HBH_MT32x32x32_MI16x16x16x1_SE_1LDSB0_GRVW2_LPB16_NLCA1_PLR2_SU0_SUS256_SRVW4_TT1_16_WG32_8_1_WGM1
    SolutionIndex: 1
    SolutionNameMin: Cijk_Ailk_Bljk_HBH_MT64x64x32_MI32x32x8x1_SE_1LDSB0_GRVW2_LPB8_NLCA1_PLR5_SU0_SUS256_SRVW4_TT1_32_WG64_4_1_WGM1
    SolutionIndex: 2
    SolutionNameMin: Cijk_Ailk_Bljk_HBH_MT64x128x32_MI32x32x8x1_SE_1LDSB0_GRVW2_LPB8_NLCA1_PLR5_SU0_SUS256_SRVW4_TT1_64_WG64_4_1_WGM1
    SolutionIndex: 3
    SolutionNameMin: Cijk_Ailk_Bljk_HBH_MT128x64x32_MI32x32x8x1_SE_1LDSB0_GRVW2_LPB8_NLCA1_PLR5_SU0_SUS256_SRVW4_TT2_32_WG64_4_1_WGM1
    SolutionIndex: 4
    SolutionNameMin: Cijk_Ailk_Bljk_HBH_MT32x32x32_MI16x16x16x1_SE_1LDSB0_GRVW4_LPB16_NLCA1_PLR2_SU0_SUS256_SRVW4_TT1_16_WG32_8_1_WGM1
    SolutionIndex: 5
    SolutionNameMin: Cijk_Ailk_Bljk_HBH_MT64x64x32_MI32x32x8x1_SE_1LDSB0_GRVW4_LPB8_NLCA1_PLR5_SU0_SUS256_SRVW4_TT1_32_WG64_4_1_WGM1
    SolutionIndex: 6
    SolutionNameMin: Cijk_Ailk_Bljk_HBH_MT64x128x32_MI32x32x8x1_SE_1LDSB0_GRVW4_LPB8_NLCA1_PLR5_SU0_SUS256_SRVW4_TT1_64_WG64_4_1_WGM1
    SolutionIndex: 7
    SolutionNameMin: Cijk_Ailk_Bljk_HBH_MT128x64x32_MI32x32x8x1_SE_1LDSB0_GRVW4_LPB8_NLCA1_PLR5_SU0_SUS256_SRVW4_TT2_32_WG64_4_1_WGM1
    SolutionIndex: 8
    SolutionNameMin: Cijk_Ailk_Bljk_HBH_MT256x160x32_MI32x32x8x1_SE_1LDSB0_GRVW4_LPB8_NLCA1_PLR5_SU0_SUS256_SRVW4_TT2_160_WG128_2_1_WGM1
    SolutionIndex: 9
    SolutionNameMin: Cijk_Ailk_Bljk_HBH_MT32x32x32_MI16x16x16x1_SE_1LDSB0_GRVW8_LPB16_NLCA1_PLR2_SU0_SUS256_SRVW4_TT1_16_WG32_8_1_WGM1
    SolutionIndex: 10
    SolutionNameMin: Cijk_Ailk_Bljk_HBH_MT64x64x32_MI32x32x8x1_SE_1LDSB0_GRVW8_LPB8_NLCA1_PLR5_SU0_SUS256_SRVW4_TT1_32_WG64_4_1_WGM1
    SolutionIndex: 11
    SolutionNameMin: Cijk_Ailk_Bljk_HBH_MT64x128x32_MI32x32x8x1_SE_1LDSB0_GRVW8_LPB8_NLCA1_PLR5_SU0_SUS256_SRVW4_TT1_64_WG64_4_1_WGM1
    SolutionIndex: 12
    SolutionNameMin: Cijk_Ailk_Bljk_HBH_MT128x64x32_MI32x32x8x1_SE_1LDSB0_GRVW8_LPB8_NLCA1_PLR5_SU0_SUS256_SRVW4_TT2_32_WG64_4_1_WGM1
    SolutionIndex: 13
    SolutionNameMin: Cijk_Ailk_Bljk_HBH_MT32x32x64_MI16x16x16x1_SE_1LDSB0_GRVW8_LPB16_NLCA1_PLR5_SU0_SUS256_SRVW4_TT1_16_WG32_8_1_WGM1
    SolutionIndex: 14
    SolutionNameMin: Cijk_Ailk_Bljk_HBH_MT64x64x64_MI32x32x8x1_SE_1LDSB0_GRVW8_LPB8_NLCA1_PLR9_SU0_SUS256_SRVW4_TT1_32_WG64_4_1_WGM1
    SolutionIndex: 15
    SolutionNameMin: Cijk_Ailk_Bljk_HBH_MT64x128x64_MI32x32x8x1_SE_1LDSB0_GRVW8_LPB8_NLCA1_PLR9_SU0_SUS256_SRVW4_TT1_64_WG64_4_1_WGM1
    SolutionIndex: 16
    SolutionNameMin: Cijk_Ailk_Bljk_HBH_MT128x96x64_MI32x32x8x1_SE_1LDSB0_GRVW8_LPB8_NLCA1_PLR9_SU0_SUS256_SRVW4_TT1_96_WG128_2_1_WGM1
    SolutionIndex: 17
    SolutionNameMin: Cijk_Ailk_Bljk_HBH_MT64x128x32_MI32x32x8x1_SE_1LDSB0_GRVW2_LPB8_NLCA1_PLR5_SU32_SUS128_SRVW4_TT1_64_WG64_4_1_WGM1
    SolutionIndex: 18
    SolutionNameMin: Cijk_Ailk_Bljk_HBH_MT64x128x32_MI32x32x8x1_SE_1LDSB0_GRVW8_LPB8_NLCA1_PLR5_SU32_SUS128_SRVW4_TT1_64_WG64_4_1_WGM1
    SolutionIndex: 19
    SolutionNameMin: Cijk_Ailk_Bljk_HBH_MT32x64x64_MI16x16x16x1_SE_1LDSB0_GRVW8_LPB16_NLCA1_PLR5_SU32_SUS128_SRVW4_TT1_32_WG32_8_1_WGM1
    SolutionIndex: 20
    SolutionNameMin: Cijk_Ailk_Bljk_HBH_MT64x128x64_MI32x32x8x1_SE_1LDSB0_GRVW8_LPB8_NLCA1_PLR9_SU32_SUS128_SRVW4_TT1_64_WG64_4_1_WGM1
    SolutionIndex: 21
    SolutionNameMin: Cijk_Ailk_Bljk_HBH_MT128x96x64_MI32x32x8x1_SE_1LDSB0_GRVW8_LPB8_NLCA1_PLR9_SU32_SUS128_SRVW4_TT1_96_WG128_2_1_WGM1
    SolutionIndex: 22
    SolutionNameMin: Cijk_Ailk_Bljk_HBH_MT32x32x64_MI16x16x16x1_SE_1LDSB0_GRVW8_LPB16_NLCA1_PLR5_SU32_SUS256_SRVW4_TT1_16_WG32_8_1_WGM1
    SolutionIndex: 23
    SolutionNameMin: Cijk_Ailk_Bljk_HBH_MT32x64x64_MI16x16x16x1_SE_1LDSB0_GRVW8_LPB16_NLCA1_PLR5_SU32_SUS256_SRVW4_TT1_32_WG32_8_1_WGM1
    SolutionIndex: 24
    SolutionNameMin: Cijk_Ailk_Bljk_HBH_MT64x128x64_MI32x32x8x1_SE_1LDSB0_GRVW8_LPB8_NLCA1_PLR9_SU32_SUS256_SRVW4_TT1_64_WG64_4_1_WGM1
    SolutionIndex: 25
    SolutionNameMin: Cijk_Ailk_Bljk_HBH_MT96x128x64_MI32x32x8x1_SE_1LDSB0_GRVW8_LPB8_NLCA3_PLR9_SU32_SUS256_SRVW0_TT3_32_WG32_8_1_WGM1
    SolutionIndex: 26
    SolutionNameMin: Cijk_Ailk_Bljk_HBH_MT64x64x32_MI32x32x8x1_SE_1LDSB0_GRVW2_LPB8_NLCA1_PLR5_SU0_SUS256_SRVW4_TT1_32_WG64_4_1_WGM2
    SolutionIndex: 27
    SolutionNameMin: Cijk_Ailk_Bljk_HBH_MT96x96x32_MI16x16x16x1_SE_1LDSB0_GRVW4_LPB16_NLCA3_PLR2_SU0_SUS256_SRVW0_TT3_48_WG32_8_1_WGM2
    SolutionIndex: 28
    SolutionNameMin: Cijk_Ailk_Bljk_HBH_MT64x128x32_MI32x32x8x1_SE_1LDSB0_GRVW4_LPB8_NLCA1_PLR5_SU0_SUS256_SRVW4_TT1_64_WG64_4_1_WGM2
    SolutionIndex: 29
    SolutionNameMin: Cijk_Ailk_Bljk_HBH_MT128x288x32_MI32x32x8x1_SE_1LDSB0_GRVW4_LPB8_NLCA1_PLR5_SU0_SUS256_SRVW4_TT1_288_WG128_2_1_WGM2
    SolutionIndex: 30
    SolutionNameMin: Cijk_Ailk_Bljk_HBH_MT256x160x32_MI32x32x8x1_SE_1LDSB0_GRVW4_LPB8_NLCA1_PLR5_SU0_SUS256_SRVW4_TT2_160_WG128_2_1_WGM2
    SolutionIndex: 31
    SolutionNameMin: Cijk_Ailk_Bljk_HBH_MT32x32x32_MI16x16x16x1_SE_1LDSB0_GRVW8_LPB16_NLCA1_PLR2_SU0_SUS256_SRVW4_TT1_16_WG32_8_1_WGM2
    SolutionIndex: 32
    SolutionNameMin: Cijk_Ailk_Bljk_HBH_MT32x64x32_MI16x16x16x1_SE_1LDSB0_GRVW8_LPB16_NLCA1_PLR2_SU0_SUS256_SRVW4_TT1_32_WG32_8_1_WGM2
    SolutionIndex: 33
    SolutionNameMin: Cijk_Ailk_Bljk_HBH_MT64x64x32_MI32x32x8x1_SE_1LDSB0_GRVW8_LPB8_NLCA1_PLR5_SU0_SUS256_SRVW4_TT1_32_WG64_4_1_WGM2
    SolutionIndex: 34
    SolutionNameMin: Cijk_Ailk_Bljk_HBH_MT64x128x32_MI32x32x8x1_SE_1LDSB0_GRVW8_LPB8_NLCA1_PLR5_SU0_SUS256_SRVW4_TT1_64_WG64_4_1_WGM2
    SolutionIndex: 35
    SolutionNameMin: Cijk_Ailk_Bljk_HBH_MT256x128x32_MI32x32x8x1_SE_1LDSB0_GRVW8_LPB8_NLCA1_PLR5_SU0_SUS256_SRVW4_TT4_64_WG64_4_1_WGM2
    SolutionIndex: 36
    SolutionNameMin: Cijk_Ailk_Bljk_HBH_MT32x32x64_MI16x16x16x1_SE_1LDSB0_GRVW8_LPB16_NLCA1_PLR5_SU0_SUS256_SRVW4_TT1_16_WG32_8_1_WGM2
    SolutionIndex: 37
    SolutionNameMin: Cijk_Ailk_Bljk_HBH_MT32x64x64_MI16x16x16x1_SE_1LDSB0_GRVW8_LPB16_NLCA1_PLR5_SU0_SUS256_SRVW4_TT1_32_WG32_8_1_WGM2
    SolutionIndex: 38
    SolutionNameMin: Cijk_Ailk_Bljk_HBH_MT128x96x64_MI32x32x8x1_SE_1LDSB0_GRVW8_LPB8_NLCA1_PLR9_SU0_SUS256_SRVW4_TT1_96_WG128_2_1_WGM2
    SolutionIndex: 39
    SolutionNameMin: Cijk_Ailk_Bljk_HBH_MT64x128x32_MI32x32x8x1_SE_1LDSB0_GRVW4_LPB8_NLCA1_PLR5_SU32_SUS128_SRVW4_TT1_64_WG64_4_1_WGM2
    SolutionIndex: 40
    SolutionNameMin: Cijk_Ailk_Bljk_HBH_MT256x160x32_MI32x32x8x1_SE_1LDSB0_GRVW4_LPB8_NLCA1_PLR5_SU32_SUS128_SRVW4_TT2_160_WG128_2_1_WGM2
    SolutionIndex: 41
    SolutionNameMin: Cijk_Ailk_Bljk_HBH_MT64x128x64_MI32x32x8x1_SE_1LDSB0_GRVW4_LPB8_NLCA1_PLR9_SU32_SUS128_SRVW4_TT1_64_WG64_4_1_WGM2
    SolutionIndex: 42
    SolutionNameMin: Cijk_Ailk_Bljk_HBH_MT64x128x64_MI32x32x8x1_SE_1LDSB0_GRVW8_LPB8_NLCA1_PLR9_SU32_SUS128_SRVW4_TT1_64_WG64_4_1_WGM2
    SolutionIndex: 43
    SolutionNameMin: Cijk_Ailk_Bljk_HBH_MT128x96x64_MI32x32x8x1_SE_1LDSB0_GRVW8_LPB8_NLCA1_PLR9_SU32_SUS128_SRVW4_TT1_96_WG128_2_1_WGM2
    SolutionIndex: 44
    SolutionNameMin: Cijk_Ailk_Bljk_HBH_MT64x128x32_MI32x32x8x1_SE_1LDSB0_GRVW2_LPB8_NLCA1_PLR5_SU32_SUS256_SRVW4_TT1_64_WG64_4_1_WGM2
    SolutionIndex: 45
    SolutionNameMin: Cijk_Ailk_Bljk_HBH_MT256x160x32_MI32x32x8x1_SE_1LDSB0_GRVW2_LPB8_NLCA2_PLR5_SU32_SUS256_SRVW4_TT2_160_WG128_2_1_WGM2
    SolutionIndex: 46
    SolutionNameMin: Cijk_Ailk_Bljk_HBH_MT128x96x32_MI32x32x8x1_SE_1LDSB0_GRVW4_LPB8_NLCA1_PLR5_SU32_SUS256_SRVW4_TT1_96_WG128_2_1_WGM2
    SolutionIndex: 47
    SolutionNameMin: Cijk_Ailk_Bljk_HBH_MT256x160x32_MI32x32x8x1_SE_1LDSB0_GRVW4_LPB8_NLCA1_PLR5_SU32_SUS256_SRVW4_TT2_160_WG128_2_1_WGM2
    SolutionIndex: 48
    SolutionNameMin: Cijk_Ailk_Bljk_HBH_MT64x64x32_MI32x32x8x1_SE_1LDSB0_GRVW8_LPB8_NLCA1_PLR5_SU32_SUS256_SRVW4_TT1_32_WG64_4_1_WGM2
    SolutionIndex: 49
    SolutionNameMin: Cijk_Ailk_Bljk_HBH_MT32x64x64_MI16x16x16x1_SE_1LDSB0_GRVW8_LPB16_NLCA1_PLR5_SU32_SUS256_SRVW4_TT1_32_WG32_8_1_WGM2
    SolutionIndex: 50
    SolutionNameMin: Cijk_Ailk_Bljk_HBH_MT96x96x64_MI16x16x16x1_SE_1LDSB0_GRVW8_LPB16_NLCA3_PLR5_SU32_SUS256_SRVW0_TT3_48_WG32_8_1_WGM2
    SolutionIndex: 51
    SolutionNameMin: Cijk_Ailk_Bljk_HBH_MT64x128x64_MI32x32x8x1_SE_1LDSB0_GRVW8_LPB8_NLCA1_PLR9_SU32_SUS256_SRVW4_TT1_64_WG64_4_1_WGM2
    SolutionIndex: 52
    SolutionNameMin: Cijk_Ailk_Bljk_HBH_MT64x64x32_MI32x32x8x1_SE_1LDSB0_GRVW2_LPB8_NLCA1_PLR5_SU0_SUS256_SRVW4_TT1_32_WG64_4_1_WGM15
    SolutionIndex: 53
    SolutionNameMin: Cijk_Ailk_Bljk_HBH_MT64x128x32_MI32x32x8x1_SE_1LDSB0_GRVW2_LPB8_NLCA1_PLR5_SU0_SUS256_SRVW4_TT1_64_WG64_4_1_WGM15
    SolutionIndex: 54
    SolutionNameMin: Cijk_Ailk_Bljk_HBH_MT64x64x64_MI32x32x8x1_SE_1LDSB0_GRVW2_LPB8_NLCA1_PLR9_SU0_SUS256_SRVW4_TT1_32_WG64_4_1_WGM15
    SolutionIndex: 55
    SolutionNameMin: Cijk_Ailk_Bljk_HBH_MT128x64x32_MI32x32x8x1_SE_1LDSB0_GRVW4_LPB8_NLCA1_PLR5_SU0_SUS256_SRVW4_TT2_32_WG64_4_1_WGM15
    SolutionIndex: 56
    SolutionNameMin: Cijk_Ailk_Bljk_HBH_MT256x128x32_MI32x32x8x1_SE_1LDSB0_GRVW4_LPB8_NLCA1_PLR5_SU0_SUS256_SRVW4_TT4_64_WG64_4_1_WGM15
    SolutionIndex: 57
    SolutionNameMin: Cijk_Ailk_Bljk_HBH_MT128x96x32_MI32x32x8x1_SE_1LDSB0_GRVW4_LPB8_NLCA1_PLR5_SU0_SUS256_SRVW4_TT1_96_WG128_2_1_WGM15
    SolutionIndex: 58
    SolutionNameMin: Cijk_Ailk_Bljk_HBH_MT128x288x32_MI32x32x8x1_SE_1LDSB0_GRVW4_LPB8_NLCA1_PLR5_SU0_SUS256_SRVW4_TT1_288_WG128_2_1_WGM15
    SolutionIndex: 59
    SolutionNameMin: Cijk_Ailk_Bljk_HBH_MT256x160x32_MI32x32x8x1_SE_1LDSB0_GRVW4_LPB8_NLCA1_PLR5_SU0_SUS256_SRVW4_TT2_160_WG128_2_1_WGM15
    SolutionIndex: 60
    SolutionNameMin: Cijk_Ailk_Bljk_HBH_MT32x32x64_MI16x16x16x1_SE_1LDSB0_GRVW4_LPB16_NLCA1_PLR5_SU0_SUS256_SRVW4_TT1_16_WG32_8_1_WGM15
    SolutionIndex: 61
    SolutionNameMin: Cijk_Ailk_Bljk_HBH_MT128x64x64_MI32x32x8x1_SE_1LDSB0_GRVW4_LPB8_NLCA1_PLR9_SU0_SUS256_SRVW4_TT2_32_WG64_4_1_WGM15
    SolutionIndex: 62
    SolutionNameMin: Cijk_Ailk_Bljk_HBH_MT64x32x32_MI16x16x16x1_SE_1LDSB0_GRVW8_LPB16_NLCA1_PLR2_SU0_SUS256_SRVW4_TT2_16_WG32_8_1_WGM15
    SolutionIndex: 63
    SolutionNameMin: Cijk_Ailk_Bljk_HBH_MT64x64x32_MI32x32x8x1_SE_1LDSB0_GRVW8_LPB8_NLCA1_PLR5_SU0_SUS256_SRVW4_TT1_32_WG64_4_1_WGM15
    SolutionIndex: 64
    SolutionNameMin: Cijk_Ailk_Bljk_HBH_MT128x256x32_MI32x32x8x1_SE_1LDSB0_GRVW8_LPB8_NLCA1_PLR5_SU0_SUS256_SRVW4_TT2_128_WG64_4_1_WGM15
    SolutionIndex: 65
    SolutionNameMin: Cijk_Ailk_Bljk_HBH_MT256x128x32_MI32x32x8x1_SE_1LDSB0_GRVW8_LPB8_NLCA1_PLR5_SU0_SUS256_SRVW4_TT4_64_WG64_4_1_WGM15
    SolutionIndex: 66
    SolutionNameMin: Cijk_Ailk_Bljk_HBH_MT32x32x64_MI16x16x16x1_SE_1LDSB0_GRVW8_LPB16_NLCA1_PLR5_SU0_SUS256_SRVW4_TT1_16_WG32_8_1_WGM15
    SolutionIndex: 67
    SolutionNameMin: Cijk_Ailk_Bljk_HBH_MT64x128x64_MI32x32x8x1_SE_1LDSB0_GRVW8_LPB8_NLCA1_PLR9_SU0_SUS256_SRVW4_TT1_64_WG64_4_1_WGM15
    SolutionIndex: 68
    SolutionNameMin: Cijk_Ailk_Bljk_HBH_MT128x64x64_MI32x32x8x1_SE_1LDSB0_GRVW8_LPB8_NLCA1_PLR9_SU0_SUS256_SRVW4_TT2_32_WG64_4_1_WGM15
    SolutionIndex: 69
    SolutionNameMin: Cijk_Ailk_Bljk_HBH_MT128x96x64_MI32x32x8x1_SE_1LDSB0_GRVW8_LPB8_NLCA1_PLR9_SU0_SUS256_SRVW4_TT1_96_WG128_2_1_WGM15
    SolutionIndex: 70
    SolutionNameMin: Cijk_Ailk_Bljk_HBH_MT64x128x32_MI32x32x8x1_SE_1LDSB0_GRVW2_LPB8_NLCA1_PLR5_SU32_SUS128_SRVW4_TT1_64_WG64_4_1_WGM15
    SolutionIndex: 71
    SolutionNameMin: Cijk_Ailk_Bljk_HBH_MT128x288x32_MI32x32x8x1_SE_1LDSB0_GRVW4_LPB8_NLCA1_PLR5_SU32_SUS128_SRVW4_TT1_288_WG128_2_1_WGM15
    SolutionIndex: 72
    SolutionNameMin: Cijk_Ailk_Bljk_HBH_MT256x160x32_MI32x32x8x1_SE_1LDSB0_GRVW4_LPB8_NLCA1_PLR5_SU32_SUS128_SRVW4_TT2_160_WG128_2_1_WGM15
    SolutionIndex: 73
    SolutionNameMin: Cijk_Ailk_Bljk_HBH_MT32x32x64_MI16x16x16x1_SE_1LDSB0_GRVW4_LPB16_NLCA1_PLR5_SU32_SUS128_SRVW4_TT1_16_WG32_8_1_WGM15
    SolutionIndex: 74
    SolutionNameMin: Cijk_Ailk_Bljk_HBH_MT64x128x64_MI32x32x8x1_SE_1LDSB0_GRVW4_LPB8_NLCA1_PLR9_SU32_SUS128_SRVW4_TT1_64_WG64_4_1_WGM15
    SolutionIndex: 75
    SolutionNameMin: Cijk_Ailk_Bljk_HBH_MT64x128x32_MI32x32x8x1_SE_1LDSB0_GRVW8_LPB8_NLCA1_PLR5_SU32_SUS128_SRVW4_TT1_64_WG64_4_1_WGM15
    SolutionIndex: 76
    SolutionNameMin: Cijk_Ailk_Bljk_HBH_MT128x256x32_MI32x32x8x1_SE_1LDSB0_GRVW8_LPB8_NLCA1_PLR5_SU32_SUS128_SRVW4_TT2_128_WG64_4_1_WGM15
    SolutionIndex: 77
    SolutionNameMin: Cijk_Ailk_Bljk_HBH_MT32x32x64_MI16x16x16x1_SE_1LDSB0_GRVW8_LPB16_NLCA1_PLR5_SU32_SUS128_SRVW4_TT1_16_WG32_8_1_WGM15
    SolutionIndex: 78
    SolutionNameMin: Cijk_Ailk_Bljk_HBH_MT64x128x64_MI32x32x8x1_SE_1LDSB0_GRVW8_LPB8_NLCA1_PLR9_SU32_SUS128_SRVW4_TT1_64_WG64_4_1_WGM15
    SolutionIndex: 79
    SolutionNameMin: Cijk_Ailk_Bljk_HBH_MT64x128x32_MI32x32x8x1_SE_1LDSB0_GRVW2_LPB8_NLCA1_PLR5_SU32_SUS256_SRVW4_TT1_64_WG64_4_1_WGM15
    SolutionIndex: 80
    SolutionNameMin: Cijk_Ailk_Bljk_HBH_MT128x288x32_MI32x32x8x1_SE_1LDSB0_GRVW2_LPB8_NLCA1_PLR5_SU32_SUS256_SRVW4_TT1_288_WG128_2_1_WGM15
    SolutionIndex: 81
    SolutionNameMin: Cijk_Ailk_Bljk_HBH_MT128x96x32_MI32x32x8x1_SE_1LDSB0_GRVW4_LPB8_NLCA1_PLR5_SU32_SUS256_SRVW4_TT1_96_WG128_2_1_WGM15
    SolutionIndex: 82
    SolutionNameMin: Cijk_Ailk_Bljk_HBH_MT256x160x32_MI32x32x8x1_SE_1LDSB0_GRVW4_LPB8_NLCA1_PLR5_SU32_SUS256_SRVW4_TT2_160_WG128_2_1_WGM15
    SolutionIndex: 83
    SolutionNameMin: Cijk_Ailk_Bljk_HBH_MT128x128x32_MI32x32x8x1_SE_1LDSB0_GRVW8_LPB8_NLCA1_PLR5_SU32_SUS256_SRVW4_TT2_64_WG64_4_1_WGM15
    SolutionIndex: 84
    SolutionNameMin: Cijk_Ailk_Bljk_HBH_MT32x32x64_MI16x16x16x1_SE_1LDSB0_GRVW8_LPB16_NLCA1_PLR5_SU32_SUS256_SRVW4_TT1_16_WG32_8_1_WGM15
    SolutionIndex: 85
    SolutionNameMin: Cijk_Ailk_Bljk_HBH_MT32x64x64_MI16x16x16x1_SE_1LDSB0_GRVW8_LPB16_NLCA1_PLR5_SU32_SUS256_SRVW4_TT1_32_WG32_8_1_WGM15
    SolutionIndex: 86
    SolutionNameMin: Cijk_Ailk_Bljk_HBH_MT64x128x64_MI32x32x8x1_SE_1LDSB0_GRVW8_LPB8_NLCA1_PLR9_SU32_SUS256_SRVW4_TT1_64_WG64_4_1_WGM15
    SolutionIndex: 87
    SolutionNameMin: Cijk_Ailk_Bljk_HBH_MT128x96x64_MI32x32x8x1_SE_1LDSB0_GRVW8_LPB8_NLCA1_PLR9_SU32_SUS256_SRVW4_TT1_96_WG128_2_1_WGM15
    SolutionIndex: 88
    SolutionNameMin: Cijk_Ailk_Bljk_HBH_MT32x64x32_MI16x16x16x1_SE_1LDSB1_GRVW2_LPB16_NLCA1_PLR2_SU0_SUS256_SRVW4_TT1_32_WG32_8_1_WGM1
    SolutionIndex: 89
    SolutionNameMin: Cijk_Ailk_Bljk_HBH_MT64x32x32_MI16x16x16x1_SE_1LDSB1_GRVW2_LPB16_NLCA1_PLR2_SU0_SUS256_SRVW4_TT2_16_WG32_8_1_WGM1
    SolutionIndex: 90
    SolutionNameMin: Cijk_Ailk_Bljk_HBH_MT128x128x32_MI32x32x8x1_SE_1LDSB1_GRVW2_LPB8_NLCA1_PLR5_SU0_SUS256_SRVW4_TT2_64_WG64_4_1_WGM1
    SolutionIndex: 91
    SolutionNameMin: Cijk_Ailk_Bljk_HBH_MT128x96x32_MI32x32x8x1_SE_1LDSB1_GRVW2_LPB8_NLCA1_PLR5_SU0_SUS256_SRVW4_TT1_96_WG128_2_1_WGM1
    SolutionIndex: 92
    SolutionNameMin: Cijk_Ailk_Bljk_HBH_MT128x128x64_MI32x32x8x1_SE_1LDSB1_GRVW2_LPB8_NLCA1_PLR9_SU0_SUS256_SRVW4_TT2_64_WG64_4_1_WGM1
    SolutionIndex: 93
    SolutionNameMin: Cijk_Ailk_Bljk_HBH_MT128x256x32_MI32x32x8x1_SE_1LDSB1_GRVW8_LPB8_NLCA1_PLR5_SU0_SUS256_SRVW4_TT2_128_WG64_4_1_WGM1
    SolutionIndex: 94
    SolutionNameMin: Cijk_Ailk_Bljk_HBH_MT256x128x32_MI32x32x8x1_SE_1LDSB1_GRVW8_LPB8_NLCA1_PLR5_SU0_SUS256_SRVW4_TT4_64_WG64_4_1_WGM1
    SolutionIndex: 95
    SolutionNameMin: Cijk_Ailk_Bljk_HBH_MT256x256x32_MI32x32x8x1_SE_1LDSB1_GRVW8_LPB8_NLCA1_PLR5_SU0_SUS256_SRVW4_TT4_128_WG64_4_1_WGM1
    SolutionIndex: 96
    SolutionNameMin: Cijk_Ailk_Bljk_HBH_MT160x160x64_MI16x16x16x1_SE_1LDSB1_GRVW8_LPB16_NLCA5_PLR5_SU0_SUS256_SRVW0_TT5_80_WG32_8_1_WGM1
    SolutionIndex: 97
    SolutionNameMin: Cijk_Ailk_Bljk_HBH_MT128x128x32_MI32x32x8x1_SE_1LDSB1_GRVW2_LPB8_NLCA1_PLR5_SU32_SUS128_SRVW4_TT2_64_WG64_4_1_WGM1
    SolutionIndex: 98
    SolutionNameMin: Cijk_Ailk_Bljk_HBH_MT128x96x32_MI32x32x8x1_SE_1LDSB1_GRVW2_LPB8_NLCA1_PLR5_SU32_SUS128_SRVW4_TT1_96_WG128_2_1_WGM1
    SolutionIndex: 99
    SolutionNameMin: Cijk_Ailk_Bljk_HBH_MT128x128x64_MI32x32x8x1_SE_1LDSB1_GRVW2_LPB8_NLCA1_PLR9_SU32_SUS128_SRVW4_TT2_64_WG64_4_1_WGM1
    SolutionIndex: 100
    SolutionNameMin: Cijk_Ailk_Bljk_HBH_MT128x256x32_MI32x32x8x1_SE_1LDSB1_GRVW8_LPB8_NLCA1_PLR5_SU32_SUS128_SRVW4_TT2_128_WG64_4_1_WGM1
    SolutionIndex: 101
    SolutionNameMin: Cijk_Ailk_Bljk_HBH_MT32x64x32_MI16x16x16x1_SE_1LDSB1_GRVW2_LPB16_NLCA1_PLR2_SU32_SUS256_SRVW4_TT1_32_WG32_8_1_WGM1
    SolutionIndex: 102
    SolutionNameMin: Cijk_Ailk_Bljk_HBH_MT128x128x32_MI32x32x8x1_SE_1LDSB1_GRVW2_LPB8_NLCA1_PLR5_SU32_SUS256_SRVW4_TT2_64_WG64_4_1_WGM1
    SolutionIndex: 103
    SolutionNameMin: Cijk_Ailk_Bljk_HBH_MT128x96x32_MI32x32x8x1_SE_1LDSB1_GRVW2_LPB8_NLCA1_PLR5_SU32_SUS256_SRVW4_TT1_96_WG128_2_1_WGM1
    SolutionIndex: 104
    SolutionNameMin: Cijk_Ailk_Bljk_HBH_MT128x96x64_MI32x32x8x1_SE_1LDSB1_GRVW2_LPB8_NLCA1_PLR9_SU32_SUS256_SRVW4_TT1_96_WG128_2_1_WGM1
    SolutionIndex: 105
    SolutionNameMin: Cijk_Ailk_Bljk_HBH_MT256x256x32_MI32x32x8x1_SE_1LDSB1_GRVW8_LPB8_NLCA1_PLR5_SU32_SUS256_SRVW4_TT4_128_WG64_4_1_WGM1
    SolutionIndex: 106
    SolutionNameMin: Cijk_Ailk_Bljk_HBH_MT32x64x32_MI16x16x16x1_SE_1LDSB1_GRVW2_LPB16_NLCA1_PLR2_SU0_SUS256_SRVW4_TT1_32_WG32_8_1_WGM2
    SolutionIndex: 107
    SolutionNameMin: Cijk_Ailk_Bljk_HBH_MT64x32x32_MI16x16x16x1_SE_1LDSB1_GRVW2_LPB16_NLCA1_PLR2_SU0_SUS256_SRVW4_TT2_16_WG32_8_1_WGM2
    SolutionIndex: 108
    SolutionNameMin: Cijk_Ailk_Bljk_HBH_MT128x128x32_MI32x32x8x1_SE_1LDSB1_GRVW2_LPB8_NLCA1_PLR5_SU0_SUS256_SRVW4_TT2_64_WG64_4_1_WGM2
    SolutionIndex: 109
    SolutionNameMin: Cijk_Ailk_Bljk_HBH_MT256x256x32_MI32x32x8x1_SE_1LDSB1_GRVW2_LPB8_NLCA2_PLR5_SU0_SUS256_SRVW4_TT4_128_WG64_4_1_WGM2
    SolutionIndex: 110
    SolutionNameMin: Cijk_Ailk_Bljk_HBH_MT128x96x32_MI32x32x8x1_SE_1LDSB1_GRVW2_LPB8_NLCA1_PLR5_SU0_SUS256_SRVW4_TT1_96_WG128_2_1_WGM2
    SolutionIndex: 111
    SolutionNameMin: Cijk_Ailk_Bljk_HBH_MT128x96x64_MI32x32x8x1_SE_1LDSB1_GRVW2_LPB8_NLCA1_PLR9_SU0_SUS256_SRVW4_TT1_96_WG128_2_1_WGM2
    SolutionIndex: 112
    SolutionNameMin: Cijk_Ailk_Bljk_HBH_MT128x160x64_MI32x32x8x1_SE_1LDSB1_GRVW2_LPB8_NLCA1_PLR9_SU0_SUS256_SRVW4_TT1_160_WG128_2_1_WGM2
    SolutionIndex: 113
    SolutionNameMin: Cijk_Ailk_Bljk_HBH_MT128x256x32_MI32x32x8x1_SE_1LDSB1_GRVW8_LPB8_NLCA1_PLR5_SU0_SUS256_SRVW4_TT2_128_WG64_4_1_WGM2
    SolutionIndex: 114
    SolutionNameMin: Cijk_Ailk_Bljk_HBH_MT256x128x32_MI32x32x8x1_SE_1LDSB1_GRVW8_LPB8_NLCA1_PLR5_SU0_SUS256_SRVW4_TT4_64_WG64_4_1_WGM2
    SolutionIndex: 115
    SolutionNameMin: Cijk_Ailk_Bljk_HBH_MT256x256x32_MI32x32x8x1_SE_1LDSB1_GRVW8_LPB8_NLCA1_PLR5_SU0_SUS256_SRVW4_TT4_128_WG64_4_1_WGM2
    SolutionIndex: 116
    SolutionNameMin: Cijk_Ailk_Bljk_HBH_MT160x160x64_MI16x16x16x1_SE_1LDSB1_GRVW8_LPB16_NLCA5_PLR5_SU0_SUS256_SRVW0_TT5_80_WG32_8_1_WGM2
    SolutionIndex: 117
    SolutionNameMin: Cijk_Ailk_Bljk_HBH_MT64x32x32_MI16x16x16x1_SE_1LDSB1_GRVW2_LPB16_NLCA1_PLR2_SU32_SUS128_SRVW4_TT2_16_WG32_8_1_WGM2
    SolutionIndex: 118
    SolutionNameMin: Cijk_Ailk_Bljk_HBH_MT128x128x32_MI32x32x8x1_SE_1LDSB1_GRVW2_LPB8_NLCA1_PLR5_SU32_SUS128_SRVW4_TT2_64_WG64_4_1_WGM2
    SolutionIndex: 119
    SolutionNameMin: Cijk_Ailk_Bljk_HBH_MT128x256x32_MI32x32x8x1_SE_1LDSB1_GRVW2_LPB8_NLCA1_PLR5_SU32_SUS128_SRVW4_TT2_128_WG64_4_1_WGM2
    SolutionIndex: 120
    SolutionNameMin: Cijk_Ailk_Bljk_HBH_MT256x256x32_MI32x32x8x1_SE_1LDSB1_GRVW2_LPB8_NLCA2_PLR5_SU32_SUS128_SRVW4_TT4_128_WG64_4_1_WGM2
    SolutionIndex: 121
    SolutionNameMin: Cijk_Ailk_Bljk_HBH_MT128x96x32_MI32x32x8x1_SE_1LDSB1_GRVW2_LPB8_NLCA1_PLR5_SU32_SUS128_SRVW4_TT1_96_WG128_2_1_WGM2
    SolutionIndex: 122
    SolutionNameMin: Cijk_Ailk_Bljk_HBH_MT128x160x64_MI32x32x8x1_SE_1LDSB1_GRVW2_LPB8_NLCA1_PLR9_SU32_SUS128_SRVW4_TT1_160_WG128_2_1_WGM2
    SolutionIndex: 123
    SolutionNameMin: Cijk_Ailk_Bljk_HBH_MT128x256x32_MI32x32x8x1_SE_1LDSB1_GRVW8_LPB8_NLCA1_PLR5_SU32_SUS128_SRVW4_TT2_128_WG64_4_1_WGM2
    SolutionIndex: 124
    SolutionNameMin: Cijk_Ailk_Bljk_HBH_MT256x128x32_MI32x32x8x1_SE_1LDSB1_GRVW8_LPB8_NLCA1_PLR5_SU32_SUS128_SRVW4_TT4_64_WG64_4_1_WGM2
    SolutionIndex: 125
    SolutionNameMin: Cijk_Ailk_Bljk_HBH_MT32x64x32_MI16x16x16x1_SE_1LDSB1_GRVW2_LPB16_NLCA1_PLR2_SU32_SUS256_SRVW4_TT1_32_WG32_8_1_WGM2
    SolutionIndex: 126
    SolutionNameMin: Cijk_Ailk_Bljk_HBH_MT64x32x32_MI16x16x16x1_SE_1LDSB1_GRVW2_LPB16_NLCA1_PLR2_SU32_SUS256_SRVW4_TT2_16_WG32_8_1_WGM2
    SolutionIndex: 127
    SolutionNameMin: Cijk_Ailk_Bljk_HBH_MT128x128x32_MI32x32x8x1_SE_1LDSB1_GRVW2_LPB8_NLCA1_PLR5_SU32_SUS256_SRVW4_TT2_64_WG64_4_1_WGM2
    SolutionIndex: 128
    SolutionNameMin: Cijk_Ailk_Bljk_HBH_MT128x96x64_MI32x32x8x1_SE_1LDSB1_GRVW2_LPB8_NLCA1_PLR9_SU32_SUS256_SRVW4_TT1_96_WG128_2_1_WGM2
    SolutionIndex: 129
    SolutionNameMin: Cijk_Ailk_Bljk_HBH_MT256x144x64_MI16x16x16x1_SE_1LDSB1_GRVW4_LPB16_NLCA1_PLR5_SU32_SUS256_SRVW4_TT4_144_WG64_4_1_WGM2
    SolutionIndex: 130
    SolutionNameMin: Cijk_Ailk_Bljk_HBH_MT128x256x32_MI32x32x8x1_SE_1LDSB1_GRVW8_LPB8_NLCA1_PLR5_SU32_SUS256_SRVW4_TT2_128_WG64_4_1_WGM2
    SolutionIndex: 131
    SolutionNameMin: Cijk_Ailk_Bljk_HBH_MT64x32x32_MI16x16x16x1_SE_1LDSB1_GRVW2_LPB16_NLCA1_PLR2_SU0_SUS256_SRVW4_TT2_16_WG32_8_1_WGM15
    SolutionIndex: 132
    SolutionNameMin: Cijk_Ailk_Bljk_HBH_MT128x144x32_MI16x16x16x1_SE_1LDSB1_GRVW2_LPB16_NLCA1_PLR2_SU0_SUS256_SRVW4_TT2_144_WG64_4_1_WGM15
    SolutionIndex: 133
    SolutionNameMin: Cijk_Ailk_Bljk_HBH_MT128x128x32_MI32x32x8x1_SE_1LDSB1_GRVW2_LPB8_NLCA1_PLR5_SU0_SUS256_SRVW4_TT2_64_WG64_4_1_WGM15
    SolutionIndex: 134
    SolutionNameMin: Cijk_Ailk_Bljk_HBH_MT128x256x32_MI32x32x8x1_SE_1LDSB1_GRVW2_LPB8_NLCA1_PLR5_SU0_SUS256_SRVW4_TT2_128_WG64_4_1_WGM15
    SolutionIndex: 135
    SolutionNameMin: Cijk_Ailk_Bljk_HBH_MT256x256x32_MI32x32x8x1_SE_1LDSB1_GRVW2_LPB8_NLCA2_PLR5_SU0_SUS256_SRVW4_TT4_128_WG64_4_1_WGM15
    SolutionIndex: 136
    SolutionNameMin: Cijk_Ailk_Bljk_HBH_MT128x96x32_MI32x32x8x1_SE_1LDSB1_GRVW2_LPB8_NLCA1_PLR5_SU0_SUS256_SRVW4_TT1_96_WG128_2_1_WGM15
    SolutionIndex: 137
    SolutionNameMin: Cijk_Ailk_Bljk_HBH_MT128x128x64_MI32x32x8x1_SE_1LDSB1_GRVW2_LPB8_NLCA1_PLR9_SU0_SUS256_SRVW4_TT2_64_WG64_4_1_WGM15
    SolutionIndex: 138
    SolutionNameMin: Cijk_Ailk_Bljk_HBH_MT128x96x64_MI32x32x8x1_SE_1LDSB1_GRVW2_LPB8_NLCA1_PLR9_SU0_SUS256_SRVW4_TT1_96_WG128_2_1_WGM15
    SolutionIndex: 139
    SolutionNameMin: Cijk_Ailk_Bljk_HBH_MT128x160x64_MI32x32x8x1_SE_1LDSB1_GRVW2_LPB8_NLCA1_PLR9_SU0_SUS256_SRVW4_TT1_160_WG128_2_1_WGM15
    SolutionIndex: 140
    SolutionNameMin: Cijk_Ailk_Bljk_HBH_MT128x256x32_MI32x32x8x1_SE_1LDSB1_GRVW8_LPB8_NLCA1_PLR5_SU0_SUS256_SRVW4_TT2_128_WG64_4_1_WGM15
    SolutionIndex: 141
    SolutionNameMin: Cijk_Ailk_Bljk_HBH_MT256x128x32_MI32x32x8x1_SE_1LDSB1_GRVW8_LPB8_NLCA1_PLR5_SU0_SUS256_SRVW4_TT4_64_WG64_4_1_WGM15
    SolutionIndex: 142
    SolutionNameMin: Cijk_Ailk_Bljk_HBH_MT256x256x32_MI32x32x8x1_SE_1LDSB1_GRVW8_LPB8_NLCA1_PLR5_SU0_SUS256_SRVW4_TT4_128_WG64_4_1_WGM15
    SolutionIndex: 143
    SolutionNameMin: Cijk_Ailk_Bljk_HBH_MT64x32x32_MI16x16x16x1_SE_1LDSB1_GRVW2_LPB16_NLCA1_PLR2_SU32_SUS128_SRVW4_TT2_16_WG32_8_1_WGM15
    SolutionIndex: 144
    SolutionNameMin: Cijk_Ailk_Bljk_HBH_MT128x144x32_MI16x16x16x1_SE_1LDSB1_GRVW2_LPB16_NLCA1_PLR2_SU32_SUS128_SRVW4_TT2_144_WG64_4_1_WGM15
    SolutionIndex: 145
    SolutionNameMin: Cijk_Ailk_Bljk_HBH_MT128x128x32_MI32x32x8x1_SE_1LDSB1_GRVW2_LPB8_NLCA1_PLR5_SU32_SUS128_SRVW4_TT2_64_WG64_4_1_WGM15
    SolutionIndex: 146
    SolutionNameMin: Cijk_Ailk_Bljk_HBH_MT256x256x32_MI32x32x8x1_SE_1LDSB1_GRVW2_LPB8_NLCA2_PLR5_SU32_SUS128_SRVW4_TT4_128_WG64_4_1_WGM15
    SolutionIndex: 147
    SolutionNameMin: Cijk_Ailk_Bljk_HBH_MT128x160x64_MI32x32x8x1_SE_1LDSB1_GRVW2_LPB8_NLCA1_PLR9_SU32_SUS128_SRVW4_TT1_160_WG128_2_1_WGM15
    SolutionIndex: 148
    SolutionNameMin: Cijk_Ailk_Bljk_HBH_MT128x256x32_MI32x32x8x1_SE_1LDSB1_GRVW8_LPB8_NLCA1_PLR5_SU32_SUS128_SRVW4_TT2_128_WG64_4_1_WGM15
    SolutionIndex: 149
    SolutionNameMin: Cijk_Ailk_Bljk_HBH_MT128x128x32_MI32x32x8x1_SE_1LDSB1_GRVW2_LPB8_NLCA1_PLR5_SU32_SUS256_SRVW4_TT2_64_WG64_4_1_WGM15
    SolutionIndex: 150
    SolutionNameMin: Cijk_Ailk_Bljk_HBH_MT256x128x32_MI32x32x8x1_SE_1LDSB1_GRVW2_LPB8_NLCA2_PLR5_SU32_SUS256_SRVW4_TT4_64_WG64_4_1_WGM15
    SolutionIndex: 151
    SolutionNameMin: Cijk_Ailk_Bljk_HBH_MT64x256x64_MI32x32x8x1_SE_1LDSB1_GRVW2_LPB8_NLCA1_PLR9_SU32_SUS256_SRVW4_TT1_128_WG64_4_1_WGM15
    SolutionIndex: 152
    SolutionNameMin: Cijk_Ailk_Bljk_HBH_MT128x96x64_MI32x32x8x1_SE_1LDSB1_GRVW2_LPB8_NLCA1_PLR9_SU32_SUS256_SRVW4_TT1_96_WG128_2_1_WGM15
    SolutionIndex: 153
    SolutionNameMin: Cijk_Ailk_Bljk_HBH_MT128x256x32_MI32x32x8x1_SE_1LDSB1_GRVW8_LPB8_NLCA1_PLR5_SU32_SUS256_SRVW4_TT2_128_WG64_4_1_WGM15
    SolutionIndex: 154
    SolutionNameMin: Cijk_Ailk_Bljk_HBH_MT256x256x32_MI32x32x8x1_SE_1LDSB1_GRVW8_LPB8_NLCA1_PLR5_SU32_SUS256_SRVW4_TT4_128_WG64_4_1_WGM15
    SolutionIndex: 155
    SolutionNameMin: Cijk_Ailk_Bljk_HBH_MT256x160x32_MI32x32x8x1_SE_1LDSB0_GRVW4_LPB8_NLCA1_PLR5_SU0_SUS256_SRVW0_TT2_160_WG128_2_1_WGM1
    SolutionIndex: 156
    SolutionNameMin: Cijk_Ailk_Bljk_HBH_MT256x160x32_MI32x32x8x1_SE_1LDSB0_GRVW4_LPB8_NLCA1_PLR5_SU32_SUS128_SRVW0_TT2_160_WG128_2_1_WGM1
    SolutionIndex: 157
    SolutionNameMin: Cijk_Ailk_Bljk_HBH_MT256x160x32_MI32x32x8x1_SE_1LDSB0_GRVW4_LPB8_NLCA1_PLR5_SU0_SUS256_SRVW0_TT2_160_WG128_2_1_WGM2
    SolutionIndex: 158
    SolutionNameMin: Cijk_Ailk_Bljk_HBH_MT32x32x64_MI16x16x16x1_SE_1LDSB0_GRVW8_LPB16_NLCA1_PLR5_SU0_SUS256_SRVW0_TT1_16_WG32_8_1_WGM2
    SolutionIndex: 159
    SolutionNameMin: Cijk_Ailk_Bljk_HBH_MT256x160x32_MI32x32x8x1_SE_1LDSB0_GRVW4_LPB8_NLCA1_PLR5_SU32_SUS128_SRVW0_TT2_160_WG128_2_1_WGM2
    SolutionIndex: 160
    SolutionNameMin: Cijk_Ailk_Bljk_HBH_MT96x128x64_MI32x32x8x1_SE_1LDSB0_GRVW4_LPB8_NLCA3_PLR9_SU32_SUS128_SRVW0_TT3_32_WG32_8_1_WGM2
    SolutionIndex: 161
    SolutionNameMin: Cijk_Ailk_Bljk_HBH_MT256x160x32_MI32x32x8x1_SE_1LDSB0_GRVW4_LPB8_NLCA1_PLR5_SU32_SUS256_SRVW0_TT2_160_WG128_2_1_WGM2
    SolutionIndex: 162
    SolutionNameMin: Cijk_Ailk_Bljk_HBH_MT256x160x32_MI32x32x8x1_SE_1LDSB0_GRVW4_LPB8_NLCA1_PLR5_SU0_SUS256_SRVW0_TT2_160_WG128_2_1_WGM15
    SolutionIndex: 163
    SolutionNameMin: Cijk_Ailk_Bljk_HBH_MT256x160x32_MI32x32x8x1_SE_1LDSB0_GRVW4_LPB8_NLCA1_PLR5_SU32_SUS128_SRVW0_TT2_160_WG128_2_1_WGM15
    SolutionIndex: 164
    SolutionNameMin: Cijk_Ailk_Bljk_HBH_MT256x160x32_MI32x32x8x1_SE_1LDSB0_GRVW4_LPB8_NLCA1_PLR5_SU32_SUS256_SRVW0_TT2_160_WG128_2_1_WGM15
    SolutionIndex: 165
    SolutionNameMin: Cijk_Ailk_Bljk_HBH_MT256x128x32_MI32x32x8x1_SE_1LDSB1_GRVW8_LPB8_NLCA1_PLR5_SU0_SUS256_SRVW0_TT4_64_WG64_4_1_WGM2
    SolutionIndex: 166
    SolutionNameMin: Cijk_Ailk_Bljk_HBH_MT256x160x32_MI32x32x8x1_SE_1LDSB1_GRVW2_LPB8_NLCA2_PLR5_SU0_SUS256_SRVW0_TT2_160_WG128_2_1_WGM15
    SolutionIndex: 167
    SolutionNameMin: Cijk_Ailk_Bljk_HBH_MT32x32x64_MI16x16x16x1_SE_1LDSB0_GRVW2_LPB16_NLCA1_PLR5_SU0_SUS256_SRVW0_TT1_16_WG32_8_1_WGM1
    SolutionIndex: 168
    SolutionNameMin: Cijk_Ailk_Bljk_HBH_MT256x128x32_MI32x32x8x1_SE_1LDSB0_GRVW8_LPB8_NLCA1_PLR5_SU0_SUS256_SRVW0_TT4_64_WG64_4_1_WGM1
    SolutionIndex: 169
    SolutionNameMin: Cijk_Ailk_Bljk_HBH_MT32x32x64_MI16x16x16x1_SE_1LDSB0_GRVW8_LPB16_NLCA1_PLR5_SU32_SUS128_SRVW0_TT1_16_WG32_8_1_WGM1
    SolutionIndex: 170
    SolutionNameMin: Cijk_Ailk_Bljk_HBH_MT32x64x64_MI16x16x16x1_SE_1LDSB0_GRVW8_LPB16_NLCA1_PLR5_SU32_SUS256_SRVW0_TT1_32_WG32_8_1_WGM1
    SolutionIndex: 171
    SolutionNameMin: Cijk_Ailk_Bljk_HBH_MT32x32x64_MI16x16x16x1_SE_1LDSB0_GRVW4_LPB16_NLCA1_PLR5_SU0_SUS256_SRVW0_TT1_16_WG32_8_1_WGM2
    SolutionIndex: 172
    SolutionNameMin: Cijk_Ailk_Bljk_HBH_MT32x64x64_MI16x16x16x1_SE_1LDSB0_GRVW8_LPB16_NLCA1_PLR5_SU0_SUS256_SRVW0_TT1_32_WG32_8_1_WGM2
    SolutionIndex: 173
    SolutionNameMin: Cijk_Ailk_Bljk_HBH_MT32x32x32_MI16x16x16x1_SE_1LDSB0_GRVW4_LPB16_NLCA1_PLR2_SU32_SUS128_SRVW0_TT1_16_WG32_8_1_WGM2
    SolutionIndex: 174
    SolutionNameMin: Cijk_Ailk_Bljk_HBH_MT64x64x64_MI32x32x8x1_SE_1LDSB0_GRVW8_LPB8_NLCA1_PLR9_SU32_SUS256_SRVW0_TT1_32_WG64_4_1_WGM2
    SolutionIndex: 175
    SolutionNameMin: Cijk_Ailk_Bljk_HBH_MT256x160x32_MI32x32x8x1_SE_1LDSB0_GRVW4_LPB8_NLCA1_PLR5_SU0_SUS256_SRVW0_TT2_160_WG128_2_1_WGM15
    SolutionIndex: 176
    SolutionNameMin: Cijk_Ailk_Bljk_HBH_MT32x32x64_MI16x16x16x1_SE_1LDSB0_GRVW8_LPB16_NLCA1_PLR5_SU0_SUS256_SRVW0_TT1_16_WG32_8_1_WGM15
    SolutionIndex: 177
    SolutionNameMin: Cijk_Ailk_Bljk_HBH_MT256x256x32_MI32x32x8x1_SE_1LDSB1_GRVW2_LPB8_NLCA2_PLR5_SU0_SUS256_SRVW0_TT4_128_WG64_4_1_WGM1
    SolutionIndex: 178
    SolutionNameMin: Cijk_Ailk_Bljk_HBH_MT256x128x32_MI32x32x8x1_SE_1LDSB1_GRVW8_LPB8_NLCA1_PLR5_SU0_SUS256_SRVW0_TT4_64_WG64_4_1_WGM1
    SolutionIndex: 179
    SolutionNameMin: Cijk_Ailk_Bljk_HBH_MT96x96x64_MI16x16x16x1_SE_1LDSB0_GRVW2_LPB16_NLCA3_PLR5_SU0_SUS256_SRVW0_TT3_48_WG32_8_1_WGM1
    SolutionIndex: 180
    SolutionNameMin: Cijk_Ailk_Bljk_HBH_MT96x96x64_MI16x16x16x1_SE_1LDSB0_GRVW8_LPB16_NLCA3_PLR5_SU0_SUS256_SRVW0_TT3_48_WG32_8_1_WGM1
    SolutionIndex: 181
    SolutionNameMin: Cijk_Ailk_Bljk_HBH_MT256x160x32_MI32x32x8x1_SE_1LDSB0_GRVW4_LPB8_NLCA1_PLR5_SU32_SUS128_SRVW0_TT2_160_WG128_2_1_WGM1
    SolutionIndex: 182
    SolutionNameMin: Cijk_Ailk_Bljk_HBH_MT96x96x64_MI16x16x16x1_SE_1LDSB0_GRVW8_LPB16_NLCA3_PLR5_SU32_SUS128_SRVW0_TT3_48_WG32_8_1_WGM1
    SolutionIndex: 183
    SolutionNameMin: Cijk_Ailk_Bljk_HBH_MT64x32x64_MI16x16x16x1_SE_1LDSB0_GRVW8_LPB16_NLCA1_PLR5_SU32_SUS256_SRVW0_TT2_16_WG32_8_1_WGM1
    SolutionIndex: 184
    SolutionNameMin: Cijk_Ailk_Bljk_HBH_MT32x32x64_MI16x16x16x1_SE_1LDSB0_GRVW8_LPB16_NLCA1_PLR5_SU0_SUS256_SRVW0_TT1_16_WG32_8_1_WGM2
    SolutionIndex: 185
    SolutionNameMin: Cijk_Ailk_Bljk_HBH_MT256x144x64_MI16x16x16x1_SE_1LDSB1_GRVW4_LPB16_NLCA1_PLR5_SU0_SUS256_SRVW0_TT4_144_WG64_4_1_WGM2
    SolutionIndex: 186
    SolutionNameMin: Cijk_Ailk_Bljk_HBH_MT256x144x64_MI16x16x16x1_SE_1LDSB1_GRVW4_LPB16_NLCA1_PLR5_SU0_SUS256_SRVW0_TT4_144_WG64_4_1_WGM15
    SolutionIndex: 187
    SolutionNameMin: Cijk_Ailk_Bljk_HBH_MT64x32x64_MI16x16x16x1_SE_1LDSB0_GRVW4_LPB16_NLCA1_PLR5_SU32_SUS128_SRVW0_TT2_16_WG32_8_1_WGM1
    SolutionIndex: 188
    SolutionNameMin: Cijk_Ailk_Bljk_HBH_MT64x128x64_MI32x32x8x1_SE_1LDSB0_GRVW4_LPB8_NLCA1_PLR9_SU32_SUS256_SRVW0_TT1_64_WG64_4_1_WGM2
    SolutionIndex: 189
    SolutionNameMin: Cijk_Ailk_Bljk_HBH_MT256x160x32_MI32x32x8x1_SE_1LDSB0_GRVW4_LPB8_NLCA1_PLR5_SU0_SUS256_SRVW0_TT2_160_WG128_2_1_WGM15
    SolutionIndex: 190
    SolutionNameMin: Cijk_Ailk_Bljk_HBH_MT256x128x32_MI32x32x8x1_SE_1LDSB0_GRVW8_LPB8_NLCA1_PLR5_SU0_SUS256_SRVW0_TT4_64_WG64_4_1_WGM1
    SolutionIndex: 191
    SolutionNameMin: Cijk_Ailk_Bljk_HBH_MT256x160x32_MI32x32x8x1_SE_1LDSB0_GRVW2_LPB8_NLCA2_PLR5_SU32_SUS128_SRVW0_TT2_160_WG128_2_1_WGM1
    SolutionIndex: 192
    SolutionNameMin: Cijk_Ailk_Bljk_HBH_MT128x96x64_MI32x32x8x1_SE_1LDSB0_GRVW8_LPB8_NLCA1_PLR9_SU0_SUS256_SRVW0_TT1_96_WG128_2_1_WGM15
    SolutionIndex: 193
    SolutionNameMin: Cijk_Ailk_Bljk_HBH_MT128x160x64_MI32x32x8x1_SE_1LDSB1_GRVW2_LPB8_NLCA1_PLR9_SU0_SUS256_SRVW0_TT1_160_WG128_2_1_WGM1
    SolutionIndex: 194
    SolutionNameMin: Cijk_Ailk_Bljk_HBH_MT256x256x32_MI32x32x8x1_SE_1LDSB1_GRVW4_LPB8_NLCA1_PLR5_SU0_SUS256_SRVW0_TT4_128_WG64_4_1_WGM1
    SolutionIndex: 195
    SolutionNameMin: Cijk_Ailk_Bljk_HBH_MT256x128x32_MI32x32x8x1_SE_1LDSB1_GRVW8_LPB8_NLCA1_PLR5_SU0_SUS256_SRVW0_TT4_64_WG64_4_1_WGM1
    SolutionIndex: 196
    SolutionNameMin: Cijk_Ailk_Bljk_HBH_MT128x160x64_MI32x32x8x1_SE_1LDSB1_GRVW2_LPB8_NLCA1_PLR9_SU0_SUS256_SRVW0_TT1_160_WG128_2_1_WGM15
    SolutionIndex: 197
    SolutionNameMin: Cijk_Ailk_Bljk_HBH_MT128x64x32_MI32x32x8x1_SE_1LDSB0_GRVW2_LPB8_NLCA1_PLR5_SU0_SUS256_SRVW4_TT2_32_WG64_4_1_WGM1
    SolutionIndex: 198
    SolutionNameMin: Cijk_Ailk_Bljk_HBH_MT128x64x32_MI32x32x8x1_SE_1LDSB0_GRVW4_LPB8_NLCA1_PLR5_SU0_SUS256_SRVW4_TT2_32_WG64_4_1_WGM1
    SolutionIndex: 199
    SolutionNameMin: Cijk_Ailk_Bljk_HBH_MT128x64x32_MI32x32x8x1_SE_1LDSB0_GRVW8_LPB8_NLCA1_PLR5_SU0_SUS256_SRVW4_TT2_32_WG64_4_1_WGM1
    SolutionIndex: 200
    SolutionNameMin: Cijk_Ailk_Bljk_HBH_MT64x128x64_MI32x32x8x1_SE_1LDSB0_GRVW8_LPB8_NLCA1_PLR9_SU0_SUS256_SRVW4_TT1_64_WG64_4_1_WGM1
    SolutionIndex: 201
    SolutionNameMin: Cijk_Ailk_Bljk_HBH_MT128x64x32_MI32x32x8x1_SE_1LDSB0_GRVW8_LPB8_NLCA1_PLR5_SU32_SUS256_SRVW4_TT2_32_WG64_4_1_WGM1
    SolutionIndex: 202
    SolutionNameMin: Cijk_Ailk_Bljk_HBH_MT64x32x32_MI16x16x16x1_SE_1LDSB0_GRVW4_LPB16_NLCA1_PLR2_SU0_SUS256_SRVW4_TT2_16_WG32_8_1_WGM2
    SolutionIndex: 203
    SolutionNameMin: Cijk_Ailk_Bljk_HBH_MT128x96x32_MI32x32x8x1_SE_1LDSB0_GRVW4_LPB8_NLCA1_PLR5_SU0_SUS256_SRVW4_TT1_96_WG128_2_1_WGM2
    SolutionIndex: 204
    SolutionNameMin: Cijk_Ailk_Bljk_HBH_MT256x160x32_MI32x32x8x1_SE_1LDSB0_GRVW4_LPB8_NLCA1_PLR5_SU0_SUS256_SRVW4_TT2_160_WG128_2_1_WGM2
    SolutionIndex: 205
    SolutionNameMin: Cijk_Ailk_Bljk_HBH_MT64x128x64_MI32x32x8x1_SE_1LDSB0_GRVW4_LPB8_NLCA1_PLR9_SU0_SUS256_SRVW4_TT1_64_WG64_4_1_WGM2
    SolutionIndex: 206
    SolutionNameMin: Cijk_Ailk_Bljk_HBH_MT128x64x32_MI32x32x8x1_SE_1LDSB0_GRVW8_LPB8_NLCA1_PLR5_SU0_SUS256_SRVW4_TT2_32_WG64_4_1_WGM2
    SolutionIndex: 207
    SolutionNameMin: Cijk_Ailk_Bljk_HBH_MT64x128x32_MI32x32x8x1_SE_1LDSB0_GRVW8_LPB8_NLCA1_PLR5_SU32_SUS256_SRVW4_TT1_64_WG64_4_1_WGM2
    SolutionIndex: 208
    SolutionNameMin: Cijk_Ailk_Bljk_HBH_MT64x128x64_MI32x32x8x1_SE_1LDSB0_GRVW8_LPB8_NLCA1_PLR9_SU32_SUS256_SRVW4_TT1_64_WG64_4_1_WGM2
    SolutionIndex: 209
    SolutionNameMin: Cijk_Ailk_Bljk_HBH_MT64x32x32_MI16x16x16x1_SE_1LDSB0_GRVW2_LPB16_NLCA1_PLR2_SU0_SUS256_SRVW4_TT2_16_WG32_8_1_WGM15
    SolutionIndex: 210
    SolutionNameMin: Cijk_Ailk_Bljk_HBH_MT128x64x32_MI32x32x8x1_SE_1LDSB0_GRVW4_LPB8_NLCA1_PLR5_SU0_SUS256_SRVW4_TT2_32_WG64_4_1_WGM15
    SolutionIndex: 211
    SolutionNameMin: Cijk_Ailk_Bljk_HBH_MT128x96x32_MI32x32x8x1_SE_1LDSB0_GRVW4_LPB8_NLCA1_PLR5_SU0_SUS256_SRVW4_TT1_96_WG128_2_1_WGM15
    SolutionIndex: 212
    SolutionNameMin: Cijk_Ailk_Bljk_HBH_MT128x64x32_MI32x32x8x1_SE_1LDSB0_GRVW8_LPB8_NLCA1_PLR5_SU0_SUS256_SRVW4_TT2_32_WG64_4_1_WGM15
    SolutionIndex: 213
    SolutionNameMin: Cijk_Ailk_Bljk_HBH_MT64x128x64_MI32x32x8x1_SE_1LDSB0_GRVW8_LPB8_NLCA1_PLR9_SU0_SUS256_SRVW4_TT1_64_WG64_4_1_WGM15
    SolutionIndex: 214
    SolutionNameMin: Cijk_Ailk_Bljk_HBH_MT64x128x64_MI32x32x8x1_SE_1LDSB0_GRVW8_LPB8_NLCA1_PLR9_SU32_SUS256_SRVW4_TT1_64_WG64_4_1_WGM15
    SolutionIndex: 215
    SolutionNameMin: Cijk_Ailk_Bljk_HBH_MT128x128x32_MI32x32x8x1_SE_1LDSB1_GRVW2_LPB8_NLCA1_PLR5_SU0_SUS256_SRVW4_TT2_64_WG64_4_1_WGM1
    SolutionIndex: 216
    SolutionNameMin: Cijk_Ailk_Bljk_HBH_MT128x96x32_MI32x32x8x1_SE_1LDSB1_GRVW2_LPB8_NLCA1_PLR5_SU0_SUS256_SRVW4_TT1_96_WG128_2_1_WGM1
    SolutionIndex: 217
    SolutionNameMin: Cijk_Ailk_Bljk_HBH_MT64x256x64_MI32x32x8x1_SE_1LDSB1_GRVW2_LPB8_NLCA1_PLR9_SU0_SUS256_SRVW4_TT1_128_WG64_4_1_WGM1
    SolutionIndex: 218
    SolutionNameMin: Cijk_Ailk_Bljk_HBH_MT128x96x32_MI32x32x8x1_SE_1LDSB1_GRVW2_LPB8_NLCA1_PLR5_SU32_SUS256_SRVW4_TT1_96_WG128_2_1_WGM1
    SolutionIndex: 219
    SolutionNameMin: Cijk_Ailk_Bljk_HBH_MT64x256x32_MI32x32x8x1_SE_1LDSB1_GRVW4_LPB8_NLCA1_PLR5_SU32_SUS256_SRVW4_TT1_128_WG64_4_1_WGM1
    SolutionIndex: 220
    SolutionNameMin: Cijk_Ailk_Bljk_HBH_MT128x128x32_MI32x32x8x1_SE_1LDSB1_GRVW2_LPB8_NLCA1_PLR5_SU0_SUS256_SRVW4_TT2_64_WG64_4_1_WGM2
    SolutionIndex: 221
    SolutionNameMin: Cijk_Ailk_Bljk_HBH_MT128x96x32_MI32x32x8x1_SE_1LDSB1_GRVW2_LPB8_NLCA1_PLR5_SU0_SUS256_SRVW4_TT1_96_WG128_2_1_WGM2
    SolutionIndex: 222
    SolutionNameMin: Cijk_Ailk_Bljk_HBH_MT128x256x32_MI32x32x8x1_SE_1LDSB1_GRVW8_LPB8_NLCA1_PLR5_SU0_SUS256_SRVW4_TT2_128_WG64_4_1_WGM2
    SolutionIndex: 223
    SolutionNameMin: Cijk_Ailk_Bljk_HBH_MT128x128x32_MI32x32x8x1_SE_1LDSB1_GRVW2_LPB8_NLCA1_PLR5_SU0_SUS256_SRVW4_TT2_64_WG64_4_1_WGM15
    SolutionIndex: 224
    SolutionNameMin: Cijk_Ailk_Bljk_HBH_MT128x96x32_MI32x32x8x1_SE_1LDSB1_GRVW2_LPB8_NLCA1_PLR5_SU0_SUS256_SRVW4_TT1_96_WG128_2_1_WGM15
    SolutionIndex: 225
    SolutionNameMin: Cijk_Ailk_Bljk_HBH_MT128x160x32_MI32x32x8x1_SE_1LDSB1_GRVW2_LPB8_NLCA1_PLR5_SU0_SUS256_SRVW4_TT1_160_WG128_2_1_WGM15
    SolutionIndex: 226
    SolutionNameMin: Cijk_Ailk_Bljk_HBH_MT128x256x32_MI32x32x8x1_SE_1LDSB1_GRVW8_LPB8_NLCA1_PLR5_SU0_SUS256_SRVW4_TT2_128_WG64_4_1_WGM15
    SolutionIndex: 227
    SolutionNameMin: Cijk_Ailk_Bljk_HBH_MT64x32x32_MI16x16x16x1_SE_1LDSB1_GRVW2_LPB16_NLCA1_PLR2_SU32_SUS128_SRVW4_TT2_16_WG32_8_1_WGM15
    SolutionIndex: 228
    SolutionNameMin: Cijk_Ailk_Bljk_HBH_MT128x96x32_MI32x32x8x1_SE_1LDSB1_GRVW2_LPB8_NLCA1_PLR5_SU32_SUS128_SRVW4_TT1_96_WG128_2_1_WGM15
    SolutionIndex: 229
    SolutionNameMin: Cijk_Ailk_Bljk_HBH_MT32x64x64_MI16x16x16x1_SE_1LDSB0_GRVW2_LPB16_NLCA1_PLR5_SU0_SUS256_SRVW0_TT1_32_WG32_8_1_WGM1
    SolutionIndex: 230
    SolutionNameMin: Cijk_Ailk_Bljk_HBH_MT32x32x64_MI16x16x16x1_SE_1LDSB0_GRVW4_LPB16_NLCA1_PLR5_SU0_SUS256_SRVW0_TT1_16_WG32_8_1_WGM1
    SolutionIndex: 231
    SolutionNameMin: Cijk_Ailk_Bljk_HBH_MT32x64x64_MI16x16x16x1_SE_1LDSB0_GRVW8_LPB16_NLCA1_PLR5_SU32_SUS256_SRVW0_TT1_32_WG32_8_1_WGM1
    SolutionIndex: 232
    SolutionNameMin: Cijk_Ailk_Bljk_HBH_MT128x128x64_MI32x32x8x1_SE_1LDSB1_GRVW2_LPB8_NLCA1_PLR9_SU32_SUS256_SRVW0_TT2_64_WG64_4_1_WGM1
    SolutionIndex: 233
    SolutionNameMin: Cijk_Ailk_Bljk_HBH_MT64x64x64_MI32x32x8x1_SE_1LDSB0_GRVW2_LPB8_NLCA1_PLR9_SU0_SUS256_SRVW0_TT1_32_WG64_4_1_WGM1
    SolutionIndex: 234
    SolutionNameMin: Cijk_Ailk_Bljk_HBH_MT32x64x64_MI16x16x16x1_SE_1LDSB0_GRVW8_LPB16_NLCA1_PLR5_SU0_SUS256_SRVW0_TT1_32_WG32_8_1_WGM15
    SolutionIndex: 235
    SolutionNameMin: Cijk_Ailk_Bljk_HBH_MT32x64x64_MI16x16x16x1_SE_1LDSB0_GRVW8_LPB16_NLCA1_PLR5_SU0_SUS256_SRVW0_TT1_32_WG32_8_1_WGM15
    SolutionIndex: 236
    SolutionNameMin: Cijk_Ailk_Bljk_HBH_MT64x16x32_MI16x16x16x1_SE_1LDSB0_GRVW2_LPB16_NLCA1_PLR2_SU0_SUS256_SRVW0_TT1_16_WG64_4_1_WGM1
    SolutionIndex: 237
    SolutionNameMin: Cijk_Ailk_Bljk_HBH_MT64x16x32_MI16x16x16x1_SE_1LDSB0_GRVW8_LPB16_NLCA1_PLR2_SU0_SUS256_SRVW0_TT1_16_WG64_4_1_WGM1
    SolutionIndex: 238
    SolutionNameMin: Cijk_Ailk_Bljk_HBH_MT64x16x32_MI16x16x16x1_SE_1LDSB0_GRVW2_LPB16_NLCA1_PLR2_SU0_SUS256_SRVW0_TT1_16_WG64_4_1_WGM2
    SolutionIndex: 239
    SolutionNameMin: Cijk_Ailk_Bljk_HBH_MT64x16x32_MI16x16x16x1_SE_1LDSB0_GRVW4_LPB16_NLCA1_PLR2_SU0_SUS256_SRVW0_TT1_16_WG64_4_1_WGM2
- - - [7680, 8192, 1, 8192, 8384, 8384, 8384, 8384]
    - [115, 127563.0]
  - - [3840, 4096, 1, 4096, 4192, 4192, 4192, 4192]
    - [93, 125750.0]
  - - [1920, 2048, 1, 2048, 2080, 2080, 2080, 2080]
    - [93, 116374.0]
  - - [960, 1024, 1, 1024, 1056, 1056, 1056, 1056]
    - [78, 54004.0]
  - - [480, 512, 1, 512, 544, 544, 544, 544]
    - [23, 14980.0]
  - - [8192, 7680, 1, 8192, 8384, 8384, 8384, 8384]
    - [115, 127198.0]
  - - [4096, 3840, 1, 4096, 4192, 4192, 4192, 4192]
    - [93, 125242.0]
  - - [2048, 1920, 1, 2048, 2080, 2080, 2080, 2080]
    - [65, 113487.0]
  - - [1024, 960, 1, 1024, 1056, 1056, 1056, 1056]
    - [50, 51569.0]
  - - [512, 480, 1, 512, 544, 544, 544, 544]
    - [77, 14838.0]
  - - [8192, 8192, 1, 8192, 8384, 8384, 8384, 8384]
    - [8, 123598.0]
  - - [4096, 4096, 1, 4096, 4192, 4192, 4192, 4192]
    - [29, 115720.0]
  - - [2048, 2048, 1, 2048, 2080, 2080, 2080, 2080]
    - [129, 94023.0]
  - - [1024, 1024, 1, 1024, 1056, 1056, 1056, 1056]
    - [21, 51822.0]
  - - [512, 512, 1, 512, 544, 544, 544, 544]
    - [49, 14589.0]
  - - [64, 512, 16, 512, 64, 64, 64, 512]
    - [15, 20336.0]
  - - [64, 512, 128, 512, 64, 64, 64, 512]
    - [15, 36373.0]
  - - [1024, 1, 1, 2, 1024, 1024, 1024, 2]
    - [0, 0.0]
  - - [1024, 1, 1, 1024, 1024, 1024, 1024, 1024]
    - [171, 112.0]
  - - [1024, 8, 1, 1024, 1024, 1024, 1024, 1024]
    - [176, 832.0]
  - - [1024, 77, 1, 1024, 1024, 1024, 1024, 1024]
    - [13, 6684.0]
  - - [1024, 77, 1, 30522, 1024, 1024, 1024, 30522]
    - [192, 41322.0]
  - - [1024, 512, 1, 2, 1024, 1024, 1024, 2]
    - [33, 234.0]
  - - [1024, 512, 1, 1024, 1024, 1024, 1024, 1024]
    - [24, 29305.0]
  - - [1024, 512, 1, 4096, 1024, 1024, 1024, 4096]
    - [160, 43577.0]
  - - [1024, 616, 1, 1024, 1024, 1024, 1024, 1024]
    - [42, 34653.0]
  - - [1024, 4096, 1, 2, 1024, 1024, 1024, 2]
    - [149, 853.0]
  - - [1024, 4096, 1, 1024, 1024, 1024, 1024, 1024]
    - [58, 84814.0]
  - - [1024, 4096, 1, 4096, 1024, 1024, 1024, 4096]
    - [8, 98735.0]
  - - [4096, 512, 1, 1024, 4096, 4096, 4096, 1024]
    - [116, 55120.0]
  - - [4096, 4096, 1, 1024, 4096, 4096, 4096, 1024]
    - [130, 94105.0]
  - - [64, 128, 128, 128, 64, 64, 64, 128]
    - [11, 15392.0]
  - - [64, 128, 160, 128, 64, 64, 64, 128]
    - [2, 18079.0]
  - - [1024, 10, 1, 2, 1024, 1024, 1024, 2]
    - [0, 4.0]
  - - [1024, 10, 1, 1024, 1024, 1024, 1024, 1024]
    - [176, 1150.0]
  - - [1024, 160, 1, 1024, 1024, 1024, 1024, 1024]
    - [19, 13443.0]
  - - [1024, 200, 1, 1024, 1024, 1024, 1024, 1024]
    - [85, 15604.0]
  - - [1024, 200, 1, 30522, 1024, 1024, 1024, 30522]
    - [190, 61331.0]
  - - [1024, 1024, 1, 2, 1024, 1024, 1024, 2]
    - [6, 374.0]
  - - [1024, 1024, 1, 1024, 1024, 1024, 1024, 1024]
    - [43, 49527.0]
  - - [1024, 1024, 1, 4096, 1024, 1024, 1024, 4096]
    - [69, 60390.0]
  - - [1024, 1280, 1, 2, 1024, 1024, 1024, 2]
    - [39, 462.0]
  - - [1024, 1280, 1, 1024, 1024, 1024, 1024, 1024]
    - [87, 56872.0]
  - - [1024, 1280, 1, 4096, 1024, 1024, 1024, 4096]
    - [168, 67650.0]
  - - [4096, 1024, 1, 1024, 4096, 4096, 4096, 1024]
    - [30, 74669.0]
  - - [4096, 1280, 1, 1024, 4096, 4096, 4096, 1024]
    - [99, 72865.0]
  - - [64, 128, 624, 128, 64, 64, 64, 128]
    - [11, 22347.0]
  - - [1024, 39, 1, 2, 1024, 1024, 1024, 2]
    - [0, 16.0]
  - - [1024, 39, 1, 1024, 1024, 1024, 1024, 1024]
    - [169, 3902.0]
  - - [1024, 780, 1, 1024, 1024, 1024, 1024, 1024]
    - [86, 43878.0]
  - - [1024, 780, 1, 30522, 1024, 1024, 1024, 30522]
    - [181, 83146.0]
  - - [1024, 4992, 1, 2, 1024, 1024, 1024, 2]
    - [91, 940.0]
  - - [1024, 4992, 1, 1024, 1024, 1024, 1024, 1024]
    - [152, 73518.0]
  - - [1024, 4992, 1, 4096, 1024, 1024, 1024, 4096]
    - [152, 80679.0]
  - - [4096, 4992, 1, 1024, 4096, 4096, 4096, 1024]
    - [113, 98467.0]
  - - [64, 512, 64, 512, 64, 64, 64, 512]
    - [15, 32033.0]
  - - [1024, 4, 1, 2, 1024, 1024, 1024, 2]
    - [0, 2.0]
  - - [1024, 4, 1, 1024, 1024, 1024, 1024, 1024]
    - [173, 433.0]
  - - [1024, 308, 1, 1024, 1024, 1024, 1024, 1024]
    - [85, 22181.0]
  - - [1024, 308, 1, 30522, 1024, 1024, 1024, 30522]
    - [191, 70081.0]
  - - [1024, 2048, 1, 2, 1024, 1024, 1024, 2]
    - [132, 552.0]
  - - [1024, 2048, 1, 1024, 1024, 1024, 1024, 1024]
    - [112, 61147.0]
  - - [1024, 2048, 1, 4096, 1024, 1024, 1024, 4096]
    - [139, 79126.0]
  - - [4096, 2048, 1, 1024, 4096, 4096, 4096, 1024]
    - [47, 84546.0]
  - - [64, 128, 640, 128, 64, 64, 64, 128]
    - [34, 22611.0]
  - - [1024, 40, 1, 2, 1024, 1024, 1024, 2]
    - [4, 17.0]
  - - [1024, 40, 1, 1024, 1024, 1024, 1024, 1024]
    - [169, 4002.0]
  - - [1024, 800, 1, 1024, 1024, 1024, 1024, 1024]
    - [42, 44244.0]
  - - [1024, 800, 1, 30522, 1024, 1024, 1024, 30522]
    - [185, 84289.0]
  - - [1024, 5120, 1, 2, 1024, 1024, 1024, 2]
    - [90, 943.0]
  - - [1024, 5120, 1, 1024, 1024, 1024, 1024, 1024]
    - [138, 73746.0]
  - - [1024, 5120, 1, 4096, 1024, 1024, 1024, 4096]
    - [116, 81840.0]
  - - [4096, 5120, 1, 1024, 4096, 4096, 4096, 1024]
    - [113, 101067.0]
  - - [64, 128, 656, 128, 64, 64, 64, 128]
    - [11, 23239.0]
  - - [1024, 41, 1, 2, 1024, 1024, 1024, 2]
    - [9, 18.0]
  - - [1024, 41, 1, 1024, 1024, 1024, 1024, 1024]
    - [13, 3583.0]
  - - [1024, 820, 1, 1024, 1024, 1024, 1024, 1024]
    - [86, 45931.0]
  - - [1024, 820, 1, 30522, 1024, 1024, 1024, 30522]
    - [186, 85680.0]
  - - [1024, 5248, 1, 2, 1024, 1024, 1024, 2]
    - [90, 995.0]
  - - [1024, 5248, 1, 1024, 1024, 1024, 1024, 1024]
    - [138, 74849.0]
  - - [1024, 5248, 1, 4096, 1024, 1024, 1024, 4096]
    - [137, 83050.0]
  - - [4096, 5248, 1, 1024, 4096, 4096, 4096, 1024]
    - [113, 101157.0]
  - - [64, 512, 80, 512, 64, 64, 64, 512]
    - [15, 36712.0]
  - - [1024, 5, 1, 2, 1024, 1024, 1024, 2]
    - [0, 2.0]
  - - [1024, 5, 1, 1024, 1024, 1024, 1024, 1024]
    - [172, 575.0]
  - - [1024, 385, 1, 1024, 1024, 1024, 1024, 1024]
    - [54, 25486.0]
  - - [1024, 385, 1, 30522, 1024, 1024, 1024, 30522]
    - [194, 65797.0]
  - - [1024, 2560, 1, 2, 1024, 1024, 1024, 2]
    - [90, 683.0]
  - - [1024, 2560, 1, 1024, 1024, 1024, 1024, 1024]
    - [69, 65028.0]
  - - [1024, 2560, 1, 4096, 1024, 1024, 1024, 4096]
    - [96, 79844.0]
  - - [4096, 2560, 1, 1024, 4096, 4096, 4096, 1024]
    - [100, 95733.0]
  - - [64, 512, 96, 512, 64, 64, 64, 512]
    - [79, 38275.0]
  - - [1024, 6, 1, 2, 1024, 1024, 1024, 2]
    - [238, 3.0]
  - - [1024, 6, 1, 1024, 1024, 1024, 1024, 1024]
    - [170, 666.0]
  - - [1024, 462, 1, 1024, 1024, 1024, 1024, 1024]
    - [51, 26443.0]
  - - [1024, 462, 1, 30522, 1024, 1024, 1024, 30522]
    - [194, 76839.0]
  - - [1024, 3072, 1, 2, 1024, 1024, 1024, 2]
    - [103, 756.0]
  - - [1024, 3072, 1, 1024, 1024, 1024, 1024, 1024]
    - [65, 71774.0]
  - - [1024, 3072, 1, 4096, 1024, 1024, 1024, 4096]
    - [141, 92723.0]
  - - [4096, 3072, 1, 1024, 4096, 4096, 4096, 1024]
    - [130, 90892.0]
  - - [1024, 8, 1, 2, 1024, 1024, 1024, 2]
    - [0, 3.0]
  - - [1024, 160, 1, 30522, 1024, 1024, 1024, 30522]
    - [196, 54356.0]
  - - [64, 128, 144, 128, 64, 64, 64, 128]
    - [70, 16852.0]
  - - [1024, 9, 1, 2, 1024, 1024, 1024, 2]
    - [237, 4.0]
  - - [1024, 9, 1, 1024, 1024, 1024, 1024, 1024]
    - [176, 936.0]
  - - [1024, 180, 1, 1024, 1024, 1024, 1024, 1024]
    - [19, 14474.0]
  - - [1024, 180, 1, 30522, 1024, 1024, 1024, 30522]
    - [195, 54261.0]
  - - [1024, 1152, 1, 2, 1024, 1024, 1024, 2]
    - [34, 427.0]
  - - [1024, 1152, 1, 1024, 1024, 1024, 1024, 1024]
    - [38, 55108.0]
  - - [1024, 1152, 1, 4096, 1024, 1024, 1024, 4096]
    - [69, 63778.0]
  - - [4096, 1152, 1, 1024, 4096, 4096, 4096, 1024]
    - [46, 68947.0]
  - - [256, 32768, 1, 128, 256, 256, 256, 128]
    - [90, 45965.0]
  - - [512, 32768, 1, 256, 512, 512, 512, 256]
    - [133, 70921.0]
  - - [1024, 32768, 1, 512, 1024, 1024, 1024, 512]
    - [113, 97613.0]
  - - [1024, 32768, 1, 1024, 1024, 1024, 1024, 1024]
    - [113, 107859.0]
  - - [64, 128, 512, 128, 64, 64, 64, 128]
    - [101, 21718.0]
  - - [128, 128, 512, 64, 128, 128, 128, 64]
    - [90, 27962.0]
  - - [1024, 32, 1, 2, 1024, 1024, 1024, 2]
    - [9, 13.0]
  - - [1024, 32, 1, 1024, 1024, 1024, 1024, 1024]
    - [36, 2689.0]
  - - [1024, 4096, 1, 30528, 1024, 1024, 1024, 30528]
    - [82, 108925.0]
  - - [512, 512, 64, 64, 512, 512, 512, 64]
    - [133, 38568.0]
  - - [1024, 2048, 1, 30528, 1024, 1024, 1024, 30528]
    - [157, 102876.0]
  - - [64, 4, 32768, 4, 64, 64, 2097152, 4]
    - [89, 194.0]
  - - [64, 4, 38400, 4, 64, 64, 2457600, 4]
    - [89, 196.0]
  - - [1024, 8192, 1, 1024, 1024, 1024, 1024, 1024]
    - [58, 85082.0]
  - - [1024, 8192, 1, 4096, 1024, 1024, 1024, 4096]
    - [82, 101969.0]
  - - [1024, 8192, 1, 33712, 1024, 1024, 1024, 33712]
    - [40, 109397.0]
  - - [1024, 9600, 1, 1024, 1024, 1024, 1024, 1024]
    - [59, 104163.0]
  - - [1024, 9600, 1, 4096, 1024, 1024, 1024, 4096]
    - [8, 108356.0]
  - - [1024, 9600, 1, 33712, 1024, 1024, 1024, 33712]
    - [59, 115131.0]
  - - [4096, 8192, 1, 1024, 4096, 4096, 4096, 1024]
    - [113, 103418.0]
  - - [4096, 9600, 1, 1024, 4096, 4096, 4096, 1024]
    - [113, 103627.0]
  - - [1024, 10064, 1, 1024, 1024, 1024, 1024, 1024]
    - [93, 94357.0]
  - - [1024, 10064, 1, 4096, 1024, 1024, 1024, 4096]
    - [140, 104421.0]
  - - [1024, 10080, 1, 1024, 1024, 1024, 1024, 1024]
    - [140, 94846.0]
  - - [1024, 10080, 1, 4096, 1024, 1024, 1024, 4096]
    - [93, 104753.0]
  - - [1024, 10080, 1, 42720, 1024, 1024, 1024, 42720]
    - [56, 111120.0]
  - - [1024, 10200, 1, 1024, 1024, 1024, 1024, 1024]
    - [140, 92075.0]
  - - [1024, 10200, 1, 4096, 1024, 1024, 1024, 4096]
    - [140, 105853.0]
  - - [1024, 3840, 1, 1024, 1024, 1024, 1024, 1024]
    - [140, 89558.0]
  - - [1024, 3840, 1, 4096, 1024, 1024, 1024, 4096]
    - [141, 107892.0]
  - - [1024, 3968, 1, 1024, 1024, 1024, 1024, 1024]
    - [29, 74087.0]
  - - [1024, 3968, 1, 4096, 1024, 1024, 1024, 4096]
    - [30, 95958.0]
  - - [1024, 3968, 1, 42720, 1024, 1024, 1024, 42720]
    - [82, 105909.0]
  - - [1024, 6528, 1, 1024, 1024, 1024, 1024, 1024]
    - [141, 87132.0]
  - - [1024, 6528, 1, 4096, 1024, 1024, 1024, 4096]
    - [141, 100427.0]
  - - [1024, 6528, 1, 42720, 1024, 1024, 1024, 42720]
    - [56, 108508.0]
  - - [1024, 7104, 1, 1024, 1024, 1024, 1024, 1024]
    - [109, 92650.0]
  - - [1024, 7104, 1, 4096, 1024, 1024, 1024, 4096]
    - [115, 113761.0]
  - - [1024, 7104, 1, 42720, 1024, 1024, 1024, 42720]
    - [120, 116819.0]
  - - [1024, 7200, 1, 1024, 1024, 1024, 1024, 1024]
    - [134, 88695.0]
  - - [1024, 7200, 1, 4096, 1024, 1024, 1024, 4096]
    - [105, 109353.0]
  - - [1024, 7200, 1, 42720, 1024, 1024, 1024, 42720]
    - [146, 118497.0]
  - - [1024, 8064, 1, 1024, 1024, 1024, 1024, 1024]
    - [58, 84896.0]
  - - [1024, 8064, 1, 4096, 1024, 1024, 1024, 4096]
    - [82, 100687.0]
  - - [1024, 8160, 1, 1024, 1024, 1024, 1024, 1024]
    - [59, 90640.0]
  - - [1024, 8160, 1, 4096, 1024, 1024, 1024, 4096]
    - [59, 103764.0]
  - - [1024, 9216, 1, 1024, 1024, 1024, 1024, 1024]
    - [59, 93207.0]
  - - [1024, 9216, 1, 4096, 1024, 1024, 1024, 4096]
    - [59, 112972.0]
  - - [1024, 9520, 1, 1024, 1024, 1024, 1024, 1024]
    - [82, 94602.0]
  - - [1024, 9520, 1, 4096, 1024, 1024, 1024, 4096]
    - [59, 109289.0]
  - - [1024, 9520, 1, 42720, 1024, 1024, 1024, 42720]
    - [59, 126856.0]
  - - [4096, 10064, 1, 1024, 4096, 4096, 4096, 1024]
    - [113, 102118.0]
  - - [4096, 10080, 1, 1024, 4096, 4096, 4096, 1024]
    - [30, 102937.0]
  - - [4096, 10200, 1, 1024, 4096, 4096, 4096, 1024]
    - [93, 103678.0]
  - - [4096, 3840, 1, 1024, 4096, 4096, 4096, 1024]
    - [115, 108182.0]
  - - [4096, 3968, 1, 1024, 4096, 4096, 4096, 1024]
    - [113, 93416.0]
  - - [4096, 6528, 1, 1024, 4096, 4096, 4096, 1024]
    - [113, 97620.0]
  - - [4096, 7104, 1, 1024, 4096, 4096, 4096, 1024]
    - [130, 101902.0]
  - - [4096, 7200, 1, 1024, 4096, 4096, 4096, 1024]
    - [45, 103705.0]
  - - [4096, 8064, 1, 1024, 4096, 4096, 4096, 1024]
    - [148, 101827.0]
  - - [4096, 8160, 1, 1024, 4096, 4096, 4096, 1024]
    - [93, 103089.0]
  - - [4096, 9216, 1, 1024, 4096, 4096, 4096, 1024]
    - [95, 107781.0]
  - - [4096, 9520, 1, 1024, 4096, 4096, 4096, 1024]
    - [93, 104288.0]
  - - [64, 14, 10880, 14, 64, 64, 696320, 14]
    - [107, 2063.0]
  - - [64, 14, 10880, 15, 64, 64, 696320, 15]
    - [89, 2226.0]
  - - [64, 15, 7680, 15, 64, 64, 491520, 15]
    - [89, 2300.0]
  - - [64, 15, 10880, 15, 64, 64, 696320, 15]
    - [131, 2368.0]
  - - [64, 15, 7680, 17, 64, 64, 491520, 17]
    - [89, 2352.0]
  - - [64, 17, 6144, 17, 64, 64, 393216, 17]
    - [89, 2519.0]
  - - [64, 17, 7680, 17, 64, 64, 491520, 17]
    - [131, 2654.0]
  - - [64, 17, 6144, 21, 64, 64, 393216, 21]
    - [89, 3057.0]
  - - [64, 21, 6144, 21, 64, 64, 393216, 21]
    - [89, 3699.0]
  - - [64, 24, 4736, 24, 64, 64, 303104, 24]
    - [107, 4734.0]
  - - [64, 24, 4736, 34, 64, 64, 303104, 34]
    - [89, 5187.0]
  - - [64, 30, 2048, 30, 64, 64, 131072, 30]
    - [89, 5715.0]
  - - [64, 31, 2048, 30, 64, 64, 131072, 30]
    - [107, 5929.0]
  - - [64, 31, 2048, 31, 64, 64, 131072, 31]
    - [131, 6033.0]
  - - [64, 32, 4608, 32, 64, 64, 294912, 32]
    - [131, 9960.0]
  - - [64, 34, 4736, 34, 64, 64, 303104, 34]
    - [101, 4932.0]
  - - [64, 35, 4608, 32, 64, 64, 294912, 32]
    - [89, 8584.0]
  - - [64, 35, 4608, 35, 64, 64, 294912, 35]
    - [88, 4784.0]
  - - [64, 512, 1, 512, 64, 64, 64, 512]
    - [22, 1997.0]
  - - [512, 512, 1, 64, 512, 512, 512, 64]
    - [32, 3884.0]
  - - [128, 128, 1, 64, 128, 128, 128, 64]
    - [22, 247.0]
  - - [64, 128, 1, 128, 64, 64, 64, 128]
    - [0, 208.0]
  - - [1024, 512, 1, 64, 1024, 1024, 1024, 64]
    - [10, 6991.0]
  - - [64, 5, 1, 5, 64, 64, 64, 5]
    - [0, 0.0]
  - - [2048, 512, 1, 2048, 2048, 2048, 2048, 2048]
    - [21, 56872.0]
  - - [512, 1600, 1, 512, 512, 512, 512, 512]
    - [61, 34493.0]
  - - [32, 33, 1, 33, 32, 32, 32, 33]
    - [0, 6.0]
  - - [560, 1600, 1, 1024, 560, 560, 560, 1024]
    - [78, 44453.0]
  - - [512, 1600, 1, 32, 512, 512, 512, 32]
    - [1, 6068.0]
  - - [1024, 1600, 1, 1024, 1024, 1024, 1024, 1024]
    - [99, 55924.0]
  - - [32, 33, 1600, 33, 32, 32, 32, 33]
    - [106, 3433.0]
  - - [32, 200, 1, 1, 32, 32, 32, 1]
    - [0, 1.0]
  - - [64, 3, 512, 3, 64, 64, 64, 3]
    - [236, 46.0]
  - - [64, 5, 512, 5, 64, 64, 64, 5]
    - [238, 120.0]
  - - [64, 5, 960, 5, 64, 64, 64, 5]
    - [239, 185.0]
  - - [64, 9, 512, 9, 64, 64, 64, 9]
    - [89, 377.0]
  - - [64, 512, 1, 1, 64, 64, 64, 1]
    - [63, 9.0]
  - - [128, 27, 32768, 27, 128, 128, 128, 27]
    - [107, 6654.0]
  - - [256, 1024, 1, 1, 256, 256, 256, 1]
    - [89, 70.0]
  - - [256, 8976, 1, 1536, 256, 256, 256, 1536]
    - [112, 75160.0]
  - - [256, 8976, 1, 2048, 256, 256, 256, 2048]
    - [139, 80804.0]
  - - [256, 8976, 1, 2304, 256, 256, 256, 2304]
    - [112, 80119.0]
  - - [256, 8976, 1, 2560, 256, 256, 256, 2560]
    - [122, 81071.0]
  - - [256, 8976, 1, 2816, 256, 256, 256, 2816]
    - [139, 81209.0]
  - - [256, 8976, 1, 3072, 256, 256, 256, 3072]
    - [122, 82852.0]
  - - [256, 8976, 1, 4352, 256, 256, 256, 4352]
    - [147, 85152.0]
  - - [256, 8976, 1, 4864, 256, 256, 256, 4864]
    - [139, 83859.0]
  - - [256, 8976, 1, 5376, 256, 256, 256, 5376]
    - [162, 85312.0]
  - - [256, 8976, 1, 5632, 256, 256, 256, 5632]
    - [147, 88640.0]
  - - [256, 8976, 1, 5888, 256, 256, 256, 5888]
    - [159, 88407.0]
  - - [256, 8976, 1, 6144, 256, 256, 256, 6144]
    - [161, 89354.0]
  - - [256, 8976, 1, 6656, 256, 256, 256, 6656]
    - [164, 91256.0]
  - - [256, 8976, 1, 7168, 256, 256, 256, 7168]
    - [164, 92868.0]
  - - [256, 8976, 1, 7424, 256, 256, 256, 7424]
    - [157, 93281.0]
  - - [256, 8976, 1, 8192, 256, 256, 256, 8192]
    - [155, 93521.0]
  - - [256, 8976, 1, 8448, 256, 256, 256, 8448]
    - [163, 96406.0]
  - - [256, 8976, 1, 8960, 256, 256, 256, 8960]
    - [159, 97264.0]
  - - [256, 8976, 1, 9472, 256, 256, 256, 9472]
    - [157, 97971.0]
  - - [256, 8976, 1, 9728, 256, 256, 256, 9728]
    - [161, 98804.0]
  - - [256, 8976, 1, 9984, 256, 256, 256, 9984]
    - [163, 99470.0]
  - - [256, 8976, 1, 10240, 256, 256, 256, 10240]
    - [157, 99199.0]
  - - [256, 8976, 1, 10496, 256, 256, 256, 10496]
    - [159, 100225.0]
  - - [256, 8976, 1, 11008, 256, 256, 256, 11008]
    - [157, 100696.0]
  - - [256, 8976, 1, 11520, 256, 256, 256, 11520]
    - [163, 101875.0]
  - - [256, 8976, 1, 12288, 256, 256, 256, 12288]
    - [164, 102602.0]
  - - [256, 8976, 1, 14336, 256, 256, 256, 14336]
    - [163, 105313.0]
  - - [256, 8976, 1, 14848, 256, 256, 256, 14848]
    - [164, 105486.0]
  - - [256, 8976, 1, 15104, 256, 256, 256, 15104]
    - [155, 105684.0]
  - - [256, 8976, 1, 15872, 256, 256, 256, 15872]
    - [157, 106096.0]
  - - [256, 8976, 1, 17152, 256, 256, 256, 17152]
    - [162, 106498.0]
  - - [256, 8976, 1, 19712, 256, 256, 256, 19712]
    - [163, 108945.0]
  - - [256, 8976, 1, 19968, 256, 256, 256, 19968]
    - [156, 108482.0]
  - - [256, 8976, 1, 20480, 256, 256, 256, 20480]
    - [155, 108854.0]
  - - [256, 8976, 1, 20992, 256, 256, 256, 20992]
    - [164, 109112.0]
  - - [256, 8976, 1, 22016, 256, 256, 256, 22016]
    - [157, 109067.0]
  - - [256, 8976, 1, 26112, 256, 256, 256, 26112]
    - [164, 111328.0]
  - - [256, 8976, 1, 33536, 256, 256, 256, 33536]
    - [155, 113552.0]
  - - [256, 8976, 1, 44505, 256, 256, 256, 44505]
    - [159, 108738.0]
  - - [480, 32768, 1, 1024, 480, 480, 480, 1024]
    - [90, 89717.0]
  - - [512, 200, 1, 1, 512, 512, 512, 1]
    - [0, 30.0]
  - - [512, 200, 1, 32, 512, 512, 512, 32]
    - [4, 836.0]
  - - [512, 215, 1, 2048, 512, 512, 512, 2048]
    - [188, 14452.0]
  - - [512, 256, 1, 2048, 512, 512, 512, 2048]
    - [180, 16611.0]
  - - [560, 200, 1, 1024, 560, 560, 560, 1024]
    - [174, 9370.0]
  - - [768, 215, 1, 2048, 768, 768, 768, 2048]
    - [182, 20129.0]
  - - [768, 256, 1, 2048, 768, 768, 768, 2048]
    - [179, 23410.0]
  - - [1024, 1, 1, 200, 1024, 1024, 1024, 200]
    - [237, 29.0]
  - - [1024, 1, 1, 1600, 1024, 1024, 1024, 1600]
    - [184, 190.0]
  - - [1024, 200, 1, 1, 1024, 1024, 1024, 1]
    - [9, 60.0]
  - - [1024, 512, 1, 1, 1024, 1024, 1024, 1]
    - [5, 126.0]
  - - [1024, 960, 1, 64, 1024, 1024, 1024, 64]
    - [52, 12288.0]
  - - [1024, 960, 1, 1024, 1024, 1024, 1024, 1024]
    - [68, 48026.0]
  - - [1024, 1600, 1, 1, 1024, 1024, 1024, 1]
    - [7, 284.0]
  - - [1024, 1792, 1, 256, 1024, 1024, 1024, 256]
    - [83, 41063.0]
  - - [1024, 2048, 1, 256, 1024, 1024, 1024, 256]
    - [144, 41425.0]
  - - [1024, 2560, 1, 256, 1024, 1024, 1024, 256]
    - [57, 43019.0]
  - - [1024, 3072, 1, 256, 1024, 1024, 1024, 256]
    - [133, 47708.0]
  - - [1024, 3328, 1, 256, 1024, 1024, 1024, 256]
    - [64, 50487.0]
  - - [1024, 3840, 1, 256, 1024, 1024, 1024, 256]
    - [76, 60205.0]
  - - [1024, 4096, 1, 256, 1024, 1024, 1024, 256]
    - [71, 57604.0]
  - - [1024, 4608, 1, 256, 1024, 1024, 1024, 256]
    - [111, 52611.0]
  - - [1024, 4864, 1, 256, 1024, 1024, 1024, 256]
    - [133, 52086.0]
  - - [1024, 5120, 1, 256, 1024, 1024, 1024, 256]
    - [145, 52265.0]
  - - [1024, 5632, 1, 256, 1024, 1024, 1024, 256]
    - [145, 56437.0]
  - - [1024, 6144, 1, 256, 1024, 1024, 1024, 256]
    - [140, 59040.0]
  - - [1024, 6400, 1, 256, 1024, 1024, 1024, 256]
    - [140, 61681.0]
  - - [1024, 7168, 1, 256, 1024, 1024, 1024, 256]
    - [140, 66164.0]
  - - [1024, 7424, 1, 256, 1024, 1024, 1024, 256]
    - [153, 68527.0]
  - - [1024, 7680, 1, 256, 1024, 1024, 1024, 256]
    - [140, 69711.0]
  - - [1024, 7936, 1, 256, 1024, 1024, 1024, 256]
    - [127, 60196.0]
  - - [1024, 8192, 1, 256, 1024, 1024, 1024, 256]
    - [133, 60870.0]
  - - [1024, 8448, 1, 256, 1024, 1024, 1024, 256]
    - [133, 64080.0]
  - - [1024, 8704, 1, 256, 1024, 1024, 1024, 256]
    - [133, 62961.0]
  - - [1024, 8960, 1, 256, 1024, 1024, 1024, 256]
    - [133, 65245.0]
  - - [1024, 9728, 1, 256, 1024, 1024, 1024, 256]
    - [123, 65455.0]
  - - [1024, 9984, 1, 256, 1024, 1024, 1024, 256]
    - [153, 66903.0]
  - - [1024, 10240, 1, 256, 1024, 1024, 1024, 256]
    - [153, 68759.0]
  - - [1024, 10496, 1, 256, 1024, 1024, 1024, 256]
    - [148, 69622.0]
  - - [1024, 11008, 1, 256, 1024, 1024, 1024, 256]
    - [148, 71855.0]
  - - [1024, 11264, 1, 256, 1024, 1024, 1024, 256]
    - [148, 73089.0]
  - - [1024, 11520, 1, 256, 1024, 1024, 1024, 256]
    - [148, 71629.0]
  - - [1024, 12288, 1, 256, 1024, 1024, 1024, 256]
    - [133, 64944.0]
  - - [1024, 13312, 1, 256, 1024, 1024, 1024, 256]
    - [148, 68586.0]
  - - [1024, 13568, 1, 256, 1024, 1024, 1024, 256]
    - [153, 70236.0]
  - - [1024, 14336, 1, 256, 1024, 1024, 1024, 256]
    - [140, 71610.0]
  - - [1024, 14592, 1, 256, 1024, 1024, 1024, 256]
    - [140, 72228.0]
  - - [1024, 14848, 1, 256, 1024, 1024, 1024, 256]
    - [140, 73718.0]
  - - [1024, 15104, 1, 256, 1024, 1024, 1024, 256]
    - [153, 73870.0]
  - - [1024, 16128, 1, 256, 1024, 1024, 1024, 256]
    - [127, 68456.0]
  - - [1024, 17152, 1, 256, 1024, 1024, 1024, 256]
    - [140, 71964.0]
  - - [1024, 18944, 1, 256, 1024, 1024, 1024, 256]
    - [153, 75887.0]
  - - [1024, 19712, 1, 256, 1024, 1024, 1024, 256]
    - [123, 70981.0]
  - - [1024, 19968, 1, 256, 1024, 1024, 1024, 256]
    - [130, 70508.0]
  - - [1024, 20480, 1, 256, 1024, 1024, 1024, 256]
    - [148, 73103.0]
  - - [1024, 20992, 1, 256, 1024, 1024, 1024, 256]
    - [123, 74123.0]
  - - [1024, 21504, 1, 256, 1024, 1024, 1024, 256]
    - [148, 74487.0]
  - - [1024, 22016, 1, 256, 1024, 1024, 1024, 256]
    - [130, 75384.0]
  - - [1024, 23552, 1, 256, 1024, 1024, 1024, 256]
    - [148, 73083.0]
  - - [1024, 28672, 1, 256, 1024, 1024, 1024, 256]
    - [148, 76759.0]
  - - [1024, 33536, 1, 256, 1024, 1024, 1024, 256]
    - [140, 77606.0]
  - - [1024, 40448, 1, 256, 1024, 1024, 1024, 256]
    - [130, 78379.0]
  - - [1600, 512, 1, 1024, 1600, 1600, 1600, 1024]
    - [41, 44811.0]
  - - [2048, 1, 1, 512, 2048, 2048, 2048, 512]
    - [158, 129.0]
  - - [2048, 512, 1, 1, 2048, 2048, 2048, 1]
    - [28, 202.0]
  - - [2048, 960, 1, 2048, 2048, 2048, 2048, 2048]
    - [147, 66664.0]
  - - [2048, 1024, 1, 1, 2048, 2048, 2048, 1]
    - [118, 288.0]
  - - [2048, 1024, 1, 256, 2048, 2048, 2048, 256]
    - [81, 37491.0]
  - - [3200, 1024, 1, 2048, 3200, 3200, 3200, 2048]
    - [94, 86037.0]
  - - [4096, 1024, 1, 1, 4096, 4096, 4096, 1]
    - [90, 413.0]
  - - [2048, 1024, 1, 2048, 2048, 2048, 2048, 2048]
    - [139, 73645.0]
  - - [2048, 1024, 1, 30592, 2048, 2048, 2048, 30592]
    - [166, 95029.0]
  - - [2048, 1024, 1, 6144, 2048, 2048, 2048, 6144]
    - [122, 84281.0]
  - - [2048, 1024, 1, 8192, 2048, 2048, 2048, 8192]
    - [162, 86592.0]
  - - [2048, 2, 1, 2, 2048, 2048, 2048, 2]
    - [31, 2.0]
  - - [2048, 2, 1, 2048, 2048, 2048, 2048, 2048]
    - [187, 754.0]
  - - [8192, 1024, 1, 2048, 8192, 8192, 8192, 2048]
    - [8, 95571.0]
  - - [1024, 16, 1, 1024, 1024, 1024, 1024, 1024]
    - [176, 1762.0]
  - - [1024, 16, 1, 2, 1024, 1024, 1024, 2]
    - [239, 7.0]
  - - [1024, 8192, 1, 30592, 1024, 1024, 1024, 30592]
    - [72, 109507.0]
  - - [1024, 8192, 1, 3072, 1024, 1024, 1024, 3072]
    - [82, 99451.0]
  - - [512, 512, 256, 64, 512, 512, 512, 64]
    - [133, 44443.0]
  - - [64, 512, 256, 512, 64, 64, 64, 512]
    - [67, 40185.0]
  - - [1024, 2048, 1, 30592, 1024, 1024, 1024, 30592]
    - [162, 102617.0]
  - - [1024, 2048, 1, 3072, 1024, 1024, 1024, 3072]
    - [147, 77883.0]
  - - [1024, 4096, 1, 30592, 1024, 1024, 1024, 30592]
    - [59, 108028.0]
  - - [1024, 4096, 1, 3072, 1024, 1024, 1024, 3072]
    - [58, 95699.0]
  - - [512, 512, 128, 64, 512, 512, 512, 64]
    - [149, 41943.0]
  - - [2560, 2048, 1, 1920, 2560, 2560, 2560, 1920]
    - [128, 81973.0]
  - - [2560, 2048, 1, 2560, 2560, 2560, 2560, 2560]
    - [21, 84648.0]
  - - [2560, 2048, 1, 7680, 2560, 2560, 2560, 7680]
    - [87, 88177.0]
  - - [2560, 4, 1, 2, 2560, 2560, 2560, 2]
    - [0, 4.0]
  - - [2560, 4, 1, 2560, 2560, 2560, 2560, 2560]
    - [183, 1781.0]
  - - [640, 2048, 1, 2560, 640, 640, 640, 2560]
    - [16, 72944.0]
  - - [512, 512, 40, 64, 512, 512, 512, 64]
    - [133, 36158.0]
  - - [64, 512, 40, 512, 64, 64, 64, 512]
    - [75, 33421.0]
  - - [1536, 4096, 1, 1536, 1536, 1536, 1536, 1536]
    - [141, 89945.0]
  - - [1536, 4096, 1, 4608, 1536, 1536, 1536, 4608]
    - [35, 97678.0]
  - - [1536, 4096, 1, 50304, 1536, 1536, 1536, 50304]
    - [135, 102253.0]
  - - [1536, 4096, 1, 6144, 1536, 1536, 1536, 6144]
    - [114, 98729.0]
  - - [6144, 4096, 1, 1536, 6144, 6144, 6144, 1536]
    - [113, 108874.0]
  - - [1024, 1024, 64, 96, 1024, 1024, 1024, 96]
    - [123, 64373.0]
  - - [96, 1024, 64, 1024, 96, 96, 96, 1024]
    - [104, 57977.0]
  - - [1536, 8192, 1, 1536, 1536, 1536, 1536, 1536]
    - [142, 95002.0]
  - - [1536, 8192, 1, 4608, 1536, 1536, 1536, 4608]
    - [82, 105055.0]
  - - [1536, 8192, 1, 50304, 1536, 1536, 1536, 50304]
    - [72, 110619.0]
  - - [1536, 8192, 1, 6144, 1536, 1536, 1536, 6144]
    - [72, 106475.0]
  - - [6144, 8192, 1, 1536, 6144, 6144, 6144, 1536]
    - [130, 116136.0]
  - - [1024, 1024, 128, 96, 1024, 1024, 1024, 96]
    - [130, 66997.0]
  - - [96, 1024, 128, 1024, 96, 96, 96, 1024]
    - [25, 61124.0]
  - - [1024, 16384, 1, 1024, 1024, 1024, 1024, 1024]
    - [113, 95486.0]
  - - [1024, 16384, 1, 3072, 1024, 1024, 1024, 3072]
    - [82, 102505.0]
  - - [1024, 16384, 1, 4096, 1024, 1024, 1024, 4096]
    - [72, 104576.0]
  - - [1024, 16384, 1, 50304, 1024, 1024, 1024, 50304]
    - [72, 110114.0]
  - - [4096, 16384, 1, 1024, 4096, 4096, 4096, 1024]
    - [115, 107146.0]
  - - [1024, 1024, 256, 64, 1024, 1024, 1024, 64]
    - [134, 48498.0]
  - - [64, 1024, 256, 1024, 64, 64, 64, 1024]
    - [151, 50434.0]
  - - [1024, 2048, 1, 50304, 1024, 1024, 1024, 50304]
    - [162, 105318.0]
  - - [1024, 1024, 32, 64, 1024, 1024, 1024, 64]
    - [108, 43507.0]
  - - [64, 1024, 32, 1024, 64, 64, 64, 1024]
    - [15, 37283.0]
  - - [1024, 4096, 1, 50304, 1024, 1024, 1024, 50304]
    - [59, 109280.0]
  - - [1024, 1024, 64, 64, 1024, 1024, 1024, 64]
    - [145, 46004.0]
  - - [64, 1024, 64, 1024, 64, 64, 64, 1024]
    - [51, 43471.0]
  - - [1024, 8192, 1, 50304, 1024, 1024, 1024, 50304]
    - [59, 109696.0]
  - - [1024, 1024, 128, 64, 1024, 1024, 1024, 64]
    - [134, 47616.0]
  - - [64, 1024, 128, 1024, 64, 64, 64, 1024]
    - [78, 47574.0]
  - - [128, 128, 1024, 64, 128, 128, 128, 64]
    - [133, 26790.0]
  - - [64, 128, 1024, 128, 64, 64, 64, 128]
    - [117, 23630.0]
  - - [1024, 64, 1, 2, 1024, 1024, 1024, 2]
    - [4, 26.0]
  - - [1024, 8192, 1, 30528, 1024, 1024, 1024, 30528]
    - [82, 109829.0]
  - - [1024, 64, 1, 1024, 1024, 1024, 1024, 1024]
    - [13, 5447.0]
  - - [1024, 3456, 1, 1024, 1024, 1024, 1024, 1024]
    - [140, 80459.0]
  - - [1024, 3456, 1, 512, 1024, 1024, 1024, 512]
    - [150, 65084.0]
  - - [1024, 4096, 1, 512, 1024, 1024, 1024, 512]
    - [80, 73343.0]
  - - [1024, 6912, 1, 1024, 1024, 1024, 1024, 1024]
    - [95, 96482.0]
  - - [1024, 6912, 1, 512, 1024, 1024, 1024, 512]
    - [154, 83423.0]
  - - [1024, 864, 1, 1024, 1024, 1024, 1024, 1024]
    - [86, 46412.0]
  - - [1024, 864, 1, 512, 1024, 1024, 1024, 512]
    - [42, 34526.0]
  - - [256, 3456, 1, 128, 256, 256, 256, 128]
    - [10, 18148.0]
  - - [256, 4096, 1, 128, 256, 256, 256, 128]
    - [12, 17848.0]
  - - [256, 55296, 1, 128, 256, 256, 256, 128]
    - [110, 53927.0]
  - - [256, 6912, 1, 128, 256, 256, 256, 128]
    - [55, 29187.0]
  - - [256, 864, 1, 128, 256, 256, 256, 128]
    - [60, 5802.0]
  - - [480, 3456, 1, 1024, 480, 480, 480, 1024]
    - [6, 55731.0]
  - - [480, 4096, 1, 1024, 480, 480, 480, 1024]
    - [27, 58389.0]
  - - [480, 6912, 1, 1024, 480, 480, 480, 1024]
    - [124, 80127.0]
  - - [480, 864, 1, 1024, 480, 480, 480, 1024]
    - [14, 27505.0]
  - - [512, 3456, 1, 256, 512, 512, 512, 256]
    - [137, 39597.0]
  - - [512, 4096, 1, 256, 512, 512, 512, 256]
    - [57, 36080.0]
  - - [512, 55296, 1, 256, 512, 512, 512, 256]
    - [140, 74443.0]
  - - [512, 6912, 1, 256, 512, 512, 512, 256]
    - [35, 54708.0]
  - - [512, 864, 1, 256, 512, 512, 512, 256]
    - [62, 14901.0]
  - - [1024, 640, 1, 30528, 1024, 1024, 1024, 30528]
    - [189, 99161.0]
  - - [1024, 1280, 1, 30528, 1024, 1024, 1024, 30528]
    - [178, 96688.0]
  - - [1024, 1600, 1, 30528, 1024, 1024, 1024, 30528]
    - [175, 113160.0]
  - - [1024, 10240, 1, 1024, 1024, 1024, 1024, 1024]
    - [93, 96144.0]
  - - [1024, 10240, 1, 4096, 1024, 1024, 1024, 4096]
    - [65, 105579.0]
  - - [4096, 10240, 1, 1024, 4096, 4096, 4096, 1024]
    - [30, 104510.0]
  - - [1024, 80, 1, 1024, 1024, 1024, 1024, 1024]
    - [77, 6899.0]
  - - [1024, 80, 1, 2, 1024, 1024, 1024, 2]
    - [31, 33.0]
  - - [128, 128, 1280, 64, 128, 128, 128, 64]
    - [97, 27640.0]
  - - [64, 128, 1280, 128, 64, 64, 64, 128]
    - [143, 24002.0]
  - - [1024, 1640, 1, 30528, 1024, 1024, 1024, 30528]
    - [165, 102469.0]
  - - [1024, 10496, 1, 1024, 1024, 1024, 1024, 1024]
    - [140, 98266.0]
  - - [1024, 10496, 1, 4096, 1024, 1024, 1024, 4096]
    - [65, 107689.0]
  - - [4096, 10496, 1, 1024, 4096, 4096, 4096, 1024]
    - [93, 107186.0]
  - - [1024, 82, 1, 1024, 1024, 1024, 1024, 1024]
    - [19, 7071.0]
  - - [1024, 82, 1, 2, 1024, 1024, 1024, 2]
    - [9, 36.0]
  - - [128, 128, 1312, 64, 128, 128, 128, 64]
    - [149, 27647.0]
  - - [64, 128, 1312, 128, 64, 64, 64, 128]
    - [117, 24018.0]
  - - [1024, 160, 1, 30528, 1024, 1024, 1024, 30528]
    - [193, 67372.0]
  - - [1024, 240, 1, 30528, 1024, 1024, 1024, 30528]
    - [195, 79476.0]
  - - [1024, 6144, 1, 4096, 1024, 1024, 1024, 4096]
    - [141, 96328.0]
  - - [1024, 12, 1, 1024, 1024, 1024, 1024, 1024]
    - [167, 1248.0]
  - - [4096, 6144, 1, 1024, 4096, 4096, 4096, 1024]
    - [93, 102816.0]
  - - [1024, 6144, 1, 1024, 1024, 1024, 1024, 1024]
    - [65, 82850.0]
  - - [1024, 12, 1, 2, 1024, 1024, 1024, 2]
    - [0, 5.0]
  - - [512, 512, 192, 64, 512, 512, 512, 64]
    - [145, 44102.0]
  - - [64, 512, 192, 512, 64, 64, 64, 512]
    - [15, 38679.0]
  - - [256, 4096, 1, 1, 256, 256, 256, 1]
    - [107, 182.0]
  - - [256, 6912, 1, 1, 256, 256, 256, 1]
    - [3, 284.0]
  - - [3136, 128, 64, 64, 3136, 3136, 3136, 64]
    - [97, 34541.0]
  - - [3136, 256, 64, 64, 3136, 3136, 3136, 64]
    - [145, 42683.0]
  - - [3136, 256, 64, 128, 3136, 3136, 3136, 128]
    - [93, 62659.0]
  - - [784, 512, 64, 256, 784, 784, 784, 256]
    - [93, 67997.0]
  - - [3136, 128, 64, 256, 3136, 3136, 3136, 256]
    - [108, 62185.0]
  - - [3136, 256, 64, 256, 3136, 3136, 3136, 256]
    - [93, 81921.0]
  - - [784, 256, 64, 512, 784, 784, 784, 512]
    - [93, 76974.0]
  - - [784, 512, 64, 512, 784, 784, 784, 512]
    - [93, 82580.0]
  - - [3136, 128, 32, 64, 3136, 3136, 3136, 64]
    - [133, 31913.0]
  - - [3136, 256, 32, 64, 3136, 3136, 3136, 64]
    - [110, 39753.0]
  - - [3136, 256, 32, 128, 3136, 3136, 3136, 128]
    - [90, 58304.0]
  - - [784, 512, 32, 256, 784, 784, 784, 256]
    - [93, 63727.0]
  - - [3136, 128, 32, 256, 3136, 3136, 3136, 256]
    - [133, 60270.0]
  - - [3136, 256, 32, 256, 3136, 3136, 3136, 256]
    - [118, 74599.0]
  - - [784, 256, 32, 512, 784, 784, 784, 512]
    - [90, 65453.0]
  - - [784, 512, 32, 512, 784, 784, 784, 512]
    - [93, 74599.0]
  - - [3136, 64, 64, 64, 3136, 3136, 3136, 64]
    - [89, 25373.0]
  - - [3136, 64, 64, 256, 3136, 3136, 3136, 256]
    - [91, 40338.0]
  - - [784, 512, 64, 128, 784, 784, 784, 128]
    - [133, 51834.0]
  - - [784, 128, 64, 512, 784, 784, 784, 512]
    - [90, 57731.0]
  - - [64, 192, 64, 1280, 64, 64, 64, 1280]
    - [48, 33376.0]
  - - [64, 320, 64, 1280, 64, 64, 64, 1280]
    - [53, 36096.0]
  - - [64, 384, 64, 1280, 64, 64, 64, 1280]
    - [18, 42154.0]
  - - [64, 448, 64, 1280, 64, 64, 64, 1280]
    - [33, 40609.0]
  - - [64, 192, 64, 2048, 64, 64, 64, 2048]
    - [1, 32630.0]
  - - [64, 320, 64, 2048, 64, 64, 64, 2048]
    - [20, 36158.0]
  - - [64, 384, 64, 2048, 64, 64, 64, 2048]
    - [44, 40672.0]
  - - [64, 448, 64, 2048, 64, 64, 64, 2048]
    - [1, 40778.0]
  - - [64, 192, 32, 1280, 64, 64, 64, 1280]
    - [37, 28087.0]
  - - [64, 320, 32, 1280, 64, 64, 64, 1280]
    - [86, 34493.0]
  - - [64, 384, 32, 1280, 64, 64, 64, 1280]
    - [20, 37900.0]
  - - [64, 448, 32, 1280, 64, 64, 64, 1280]
    - [63, 39252.0]
  - - [64, 192, 32, 2048, 64, 64, 64, 2048]
    - [14, 28598.0]
  - - [64, 320, 32, 2048, 64, 64, 64, 2048]
    - [74, 35926.0]
  - - [64, 384, 32, 2048, 64, 64, 64, 2048]
    - [86, 39867.0]
  - - [64, 448, 32, 2048, 64, 64, 64, 2048]
    - [1, 39542.0]
  - - [1024, 10224, 1, 1024, 1024, 1024, 1024, 1024]
    - [140, 90607.0]
  - - [1024, 10192, 1, 1024, 1024, 1024, 1024, 1024]
    - [140, 93158.0]
  - - [1024, 10208, 1, 1024, 1024, 1024, 1024, 1024]
    - [140, 92211.0]
  - - [1024, 10224, 1, 4096, 1024, 1024, 1024, 4096]
    - [113, 104980.0]
  - - [1024, 10224, 1, 3072, 1024, 1024, 1024, 3072]
    - [113, 103189.0]
  - - [4096, 10224, 1, 1024, 4096, 4096, 4096, 1024]
    - [113, 103441.0]
  - - [1024, 10240, 1, 3072, 1024, 1024, 1024, 3072]
    - [113, 104666.0]
  - - [1024, 10192, 1, 3072, 1024, 1024, 1024, 3072]
    - [140, 103933.0]
  - - [4096, 10192, 1, 1024, 4096, 4096, 4096, 1024]
    - [93, 103818.0]
  - - [1024, 10192, 1, 4096, 1024, 1024, 1024, 4096]
    - [140, 105541.0]
  - - [1024, 10200, 1, 3072, 1024, 1024, 1024, 3072]
    - [113, 103960.0]
  - - [1024, 10184, 1, 1024, 1024, 1024, 1024, 1024]
    - [140, 92826.0]
  - - [4096, 10208, 1, 1024, 4096, 4096, 4096, 1024]
    - [93, 104001.0]
  - - [1024, 10208, 1, 3072, 1024, 1024, 1024, 3072]
    - [140, 104557.0]
  - - [1024, 10208, 1, 4096, 1024, 1024, 1024, 4096]
    - [140, 105456.0]
  - - [1024, 10224, 1, 2048, 1024, 1024, 1024, 2048]
    - [140, 100006.0]
  - - [1024, 10240, 1, 2048, 1024, 1024, 1024, 2048]
    - [140, 102495.0]
  - - [1024, 10120, 1, 1024, 1024, 1024, 1024, 1024]
    - [140, 94476.0]
  - - [1024, 10192, 1, 2048, 1024, 1024, 1024, 2048]
    - [140, 101782.0]
  - - [64, 24, 6816, 24, 436224, 436224, 1308672, 24]
    - [107, 4744.0]
  - - [64, 24, 6816, 24, 1308672, 1308672, 1308672, 24]
    - [89, 4646.0]
  - - [1024, 10152, 1, 1024, 1024, 1024, 1024, 1024]
    - [140, 93182.0]
  - - [1024, 10080, 1, 3072, 1024, 1024, 1024, 3072]
    - [113, 103085.0]
  - - [64, 26, 6272, 26, 1204224, 1204224, 1204224, 26]
    - [89, 5116.0]
  - - [64, 26, 6272, 26, 401408, 401408, 1204224, 26]
    - [89, 5292.0]
  - - [100352, 512, 1, 256, 100352, 100352, 100352, 256]
    - [123, 91241.0]
  - - [12544, 2048, 1, 1024, 12544, 12544, 12544, 1024]
    - [113, 108062.0]
  - - [12544, 64, 1, 147, 12544, 12544, 12544, 147]
    - [26, 12940.0]
  - - [200704, 512, 1, 256, 200704, 200704, 200704, 256]
    - [123, 93684.0]
  - - [25088, 1024, 1, 512, 25088, 25088, 25088, 512]
    - [123, 100560.0]
  - - [3136, 64, 1, 576, 3136, 3136, 3136, 576]
    - [84, 12902.0]
  - - [50176, 1024, 1, 512, 50176, 50176, 50176, 512]
    - [123, 104824.0]
  - - [6272, 2048, 1, 1024, 6272, 6272, 6272, 1024]
    - [90, 92838.0]
  - - [784, 128, 1, 1152, 784, 784, 784, 1152]
    - [22, 8451.0]
  - - [3136, 128, 128, 256, 3136, 3136, 3136, 256]
    - [133, 64351.0]
  - - [3136, 128, 256, 256, 3136, 3136, 3136, 256]
    - [108, 65115.0]
  - - [3136, 256, 128, 64, 3136, 3136, 3136, 64]
    - [98, 44174.0]
  - - [3136, 256, 256, 64, 3136, 3136, 3136, 64]
    - [110, 44873.0]
  - - [3136, 64, 128, 256, 3136, 3136, 3136, 256]
    - [136, 41667.0]
  - - [3136, 64, 256, 256, 3136, 3136, 3136, 256]
    - [111, 42343.0]
  - - [3136, 64, 128, 64, 3136, 3136, 3136, 64]
    - [98, 27624.0]
  - - [3136, 64, 256, 64, 3136, 3136, 3136, 64]
    - [98, 29318.0]
  - - [784, 128, 128, 512, 784, 784, 784, 512]
    - [108, 63580.0]
  - - [784, 128, 256, 512, 784, 784, 784, 512]
    - [90, 65374.0]
  - - [784, 256, 128, 512, 784, 784, 784, 512]
    - [140, 79046.0]
  - - [784, 256, 256, 512, 784, 784, 784, 512]
    - [93, 85478.0]
  - - [784, 512, 128, 128, 784, 784, 784, 128]
    - [100, 56076.0]
  - - [784, 512, 256, 128, 784, 784, 784, 128]
    - [100, 59058.0]
  - - [128, 128, 2048, 64, 128, 128, 128, 64]
    - [102, 28895.0]
  - - [64, 128, 2048, 128, 64, 64, 64, 128]
    - [126, 24878.0]
  - - [1024, 2560, 1, 30528, 1024, 1024, 1024, 30528]
    - [177, 116876.0]
  - - [1024, 128, 1, 1024, 1024, 1024, 1024, 1024]
    - [73, 10686.0]
  - - [1024, 128, 1, 2, 1024, 1024, 1024, 2]
    - [9, 73.0]
  - - [128, 128, 1536, 64, 128, 128, 128, 64]
    - [90, 28237.0]
  - - [64, 128, 1536, 128, 64, 64, 64, 128]
    - [143, 24374.0]
  - - [1024, 12288, 1, 4096, 1024, 1024, 1024, 4096]
    - [72, 102521.0]
  - - [1024, 12288, 1, 1024, 1024, 1024, 1024, 1024]
    - [142, 90028.0]
  - - [4096, 12288, 1, 1024, 4096, 4096, 4096, 1024]
    - [93, 107177.0]
  - - [1024, 1920, 1, 30528, 1024, 1024, 1024, 30528]
    - [165, 99582.0]
  - - [1024, 96, 1, 1024, 1024, 1024, 1024, 1024]
    - [66, 8502.0]
  - - [1024, 96, 1, 2, 1024, 1024, 1024, 2]
    - [9, 38.0]
  - - [128, 128, 192, 64, 128, 128, 128, 64]
    - [102, 22469.0]
  - - [64, 128, 192, 128, 64, 64, 64, 128]
    - [17, 20133.0]
  - - [768, 2048, 1, 2, 768, 768, 768, 2]
    - [11, 554.0]
  - - [3072, 2048, 1, 768, 3072, 3072, 3072, 768]
    - [130, 80746.0]
  - - [768, 2048, 1, 3072, 768, 768, 768, 3072]
    - [92, 67484.0]
  - - [768, 2048, 1, 768, 768, 768, 768, 768]
    - [6, 52247.0]
  - - [384, 384, 144, 64, 384, 384, 384, 64]
    - [136, 39140.0]
  - - [64, 384, 144, 384, 64, 64, 64, 384]
    - [18, 35762.0]
  - - [768, 4608, 1, 2, 768, 768, 768, 2]
    - [108, 867.0]
  - - [3072, 4608, 1, 768, 3072, 3072, 3072, 768]
    - [93, 97137.0]
  - - [768, 4608, 1, 3072, 768, 768, 768, 3072]
    - [141, 104696.0]
  - - [768, 4608, 1, 768, 768, 768, 768, 768]
    - [35, 86010.0]
  - - [512, 512, 48, 64, 512, 512, 512, 64]
    - [133, 36341.0]
  - - [64, 512, 48, 512, 64, 64, 64, 512]
    - [28, 38421.0]
  - - [128, 128, 256, 64, 128, 128, 128, 64]
    - [90, 21103.0]
  - - [64, 128, 256, 128, 64, 64, 64, 128]
    - [125, 19284.0]
  - - [384, 384, 192, 64, 384, 384, 384, 64]
    - [121, 40087.0]
  - - [64, 384, 192, 384, 64, 64, 64, 384]
    - [67, 33654.0]
  - - [1024, 4608, 1, 2, 1024, 1024, 1024, 2]
    - [97, 929.0]
  - - [4096, 4608, 1, 1024, 4096, 4096, 4096, 1024]
    - [119, 99831.0]
  - - [1024, 4608, 1, 4096, 1024, 1024, 1024, 4096]
    - [59, 108580.0]
  - - [1024, 4608, 1, 1024, 1024, 1024, 1024, 1024]
    - [30, 84710.0]
  - - [8192, 1024, 1, 1024, 8192, 8192, 8192, 1024]
    - [8, 84881.0]
  - - [8192, 4096, 1, 1024, 8192, 8192, 8192, 1024]
    - [123, 109009.0]
  - - [479, 32768, 1, 1024, 479, 479, 479, 1024]
    - [226, 83572.0]
  - - [74, 512, 1, 2048, 74, 74, 74, 2048]
    - [230, 6510.0]
  - - [67, 512, 1, 2048, 67, 67, 67, 2048]
    - [234, 5894.0]
  - - [74, 960, 1, 2048, 74, 74, 74, 2048]
    - [229, 9778.0]
  - - [100, 512, 1, 2048, 100, 100, 100, 2048]
    - [231, 7992.0]
  - - [257, 1024, 1, 4096, 257, 257, 257, 4096]
    - [232, 30623.0]
  - - [196, 1024, 64, 512, 196, 196, 196, 512]
    - [220, 57569.0]
  - - [196, 512, 64, 1024, 196, 196, 196, 1024]
    - [220, 58973.0]
  - - [196, 1024, 64, 1024, 196, 196, 196, 1024]
    - [220, 67969.0]
  - - [49, 2048, 64, 1024, 49, 49, 49, 1024]
    - [217, 33472.0]
  - - [49, 1024, 64, 2048, 49, 49, 49, 2048]
    - [205, 32545.0]
  - - [196, 1024, 32, 512, 196, 196, 196, 512]
    - [220, 50998.0]
  - - [196, 512, 32, 1024, 196, 196, 196, 1024]
    - [220, 48415.0]
  - - [196, 1024, 32, 1024, 196, 196, 196, 1024]
    - [204, 61076.0]
  - - [49, 2048, 32, 1024, 49, 49, 49, 1024]
    - [214, 30025.0]
  - - [49, 1024, 32, 2048, 49, 49, 49, 2048]
    - [228, 28724.0]
  - - [196, 1024, 64, 256, 196, 196, 196, 256]
    - [223, 44923.0]
  - - [196, 256, 64, 1024, 196, 196, 196, 1024]
    - [220, 47740.0]
  - - [49, 2048, 64, 512, 49, 49, 49, 512]
    - [207, 28825.0]
  - - [49, 512, 64, 2048, 49, 49, 49, 2048]
    - [200, 27312.0]
  - - [1225, 32, 64, 192, 1225, 1225, 1225, 192]
    - [202, 18584.0]
  - - [1225, 48, 64, 192, 1225, 1225, 1225, 192]
    - [216, 20205.0]
  - - [1225, 64, 64, 192, 1225, 1225, 1225, 192]
    - [212, 30642.0]
  - - [1225, 48, 64, 256, 1225, 1225, 1225, 256]
    - [216, 23203.0]
  - - [1225, 64, 64, 256, 1225, 1225, 1225, 256]
    - [199, 34090.0]
  - - [1225, 48, 64, 288, 1225, 1225, 1225, 288]
    - [221, 24020.0]
  - - [1225, 64, 64, 288, 1225, 1225, 1225, 288]
    - [198, 36345.0]
  - - [5329, 80, 64, 64, 5329, 5329, 5329, 64]
    - [227, 16816.0]
  - - [289, 128, 64, 768, 289, 289, 289, 768]
    - [215, 42403.0]
  - - [289, 160, 64, 768, 289, 289, 289, 768]
    - [225, 46120.0]
  - - [289, 192, 64, 768, 289, 289, 289, 768]
    - [211, 50061.0]
  - - [1225, 32, 32, 192, 1225, 1225, 1225, 192]
    - [209, 16014.0]
  - - [1225, 48, 32, 192, 1225, 1225, 1225, 192]
    - [218, 17709.0]
  - - [1225, 64, 32, 192, 1225, 1225, 1225, 192]
    - [201, 26408.0]
  - - [1225, 48, 32, 256, 1225, 1225, 1225, 256]
    - [216, 20070.0]
  - - [1225, 64, 32, 256, 1225, 1225, 1225, 256]
    - [197, 28368.0]
  - - [1225, 48, 32, 288, 1225, 1225, 1225, 288]
    - [224, 21572.0]
  - - [1225, 64, 32, 288, 1225, 1225, 1225, 288]
    - [210, 30720.0]
  - - [5329, 80, 32, 64, 5329, 5329, 5329, 64]
    - [227, 16289.0]
  - - [289, 128, 32, 768, 289, 289, 289, 768]
    - [206, 36423.0]
  - - [289, 160, 32, 768, 289, 289, 289, 768]
    - [203, 37480.0]
  - - [289, 192, 32, 768, 289, 289, 289, 768]
    - [211, 46574.0]
  - - [196, 256, 1, 2304, 196, 196, 196, 2304]
    - [233, 9204.0]
  - - [49, 512, 1, 4608, 49, 49, 49, 4608]
    - [235, 8028.0]
  - - [196, 1024, 128, 256, 196, 196, 196, 256]
    - [223, 49914.0]
  - - [196, 1024, 256, 256, 196, 196, 196, 256]
    - [223, 51300.0]
  - - [196, 256, 128, 1024, 196, 196, 196, 1024]
    - [220, 56970.0]
  - - [196, 256, 256, 1024, 196, 196, 196, 1024]
    - [223, 63876.0]
  - - [196, 512, 128, 1024, 196, 196, 196, 1024]
    - [220, 66297.0]
  - - [196, 512, 256, 1024, 196, 196, 196, 1024]
    - [222, 72462.0]
  - - [49, 2048, 128, 512, 49, 49, 49, 512]
    - [219, 30686.0]
  - - [49, 2048, 256, 512, 49, 49, 49, 512]
    - [219, 31151.0]
  - - [49, 512, 128, 2048, 49, 49, 49, 2048]
    - [213, 31864.0]
  - - [49, 512, 256, 2048, 49, 49, 49, 2048]
    - [208, 34775.0]
- null
