TRAIN_3.10/logic/arcturus_Cijk_Alik_Bljk_HBH.yaml
- {MinimumRequiredVersion: 4.23.0}
- arcturus
- gfx908
- [Device 7380, Device 7388, Device 738c, Device 7390]
    SolutionIndex: 0
    SolutionNameMin: Cijk_Alik_Bljk_HBH_MT128x256x32_MI32x32x8x1_SE_1LDSB0_AF0EM8_GRVW2_LBSPP128_LPA8_LPB8_PLR5_SU0_SUS256_SRVW4_TT2_128_WG64_4_1_WGM1
    SolutionIndex: 1
    SolutionNameMin: Cijk_Alik_Bljk_HBH_MT64x32x32_MI16x16x16x1_SE_1LDSB0_AF0EM8_GRVW4_LBSPP128_LPA16_LPB16_PLR2_SU0_SUS256_SRVW4_TT2_16_WG32_8_1_WGM1
    SolutionIndex: 2
    SolutionNameMin: Cijk_Alik_Bljk_HBH_MT32x32x64_MI16x16x16x1_SE_1LDSB0_AF0EM8_GRVW4_LBSPP128_LPA16_LPB16_PLR5_SU0_SUS256_SRVW4_TT1_16_WG32_8_1_WGM1
    SolutionIndex: 3
    SolutionNameMin: Cijk_Alik_Bljk_HBH_MT32x32x32_MI16x16x16x1_SE_1LDSB0_AF0EM8_GRVW8_LBSPP128_LPA16_LPB16_PLR2_SU0_SUS256_SRVW4_TT1_16_WG32_8_1_WGM1
    SolutionIndex: 4
    SolutionNameMin: Cijk_Alik_Bljk_HBH_MT64x32x32_MI16x16x16x1_SE_1LDSB0_AF0EM8_GRVW8_LBSPP128_LPA16_LPB16_PLR2_SU0_SUS256_SRVW4_TT2_16_WG32_8_1_WGM1
    SolutionIndex: 5
    SolutionNameMin: Cijk_Alik_Bljk_HBH_MT64x128x32_MI32x32x8x1_SE_1LDSB0_AF0EM8_GRVW8_LBSPP128_LPA8_LPB8_PLR5_SU0_SUS256_SRVW4_TT1_64_WG64_4_1_WGM1
    SolutionIndex: 6
    SolutionNameMin: Cijk_Alik_Bljk_HBH_MT32x32x64_MI16x16x16x1_SE_1LDSB0_AF0EM8_GRVW8_LBSPP128_LPA16_LPB16_PLR5_SU0_SUS256_SRVW4_TT1_16_WG32_8_1_WGM1
    SolutionIndex: 7
    SolutionNameMin: Cijk_Alik_Bljk_HBH_MT32x32x64_MI16x16x16x1_SE_1LDSB0_AF0EM8_GRVW8_LBSPP128_LPA16_LPB16_PLR5_SU32_SUS128_SRVW4_TT1_16_WG32_8_1_WGM1
    SolutionIndex: 8
    SolutionNameMin: Cijk_Alik_Bljk_HBH_MT32x32x64_MI16x16x16x1_SE_1LDSB0_AF0EM8_GRVW2_LBSPP128_LPA16_LPB16_PLR5_SU32_SUS256_SRVW4_TT1_16_WG32_8_1_WGM1
    SolutionIndex: 9
    SolutionNameMin: Cijk_Alik_Bljk_HBH_MT32x32x64_MI16x16x16x1_SE_1LDSB0_AF0EM8_GRVW2_LBSPP128_LPA16_LPB16_PLR5_SU0_SUS256_SRVW4_TT1_16_WG32_8_1_WGM2
    SolutionIndex: 10
    SolutionNameMin: Cijk_Alik_Bljk_HBH_MT128x96x64_MI32x32x8x1_SE_1LDSB0_AF0EM8_GRVW2_LBSPP128_LPA8_LPB8_PLR9_SU0_SUS256_SRVW4_TT1_96_WG128_2_1_WGM2
    SolutionIndex: 11
    SolutionNameMin: Cijk_Alik_Bljk_HBH_MT128x96x32_MI32x32x8x1_SE_1LDSB0_AF0EM8_GRVW4_LBSPP128_LPA8_LPB8_PLR5_SU0_SUS256_SRVW4_TT1_96_WG128_2_1_WGM2
    SolutionIndex: 12
    SolutionNameMin: Cijk_Alik_Bljk_HBH_MT32x32x64_MI16x16x16x1_SE_1LDSB0_AF0EM8_GRVW4_LBSPP128_LPA16_LPB16_PLR5_SU0_SUS256_SRVW4_TT1_16_WG32_8_1_WGM2
    SolutionIndex: 13
    SolutionNameMin: Cijk_Alik_Bljk_HBH_MT32x32x64_MI16x16x16x1_SE_1LDSB0_AF0EM8_GRVW2_LBSPP128_LPA16_LPB16_PLR5_SU32_SUS128_SRVW4_TT1_16_WG32_8_1_WGM2
    SolutionIndex: 14
    SolutionNameMin: Cijk_Alik_Bljk_HBH_MT128x128x32_MI32x32x8x1_SE_1LDSB0_AF0EM8_GRVW8_LBSPP128_LPA8_LPB8_PLR5_SU32_SUS128_SRVW4_TT2_64_WG64_4_1_WGM2
    SolutionIndex: 15
    SolutionNameMin: Cijk_Alik_Bljk_HBH_MT32x32x64_MI16x16x16x1_SE_1LDSB0_AF0EM8_GRVW8_LBSPP128_LPA16_LPB16_PLR5_SU32_SUS128_SRVW4_TT1_16_WG32_8_1_WGM2
    SolutionIndex: 16
    SolutionNameMin: Cijk_Alik_Bljk_HBH_MT128x64x64_MI32x32x8x1_SE_1LDSB0_AF0EM8_GRVW8_LBSPP128_LPA8_LPB8_PLR9_SU32_SUS128_SRVW4_TT2_32_WG64_4_1_WGM2
    SolutionIndex: 17
    SolutionNameMin: Cijk_Alik_Bljk_HBH_MT128x96x64_MI32x32x8x1_SE_1LDSB0_AF0EM8_GRVW2_LBSPP128_LPA8_LPB8_PLR9_SU32_SUS256_SRVW4_TT1_96_WG128_2_1_WGM2
    SolutionIndex: 18
    SolutionNameMin: Cijk_Alik_Bljk_HBH_MT32x32x64_MI16x16x16x1_SE_1LDSB0_AF0EM8_GRVW8_LBSPP128_LPA16_LPB16_PLR5_SU32_SUS256_SRVW4_TT1_16_WG32_8_1_WGM2
    SolutionIndex: 19
    SolutionNameMin: Cijk_Alik_Bljk_HBH_MT64x128x64_MI32x32x8x1_SE_1LDSB0_AF0EM8_GRVW8_LBSPP128_LPA8_LPB8_PLR9_SU32_SUS256_SRVW4_TT1_64_WG64_4_1_WGM2
    SolutionIndex: 20
    SolutionNameMin: Cijk_Alik_Bljk_HBH_MT32x32x32_MI16x16x16x1_SE_1LDSB0_AF0EM8_GRVW2_LBSPP128_LPA16_LPB16_PLR2_SU0_SUS256_SRVW4_TT1_16_WG32_8_1_WGM15
    SolutionIndex: 21
    SolutionNameMin: Cijk_Alik_Bljk_HBH_MT128x96x32_MI32x32x8x1_SE_1LDSB0_AF0EM8_GRVW2_LBSPP128_LPA8_LPB8_PLR5_SU0_SUS256_SRVW4_TT1_96_WG128_2_1_WGM15
    SolutionIndex: 22
    SolutionNameMin: Cijk_Alik_Bljk_HBH_MT128x288x32_MI32x32x8x1_SE_1LDSB0_AF0EM8_GRVW2_LBSPP128_LPA8_LPB8_PLR5_SU0_SUS256_SRVW4_TT1_288_WG128_2_1_WGM15
    SolutionIndex: 23
    SolutionNameMin: Cijk_Alik_Bljk_HBH_MT32x32x64_MI16x16x16x1_SE_1LDSB0_AF0EM8_GRVW2_LBSPP128_LPA16_LPB16_PLR5_SU0_SUS256_SRVW4_TT1_16_WG32_8_1_WGM15
    SolutionIndex: 24
    SolutionNameMin: Cijk_Alik_Bljk_HBH_MT64x128x64_MI32x32x8x1_SE_1LDSB0_AF0EM8_GRVW2_LBSPP128_LPA8_LPB8_PLR9_SU0_SUS256_SRVW4_TT1_64_WG64_4_1_WGM15
    SolutionIndex: 25
    SolutionNameMin: Cijk_Alik_Bljk_HBH_MT32x32x64_MI16x16x16x1_SE_1LDSB0_AF0EM8_GRVW4_LBSPP128_LPA16_LPB16_PLR5_SU0_SUS256_SRVW4_TT1_16_WG32_8_1_WGM15
    SolutionIndex: 26
    SolutionNameMin: Cijk_Alik_Bljk_HBH_MT128x256x32_MI32x32x8x1_SE_1LDSB0_AF0EM8_GRVW8_LBSPP128_LPA8_LPB8_PLR5_SU0_SUS256_SRVW4_TT2_128_WG64_4_1_WGM15
    SolutionIndex: 27
    SolutionNameMin: Cijk_Alik_Bljk_HBH_MT32x32x64_MI16x16x16x1_SE_1LDSB0_AF0EM8_GRVW8_LBSPP128_LPA16_LPB16_PLR5_SU0_SUS256_SRVW4_TT1_16_WG32_8_1_WGM15
    SolutionIndex: 28
    SolutionNameMin: Cijk_Alik_Bljk_HBH_MT64x32x64_MI16x16x16x1_SE_1LDSB0_AF0EM8_GRVW8_LBSPP128_LPA16_LPB16_PLR5_SU0_SUS256_SRVW4_TT2_16_WG32_8_1_WGM15
    SolutionIndex: 29
    SolutionNameMin: Cijk_Alik_Bljk_HBH_MT128x64x64_MI32x32x8x1_SE_1LDSB0_AF0EM8_GRVW8_LBSPP128_LPA8_LPB8_PLR9_SU0_SUS256_SRVW4_TT2_32_WG64_4_1_WGM15
    SolutionIndex: 30
    SolutionNameMin: Cijk_Alik_Bljk_HBH_MT32x32x64_MI16x16x16x1_SE_1LDSB0_AF0EM8_GRVW2_LBSPP128_LPA16_LPB16_PLR5_SU32_SUS128_SRVW4_TT1_16_WG32_8_1_WGM15
    SolutionIndex: 31
    SolutionNameMin: Cijk_Alik_Bljk_HBH_MT64x128x64_MI32x32x8x1_SE_1LDSB0_AF0EM8_GRVW2_LBSPP128_LPA8_LPB8_PLR9_SU32_SUS128_SRVW4_TT1_64_WG64_4_1_WGM15
    SolutionIndex: 32
    SolutionNameMin: Cijk_Alik_Bljk_HBH_MT128x96x64_MI32x32x8x1_SE_1LDSB0_AF0EM8_GRVW2_LBSPP128_LPA8_LPB8_PLR9_SU32_SUS128_SRVW4_TT1_96_WG128_2_1_WGM15
    SolutionIndex: 33
    SolutionNameMin: Cijk_Alik_Bljk_HBH_MT64x128x32_MI32x32x8x1_SE_1LDSB0_AF0EM8_GRVW4_LBSPP128_LPA8_LPB8_PLR5_SU32_SUS128_SRVW4_TT1_64_WG64_4_1_WGM15
    SolutionIndex: 34
    SolutionNameMin: Cijk_Alik_Bljk_HBH_MT32x32x64_MI16x16x16x1_SE_1LDSB0_AF0EM8_GRVW4_LBSPP128_LPA16_LPB16_PLR5_SU32_SUS128_SRVW4_TT1_16_WG32_8_1_WGM15
    SolutionIndex: 35
    SolutionNameMin: Cijk_Alik_Bljk_HBH_MT32x32x64_MI16x16x16x1_SE_1LDSB0_AF0EM8_GRVW8_LBSPP128_LPA16_LPB16_PLR5_SU32_SUS128_SRVW4_TT1_16_WG32_8_1_WGM15
    SolutionIndex: 36
    SolutionNameMin: Cijk_Alik_Bljk_HBH_MT32x64x64_MI16x16x16x1_SE_1LDSB0_AF0EM8_GRVW8_LBSPP128_LPA16_LPB16_PLR5_SU32_SUS128_SRVW4_TT1_32_WG32_8_1_WGM15
    SolutionIndex: 37
    SolutionNameMin: Cijk_Alik_Bljk_HBH_MT64x64x64_MI32x32x8x1_SE_1LDSB0_AF0EM8_GRVW8_LBSPP128_LPA8_LPB8_PLR9_SU32_SUS128_SRVW4_TT1_32_WG64_4_1_WGM15
    SolutionIndex: 38
    SolutionNameMin: Cijk_Alik_Bljk_HBH_MT128x64x64_MI32x32x8x1_SE_1LDSB0_AF0EM8_GRVW8_LBSPP128_LPA8_LPB8_PLR9_SU32_SUS128_SRVW4_TT2_32_WG64_4_1_WGM15
    SolutionIndex: 39
    SolutionNameMin: Cijk_Alik_Bljk_HBH_MT128x96x64_MI32x32x8x1_SE_1LDSB0_AF0EM8_GRVW2_LBSPP128_LPA8_LPB8_PLR9_SU32_SUS256_SRVW4_TT1_96_WG128_2_1_WGM15
    SolutionIndex: 40
    SolutionNameMin: Cijk_Alik_Bljk_HBH_MT64x64x32_MI32x32x8x1_SE_1LDSB1_AF0EM8_GRVW2_LBSPP128_LPA8_LPB8_PLR5_SU0_SUS256_SRVW4_TT1_32_WG64_4_1_WGM1
    SolutionIndex: 41
    SolutionNameMin: Cijk_Alik_Bljk_HBH_MT128x64x32_MI32x32x8x1_SE_1LDSB1_AF0EM8_GRVW2_LBSPP128_LPA8_LPB8_PLR5_SU0_SUS256_SRVW4_TT2_32_WG64_4_1_WGM1
    SolutionIndex: 42
    SolutionNameMin: Cijk_Alik_Bljk_HBH_MT256x256x32_MI32x32x8x1_SE_1LDSB1_AF0EM8_GRVW2_LBSPP128_LPA8_LPB8_PLR5_SU0_SUS256_SRVW4_TT4_128_WG64_4_1_WGM1
    SolutionIndex: 43
    SolutionNameMin: Cijk_Alik_Bljk_HBH_MT160x160x64_MI16x16x16x1_SE_1LDSB1_AF0EM8_GRVW2_LBSPP128_LPA16_LPB16_PLR5_SU0_SUS256_SRVW0_TT5_80_WG32_8_1_WGM1
    SolutionIndex: 44
    SolutionNameMin: Cijk_Alik_Bljk_HBH_MT144x128x64_MI16x16x16x1_SE_1LDSB1_AF0EM8_GRVW2_LBSPP128_LPA16_LPB16_PLR5_SU0_SUS256_SRVW0_TT9_32_WG16_16_1_WGM1
    SolutionIndex: 45
    SolutionNameMin: Cijk_Alik_Bljk_HBH_MT64x64x64_MI32x32x8x1_SE_1LDSB1_AF0EM8_GRVW2_LBSPP128_LPA8_LPB8_PLR9_SU0_SUS256_SRVW4_TT1_32_WG64_4_1_WGM1
    SolutionIndex: 46
    SolutionNameMin: Cijk_Alik_Bljk_HBH_MT128x256x64_MI32x32x8x1_SE_1LDSB1_AF0EM8_GRVW2_LBSPP128_LPA8_LPB8_PLR9_SU0_SUS256_SRVW4_TT2_128_WG64_4_1_WGM1
    SolutionIndex: 47
    SolutionNameMin: Cijk_Alik_Bljk_HBH_MT256x128x64_MI32x32x8x1_SE_1LDSB1_AF0EM8_GRVW2_LBSPP128_LPA8_LPB8_PLR9_SU0_SUS256_SRVW4_TT4_64_WG64_4_1_WGM1
    SolutionIndex: 48
    SolutionNameMin: Cijk_Alik_Bljk_HBH_MT256x160x64_MI32x32x8x1_SE_1LDSB1_AF0EM8_GRVW2_LBSPP128_LPA8_LPB8_PLR9_SU0_SUS256_SRVW4_TT2_160_WG128_2_1_WGM1
    SolutionIndex: 49
    SolutionNameMin: Cijk_Alik_Bljk_HBH_MT32x64x32_MI16x16x16x1_SE_1LDSB1_AF0EM8_GRVW4_LBSPP128_LPA16_LPB16_PLR2_SU0_SUS256_SRVW4_TT1_32_WG32_8_1_WGM1
    SolutionIndex: 50
    SolutionNameMin: Cijk_Alik_Bljk_HBH_MT128x96x32_MI32x32x8x1_SE_1LDSB1_AF0EM8_GRVW4_LBSPP128_LPA8_LPB8_PLR5_SU0_SUS256_SRVW4_TT1_96_WG128_2_1_WGM1
    SolutionIndex: 51
    SolutionNameMin: Cijk_Alik_Bljk_HBH_MT128x128x64_MI32x32x8x1_SE_1LDSB1_AF0EM8_GRVW4_LBSPP128_LPA8_LPB8_PLR9_SU0_SUS256_SRVW4_TT2_64_WG64_4_1_WGM1
    SolutionIndex: 52
    SolutionNameMin: Cijk_Alik_Bljk_HBH_MT32x32x32_MI16x16x16x1_SE_1LDSB1_AF0EM8_GRVW8_LBSPP128_LPA16_LPB16_PLR2_SU0_SUS256_SRVW4_TT1_16_WG32_8_1_WGM1
    SolutionIndex: 53
    SolutionNameMin: Cijk_Alik_Bljk_HBH_MT64x128x32_MI32x32x8x1_SE_1LDSB1_AF0EM8_GRVW8_LBSPP128_LPA8_LPB8_PLR5_SU0_SUS256_SRVW4_TT1_64_WG64_4_1_WGM1
    SolutionIndex: 54
    SolutionNameMin: Cijk_Alik_Bljk_HBH_MT128x64x32_MI32x32x8x1_SE_1LDSB1_AF0EM8_GRVW8_LBSPP128_LPA8_LPB8_PLR5_SU0_SUS256_SRVW4_TT2_32_WG64_4_1_WGM1
    SolutionIndex: 55
    SolutionNameMin: Cijk_Alik_Bljk_HBH_MT128x128x32_MI32x32x8x1_SE_1LDSB1_AF0EM8_GRVW8_LBSPP128_LPA8_LPB8_PLR5_SU0_SUS256_SRVW4_TT2_64_WG64_4_1_WGM1
    SolutionIndex: 56
    SolutionNameMin: Cijk_Alik_Bljk_HBH_MT128x256x32_MI32x32x8x1_SE_1LDSB1_AF0EM8_GRVW8_LBSPP128_LPA8_LPB8_PLR5_SU0_SUS256_SRVW4_TT2_128_WG64_4_1_WGM1
    SolutionIndex: 57
    SolutionNameMin: Cijk_Alik_Bljk_HBH_MT64x32x64_MI16x16x16x1_SE_1LDSB1_AF0EM8_GRVW8_LBSPP128_LPA16_LPB16_PLR5_SU0_SUS256_SRVW4_TT2_16_WG32_8_1_WGM1
    SolutionIndex: 58
    SolutionNameMin: Cijk_Alik_Bljk_HBH_MT64x64x64_MI32x32x8x1_SE_1LDSB1_AF0EM8_GRVW8_LBSPP128_LPA8_LPB8_PLR9_SU0_SUS256_SRVW4_TT1_32_WG64_4_1_WGM1
    SolutionIndex: 59
    SolutionNameMin: Cijk_Alik_Bljk_HBH_MT64x128x64_MI32x32x8x1_SE_1LDSB1_AF0EM8_GRVW8_LBSPP128_LPA8_LPB8_PLR9_SU0_SUS256_SRVW4_TT1_64_WG64_4_1_WGM1
    SolutionIndex: 60
    SolutionNameMin: Cijk_Alik_Bljk_HBH_MT96x128x64_MI32x32x8x1_SE_1LDSB1_AF0EM8_GRVW8_LBSPP128_LPA8_LPB8_PLR9_SU0_SUS256_SRVW0_TT3_32_WG32_8_1_WGM1
    SolutionIndex: 61
    SolutionNameMin: Cijk_Alik_Bljk_HBH_MT256x256x32_MI32x32x8x1_SE_1LDSB1_AF0EM8_GRVW2_LBSPP128_LPA8_LPB8_PLR5_SU32_SUS128_SRVW4_TT4_128_WG64_4_1_WGM1
    SolutionIndex: 62
    SolutionNameMin: Cijk_Alik_Bljk_HBH_MT256x160x64_MI32x32x8x1_SE_1LDSB1_AF0EM8_GRVW2_LBSPP128_LPA8_LPB8_PLR9_SU32_SUS128_SRVW4_TT2_160_WG128_2_1_WGM1
    SolutionIndex: 63
    SolutionNameMin: Cijk_Alik_Bljk_HBH_MT128x96x32_MI32x32x8x1_SE_1LDSB1_AF0EM8_GRVW4_LBSPP128_LPA8_LPB8_PLR5_SU32_SUS128_SRVW4_TT1_96_WG128_2_1_WGM1
    SolutionIndex: 64
    SolutionNameMin: Cijk_Alik_Bljk_HBH_MT64x64x64_MI32x32x8x1_SE_1LDSB1_AF0EM8_GRVW4_LBSPP128_LPA8_LPB8_PLR9_SU32_SUS128_SRVW4_TT1_32_WG64_4_1_WGM1
    SolutionIndex: 65
    SolutionNameMin: Cijk_Alik_Bljk_HBH_MT64x64x32_MI32x32x8x1_SE_1LDSB1_AF0EM8_GRVW8_LBSPP128_LPA8_LPB8_PLR5_SU32_SUS128_SRVW4_TT1_32_WG64_4_1_WGM1
    SolutionIndex: 66
    SolutionNameMin: Cijk_Alik_Bljk_HBH_MT128x128x32_MI32x32x8x1_SE_1LDSB1_AF0EM8_GRVW8_LBSPP128_LPA8_LPB8_PLR5_SU32_SUS128_SRVW4_TT2_64_WG64_4_1_WGM1
    SolutionIndex: 67
    SolutionNameMin: Cijk_Alik_Bljk_HBH_MT128x256x32_MI32x32x8x1_SE_1LDSB1_AF0EM8_GRVW8_LBSPP128_LPA8_LPB8_PLR5_SU32_SUS128_SRVW4_TT2_128_WG64_4_1_WGM1
    SolutionIndex: 68
    SolutionNameMin: Cijk_Alik_Bljk_HBH_MT64x64x64_MI32x32x8x1_SE_1LDSB1_AF0EM8_GRVW8_LBSPP128_LPA8_LPB8_PLR9_SU32_SUS128_SRVW4_TT1_32_WG64_4_1_WGM1
    SolutionIndex: 69
    SolutionNameMin: Cijk_Alik_Bljk_HBH_MT64x128x64_MI32x32x8x1_SE_1LDSB1_AF0EM8_GRVW8_LBSPP128_LPA8_LPB8_PLR9_SU32_SUS128_SRVW4_TT1_64_WG64_4_1_WGM1
    SolutionIndex: 70
    SolutionNameMin: Cijk_Alik_Bljk_HBH_MT128x128x64_MI32x32x8x1_SE_1LDSB1_AF0EM8_GRVW8_LBSPP128_LPA8_LPB8_PLR9_SU32_SUS128_SRVW4_TT2_64_WG64_4_1_WGM1
    SolutionIndex: 71
    SolutionNameMin: Cijk_Alik_Bljk_HBH_MT256x256x32_MI32x32x8x1_SE_1LDSB1_AF0EM8_GRVW2_LBSPP128_LPA8_LPB8_PLR5_SU32_SUS256_SRVW4_TT4_128_WG64_4_1_WGM1
    SolutionIndex: 72
    SolutionNameMin: Cijk_Alik_Bljk_HBH_MT144x256x64_MI16x16x16x1_SE_1LDSB1_AF0EM8_GRVW2_LBSPP128_LPA16_LPB16_PLR5_SU32_SUS256_SRVW0_TT9_64_WG16_16_1_WGM1
    SolutionIndex: 73
    SolutionNameMin: Cijk_Alik_Bljk_HBH_MT256x128x64_MI32x32x8x1_SE_1LDSB1_AF0EM8_GRVW4_LBSPP128_LPA8_LPB8_PLR9_SU32_SUS256_SRVW4_TT4_64_WG64_4_1_WGM1
    SolutionIndex: 74
    SolutionNameMin: Cijk_Alik_Bljk_HBH_MT64x64x32_MI32x32x8x1_SE_1LDSB1_AF0EM8_GRVW8_LBSPP128_LPA8_LPB8_PLR5_SU32_SUS256_SRVW4_TT1_32_WG64_4_1_WGM1
    SolutionIndex: 75
    SolutionNameMin: Cijk_Alik_Bljk_HBH_MT128x128x32_MI32x32x8x1_SE_1LDSB1_AF0EM8_GRVW8_LBSPP128_LPA8_LPB8_PLR5_SU32_SUS256_SRVW4_TT2_64_WG64_4_1_WGM1
    SolutionIndex: 76
    SolutionNameMin: Cijk_Alik_Bljk_HBH_MT64x32x64_MI16x16x16x1_SE_1LDSB1_AF0EM8_GRVW8_LBSPP128_LPA16_LPB16_PLR5_SU32_SUS256_SRVW4_TT2_16_WG32_8_1_WGM1
    SolutionIndex: 77
    SolutionNameMin: Cijk_Alik_Bljk_HBH_MT64x128x64_MI32x32x8x1_SE_1LDSB1_AF0EM8_GRVW8_LBSPP128_LPA8_LPB8_PLR9_SU32_SUS256_SRVW4_TT1_64_WG64_4_1_WGM1
    SolutionIndex: 78
    SolutionNameMin: Cijk_Alik_Bljk_HBH_MT128x128x64_MI32x32x8x1_SE_1LDSB1_AF0EM8_GRVW8_LBSPP128_LPA8_LPB8_PLR9_SU32_SUS256_SRVW4_TT2_64_WG64_4_1_WGM1
    SolutionIndex: 79
    SolutionNameMin: Cijk_Alik_Bljk_HBH_MT32x64x32_MI16x16x16x1_SE_1LDSB1_AF0EM8_GRVW2_LBSPP128_LPA16_LPB16_PLR2_SU0_SUS256_SRVW4_TT1_32_WG32_8_1_WGM2
    SolutionIndex: 80
    SolutionNameMin: Cijk_Alik_Bljk_HBH_MT128x256x32_MI32x32x8x1_SE_1LDSB1_AF0EM8_GRVW2_LBSPP128_LPA8_LPB8_PLR5_SU0_SUS256_SRVW4_TT2_128_WG64_4_1_WGM2
    SolutionIndex: 81
    SolutionNameMin: Cijk_Alik_Bljk_HBH_MT256x256x32_MI32x32x8x1_SE_1LDSB1_AF0EM8_GRVW2_LBSPP128_LPA8_LPB8_PLR5_SU0_SUS256_SRVW4_TT4_128_WG64_4_1_WGM2
    SolutionIndex: 82
    SolutionNameMin: Cijk_Alik_Bljk_HBH_MT128x96x32_MI32x32x8x1_SE_1LDSB1_AF0EM8_GRVW2_LBSPP128_LPA8_LPB8_PLR5_SU0_SUS256_SRVW4_TT1_96_WG128_2_1_WGM2
    SolutionIndex: 83
    SolutionNameMin: Cijk_Alik_Bljk_HBH_MT128x160x32_MI32x32x8x1_SE_1LDSB1_AF0EM8_GRVW2_LBSPP128_LPA8_LPB8_PLR5_SU0_SUS256_SRVW4_TT1_160_WG128_2_1_WGM2
    SolutionIndex: 84
    SolutionNameMin: Cijk_Alik_Bljk_HBH_MT160x160x64_MI16x16x16x1_SE_1LDSB1_AF0EM8_GRVW2_LBSPP128_LPA16_LPB16_PLR5_SU0_SUS256_SRVW0_TT5_80_WG32_8_1_WGM2
    SolutionIndex: 85
    SolutionNameMin: Cijk_Alik_Bljk_HBH_MT128x144x64_MI16x16x16x1_SE_1LDSB1_AF0EM8_GRVW2_LBSPP128_LPA16_LPB16_PLR5_SU0_SUS256_SRVW4_TT2_144_WG64_4_1_WGM2
    SolutionIndex: 86
    SolutionNameMin: Cijk_Alik_Bljk_HBH_MT256x144x64_MI16x16x16x1_SE_1LDSB1_AF0EM8_GRVW2_LBSPP128_LPA16_LPB16_PLR5_SU0_SUS256_SRVW4_TT4_144_WG64_4_1_WGM2
    SolutionIndex: 87
    SolutionNameMin: Cijk_Alik_Bljk_HBH_MT128x256x64_MI32x32x8x1_SE_1LDSB1_AF0EM8_GRVW2_LBSPP128_LPA8_LPB8_PLR9_SU0_SUS256_SRVW4_TT2_128_WG64_4_1_WGM2
    SolutionIndex: 88
    SolutionNameMin: Cijk_Alik_Bljk_HBH_MT256x160x64_MI32x32x8x1_SE_1LDSB1_AF0EM8_GRVW2_LBSPP128_LPA8_LPB8_PLR9_SU0_SUS256_SRVW4_TT2_160_WG128_2_1_WGM2
    SolutionIndex: 89
    SolutionNameMin: Cijk_Alik_Bljk_HBH_MT128x128x32_MI32x32x8x1_SE_1LDSB1_AF0EM8_GRVW4_LBSPP128_LPA8_LPB8_PLR5_SU0_SUS256_SRVW4_TT2_64_WG64_4_1_WGM2
    SolutionIndex: 90
    SolutionNameMin: Cijk_Alik_Bljk_HBH_MT128x256x32_MI32x32x8x1_SE_1LDSB1_AF0EM8_GRVW4_LBSPP128_LPA8_LPB8_PLR5_SU0_SUS256_SRVW4_TT2_128_WG64_4_1_WGM2
    SolutionIndex: 91
    SolutionNameMin: Cijk_Alik_Bljk_HBH_MT128x160x32_MI32x32x8x1_SE_1LDSB1_AF0EM8_GRVW4_LBSPP128_LPA8_LPB8_PLR5_SU0_SUS256_SRVW4_TT1_160_WG128_2_1_WGM2
    SolutionIndex: 92
    SolutionNameMin: Cijk_Alik_Bljk_HBH_MT64x64x64_MI32x32x8x1_SE_1LDSB1_AF0EM8_GRVW4_LBSPP128_LPA8_LPB8_PLR9_SU0_SUS256_SRVW4_TT1_32_WG64_4_1_WGM2
    SolutionIndex: 93
    SolutionNameMin: Cijk_Alik_Bljk_HBH_MT128x256x64_MI32x32x8x1_SE_1LDSB1_AF0EM8_GRVW4_LBSPP128_LPA8_LPB8_PLR9_SU0_SUS256_SRVW4_TT2_128_WG64_4_1_WGM2
    SolutionIndex: 94
    SolutionNameMin: Cijk_Alik_Bljk_HBH_MT128x96x64_MI32x32x8x1_SE_1LDSB1_AF0EM8_GRVW4_LBSPP128_LPA8_LPB8_PLR9_SU0_SUS256_SRVW4_TT1_96_WG128_2_1_WGM2
    SolutionIndex: 95
    SolutionNameMin: Cijk_Alik_Bljk_HBH_MT128x288x64_MI32x32x8x1_SE_1LDSB1_AF0EM8_GRVW4_LBSPP128_LPA8_LPB8_PLR9_SU0_SUS256_SRVW4_TT1_288_WG128_2_1_WGM2
    SolutionIndex: 96
    SolutionNameMin: Cijk_Alik_Bljk_HBH_MT128x256x32_MI32x32x8x1_SE_1LDSB1_AF0EM8_GRVW8_LBSPP128_LPA8_LPB8_PLR5_SU0_SUS256_SRVW4_TT2_128_WG64_4_1_WGM2
    SolutionIndex: 97
    SolutionNameMin: Cijk_Alik_Bljk_HBH_MT64x128x64_MI32x32x8x1_SE_1LDSB1_AF0EM8_GRVW8_LBSPP128_LPA8_LPB8_PLR9_SU0_SUS256_SRVW4_TT1_64_WG64_4_1_WGM2
    SolutionIndex: 98
    SolutionNameMin: Cijk_Alik_Bljk_HBH_MT128x64x64_MI32x32x8x1_SE_1LDSB1_AF0EM8_GRVW8_LBSPP128_LPA8_LPB8_PLR9_SU0_SUS256_SRVW4_TT2_32_WG64_4_1_WGM2
    SolutionIndex: 99
    SolutionNameMin: Cijk_Alik_Bljk_HBH_MT128x128x64_MI32x32x8x1_SE_1LDSB1_AF0EM8_GRVW8_LBSPP128_LPA8_LPB8_PLR9_SU0_SUS256_SRVW4_TT2_64_WG64_4_1_WGM2
    SolutionIndex: 100
    SolutionNameMin: Cijk_Alik_Bljk_HBH_MT128x96x64_MI32x32x8x1_SE_1LDSB1_AF0EM8_GRVW8_LBSPP128_LPA8_LPB8_PLR9_SU0_SUS256_SRVW4_TT1_96_WG128_2_1_WGM2
    SolutionIndex: 101
    SolutionNameMin: Cijk_Alik_Bljk_HBH_MT128x160x64_MI32x32x8x1_SE_1LDSB1_AF0EM8_GRVW8_LBSPP128_LPA8_LPB8_PLR9_SU0_SUS256_SRVW4_TT1_160_WG128_2_1_WGM2
    SolutionIndex: 102
    SolutionNameMin: Cijk_Alik_Bljk_HBH_MT256x256x32_MI32x32x8x1_SE_1LDSB1_AF0EM8_GRVW2_LBSPP128_LPA8_LPB8_PLR5_SU32_SUS128_SRVW4_TT4_128_WG64_4_1_WGM2
    SolutionIndex: 103
    SolutionNameMin: Cijk_Alik_Bljk_HBH_MT256x144x64_MI16x16x16x1_SE_1LDSB1_AF0EM8_GRVW2_LBSPP128_LPA16_LPB16_PLR5_SU32_SUS128_SRVW4_TT4_144_WG64_4_1_WGM2
    SolutionIndex: 104
    SolutionNameMin: Cijk_Alik_Bljk_HBH_MT144x256x64_MI16x16x16x1_SE_1LDSB1_AF0EM8_GRVW2_LBSPP128_LPA16_LPB16_PLR5_SU32_SUS128_SRVW0_TT9_64_WG16_16_1_WGM2
    SolutionIndex: 105
    SolutionNameMin: Cijk_Alik_Bljk_HBH_MT256x160x64_MI32x32x8x1_SE_1LDSB1_AF0EM8_GRVW2_LBSPP128_LPA8_LPB8_PLR9_SU32_SUS128_SRVW4_TT2_160_WG128_2_1_WGM2
    SolutionIndex: 106
    SolutionNameMin: Cijk_Alik_Bljk_HBH_MT128x288x32_MI32x32x8x1_SE_1LDSB1_AF0EM8_GRVW4_LBSPP128_LPA8_LPB8_PLR5_SU32_SUS128_SRVW4_TT1_288_WG128_2_1_WGM2
    SolutionIndex: 107
    SolutionNameMin: Cijk_Alik_Bljk_HBH_MT128x256x64_MI32x32x8x1_SE_1LDSB1_AF0EM8_GRVW4_LBSPP128_LPA8_LPB8_PLR9_SU32_SUS128_SRVW4_TT2_128_WG64_4_1_WGM2
    SolutionIndex: 108
    SolutionNameMin: Cijk_Alik_Bljk_HBH_MT128x96x64_MI32x32x8x1_SE_1LDSB1_AF0EM8_GRVW4_LBSPP128_LPA8_LPB8_PLR9_SU32_SUS128_SRVW4_TT1_96_WG128_2_1_WGM2
    SolutionIndex: 109
    SolutionNameMin: Cijk_Alik_Bljk_HBH_MT128x288x64_MI32x32x8x1_SE_1LDSB1_AF0EM8_GRVW4_LBSPP128_LPA8_LPB8_PLR9_SU32_SUS128_SRVW4_TT1_288_WG128_2_1_WGM2
    SolutionIndex: 110
    SolutionNameMin: Cijk_Alik_Bljk_HBH_MT128x160x64_MI32x32x8x1_SE_1LDSB1_AF0EM8_GRVW4_LBSPP128_LPA8_LPB8_PLR9_SU32_SUS128_SRVW4_TT1_160_WG128_2_1_WGM2
    SolutionIndex: 111
    SolutionNameMin: Cijk_Alik_Bljk_HBH_MT128x128x32_MI32x32x8x1_SE_1LDSB1_AF0EM8_GRVW8_LBSPP128_LPA8_LPB8_PLR5_SU32_SUS128_SRVW4_TT2_64_WG64_4_1_WGM2
    SolutionIndex: 112
    SolutionNameMin: Cijk_Alik_Bljk_HBH_MT128x256x32_MI32x32x8x1_SE_1LDSB1_AF0EM8_GRVW8_LBSPP128_LPA8_LPB8_PLR5_SU32_SUS128_SRVW4_TT2_128_WG64_4_1_WGM2
    SolutionIndex: 113
    SolutionNameMin: Cijk_Alik_Bljk_HBH_MT64x64x64_MI32x32x8x1_SE_1LDSB1_AF0EM8_GRVW8_LBSPP128_LPA8_LPB8_PLR9_SU32_SUS128_SRVW4_TT1_32_WG64_4_1_WGM2
    SolutionIndex: 114
    SolutionNameMin: Cijk_Alik_Bljk_HBH_MT64x128x64_MI32x32x8x1_SE_1LDSB1_AF0EM8_GRVW8_LBSPP128_LPA8_LPB8_PLR9_SU32_SUS128_SRVW4_TT1_64_WG64_4_1_WGM2
    SolutionIndex: 115
    SolutionNameMin: Cijk_Alik_Bljk_HBH_MT128x128x64_MI32x32x8x1_SE_1LDSB1_AF0EM8_GRVW8_LBSPP128_LPA8_LPB8_PLR9_SU32_SUS128_SRVW4_TT2_64_WG64_4_1_WGM2
    SolutionIndex: 116
    SolutionNameMin: Cijk_Alik_Bljk_HBH_MT128x96x64_MI32x32x8x1_SE_1LDSB1_AF0EM8_GRVW8_LBSPP128_LPA8_LPB8_PLR9_SU32_SUS128_SRVW4_TT1_96_WG128_2_1_WGM2
    SolutionIndex: 117
    SolutionNameMin: Cijk_Alik_Bljk_HBH_MT128x256x32_MI32x32x8x1_SE_1LDSB1_AF0EM8_GRVW2_LBSPP128_LPA8_LPB8_PLR5_SU32_SUS256_SRVW4_TT2_128_WG64_4_1_WGM2
    SolutionIndex: 118
    SolutionNameMin: Cijk_Alik_Bljk_HBH_MT256x256x32_MI32x32x8x1_SE_1LDSB1_AF0EM8_GRVW2_LBSPP128_LPA8_LPB8_PLR5_SU32_SUS256_SRVW4_TT4_128_WG64_4_1_WGM2
    SolutionIndex: 119
    SolutionNameMin: Cijk_Alik_Bljk_HBH_MT256x144x64_MI16x16x16x1_SE_1LDSB1_AF0EM8_GRVW2_LBSPP128_LPA16_LPB16_PLR5_SU32_SUS256_SRVW4_TT4_144_WG64_4_1_WGM2
    SolutionIndex: 120
    SolutionNameMin: Cijk_Alik_Bljk_HBH_MT144x256x64_MI16x16x16x1_SE_1LDSB1_AF0EM8_GRVW2_LBSPP128_LPA16_LPB16_PLR5_SU32_SUS256_SRVW0_TT9_64_WG16_16_1_WGM2
    SolutionIndex: 121
    SolutionNameMin: Cijk_Alik_Bljk_HBH_MT256x128x64_MI32x32x8x1_SE_1LDSB1_AF0EM8_GRVW2_LBSPP128_LPA8_LPB8_PLR9_SU32_SUS256_SRVW4_TT4_64_WG64_4_1_WGM2
    SolutionIndex: 122
    SolutionNameMin: Cijk_Alik_Bljk_HBH_MT160x128x64_MI32x32x8x1_SE_1LDSB1_AF0EM8_GRVW2_LBSPP128_LPA8_LPB8_PLR9_SU32_SUS256_SRVW0_TT5_32_WG32_8_1_WGM2
    SolutionIndex: 123
    SolutionNameMin: Cijk_Alik_Bljk_HBH_MT256x160x64_MI32x32x8x1_SE_1LDSB1_AF0EM8_GRVW2_LBSPP128_LPA8_LPB8_PLR9_SU32_SUS256_SRVW4_TT2_160_WG128_2_1_WGM2
    SolutionIndex: 124
    SolutionNameMin: Cijk_Alik_Bljk_HBH_MT128x96x64_MI32x32x8x1_SE_1LDSB1_AF0EM8_GRVW4_LBSPP128_LPA8_LPB8_PLR9_SU32_SUS256_SRVW4_TT1_96_WG128_2_1_WGM2
    SolutionIndex: 125
    SolutionNameMin: Cijk_Alik_Bljk_HBH_MT128x128x32_MI32x32x8x1_SE_1LDSB1_AF0EM8_GRVW8_LBSPP128_LPA8_LPB8_PLR5_SU32_SUS256_SRVW4_TT2_64_WG64_4_1_WGM2
    SolutionIndex: 126
    SolutionNameMin: Cijk_Alik_Bljk_HBH_MT128x256x32_MI32x32x8x1_SE_1LDSB1_AF0EM8_GRVW8_LBSPP128_LPA8_LPB8_PLR5_SU32_SUS256_SRVW4_TT2_128_WG64_4_1_WGM2
    SolutionIndex: 127
    SolutionNameMin: Cijk_Alik_Bljk_HBH_MT64x64x64_MI32x32x8x1_SE_1LDSB1_AF0EM8_GRVW8_LBSPP128_LPA8_LPB8_PLR9_SU32_SUS256_SRVW4_TT1_32_WG64_4_1_WGM2
    SolutionIndex: 128
    SolutionNameMin: Cijk_Alik_Bljk_HBH_MT64x128x64_MI32x32x8x1_SE_1LDSB1_AF0EM8_GRVW8_LBSPP128_LPA8_LPB8_PLR9_SU32_SUS256_SRVW4_TT1_64_WG64_4_1_WGM2
    SolutionIndex: 129
    SolutionNameMin: Cijk_Alik_Bljk_HBH_MT128x128x64_MI32x32x8x1_SE_1LDSB1_AF0EM8_GRVW8_LBSPP128_LPA8_LPB8_PLR9_SU32_SUS256_SRVW4_TT2_64_WG64_4_1_WGM2
    SolutionIndex: 130
    SolutionNameMin: Cijk_Alik_Bljk_HBH_MT96x128x64_MI32x32x8x1_SE_1LDSB1_AF0EM8_GRVW8_LBSPP128_LPA8_LPB8_PLR9_SU32_SUS256_SRVW0_TT3_32_WG32_8_1_WGM2
    SolutionIndex: 131
    SolutionNameMin: Cijk_Alik_Bljk_HBH_MT128x160x64_MI32x32x8x1_SE_1LDSB1_AF0EM8_GRVW8_LBSPP128_LPA8_LPB8_PLR9_SU32_SUS256_SRVW4_TT1_160_WG128_2_1_WGM2
    SolutionIndex: 132
    SolutionNameMin: Cijk_Alik_Bljk_HBH_MT32x64x32_MI16x16x16x1_SE_1LDSB1_AF0EM8_GRVW2_LBSPP128_LPA16_LPB16_PLR2_SU0_SUS256_SRVW4_TT1_32_WG32_8_1_WGM15
    SolutionIndex: 133
    SolutionNameMin: Cijk_Alik_Bljk_HBH_MT128x144x32_MI16x16x16x1_SE_1LDSB1_AF0EM8_GRVW2_LBSPP128_LPA16_LPB16_PLR2_SU0_SUS256_SRVW4_TT2_144_WG64_4_1_WGM15
    SolutionIndex: 134
    SolutionNameMin: Cijk_Alik_Bljk_HBH_MT64x64x32_MI32x32x8x1_SE_1LDSB1_AF0EM8_GRVW2_LBSPP128_LPA8_LPB8_PLR5_SU0_SUS256_SRVW4_TT1_32_WG64_4_1_WGM15
    SolutionIndex: 135
    SolutionNameMin: Cijk_Alik_Bljk_HBH_MT128x128x32_MI32x32x8x1_SE_1LDSB1_AF0EM8_GRVW2_LBSPP128_LPA8_LPB8_PLR5_SU0_SUS256_SRVW4_TT2_64_WG64_4_1_WGM15
    SolutionIndex: 136
    SolutionNameMin: Cijk_Alik_Bljk_HBH_MT256x256x32_MI32x32x8x1_SE_1LDSB1_AF0EM8_GRVW2_LBSPP128_LPA8_LPB8_PLR5_SU0_SUS256_SRVW4_TT4_128_WG64_4_1_WGM15
    SolutionIndex: 137
    SolutionNameMin: Cijk_Alik_Bljk_HBH_MT128x144x64_MI16x16x16x1_SE_1LDSB1_AF0EM8_GRVW2_LBSPP128_LPA16_LPB16_PLR5_SU0_SUS256_SRVW4_TT2_144_WG64_4_1_WGM15
    SolutionIndex: 138
    SolutionNameMin: Cijk_Alik_Bljk_HBH_MT256x144x64_MI16x16x16x1_SE_1LDSB1_AF0EM8_GRVW2_LBSPP128_LPA16_LPB16_PLR5_SU0_SUS256_SRVW4_TT4_144_WG64_4_1_WGM15
    SolutionIndex: 139
    SolutionNameMin: Cijk_Alik_Bljk_HBH_MT64x64x64_MI32x32x8x1_SE_1LDSB1_AF0EM8_GRVW2_LBSPP128_LPA8_LPB8_PLR9_SU0_SUS256_SRVW4_TT1_32_WG64_4_1_WGM15
    SolutionIndex: 140
    SolutionNameMin: Cijk_Alik_Bljk_HBH_MT128x256x64_MI32x32x8x1_SE_1LDSB1_AF0EM8_GRVW2_LBSPP128_LPA8_LPB8_PLR9_SU0_SUS256_SRVW4_TT2_128_WG64_4_1_WGM15
    SolutionIndex: 141
    SolutionNameMin: Cijk_Alik_Bljk_HBH_MT256x128x64_MI32x32x8x1_SE_1LDSB1_AF0EM8_GRVW2_LBSPP128_LPA8_LPB8_PLR9_SU0_SUS256_SRVW4_TT4_64_WG64_4_1_WGM15
    SolutionIndex: 142
    SolutionNameMin: Cijk_Alik_Bljk_HBH_MT128x160x64_MI32x32x8x1_SE_1LDSB1_AF0EM8_GRVW2_LBSPP128_LPA8_LPB8_PLR9_SU0_SUS256_SRVW4_TT1_160_WG128_2_1_WGM15
    SolutionIndex: 143
    SolutionNameMin: Cijk_Alik_Bljk_HBH_MT256x160x64_MI32x32x8x1_SE_1LDSB1_AF0EM8_GRVW2_LBSPP128_LPA8_LPB8_PLR9_SU0_SUS256_SRVW4_TT2_160_WG128_2_1_WGM15
    SolutionIndex: 144
    SolutionNameMin: Cijk_Alik_Bljk_HBH_MT128x64x32_MI32x32x8x1_SE_1LDSB1_AF0EM8_GRVW4_LBSPP128_LPA8_LPB8_PLR5_SU0_SUS256_SRVW4_TT2_32_WG64_4_1_WGM15
    SolutionIndex: 145
    SolutionNameMin: Cijk_Alik_Bljk_HBH_MT128x128x32_MI32x32x8x1_SE_1LDSB1_AF0EM8_GRVW4_LBSPP128_LPA8_LPB8_PLR5_SU0_SUS256_SRVW4_TT2_64_WG64_4_1_WGM15
    SolutionIndex: 146
    SolutionNameMin: Cijk_Alik_Bljk_HBH_MT128x96x32_MI32x32x8x1_SE_1LDSB1_AF0EM8_GRVW4_LBSPP128_LPA8_LPB8_PLR5_SU0_SUS256_SRVW4_TT1_96_WG128_2_1_WGM15
    SolutionIndex: 147
    SolutionNameMin: Cijk_Alik_Bljk_HBH_MT128x160x32_MI32x32x8x1_SE_1LDSB1_AF0EM8_GRVW4_LBSPP128_LPA8_LPB8_PLR5_SU0_SUS256_SRVW4_TT1_160_WG128_2_1_WGM15
    SolutionIndex: 148
    SolutionNameMin: Cijk_Alik_Bljk_HBH_MT64x64x64_MI32x32x8x1_SE_1LDSB1_AF0EM8_GRVW4_LBSPP128_LPA8_LPB8_PLR9_SU0_SUS256_SRVW4_TT1_32_WG64_4_1_WGM15
    SolutionIndex: 149
    SolutionNameMin: Cijk_Alik_Bljk_HBH_MT64x256x64_MI32x32x8x1_SE_1LDSB1_AF0EM8_GRVW4_LBSPP128_LPA8_LPB8_PLR9_SU0_SUS256_SRVW4_TT1_128_WG64_4_1_WGM15
    SolutionIndex: 150
    SolutionNameMin: Cijk_Alik_Bljk_HBH_MT128x96x64_MI32x32x8x1_SE_1LDSB1_AF0EM8_GRVW4_LBSPP128_LPA8_LPB8_PLR9_SU0_SUS256_SRVW4_TT1_96_WG128_2_1_WGM15
    SolutionIndex: 151
    SolutionNameMin: Cijk_Alik_Bljk_HBH_MT128x288x64_MI32x32x8x1_SE_1LDSB1_AF0EM8_GRVW4_LBSPP128_LPA8_LPB8_PLR9_SU0_SUS256_SRVW4_TT1_288_WG128_2_1_WGM15
    SolutionIndex: 152
    SolutionNameMin: Cijk_Alik_Bljk_HBH_MT128x160x64_MI32x32x8x1_SE_1LDSB1_AF0EM8_GRVW4_LBSPP128_LPA8_LPB8_PLR9_SU0_SUS256_SRVW4_TT1_160_WG128_2_1_WGM15
    SolutionIndex: 153
    SolutionNameMin: Cijk_Alik_Bljk_HBH_MT256x160x64_MI32x32x8x1_SE_1LDSB1_AF0EM8_GRVW4_LBSPP128_LPA8_LPB8_PLR9_SU0_SUS256_SRVW4_TT2_160_WG128_2_1_WGM15
    SolutionIndex: 154
    SolutionNameMin: Cijk_Alik_Bljk_HBH_MT64x128x32_MI32x32x8x1_SE_1LDSB1_AF0EM8_GRVW8_LBSPP128_LPA8_LPB8_PLR5_SU0_SUS256_SRVW4_TT1_64_WG64_4_1_WGM15
    SolutionIndex: 155
    SolutionNameMin: Cijk_Alik_Bljk_HBH_MT128x128x32_MI32x32x8x1_SE_1LDSB1_AF0EM8_GRVW8_LBSPP128_LPA8_LPB8_PLR5_SU0_SUS256_SRVW4_TT2_64_WG64_4_1_WGM15
    SolutionIndex: 156
    SolutionNameMin: Cijk_Alik_Bljk_HBH_MT128x256x32_MI32x32x8x1_SE_1LDSB1_AF0EM8_GRVW8_LBSPP128_LPA8_LPB8_PLR5_SU0_SUS256_SRVW4_TT2_128_WG64_4_1_WGM15
    SolutionIndex: 157
    SolutionNameMin: Cijk_Alik_Bljk_HBH_MT256x128x32_MI32x32x8x1_SE_1LDSB1_AF0EM8_GRVW8_LBSPP128_LPA8_LPB8_PLR5_SU0_SUS256_SRVW4_TT4_64_WG64_4_1_WGM15
    SolutionIndex: 158
    SolutionNameMin: Cijk_Alik_Bljk_HBH_MT64x64x64_MI32x32x8x1_SE_1LDSB1_AF0EM8_GRVW8_LBSPP128_LPA8_LPB8_PLR9_SU0_SUS256_SRVW4_TT1_32_WG64_4_1_WGM15
    SolutionIndex: 159
    SolutionNameMin: Cijk_Alik_Bljk_HBH_MT64x128x64_MI32x32x8x1_SE_1LDSB1_AF0EM8_GRVW8_LBSPP128_LPA8_LPB8_PLR9_SU0_SUS256_SRVW4_TT1_64_WG64_4_1_WGM15
    SolutionIndex: 160
    SolutionNameMin: Cijk_Alik_Bljk_HBH_MT128x128x64_MI32x32x8x1_SE_1LDSB1_AF0EM8_GRVW8_LBSPP128_LPA8_LPB8_PLR9_SU0_SUS256_SRVW4_TT2_64_WG64_4_1_WGM15
    SolutionIndex: 161
    SolutionNameMin: Cijk_Alik_Bljk_HBH_MT128x96x64_MI32x32x8x1_SE_1LDSB1_AF0EM8_GRVW8_LBSPP128_LPA8_LPB8_PLR9_SU0_SUS256_SRVW4_TT1_96_WG128_2_1_WGM15
    SolutionIndex: 162
    SolutionNameMin: Cijk_Alik_Bljk_HBH_MT128x160x64_MI32x32x8x1_SE_1LDSB1_AF0EM8_GRVW8_LBSPP128_LPA8_LPB8_PLR9_SU0_SUS256_SRVW4_TT1_160_WG128_2_1_WGM15
    SolutionIndex: 163
    SolutionNameMin: Cijk_Alik_Bljk_HBH_MT64x64x32_MI32x32x8x1_SE_1LDSB1_AF0EM8_GRVW2_LBSPP128_LPA8_LPB8_PLR5_SU32_SUS128_SRVW4_TT1_32_WG64_4_1_WGM15
    SolutionIndex: 164
    SolutionNameMin: Cijk_Alik_Bljk_HBH_MT128x128x32_MI32x32x8x1_SE_1LDSB1_AF0EM8_GRVW2_LBSPP128_LPA8_LPB8_PLR5_SU32_SUS128_SRVW4_TT2_64_WG64_4_1_WGM15
    SolutionIndex: 165
    SolutionNameMin: Cijk_Alik_Bljk_HBH_MT256x256x32_MI32x32x8x1_SE_1LDSB1_AF0EM8_GRVW2_LBSPP128_LPA8_LPB8_PLR5_SU32_SUS128_SRVW4_TT4_128_WG64_4_1_WGM15
    SolutionIndex: 166
    SolutionNameMin: Cijk_Alik_Bljk_HBH_MT128x160x32_MI32x32x8x1_SE_1LDSB1_AF0EM8_GRVW2_LBSPP128_LPA8_LPB8_PLR5_SU32_SUS128_SRVW4_TT1_160_WG128_2_1_WGM15
    SolutionIndex: 167
    SolutionNameMin: Cijk_Alik_Bljk_HBH_MT128x256x64_MI32x32x8x1_SE_1LDSB1_AF0EM8_GRVW2_LBSPP128_LPA8_LPB8_PLR9_SU32_SUS128_SRVW4_TT2_128_WG64_4_1_WGM15
    SolutionIndex: 168
    SolutionNameMin: Cijk_Alik_Bljk_HBH_MT128x160x32_MI32x32x8x1_SE_1LDSB1_AF0EM8_GRVW4_LBSPP128_LPA8_LPB8_PLR5_SU32_SUS128_SRVW4_TT1_160_WG128_2_1_WGM15
    SolutionIndex: 169
    SolutionNameMin: Cijk_Alik_Bljk_HBH_MT64x64x64_MI32x32x8x1_SE_1LDSB1_AF0EM8_GRVW4_LBSPP128_LPA8_LPB8_PLR9_SU32_SUS128_SRVW4_TT1_32_WG64_4_1_WGM15
    SolutionIndex: 170
    SolutionNameMin: Cijk_Alik_Bljk_HBH_MT128x128x64_MI32x32x8x1_SE_1LDSB1_AF0EM8_GRVW4_LBSPP128_LPA8_LPB8_PLR9_SU32_SUS128_SRVW4_TT2_64_WG64_4_1_WGM15
    SolutionIndex: 171
    SolutionNameMin: Cijk_Alik_Bljk_HBH_MT128x288x64_MI32x32x8x1_SE_1LDSB1_AF0EM8_GRVW4_LBSPP128_LPA8_LPB8_PLR9_SU32_SUS128_SRVW4_TT1_288_WG128_2_1_WGM15
    SolutionIndex: 172
    SolutionNameMin: Cijk_Alik_Bljk_HBH_MT128x160x64_MI32x32x8x1_SE_1LDSB1_AF0EM8_GRVW4_LBSPP128_LPA8_LPB8_PLR9_SU32_SUS128_SRVW4_TT1_160_WG128_2_1_WGM15
    SolutionIndex: 173
    SolutionNameMin: Cijk_Alik_Bljk_HBH_MT64x128x32_MI32x32x8x1_SE_1LDSB1_AF0EM8_GRVW8_LBSPP128_LPA8_LPB8_PLR5_SU32_SUS128_SRVW4_TT1_64_WG64_4_1_WGM15
    SolutionIndex: 174
    SolutionNameMin: Cijk_Alik_Bljk_HBH_MT128x128x32_MI32x32x8x1_SE_1LDSB1_AF0EM8_GRVW8_LBSPP128_LPA8_LPB8_PLR5_SU32_SUS128_SRVW4_TT2_64_WG64_4_1_WGM15
    SolutionIndex: 175
    SolutionNameMin: Cijk_Alik_Bljk_HBH_MT128x256x32_MI32x32x8x1_SE_1LDSB1_AF0EM8_GRVW8_LBSPP128_LPA8_LPB8_PLR5_SU32_SUS128_SRVW4_TT2_128_WG64_4_1_WGM15
    SolutionIndex: 176
    SolutionNameMin: Cijk_Alik_Bljk_HBH_MT32x64x64_MI16x16x16x1_SE_1LDSB1_AF0EM8_GRVW8_LBSPP128_LPA16_LPB16_PLR5_SU32_SUS128_SRVW4_TT1_32_WG32_8_1_WGM15
    SolutionIndex: 177
    SolutionNameMin: Cijk_Alik_Bljk_HBH_MT64x32x64_MI16x16x16x1_SE_1LDSB1_AF0EM8_GRVW8_LBSPP128_LPA16_LPB16_PLR5_SU32_SUS128_SRVW4_TT2_16_WG32_8_1_WGM15
    SolutionIndex: 178
    SolutionNameMin: Cijk_Alik_Bljk_HBH_MT64x64x64_MI32x32x8x1_SE_1LDSB1_AF0EM8_GRVW8_LBSPP128_LPA8_LPB8_PLR9_SU32_SUS128_SRVW4_TT1_32_WG64_4_1_WGM15
    SolutionIndex: 179
    SolutionNameMin: Cijk_Alik_Bljk_HBH_MT64x128x64_MI32x32x8x1_SE_1LDSB1_AF0EM8_GRVW8_LBSPP128_LPA8_LPB8_PLR9_SU32_SUS128_SRVW4_TT1_64_WG64_4_1_WGM15
    SolutionIndex: 180
    SolutionNameMin: Cijk_Alik_Bljk_HBH_MT128x64x64_MI32x32x8x1_SE_1LDSB1_AF0EM8_GRVW8_LBSPP128_LPA8_LPB8_PLR9_SU32_SUS128_SRVW4_TT2_32_WG64_4_1_WGM15
    SolutionIndex: 181
    SolutionNameMin: Cijk_Alik_Bljk_HBH_MT128x128x64_MI32x32x8x1_SE_1LDSB1_AF0EM8_GRVW8_LBSPP128_LPA8_LPB8_PLR9_SU32_SUS128_SRVW4_TT2_64_WG64_4_1_WGM15
    SolutionIndex: 182
    SolutionNameMin: Cijk_Alik_Bljk_HBH_MT128x96x64_MI32x32x8x1_SE_1LDSB1_AF0EM8_GRVW8_LBSPP128_LPA8_LPB8_PLR9_SU32_SUS128_SRVW4_TT1_96_WG128_2_1_WGM15
    SolutionIndex: 183
    SolutionNameMin: Cijk_Alik_Bljk_HBH_MT96x128x64_MI32x32x8x1_SE_1LDSB1_AF0EM8_GRVW8_LBSPP128_LPA8_LPB8_PLR9_SU32_SUS128_SRVW0_TT3_32_WG32_8_1_WGM15
    SolutionIndex: 184
    SolutionNameMin: Cijk_Alik_Bljk_HBH_MT128x160x64_MI32x32x8x1_SE_1LDSB1_AF0EM8_GRVW8_LBSPP128_LPA8_LPB8_PLR9_SU32_SUS128_SRVW4_TT1_160_WG128_2_1_WGM15
    SolutionIndex: 185
    SolutionNameMin: Cijk_Alik_Bljk_HBH_MT256x144x64_MI16x16x16x1_SE_1LDSB1_AF0EM8_GRVW2_LBSPP128_LPA16_LPB16_PLR5_SU32_SUS256_SRVW4_TT4_144_WG64_4_1_WGM15
    SolutionIndex: 186
    SolutionNameMin: Cijk_Alik_Bljk_HBH_MT128x128x64_MI32x32x8x1_SE_1LDSB1_AF0EM8_GRVW4_LBSPP128_LPA8_LPB8_PLR9_SU32_SUS256_SRVW4_TT2_64_WG64_4_1_WGM15
    SolutionIndex: 187
    SolutionNameMin: Cijk_Alik_Bljk_HBH_MT64x64x32_MI32x32x8x1_SE_1LDSB1_AF0EM8_GRVW8_LBSPP128_LPA8_LPB8_PLR5_SU32_SUS256_SRVW4_TT1_32_WG64_4_1_WGM15
    SolutionIndex: 188
    SolutionNameMin: Cijk_Alik_Bljk_HBH_MT128x128x32_MI32x32x8x1_SE_1LDSB1_AF0EM8_GRVW8_LBSPP128_LPA8_LPB8_PLR5_SU32_SUS256_SRVW4_TT2_64_WG64_4_1_WGM15
    SolutionIndex: 189
    SolutionNameMin: Cijk_Alik_Bljk_HBH_MT128x256x32_MI32x32x8x1_SE_1LDSB1_AF0EM8_GRVW8_LBSPP128_LPA8_LPB8_PLR5_SU32_SUS256_SRVW4_TT2_128_WG64_4_1_WGM15
    SolutionIndex: 190
    SolutionNameMin: Cijk_Alik_Bljk_HBH_MT64x64x64_MI32x32x8x1_SE_1LDSB1_AF0EM8_GRVW8_LBSPP128_LPA8_LPB8_PLR9_SU32_SUS256_SRVW4_TT1_32_WG64_4_1_WGM15
    SolutionIndex: 191
    SolutionNameMin: Cijk_Alik_Bljk_HBH_MT64x128x64_MI32x32x8x1_SE_1LDSB1_AF0EM8_GRVW8_LBSPP128_LPA8_LPB8_PLR9_SU32_SUS256_SRVW4_TT1_64_WG64_4_1_WGM15
    SolutionIndex: 192
    SolutionNameMin: Cijk_Alik_Bljk_HBH_MT128x128x64_MI32x32x8x1_SE_1LDSB1_AF0EM8_GRVW8_LBSPP128_LPA8_LPB8_PLR9_SU32_SUS256_SRVW4_TT2_64_WG64_4_1_WGM15
    SolutionIndex: 193
    SolutionNameMin: Cijk_Alik_Bljk_HBH_MT128x96x64_MI32x32x8x1_SE_1LDSB1_AF0EM8_GRVW8_LBSPP128_LPA8_LPB8_PLR9_SU32_SUS256_SRVW4_TT1_96_WG128_2_1_WGM15
    SolutionIndex: 194
    SolutionNameMin: Cijk_Alik_Bljk_HBH_MT64x128x64_MI32x32x8x1_SE_1LDSB0_AF0EM8_GRVW2_LBSPP128_LPA8_LPB8_PLR9_SU0_SUS256_SRVW0_TT1_64_WG64_4_1_WGM2
    SolutionIndex: 195
    SolutionNameMin: Cijk_Alik_Bljk_HBH_MT128x144x64_MI16x16x16x1_SE_1LDSB1_AF0EM8_GRVW2_LBSPP128_LPA16_LPB16_PLR5_SU0_SUS256_SRVW0_TT2_144_WG64_4_1_WGM1
    SolutionIndex: 196
    SolutionNameMin: Cijk_Alik_Bljk_HBH_MT144x128x64_MI16x16x16x1_SE_1LDSB1_AF0EM8_GRVW2_LBSPP128_LPA16_LPB16_PLR5_SU0_SUS256_SRVW0_TT9_32_WG16_16_1_WGM1
    SolutionIndex: 197
    SolutionNameMin: Cijk_Alik_Bljk_HBH_MT160x160x64_MI16x16x16x1_SE_1LDSB1_AF0EM8_GRVW2_LBSPP128_LPA16_LPB16_PLR5_SU0_SUS256_SRVW0_TT5_80_WG32_8_1_WGM2
    SolutionIndex: 198
    SolutionNameMin: Cijk_Alik_Bljk_HBH_MT144x128x64_MI16x16x16x1_SE_1LDSB1_AF0EM8_GRVW2_LBSPP128_LPA16_LPB16_PLR5_SU0_SUS256_SRVW0_TT9_32_WG16_16_1_WGM2
    SolutionIndex: 199
    SolutionNameMin: Cijk_Alik_Bljk_HBH_MT64x32x64_MI16x16x16x1_SE_1LDSB1_AF0EM8_GRVW2_LBSPP128_LPA16_LPB16_PLR5_SU0_SUS256_SRVW0_TT2_16_WG32_8_1_WGM1
    SolutionIndex: 200
    SolutionNameMin: Cijk_Alik_Bljk_HBH_MT128x64x64_MI32x32x8x1_SE_1LDSB1_AF0EM8_GRVW8_LBSPP128_LPA8_LPB8_PLR9_SU0_SUS256_SRVW0_TT2_32_WG64_4_1_WGM1
    SolutionIndex: 201
    SolutionNameMin: Cijk_Alik_Bljk_HBH_MT128x128x64_MI32x32x8x1_SE_1LDSB1_AF0EM8_GRVW8_LBSPP128_LPA8_LPB8_PLR9_SU0_SUS256_SRVW0_TT2_64_WG64_4_1_WGM1
    SolutionIndex: 202
    SolutionNameMin: Cijk_Alik_Bljk_HBH_MT128x128x64_MI32x32x8x1_SE_1LDSB1_AF0EM8_GRVW2_LBSPP128_LPA8_LPB8_PLR9_SU0_SUS256_SRVW0_TT2_64_WG64_4_1_WGM2
    SolutionIndex: 203
    SolutionNameMin: Cijk_Alik_Bljk_HBH_MT128x256x64_MI32x32x8x1_SE_1LDSB1_AF0EM8_GRVW2_LBSPP128_LPA8_LPB8_PLR9_SU0_SUS256_SRVW0_TT2_128_WG64_4_1_WGM2
    SolutionIndex: 204
    SolutionNameMin: Cijk_Alik_Bljk_HBH_MT64x64x64_MI32x32x8x1_SE_1LDSB1_AF0EM8_GRVW8_LBSPP128_LPA8_LPB8_PLR9_SU0_SUS256_SRVW0_TT1_32_WG64_4_1_WGM15
    SolutionIndex: 205
    SolutionNameMin: Cijk_Alik_Bljk_HBH_MT128x128x64_MI32x32x8x1_SE_1LDSB1_AF0EM8_GRVW8_LBSPP128_LPA8_LPB8_PLR9_SU32_SUS128_SRVW0_TT2_64_WG64_4_1_WGM15
    SolutionIndex: 206
    SolutionNameMin: Cijk_Alik_Bljk_HBH_MT32x64x64_MI16x16x16x1_SE_1LDSB1_AF0EM8_GRVW8_LBSPP128_LPA16_LPB16_PLR5_SU32_SUS256_SRVW0_TT1_32_WG32_8_1_WGM15
    SolutionIndex: 207
    SolutionNameMin: Cijk_Alik_Bljk_HBH_MT128x128x64_MI32x32x8x1_SE_1LDSB1_AF0EM8_GRVW8_LBSPP128_LPA8_LPB8_PLR9_SU32_SUS256_SRVW0_TT2_64_WG64_4_1_WGM15
    SolutionIndex: 208
    SolutionNameMin: Cijk_Alik_Bljk_HBH_MT32x32x64_MI16x16x16x1_SE_1LDSB0_AF0EM8_GRVW8_LBSPP128_LPA16_LPB16_PLR5_SU0_SUS256_SRVW0_TT1_16_WG32_8_1_WGM1
    SolutionIndex: 209
    SolutionNameMin: Cijk_Alik_Bljk_HBH_MT32x64x64_MI16x16x16x1_SE_1LDSB0_AF0EM8_GRVW8_LBSPP128_LPA16_LPB16_PLR5_SU0_SUS256_SRVW0_TT1_32_WG32_8_1_WGM1
    SolutionIndex: 210
    SolutionNameMin: Cijk_Alik_Bljk_HBH_MT64x32x64_MI16x16x16x1_SE_1LDSB0_AF0EM8_GRVW8_LBSPP128_LPA16_LPB16_PLR5_SU0_SUS256_SRVW0_TT2_16_WG32_8_1_WGM1
    SolutionIndex: 211
    SolutionNameMin: Cijk_Alik_Bljk_HBH_MT64x32x64_MI16x16x16x1_SE_1LDSB0_AF0EM8_GRVW8_LBSPP128_LPA16_LPB16_PLR5_SU0_SUS256_SRVW0_TT2_16_WG32_8_1_WGM2
    SolutionIndex: 212
    SolutionNameMin: Cijk_Alik_Bljk_HBH_MT32x32x64_MI16x16x16x1_SE_1LDSB0_AF0EM8_GRVW8_LBSPP128_LPA16_LPB16_PLR5_SU0_SUS256_SRVW0_TT1_16_WG32_8_1_WGM15
    SolutionIndex: 213
    SolutionNameMin: Cijk_Alik_Bljk_HBH_MT32x64x64_MI16x16x16x1_SE_1LDSB0_AF0EM8_GRVW8_LBSPP128_LPA16_LPB16_PLR5_SU0_SUS256_SRVW0_TT1_32_WG32_8_1_WGM15
    SolutionIndex: 214
    SolutionNameMin: Cijk_Alik_Bljk_HBH_MT32x32x64_MI16x16x16x1_SE_1LDSB0_AF0EM8_GRVW8_LBSPP128_LPA16_LPB16_PLR5_SU32_SUS128_SRVW0_TT1_16_WG32_8_1_WGM15
    SolutionIndex: 215
    SolutionNameMin: Cijk_Alik_Bljk_HBH_MT32x32x32_MI16x16x16x1_SE_1LDSB0_AF0EM1_GRVW2_LBSPP128_LPA16_LPB16_PLR2_SU0_SUS256_SRVW4_TT1_16_WG32_8_1_WGM1
    SolutionIndex: 216
    SolutionNameMin: Cijk_Alik_Bljk_HBH_MT32x32x64_MI16x16x16x1_SE_1LDSB0_AF0EM1_GRVW4_LBSPP128_LPA16_LPB16_PLR5_SU0_SUS256_SRVW4_TT1_16_WG32_8_1_WGM1
    SolutionIndex: 217
    SolutionNameMin: Cijk_Alik_Bljk_HBH_MT32x32x64_MI16x16x16x1_SE_1LDSB0_AF0EM1_GRVW8_LBSPP128_LPA16_LPB16_PLR5_SU0_SUS256_SRVW4_TT1_16_WG32_8_1_WGM1
    SolutionIndex: 218
    SolutionNameMin: Cijk_Alik_Bljk_HBH_MT64x32x64_MI16x16x16x1_SE_1LDSB1_AF0EM1_GRVW2_LBSPP128_LPA16_LPB16_PLR5_SU0_SUS256_SRVW4_TT2_16_WG32_8_1_WGM1
    SolutionIndex: 219
    SolutionNameMin: Cijk_Alik_Bljk_HBH_MT256x160x64_MI32x32x8x1_SE_1LDSB1_AF0EM1_GRVW2_LBSPP128_LPA8_LPB8_PLR9_SU0_SUS256_SRVW4_TT2_160_WG128_2_1_WGM1
    SolutionIndex: 220
    SolutionNameMin: Cijk_Alik_Bljk_HBH_MT32x32x32_MI16x16x16x1_SE_1LDSB1_AF0EM1_GRVW4_LBSPP128_LPA16_LPB16_PLR2_SU0_SUS256_SRVW4_TT1_16_WG32_8_1_WGM1
    SolutionIndex: 221
    SolutionNameMin: Cijk_Alik_Bljk_HBH_MT32x32x32_MI16x16x16x1_SE_1LDSB1_AF0EM1_GRVW8_LBSPP128_LPA16_LPB16_PLR2_SU0_SUS256_SRVW4_TT1_16_WG32_8_1_WGM1
    SolutionIndex: 222
    SolutionNameMin: Cijk_Alik_Bljk_HBH_MT64x64x32_MI32x32x8x1_SE_1LDSB1_AF0EM1_GRVW8_LBSPP128_LPA8_LPB8_PLR5_SU0_SUS256_SRVW4_TT1_32_WG64_4_1_WGM1
    SolutionIndex: 223
    SolutionNameMin: Cijk_Alik_Bljk_HBH_MT64x32x64_MI16x16x16x1_SE_1LDSB1_AF0EM1_GRVW8_LBSPP128_LPA16_LPB16_PLR5_SU0_SUS256_SRVW4_TT2_16_WG32_8_1_WGM1
    SolutionIndex: 224
    SolutionNameMin: Cijk_Alik_Bljk_HBH_MT64x64x32_MI32x32x8x1_SE_1LDSB1_AF0EM1_GRVW2_LBSPP128_LPA8_LPB8_PLR5_SU32_SUS128_SRVW4_TT1_32_WG64_4_1_WGM1
    SolutionIndex: 225
    SolutionNameMin: Cijk_Alik_Bljk_HBH_MT32x32x32_MI16x16x16x1_SE_1LDSB1_AF0EM1_GRVW4_LBSPP128_LPA16_LPB16_PLR2_SU32_SUS128_SRVW4_TT1_16_WG32_8_1_WGM1
    SolutionIndex: 226
    SolutionNameMin: Cijk_Alik_Bljk_HBH_MT32x32x32_MI16x16x16x1_SE_1LDSB1_AF0EM1_GRVW4_LBSPP128_LPA16_LPB16_PLR2_SU0_SUS256_SRVW4_TT1_16_WG32_8_1_WGM2
    SolutionIndex: 227
    SolutionNameMin: Cijk_Alik_Bljk_HBH_MT128x96x64_MI32x32x8x1_SE_1LDSB1_AF0EM1_GRVW8_LBSPP128_LPA8_LPB8_PLR9_SU32_SUS128_SRVW4_TT1_96_WG128_2_1_WGM2
    SolutionIndex: 228
    SolutionNameMin: Cijk_Alik_Bljk_HBH_MT256x160x64_MI32x32x8x1_SE_1LDSB1_AF0EM1_GRVW4_LBSPP128_LPA8_LPB8_PLR9_SU0_SUS256_SRVW4_TT2_160_WG128_2_1_WGM15
    SolutionIndex: 229
    SolutionNameMin: Cijk_Alik_Bljk_HBH_MT128x128x32_MI32x32x8x1_SE_1LDSB1_AF0EM1_GRVW8_LBSPP128_LPA8_LPB8_PLR5_SU0_SUS256_SRVW4_TT2_64_WG64_4_1_WGM15
    SolutionIndex: 230
    SolutionNameMin: Cijk_Alik_Bljk_HBH_MT128x160x32_MI32x32x8x1_SE_1LDSB1_AF0EM1_GRVW2_LBSPP128_LPA8_LPB8_PLR5_SU32_SUS128_SRVW4_TT1_160_WG128_2_1_WGM15
    SolutionIndex: 231
    SolutionNameMin: Cijk_Alik_Bljk_HBH_MT256x160x64_MI32x32x8x1_SE_1LDSB1_AF0EM1_GRVW2_LBSPP128_LPA8_LPB8_PLR9_SU32_SUS128_SRVW4_TT2_160_WG128_2_1_WGM15
    SolutionIndex: 232
    SolutionNameMin: Cijk_Alik_Bljk_HBH_MT128x128x32_MI32x32x8x1_SE_1LDSB1_AF0EM1_GRVW4_LBSPP128_LPA8_LPB8_PLR5_SU32_SUS128_SRVW4_TT2_64_WG64_4_1_WGM15
    SolutionIndex: 233
    SolutionNameMin: Cijk_Alik_Bljk_HBH_MT128x96x64_MI32x32x8x1_SE_1LDSB1_AF0EM1_GRVW4_LBSPP128_LPA8_LPB8_PLR9_SU32_SUS128_SRVW4_TT1_96_WG128_2_1_WGM15
    SolutionIndex: 234
    SolutionNameMin: Cijk_Alik_Bljk_HBH_MT128x256x32_MI32x32x8x1_SE_1LDSB1_AF0EM1_GRVW8_LBSPP128_LPA8_LPB8_PLR5_SU32_SUS128_SRVW4_TT2_128_WG64_4_1_WGM15
    SolutionIndex: 235
    SolutionNameMin: Cijk_Alik_Bljk_HBH_MT256x160x64_MI32x32x8x1_SE_1LDSB1_AF0EM1_GRVW2_LBSPP128_LPA8_LPB8_PLR9_SU32_SUS256_SRVW4_TT2_160_WG128_2_1_WGM15
    SolutionIndex: 236
    SolutionNameMin: Cijk_Alik_Bljk_HBH_MT128x128x32_MI32x32x8x1_SE_1LDSB1_AF0EM1_GRVW8_LBSPP128_LPA8_LPB8_PLR5_SU32_SUS256_SRVW4_TT2_64_WG64_4_1_WGM15
    SolutionIndex: 237
    SolutionNameMin: Cijk_Alik_Bljk_HBH_MT32x32x64_MI16x16x16x1_SE_1LDSB0_AF0EM1_GRVW2_LBSPP128_LPA16_LPB16_PLR5_SU0_SUS256_SRVW0_TT1_16_WG32_8_1_WGM1
    SolutionIndex: 238
    SolutionNameMin: Cijk_Alik_Bljk_HBH_MT32x32x64_MI16x16x16x1_SE_1LDSB0_AF0EM1_GRVW8_LBSPP128_LPA16_LPB16_PLR5_SU0_SUS256_SRVW0_TT1_16_WG32_8_1_WGM1
    SolutionIndex: 239
    SolutionNameMin: Cijk_Alik_Bljk_HBH_MT32x32x64_MI16x16x16x1_SE_1LDSB0_AF0EM1_GRVW8_LBSPP128_LPA16_LPB16_PLR5_SU32_SUS256_SRVW0_TT1_16_WG32_8_1_WGM2
    SolutionIndex: 240
    SolutionNameMin: Cijk_Alik_Bljk_HBH_MT32x32x64_MI16x16x16x1_SE_1LDSB0_AF0EM1_GRVW2_LBSPP128_LPA16_LPB16_PLR5_SU0_SUS256_SRVW0_TT1_16_WG32_8_1_WGM1
    SolutionIndex: 241
    SolutionNameMin: Cijk_Alik_Bljk_HBH_MT32x32x64_MI16x16x16x1_SE_1LDSB0_AF0EM1_GRVW4_LBSPP128_LPA16_LPB16_PLR5_SU0_SUS256_SRVW0_TT1_16_WG32_8_1_WGM1
    SolutionIndex: 242
    SolutionNameMin: Cijk_Alik_Bljk_HBH_MT32x32x64_MI16x16x16x1_SE_1LDSB0_AF0EM1_GRVW4_LBSPP128_LPA16_LPB16_PLR5_SU32_SUS128_SRVW0_TT1_16_WG32_8_1_WGM2
    SolutionIndex: 243
    SolutionNameMin: Cijk_Alik_Bljk_HBH_MT32x32x64_MI16x16x16x1_SE_1LDSB0_AF0EM1_GRVW8_LBSPP128_LPA16_LPB16_PLR5_SU32_SUS256_SRVW0_TT1_16_WG32_8_1_WGM2
    SolutionIndex: 244
    SolutionNameMin: Cijk_Alik_Bljk_HBH_MT32x32x64_MI16x16x16x1_SE_1LDSB0_AF0EM1_GRVW8_LBSPP128_LPA16_LPB16_PLR5_SU32_SUS256_SRVW0_TT1_16_WG32_8_1_WGM2
    SolutionIndex: 245
    SolutionNameMin: Cijk_Alik_Bljk_HBH_MT16x16x32_MI16x16x16x1_SE_1LDSB0_AF0EM1_GRVW2_LBSPP128_LPA16_LPB16_PLR2_SU0_SUS256_SRVW0_TT1_16_WG16_4_1_WGM1
    SolutionIndex: 246
    SolutionNameMin: Cijk_Alik_Bljk_HBH_MT16x16x32_MI16x16x16x1_SE_1LDSB0_AF0EM1_GRVW4_LBSPP128_LPA16_LPB16_PLR2_SU0_SUS256_SRVW0_TT1_16_WG16_4_1_WGM1
    SolutionIndex: 247
    SolutionNameMin: Cijk_Alik_Bljk_HBH_MT16x16x64_MI16x16x16x1_SE_1LDSB0_AF0EM8_GRVW8_LBSPP128_LPA16_LPB16_PLR5_SU0_SUS256_SRVW0_TT1_16_WG16_4_1_WGM1
    SolutionIndex: 248
    SolutionNameMin: Cijk_Alik_Bljk_HBH_MT16x16x128_MI16x16x16x1_SE_1LDSB0_AF0EM1_GRVW8_LBSPP256_LPA16_LPB16_PLR9_SU0_SUS256_SRVW0_TT1_16_WG16_4_1_WGM1
    SolutionIndex: 249
    SolutionNameMin: Cijk_Alik_Bljk_HBH_MT16x16x128_MI16x16x16x1_SE_1LDSB0_AF0EM8_GRVW8_LBSPP256_LPA16_LPB16_PLR9_SU0_SUS256_SRVW0_TT1_16_WG16_4_1_WGM1
    SolutionIndex: 250
    SolutionNameMin: Cijk_Alik_Bljk_HBH_MT16x16x128_MI16x16x16x1_SE_1LDSB0_AF0EM8_GRVW8_LBSPP256_LPA16_LPB16_PLR9_SU32_SUS256_SRVW0_TT1_16_WG16_4_1_WGM1
    SolutionIndex: 251
    SolutionNameMin: Cijk_Alik_Bljk_HBH_MT16x16x32_MI16x16x16x1_SE_1LDSB0_AF0EM1_GRVW2_LBSPP128_LPA16_LPB16_PLR2_SU0_SUS256_SRVW0_TT1_16_WG16_4_1_WGM2
    SolutionIndex: 252
    SolutionNameMin: Cijk_Alik_Bljk_HBH_MT16x16x128_MI16x16x16x1_SE_1LDSB0_AF0EM8_GRVW8_LBSPP256_LPA16_LPB16_PLR9_SU0_SUS256_SRVW0_TT1_16_WG16_4_1_WGM2
    SolutionIndex: 253
    SolutionNameMin: Cijk_Alik_Bljk_HBH_MT16x16x32_MI16x16x16x1_SE_1LDSB0_AF0EM1_GRVW4_LBSPP128_LPA16_LPB16_PLR2_SU0_SUS256_SRVW0_TT1_16_WG16_4_1_WGM15
    SolutionIndex: 254
    SolutionNameMin: Cijk_Alik_Bljk_HBH_MT16x16x64_MI16x16x16x1_SE_1LDSB0_AF0EM1_GRVW8_LBSPP128_LPA16_LPB16_PLR5_SU0_SUS256_SRVW0_TT1_16_WG16_4_1_WGM15
    SolutionIndex: 255
    SolutionNameMin: Cijk_Alik_Bljk_HBH_MT16x16x128_MI16x16x16x1_SE_1LDSB0_AF0EM1_GRVW8_LBSPP256_LPA16_LPB16_PLR9_SU0_SUS256_SRVW0_TT1_16_WG16_4_1_WGM15
    SolutionIndex: 256
    SolutionNameMin: Cijk_Alik_Bljk_HBH_MT16x16x128_MI16x16x16x1_SE_1LDSB0_AF0EM8_GRVW8_LBSPP256_LPA16_LPB16_PLR9_SU0_SUS256_SRVW0_TT1_16_WG16_4_1_WGM15
    SolutionIndex: 257
    SolutionNameMin: Cijk_Alik_Bljk_HBH_MT16x16x32_MI16x16x16x1_SE_1LDSB1_AF0EM1_GRVW2_LBSPP128_LPA16_LPB16_PLR2_SU0_SUS256_SRVW0_TT1_16_WG16_4_1_WGM1
    SolutionIndex: 258
    SolutionNameMin: Cijk_Alik_Bljk_HBH_MT16x16x32_MI16x16x16x1_SE_1LDSB1_AF0EM1_GRVW8_LBSPP128_LPA16_LPB16_PLR2_SU0_SUS256_SRVW0_TT1_16_WG16_4_1_WGM1
    SolutionIndex: 259
    SolutionNameMin: Cijk_Alik_Bljk_HBH_MT64x4x64_MI4x4x4x16_SE_1LDSB1_AF0EM1_GRVW8_LBSPP128_LPA8_LPB8_PLR17_SU0_SUS256_SRVW0_TT1_4_WG64_1_1_WGM1
    SolutionIndex: 260
    SolutionNameMin: Cijk_Alik_Bljk_HBH_MT16x16x32_MI16x16x16x1_SE_1LDSB1_AF0EM1_GRVW2_LBSPP128_LPA16_LPB16_PLR2_SU0_SUS256_SRVW4_TT1_16_WG16_4_1_WGM1
    SolutionIndex: 261
    SolutionNameMin: Cijk_Alik_Bljk_HBH_MT16x16x128_MI16x16x16x1_SE_1LDSB1_AF0EM1_GRVW8_LBSPP256_LPA16_LPB16_PLR9_SU0_SUS256_SRVW0_TT1_16_WG16_4_1_WGM1
    SolutionIndex: 262
    SolutionNameMin: Cijk_Alik_Bljk_HBH_MT16x16x128_MI16x16x16x1_SE_1LDSB1_AF0EM8_GRVW8_LBSPP256_LPA16_LPB16_PLR9_SU0_SUS256_SRVW0_TT1_16_WG16_4_1_WGM1
    SolutionIndex: 263
    SolutionNameMin: Cijk_Alik_Bljk_HBH_MT16x16x128_MI16x16x16x1_SE_1LDSB1_AF0EM8_GRVW8_LBSPP256_LPA16_LPB16_PLR9_SU0_SUS256_SRVW4_TT1_16_WG16_4_1_WGM1
    SolutionIndex: 264
    SolutionNameMin: Cijk_Alik_Bljk_HBH_MT16x16x32_MI16x16x16x1_SE_1LDSB1_AF0EM1_GRVW4_LBSPP128_LPA16_LPB16_PLR2_SU32_SUS256_SRVW0_TT1_16_WG16_4_1_WGM1
    SolutionIndex: 265
    SolutionNameMin: Cijk_Alik_Bljk_HBH_MT16x16x128_MI16x16x16x1_SE_1LDSB1_AF0EM8_GRVW4_LBSPP256_LPA16_LPB16_PLR9_SU32_SUS256_SRVW0_TT1_16_WG16_4_1_WGM1
    SolutionIndex: 266
    SolutionNameMin: Cijk_Alik_Bljk_HBH_MT16x16x128_MI16x16x16x1_SE_1LDSB1_AF0EM8_GRVW8_LBSPP256_LPA16_LPB16_PLR9_SU32_SUS256_SRVW0_TT1_16_WG16_4_1_WGM1
    SolutionIndex: 267
    SolutionNameMin: Cijk_Alik_Bljk_HBH_MT16x16x128_MI16x16x16x1_SE_1LDSB1_AF0EM1_GRVW8_LBSPP256_LPA16_LPB16_PLR9_SU0_SUS256_SRVW0_TT1_16_WG16_4_1_WGM2
    SolutionIndex: 268
    SolutionNameMin: Cijk_Alik_Bljk_HBH_MT16x16x128_MI16x16x16x1_SE_1LDSB1_AF0EM1_GRVW8_LBSPP256_LPA16_LPB16_PLR9_SU0_SUS256_SRVW0_TT1_16_WG16_4_1_WGM15
    SolutionIndex: 269
    SolutionNameMin: Cijk_Alik_Bljk_HBH_MT16x16x128_MI16x16x16x1_SE_1LDSB1_AF0EM8_GRVW8_LBSPP256_LPA16_LPB16_PLR9_SU0_SUS256_SRVW0_TT1_16_WG16_4_1_WGM15
    SolutionIndex: 270
    SolutionNameMin: Cijk_Alik_Bljk_HBH_MT16x16x32_MI16x16x16x1_SE_1LDSB1_AF0EM1_GRVW2_LBSPP128_LPA16_LPB16_PLR2_SU32_SUS256_SRVW0_TT1_16_WG16_4_1_WGM15
    SolutionIndex: 271
    SolutionNameMin: Cijk_Alik_Bljk_HBH_MT16x16x32_MI16x16x16x1_SE_1LDSB1_AF0EM1_GRVW2_LBSPP128_LPA16_LPB16_PLR2_SU32_SUS256_SRVW4_TT1_16_WG16_4_1_WGM15
- - - [7680, 8192, 1, 8192, 8384, 8384, 8384, 8384]
    - [81, 127581.0]
  - - [3840, 4096, 1, 4096, 4192, 4192, 4192, 4192]
    - [90, 125028.0]
  - - [1920, 2048, 1, 2048, 2080, 2080, 2080, 2080]
    - [0, 116508.0]
  - - [960, 1024, 1, 1024, 1056, 1056, 1056, 1056]
    - [19, 54471.0]
  - - [480, 512, 1, 512, 544, 544, 544, 544]
    - [7, 16215.0]
  - - [8192, 7680, 1, 8192, 8384, 8384, 8384, 8384]
    - [42, 127487.0]
  - - [4096, 3840, 1, 4096, 4192, 4192, 4192, 4192]
    - [81, 125028.0]
  - - [2048, 1920, 1, 2048, 2080, 2080, 2080, 2080]
    - [157, 116105.0]
  - - [1024, 960, 1, 1024, 1056, 1056, 1056, 1056]
    - [29, 54708.0]
  - - [512, 480, 1, 512, 544, 544, 544, 544]
    - [30, 15729.0]
  - - [8192, 8192, 1, 8192, 8384, 8384, 8384, 8384]
    - [153, 123321.0]
  - - [4096, 4096, 1, 4096, 4192, 4192, 4192, 4192]
    - [22, 115301.0]
  - - [2048, 2048, 1, 2048, 2080, 2080, 2080, 2080]
    - [119, 106734.0]
  - - [1024, 1024, 1, 1024, 1056, 1056, 1056, 1056]
    - [183, 55234.0]
  - - [512, 512, 1, 512, 544, 544, 544, 544]
    - [176, 16132.0]
  - - [512, 512, 16, 64, 512, 512, 64, 64]
    - [75, 27962.0]
  - - [512, 512, 128, 64, 512, 512, 64, 64]
    - [135, 41878.0]
  - - [1024, 1, 1, 1024, 1024, 1024, 1024, 1024]
    - [263, 135.0]
  - - [1024, 77, 1, 1024, 1024, 1024, 1024, 1024]
    - [13, 7058.0]
  - - [1024, 512, 1, 1024, 1024, 1024, 1024, 1024]
    - [68, 32420.0]
  - - [1024, 512, 1, 4096, 1024, 1024, 4096, 4096]
    - [207, 43226.0]
  - - [4096, 512, 1, 1024, 4096, 4096, 1024, 1024]
    - [44, 73746.0]
  - - [128, 128, 128, 64, 128, 128, 64, 64]
    - [74, 18641.0]
  - - [128, 128, 160, 64, 128, 128, 64, 64]
    - [54, 22075.0]
  - - [1024, 10, 1, 1024, 1024, 1024, 1024, 1024]
    - [262, 1409.0]
  - - [1024, 200, 1, 1024, 1024, 1024, 1024, 1024]
    - [36, 16591.0]
  - - [1024, 1280, 1, 1024, 1024, 1024, 1024, 1024]
    - [193, 58254.0]
  - - [1024, 1280, 1, 4096, 1024, 1024, 4096, 4096]
    - [203, 65281.0]
  - - [4096, 1280, 1, 1024, 4096, 4096, 1024, 1024]
    - [115, 80274.0]
  - - [128, 128, 624, 64, 128, 128, 64, 64]
    - [163, 26299.0]
  - - [1024, 39, 1, 1024, 1024, 1024, 1024, 1024]
    - [206, 3787.0]
  - - [1024, 780, 1, 1024, 1024, 1024, 1024, 1024]
    - [191, 44451.0]
  - - [1024, 4992, 1, 1024, 1024, 1024, 1024, 1024]
    - [100, 81281.0]
  - - [1024, 4992, 1, 4096, 1024, 1024, 4096, 4096]
    - [43, 89662.0]
  - - [4096, 4992, 1, 1024, 4096, 4096, 1024, 1024]
    - [145, 95520.0]
  - - [512, 512, 64, 64, 512, 512, 64, 64]
    - [145, 39827.0]
  - - [1024, 4, 1, 1024, 1024, 1024, 1024, 1024]
    - [262, 546.0]
  - - [1024, 308, 1, 1024, 1024, 1024, 1024, 1024]
    - [127, 22304.0]
  - - [1024, 2048, 1, 1024, 1024, 1024, 1024, 1024]
    - [137, 72747.0]
  - - [1024, 2048, 1, 4096, 1024, 1024, 4096, 4096]
    - [152, 81468.0]
  - - [4096, 2048, 1, 1024, 4096, 4096, 1024, 1024]
    - [72, 88012.0]
  - - [128, 128, 640, 64, 128, 128, 64, 64]
    - [65, 26297.0]
  - - [1024, 40, 1, 1024, 1024, 1024, 1024, 1024]
    - [7, 3772.0]
  - - [1024, 800, 1, 1024, 1024, 1024, 1024, 1024]
    - [179, 44620.0]
  - - [1024, 5120, 1, 1024, 1024, 1024, 1024, 1024]
    - [124, 79987.0]
  - - [1024, 5120, 1, 4096, 1024, 1024, 4096, 4096]
    - [43, 87982.0]
  - - [4096, 5120, 1, 1024, 4096, 4096, 1024, 1024]
    - [96, 99494.0]
  - - [128, 128, 656, 64, 128, 128, 64, 64]
    - [187, 26375.0]
  - - [1024, 41, 1, 1024, 1024, 1024, 1024, 1024]
    - [7, 3866.0]
  - - [1024, 820, 1, 1024, 1024, 1024, 1024, 1024]
    - [24, 45350.0]
  - - [1024, 5248, 1, 1024, 1024, 1024, 1024, 1024]
    - [100, 80641.0]
  - - [1024, 5248, 1, 4096, 1024, 1024, 4096, 4096]
    - [186, 87292.0]
  - - [4096, 5248, 1, 1024, 4096, 4096, 1024, 1024]
    - [56, 99331.0]
  - - [512, 512, 80, 64, 512, 512, 64, 64]
    - [164, 39946.0]
  - - [1024, 5, 1, 1024, 1024, 1024, 1024, 1024]
    - [252, 662.0]
  - - [1024, 385, 1, 1024, 1024, 1024, 1024, 1024]
    - [158, 28672.0]
  - - [1024, 2560, 1, 1024, 1024, 1024, 1024, 1024]
    - [43, 73584.0]
  - - [1024, 2560, 1, 4096, 1024, 1024, 4096, 4096]
    - [84, 84573.0]
  - - [4096, 2560, 1, 1024, 4096, 4096, 1024, 1024]
    - [126, 95460.0]
  - - [512, 512, 96, 64, 512, 512, 64, 64]
    - [145, 39867.0]
  - - [1024, 6, 1, 1024, 1024, 1024, 1024, 1024]
    - [256, 802.0]
  - - [1024, 462, 1, 1024, 1024, 1024, 1024, 1024]
    - [190, 31054.0]
  - - [1024, 3072, 1, 1024, 1024, 1024, 1024, 1024]
    - [155, 73477.0]
  - - [1024, 3072, 1, 4096, 1024, 1024, 4096, 4096]
    - [107, 85716.0]
  - - [4096, 3072, 1, 1024, 4096, 4096, 1024, 1024]
    - [171, 90079.0]
  - - [1024, 8, 1, 1024, 1024, 1024, 1024, 1024]
    - [250, 1070.0]
  - - [1024, 160, 1, 1024, 1024, 1024, 1024, 1024]
    - [25, 13981.0]
  - - [1024, 1024, 1, 1024, 1024, 1024, 1024, 1024]
    - [182, 48280.0]
  - - [1024, 1024, 1, 4096, 1024, 1024, 4096, 4096]
    - [32, 58483.0]
  - - [4096, 1024, 1, 1024, 4096, 4096, 1024, 1024]
    - [120, 83107.0]
  - - [128, 128, 144, 64, 128, 128, 64, 64]
    - [53, 20295.0]
  - - [1024, 9, 1, 1024, 1024, 1024, 1024, 1024]
    - [249, 1216.0]
  - - [1024, 180, 1, 1024, 1024, 1024, 1024, 1024]
    - [35, 15124.0]
  - - [1024, 1152, 1, 1024, 1024, 1024, 1024, 1024]
    - [124, 55513.0]
  - - [1024, 1152, 1, 4096, 1024, 1024, 4096, 4096]
    - [197, 61193.0]
  - - [4096, 1152, 1, 1024, 4096, 4096, 1024, 1024]
    - [161, 77235.0]
  - - [128, 32768, 1, 256, 128, 128, 256, 256]
    - [133, 47260.0]
  - - [256, 32768, 1, 512, 256, 256, 512, 512]
    - [182, 75297.0]
  - - [512, 32768, 1, 13, 512, 512, 13, 13]
    - [155, 7251.0]
  - - [512, 32768, 1, 1024, 512, 512, 1024, 1024]
    - [83, 94853.0]
  - - [1024, 32768, 1, 479, 1024, 1024, 479, 479]
    - [80, 70494.0]
  - - [1024, 32768, 1, 1024, 1024, 1024, 1024, 1024]
    - [56, 106101.0]
  - - [32768, 1, 1, 256, 32768, 32768, 256, 256]
    - [259, 708.0]
  - - [64, 128, 512, 128, 64, 64, 128, 128]
    - [92, 27391.0]
  - - [128, 128, 512, 64, 128, 128, 64, 64]
    - [154, 25517.0]
  - - [1024, 32, 1, 1024, 1024, 1024, 1024, 131072]
    - [7, 2893.0]
  - - [1024, 4096, 1, 1024, 1024, 1024, 1024, 1024]
    - [95, 90841.0]
  - - [1024, 4096, 1, 4096, 1024, 1024, 4096, 4096]
    - [119, 99374.0]
  - - [4096, 4096, 1, 1024, 4096, 4096, 1024, 1024]
    - [96, 94519.0]
  - - [30528, 4096, 1, 1024, 30528, 30528, 1024, 1024]
    - [175, 113739.0]
  - - [64, 512, 64, 512, 64, 64, 512, 512]
    - [127, 37915.0]
  - - [1024, 4, 1, 1024, 1024, 1024, 1024, 524288]
    - [250, 546.0]
  - - [30528, 2048, 1, 1024, 30528, 30528, 1024, 1024]
    - [112, 109822.0]
  - - [1024, 8192, 1, 1024, 1024, 1024, 1024, 1024]
    - [109, 86522.0]
  - - [1024, 8192, 1, 4096, 1024, 1024, 4096, 4096]
    - [185, 101921.0]
  - - [1024, 9600, 1, 1024, 1024, 1024, 1024, 1024]
    - [48, 102051.0]
  - - [1024, 9600, 1, 4096, 1024, 1024, 4096, 4096]
    - [143, 120094.0]
  - - [4096, 8192, 1, 1024, 4096, 4096, 1024, 1024]
    - [96, 105657.0]
  - - [4096, 9600, 1, 1024, 4096, 4096, 1024, 1024]
    - [123, 105428.0]
  - - [33712, 8192, 1, 1024, 33712, 33712, 1024, 1024]
    - [175, 116064.0]
  - - [33712, 9600, 1, 1024, 33712, 33712, 1024, 1024]
    - [175, 114513.0]
  - - [1024, 10064, 1, 1024, 1024, 1024, 1024, 1024]
    - [56, 89857.0]
  - - [1024, 10064, 1, 4096, 1024, 1024, 4096, 4096]
    - [156, 102216.0]
  - - [1024, 10080, 1, 1024, 1024, 1024, 1024, 1024]
    - [56, 89816.0]
  - - [1024, 10080, 1, 4096, 1024, 1024, 4096, 4096]
    - [96, 103158.0]
  - - [1024, 10200, 1, 1024, 1024, 1024, 1024, 1024]
    - [175, 88421.0]
  - - [1024, 10200, 1, 4096, 1024, 1024, 4096, 4096]
    - [156, 100672.0]
  - - [1024, 3840, 1, 1024, 1024, 1024, 1024, 1024]
    - [87, 93902.0]
  - - [1024, 3840, 1, 4096, 1024, 1024, 4096, 4096]
    - [87, 105076.0]
  - - [1024, 3968, 1, 1024, 1024, 1024, 1024, 1024]
    - [103, 83482.0]
  - - [1024, 3968, 1, 4096, 1024, 1024, 4096, 4096]
    - [103, 97487.0]
  - - [1024, 6528, 1, 1024, 1024, 1024, 1024, 1024]
    - [175, 84051.0]
  - - [1024, 6528, 1, 4096, 1024, 1024, 4096, 4096]
    - [71, 99637.0]
  - - [1024, 7104, 1, 1024, 1024, 1024, 1024, 1024]
    - [118, 92009.0]
  - - [1024, 7104, 1, 4096, 1024, 1024, 4096, 4096]
    - [102, 113104.0]
  - - [1024, 7200, 1, 1024, 1024, 1024, 1024, 1024]
    - [96, 93253.0]
  - - [1024, 7200, 1, 4096, 1024, 1024, 4096, 4096]
    - [81, 109037.0]
  - - [1024, 8064, 1, 1024, 1024, 1024, 1024, 1024]
    - [171, 90883.0]
  - - [1024, 8064, 1, 4096, 1024, 1024, 4096, 4096]
    - [119, 102171.0]
  - - [1024, 8160, 1, 1024, 1024, 1024, 1024, 1024]
    - [48, 89878.0]
  - - [1024, 8160, 1, 4096, 1024, 1024, 4096, 4096]
    - [88, 104016.0]
  - - [1024, 9216, 1, 1024, 1024, 1024, 1024, 1024]
    - [147, 91443.0]
  - - [1024, 9216, 1, 4096, 1024, 1024, 4096, 4096]
    - [62, 115153.0]
  - - [1024, 9520, 1, 1024, 1024, 1024, 1024, 1024]
    - [88, 92498.0]
  - - [1024, 9520, 1, 4096, 1024, 1024, 4096, 4096]
    - [48, 115886.0]
  - - [4096, 10064, 1, 1024, 4096, 4096, 1024, 1024]
    - [96, 105360.0]
  - - [4096, 10080, 1, 1024, 4096, 4096, 1024, 1024]
    - [175, 105338.0]
  - - [4096, 10200, 1, 1024, 4096, 4096, 1024, 1024]
    - [175, 106571.0]
  - - [4096, 3840, 1, 1024, 4096, 4096, 1024, 1024]
    - [118, 106804.0]
  - - [4096, 3968, 1, 1024, 4096, 4096, 1024, 1024]
    - [147, 96942.0]
  - - [4096, 6528, 1, 1024, 4096, 4096, 1024, 1024]
    - [175, 102934.0]
  - - [4096, 7104, 1, 1024, 4096, 4096, 1024, 1024]
    - [56, 101569.0]
  - - [4096, 7200, 1, 1024, 4096, 4096, 1024, 1024]
    - [48, 106967.0]
  - - [4096, 8064, 1, 1024, 4096, 4096, 1024, 1024]
    - [96, 103143.0]
  - - [4096, 8160, 1, 1024, 4096, 4096, 1024, 1024]
    - [48, 104986.0]
  - - [4096, 9216, 1, 1024, 4096, 4096, 1024, 1024]
    - [96, 107255.0]
  - - [4096, 9520, 1, 1024, 4096, 4096, 1024, 1024]
    - [88, 106219.0]
  - - [42720, 10080, 1, 1024, 42720, 42720, 1024, 1024]
    - [175, 114939.0]
  - - [42720, 3968, 1, 1024, 42720, 42720, 1024, 1024]
    - [175, 113103.0]
  - - [42720, 6528, 1, 1024, 42720, 42720, 1024, 1024]
    - [175, 113932.0]
  - - [42720, 7104, 1, 1024, 42720, 42720, 1024, 1024]
    - [175, 116696.0]
  - - [42720, 7200, 1, 1024, 42720, 42720, 1024, 1024]
    - [175, 113867.0]
  - - [42720, 9520, 1, 1024, 42720, 42720, 1024, 1024]
    - [175, 113815.0]
  - - [24, 24, 4736, 64, 24, 24, 303104, 303104]
    - [52, 6884.0]
  - - [32, 32, 4608, 64, 32, 32, 294912, 294912]
    - [49, 8658.0]
  - - [32, 35, 4608, 64, 32, 32, 294912, 294912]
    - [79, 8898.0]
  - - [64, 512, 1, 512, 64, 64, 512, 512]
    - [15, 2280.0]
  - - [512, 512, 1, 64, 512, 512, 64, 64]
    - [76, 4112.0]
  - - [128, 128, 1, 64, 128, 128, 64, 64]
    - [6, 262.0]
  - - [1024, 8, 1, 1024, 1024, 1024, 1024, 131072]
    - [256, 1092.0]
  - - [64, 128, 1, 128, 64, 64, 128, 128]
    - [6, 218.0]
  - - [2048, 512, 1, 2048, 2048, 2048, 2048, 2048]
    - [39, 55924.0]
  - - [1024, 512, 1, 1600, 1024, 1024, 1600, 1600]
    - [178, 39870.0]
  - - [2048, 512, 1, 74, 2048, 2048, 74, 74]
    - [134, 9326.0]
  - - [512, 1, 1, 2048, 512, 512, 2048, 2048]
    - [213, 122.0]
  - - [64, 512, 1, 1024, 64, 64, 1024, 1024]
    - [27, 3039.0]
  - - [1024, 1600, 1, 560, 1024, 1024, 560, 560]
    - [14, 40383.0]
  - - [1600, 1, 1, 1024, 1600, 1600, 1024, 1024]
    - [250, 216.0]
  - - [512, 1600, 1, 512, 512, 512, 512, 512]
    - [38, 34493.0]
  - - [1024, 1600, 1, 1024, 1024, 1024, 1024, 1024]
    - [181, 63358.0]
  - - [32, 1600, 1, 512, 32, 32, 512, 512]
    - [6, 3449.0]
  - - [64, 960, 1, 1024, 64, 64, 1024, 1024]
    - [12, 5500.0]
  - - [200, 1, 1, 1024, 200, 200, 1024, 1024]
    - [249, 27.0]
  - - [256, 684, 1, 1024, 256, 256, 1024, 1024]
    - [36, 14460.0]
  - - [256, 1280, 1, 1024, 256, 256, 1024, 1024]
    - [68, 23432.0]
  - - [256, 1536, 1, 1024, 256, 256, 1024, 1024]
    - [139, 27655.0]
  - - [256, 2304, 1, 1024, 256, 256, 1024, 1024]
    - [178, 34162.0]
  - - [256, 2560, 1, 1024, 256, 256, 1024, 1024]
    - [31, 36954.0]
  - - [256, 2816, 1, 1024, 256, 256, 1024, 1024]
    - [31, 40471.0]
  - - [256, 3328, 1, 1024, 256, 256, 1024, 1024]
    - [180, 46013.0]
  - - [256, 3584, 1, 1024, 256, 256, 1024, 1024]
    - [159, 48329.0]
  - - [256, 4608, 1, 1024, 256, 256, 1024, 1024]
    - [116, 53927.0]
  - - [256, 4864, 1, 1024, 256, 256, 1024, 1024]
    - [17, 54960.0]
  - - [256, 5376, 1, 1024, 256, 256, 1024, 1024]
    - [10, 62248.0]
  - - [256, 5888, 1, 1024, 256, 256, 1024, 1024]
    - [192, 62642.0]
  - - [256, 6144, 1, 1024, 256, 256, 1024, 1024]
    - [129, 64735.0]
  - - [256, 6400, 1, 1024, 256, 256, 1024, 1024]
    - [170, 66156.0]
  - - [256, 6656, 1, 1024, 256, 256, 1024, 1024]
    - [181, 69239.0]
  - - [256, 7168, 1, 1024, 256, 256, 1024, 1024]
    - [99, 76759.0]
  - - [256, 7424, 1, 1024, 256, 256, 1024, 1024]
    - [99, 79241.0]
  - - [256, 7936, 1, 1024, 256, 256, 1024, 1024]
    - [85, 72639.0]
  - - [256, 8192, 1, 1024, 256, 256, 1024, 1024]
    - [110, 67958.0]
  - - [256, 8448, 1, 1024, 256, 256, 1024, 1024]
    - [172, 68183.0]
  - - [256, 8960, 1, 1024, 256, 256, 1024, 1024]
    - [101, 82938.0]
  - - [256, 9984, 1, 1024, 256, 256, 1024, 1024]
    - [94, 67455.0]
  - - [256, 10496, 1, 1024, 256, 256, 1024, 1024]
    - [21, 71952.0]
  - - [256, 11264, 1, 1024, 256, 256, 1024, 1024]
    - [146, 74116.0]
  - - [256, 11520, 1, 1024, 256, 256, 1024, 1024]
    - [11, 69776.0]
  - - [256, 11776, 1, 1024, 256, 256, 1024, 1024]
    - [174, 70673.0]
  - - [256, 12544, 1, 1024, 256, 256, 1024, 1024]
    - [155, 74195.0]
  - - [256, 13312, 1, 1024, 256, 256, 1024, 1024]
    - [93, 80185.0]
  - - [256, 14336, 1, 1024, 256, 256, 1024, 1024]
    - [87, 88467.0]
  - - [256, 14592, 1, 1024, 256, 256, 1024, 1024]
    - [87, 90388.0]
  - - [256, 14848, 1, 1024, 256, 256, 1024, 1024]
    - [87, 91283.0]
  - - [256, 15104, 1, 1024, 256, 256, 1024, 1024]
    - [140, 93207.0]
  - - [256, 16128, 1, 1024, 256, 256, 1024, 1024]
    - [151, 88970.0]
  - - [256, 18176, 1, 1024, 256, 256, 1024, 1024]
    - [101, 80703.0]
  - - [256, 18944, 1, 1024, 256, 256, 1024, 1024]
    - [184, 84228.0]
  - - [256, 19200, 1, 1024, 256, 256, 1024, 1024]
    - [88, 102300.0]
  - - [256, 20480, 1, 1024, 256, 256, 1024, 1024]
    - [108, 80178.0]
  - - [256, 20992, 1, 1024, 256, 256, 1024, 1024]
    - [145, 80735.0]
  - - [256, 21248, 1, 1024, 256, 256, 1024, 1024]
    - [89, 81054.0]
  - - [256, 21504, 1, 1024, 256, 256, 1024, 1024]
    - [150, 82511.0]
  - - [256, 22016, 1, 1024, 256, 256, 1024, 1024]
    - [160, 83017.0]
  - - [256, 22344, 1, 1024, 256, 256, 1024, 1024]
    - [181, 81990.0]
  - - [256, 23296, 1, 1024, 256, 256, 1024, 1024]
    - [96, 77342.0]
  - - [256, 23552, 1, 1024, 256, 256, 1024, 1024]
    - [96, 77563.0]
  - - [256, 31488, 1, 1024, 256, 256, 1024, 1024]
    - [100, 86055.0]
  - - [256, 33536, 1, 1024, 256, 256, 1024, 1024]
    - [95, 85986.0]
  - - [256, 44505, 1, 1024, 256, 256, 1024, 1024]
    - [156, 90355.0]
  - - [960, 1, 1, 2048, 960, 960, 2048, 2048]
    - [212, 217.0]
  - - [1024, 200, 1, 560, 1024, 1024, 560, 560]
    - [57, 10619.0]
  - - [1024, 960, 1, 1024, 1024, 1024, 1024, 1024]
    - [29, 49539.0]
  - - [1024, 960, 1, 1600, 1024, 1024, 1600, 1600]
    - [182, 60869.0]
  - - [1024, 32768, 1, 480, 1024, 1024, 480, 480]
    - [126, 106017.0]
  - - [1280, 8976, 1, 256, 1280, 1280, 256, 256]
    - [155, 68338.0]
  - - [1792, 8976, 1, 256, 1792, 1792, 256, 256]
    - [66, 73322.0]
  - - [2048, 114, 1, 512, 2048, 2048, 512, 512]
    - [177, 13835.0]
  - - [2048, 114, 1, 768, 2048, 2048, 768, 768]
    - [177, 17109.0]
  - - [2048, 215, 1, 512, 2048, 2048, 512, 512]
    - [169, 22189.0]
  - - [2048, 215, 1, 768, 2048, 2048, 768, 768]
    - [190, 27097.0]
  - - [2048, 256, 1, 512, 2048, 2048, 512, 512]
    - [113, 25614.0]
  - - [2048, 256, 1, 768, 2048, 2048, 768, 768]
    - [68, 30690.0]
  - - [2048, 512, 1, 67, 2048, 2048, 67, 67]
    - [134, 8610.0]
  - - [2048, 512, 1, 100, 2048, 2048, 100, 100]
    - [134, 11808.0]
  - - [2048, 684, 1, 512, 2048, 2048, 512, 512]
    - [33, 41315.0]
  - - [2048, 684, 1, 768, 2048, 2048, 768, 768]
    - [99, 49807.0]
  - - [2048, 960, 1, 74, 2048, 2048, 74, 74]
    - [144, 14320.0]
  - - [2048, 960, 1, 2048, 2048, 2048, 2048, 2048]
    - [131, 78155.0]
  - - [2048, 1536, 1, 512, 2048, 2048, 512, 512]
    - [188, 67109.0]
  - - [2048, 1536, 1, 768, 2048, 2048, 768, 768]
    - [55, 76068.0]
  - - [2048, 8976, 1, 256, 2048, 2048, 256, 256]
    - [66, 71651.0]
  - - [2304, 8976, 1, 256, 2304, 2304, 256, 256]
    - [111, 77311.0]
  - - [2560, 8976, 1, 256, 2560, 2560, 256, 256]
    - [66, 75340.0]
  - - [2816, 8976, 1, 256, 2816, 2816, 256, 256]
    - [66, 78835.0]
  - - [3072, 8976, 1, 256, 3072, 3072, 256, 256]
    - [66, 77948.0]
  - - [3328, 8976, 1, 256, 3328, 3328, 256, 256]
    - [66, 79925.0]
  - - [3840, 8976, 1, 256, 3840, 3840, 256, 256]
    - [66, 78503.0]
  - - [4096, 8976, 1, 256, 4096, 4096, 256, 256]
    - [66, 75320.0]
  - - [4352, 8976, 1, 256, 4352, 4352, 256, 256]
    - [66, 78966.0]
  - - [4608, 8976, 1, 256, 4608, 4608, 256, 256]
    - [174, 78877.0]
  - - [4864, 8976, 1, 256, 4864, 4864, 256, 256]
    - [66, 78356.0]
  - - [5120, 8976, 1, 256, 5120, 5120, 256, 256]
    - [174, 79236.0]
  - - [5376, 8976, 1, 256, 5376, 5376, 256, 256]
    - [175, 79228.0]
  - - [5632, 8976, 1, 256, 5632, 5632, 256, 256]
    - [174, 79182.0]
  - - [5888, 8976, 1, 256, 5888, 5888, 256, 256]
    - [166, 78955.0]
  - - [6144, 8976, 1, 256, 6144, 6144, 256, 256]
    - [168, 78960.0]
  - - [6400, 8976, 1, 256, 6400, 6400, 256, 256]
    - [175, 80099.0]
  - - [7168, 8976, 1, 256, 7168, 7168, 256, 256]
    - [112, 81186.0]
  - - [7936, 8976, 1, 256, 7936, 7936, 256, 256]
    - [174, 79981.0]
  - - [8192, 8976, 1, 256, 8192, 8192, 256, 256]
    - [112, 80335.0]
  - - [8448, 8976, 1, 256, 8448, 8448, 256, 256]
    - [112, 82423.0]
  - - [8960, 8976, 1, 256, 8960, 8960, 256, 256]
    - [112, 81263.0]
  - - [9472, 8976, 1, 256, 9472, 9472, 256, 256]
    - [112, 81117.0]
  - - [9728, 8976, 1, 256, 9728, 9728, 256, 256]
    - [112, 82766.0]
  - - [9984, 8976, 1, 256, 9984, 9984, 256, 256]
    - [112, 81958.0]
  - - [10240, 8976, 1, 256, 10240, 10240, 256, 256]
    - [112, 82759.0]
  - - [10496, 8976, 1, 256, 10496, 10496, 256, 256]
    - [112, 82755.0]
  - - [11264, 8976, 1, 256, 11264, 11264, 256, 256]
    - [112, 83257.0]
  - - [11776, 8976, 1, 256, 11776, 11776, 256, 256]
    - [112, 83661.0]
  - - [12544, 8976, 1, 256, 12544, 12544, 256, 256]
    - [112, 83403.0]
  - - [13312, 8976, 1, 256, 13312, 13312, 256, 256]
    - [112, 83195.0]
  - - [13568, 8976, 1, 256, 13568, 13568, 256, 256]
    - [112, 83630.0]
  - - [13824, 8976, 1, 256, 13824, 13824, 256, 256]
    - [112, 83330.0]
  - - [15104, 8976, 1, 256, 15104, 15104, 256, 256]
    - [112, 84453.0]
  - - [15360, 8976, 1, 256, 15360, 15360, 256, 256]
    - [112, 82697.0]
  - - [15872, 8976, 1, 256, 15872, 15872, 256, 256]
    - [112, 83665.0]
  - - [16128, 8976, 1, 256, 16128, 16128, 256, 256]
    - [175, 83664.0]
  - - [17152, 8976, 1, 256, 17152, 17152, 256, 256]
    - [112, 83714.0]
  - - [18176, 8976, 1, 256, 18176, 18176, 256, 256]
    - [112, 84287.0]
  - - [18688, 8976, 1, 256, 18688, 18688, 256, 256]
    - [112, 84786.0]
  - - [18944, 8976, 1, 256, 18944, 18944, 256, 256]
    - [112, 84296.0]
  - - [19712, 8976, 1, 256, 19712, 19712, 256, 256]
    - [112, 84179.0]
  - - [19968, 8976, 1, 256, 19968, 19968, 256, 256]
    - [112, 83790.0]
  - - [20480, 8976, 1, 256, 20480, 20480, 256, 256]
    - [112, 83808.0]
  - - [20992, 8976, 1, 256, 20992, 20992, 256, 256]
    - [112, 84282.0]
  - - [21248, 8976, 1, 256, 21248, 21248, 256, 256]
    - [112, 84437.0]
  - - [23552, 8976, 1, 256, 23552, 23552, 256, 256]
    - [112, 84276.0]
  - - [28672, 8976, 1, 256, 28672, 28672, 256, 256]
    - [112, 84928.0]
  - - [31488, 8976, 1, 256, 31488, 31488, 256, 256]
    - [112, 84844.0]
  - - [33536, 8976, 1, 256, 33536, 33536, 256, 256]
    - [112, 85342.0]
  - - [2048, 1024, 1, 2048, 2048, 2048, 2048, 2048]
    - [172, 80854.0]
  - - [2048, 1024, 1, 8192, 2048, 2048, 8192, 8192]
    - [184, 90041.0]
  - - [2048, 2, 1, 2048, 2048, 2048, 2048, 1048576]
    - [211, 765.0]
  - - [30592, 1024, 1, 2048, 30592, 30592, 2048, 2048]
    - [118, 116596.0]
  - - [6144, 1024, 1, 2048, 6144, 6144, 2048, 2048]
    - [136, 88690.0]
  - - [8192, 1024, 1, 2048, 8192, 8192, 2048, 2048]
    - [72, 99053.0]
  - - [1024, 16, 1, 1024, 1024, 1024, 1024, 524288]
    - [249, 2255.0]
  - - [30592, 8192, 1, 1024, 30592, 30592, 1024, 1024]
    - [175, 116203.0]
  - - [3072, 8192, 1, 1024, 3072, 3072, 1024, 1024]
    - [56, 102685.0]
  - - [512, 512, 256, 64, 512, 512, 64, 64]
    - [164, 43542.0]
  - - [64, 512, 256, 512, 64, 64, 512, 512]
    - [59, 43436.0]
  - - [30592, 2048, 1, 1024, 30592, 30592, 1024, 1024]
    - [175, 110797.0]
  - - [3072, 2048, 1, 1024, 3072, 3072, 1024, 1024]
    - [126, 84858.0]
  - - [1024, 8, 1, 1024, 1024, 1024, 1024, 524288]
    - [269, 1081.0]
  - - [30592, 4096, 1, 1024, 30592, 30592, 1024, 1024]
    - [175, 112990.0]
  - - [3072, 4096, 1, 1024, 3072, 3072, 1024, 1024]
    - [151, 90636.0]
  - - [64, 512, 128, 512, 64, 64, 512, 512]
    - [58, 41298.0]
  - - [1920, 2048, 1, 2560, 1920, 1920, 2560, 2560]
    - [46, 107730.0]
  - - [2560, 2048, 1, 2560, 2560, 2560, 2560, 2560]
    - [115, 93623.0]
  - - [2560, 2048, 1, 640, 2560, 2560, 640, 640]
    - [193, 76678.0]
  - - [2560, 4, 1, 2560, 2560, 2560, 2560, 1310720]
    - [265, 1986.0]
  - - [7680, 2048, 1, 2560, 7680, 7680, 2560, 2560]
    - [42, 119808.0]
  - - [512, 512, 40, 64, 512, 512, 64, 64]
    - [89, 35696.0]
  - - [64, 512, 40, 512, 64, 64, 512, 512]
    - [59, 36003.0]
  - - [1536, 4096, 1, 1536, 1536, 1536, 1536, 1536]
    - [94, 85128.0]
  - - [1536, 4096, 1, 6144, 1536, 1536, 6144, 6144]
    - [165, 99053.0]
  - - [4608, 4096, 1, 1536, 4608, 4608, 1536, 1536]
    - [67, 106490.0]
  - - [50304, 4096, 1, 1536, 50304, 50304, 1536, 1536]
    - [112, 117373.0]
  - - [6144, 4096, 1, 1536, 6144, 6144, 1536, 1536]
    - [112, 104676.0]
  - - [1024, 1024, 64, 96, 1024, 1024, 96, 96]
    - [96, 63460.0]
  - - [96, 1024, 64, 1024, 96, 96, 1024, 1024]
    - [130, 60778.0]
  - - [1536, 8192, 1, 1536, 1536, 1536, 1536, 1536]
    - [171, 97731.0]
  - - [1536, 8192, 1, 6144, 1536, 1536, 6144, 6144]
    - [104, 111731.0]
  - - [4608, 8192, 1, 1536, 4608, 4608, 1536, 1536]
    - [118, 110839.0]
  - - [50304, 8192, 1, 1536, 50304, 50304, 1536, 1536]
    - [112, 118624.0]
  - - [6144, 8192, 1, 1536, 6144, 6144, 1536, 1536]
    - [175, 115112.0]
  - - [1024, 1024, 128, 96, 1024, 1024, 96, 96]
    - [96, 66830.0]
  - - [96, 1024, 128, 1024, 96, 96, 1024, 1024]
    - [60, 65366.0]
  - - [1024, 16384, 1, 1024, 1024, 1024, 1024, 1024]
    - [145, 93776.0]
  - - [1024, 16384, 1, 4096, 1024, 1024, 4096, 4096]
    - [138, 103568.0]
  - - [3072, 16384, 1, 1024, 3072, 3072, 1024, 1024]
    - [175, 109509.0]
  - - [4096, 16384, 1, 1024, 4096, 4096, 1024, 1024]
    - [96, 107819.0]
  - - [50304, 16384, 1, 1024, 50304, 50304, 1024, 1024]
    - [126, 115362.0]
  - - [1024, 1024, 256, 64, 1024, 1024, 64, 64]
    - [125, 48345.0]
  - - [64, 1024, 256, 1024, 64, 64, 1024, 1024]
    - [149, 51326.0]
  - - [50304, 2048, 1, 1024, 50304, 50304, 1024, 1024]
    - [175, 112295.0]
  - - [1024, 1024, 32, 64, 1024, 1024, 64, 64]
    - [66, 43296.0]
  - - [64, 1024, 32, 1024, 64, 64, 1024, 1024]
    - [64, 41943.0]
  - - [50304, 4096, 1, 1024, 50304, 50304, 1024, 1024]
    - [175, 115877.0]
  - - [1024, 1024, 64, 64, 1024, 1024, 64, 64]
    - [55, 45421.0]
  - - [64, 1024, 64, 1024, 64, 64, 1024, 1024]
    - [159, 45926.0]
  - - [50304, 8192, 1, 1024, 50304, 50304, 1024, 1024]
    - [175, 118146.0]
  - - [1024, 1024, 128, 64, 1024, 1024, 64, 64]
    - [66, 47469.0]
  - - [64, 1024, 128, 1024, 64, 64, 1024, 1024]
    - [128, 48563.0]
  - - [1024, 64, 1, 1024, 1024, 1024, 1024, 131072]
    - [34, 5907.0]
  - - [30528, 8192, 1, 1024, 30528, 30528, 1024, 1024]
    - [175, 117067.0]
  - - [128, 128, 1024, 64, 128, 128, 64, 64]
    - [58, 28376.0]
  - - [64, 128, 1024, 128, 64, 64, 128, 128]
    - [58, 25911.0]
  - - [1024, 3456, 1, 1024, 1024, 1024, 1024, 1024]
    - [167, 82964.0]
  - - [1024, 3456, 1, 480, 1024, 1024, 480, 480]
    - [26, 75297.0]
  - - [1024, 4096, 1, 480, 1024, 1024, 480, 480]
    - [106, 81180.0]
  - - [1024, 6912, 1, 1024, 1024, 1024, 1024, 1024]
    - [61, 94470.0]
  - - [1024, 6912, 1, 480, 1024, 1024, 480, 480]
    - [126, 87023.0]
  - - [1024, 864, 1, 1024, 1024, 1024, 1024, 1024]
    - [24, 46412.0]
  - - [1024, 864, 1, 480, 1024, 1024, 480, 480]
    - [5, 33812.0]
  - - [128, 3456, 1, 256, 128, 128, 256, 256]
    - [37, 16852.0]
  - - [128, 4096, 1, 256, 128, 128, 256, 256]
    - [190, 18641.0]
  - - [128, 55296, 1, 256, 128, 128, 256, 256]
    - [67, 59761.0]
  - - [128, 6912, 1, 256, 128, 128, 256, 256]
    - [128, 26459.0]
  - - [128, 864, 1, 256, 128, 128, 256, 256]
    - [2, 5282.0]
  - - [256, 3456, 1, 512, 256, 256, 512, 512]
    - [16, 37009.0]
  - - [256, 4096, 1, 512, 256, 256, 512, 512]
    - [98, 37491.0]
  - - [256, 55296, 1, 512, 256, 256, 512, 512]
    - [56, 81180.0]
  - - [256, 6912, 1, 512, 256, 256, 512, 512]
    - [160, 60237.0]
  - - [256, 864, 1, 512, 256, 256, 512, 512]
    - [28, 14156.0]
  - - [3456, 1, 1, 256, 3456, 3456, 256, 256]
    - [248, 194.0]
  - - [4096, 1, 1, 256, 4096, 4096, 256, 256]
    - [269, 218.0]
  - - [512, 3456, 1, 1024, 512, 512, 1024, 1024]
    - [99, 72131.0]
  - - [512, 3456, 1, 13, 512, 512, 13, 13]
    - [53, 3423.0]
  - - [512, 4096, 1, 1024, 512, 512, 1024, 1024]
    - [162, 67446.0]
  - - [512, 4096, 1, 13, 512, 512, 13, 13]
    - [187, 3550.0]
  - - [512, 55296, 1, 13, 512, 512, 13, 13]
    - [50, 7771.0]
  - - [512, 6912, 1, 1024, 512, 512, 1024, 1024]
    - [87, 85469.0]
  - - [512, 6912, 1, 13, 512, 512, 13, 13]
    - [173, 5089.0]
  - - [512, 864, 1, 1024, 512, 512, 1024, 1024]
    - [190, 30280.0]
  - - [512, 864, 1, 13, 512, 512, 13, 13]
    - [4, 1218.0]
  - - [6912, 1, 1, 256, 6912, 6912, 256, 256]
    - [247, 330.0]
  - - [864, 1, 1, 256, 864, 864, 256, 256]
    - [250, 43.0]
  - - [1024, 32, 1, 1024, 1024, 1024, 1024, 1024]
    - [9, 2933.0]
  - - [30528, 640, 1, 1024, 30528, 30528, 1024, 1024]
    - [143, 99596.0]
  - - [30528, 1280, 1, 1024, 30528, 30528, 1024, 1024]
    - [126, 106714.0]
  - - [1024, 64, 1, 1024, 1024, 1024, 1024, 1024]
    - [34, 5992.0]
  - - [30528, 1600, 1, 1024, 30528, 30528, 1024, 1024]
    - [143, 104271.0]
  - - [1024, 10240, 1, 1024, 1024, 1024, 1024, 1024]
    - [156, 91491.0]
  - - [1024, 80, 1, 1024, 1024, 1024, 1024, 1024]
    - [35, 7384.0]
  - - [4096, 10240, 1, 1024, 4096, 4096, 1024, 1024]
    - [175, 107095.0]
  - - [1024, 10240, 1, 4096, 1024, 1024, 4096, 4096]
    - [156, 102554.0]
  - - [64, 128, 1280, 128, 64, 64, 128, 128]
    - [113, 26338.0]
  - - [128, 128, 1280, 64, 128, 128, 64, 64]
    - [45, 28728.0]
  - - [1024, 10496, 1, 4096, 1024, 1024, 4096, 4096]
    - [156, 105037.0]
  - - [30528, 1640, 1, 1024, 30528, 30528, 1024, 1024]
    - [189, 103345.0]
  - - [1024, 82, 1, 1024, 1024, 1024, 1024, 1024]
    - [35, 7569.0]
  - - [4096, 10496, 1, 1024, 4096, 4096, 1024, 1024]
    - [117, 104419.0]
  - - [1024, 10496, 1, 1024, 1024, 1024, 1024, 1024]
    - [156, 93906.0]
  - - [64, 128, 1312, 128, 64, 64, 128, 128]
    - [58, 26214.0]
  - - [128, 128, 1312, 64, 128, 128, 64, 64]
    - [58, 28999.0]
  - - [30528, 160, 1, 1024, 30528, 30528, 1024, 1024]
    - [48, 96335.0]
  - - [1024, 12, 1, 1024, 1024, 1024, 1024, 1024]
    - [249, 1638.0]
  - - [30528, 240, 1, 1024, 30528, 30528, 1024, 1024]
    - [61, 97690.0]
  - - [1024, 6144, 1, 1024, 1024, 1024, 1024, 1024]
    - [156, 81344.0]
  - - [4096, 6144, 1, 1024, 4096, 4096, 1024, 1024]
    - [56, 101905.0]
  - - [1024, 6144, 1, 4096, 1024, 1024, 4096, 4096]
    - [102, 96098.0]
  - - [64, 512, 192, 512, 64, 64, 512, 512]
    - [77, 43065.0]
  - - [512, 512, 192, 64, 512, 512, 64, 64]
    - [135, 43019.0]
  - - [1024, 10224, 1, 1024, 1024, 1024, 1024, 1024]
    - [112, 88337.0]
  - - [1024, 10192, 1, 1024, 1024, 1024, 1024, 1024]
    - [112, 87714.0]
  - - [1024, 10208, 1, 1024, 1024, 1024, 1024, 1024]
    - [112, 87507.0]
  - - [1024, 10224, 1, 4096, 1024, 1024, 4096, 4096]
    - [156, 100437.0]
  - - [4096, 10224, 1, 1024, 4096, 4096, 1024, 1024]
    - [175, 106503.0]
  - - [3072, 10224, 1, 1024, 3072, 3072, 1024, 1024]
    - [136, 104666.0]
  - - [3072, 10240, 1, 1024, 3072, 3072, 1024, 1024]
    - [136, 110014.0]
  - - [1024, 10192, 1, 4096, 1024, 1024, 4096, 4096]
    - [156, 101184.0]
  - - [4096, 10192, 1, 1024, 4096, 4096, 1024, 1024]
    - [175, 106615.0]
  - - [3072, 10192, 1, 1024, 3072, 3072, 1024, 1024]
    - [136, 104284.0]
  - - [3072, 10200, 1, 1024, 3072, 3072, 1024, 1024]
    - [175, 104830.0]
  - - [1024, 10184, 1, 1024, 1024, 1024, 1024, 1024]
    - [112, 88517.0]
  - - [3072, 10208, 1, 1024, 3072, 3072, 1024, 1024]
    - [175, 105686.0]
  - - [1024, 10208, 1, 4096, 1024, 1024, 4096, 4096]
    - [156, 100336.0]
  - - [4096, 10208, 1, 1024, 4096, 4096, 1024, 1024]
    - [96, 106633.0]
  - - [2048, 10224, 1, 1024, 2048, 2048, 1024, 1024]
    - [83, 95651.0]
  - - [2048, 10240, 1, 1024, 2048, 2048, 1024, 1024]
    - [56, 99090.0]
  - - [1024, 10120, 1, 1024, 1024, 1024, 1024, 1024]
    - [56, 89989.0]
  - - [2048, 10192, 1, 1024, 2048, 2048, 1024, 1024]
    - [91, 96803.0]
  - - [24, 24, 6816, 64, 24, 24, 1308672, 1308672]
    - [57, 6269.0]
  - - [24, 24, 6816, 64, 24, 24, 1308672, 436224]
    - [57, 6307.0]
  - - [1024, 10152, 1, 1024, 1024, 1024, 1024, 1024]
    - [112, 89605.0]
  - - [3072, 10080, 1, 1024, 3072, 3072, 1024, 1024]
    - [175, 105753.0]
  - - [1024, 2048, 1, 49, 1024, 1024, 49, 49]
    - [41, 11367.0]
  - - [1024, 256, 1, 196, 1024, 1024, 196, 196]
    - [20, 7058.0]
  - - [1024, 512, 1, 196, 1024, 1024, 196, 196]
    - [132, 11784.0]
  - - [1152, 128, 1, 784, 1152, 1152, 784, 784]
    - [23, 10105.0]
  - - [128, 512, 1, 784, 128, 128, 784, 784]
    - [13, 4460.0]
  - - [2048, 512, 1, 49, 2048, 2048, 49, 49]
    - [134, 6981.0]
  - - [2304, 256, 1, 196, 2304, 2304, 196, 196]
    - [132, 12902.0]
  - - [256, 1024, 1, 196, 256, 256, 196, 196]
    - [3, 7058.0]
  - - [256, 128, 1, 3136, 256, 256, 3136, 3136]
    - [209, 7646.0]
  - - [256, 512, 1, 784, 256, 256, 784, 784]
    - [8, 8798.0]
  - - [256, 64, 1, 3136, 256, 256, 3136, 3136]
    - [208, 4588.0]
  - - [4608, 512, 1, 49, 4608, 4608, 49, 49]
    - [134, 12042.0]
  - - [512, 1024, 1, 196, 512, 512, 196, 196]
    - [1, 12005.0]
  - - [512, 128, 1, 784, 512, 512, 784, 784]
    - [18, 4460.0]
  - - [512, 2048, 1, 49, 512, 512, 49, 49]
    - [40, 7136.0]
  - - [512, 256, 1, 784, 512, 512, 784, 784]
    - [30, 9046.0]
  - - [576, 64, 1, 3136, 576, 576, 3136, 3136]
    - [210, 8551.0]
  - - [64, 256, 1, 3136, 64, 64, 3136, 3136]
    - [214, 4555.0]
  - - [64, 64, 1, 3136, 64, 64, 3136, 3136]
    - [214, 1123.0]
  - - [128, 128, 49, 12800, 128, 128, 12800, 12800]
    - [196, 54893.0]
  - - [128, 128, 25, 25088, 128, 128, 25088, 25088]
    - [205, 48362.0]
  - - [128, 128, 49, 25600, 128, 128, 25600, 25600]
    - [196, 58122.0]
  - - [128, 128, 25, 50176, 128, 128, 50176, 50176]
    - [201, 49942.0]
  - - [256, 256, 25, 12544, 256, 256, 12544, 12544]
    - [129, 84590.0]
  - - [256, 256, 49, 3200, 256, 256, 3200, 3200]
    - [46, 83627.0]
  - - [256, 256, 25, 6272, 256, 256, 6272, 6272]
    - [181, 82658.0]
  - - [256, 256, 49, 6400, 256, 256, 6400, 6400]
    - [47, 89983.0]
  - - [512, 512, 49, 1152, 512, 512, 1152, 1152]
    - [81, 90626.0]
  - - [512, 512, 25, 2048, 512, 512, 2048, 2048]
    - [102, 91379.0]
  - - [512, 512, 49, 2304, 512, 512, 2304, 2304]
    - [136, 97686.0]
  - - [512, 512, 25, 4096, 512, 512, 4096, 4096]
    - [118, 99834.0]
  - - [64, 128, 2048, 128, 64, 64, 128, 128]
    - [158, 26790.0]
  - - [128, 128, 2048, 64, 128, 128, 64, 64]
    - [58, 30127.0]
  - - [30528, 2560, 1, 1024, 30528, 30528, 1024, 1024]
    - [175, 111013.0]
  - - [1024, 128, 1, 1024, 1024, 1024, 1024, 1024]
    - [15, 11732.0]
  - - [64, 128, 1536, 128, 64, 64, 128, 128]
    - [58, 26421.0]
  - - [128, 128, 1536, 64, 128, 128, 64, 64]
    - [113, 29305.0]
  - - [1024, 12288, 1, 1024, 1024, 1024, 1024, 1024]
    - [171, 89727.0]
  - - [1024, 12288, 1, 4096, 1024, 1024, 4096, 4096]
    - [151, 103360.0]
  - - [30528, 1920, 1, 1024, 30528, 30528, 1024, 1024]
    - [143, 104755.0]
  - - [1024, 96, 1, 1024, 1024, 1024, 1024, 1024]
    - [15, 8988.0]
  - - [4096, 12288, 1, 1024, 4096, 4096, 1024, 1024]
    - [175, 107231.0]
  - - [128, 128, 36, 12544, 128, 128, 12544, 12544]
    - [202, 49776.0]
  - - [128, 128, 49, 9216, 128, 128, 9216, 9216]
    - [195, 52909.0]
  - - [128, 128, 64, 6400, 128, 128, 6400, 6400]
    - [78, 48377.0]
  - - [128, 128, 81, 12544, 128, 128, 12544, 12544]
    - [99, 53562.0]
  - - [128, 128, 121, 9216, 128, 128, 9216, 9216]
    - [200, 45224.0]
  - - [128, 128, 169, 6400, 128, 128, 6400, 6400]
    - [198, 54372.0]
  - - [256, 256, 36, 4096, 256, 256, 4096, 4096]
    - [141, 64804.0]
  - - [256, 256, 49, 2304, 256, 256, 2304, 2304]
    - [73, 79522.0]
  - - [256, 256, 64, 2304, 256, 256, 2304, 2304]
    - [100, 70230.0]
  - - [256, 256, 81, 4096, 256, 256, 4096, 4096]
    - [51, 81717.0]
  - - [256, 256, 121, 2304, 256, 256, 2304, 2304]
    - [94, 76126.0]
  - - [256, 256, 169, 2304, 256, 256, 2304, 2304]
    - [121, 94849.0]
  - - [512, 512, 81, 1024, 512, 512, 1024, 1024]
    - [81, 97907.0]
  - - [512, 512, 121, 1024, 512, 512, 1024, 1024]
    - [56, 94530.0]
  - - [512, 512, 169, 1024, 512, 512, 1024, 1024]
    - [81, 102119.0]
  - - [512, 512, 36, 1024, 512, 512, 1024, 1024]
    - [89, 80962.0]
  - - [512, 512, 49, 1024, 512, 512, 1024, 1024]
    - [136, 89747.0]
  - - [512, 512, 64, 1024, 512, 512, 1024, 1024]
    - [96, 88483.0]
  - - [64, 64, 36, 50176, 64, 64, 50176, 50176]
    - [199, 27113.0]
  - - [64, 64, 49, 36864, 64, 64, 36864, 36864]
    - [194, 29037.0]
  - - [64, 64, 64, 25600, 64, 64, 25600, 25600]
    - [204, 27549.0]
  - - [128, 128, 192, 64, 128, 128, 64, 64]
    - [55, 23088.0]
  - - [64, 128, 192, 128, 64, 64, 128, 128]
    - [114, 21148.0]
  - - [768, 2048, 1, 768, 768, 768, 768, 768]
    - [70, 59919.0]
  - - [3072, 2048, 1, 768, 3072, 3072, 768, 768]
    - [67, 79892.0]
  - - [768, 2048, 1, 3072, 768, 768, 3072, 3072]
    - [181, 79367.0]
  - - [768, 16, 1, 768, 768, 768, 768, 768]
    - [252, 1456.0]
  - - [384, 384, 144, 64, 384, 384, 64, 64]
    - [63, 38519.0]
  - - [64, 384, 144, 384, 64, 64, 384, 384]
    - [77, 37833.0]
  - - [768, 4608, 1, 768, 768, 768, 768, 768]
    - [46, 80890.0]
  - - [3072, 4608, 1, 768, 3072, 3072, 768, 768]
    - [118, 93079.0]
  - - [768, 4608, 1, 3072, 768, 768, 3072, 3072]
    - [140, 99049.0]
  - - [768, 12, 1, 768, 768, 768, 768, 768]
    - [262, 1005.0]
  - - [512, 512, 48, 64, 512, 512, 64, 64]
    - [145, 36472.0]
  - - [64, 512, 48, 512, 64, 64, 512, 512]
    - [97, 40105.0]
  - - [768, 4, 1, 768, 768, 768, 768, 768]
    - [249, 328.0]
  - - [128, 128, 256, 64, 128, 128, 64, 64]
    - [53, 23141.0]
  - - [64, 128, 256, 128, 64, 64, 128, 128]
    - [58, 21789.0]
  - - [1024, 16, 1, 1024, 1024, 1024, 1024, 1024]
    - [266, 2280.0]
  - - [384, 384, 192, 64, 384, 384, 64, 64]
    - [82, 39390.0]
  - - [64, 384, 192, 384, 64, 64, 384, 384]
    - [69, 37749.0]
  - - [1024, 4608, 1, 1024, 1024, 1024, 1024, 1024]
    - [184, 81951.0]
  - - [4096, 4608, 1, 1024, 4096, 4096, 1024, 1024]
    - [96, 103821.0]
  - - [1024, 4608, 1, 4096, 1024, 1024, 4096, 4096]
    - [105, 108776.0]
  - - [2880, 3072, 1, 3072, 2880, 2880, 3072, 3072]
    - [120, 109734.0]
  - - [3072, 3072, 1, 3072, 3072, 3072, 3072, 3072]
    - [48, 110181.0]
  - - [3072, 512, 1, 3072, 3072, 3072, 3072, 3072]
    - [181, 81289.0]
  - - [4096, 512, 1, 4096, 4096, 4096, 4096, 4096]
    - [122, 76750.0]
  - - [512, 1024, 1, 1024, 512, 512, 1024, 1024]
    - [148, 33222.0]
  - - [512, 2048, 1, 2048, 512, 512, 2048, 2048]
    - [10, 58997.0]
  - - [512, 3072, 1, 3072, 512, 512, 3072, 3072]
    - [192, 77832.0]
  - - [512, 4096, 1, 4096, 512, 512, 4096, 4096]
    - [142, 81344.0]
  - - [512, 8192, 1, 8192, 512, 512, 8192, 8192]
    - [86, 105449.0]
  - - [64, 1024, 1, 1024, 64, 64, 1024, 1024]
    - [25, 5825.0]
  - - [8192, 512, 1, 8192, 8192, 8192, 8192, 8192]
    - [104, 105217.0]
  - - [2, 1, 1, 1024, 2, 2, 1024, 1024]
    - [215, 0.0]
  - - [2, 8, 1, 1024, 2, 2, 1024, 1024]
    - [238, 2.0]
  - - [30522, 77, 1, 1024, 30522, 30522, 1024, 1024]
    - [227, 46785.0]
  - - [30522, 616, 1, 1024, 30522, 30522, 1024, 1024]
    - [232, 87704.0]
  - - [2, 10, 1, 1024, 2, 2, 1024, 1024]
    - [217, 2.0]
  - - [30522, 160, 1, 1024, 30522, 30522, 1024, 1024]
    - [228, 89426.0]
  - - [30522, 200, 1, 1024, 30522, 30522, 1024, 1024]
    - [234, 68063.0]
  - - [2, 39, 1, 1024, 2, 2, 1024, 1024]
    - [239, 9.0]
  - - [30522, 780, 1, 1024, 30522, 30522, 1024, 1024]
    - [230, 93333.0]
  - - [2, 4, 1, 1024, 2, 2, 1024, 1024]
    - [216, 1.0]
  - - [30522, 308, 1, 1024, 30522, 30522, 1024, 1024]
    - [219, 82361.0]
  - - [2, 40, 1, 1024, 2, 2, 1024, 1024]
    - [238, 9.0]
  - - [30522, 800, 1, 1024, 30522, 30522, 1024, 1024]
    - [235, 100110.0]
  - - [2, 41, 1, 1024, 2, 2, 1024, 1024]
    - [238, 9.0]
  - - [30522, 820, 1, 1024, 30522, 30522, 1024, 1024]
    - [236, 90267.0]
  - - [2, 5, 1, 1024, 2, 2, 1024, 1024]
    - [215, 1.0]
  - - [30522, 385, 1, 1024, 30522, 30522, 1024, 1024]
    - [230, 78340.0]
  - - [2, 6, 1, 1024, 2, 2, 1024, 1024]
    - [215, 1.0]
  - - [30522, 462, 1, 1024, 30522, 30522, 1024, 1024]
    - [231, 85542.0]
  - - [2, 9, 1, 1024, 2, 2, 1024, 1024]
    - [237, 2.0]
  - - [30522, 180, 1, 1024, 30522, 30522, 1024, 1024]
    - [233, 63240.0]
  - - [2, 32, 1, 1024, 2, 2, 1024, 1024]
    - [240, 7.0]
  - - [4, 4, 32768, 64, 4, 4, 2097152, 2097152]
    - [257, 989.0]
  - - [4, 4, 38400, 64, 4, 4, 2457600, 2457600]
    - [258, 1003.0]
  - - [14, 14, 10880, 64, 14, 14, 696320, 696320]
    - [270, 4466.0]
  - - [15, 14, 10880, 64, 15, 15, 696320, 696320]
    - [260, 4639.0]
  - - [15, 15, 7680, 64, 15, 15, 491520, 491520]
    - [271, 4518.0]
  - - [15, 15, 10880, 64, 15, 15, 696320, 696320]
    - [264, 4788.0]
  - - [17, 15, 7680, 64, 17, 17, 491520, 491520]
    - [220, 4007.0]
  - - [17, 17, 6144, 64, 17, 17, 393216, 393216]
    - [220, 3661.0]
  - - [17, 17, 7680, 64, 17, 17, 491520, 491520]
    - [220, 4461.0]
  - - [21, 17, 6144, 64, 21, 21, 393216, 393216]
    - [221, 4168.0]
  - - [21, 21, 6144, 64, 21, 21, 393216, 393216]
    - [220, 4692.0]
  - - [30, 30, 2048, 64, 30, 30, 131072, 131072]
    - [221, 6302.0]
  - - [30, 31, 2048, 64, 30, 30, 131072, 131072]
    - [221, 6402.0]
  - - [31, 31, 2048, 64, 31, 31, 131072, 131072]
    - [226, 6479.0]
  - - [34, 24, 4736, 64, 34, 34, 303104, 303104]
    - [223, 7710.0]
  - - [34, 34, 4736, 64, 34, 34, 303104, 303104]
    - [224, 8202.0]
  - - [35, 35, 4608, 64, 35, 35, 294912, 294912]
    - [224, 7867.0]
  - - [2, 2048, 1, 1024, 2, 2, 1024, 1024]
    - [267, 570.0]
  - - [2, 1024, 1, 1024, 2, 2, 1024, 1024]
    - [268, 262.0]
  - - [5, 5, 1, 64, 5, 5, 64, 64]
    - [215, 0.0]
  - - [33, 33, 1, 32, 33, 33, 32, 32]
    - [225, 7.0]
  - - [3, 3, 512, 64, 3, 3, 64, 64]
    - [251, 77.0]
  - - [5, 5, 512, 64, 5, 5, 64, 64]
    - [246, 205.0]
  - - [5, 5, 960, 64, 5, 5, 64, 64]
    - [253, 362.0]
  - - [9, 9, 512, 64, 9, 9, 64, 64]
    - [245, 638.0]
  - - [27, 27, 32768, 128, 27, 27, 128, 128]
    - [218, 11352.0]
  - - [33, 33, 1600, 32, 33, 33, 32, 32]
    - [222, 4124.0]
  - - [684, 8976, 1, 256, 684, 684, 256, 256]
    - [229, 52391.0]
  - - [44505, 8976, 1, 256, 44505, 44505, 256, 256]
    - [234, 82536.0]
  - - [2, 2, 1, 2048, 2, 2, 2048, 2048]
    - [237, 1.0]
  - - [2, 16, 1, 1024, 2, 2, 1024, 1024]
    - [241, 4.0]
  - - [2, 4, 1, 2560, 2, 2, 2560, 2560]
    - [240, 2.0]
  - - [2, 64, 1, 1024, 2, 2, 1024, 1024]
    - [242, 15.0]
  - - [2, 80, 1, 1024, 2, 2, 1024, 1024]
    - [243, 21.0]
  - - [2, 82, 1, 1024, 2, 2, 1024, 1024]
    - [267, 22.0]
  - - [2, 12, 1, 1024, 2, 2, 1024, 1024]
    - [240, 3.0]
  - - [1, 4096, 1, 256, 1, 1, 256, 256]
    - [267, 218.0]
  - - [1, 6912, 1, 256, 1, 1, 256, 256]
    - [254, 330.0]
  - - [26, 26, 6272, 64, 26, 26, 1204224, 1204224]
    - [223, 6364.0]
  - - [26, 26, 6272, 64, 26, 26, 1204224, 401408]
    - [223, 6510.0]
  - - [147, 64, 1, 12544, 147, 147, 12544, 12544]
    - [244, 8334.0]
  - - [2, 128, 1, 1024, 2, 2, 1024, 1024]
    - [261, 40.0]
  - - [2, 96, 1, 1024, 2, 2, 1024, 1024]
    - [267, 25.0]
  - - [2, 2048, 1, 768, 2, 2, 768, 768]
    - [255, 511.0]
  - - [2, 4608, 1, 768, 2, 2, 768, 768]
    - [261, 972.0]
  - - [2, 4608, 1, 1024, 2, 2, 1024, 1024]
    - [261, 1102.0]
- null
