TRAIN_3.9/logic/conv/arcturus_Cijk_Ailk_Bljk_BBH.yaml
- {MinimumRequiredVersion: 4.22.0}
- arcturus
- gfx908
- [Device 7380, Device 7388, Device 738c, Device 7390]
    SolutionIndex: 0
    SolutionNameMin: Cijk_Ailk_Bljk_BBH_MT32x64x64_MI16x16x8x1_SE_1LDSB0_GRVW4_LPB4_NLCA1_PLR9_SU0_SUS256_SRVW4_TT1_32_WG32_8_1_WGM1
    SolutionIndex: 1
    SolutionNameMin: Cijk_Ailk_Bljk_BBH_MT64x64x32_MI32x32x4x1_SE_1LDSB0_GRVW8_LPB8_NLCA1_PLR9_SU0_SUS256_SRVW4_TT1_32_WG64_4_1_WGM1
    SolutionIndex: 2
    SolutionNameMin: Cijk_Ailk_Bljk_BBH_MT64x128x32_MI32x32x4x1_SE_1LDSB0_GRVW8_LPB8_NLCA1_PLR9_SU0_SUS256_SRVW4_TT1_64_WG64_4_1_WGM1
    SolutionIndex: 3
    SolutionNameMin: Cijk_Ailk_Bljk_BBH_MT128x64x32_MI32x32x4x1_SE_1LDSB0_GRVW8_LPB8_NLCA1_PLR9_SU0_SUS256_SRVW4_TT2_32_WG64_4_1_WGM1
    SolutionIndex: 4
    SolutionNameMin: Cijk_Ailk_Bljk_BBH_MT64x128x64_MI32x32x4x1_SE_1LDSB0_GRVW8_LPB8_NLCA1_PLR17_SU0_SUS256_SRVW4_TT1_64_WG64_4_1_WGM1
    SolutionIndex: 5
    SolutionNameMin: Cijk_Ailk_Bljk_BBH_MT64x128x32_MI32x32x4x1_SE_1LDSB0_GRVW8_LPB8_NLCA1_PLR9_SU32_SUS128_SRVW4_TT1_64_WG64_4_1_WGM1
    SolutionIndex: 6
    SolutionNameMin: Cijk_Ailk_Bljk_BBH_MT64x64x32_MI32x32x4x1_SE_1LDSB0_GRVW8_LPB8_NLCA1_PLR9_SU32_SUS256_SRVW4_TT1_32_WG64_4_1_WGM1
    SolutionIndex: 7
    SolutionNameMin: Cijk_Ailk_Bljk_BBH_MT64x128x32_MI32x32x4x1_SE_1LDSB0_GRVW8_LPB8_NLCA1_PLR9_SU32_SUS256_SRVW4_TT1_64_WG64_4_1_WGM1
    SolutionIndex: 8
    SolutionNameMin: Cijk_Ailk_Bljk_BBH_MT64x64x32_MI32x32x4x1_SE_1LDSB0_GRVW8_LPB8_NLCA1_PLR9_SU0_SUS256_SRVW4_TT1_32_WG64_4_1_WGM2
    SolutionIndex: 9
    SolutionNameMin: Cijk_Ailk_Bljk_BBH_MT64x128x32_MI32x32x4x1_SE_1LDSB0_GRVW8_LPB8_NLCA1_PLR9_SU0_SUS256_SRVW4_TT1_64_WG64_4_1_WGM2
    SolutionIndex: 10
    SolutionNameMin: Cijk_Ailk_Bljk_BBH_MT128x64x32_MI32x32x4x1_SE_1LDSB0_GRVW8_LPB8_NLCA1_PLR9_SU32_SUS128_SRVW4_TT2_32_WG64_4_1_WGM2
    SolutionIndex: 11
    SolutionNameMin: Cijk_Ailk_Bljk_BBH_MT64x64x32_MI32x32x4x1_SE_1LDSB0_GRVW8_LPB8_NLCA1_PLR9_SU32_SUS256_SRVW4_TT1_32_WG64_4_1_WGM2
    SolutionIndex: 12
    SolutionNameMin: Cijk_Ailk_Bljk_BBH_MT128x64x32_MI32x32x4x1_SE_1LDSB0_GRVW4_LPB4_NLCA1_PLR9_SU0_SUS256_SRVW4_TT2_32_WG64_4_1_WGM15
    SolutionIndex: 13
    SolutionNameMin: Cijk_Ailk_Bljk_BBH_MT32x64x64_MI16x16x8x1_SE_1LDSB0_GRVW4_LPB4_NLCA1_PLR9_SU0_SUS256_SRVW4_TT1_32_WG32_8_1_WGM15
    SolutionIndex: 14
    SolutionNameMin: Cijk_Ailk_Bljk_BBH_MT64x128x32_MI32x32x4x1_SE_1LDSB0_GRVW8_LPB8_NLCA1_PLR9_SU0_SUS256_SRVW4_TT1_64_WG64_4_1_WGM15
    SolutionIndex: 15
    SolutionNameMin: Cijk_Ailk_Bljk_BBH_MT64x128x64_MI32x32x4x1_SE_1LDSB0_GRVW8_LPB8_NLCA1_PLR17_SU32_SUS256_SRVW4_TT1_64_WG64_4_1_WGM15
    SolutionIndex: 16
    SolutionNameMin: Cijk_Ailk_Bljk_BBH_MT128x144x32_MI16x16x8x1_SE_1LDSB1_GRVW2_LPB4_NLCA1_PLR5_SU0_SUS256_SRVW4_TT2_144_WG64_4_1_WGM1
    SolutionIndex: 17
    SolutionNameMin: Cijk_Ailk_Bljk_BBH_MT128x256x32_MI32x32x4x1_SE_1LDSB1_GRVW8_LPB8_NLCA1_PLR9_SU0_SUS256_SRVW4_TT2_128_WG64_4_1_WGM1
    SolutionIndex: 18
    SolutionNameMin: Cijk_Ailk_Bljk_BBH_MT128x144x32_MI16x16x8x1_SE_1LDSB1_GRVW2_LPB4_NLCA1_PLR5_SU32_SUS256_SRVW4_TT2_144_WG64_4_1_WGM1
    SolutionIndex: 19
    SolutionNameMin: Cijk_Ailk_Bljk_BBH_MT128x256x32_MI32x32x4x1_SE_1LDSB1_GRVW8_LPB8_NLCA1_PLR9_SU32_SUS256_SRVW4_TT2_128_WG64_4_1_WGM15
    SolutionIndex: 20
    SolutionNameMin: Cijk_Ailk_Bljk_BBH_MT64x128x32_MI32x32x4x1_SE_1LDSB0_GRVW2_LPB4_NLCA1_PLR9_SU0_SUS256_SRVW4_TT1_64_WG64_4_1_WGM1
    SolutionIndex: 21
    SolutionNameMin: Cijk_Ailk_Bljk_BBH_MT64x32x32_MI16x16x8x1_SE_1LDSB0_GRVW4_LPB4_NLCA1_PLR5_SU0_SUS256_SRVW4_TT2_16_WG32_8_1_WGM1
    SolutionIndex: 22
    SolutionNameMin: Cijk_Ailk_Bljk_BBH_MT64x128x32_MI32x32x4x1_SE_1LDSB0_GRVW4_LPB4_NLCA1_PLR9_SU0_SUS256_SRVW4_TT1_64_WG64_4_1_WGM1
    SolutionIndex: 23
    SolutionNameMin: Cijk_Ailk_Bljk_BBH_MT128x64x32_MI32x32x4x1_SE_1LDSB0_GRVW4_LPB4_NLCA1_PLR9_SU0_SUS256_SRVW4_TT2_32_WG64_4_1_WGM1
    SolutionIndex: 24
    SolutionNameMin: Cijk_Ailk_Bljk_BBH_MT64x64x32_MI32x32x4x1_SE_1LDSB0_GRVW8_LPB8_NLCA1_PLR9_SU0_SUS256_SRVW4_TT1_32_WG64_4_1_WGM1
    SolutionIndex: 25
    SolutionNameMin: Cijk_Ailk_Bljk_BBH_MT64x128x32_MI32x32x4x1_SE_1LDSB0_GRVW8_LPB8_NLCA1_PLR9_SU0_SUS256_SRVW4_TT1_64_WG64_4_1_WGM1
    SolutionIndex: 26
    SolutionNameMin: Cijk_Ailk_Bljk_BBH_MT64x128x32_MI32x32x4x1_SE_1LDSB0_GRVW2_LPB4_NLCA1_PLR9_SU32_SUS256_SRVW4_TT1_64_WG64_4_1_WGM1
    SolutionIndex: 27
    SolutionNameMin: Cijk_Ailk_Bljk_BBH_MT64x32x32_MI16x16x8x1_SE_1LDSB0_GRVW4_LPB4_NLCA1_PLR5_SU0_SUS256_SRVW4_TT2_16_WG32_8_1_WGM2
    SolutionIndex: 28
    SolutionNameMin: Cijk_Ailk_Bljk_BBH_MT128x96x32_MI32x32x4x1_SE_1LDSB0_GRVW4_LPB4_NLCA1_PLR9_SU0_SUS256_SRVW4_TT1_96_WG128_2_1_WGM2
    SolutionIndex: 29
    SolutionNameMin: Cijk_Ailk_Bljk_BBH_MT64x64x32_MI32x32x4x1_SE_1LDSB0_GRVW8_LPB8_NLCA1_PLR9_SU0_SUS256_SRVW4_TT1_32_WG64_4_1_WGM2
    SolutionIndex: 30
    SolutionNameMin: Cijk_Ailk_Bljk_BBH_MT64x128x32_MI32x32x4x1_SE_1LDSB0_GRVW8_LPB8_NLCA1_PLR9_SU0_SUS256_SRVW4_TT1_64_WG64_4_1_WGM2
    SolutionIndex: 31
    SolutionNameMin: Cijk_Ailk_Bljk_BBH_MT128x64x32_MI32x32x4x1_SE_1LDSB0_GRVW8_LPB8_NLCA1_PLR9_SU0_SUS256_SRVW4_TT2_32_WG64_4_1_WGM2
    SolutionIndex: 32
    SolutionNameMin: Cijk_Ailk_Bljk_BBH_MT64x128x64_MI32x32x4x1_SE_1LDSB0_GRVW8_LPB8_NLCA1_PLR17_SU0_SUS256_SRVW4_TT1_64_WG64_4_1_WGM2
    SolutionIndex: 33
    SolutionNameMin: Cijk_Ailk_Bljk_BBH_MT128x64x32_MI32x32x4x1_SE_1LDSB0_GRVW4_LPB4_NLCA1_PLR9_SU0_SUS256_SRVW4_TT2_32_WG64_4_1_WGM15
    SolutionIndex: 34
    SolutionNameMin: Cijk_Ailk_Bljk_BBH_MT128x96x32_MI32x32x4x1_SE_1LDSB0_GRVW4_LPB4_NLCA1_PLR9_SU0_SUS256_SRVW4_TT1_96_WG128_2_1_WGM15
    SolutionIndex: 35
    SolutionNameMin: Cijk_Ailk_Bljk_BBH_MT64x32x32_MI16x16x8x1_SE_1LDSB0_GRVW8_LPB8_NLCA1_PLR5_SU0_SUS256_SRVW4_TT2_16_WG32_8_1_WGM15
    SolutionIndex: 36
    SolutionNameMin: Cijk_Ailk_Bljk_BBH_MT64x128x32_MI32x32x4x1_SE_1LDSB0_GRVW8_LPB8_NLCA1_PLR9_SU0_SUS256_SRVW4_TT1_64_WG64_4_1_WGM15
    SolutionIndex: 37
    SolutionNameMin: Cijk_Ailk_Bljk_BBH_MT128x64x32_MI32x32x4x1_SE_1LDSB0_GRVW8_LPB8_NLCA1_PLR9_SU0_SUS256_SRVW4_TT2_32_WG64_4_1_WGM15
    SolutionIndex: 38
    SolutionNameMin: Cijk_Ailk_Bljk_BBH_MT128x64x32_MI32x32x4x1_SE_1LDSB0_GRVW8_LPB8_NLCA1_PLR9_SU32_SUS128_SRVW4_TT2_32_WG64_4_1_WGM15
    SolutionIndex: 39
    SolutionNameMin: Cijk_Ailk_Bljk_BBH_MT96x96x32_MI16x16x8x1_SE_1LDSB1_GRVW4_LPB4_NLCA3_PLR5_SU32_SUS128_SRVW0_TT3_48_WG32_8_1_WGM2
- - - [3136, 128, 64, 64, 3136, 3136, 3136, 64]
    - [2, 26622.0]
  - - [3136, 256, 64, 64, 3136, 3136, 3136, 64]
    - [18, 30859.0]
  - - [3136, 256, 64, 128, 3136, 3136, 3136, 128]
    - [17, 43543.0]
  - - [784, 512, 64, 256, 784, 784, 784, 256]
    - [5, 46577.0]
  - - [3136, 128, 64, 256, 3136, 3136, 3136, 256]
    - [3, 48386.0]
  - - [3136, 256, 64, 256, 3136, 3136, 3136, 256]
    - [17, 52546.0]
  - - [784, 256, 64, 512, 784, 784, 784, 512]
    - [2, 50373.0]
  - - [784, 512, 64, 512, 784, 784, 784, 512]
    - [2, 53123.0]
  - - [3136, 128, 32, 64, 3136, 3136, 3136, 64]
    - [14, 23249.0]
  - - [3136, 256, 32, 64, 3136, 3136, 3136, 64]
    - [16, 27149.0]
  - - [3136, 256, 32, 128, 3136, 3136, 3136, 128]
    - [3, 39561.0]
  - - [784, 512, 32, 256, 784, 784, 784, 256]
    - [5, 44103.0]
  - - [3136, 128, 32, 256, 3136, 3136, 3136, 256]
    - [3, 45021.0]
  - - [3136, 256, 32, 256, 3136, 3136, 3136, 256]
    - [3, 50005.0]
  - - [784, 256, 32, 512, 784, 784, 784, 512]
    - [2, 47084.0]
  - - [784, 512, 32, 512, 784, 784, 784, 512]
    - [7, 50872.0]
  - - [3136, 64, 64, 64, 3136, 3136, 3136, 64]
    - [10, 19648.0]
  - - [3136, 64, 64, 256, 3136, 3136, 3136, 256]
    - [12, 36570.0]
  - - [784, 512, 64, 128, 784, 784, 784, 128]
    - [19, 35805.0]
  - - [784, 128, 64, 512, 784, 784, 784, 512]
    - [14, 44437.0]
  - - [64, 192, 64, 1280, 64, 64, 64, 1280]
    - [1, 32514.0]
  - - [64, 320, 64, 1280, 64, 64, 64, 1280]
    - [14, 34779.0]
  - - [64, 384, 64, 1280, 64, 64, 64, 1280]
    - [14, 40073.0]
  - - [64, 448, 64, 1280, 64, 64, 64, 1280]
    - [1, 39199.0]
  - - [64, 192, 64, 2048, 64, 64, 64, 2048]
    - [6, 31655.0]
  - - [64, 320, 64, 2048, 64, 64, 64, 2048]
    - [14, 34169.0]
  - - [64, 384, 64, 2048, 64, 64, 64, 2048]
    - [9, 39399.0]
  - - [64, 448, 64, 2048, 64, 64, 64, 2048]
    - [11, 38759.0]
  - - [64, 192, 32, 1280, 64, 64, 64, 1280]
    - [0, 25166.0]
  - - [64, 320, 32, 1280, 64, 64, 64, 1280]
    - [1, 28886.0]
  - - [64, 384, 32, 1280, 64, 64, 64, 1280]
    - [1, 33825.0]
  - - [64, 448, 32, 1280, 64, 64, 64, 1280]
    - [8, 38130.0]
  - - [64, 192, 32, 2048, 64, 64, 64, 2048]
    - [13, 26772.0]
  - - [64, 320, 32, 2048, 64, 64, 64, 2048]
    - [4, 31069.0]
  - - [64, 384, 32, 2048, 64, 64, 64, 2048]
    - [15, 35507.0]
  - - [64, 448, 32, 2048, 64, 64, 64, 2048]
    - [1, 38254.0]
  - - [196, 1024, 64, 512, 196, 196, 196, 512]
    - [34, 40617.0]
  - - [196, 512, 64, 1024, 196, 196, 196, 1024]
    - [37, 40940.0]
  - - [196, 1024, 64, 1024, 196, 196, 196, 1024]
    - [34, 43821.0]
  - - [49, 2048, 64, 1024, 49, 49, 49, 1024]
    - [22, 31765.0]
  - - [49, 1024, 64, 2048, 49, 49, 49, 2048]
    - [32, 29948.0]
  - - [196, 1024, 32, 512, 196, 196, 196, 512]
    - [28, 38308.0]
  - - [196, 512, 32, 1024, 196, 196, 196, 1024]
    - [37, 35527.0]
  - - [196, 1024, 32, 1024, 196, 196, 196, 1024]
    - [34, 42573.0]
  - - [49, 2048, 32, 1024, 49, 49, 49, 1024]
    - [20, 27680.0]
  - - [49, 1024, 32, 2048, 49, 49, 49, 2048]
    - [39, 25064.0]
  - - [196, 1024, 64, 256, 196, 196, 196, 256]
    - [34, 34027.0]
  - - [196, 256, 64, 1024, 196, 196, 196, 1024]
    - [25, 35012.0]
  - - [49, 2048, 64, 512, 49, 49, 49, 512]
    - [26, 27421.0]
  - - [49, 512, 64, 2048, 49, 49, 49, 2048]
    - [35, 24702.0]
  - - [1225, 32, 64, 192, 1225, 1225, 1225, 192]
    - [27, 17009.0]
  - - [1225, 48, 64, 192, 1225, 1225, 1225, 192]
    - [21, 16303.0]
  - - [1225, 64, 64, 192, 1225, 1225, 1225, 192]
    - [37, 24426.0]
  - - [1225, 48, 64, 256, 1225, 1225, 1225, 256]
    - [37, 18163.0]
  - - [1225, 64, 64, 256, 1225, 1225, 1225, 256]
    - [33, 28368.0]
  - - [1225, 48, 64, 288, 1225, 1225, 1225, 288]
    - [23, 19606.0]
  - - [1225, 64, 64, 288, 1225, 1225, 1225, 288]
    - [23, 30056.0]
  - - [5329, 80, 64, 64, 5329, 5329, 5329, 64]
    - [21, 14758.0]
  - - [289, 128, 64, 768, 289, 289, 289, 768]
    - [30, 32608.0]
  - - [289, 160, 64, 768, 289, 289, 289, 768]
    - [31, 30713.0]
  - - [289, 192, 64, 768, 289, 289, 289, 768]
    - [31, 36816.0]
  - - [1225, 32, 32, 192, 1225, 1225, 1225, 192]
    - [21, 14068.0]
  - - [1225, 48, 32, 192, 1225, 1225, 1225, 192]
    - [21, 14291.0]
  - - [1225, 64, 32, 192, 1225, 1225, 1225, 192]
    - [24, 20550.0]
  - - [1225, 48, 32, 256, 1225, 1225, 1225, 256]
    - [21, 15639.0]
  - - [1225, 64, 32, 256, 1225, 1225, 1225, 256]
    - [38, 22363.0]
  - - [1225, 48, 32, 288, 1225, 1225, 1225, 288]
    - [21, 16441.0]
  - - [1225, 64, 32, 288, 1225, 1225, 1225, 288]
    - [29, 24881.0]
  - - [5329, 80, 32, 64, 5329, 5329, 5329, 64]
    - [21, 13974.0]
  - - [289, 128, 32, 768, 289, 289, 289, 768]
    - [36, 28410.0]
  - - [289, 160, 32, 768, 289, 289, 289, 768]
    - [24, 26305.0]
  - - [289, 192, 32, 768, 289, 289, 289, 768]
    - [24, 31277.0]
- null
