TRAIN_3.9/logic/conv/arcturus_Cijk_Ailk_Bjlk_HBH.yaml
- {MinimumRequiredVersion: 4.22.0}
- arcturus
- gfx908
- [Device 7380, Device 7388, Device 738c, Device 7390]
    SolutionIndex: 0
    SolutionNameMin: Cijk_Ailk_Bjlk_HBH_MT64x128x16_MI32x32x8x1_SE_1LDSB0_GRVW4_NLCA1_NLCB1_SU0_SUS256_SRVW4_TT1_64_WG64_4_1_WGM1
    SolutionIndex: 1
    SolutionNameMin: Cijk_Ailk_Bjlk_HBH_MT64x64x32_MI32x32x8x1_SE_1LDSB0_GRVW4_NLCA1_NLCB1_SU0_SUS256_SRVW4_TT1_32_WG64_4_1_WGM1
    SolutionIndex: 2
    SolutionNameMin: Cijk_Ailk_Bjlk_HBH_MT128x128x16_MI32x32x8x1_SE_1LDSB0_GRVW8_NLCA1_NLCB1_SU0_SUS256_SRVW4_TT2_64_WG64_4_1_WGM1
    SolutionIndex: 3
    SolutionNameMin: Cijk_Ailk_Bjlk_HBH_MT64x64x32_MI32x32x8x1_SE_1LDSB0_GRVW8_NLCA1_NLCB1_SU0_SUS256_SRVW4_TT1_32_WG64_4_1_WGM1
    SolutionIndex: 4
    SolutionNameMin: Cijk_Ailk_Bjlk_HBH_MT64x128x32_MI32x32x8x1_SE_1LDSB0_GRVW8_NLCA1_NLCB1_SU0_SUS256_SRVW4_TT1_64_WG64_4_1_WGM1
    SolutionIndex: 5
    SolutionNameMin: Cijk_Ailk_Bjlk_HBH_MT128x128x32_MI32x32x8x1_SE_1LDSB0_GRVW8_NLCA1_NLCB1_SU0_SUS256_SRVW4_TT2_64_WG64_4_1_WGM1
    SolutionIndex: 6
    SolutionNameMin: Cijk_Ailk_Bjlk_HBH_MT64x128x32_MI32x32x8x1_SE_1LDSB0_GRVW8_NLCA1_NLCB1_SU32_SUS128_SRVW4_TT1_64_WG64_4_1_WGM1
    SolutionIndex: 7
    SolutionNameMin: Cijk_Ailk_Bjlk_HBH_MT64x64x16_MI32x32x8x1_SE_1LDSB0_GRVW8_NLCA1_NLCB1_SU32_SUS256_SRVW4_TT1_32_WG64_4_1_WGM1
    SolutionIndex: 8
    SolutionNameMin: Cijk_Ailk_Bjlk_HBH_MT64x128x16_MI32x32x8x1_SE_1LDSB0_GRVW8_NLCA1_NLCB1_SU32_SUS256_SRVW4_TT1_64_WG64_4_1_WGM1
    SolutionIndex: 9
    SolutionNameMin: Cijk_Ailk_Bjlk_HBH_MT64x256x16_MI32x32x8x1_SE_1LDSB0_GRVW8_NLCA1_NLCB1_SU32_SUS256_SRVW4_TT1_128_WG64_4_1_WGM1
    SolutionIndex: 10
    SolutionNameMin: Cijk_Ailk_Bjlk_HBH_MT64x128x32_MI32x32x8x1_SE_1LDSB0_GRVW8_NLCA1_NLCB1_SU32_SUS256_SRVW4_TT1_64_WG64_4_1_WGM1
    SolutionIndex: 11
    SolutionNameMin: Cijk_Ailk_Bjlk_HBH_MT128x128x32_MI32x32x8x1_SE_1LDSB0_GRVW8_NLCA1_NLCB1_SU32_SUS256_SRVW4_TT2_64_WG64_4_1_WGM1
    SolutionIndex: 12
    SolutionNameMin: Cijk_Ailk_Bjlk_HBH_MT64x128x16_MI32x32x8x1_SE_1LDSB0_GRVW8_NLCA1_NLCB1_SU0_SUS256_SRVW4_TT1_64_WG64_4_1_WGM2
    SolutionIndex: 13
    SolutionNameMin: Cijk_Ailk_Bjlk_HBH_MT64x256x16_MI32x32x8x1_SE_1LDSB0_GRVW8_NLCA1_NLCB1_SU0_SUS256_SRVW4_TT1_128_WG64_4_1_WGM2
    SolutionIndex: 14
    SolutionNameMin: Cijk_Ailk_Bjlk_HBH_MT128x64x16_MI32x32x8x1_SE_1LDSB0_GRVW8_NLCA1_NLCB1_SU0_SUS256_SRVW4_TT2_32_WG64_4_1_WGM2
    SolutionIndex: 15
    SolutionNameMin: Cijk_Ailk_Bjlk_HBH_MT128x256x16_MI32x32x8x1_SE_1LDSB0_GRVW8_NLCA1_NLCB1_SU0_SUS256_SRVW4_TT2_128_WG64_4_1_WGM2
    SolutionIndex: 16
    SolutionNameMin: Cijk_Ailk_Bjlk_HBH_MT128x128x32_MI32x32x8x1_SE_1LDSB0_GRVW8_NLCA1_NLCB1_SU0_SUS256_SRVW4_TT2_64_WG64_4_1_WGM2
    SolutionIndex: 17
    SolutionNameMin: Cijk_Ailk_Bjlk_HBH_MT64x128x16_MI32x32x8x1_SE_1LDSB0_GRVW2_NLCA1_NLCB1_SU32_SUS128_SRVW4_TT1_64_WG64_4_1_WGM2
    SolutionIndex: 18
    SolutionNameMin: Cijk_Ailk_Bjlk_HBH_MT64x128x16_MI32x32x8x1_SE_1LDSB0_GRVW2_NLCA1_NLCB1_SU32_SUS256_SRVW4_TT1_64_WG64_4_1_WGM2
    SolutionIndex: 19
    SolutionNameMin: Cijk_Ailk_Bjlk_HBH_MT64x64x16_MI32x32x8x1_SE_1LDSB0_GRVW8_NLCA1_NLCB1_SU32_SUS256_SRVW4_TT1_32_WG64_4_1_WGM2
    SolutionIndex: 20
    SolutionNameMin: Cijk_Ailk_Bjlk_HBH_MT64x128x16_MI32x32x8x1_SE_1LDSB0_GRVW2_NLCA1_NLCB1_SU0_SUS256_SRVW4_TT1_64_WG64_4_1_WGM15
    SolutionIndex: 21
    SolutionNameMin: Cijk_Ailk_Bjlk_HBH_MT64x128x32_MI32x32x8x1_SE_1LDSB0_GRVW8_NLCA1_NLCB1_SU0_SUS256_SRVW4_TT1_64_WG64_4_1_WGM15
    SolutionIndex: 22
    SolutionNameMin: Cijk_Ailk_Bjlk_HBH_MT128x128x32_MI32x32x8x1_SE_1LDSB0_GRVW8_NLCA1_NLCB1_SU0_SUS256_SRVW4_TT2_64_WG64_4_1_WGM15
    SolutionIndex: 23
    SolutionNameMin: Cijk_Ailk_Bjlk_HBH_MT128x128x32_MI32x32x8x1_SE_1LDSB0_GRVW8_NLCA1_NLCB1_SU32_SUS128_SRVW4_TT2_64_WG64_4_1_WGM15
    SolutionIndex: 24
    SolutionNameMin: Cijk_Ailk_Bjlk_HBH_MT64x128x32_MI32x32x8x1_SE_1LDSB0_GRVW8_NLCA1_NLCB1_SU32_SUS256_SRVW4_TT1_64_WG64_4_1_WGM15
    SolutionIndex: 25
    SolutionNameMin: Cijk_Ailk_Bjlk_HBH_MT128x128x32_MI32x32x8x1_SE_1LDSB0_GRVW8_NLCA1_NLCB1_SU32_SUS256_SRVW4_TT2_64_WG64_4_1_WGM15
    SolutionIndex: 26
    SolutionNameMin: Cijk_Ailk_Bjlk_HBH_MT128x256x32_MI32x32x8x1_SE_1LDSB1_GRVW2_NLCA1_NLCB2_SU0_SUS256_SRVW4_TT2_128_WG64_4_1_WGM1
    SolutionIndex: 27
    SolutionNameMin: Cijk_Ailk_Bjlk_HBH_MT128x256x16_MI32x32x8x1_SE_1LDSB1_GRVW8_NLCA1_NLCB1_SU0_SUS256_SRVW4_TT2_128_WG64_4_1_WGM1
    SolutionIndex: 28
    SolutionNameMin: Cijk_Ailk_Bjlk_HBH_MT128x256x32_MI32x32x8x1_SE_1LDSB1_GRVW2_NLCA1_NLCB2_SU0_SUS256_SRVW4_TT2_128_WG64_4_1_WGM2
    SolutionIndex: 29
    SolutionNameMin: Cijk_Ailk_Bjlk_HBH_MT128x256x16_MI32x32x8x1_SE_1LDSB1_GRVW8_NLCA1_NLCB1_SU0_SUS256_SRVW4_TT2_128_WG64_4_1_WGM2
    SolutionIndex: 30
    SolutionNameMin: Cijk_Ailk_Bjlk_HBH_MT128x256x16_MI32x32x8x1_SE_1LDSB1_GRVW8_NLCA1_NLCB1_SU0_SUS256_SRVW4_TT2_128_WG64_4_1_WGM15
    SolutionIndex: 31
    SolutionNameMin: Cijk_Ailk_Bjlk_HBH_MT128x64x16_MI32x32x8x1_SE_1LDSB0_GRVW2_NLCA1_NLCB1_SU0_SUS256_SRVW4_TT2_32_WG64_4_1_WGM1
    SolutionIndex: 32
    SolutionNameMin: Cijk_Ailk_Bjlk_HBH_MT128x96x16_MI32x32x8x1_SE_1LDSB0_GRVW2_NLCA1_NLCB3_SU0_SUS256_SRVW4_TT1_96_WG128_2_1_WGM1
    SolutionIndex: 33
    SolutionNameMin: Cijk_Ailk_Bjlk_HBH_MT96x128x32_MI32x32x8x1_SE_1LDSB0_GRVW4_NLCA3_NLCB1_SU0_SUS256_SRVW0_TT3_32_WG32_8_1_WGM1
    SolutionIndex: 34
    SolutionNameMin: Cijk_Ailk_Bjlk_HBH_MT64x64x16_MI32x32x8x1_SE_1LDSB0_GRVW8_NLCA1_NLCB1_SU0_SUS256_SRVW4_TT1_32_WG64_4_1_WGM1
    SolutionIndex: 35
    SolutionNameMin: Cijk_Ailk_Bjlk_HBH_MT64x128x16_MI32x32x8x1_SE_1LDSB0_GRVW8_NLCA1_NLCB1_SU0_SUS256_SRVW4_TT1_64_WG64_4_1_WGM1
    SolutionIndex: 36
    SolutionNameMin: Cijk_Ailk_Bjlk_HBH_MT128x128x16_MI32x32x8x1_SE_1LDSB0_GRVW8_NLCA1_NLCB1_SU0_SUS256_SRVW4_TT2_64_WG64_4_1_WGM1
    SolutionIndex: 37
    SolutionNameMin: Cijk_Ailk_Bjlk_HBH_MT128x128x32_MI32x32x8x1_SE_1LDSB0_GRVW8_NLCA1_NLCB1_SU0_SUS256_SRVW4_TT2_64_WG64_4_1_WGM1
    SolutionIndex: 38
    SolutionNameMin: Cijk_Ailk_Bjlk_HBH_MT128x96x16_MI32x32x8x1_SE_1LDSB0_GRVW2_NLCA1_NLCB3_SU32_SUS128_SRVW4_TT1_96_WG128_2_1_WGM1
    SolutionIndex: 39
    SolutionNameMin: Cijk_Ailk_Bjlk_HBH_MT256x160x32_MI32x32x8x1_SE_1LDSB0_GRVW4_NLCA1_NLCB5_SU32_SUS128_SRVW4_TT2_160_WG128_2_1_WGM1
    SolutionIndex: 40
    SolutionNameMin: Cijk_Ailk_Bjlk_HBH_MT64x128x64_MI32x32x8x1_SE_1LDSB0_GRVW8_NLCA1_NLCB1_SU32_SUS128_SRVW4_TT1_64_WG64_4_1_WGM1
    SolutionIndex: 41
    SolutionNameMin: Cijk_Ailk_Bjlk_HBH_MT64x128x16_MI32x32x8x1_SE_1LDSB0_GRVW8_NLCA1_NLCB1_SU32_SUS256_SRVW4_TT1_64_WG64_4_1_WGM1
    SolutionIndex: 42
    SolutionNameMin: Cijk_Ailk_Bjlk_HBH_MT128x256x16_MI32x32x8x1_SE_1LDSB0_GRVW8_NLCA1_NLCB1_SU32_SUS256_SRVW4_TT2_128_WG64_4_1_WGM1
    SolutionIndex: 43
    SolutionNameMin: Cijk_Ailk_Bjlk_HBH_MT128x96x16_MI32x32x8x1_SE_1LDSB0_GRVW2_NLCA1_NLCB3_SU0_SUS256_SRVW4_TT1_96_WG128_2_1_WGM2
    SolutionIndex: 44
    SolutionNameMin: Cijk_Ailk_Bjlk_HBH_MT128x128x16_MI32x32x8x1_SE_1LDSB0_GRVW4_NLCA1_NLCB1_SU0_SUS256_SRVW4_TT2_64_WG64_4_1_WGM2
    SolutionIndex: 45
    SolutionNameMin: Cijk_Ailk_Bjlk_HBH_MT128x96x32_MI32x32x8x1_SE_1LDSB0_GRVW4_NLCA1_NLCB3_SU0_SUS256_SRVW4_TT1_96_WG128_2_1_WGM2
    SolutionIndex: 46
    SolutionNameMin: Cijk_Ailk_Bjlk_HBH_MT128x128x16_MI32x32x8x1_SE_1LDSB0_GRVW8_NLCA1_NLCB1_SU0_SUS256_SRVW4_TT2_64_WG64_4_1_WGM2
    SolutionIndex: 47
    SolutionNameMin: Cijk_Ailk_Bjlk_HBH_MT64x64x32_MI32x32x8x1_SE_1LDSB0_GRVW8_NLCA1_NLCB1_SU0_SUS256_SRVW4_TT1_32_WG64_4_1_WGM2
    SolutionIndex: 48
    SolutionNameMin: Cijk_Ailk_Bjlk_HBH_MT64x128x32_MI32x32x8x1_SE_1LDSB0_GRVW8_NLCA1_NLCB1_SU0_SUS256_SRVW4_TT1_64_WG64_4_1_WGM2
    SolutionIndex: 49
    SolutionNameMin: Cijk_Ailk_Bjlk_HBH_MT128x128x32_MI32x32x8x1_SE_1LDSB0_GRVW8_NLCA1_NLCB1_SU0_SUS256_SRVW4_TT2_64_WG64_4_1_WGM2
    SolutionIndex: 50
    SolutionNameMin: Cijk_Ailk_Bjlk_HBH_MT64x128x16_MI32x32x8x1_SE_1LDSB0_GRVW8_NLCA1_NLCB1_SU32_SUS128_SRVW4_TT1_64_WG64_4_1_WGM2
    SolutionIndex: 51
    SolutionNameMin: Cijk_Ailk_Bjlk_HBH_MT64x128x32_MI32x32x8x1_SE_1LDSB0_GRVW8_NLCA1_NLCB1_SU32_SUS128_SRVW4_TT1_64_WG64_4_1_WGM2
    SolutionIndex: 52
    SolutionNameMin: Cijk_Ailk_Bjlk_HBH_MT128x96x16_MI32x32x8x1_SE_1LDSB0_GRVW2_NLCA1_NLCB3_SU32_SUS256_SRVW4_TT1_96_WG128_2_1_WGM2
    SolutionIndex: 53
    SolutionNameMin: Cijk_Ailk_Bjlk_HBH_MT64x64x16_MI32x32x8x1_SE_1LDSB0_GRVW8_NLCA1_NLCB1_SU32_SUS256_SRVW4_TT1_32_WG64_4_1_WGM2
    SolutionIndex: 54
    SolutionNameMin: Cijk_Ailk_Bjlk_HBH_MT64x128x32_MI32x32x8x1_SE_1LDSB0_GRVW8_NLCA1_NLCB1_SU32_SUS256_SRVW4_TT1_64_WG64_4_1_WGM2
    SolutionIndex: 55
    SolutionNameMin: Cijk_Ailk_Bjlk_HBH_MT64x128x16_MI32x32x8x1_SE_1LDSB0_GRVW8_NLCA1_NLCB1_SU0_SUS256_SRVW4_TT1_64_WG64_4_1_WGM15
    SolutionIndex: 56
    SolutionNameMin: Cijk_Ailk_Bjlk_HBH_MT128x128x16_MI32x32x8x1_SE_1LDSB0_GRVW8_NLCA1_NLCB1_SU0_SUS256_SRVW4_TT2_64_WG64_4_1_WGM15
    SolutionIndex: 57
    SolutionNameMin: Cijk_Ailk_Bjlk_HBH_MT64x128x32_MI32x32x8x1_SE_1LDSB0_GRVW8_NLCA1_NLCB1_SU0_SUS256_SRVW4_TT1_64_WG64_4_1_WGM15
    SolutionIndex: 58
    SolutionNameMin: Cijk_Ailk_Bjlk_HBH_MT128x128x32_MI32x32x8x1_SE_1LDSB0_GRVW8_NLCA1_NLCB1_SU0_SUS256_SRVW4_TT2_64_WG64_4_1_WGM15
    SolutionIndex: 59
    SolutionNameMin: Cijk_Ailk_Bjlk_HBH_MT64x64x16_MI32x32x8x1_SE_1LDSB0_GRVW4_NLCA1_NLCB1_SU32_SUS128_SRVW4_TT1_32_WG64_4_1_WGM15
    SolutionIndex: 60
    SolutionNameMin: Cijk_Ailk_Bjlk_HBH_MT64x64x16_MI32x32x8x1_SE_1LDSB0_GRVW8_NLCA1_NLCB1_SU32_SUS128_SRVW4_TT1_32_WG64_4_1_WGM15
    SolutionIndex: 61
    SolutionNameMin: Cijk_Ailk_Bjlk_HBH_MT64x128x16_MI32x32x8x1_SE_1LDSB0_GRVW8_NLCA1_NLCB1_SU32_SUS128_SRVW4_TT1_64_WG64_4_1_WGM15
    SolutionIndex: 62
    SolutionNameMin: Cijk_Ailk_Bjlk_HBH_MT128x128x16_MI32x32x8x1_SE_1LDSB0_GRVW4_NLCA1_NLCB1_SU32_SUS256_SRVW4_TT2_64_WG64_4_1_WGM15
    SolutionIndex: 63
    SolutionNameMin: Cijk_Ailk_Bjlk_HBH_MT128x256x16_MI32x32x8x1_SE_1LDSB1_GRVW8_NLCA1_NLCB1_SU0_SUS256_SRVW4_TT2_128_WG64_4_1_WGM2
    SolutionIndex: 64
    SolutionNameMin: Cijk_Ailk_Bjlk_HBH_MT128x256x16_MI32x32x8x1_SE_1LDSB1_GRVW8_NLCA1_NLCB1_SU32_SUS256_SRVW4_TT2_128_WG64_4_1_WGM2
- - - [3136, 64, 64, 128, 3136, 3136, 3136, 64]
    - [19, 32883.0]
  - - [3136, 64, 64, 256, 3136, 3136, 3136, 64]
    - [14, 41228.0]
  - - [3136, 128, 64, 256, 3136, 3136, 3136, 128]
    - [5, 65193.0]
  - - [784, 256, 64, 512, 784, 784, 784, 256]
    - [29, 77336.0]
  - - [3136, 256, 64, 128, 3136, 3136, 3136, 256]
    - [26, 66244.0]
  - - [3136, 256, 64, 256, 3136, 3136, 3136, 256]
    - [30, 85678.0]
  - - [784, 512, 64, 256, 784, 784, 784, 512]
    - [15, 73335.0]
  - - [784, 512, 64, 512, 784, 784, 784, 512]
    - [29, 85634.0]
  - - [3136, 64, 32, 128, 3136, 3136, 3136, 64]
    - [7, 29614.0]
  - - [3136, 64, 32, 256, 3136, 3136, 3136, 64]
    - [1, 37710.0]
  - - [3136, 128, 32, 256, 3136, 3136, 3136, 128]
    - [23, 61350.0]
  - - [784, 256, 32, 512, 784, 784, 784, 256]
    - [16, 67941.0]
  - - [3136, 256, 32, 128, 3136, 3136, 3136, 256]
    - [28, 60447.0]
  - - [3136, 256, 32, 256, 3136, 3136, 3136, 256]
    - [25, 78145.0]
  - - [784, 512, 32, 256, 784, 784, 784, 512]
    - [29, 66728.0]
  - - [784, 512, 32, 512, 784, 784, 784, 512]
    - [27, 80517.0]
  - - [3136, 256, 32, 64, 3136, 3136, 3136, 256]
    - [5, 40219.0]
  - - [3136, 64, 32, 64, 3136, 3136, 3136, 64]
    - [3, 23040.0]
  - - [784, 512, 32, 128, 784, 784, 784, 512]
    - [2, 52031.0]
  - - [784, 128, 32, 512, 784, 784, 784, 128]
    - [16, 60270.0]
  - - [3136, 64, 64, 64, 3136, 3136, 3136, 64]
    - [3, 26691.0]
  - - [3136, 256, 64, 64, 3136, 3136, 3136, 256]
    - [11, 43041.0]
  - - [784, 128, 64, 512, 784, 784, 784, 128]
    - [22, 65245.0]
  - - [784, 512, 64, 128, 784, 784, 784, 512]
    - [26, 57650.0]
  - - [64, 1280, 64, 192, 64, 64, 64, 1280]
    - [18, 35951.0]
  - - [64, 1280, 64, 320, 64, 64, 64, 1280]
    - [12, 41364.0]
  - - [64, 1280, 64, 384, 64, 64, 64, 1280]
    - [12, 43919.0]
  - - [64, 1280, 64, 448, 64, 64, 64, 1280]
    - [6, 45379.0]
  - - [64, 2048, 64, 192, 64, 64, 64, 2048]
    - [20, 38202.0]
  - - [64, 2048, 64, 320, 64, 64, 64, 2048]
    - [0, 43408.0]
  - - [64, 2048, 64, 384, 64, 64, 64, 2048]
    - [21, 45140.0]
  - - [64, 2048, 64, 448, 64, 64, 64, 2048]
    - [4, 47547.0]
  - - [64, 1280, 32, 192, 64, 64, 64, 1280]
    - [17, 32264.0]
  - - [64, 1280, 32, 320, 64, 64, 64, 1280]
    - [9, 38130.0]
  - - [64, 1280, 32, 384, 64, 64, 64, 1280]
    - [13, 39819.0]
  - - [64, 1280, 32, 448, 64, 64, 64, 1280]
    - [8, 42551.0]
  - - [64, 2048, 32, 192, 64, 64, 64, 2048]
    - [12, 33004.0]
  - - [64, 2048, 32, 320, 64, 64, 64, 2048]
    - [10, 38568.0]
  - - [64, 2048, 32, 384, 64, 64, 64, 2048]
    - [21, 40920.0]
  - - [64, 2048, 32, 448, 64, 64, 64, 2048]
    - [24, 42474.0]
  - - [196, 512, 64, 1024, 196, 196, 196, 512]
    - [58, 61997.0]
  - - [196, 1024, 64, 512, 196, 196, 196, 1024]
    - [44, 57208.0]
  - - [196, 1024, 64, 1024, 196, 196, 196, 1024]
    - [63, 66458.0]
  - - [49, 1024, 64, 2048, 49, 49, 49, 1024]
    - [40, 37762.0]
  - - [49, 2048, 64, 1024, 49, 49, 49, 2048]
    - [48, 39240.0]
  - - [196, 512, 32, 1024, 196, 196, 196, 512]
    - [49, 50066.0]
  - - [196, 1024, 32, 512, 196, 196, 196, 1024]
    - [37, 52097.0]
  - - [196, 1024, 32, 1024, 196, 196, 196, 1024]
    - [39, 60670.0]
  - - [49, 1024, 32, 2048, 49, 49, 49, 1024]
    - [61, 35222.0]
  - - [49, 2048, 32, 1024, 49, 49, 49, 2048]
    - [57, 34775.0]
  - - [196, 1024, 32, 256, 196, 196, 196, 1024]
    - [43, 39676.0]
  - - [196, 256, 32, 1024, 196, 196, 196, 256]
    - [33, 42115.0]
  - - [49, 2048, 32, 512, 49, 49, 49, 2048]
    - [51, 29152.0]
  - - [49, 512, 32, 2048, 49, 49, 49, 512]
    - [54, 29529.0]
  - - [196, 256, 64, 1024, 196, 196, 196, 256]
    - [49, 48934.0]
  - - [196, 1024, 64, 256, 196, 196, 196, 1024]
    - [46, 45269.0]
  - - [49, 512, 64, 2048, 49, 49, 49, 512]
    - [35, 35042.0]
  - - [49, 2048, 64, 512, 49, 49, 49, 2048]
    - [50, 33527.0]
  - - [1225, 192, 64, 32, 1225, 1225, 1225, 192]
    - [34, 18136.0]
  - - [1225, 192, 64, 48, 1225, 1225, 1225, 192]
    - [32, 23830.0]
  - - [1225, 192, 64, 64, 1225, 1225, 1225, 192]
    - [45, 28202.0]
  - - [1225, 256, 64, 48, 1225, 1225, 1225, 256]
    - [55, 26179.0]
  - - [1225, 256, 64, 64, 1225, 1225, 1225, 256]
    - [35, 30878.0]
  - - [1225, 288, 64, 48, 1225, 1225, 1225, 288]
    - [52, 26616.0]
  - - [1225, 288, 64, 64, 1225, 1225, 1225, 288]
    - [52, 33144.0]
  - - [5329, 64, 64, 80, 5329, 5329, 5329, 64]
    - [31, 26458.0]
  - - [289, 768, 64, 128, 289, 289, 289, 768]
    - [56, 39734.0]
  - - [289, 768, 64, 160, 289, 289, 289, 768]
    - [64, 44599.0]
  - - [289, 768, 64, 192, 289, 289, 289, 768]
    - [42, 48564.0]
  - - [1225, 192, 32, 32, 1225, 1225, 1225, 192]
    - [60, 16186.0]
  - - [1225, 192, 32, 48, 1225, 1225, 1225, 192]
    - [53, 20715.0]
  - - [1225, 192, 32, 64, 1225, 1225, 1225, 192]
    - [47, 23989.0]
  - - [1225, 256, 32, 48, 1225, 1225, 1225, 256]
    - [35, 24181.0]
  - - [1225, 256, 32, 64, 1225, 1225, 1225, 256]
    - [41, 28268.0]
  - - [1225, 288, 32, 48, 1225, 1225, 1225, 288]
    - [38, 22209.0]
  - - [1225, 288, 32, 64, 1225, 1225, 1225, 288]
    - [38, 27369.0]
  - - [5329, 64, 32, 80, 5329, 5329, 5329, 64]
    - [59, 24253.0]
  - - [289, 768, 32, 128, 289, 289, 289, 768]
    - [62, 35402.0]
  - - [289, 768, 32, 160, 289, 289, 289, 768]
    - [56, 40014.0]
  - - [289, 768, 32, 192, 289, 289, 289, 768]
    - [36, 42509.0]
- null
