TRAIN_3.9/logic/conv/arcturus_Cijk_Ailk_Bljk_HBH.yaml
- {MinimumRequiredVersion: 4.22.0}
- arcturus
- gfx908
- [Device 7380, Device 7388, Device 738c, Device 7390]
    SolutionIndex: 0
    SolutionNameMin: Cijk_Ailk_Bljk_HBH_MT64x64x32_MI32x32x8x1_SE_1LDSB0_GRVW2_NLCA1_PLR5_SU0_SUS256_SRVW4_TT1_32_WG64_4_1_WGM1
    SolutionIndex: 1
    SolutionNameMin: Cijk_Ailk_Bljk_HBH_MT128x64x32_MI32x32x8x1_SE_1LDSB0_GRVW2_NLCA1_PLR5_SU0_SUS256_SRVW4_TT2_32_WG64_4_1_WGM1
    SolutionIndex: 2
    SolutionNameMin: Cijk_Ailk_Bljk_HBH_MT64x64x32_MI32x32x8x1_SE_1LDSB0_GRVW8_NLCA1_PLR5_SU0_SUS256_SRVW4_TT1_32_WG64_4_1_WGM1
    SolutionIndex: 3
    SolutionNameMin: Cijk_Ailk_Bljk_HBH_MT32x64x64_MI16x16x16x1_SE_1LDSB0_GRVW8_NLCA1_PLR5_SU0_SUS256_SRVW4_TT1_32_WG32_8_1_WGM1
    SolutionIndex: 4
    SolutionNameMin: Cijk_Ailk_Bljk_HBH_MT64x128x64_MI32x32x8x1_SE_1LDSB0_GRVW8_NLCA1_PLR9_SU0_SUS256_SRVW4_TT1_64_WG64_4_1_WGM1
    SolutionIndex: 5
    SolutionNameMin: Cijk_Ailk_Bljk_HBH_MT64x128x32_MI32x32x8x1_SE_1LDSB0_GRVW2_NLCA1_PLR5_SU32_SUS256_SRVW4_TT1_64_WG64_4_1_WGM1
    SolutionIndex: 6
    SolutionNameMin: Cijk_Ailk_Bljk_HBH_MT64x128x64_MI32x32x8x1_SE_1LDSB0_GRVW8_NLCA1_PLR9_SU32_SUS256_SRVW4_TT1_64_WG64_4_1_WGM1
    SolutionIndex: 7
    SolutionNameMin: Cijk_Ailk_Bljk_HBH_MT64x128x64_MI32x32x8x1_SE_1LDSB0_GRVW4_NLCA1_PLR9_SU0_SUS256_SRVW4_TT1_64_WG64_4_1_WGM2
    SolutionIndex: 8
    SolutionNameMin: Cijk_Ailk_Bljk_HBH_MT64x128x64_MI32x32x8x1_SE_1LDSB0_GRVW8_NLCA1_PLR9_SU32_SUS128_SRVW4_TT1_64_WG64_4_1_WGM2
    SolutionIndex: 9
    SolutionNameMin: Cijk_Ailk_Bljk_HBH_MT64x64x32_MI32x32x8x1_SE_1LDSB0_GRVW8_NLCA1_PLR5_SU32_SUS256_SRVW4_TT1_32_WG64_4_1_WGM2
    SolutionIndex: 10
    SolutionNameMin: Cijk_Ailk_Bljk_HBH_MT64x64x64_MI32x32x8x1_SE_1LDSB0_GRVW8_NLCA1_PLR9_SU32_SUS256_SRVW4_TT1_32_WG64_4_1_WGM2
    SolutionIndex: 11
    SolutionNameMin: Cijk_Ailk_Bljk_HBH_MT64x64x32_MI32x32x8x1_SE_1LDSB0_GRVW8_NLCA1_PLR5_SU0_SUS256_SRVW4_TT1_32_WG64_4_1_WGM15
    SolutionIndex: 12
    SolutionNameMin: Cijk_Ailk_Bljk_HBH_MT64x128x32_MI32x32x8x1_SE_1LDSB0_GRVW8_NLCA1_PLR5_SU0_SUS256_SRVW4_TT1_64_WG64_4_1_WGM15
    SolutionIndex: 13
    SolutionNameMin: Cijk_Ailk_Bljk_HBH_MT64x128x64_MI32x32x8x1_SE_1LDSB0_GRVW8_NLCA1_PLR9_SU0_SUS256_SRVW4_TT1_64_WG64_4_1_WGM15
    SolutionIndex: 14
    SolutionNameMin: Cijk_Ailk_Bljk_HBH_MT64x128x32_MI32x32x8x1_SE_1LDSB0_GRVW2_NLCA1_PLR5_SU32_SUS256_SRVW4_TT1_64_WG64_4_1_WGM15
    SolutionIndex: 15
    SolutionNameMin: Cijk_Ailk_Bljk_HBH_MT64x32x32_MI16x16x16x1_SE_1LDSB1_GRVW2_NLCA1_PLR2_SU0_SUS256_SRVW4_TT2_16_WG32_8_1_WGM1
    SolutionIndex: 16
    SolutionNameMin: Cijk_Ailk_Bljk_HBH_MT128x128x32_MI32x32x8x1_SE_1LDSB1_GRVW2_NLCA1_PLR5_SU0_SUS256_SRVW4_TT2_64_WG64_4_1_WGM1
    SolutionIndex: 17
    SolutionNameMin: Cijk_Ailk_Bljk_HBH_MT128x96x32_MI32x32x8x1_SE_1LDSB1_GRVW2_NLCA1_PLR5_SU0_SUS256_SRVW4_TT1_96_WG128_2_1_WGM1
    SolutionIndex: 18
    SolutionNameMin: Cijk_Ailk_Bljk_HBH_MT128x256x32_MI32x32x8x1_SE_1LDSB1_GRVW8_NLCA1_PLR5_SU0_SUS256_SRVW4_TT2_128_WG64_4_1_WGM1
    SolutionIndex: 19
    SolutionNameMin: Cijk_Ailk_Bljk_HBH_MT128x128x32_MI32x32x8x1_SE_1LDSB1_GRVW2_NLCA1_PLR5_SU32_SUS128_SRVW4_TT2_64_WG64_4_1_WGM1
    SolutionIndex: 20
    SolutionNameMin: Cijk_Ailk_Bljk_HBH_MT128x96x32_MI32x32x8x1_SE_1LDSB1_GRVW2_NLCA1_PLR5_SU32_SUS128_SRVW4_TT1_96_WG128_2_1_WGM1
    SolutionIndex: 21
    SolutionNameMin: Cijk_Ailk_Bljk_HBH_MT128x128x32_MI32x32x8x1_SE_1LDSB1_GRVW2_NLCA1_PLR5_SU0_SUS256_SRVW4_TT2_64_WG64_4_1_WGM2
    SolutionIndex: 22
    SolutionNameMin: Cijk_Ailk_Bljk_HBH_MT128x128x32_MI32x32x8x1_SE_1LDSB1_GRVW2_NLCA1_PLR5_SU32_SUS256_SRVW4_TT2_64_WG64_4_1_WGM2
    SolutionIndex: 23
    SolutionNameMin: Cijk_Ailk_Bljk_HBH_MT128x128x32_MI32x32x8x1_SE_1LDSB1_GRVW2_NLCA1_PLR5_SU0_SUS256_SRVW4_TT2_64_WG64_4_1_WGM15
    SolutionIndex: 24
    SolutionNameMin: Cijk_Ailk_Bljk_HBH_MT128x256x32_MI32x32x8x1_SE_1LDSB1_GRVW8_NLCA1_PLR5_SU0_SUS256_SRVW4_TT2_128_WG64_4_1_WGM15
    SolutionIndex: 25
    SolutionNameMin: Cijk_Ailk_Bljk_HBH_MT128x64x32_MI32x32x8x1_SE_1LDSB0_GRVW4_NLCA1_PLR5_SU0_SUS256_SRVW4_TT2_32_WG64_4_1_WGM1
    SolutionIndex: 26
    SolutionNameMin: Cijk_Ailk_Bljk_HBH_MT128x96x32_MI32x32x8x1_SE_1LDSB0_GRVW4_NLCA1_PLR5_SU0_SUS256_SRVW4_TT1_96_WG128_2_1_WGM1
    SolutionIndex: 27
    SolutionNameMin: Cijk_Ailk_Bljk_HBH_MT64x128x64_MI32x32x8x1_SE_1LDSB0_GRVW4_NLCA1_PLR9_SU0_SUS256_SRVW4_TT1_64_WG64_4_1_WGM1
    SolutionIndex: 28
    SolutionNameMin: Cijk_Ailk_Bljk_HBH_MT64x128x64_MI32x32x8x1_SE_1LDSB0_GRVW2_NLCA1_PLR9_SU32_SUS256_SRVW4_TT1_64_WG64_4_1_WGM1
    SolutionIndex: 29
    SolutionNameMin: Cijk_Ailk_Bljk_HBH_MT64x32x32_MI16x16x16x1_SE_1LDSB0_GRVW2_NLCA1_PLR2_SU0_SUS256_SRVW4_TT2_16_WG32_8_1_WGM2
    SolutionIndex: 30
    SolutionNameMin: Cijk_Ailk_Bljk_HBH_MT128x64x32_MI32x32x8x1_SE_1LDSB0_GRVW2_NLCA1_PLR5_SU0_SUS256_SRVW4_TT2_32_WG64_4_1_WGM2
    SolutionIndex: 31
    SolutionNameMin: Cijk_Ailk_Bljk_HBH_MT128x96x32_MI32x32x8x1_SE_1LDSB0_GRVW4_NLCA1_PLR5_SU0_SUS256_SRVW4_TT1_96_WG128_2_1_WGM2
    SolutionIndex: 32
    SolutionNameMin: Cijk_Ailk_Bljk_HBH_MT256x160x32_MI32x32x8x1_SE_1LDSB0_GRVW4_NLCA1_PLR5_SU0_SUS256_SRVW4_TT2_160_WG128_2_1_WGM2
    SolutionIndex: 33
    SolutionNameMin: Cijk_Ailk_Bljk_HBH_MT64x64x32_MI32x32x8x1_SE_1LDSB0_GRVW8_NLCA1_PLR5_SU0_SUS256_SRVW4_TT1_32_WG64_4_1_WGM2
    SolutionIndex: 34
    SolutionNameMin: Cijk_Ailk_Bljk_HBH_MT128x64x32_MI32x32x8x1_SE_1LDSB0_GRVW8_NLCA1_PLR5_SU0_SUS256_SRVW4_TT2_32_WG64_4_1_WGM2
    SolutionIndex: 35
    SolutionNameMin: Cijk_Ailk_Bljk_HBH_MT128x64x32_MI32x32x8x1_SE_1LDSB0_GRVW2_NLCA1_PLR5_SU0_SUS256_SRVW4_TT2_32_WG64_4_1_WGM15
    SolutionIndex: 36
    SolutionNameMin: Cijk_Ailk_Bljk_HBH_MT128x64x32_MI32x32x8x1_SE_1LDSB0_GRVW4_NLCA1_PLR5_SU0_SUS256_SRVW4_TT2_32_WG64_4_1_WGM15
    SolutionIndex: 37
    SolutionNameMin: Cijk_Ailk_Bljk_HBH_MT128x64x32_MI32x32x8x1_SE_1LDSB0_GRVW8_NLCA1_PLR5_SU0_SUS256_SRVW4_TT2_32_WG64_4_1_WGM15
    SolutionIndex: 38
    SolutionNameMin: Cijk_Ailk_Bljk_HBH_MT64x128x32_MI32x32x8x1_SE_1LDSB0_GRVW8_NLCA1_PLR5_SU32_SUS256_SRVW4_TT1_64_WG64_4_1_WGM15
    SolutionIndex: 39
    SolutionNameMin: Cijk_Ailk_Bljk_HBH_MT64x128x64_MI32x32x8x1_SE_1LDSB0_GRVW8_NLCA1_PLR9_SU32_SUS256_SRVW4_TT1_64_WG64_4_1_WGM15
    SolutionIndex: 40
    SolutionNameMin: Cijk_Ailk_Bljk_HBH_MT128x128x32_MI32x32x8x1_SE_1LDSB1_GRVW2_NLCA1_PLR5_SU0_SUS256_SRVW4_TT2_64_WG64_4_1_WGM1
    SolutionIndex: 41
    SolutionNameMin: Cijk_Ailk_Bljk_HBH_MT128x96x32_MI32x32x8x1_SE_1LDSB1_GRVW2_NLCA1_PLR5_SU32_SUS256_SRVW4_TT1_96_WG128_2_1_WGM1
    SolutionIndex: 42
    SolutionNameMin: Cijk_Ailk_Bljk_HBH_MT128x128x32_MI32x32x8x1_SE_1LDSB1_GRVW2_NLCA1_PLR5_SU0_SUS256_SRVW4_TT2_64_WG64_4_1_WGM2
    SolutionIndex: 43
    SolutionNameMin: Cijk_Ailk_Bljk_HBH_MT128x160x32_MI32x32x8x1_SE_1LDSB1_GRVW2_NLCA1_PLR5_SU0_SUS256_SRVW4_TT1_160_WG128_2_1_WGM2
    SolutionIndex: 44
    SolutionNameMin: Cijk_Ailk_Bljk_HBH_MT64x256x64_MI32x32x8x1_SE_1LDSB1_GRVW2_NLCA1_PLR9_SU0_SUS256_SRVW4_TT1_128_WG64_4_1_WGM2
    SolutionIndex: 45
    SolutionNameMin: Cijk_Ailk_Bljk_HBH_MT64x32x32_MI16x16x16x1_SE_1LDSB1_GRVW2_NLCA1_PLR2_SU32_SUS256_SRVW4_TT2_16_WG32_8_1_WGM2
    SolutionIndex: 46
    SolutionNameMin: Cijk_Ailk_Bljk_HBH_MT64x32x32_MI16x16x16x1_SE_1LDSB1_GRVW2_NLCA1_PLR2_SU0_SUS256_SRVW4_TT2_16_WG32_8_1_WGM15
    SolutionIndex: 47
    SolutionNameMin: Cijk_Ailk_Bljk_HBH_MT128x128x32_MI32x32x8x1_SE_1LDSB1_GRVW2_NLCA1_PLR5_SU0_SUS256_SRVW4_TT2_64_WG64_4_1_WGM15
    SolutionIndex: 48
    SolutionNameMin: Cijk_Ailk_Bljk_HBH_MT128x96x32_MI32x32x8x1_SE_1LDSB1_GRVW2_NLCA1_PLR5_SU0_SUS256_SRVW4_TT1_96_WG128_2_1_WGM15
    SolutionIndex: 49
    SolutionNameMin: Cijk_Ailk_Bljk_HBH_MT96x96x32_MI16x16x16x1_SE_1LDSB1_GRVW2_NLCA3_PLR2_SU32_SUS256_SRVW0_TT3_48_WG32_8_1_WGM15
- - - [3136, 128, 64, 64, 3136, 3136, 3136, 64]
    - [17, 34196.0]
  - - [3136, 256, 64, 64, 3136, 3136, 3136, 64]
    - [20, 43086.0]
  - - [3136, 256, 64, 128, 3136, 3136, 3136, 128]
    - [16, 62421.0]
  - - [784, 512, 64, 256, 784, 784, 784, 256]
    - [18, 68736.0]
  - - [3136, 128, 64, 256, 3136, 3136, 3136, 256]
    - [23, 61487.0]
  - - [3136, 256, 64, 256, 3136, 3136, 3136, 256]
    - [18, 81799.0]
  - - [784, 256, 64, 512, 784, 784, 784, 512]
    - [24, 75698.0]
  - - [784, 512, 64, 512, 784, 784, 784, 512]
    - [18, 82788.0]
  - - [3136, 128, 32, 64, 3136, 3136, 3136, 64]
    - [12, 31140.0]
  - - [3136, 256, 32, 64, 3136, 3136, 3136, 64]
    - [17, 40697.0]
  - - [3136, 256, 32, 128, 3136, 3136, 3136, 128]
    - [19, 58470.0]
  - - [784, 512, 32, 256, 784, 784, 784, 256]
    - [18, 63432.0]
  - - [3136, 128, 32, 256, 3136, 3136, 3136, 256]
    - [21, 58889.0]
  - - [3136, 256, 32, 256, 3136, 3136, 3136, 256]
    - [18, 76544.0]
  - - [784, 256, 32, 512, 784, 784, 784, 512]
    - [16, 65245.0]
  - - [784, 512, 32, 512, 784, 784, 784, 512]
    - [18, 78145.0]
  - - [3136, 64, 64, 64, 3136, 3136, 3136, 64]
    - [15, 25125.0]
  - - [3136, 64, 64, 256, 3136, 3136, 3136, 256]
    - [1, 39638.0]
  - - [784, 512, 64, 128, 784, 784, 784, 128]
    - [22, 52833.0]
  - - [784, 128, 64, 512, 784, 784, 784, 512]
    - [16, 58304.0]
  - - [64, 192, 64, 1280, 64, 64, 64, 1280]
    - [2, 33916.0]
  - - [64, 320, 64, 1280, 64, 64, 64, 1280]
    - [4, 36663.0]
  - - [64, 384, 64, 1280, 64, 64, 64, 1280]
    - [14, 41734.0]
  - - [64, 448, 64, 1280, 64, 64, 64, 1280]
    - [11, 40553.0]
  - - [64, 192, 64, 2048, 64, 64, 64, 2048]
    - [0, 32736.0]
  - - [64, 320, 64, 2048, 64, 64, 64, 2048]
    - [7, 36512.0]
  - - [64, 384, 64, 2048, 64, 64, 64, 2048]
    - [5, 40878.0]
  - - [64, 448, 64, 2048, 64, 64, 64, 2048]
    - [0, 40707.0]
  - - [64, 192, 32, 1280, 64, 64, 64, 1280]
    - [3, 28728.0]
  - - [64, 320, 32, 1280, 64, 64, 64, 1280]
    - [8, 34606.0]
  - - [64, 384, 32, 1280, 64, 64, 64, 1280]
    - [6, 38717.0]
  - - [64, 448, 32, 1280, 64, 64, 64, 1280]
    - [9, 39252.0]
  - - [64, 192, 32, 2048, 64, 64, 64, 2048]
    - [10, 29178.0]
  - - [64, 320, 32, 2048, 64, 64, 64, 2048]
    - [13, 35926.0]
  - - [64, 384, 32, 2048, 64, 64, 64, 2048]
    - [13, 39476.0]
  - - [64, 448, 32, 2048, 64, 64, 64, 2048]
    - [0, 39542.0]
  - - [196, 1024, 64, 512, 196, 196, 196, 512]
    - [40, 57569.0]
  - - [196, 512, 64, 1024, 196, 196, 196, 1024]
    - [42, 59271.0]
  - - [196, 1024, 64, 1024, 196, 196, 196, 1024]
    - [42, 67384.0]
  - - [49, 2048, 64, 1024, 49, 49, 49, 1024]
    - [44, 33678.0]
  - - [49, 1024, 64, 2048, 49, 49, 49, 2048]
    - [27, 32949.0]
  - - [196, 1024, 32, 512, 196, 196, 196, 512]
    - [47, 51125.0]
  - - [196, 512, 32, 1024, 196, 196, 196, 1024]
    - [42, 48529.0]
  - - [196, 1024, 32, 1024, 196, 196, 196, 1024]
    - [32, 61212.0]
  - - [49, 2048, 32, 1024, 49, 49, 49, 1024]
    - [39, 30403.0]
  - - [49, 1024, 32, 2048, 49, 49, 49, 2048]
    - [49, 29786.0]
  - - [196, 1024, 64, 256, 196, 196, 196, 256]
    - [47, 46551.0]
  - - [196, 256, 64, 1024, 196, 196, 196, 1024]
    - [47, 47246.0]
  - - [49, 2048, 64, 512, 49, 49, 49, 512]
    - [38, 28967.0]
  - - [49, 512, 64, 2048, 49, 49, 49, 2048]
    - [28, 27924.0]
  - - [1225, 32, 64, 192, 1225, 1225, 1225, 192]
    - [45, 18934.0]
  - - [1225, 48, 64, 192, 1225, 1225, 1225, 192]
    - [41, 19634.0]
  - - [1225, 64, 64, 192, 1225, 1225, 1225, 192]
    - [34, 29881.0]
  - - [1225, 48, 64, 256, 1225, 1225, 1225, 256]
    - [48, 22425.0]
  - - [1225, 64, 64, 256, 1225, 1225, 1225, 256]
    - [25, 33243.0]
  - - [1225, 48, 64, 288, 1225, 1225, 1225, 288]
    - [48, 23479.0]
  - - [1225, 64, 64, 288, 1225, 1225, 1225, 288]
    - [36, 35488.0]
  - - [5329, 80, 64, 64, 5329, 5329, 5329, 64]
    - [46, 16986.0]
  - - [289, 128, 64, 768, 289, 289, 289, 768]
    - [40, 42089.0]
  - - [289, 160, 64, 768, 289, 289, 289, 768]
    - [43, 46120.0]
  - - [289, 192, 64, 768, 289, 289, 289, 768]
    - [31, 48912.0]
  - - [1225, 32, 32, 192, 1225, 1225, 1225, 192]
    - [29, 16633.0]
  - - [1225, 48, 32, 192, 1225, 1225, 1225, 192]
    - [34, 17041.0]
  - - [1225, 64, 32, 192, 1225, 1225, 1225, 192]
    - [33, 25406.0]
  - - [1225, 48, 32, 256, 1225, 1225, 1225, 256]
    - [35, 19677.0]
  - - [1225, 64, 32, 256, 1225, 1225, 1225, 256]
    - [35, 27973.0]
  - - [1225, 48, 32, 288, 1225, 1225, 1225, 288]
    - [37, 20842.0]
  - - [1225, 64, 32, 288, 1225, 1225, 1225, 288]
    - [30, 30930.0]
  - - [5329, 80, 32, 64, 5329, 5329, 5329, 64]
    - [46, 16412.0]
  - - [289, 128, 32, 768, 289, 289, 289, 768]
    - [37, 37016.0]
  - - [289, 160, 32, 768, 289, 289, 289, 768]
    - [26, 37381.0]
  - - [289, 192, 32, 768, 289, 289, 289, 768]
    - [31, 45335.0]
- null
