TRAIN_3.9/logic/conv/arcturus_Cijk_Ailk_Bjlk_BBH.yaml
- {MinimumRequiredVersion: 4.22.0}
- arcturus
- gfx908
- [Device 7380, Device 7388, Device 738c, Device 7390]
    SolutionIndex: 0
    SolutionNameMin: Cijk_Ailk_Bjlk_BBH_MT64x128x16_MI32x32x4x1_SE_1LDSB0_GRVW4_NLCA1_NLCB1_SU0_SUS256_SRVW4_TT1_64_WG64_4_1_WGM1
    SolutionIndex: 1
    SolutionNameMin: Cijk_Ailk_Bjlk_BBH_MT64x64x32_MI32x32x4x1_SE_1LDSB0_GRVW4_NLCA1_NLCB1_SU0_SUS256_SRVW4_TT1_32_WG64_4_1_WGM1
    SolutionIndex: 2
    SolutionNameMin: Cijk_Ailk_Bjlk_BBH_MT64x128x16_MI32x32x4x1_SE_1LDSB0_GRVW8_NLCA1_NLCB1_SU0_SUS256_SRVW4_TT1_64_WG64_4_1_WGM1
    SolutionIndex: 3
    SolutionNameMin: Cijk_Ailk_Bjlk_BBH_MT128x128x16_MI32x32x4x1_SE_1LDSB0_GRVW8_NLCA1_NLCB1_SU0_SUS256_SRVW4_TT2_64_WG64_4_1_WGM1
    SolutionIndex: 4
    SolutionNameMin: Cijk_Ailk_Bjlk_BBH_MT64x128x32_MI32x32x4x1_SE_1LDSB0_GRVW8_NLCA1_NLCB1_SU0_SUS256_SRVW4_TT1_64_WG64_4_1_WGM1
    SolutionIndex: 5
    SolutionNameMin: Cijk_Ailk_Bjlk_BBH_MT64x128x16_MI32x32x4x1_SE_1LDSB0_GRVW8_NLCA1_NLCB1_SU32_SUS128_SRVW4_TT1_64_WG64_4_1_WGM1
    SolutionIndex: 6
    SolutionNameMin: Cijk_Ailk_Bjlk_BBH_MT64x64x32_MI32x32x4x1_SE_1LDSB0_GRVW8_NLCA1_NLCB1_SU32_SUS128_SRVW4_TT1_32_WG64_4_1_WGM1
    SolutionIndex: 7
    SolutionNameMin: Cijk_Ailk_Bjlk_BBH_MT64x128x16_MI32x32x4x1_SE_1LDSB0_GRVW8_NLCA1_NLCB1_SU32_SUS256_SRVW4_TT1_64_WG64_4_1_WGM1
    SolutionIndex: 8
    SolutionNameMin: Cijk_Ailk_Bjlk_BBH_MT64x128x32_MI32x32x4x1_SE_1LDSB0_GRVW8_NLCA1_NLCB1_SU32_SUS256_SRVW4_TT1_64_WG64_4_1_WGM1
    SolutionIndex: 9
    SolutionNameMin: Cijk_Ailk_Bjlk_BBH_MT64x64x32_MI32x32x4x1_SE_1LDSB0_GRVW4_NLCA1_NLCB1_SU0_SUS256_SRVW4_TT1_32_WG64_4_1_WGM2
    SolutionIndex: 10
    SolutionNameMin: Cijk_Ailk_Bjlk_BBH_MT128x64x16_MI32x32x4x1_SE_1LDSB0_GRVW8_NLCA1_NLCB1_SU0_SUS256_SRVW4_TT2_32_WG64_4_1_WGM2
    SolutionIndex: 11
    SolutionNameMin: Cijk_Ailk_Bjlk_BBH_MT64x64x32_MI32x32x4x1_SE_1LDSB0_GRVW8_NLCA1_NLCB1_SU0_SUS256_SRVW4_TT1_32_WG64_4_1_WGM2
    SolutionIndex: 12
    SolutionNameMin: Cijk_Ailk_Bjlk_BBH_MT128x128x16_MI32x32x4x1_SE_1LDSB0_GRVW8_NLCA1_NLCB1_SU32_SUS128_SRVW4_TT2_64_WG64_4_1_WGM2
    SolutionIndex: 13
    SolutionNameMin: Cijk_Ailk_Bjlk_BBH_MT64x128x32_MI32x32x4x1_SE_1LDSB0_GRVW8_NLCA1_NLCB1_SU32_SUS256_SRVW4_TT1_64_WG64_4_1_WGM2
    SolutionIndex: 14
    SolutionNameMin: Cijk_Ailk_Bjlk_BBH_MT64x128x16_MI32x32x4x1_SE_1LDSB0_GRVW8_NLCA1_NLCB1_SU0_SUS256_SRVW4_TT1_64_WG64_4_1_WGM15
    SolutionIndex: 15
    SolutionNameMin: Cijk_Ailk_Bjlk_BBH_MT64x64x32_MI32x32x4x1_SE_1LDSB0_GRVW8_NLCA1_NLCB1_SU0_SUS256_SRVW4_TT1_32_WG64_4_1_WGM15
    SolutionIndex: 16
    SolutionNameMin: Cijk_Ailk_Bjlk_BBH_MT64x128x16_MI32x32x4x1_SE_1LDSB0_GRVW8_NLCA1_NLCB1_SU32_SUS256_SRVW4_TT1_64_WG64_4_1_WGM15
    SolutionIndex: 17
    SolutionNameMin: Cijk_Ailk_Bjlk_BBH_MT128x128x16_MI32x32x4x1_SE_1LDSB1_GRVW8_NLCA1_NLCB1_SU0_SUS256_SRVW4_TT2_64_WG64_4_1_WGM1
    SolutionIndex: 18
    SolutionNameMin: Cijk_Ailk_Bjlk_BBH_MT128x128x16_MI32x32x4x1_SE_1LDSB1_GRVW8_NLCA1_NLCB1_SU32_SUS256_SRVW4_TT2_64_WG64_4_1_WGM2
    SolutionIndex: 19
    SolutionNameMin: Cijk_Ailk_Bjlk_BBH_MT64x64x16_MI32x32x4x1_SE_1LDSB0_GRVW2_NLCA1_NLCB1_SU0_SUS256_SRVW4_TT1_32_WG64_4_1_WGM1
    SolutionIndex: 20
    SolutionNameMin: Cijk_Ailk_Bjlk_BBH_MT64x64x16_MI32x32x4x1_SE_1LDSB0_GRVW4_NLCA1_NLCB1_SU0_SUS256_SRVW4_TT1_32_WG64_4_1_WGM1
    SolutionIndex: 21
    SolutionNameMin: Cijk_Ailk_Bjlk_BBH_MT64x64x16_MI32x32x4x1_SE_1LDSB0_GRVW8_NLCA1_NLCB1_SU0_SUS256_SRVW4_TT1_32_WG64_4_1_WGM1
    SolutionIndex: 22
    SolutionNameMin: Cijk_Ailk_Bjlk_BBH_MT64x128x16_MI32x32x4x1_SE_1LDSB0_GRVW8_NLCA1_NLCB1_SU0_SUS256_SRVW4_TT1_64_WG64_4_1_WGM1
    SolutionIndex: 23
    SolutionNameMin: Cijk_Ailk_Bjlk_BBH_MT64x128x32_MI32x32x4x1_SE_1LDSB0_GRVW8_NLCA1_NLCB1_SU0_SUS256_SRVW4_TT1_64_WG64_4_1_WGM1
    SolutionIndex: 24
    SolutionNameMin: Cijk_Ailk_Bjlk_BBH_MT64x64x16_MI32x32x4x1_SE_1LDSB0_GRVW8_NLCA1_NLCB1_SU32_SUS128_SRVW4_TT1_32_WG64_4_1_WGM1
    SolutionIndex: 25
    SolutionNameMin: Cijk_Ailk_Bjlk_BBH_MT64x128x16_MI32x32x4x1_SE_1LDSB0_GRVW8_NLCA1_NLCB1_SU32_SUS128_SRVW4_TT1_64_WG64_4_1_WGM1
    SolutionIndex: 26
    SolutionNameMin: Cijk_Ailk_Bjlk_BBH_MT64x64x16_MI32x32x4x1_SE_1LDSB0_GRVW8_NLCA1_NLCB1_SU32_SUS256_SRVW4_TT1_32_WG64_4_1_WGM1
    SolutionIndex: 27
    SolutionNameMin: Cijk_Ailk_Bjlk_BBH_MT64x64x16_MI32x32x4x1_SE_1LDSB0_GRVW4_NLCA1_NLCB1_SU0_SUS256_SRVW4_TT1_32_WG64_4_1_WGM2
    SolutionIndex: 28
    SolutionNameMin: Cijk_Ailk_Bjlk_BBH_MT64x64x32_MI32x32x4x1_SE_1LDSB0_GRVW4_NLCA1_NLCB1_SU0_SUS256_SRVW4_TT1_32_WG64_4_1_WGM2
    SolutionIndex: 29
    SolutionNameMin: Cijk_Ailk_Bjlk_BBH_MT64x128x16_MI32x32x4x1_SE_1LDSB0_GRVW8_NLCA1_NLCB1_SU0_SUS256_SRVW4_TT1_64_WG64_4_1_WGM2
    SolutionIndex: 30
    SolutionNameMin: Cijk_Ailk_Bjlk_BBH_MT64x64x32_MI32x32x4x1_SE_1LDSB0_GRVW8_NLCA1_NLCB1_SU0_SUS256_SRVW4_TT1_32_WG64_4_1_WGM2
    SolutionIndex: 31
    SolutionNameMin: Cijk_Ailk_Bjlk_BBH_MT64x128x32_MI32x32x4x1_SE_1LDSB0_GRVW8_NLCA1_NLCB1_SU32_SUS128_SRVW4_TT1_64_WG64_4_1_WGM2
    SolutionIndex: 32
    SolutionNameMin: Cijk_Ailk_Bjlk_BBH_MT64x128x16_MI32x32x4x1_SE_1LDSB0_GRVW8_NLCA1_NLCB1_SU32_SUS256_SRVW4_TT1_64_WG64_4_1_WGM2
    SolutionIndex: 33
    SolutionNameMin: Cijk_Ailk_Bjlk_BBH_MT64x64x32_MI32x32x4x1_SE_1LDSB0_GRVW8_NLCA1_NLCB1_SU32_SUS256_SRVW4_TT1_32_WG64_4_1_WGM2
    SolutionIndex: 34
    SolutionNameMin: Cijk_Ailk_Bjlk_BBH_MT128x96x16_MI32x32x4x1_SE_1LDSB0_GRVW2_NLCA1_NLCB3_SU0_SUS256_SRVW4_TT1_96_WG128_2_1_WGM15
    SolutionIndex: 35
    SolutionNameMin: Cijk_Ailk_Bjlk_BBH_MT128x96x32_MI32x32x4x1_SE_1LDSB0_GRVW4_NLCA1_NLCB3_SU0_SUS256_SRVW4_TT1_96_WG128_2_1_WGM15
    SolutionIndex: 36
    SolutionNameMin: Cijk_Ailk_Bjlk_BBH_MT64x64x16_MI32x32x4x1_SE_1LDSB0_GRVW8_NLCA1_NLCB1_SU0_SUS256_SRVW4_TT1_32_WG64_4_1_WGM15
    SolutionIndex: 37
    SolutionNameMin: Cijk_Ailk_Bjlk_BBH_MT64x128x16_MI32x32x4x1_SE_1LDSB0_GRVW8_NLCA1_NLCB1_SU0_SUS256_SRVW4_TT1_64_WG64_4_1_WGM15
    SolutionIndex: 38
    SolutionNameMin: Cijk_Ailk_Bjlk_BBH_MT128x128x16_MI32x32x4x1_SE_1LDSB0_GRVW8_NLCA1_NLCB1_SU0_SUS256_SRVW4_TT2_64_WG64_4_1_WGM15
    SolutionIndex: 39
    SolutionNameMin: Cijk_Ailk_Bjlk_BBH_MT64x128x32_MI32x32x4x1_SE_1LDSB0_GRVW8_NLCA1_NLCB1_SU0_SUS256_SRVW4_TT1_64_WG64_4_1_WGM15
    SolutionIndex: 40
    SolutionNameMin: Cijk_Ailk_Bjlk_BBH_MT128x96x16_MI32x32x4x1_SE_1LDSB0_GRVW2_NLCA1_NLCB3_SU32_SUS256_SRVW4_TT1_96_WG128_2_1_WGM15
    SolutionIndex: 41
    SolutionNameMin: Cijk_Ailk_Bjlk_BBH_MT64x128x16_MI32x32x4x1_SE_1LDSB0_GRVW8_NLCA1_NLCB1_SU32_SUS256_SRVW4_TT1_64_WG64_4_1_WGM15
    SolutionIndex: 42
    SolutionNameMin: Cijk_Ailk_Bjlk_BBH_MT64x64x32_MI32x32x4x1_SE_1LDSB0_GRVW8_NLCA1_NLCB1_SU32_SUS256_SRVW4_TT1_32_WG64_4_1_WGM15
    SolutionIndex: 43
    SolutionNameMin: Cijk_Ailk_Bjlk_BBH_MT64x128x32_MI32x32x4x1_SE_1LDSB0_GRVW8_NLCA1_NLCB1_SU32_SUS256_SRVW4_TT1_64_WG64_4_1_WGM15
- - - [3136, 64, 64, 128, 3136, 3136, 3136, 64]
    - [15, 30313.0]
  - - [3136, 64, 64, 256, 3136, 3136, 3136, 64]
    - [10, 38632.0]
  - - [3136, 128, 64, 256, 3136, 3136, 3136, 128]
    - [3, 53382.0]
  - - [784, 256, 64, 512, 784, 784, 784, 256]
    - [2, 52799.0]
  - - [3136, 256, 64, 128, 3136, 3136, 3136, 256]
    - [17, 50746.0]
  - - [3136, 256, 64, 256, 3136, 3136, 3136, 256]
    - [18, 57388.0]
  - - [784, 512, 64, 256, 784, 784, 784, 512]
    - [7, 50127.0]
  - - [784, 512, 64, 512, 784, 784, 784, 512]
    - [2, 54787.0]
  - - [3136, 64, 32, 128, 3136, 3136, 3136, 64]
    - [15, 27550.0]
  - - [3136, 64, 32, 256, 3136, 3136, 3136, 64]
    - [9, 34953.0]
  - - [3136, 128, 32, 256, 3136, 3136, 3136, 128]
    - [3, 48472.0]
  - - [784, 256, 32, 512, 784, 784, 784, 256]
    - [2, 48934.0]
  - - [3136, 256, 32, 128, 3136, 3136, 3136, 256]
    - [12, 46029.0]
  - - [3136, 256, 32, 256, 3136, 3136, 3136, 256]
    - [17, 54013.0]
  - - [784, 512, 32, 256, 784, 784, 784, 512]
    - [7, 47192.0]
  - - [784, 512, 32, 512, 784, 784, 784, 512]
    - [2, 52867.0]
  - - [3136, 256, 32, 64, 3136, 3136, 3136, 256]
    - [5, 33692.0]
  - - [3136, 64, 32, 64, 3136, 3136, 3136, 64]
    - [6, 18549.0]
  - - [784, 512, 32, 128, 784, 784, 784, 512]
    - [2, 38343.0]
  - - [784, 128, 32, 512, 784, 784, 784, 128]
    - [4, 39985.0]
  - - [3136, 64, 64, 64, 3136, 3136, 3136, 64]
    - [11, 23249.0]
  - - [3136, 256, 64, 64, 3136, 3136, 3136, 256]
    - [3, 37710.0]
  - - [784, 128, 64, 512, 784, 784, 784, 128]
    - [14, 47138.0]
  - - [784, 512, 64, 128, 784, 784, 784, 512]
    - [3, 42507.0]
  - - [64, 1280, 64, 192, 64, 64, 64, 1280]
    - [5, 33644.0]
  - - [64, 1280, 64, 320, 64, 64, 64, 1280]
    - [2, 39273.0]
  - - [64, 1280, 64, 384, 64, 64, 64, 1280]
    - [5, 40656.0]
  - - [64, 1280, 64, 448, 64, 64, 64, 1280]
    - [7, 42124.0]
  - - [64, 2048, 64, 192, 64, 64, 64, 2048]
    - [7, 35570.0]
  - - [64, 2048, 64, 320, 64, 64, 64, 2048]
    - [5, 40233.0]
  - - [64, 2048, 64, 384, 64, 64, 64, 2048]
    - [16, 42031.0]
  - - [64, 2048, 64, 448, 64, 64, 64, 2048]
    - [13, 44026.0]
  - - [64, 1280, 32, 192, 64, 64, 64, 1280]
    - [0, 28087.0]
  - - [64, 1280, 32, 320, 64, 64, 64, 1280]
    - [2, 34493.0]
  - - [64, 1280, 32, 384, 64, 64, 64, 1280]
    - [5, 36472.0]
  - - [64, 1280, 32, 448, 64, 64, 64, 1280]
    - [7, 37449.0]
  - - [64, 2048, 32, 192, 64, 64, 64, 2048]
    - [7, 30320.0]
  - - [64, 2048, 32, 320, 64, 64, 64, 2048]
    - [1, 34664.0]
  - - [64, 2048, 32, 384, 64, 64, 64, 2048]
    - [8, 36806.0]
  - - [64, 2048, 32, 448, 64, 64, 64, 2048]
    - [8, 38317.0]
  - - [196, 512, 64, 1024, 196, 196, 196, 512]
    - [23, 41922.0]
  - - [196, 1024, 64, 512, 196, 196, 196, 1024]
    - [38, 41022.0]
  - - [196, 1024, 64, 1024, 196, 196, 196, 1024]
    - [38, 43962.0]
  - - [49, 1024, 64, 2048, 49, 49, 49, 1024]
    - [31, 35696.0]
  - - [49, 2048, 64, 1024, 49, 49, 49, 2048]
    - [43, 36472.0]
  - - [196, 512, 32, 1024, 196, 196, 196, 512]
    - [39, 36570.0]
  - - [196, 1024, 32, 512, 196, 196, 196, 1024]
    - [23, 37367.0]
  - - [196, 1024, 32, 1024, 196, 196, 196, 1024]
    - [35, 41943.0]
  - - [49, 1024, 32, 2048, 49, 49, 49, 1024]
    - [42, 31329.0]
  - - [49, 2048, 32, 1024, 49, 49, 49, 2048]
    - [23, 32391.0]
  - - [196, 1024, 32, 256, 196, 196, 196, 1024]
    - [41, 31716.0]
  - - [196, 256, 32, 1024, 196, 196, 196, 256]
    - [30, 31282.0]
  - - [49, 2048, 32, 512, 49, 49, 49, 2048]
    - [28, 26865.0]
  - - [49, 512, 32, 2048, 49, 49, 49, 512]
    - [33, 25217.0]
  - - [196, 256, 64, 1024, 196, 196, 196, 256]
    - [39, 35993.0]
  - - [196, 1024, 64, 256, 196, 196, 196, 1024]
    - [38, 35836.0]
  - - [49, 512, 64, 2048, 49, 49, 49, 512]
    - [21, 29550.0]
  - - [49, 2048, 64, 512, 49, 49, 49, 2048]
    - [25, 30606.0]
  - - [1225, 192, 64, 32, 1225, 1225, 1225, 192]
    - [36, 14544.0]
  - - [1225, 192, 64, 48, 1225, 1225, 1225, 192]
    - [21, 19135.0]
  - - [1225, 192, 64, 64, 1225, 1225, 1225, 192]
    - [21, 22764.0]
  - - [1225, 256, 64, 48, 1225, 1225, 1225, 256]
    - [22, 20445.0]
  - - [1225, 256, 64, 64, 1225, 1225, 1225, 256]
    - [25, 24855.0]
  - - [1225, 288, 64, 48, 1225, 1225, 1225, 288]
    - [40, 21037.0]
  - - [1225, 288, 64, 64, 1225, 1225, 1225, 288]
    - [40, 25768.0]
  - - [5329, 64, 64, 80, 5329, 5329, 5329, 64]
    - [26, 24119.0]
  - - [289, 768, 64, 128, 289, 289, 289, 768]
    - [29, 31787.0]
  - - [289, 768, 64, 160, 289, 289, 289, 768]
    - [37, 35074.0]
  - - [289, 768, 64, 192, 289, 289, 289, 768]
    - [22, 37340.0]
  - - [1225, 192, 32, 32, 1225, 1225, 1225, 192]
    - [24, 11806.0]
  - - [1225, 192, 32, 48, 1225, 1225, 1225, 192]
    - [21, 15680.0]
  - - [1225, 192, 32, 64, 1225, 1225, 1225, 192]
    - [27, 19176.0]
  - - [1225, 256, 32, 48, 1225, 1225, 1225, 256]
    - [19, 17009.0]
  - - [1225, 256, 32, 64, 1225, 1225, 1225, 256]
    - [20, 20907.0]
  - - [1225, 288, 32, 48, 1225, 1225, 1225, 288]
    - [40, 16166.0]
  - - [1225, 288, 32, 64, 1225, 1225, 1225, 288]
    - [34, 20250.0]
  - - [5329, 64, 32, 80, 5329, 5329, 5329, 64]
    - [20, 21915.0]
  - - [289, 768, 32, 128, 289, 289, 289, 768]
    - [29, 27317.0]
  - - [289, 768, 32, 160, 289, 289, 289, 768]
    - [32, 30095.0]
  - - [289, 768, 32, 192, 289, 289, 289, 768]
    - [29, 32781.0]
- null
